Frau Präsidentin! Sehr geehrte Kolleginnen und Kollegen! Heute debattieren wir das UN-Mandat MINUSMA. Ich möchte vorweg für MINUSMA klar herausstellen: Das Hauptziel dieses Mandates ist die Stabilisierung des Landes in der Sahelregion. Unsere Aufgabe ist es, mithilfe der Bundeswehr und an der Seite unserer europäischen und internationalen Partner Verantwortung zu übernehmen und Mali zu helfen.
Ziel ist die Umsetzung des Friedensabkommens von 2015. Das ist das, was wir versuchen mithilfe des Mandats zu erreichen.
2013 drohte Mali die Kontrolle über weite Teile seines Territoriums zu verlieren oder hatte sie bereits an marodierende Räuberbanden verloren. Auf den Hilferuf der malischen Regierung reagierte Frankreich umgehend. Deutschland nun unterstützt Frankreich und stärkt so mit seinem Engagement nicht nur die malische Regierung, sondern auch die europäische Zusammenarbeit in der Sicherheitspolitik. In die Zukunft gedacht kann diese Zusammenarbeit beispielhaft für die beschlossene europäische Sicherheitsunion stehen.
Trotz dieser erfolgreichen Kooperation wissen wir alle: Der Blauhelmeinsatz der UN in Mali ist einer der gefährlichsten, an dem sich die Bundeswehr je beteiligt hat. Eine schwierige Sicherheitslage, die katastrophale Situation der Infrastruktur und herausfordernde Witterungsverhältnisse fordern unsere Soldatinnen und Soldaten besonders. Damit kommt uns, dem Parlament, eine besondere Verantwortung zu. Alle Abgeordneten, die diesem Mandat heute zustimmen – um Ihre Zustimmung werbe ich ausdrücklich –, sind sich dieser Verantwortung bewusst – auch ich; seien Sie sich dessen versichert.
Liebe Kolleginnen und Kollegen, die Verlängerung des Mandats um drei Monate gibt uns Zeit, die Herausforderungen und Probleme des Einsatzes anzusprechen und gegebenenfalls nachzujustieren. Auch ich bin schon im Gespräch in meinem Wahlkreis Friesland – Wilhelms­haven – Wittmund; denn 52 Soldatinnen und Soldaten des Objektschutzregiments der Luftwaffe aus Upjever, also direkt aus meinem Wahlkreis, sind vor Ort in Mali und leisten dort als Teil des Einsatzkontingentes hervorragende Arbeit. Beispielsweise sichern sie einen Flughafen. Ich freue mich deshalb besonders, dass der Kommandeur, Oberst Walter, als Vertreter der Objektschützer heute auf der Besuchertribüne zu Gast ist.
Damit unterstreicht er, wie ich finde, wie sehr die Bundeswehr eine Parlamentsarmee ist.
