Wer am lautesten schreit, wird gehört – das ist Ihre Devise. Sie reklamieren damit die Mehrheit für sich, meine Damen, meine Herren. Unser Ziel ist es, gesunde Lebensmittel nachhaltig zu produzieren.
Frau Kollegin, bitte.
Jetzt aber wirklich der letzte Satz.
Weltweit betrachtet würden ohne Pflanzenschutzmittel noch mehr Menschen an Hunger leiden.
Frau Kollegin, jetzt aber bitte. Auch in Bayern ist ein Satz ein Satz und nicht zehn Sätze.
Deshalb: Gesunde Pflanzen durch gute Versorgung.
Danke schön.
