Ja, ich nehme die Wahl mit großer Freude an und freue mich auch auf die Zusammenarbeit.
Die Freude ist unübersehbar. Ich beglückwünsche Sie im Namen des ganzen Hauses, Frau Kollegin Roth.
Ich wünsche Ihnen allen im Namen des Hauses Glück und Erfolg für das verantwortungsvolle Amt.
Da der Kollege Glaser nicht die erforderliche Mehrheit der Mitglieder des Hauses erhalten hat, ist nach der Geschäftsordnung ein zweiter Wahlgang erforderlich. Wir führen diesen zweiten Wahlgang jetzt unmittelbar durch.
Für diesen zweiten Wahlgang schlägt die Fraktion der AfD den Kollegen Glaser vor. Auch im zweiten Wahlgang ist nach unserer Geschäftsordnung die Mehrheit der Mitglieder des Bundestages, also 355 Stimmen, erforderlich. Die Wahl ist wiederum geheim. Wahlausweise und Stimmkarte für diesen Wahlgang sind blau. Die Stimmkarte erhalten Sie wieder vor den Wahlkabinen. – Jetzt bitte ich Sie – genauso wie zuvor –, sich die Wahlunterlagen zu besorgen und in den Kabinen Ihr Kreuz zu machen. Wir beginnen mit der Wahl. Sind alle Urnen besetzt? – Das ist der Fall. Dann ist die Wahl eröffnet.
Liebe Kolleginnen und Kollegen, darf ich fragen, ob jemand nicht die Möglichkeit hatte, seine Stimme abzugeben? – Das ist offensichtlich nicht der Fall. Dann schließe ich die Wahl. Ich bitte die Schriftführerinnen und Schriftführer, mit der Auszählung zu beginnen.
Ich unterbreche die Sitzung für etwa eine halbe Stunde. Der Wiederbeginn wird rechtzeitig durch Klingelsi­gnal angekündigt.
(Unterbrechung von 15.55 bis 16.15 Uhr)
