Nein, weil die sich sowieso nicht ändern. Sie bleiben bei ihrem Standpunkt.
Ich möchte gerne weiter fortführen.
Niemand sollte Gewaltverbrechen missbrauchen und das Leid und die Trauer der Menschen instrumentalisieren, um Stimmung zu machen und gegen andere zu hetzen.
Ich möchte noch kurz darauf hinweisen, dass unser Strafgesetzbuch bereits die Möglichkeit gibt, in Zweifelsfällen eine medizinische Altersfeststellung anzuordnen, um so zwischen Erwachsenen- und Jugendstrafrecht entscheiden zu können. Eine obligatorische medizinische Altersfeststellung ist weder erforderlich noch zielführend.
Sie verletzt das Recht auf körperliche Unversehrtheit aus Artikel 2 Grundgesetz
und ist nicht mit der UN-Kinderrechtskonvention vereinbar.
