Denken Sie an Ihre Redezeit, bitte?
Das sind gute Voraussetzungen für einen Schulterschluss mit Martin Schulz, der bis 2025 die Vereinigten Staaten von Europa will.
Die Regierung verschließt sich aber einer Parlamentsdebatte. Sie hat dem Antrag auf Einberufung einer Sondersitzung, den wir unterstützt haben, nicht zugestimmt, sondern hat am Montag eigenmächtig entschieden. Deshalb verweigern wir, die AfD, die Zustimmung zu einem Weg hin zu einer europäischen Armee; denn es ist ein Irrweg.
Denken Sie an Ihre Redezeit, sonst ziehe ich Ihrem Kollegen Redezeit ab.
Wir fordern Sie auf, die Zustimmung zu PESCO unverzüglich zurückzunehmen. – Vielen Dank, Frau Präsidentin.
Nächster Redner in der Debatte: Alexander Graf Lambsdorff für die FDP-Fraktion.
