Das Land hat schon 2014/2015 vorzeitig 18 Milliarden Euro an den IWF zurückgezahlt. Das wurde hier offenbar durchgewunken. Wir waren damals nicht da, um das zu verhindern, und offenbar hat auch die SPD damals eine andere Position vertreten.
Jetzt sind wir sozusagen im letzten Abschnitt dieses Vorgangs: Das restliche Darlehen von 4,5 Milliarden Euro soll beim IWF abgelöst werden, und auch die beiden skandinavischen Länder sollen ihre 1 Milliarde Euro zurückerhalten. Zur Begründung heißt es, am Markt sei derzeit nur eine Rendite von 0,25 Prozent zu erzielen, weshalb die Umfinanzierung im Falle des Falles so viel günstiger sei. Dies wird als „günstige Marktbedingungen“ charakterisiert – ich glaube, man muss eher sagen: karikiert. Durch diesen Umstand, die günstigen Marktbedingungen, sollen Einsparungen in Höhe von etwa 150 Millionen Euro über vier Jahre hinweg erzielt werden, also mehr als 30 Millionen Euro per annum. Das ist, was man früher bei der Deutschen Bank als Peanuts bezeichnete. Im Vergleich zu den 3,3 Milliarden Euro, die Irland ohnehin zahlt, ist das eine Summe, die wirklich nicht ins Gewicht fällt und nicht substanziell ist.
Gegenüber den europäischen Sonderfonds EFSM und EFSF stehen ja noch 40,2 Milliarden Euro aus, zum echten Freundschaftszins nahe null. Es ist klar, dass man da nicht runterkommen will. Das Geld anderer Leute, mit dem man beinahe gratis arbeiten kann, ist natürlich sehr attraktiv. Wir haben es also nicht mit einem Umfeld zu tun, bei dem wir von günstigen Marktbedingungen reden können, sondern wir haben es mit einer Geldschwemmenmarktwirtschaft zu tun, die maßgeblich mit der EZB-Politik zusammenhängt.
Dabei reden wir gar nicht von den Drohverlusten im TARGET2-System. Wir dürfen auch nicht vergessen, dass sich ein harter Brexit, so er erfolgt, natürlich am negativsten auf die irische Wirtschaft auswirken würde.
Jetzt, da das Geld da ist, sollte man doch die Schulden bei allen Gläubigern bedienen. Die Bundesregierung, Herr Altmaier, wäre sehr gut beraten, dafür zu sorgen, dass die vorgesehene Tilgungssumme von 5,5 Milliarden Euro entsprechend der vertraglich vereinbarten parallelen proportionalen Rückzahlungen an alle EU-Staaten, die Gläubiger sind, verteilt wird.
Damit ist dann auch das Geld deutscher Steuerzahler gerettet. Von den 23,4 Milliarden Euro, die Irland gegenwärtig in seiner Staatskasse hat, bleibt dann noch einiges übrig.
Wir in unserer Konzilianz sagen ja: Fangen wir einfach einmal mit 50 Prozent Vertragstreue und 50 Prozent Rechtstaatlichkeit an, auch in diesem Bereich. Dann sind wir schon sehr viel weiter. Da ist sozusagen last-minute-­mäßig der Königsweg eine überfraktionelle Zustimmung zu einer vernünftigen Maßnahme, die in die richtige Richtung geht. Stimmen Sie im deutschen Interesse für den Antrag der AfD!
Das Wort hat Herr Christian Dürr für die FDP-Fraktion. Es ist seine erste Rede im Hohen Hause.
