Trotz der seit 2001 andauernden Versuche der internationalen Gemeinschaft, Rechtsstaatlichkeit und demokratische Strukturen zu etablieren, gehört Afghanistan zu den korruptesten Ländern der Welt. Trotz der Bemühungen, den Opiumanbau zu unterbinden, der den Aufständischen als wesentliche Einnahmequelle dient, ist Afghanistan zum weltweit größten Produzenten von Opium aufgestiegen. Trotz der umfangreichen und über 15 Jahre andauernden Ausbildung, Beratung und Unterstützung der afghanischen Sicherheitskräfte, trotz modernster Militärtechnologie aus dem Westen, Drohnenangriffen und Großoffensiven gibt es weder Besiegte noch Sieger in diesem Krieg. Weite Teile des Landes sind eben nicht unter der Kontrolle der Regierung. Die Anzahl ziviler Opfer ist höher denn je, und noch immer fliehen Hundertausende Afghanen innerhalb der Landesgrenzen und auch nach Deutschland. Im Jahr 2000 stellten rund 5 400 Afghanen einen Asylantrag in Deutschland. Im vergangenen Jahr, meine Damen und Herren, waren es 227 000 Asylanträge. Das sind 42‑mal mehr als auf dem Höhepunkt der Herrschaft der Taliban.
Und jetzt, verehrte Bundesregierung und Frau Verteidigungsministerin, wollen Sie erneut deutsche Soldaten zur Staatenrettung nach Afghanistan schicken, während afghanische Flüchtlinge auf dem Ku’damm Kaffee trinken, anstatt beim Wiederaufbau ihres Landes zu helfen.
Korruption, Drogen, Terroranschläge, Chaos und Flucht, das ist die Bilanz in Afghanistan. Im vorliegenden Antrag der Bundesregierung zur Verlängerung der Resolute Support Mission in Afghanistan heißt es: Aufgabe der Mission ist es, „die afghanischen nationalen ... Sicherheitskräfte zu befähigen, ihrer Sicherheitsverantwortung nachzukommen“. Das, meine Damen und Herren, ist und bleibt eine Machbarkeitsillusion. Mehr noch: Es ist politischer Unsinn. Es ist der gleiche Unsinn wie die Aussage „Deutschlands Sicherheit wird am Hindukusch verteidigt“.
Nein, meine Damen und Herren, Deutschlands Sicherheit wird nicht am Hindukusch verteidigt,
sondern an der deutschen und europäischen Außengrenze. Die AfD-Fraktion lehnt den Antrag der Bundesregierung deshalb ab.
Kollege Gauland, ich habe vergessen, darauf hinzuweisen, dass dies Ihre erste Rede im Deutschen Bundestag ist. Das hole ich hiermit nach.
Als nächster Redner hat nunmehr Alexander Graf Lambsdorff das Wort.
