In den letzten vier Jahren haben Sie rund 1 300 Euro Diäten mehr erhalten: Der Anstieg ging von 8 200 Euro auf 9 500 Euro brutto monatlich. Allein diese Steigerung entspricht der Standardrente in Deutschland. Ein Rentner hat in diesem Zeitraum lediglich 26 Euro mehr erhalten, und das in den Westländern.
Meine Damen und Herren, schämen Sie sich nicht? Möchten Sie jetzt gar eine Diskussion beginnen, in welchem Maße Löhne, Gehälter oder gar der Hartz‑IV-Satz in diesem Zeitraum gestiegen sind? Ich glaube, das ersparen wir uns jetzt hier besser. Das diskutieren wir in den nächsten Wochen und Monaten noch ausgiebig mit Ihnen.
Kennen Sie die Bilder von Mitbürgern, die den Müll nach Pfandflaschen durchsuchen? Dafür schämen wir uns!
In Deutschland leben mittlerweile 1,6 Millionen Kinder in Hartz‑IV-Haushalten. Finden Sie das nicht erschreckend?
Werte Kolleginnen und Kollegen, denken Sie doch mal über die Leistungen nach, die Sie erhalten: Diäten: über 9 500 Euro, monatliches Personalbudget von fast 22 000 Euro, Sachkontoleistungen: 1 000 Euro,
Bahncard 1. Klasse, auch privat zu nutzen
– hören Sie mir mal zu! das kann ganz sinnvoll sein –,
Nutzung der Fahrbereitschaft, diverse kleinere Annehmlichkeiten, last, but not least eine steuerfreie Kostenpauschale von über 4 300 Euro.
Jeder Selbstständige muss Belege sammeln, jeder Angestellte muss Erklärungen abgeben, Nachweise erbringen. Sie können 4 300 Euro steuerfrei vereinnahmen – ohne Nachweise!
Bitte hören Sie dem Kollegen zu.
Danke. – Wer keine Zweitwohnung in Berlin unterhält und wer kein Wahlkreisbüro unterhält, bekommt die Kostenpauschale trotzdem – steuerfrei.
Meine Damen und Herren, schämen Sie sich nicht? Wir sind hier nicht im Märchen „Ali Baba und die vierzig Räuber“, wo nach Bedarf Geld aus der Sesam-öffne-dich-Höhle geholt werden kann.
Es geht hier um hart erarbeitetes Steuergeld.
