Sehr geehrter Herr Präsident! Sehr geehrte Damen und Herren! Werte Kolleginnen und Kollegen! Wir beraten heute zwei Anträge der Grünen. Es ist eigentlich fast wie in der letzten Legislatur. Ich bitte die Grünen schon, einfach zur Kenntnis zu nehmen, dass sich die Bandbreite der Meinungen wesentlich verbreitert hat.
Das sollte aus meiner Sicht natürlich dazu beitragen, dass man bei den Zwischenrufen ein bisschen vorsichtiger sein und die Sache in den Mittelpunkt stellen sollte.
Es geht zum einen um die Klimaschutzziele, und zum anderen geht es um den Ausbau der Onshorewindenergie, also um die Windkraft an Land. Eines muss ich schon einmal deutlich sagen: Entgegen sämtlichen Befürchtungen während der gesamten letzten Legislatur haben wir zwischen 2014 und 2017 den stärksten Ausbau der Windkraft seit jeher erlebt.
Thema Klimaschutz: Man könnte glauben, dass Sie die Sondierungsvereinbarung nicht gelesen haben.
Hier bekennt man sich ausdrücklich zum Klimaschutz. Dass bis zur Erreichung des Ziels 2020 noch eine Lücke besteht, ist bekannt. Diese wird schnellstmöglich geschlossen werden.
Herr Kollege, gestatten Sie eine Zwischenfrage der Kollegin Badum?
Natürlich, gerne.
