Das hat der Kollege Fechner für mich eingespart; aber es scheint nicht zu zählen.
Wir werden die Wirkungen des NetzDG ganz klar von Anfang an, das heißt ab 1. Januar 2018, kritisch begleiten und dann mit Ihnen gemeinsam die Evaluation begleiten, und wir werden überlegen, wie es dann weitergeht.
Vielen Dank fürs Zuhören.
Frau Kollegin, auch der Kollege Fechner war über seine Redezeit; aber lassen wir es einmal dabei bewenden.
Ich schließe damit die Aussprache.
Interfraktionell wird die Überweisung des Gesetzentwurfs auf Drucksache 19/204 an den Hauptausschuss vorgeschlagen. Gibt es dazu anderweitige Vorschläge? – Das erkenne ich nicht. Dann ist die Überweisung so beschlossen.
