Meine Frage geht dahin: Haben Sie sich überhaupt mit dem kanadischen Einwanderungsgesetz auseinandergesetzt? Es ist ein humankapitalorientiertes Gesetz, das ganz genau definiert, dass die Einwanderung tatsächlich der Wirtschaft nützen muss, das aber auch abstrakt darauf abstellt, dass die Einwanderer, die kommen – das begründet den Erfolg des kanadischen Modells –, ganz klar auch mit anderen Formen im Einklang stehen müssen. Seit der Reformierung, die hier angesprochen wurde, müssen Einwanderer hinsichtlich Sprache, Alter, Berufsqualifikation passen. Zum Erfolg trägt bei, dass es einen objektiven Katalog an Kriterien gibt, dass es eine Kommission gibt, die jedes Jahr Einwanderung auf den Bedarf der kanadischen Wirtschaft abstellt, dass es weiterhin ein Caregiver-Programm gibt, das auch kurzfristige, auf fünf Jahre orientierte Migration ermöglicht. Haben Sie das Programm überhaupt gelesen?
Herr Kollege, darf ich Sie bitten, Ihre Frage abzuschließen? Es soll kein Redebeitrag werden.
Ja. Dann frage ich Sie: Haben Sie überhaupt das Programm gelesen und verstanden? Was Sie dort betreiben, ist Etikettenschwindel.
Herr Kollege, das war die Frage, ob sie es verstanden hat. Frau Kollegin Kolbe, bitte antworten Sie auf diese Frage. Den Rest ignorieren Sie einfach.
Sehr gerne. – Ich bin durchaus der Auffassung, dass wir uns inhaltlich und fachlich damit auseinandersetzen sollten. Deswegen meine herzliche Einladung: Das Papier dort draußen ist zum Lesen da, lieber Herr Kollege der AfD.
Wenn Sie es gelesen hätten, dann wüssten Sie, dass wir uns sehr intensiv mit dem Konzept Kanadas und den Weiterentwicklungen in Kanada beschäftigt haben. Unser damaliger Fraktionsvorsitzender Thomas Oppermann hat sich in Kanada sogar vor Ort ein Bild davon gemacht. Haben Sie also keine Angst.
Schlusssatz. Wir haben hier einen Vorschlag gemacht. Wir sind das Parlament und können uns darüber unterhalten. Das kann eine spannende Diskussion werden. Lassen Sie uns also in die Auseinandersetzung gehen. Ich habe große Lust dazu, mit Ihnen darüber zu streiten, wie wir dieses Minus in Sachsen – 600 000 Rentnerinnen und Rentner, 300 000 Schulabgängerinnen und Schulabgänger – in den nächsten zehn Jahren bewältigen können.
Vielen Dank fürs Zuhören.
Vielen Dank, Frau Kollegin Kolbe. – Ich schließe damit die Aussprache.
Interfraktionell wird Überweisung des Gesetzentwurfs auf Drucksache 19/44 an den Hauptausschuss vorgeschlagen. Gibt es dazu anderweitige Vorschläge?
– Mitglieder der AfD-Fraktion erbitten Abstimmung. Wer für die Überweisung dieses Gesetzentwurfs ist, den bitte ich um das Handzeichen. – Wer gegen die Überweisung des Gesetzentwurfs ist, den bitte ich um das Handzeichen. – Dann stelle ich fest, dass mit den Stimmen von Linken, Bündnis 90/Die Grünen, SPD, CDU/CSU und Freie Demokraten gegen die Stimmen der AfD und des fraktionslosen Abgeordneten, den ich von hier aus sehe, die Überweisung beschlossen ist.
