Sehr geehrter Herr Vizepräsident! Verehrte Kolleginnen und Kollegen! Millionen von Kindern einen Schulbesuch zu ermöglichen und die Schlechterbehandlung und oftmals Misshandlung von Mädchen in Entwicklungsländern zu beenden, das sind zweifellos ehrenwerte Ziele, denen man sich wohlwollend nähern muss – umso mehr, als die betroffenen Länder zugleich diejenigen sind, aus denen sich die großen Migrantenströme Richtung Europa in Bewegung setzen.
Fazle Rabbani, wohlgemerkt kein AfD-Politiker, werte Kollegin, sondern ein Experte der Globalen Bildungspartnerschaft, um die es hier heute geht, weist darauf hin, dass die Geburtenrate in Bangladesch durch den vermehrten Schulbesuch von Mädchen halbiert werden konnte. Das ist gut für das betroffene Land, dessen Ressourcen begrenzt sind. Das ist aber auch gut für Deutschland und Europa, weil der Migrationsdruck dadurch nachlässt.
Man könnte jetzt darüber streiten, ob die Summe von jährlich 100 Millionen Euro, auf die die Kollegen von den Grünen den deutschen Beitrag zur Globalen Bildungspartnerschaft aufblähen wollen, wirklich angemessen ist oder ob man nicht zuerst die eigenen maroden Schulgebäude sanieren und die 35 000 fehlenden Grundschullehrer einstellen sollte, bevor man gleich die ganze Welt rettet.
Diesen finanziellen Diskurs kann ich mir hier aber sparen;
denn das Programm der Globalen Bildungspartnerschaft krankt leider schon auf einer viel grundsätzlicheren Ebene. Es ist in Wahrheit ein ideologisches trojanisches Pferd, das die Grünen hier heute ins Parlament gerollt haben.
Die Strategiepapiere der GPE, allen voran die „Gender Equality Policy and Strategy 2016–2020“ sprechen es ganz klar aus: Hinter den wohlklingenden philanthropischen Bildungszielen verbirgt sich – nicht ausschließlich, aber eben in weiten Teilen – ein weltweit angelegter Aktionsplan, um der Genderideologie,
