Und was machen die Abgeordneten der CDU/CSU, SPD und FDP im Europaparlament? Sie stimmen dieser vollkommen irrsinnigen Regel zu und dürfen sich bald als Garanten einer neuen Völkerwanderung nach Deutschland feiern lassen.
Hiermit sind auch sämtliche geplanten Pseudo-Obergrenzen bei der Migration in Höhe einer Sozialhilfegroßstadt von 220 000 Personen, also in der Größenordnung von zum Beispiel Freiburg, Makulatur – und es wird ein neues Geschäftsfeld für Schleuser eröffnet. Besonders pikant ist – das sage ich in Richtung der CSU, die in diesem Jahr in Bayern Landtagswahlen hat –, dass diese Regelung auch von der CSU-Europaabgeordneten Hohlmeier getragen wird, immerhin die Tochter von Franz Josef Strauß.
Und zur FDP: Nur im Wahlkampf bei der AfD abkupfern reicht nicht; man muss auch liefern.
Die CDU/CSU hat in ihrem Wahlkampfprogramm behauptet, man habe aus 2015 gelernt, die Migration soll auf einem niedrigen Stand gehalten werden – was auch immer das ist. Der Bürger hätte aufatmen können, wenn da nicht zwei Anglizismen folgen würden, die die wahre Absicht der CDU/CSU verschleiern, nämlich dass die CDU/CSU jenem durch Resettlement und Relocation nachkommen will. Auf Deutsch: durch Neubesiedlung und Umsiedlung.
Nicht umsonst hat uns unser heutiger Präsident Herr Schäuble bereits 2016 belehrt, wir bräuchten die Migration aus Afrika und dem Nahen Osten, um in Europa nicht in Inzucht zu degenerieren.
Meine Damen und Herren, dies ist das Vokabular der „Replacement“-Agenda der UNO und der EU, nachzulesen ab 2001 auf den offiziellen Seiten der UNO und der EU, wonach für Europa eine Migration aus Nahost und Afrika gefordert wird, um den Nationalstaaten in Europa das Rückgrat zu brechen, mit einer Quote für Deutschland von an die 12 Millionen Menschen.
Nach diesem Abstimmungsverhalten im Europaparlament fordern wir die Altparteien auf, endlich Farbe zu bekennen: Wenn Sie weiterhin die Massenmigration nach Deutschland wollen, wie die beiden linkspopulistischen Parteien im Bundestag, dann sagen Sie es jetzt und ehrlich und machen den Weg für Neuwahlen frei! Ansonsten beginnen Sie endlich damit, Politik zu machen für die, die Sie gewählt haben und die Sie bezahlen: für das deutsche Volk und Deutschland!
Stimmen Sie unserem Antrag zu!
Vielen Dank.
Nächster Redner ist der Kollege Stephan Thomae, FDP.
