Herr Präsident! Meine sehr geehrten Damen und Herren! Ich schiebe meine Rede beiseite; denn ich habe gar nicht gewusst, dass heute im Deutschen Bundestag so viel Realsatire statt Realpolitik vorgetragen wird. Ich habe von 2007 bis 2010 eine Lehre als Bankkaufmann bei der Sparkasse absolviert. Kennen Sie das?
– Nein, das ist kein SPD-Parteibuch. Anders als vielleicht die Altersgenossen bei den Jusos scheuen wir uns in meinem Alter bei der CDU/CSU nicht vor der staatspolitischen Verantwortung. Nein, es ist ein Sparkassenbuch.
Es ist ein Sparbuch, das für Vertrauen steht. Sie, liebe Liberale, versuchen hier in der Aktuellen Stunde, die Sie gefordert haben, Angst zu schüren und Vertrauen zu zerstören. Dazu muss ich sagen: Das ist wirklich mehr als despektierlich. Wenn Sie davon sprechen, dass die Einlagensicherung demnächst auf europäischer Ebene vereinheitlicht werden soll, dann sagen Sie mir bitte, wo das steht. Was hat der geschäftsführende Finanzminister gesagt? Er hat gesagt: Wir haben eine Roadmap, an die halten wir uns, und wenn alle Punkte abgearbeitet sind, dann können wir uns am Ende des Prozesses darüber unterhalten. – Das gehört zur Ehrlichkeit dazu.
Lieber Dr. De Masi, ich empfehle Ihnen, mit Ihrem linken Genossen in Wittenberg zu sprechen, der Landrat und gleichzeitig Verwaltungsratsvorsitzender der Sparkasse ist. Sprechen Sie einmal mit ihm über den Vorschlag, die Eigenkapitalquoten zu erhöhen. Ich bin auf seine Antwort gespannt.
In den Regionalbanken, die während der Finanzkrise so wichtig waren, um das deutsche Finanzsystem aufrechtzuerhalten, sind die Eigenkapitalquoten schon peu à peu erhöht worden. Das hatte zur Folge, dass vor allem in den Regionalbanken Umstrukturierungsmaßnahmen – unter anderem mit Beteiligung Ihres eben angesprochenen Verwaltungsratsvorsitzenden – vorgenommen wurden. Es kam zu Filialschließungen und Personalabbau in der Fläche. Das gehört – gerade bezogen auf das deutsche Bankensystem – zur Ehrlichkeit dazu, wenn Sie noch höhere Eigenkapitalquoten fordern.
Es würde unsere Regionalbanken kaputtmachen, liebe Freunde.
Dr. Schick, Sie sprechen ja mittlerweile von einer Eigenkapitalquote von 10 Prozent, von faulen Krediten in Höhe von 950 Milliarden Euro und von einer hervorragenden Regelung in den USA – Sie meinen, dass es da super läuft.
Wir müssen aber ganz ehrlich sagen, Herr Schick: Wir sind nicht Amerika.
Unser Ziel ist es – wir bleiben dabei –, das Risiko im Bankensystem Europas weiter zu reduzieren – ich denke, da sind wir uns einig –, einheitliche Regeln zu finden, die umgesetzt werden müssen, und die faulen Kredite, für die die Sparer mithaften – egal in welchem Land –, zu reduzieren. Das muss unser Ziel sein. Am Ende des Prozesses gehört es dazu, miteinander zu reden.
