Wenn es etwas gibt, worauf dieses Land besonders stolz sein kann, dann ist es seine Erinnerungskultur.
Wir haben es geschafft, von einer Phase des Verschweigens, des Nichtthematisierens in eine Phase des Anklagens und dann sogar in eine Phase des Verstehens, des Den-Schmerz-Aushaltens in unserer Erinnerungskultur zu kommen. Wir können wie kaum andere Länder, die eine solche Vergangenheitspolitik, wie der Historiker Norbert Frei sagte, betreiben, stolz darauf sein, dass wir aushalten und dass wir verstehen wollen, wie es dazu kam. Sie aber wollen instrumentalisieren. Sie wollen nicht verstehen, sondern Sie wollen Geschichte klittern, und das ist erbärmlich.
Wie also reagieren wir darauf?
Ich glaube, wir alle müssen uns selbst hinterfragen, wie wir besser werden können, wie wir Menschen besser erreichen, wie wir ihre Probleme lösen.
Ich glaube in der Tat: Ihre parlamentarische Existenz ist nicht so sehr Ihren Positionen geschuldet, sondern sie ist auch eine Anfrage an uns selbst, was wir besser machen können,
welche Probleme wir lösen müssen. Insofern empfinde ich diesen Schmerz, den Ihre Anwesenheit hier macht, zwar nur ungern, aber als reife, plurale Gesellschaft werden wir ihn aushalten, und wir werden auch darüber hinwegkommen. Ich bin optimistisch, dass Sie sich irgendwann als politisches Phänomen erledigen werden.
Es fällt mir schwer, mir vorzustellen, wie Sie nachts am Computer sitzen und Mails über Frau Merkel schreiben mit Begriffen, die meine bürgerliche Erziehung mir verbietet überhaupt in den Mund zu nehmen.
Es fällt mir schwer, mir vorzustellen, wie Sie sich daran ergötzen, Formulierungen zu finden, die andere diskreditieren, die Angst schüren und die Menschen kleinmachen.
Es muss Ihnen wohl eine tiefe Befriedigung verschaffen, so etwas zu tun. Meine bürgerliche Erziehung verbietet mir, offen gesagt, einige der Vokabeln, die Sie in diesem Parlament schon in den Mund genommen haben.
Wir werden also darum ringen, besser zu werden. Wir werden die von Ihnen aufgeworfenen Probleme lösen; denn daran haben Sie ja kein Interesse. Wir werden darum kämpfen, dass am Ende eine plurale, eine tolerante und eine weltoffene Gesellschaft – denn das ist im Kern das, worauf Deutschland stolz sein kann – siegt und nicht Ihre Angstmacherei und Ihre Kleinmacherei.
Vielen Dank.
Vielen Dank, Herr Kollege Ruppert. – Als Nächstes für die Fraktion Die Linke die Kollegin Petra Pau.
