Frau Präsidentin! Werte Kolleginnen und Kollegen! Liebe Gäste! Im Unterschied zu allen anderen hier will Die Linke den Nulltarif im öffentlichen Nahverkehr, also Fahren ohne Fahrschein für alle
als Antrieb für eine soziale und ökologische Verkehrswende.
Dafür werben wir seit Jahren. Wir haben Fachleute zurate gezogen, Konzepte entwickelt, Beispiele gesammelt, von denen man lernen kann – in Frankreich, in Belgien, vor der Haustür hier um die Ecke im brandenburgischen Templin. Bisher sind wir hier im Bundestag dafür belächelt und manchmal auch beschimpft worden.
Jetzt aber überrascht die Bundesregierung mit der Idee, den Nulltarif in einigen konkret benannten Städten einzuführen, um den Autoverkehr und die Abgasbelastung zu reduzieren.
„Prima“, sage ich, aber das war, wie ich jetzt gerade höre, wohl doch nicht so ernst gemeint: kein Anschluss unter dieser Nummer, kein Konzept, kein konkreter Plan und kein wirklicher Wille, glaube ich. Das überrascht mich bei dieser Regierung nicht wirklich.
Dass aber auch die Grünen abwinken, hat mich schon überrascht, und das verstehe ich überhaupt nicht. Dass ausgerechnet der hessische Verkehrsminister Tarek Al‑Wazir gegen die Einführung des Nulltarifes auftritt, verstehe ich schon gar nicht. Langsam glaube ich, dass eine ökologische Verkehrspolitik wirklich nur mit Links geht.
Es ist doch super, dass mit diesem Brief jetzt die Tür einen Spalt breit offen ist, und die Leute wollen es, sehen es ein. 71 Prozent der Bevölkerung finden die Idee gut, dass der öffentliche Nahverkehr ab 2020 kostenfrei genutzt werden kann. Das geht aus einer ganz aktuellen Umfrage von Infratest dimap hervor, und das liegt übrigens wesentlich höher als der Zustimmungswert zur Großen Koalition. Jetzt kommt es darauf an, diesen Rückenwind, auch der Öffentlichkeit, zu nutzen – natürlich nicht ohne Gesamtstrategie. Hau ruck irgendetwas irgendwie zu machen, führt natürlich zum Chaos und würde als Beweis dafür dienen, dass es nicht funktioniert.
Der Verband Deutscher Verkehrsunternehmen, VDV, hat natürlich recht: Die Kommunen und ÖPNV-Verbünde, die mit einem solchen Nulltarif starten, brauchen erhebliche Unterstützung. Mit Sicherheit – das ist ja genau das, was wir wollen – werden Fahrgastzuwächse von 25 bis 40 Prozent erwartet. Dafür muss Vorsorge getroffen werden; das ist doch klar. Außerdem muss man natürlich auch die Bedingungen für Fuß und Fahrrad deutlich verbessern; denn auch das sind wichtige Alternativen zum Autofahren.
Mittelfristige Ziele sollen aber ein bundesweiter ÖPNV-­Nulltarif und die Halbierung des Autoverkehrs sein.
