Meine Damen und Herren, ist das BAföG wirklich zu niedrig?
Im vorliegenden 21. Bericht der Bundesregierung lese ich dazu – Zitat –:
Die Anhebungen der Bedarfssätze durch das 22. und 23. BAföGÄndG erfolgten also in deutlich stärkerem Ausmaß, als die Entwicklung des Preisindexes es erfordert hätte.
Das heißt: Wir haben faktisch sogar noch Luft nach oben.
Die Grünen beklagen ferner, dass die Zahl der BAföG-Bezieher gesunken sei. Das stimmt tatsächlich, und zwar im Berichtszeitraum – das wurde eben schon genannt – um 16,7 Prozent. Ich weiß aber gar nicht, warum das schlimm sein soll.
Liest man im vorliegenden Bericht nur zwei Zeilen weiter – das hätten Sie vielleicht mal tun sollen –, liest man dort Folgendes – Zitat –:
Dieser Rückgang ist im Zusammenhang zu sehen mit steigenden Einkommen sowie einer höheren Erwerbstätigkeitsquote.
Meine Damen und Herren, das bedeutet im Klartext: Immer mehr Menschen sind nicht mehr auf den Staat angewiesen, um sich ihr Studium oder das ihrer Kinder zu finanzieren.
Das ist doch eine gute Nachricht; denn BAföG ist schließlich eine Sozialleistung. Man sollte sich doch freuen, wenn weniger Menschen sie in Anspruch nehmen müssen.
Wenn es denn wirklich so wäre, dass ein Studium in Deutschland nicht finanzierbar sei, hätte doch die Zahl der Studenten zurückgehen müssen. Das Gegenteil ist aber der Fall: Noch nie hatten wir so viele Studenten wie heute;
wir gehen auf die 3 Millionen zu. Zu fragen wäre vielmehr, ob wir so viele Akademiker überhaupt gebrauchen können. Hören wir nicht gerade auch von Ihnen immer, dass Facharbeiter fehlen?
– Regen Sie sich nicht zu früh auf; es wird noch besser.
