Kollege Kahrs, gestatten Sie eine Zwischenfrage?
Nein. Ich finde, die können jetzt einfach einmal zuhören. Dann lernt man was. – Wir wären damit ein Stück unabhängiger vom IWF, der bisher vor allem wegen seiner Expertise unverzichtbar war. Wenn man ehrlich ist, muss man sagen, dass es mit dem IWF aber nicht immer ganz einfach war.
Mit dem Europäischen Währungsfonds hätten wir eine Institution, die längerfristige Aufgaben übernimmt: bei der Beratung der Mitglieder der Euro-Zone und bei der Krisenprävention; also nicht mehr als ADAC und Reparaturbetrieb, sondern mehr TÜV und DEKRA: regelmäßige Inspektion und Wartung, und das alles aus einer Hand und das alles aus Europa.
Ich glaube, wir, die wir Europa stärken wollen, können dies nur wollen. Ich glaube, dass das richtig ist. Wir haben hier gemeinsam einen Weg beschritten. Ich habe es eben schon gesagt: Wolfgang Schäuble, Frank-Walter Steinmeier, Guido Westerwelle, sie hatten die Idee, die Vision. Diesen Weg wollen wir weitergehen.
Ich weiß, dass es wichtig ist, dass wir den ESM weiterentwickeln. Er ist nicht nur ein Bollwerk gegen Spekulanten, sondern er kann auch zusätzliche Aufgaben in der Krisenprävention und -bewältigung übernehmen.
Wir werden das in den Ausschüssen noch genau diskutieren. Mir ist nur eines wichtig – ich habe entsprechende Anmerkungen hier heute gehört –: Wir als Sozialdemokraten wollen mehr Europa; wir wollen nicht weniger Europa. Deswegen haben wir auch dafür gesorgt, dass das Europakapitel am Anfang unseres Sondierungspapiers steht. Wir wollen Europa weiterentwickeln. Europa ist nicht Teil des Problems; Europa ist Teil der Lösung unserer Probleme.
Wir alle müssen schauen, dass wir Europa stärken. Wir als Sozialdemokraten waren schon für Europa, als andere Parteien hier im Raum noch nicht einmal parlamentarisch vertreten waren. Deswegen können wir als Europapartei sagen, dass wir mit unserer 154-jährigen Geschichte weiterhin dafür stehen werden, dass Europa zusammengeführt wird und zusammenhält.
Gleichzeitig werden wir Sozialdemokraten aber auch sicherstellen, Ecki Rehberg, dass die nationalen Parlamente die Aufgaben für die nationalen Haushalte nicht aus der Hand geben. Darauf können sich die Bürgerinnen und Bürger verlassen. Dafür stehen wir Sozialdemokraten, dafür steht auch die künftige neue Koalition.
Vielen Dank.
Der Kollege Dürr von der FDP erhält Gelegenheit für eine Kurzintervention.
