Auch die SPD-Fraktion hat zu Beginn der letzten Sommerpause beschlossen, dass sie sich dem Ziel „Straight 18“, also keine Minderjährigen mehr an Waffen auszubilden und für die nationalen Streitkräfte zu werben, anschließt. Damit fordern in Deutschland das Deutsche Bündnis Kindersoldaten, UNICEF, die Gewerkschaft Erziehung und Wissenschaft, die katholischen Jugendverbände, aber eben auch Die Linke und die Grünen hier im Haus sowie jetzt auch die SPD-Fraktion, dass keine Minderjährigen mehr für die nationalen Streitkräfte geworben oder an Waffen ausgebildet werden.
Auch der Wehrbeauftragte schließt sich ein Stück weit dieser Position an, indem er erstmals in seinen Berichten für die Jahre 2016 und 2017 – herzlich willkommen, Herr Bartels! – ausführt, dass die Heranziehung Minderjähriger der Ausnahmefall sein sollte. Bei 9 Prozent oder 10 Prozent Minderjährigen bei den Grundwehrdienstleistenden kann von Ausnahmefällen aber wohl gar nicht mehr die Rede sein.
2019 muss die Bundesregierung Farbe bekennen. Warum? 2019 wird die Bundesregierung den nächsten Staatenbericht zur Umsetzung der UN-Kinderrechtskonvention und ihres 2. Fakultativprotokolls, in denen die Frage von Minderjährigen in Streitkräften und bewaffneten Konflikten geregelt werden, vorlegen, und zwar gegenüber den Vereinten Nationen. Der UN-Ausschuss für die Rechte des Kindes in Genf wird diesen Bericht zur Kenntnis nehmen. Er wird Verbände und Initiativen anhören, und er wird Handlungsempfehlungen aussprechen.
Jetzt sage ich Ihnen: Ich weiß heute schon, wie diese Handlungsempfehlungen aussehen werden: Die werden genauso aussehen wie die Handlungsempfehlungen vor fünf Jahren, weil die Bundesregierung gar nichts davon umgesetzt hat. Sie hat überhaupt nicht darauf reagiert, dass die Vereinten Nationen klare Empfehlungen ausgesprochen haben. Sie haben das schlichtweg nicht umgesetzt. Ihnen ist das egal. Sie werden wieder einen Staatenbericht vorlegen. Dieser Staatenbericht wird ein zweites oder drittes oder viertes Mal mit Handlungsempfehlungen versehen werden, die Sie am Ende wieder nicht umsetzen. Diese Blöße können wir uns durch die Annahme der Anträge von Grünen und Linken ersparen.
Jetzt werden Sie sagen: Die Bundeswehr braucht Jugendliche ganz dringend, weil man sonst die personellen Anforderungen nicht erfüllen kann. – Da haben Sie recht; das stimmt. Auch dafür hat Die Linke eine Lösung.
Sie ist ganz einfach: Ziehen Sie die Soldatinnen und Soldaten aus den anderthalb Dutzend Auslandseinsätzen ab!
Wenn Sie das machen, dann haben Sie nicht mehr so ein Personalproblem, und dann müssen Sie auch keine Minderjährigen mehr für die nationalen Streitkräfte werben.
Vielen Dank.
Vielen Dank, Herr Kollege Müller. – Als Nächste für die CDU/CSU-Fraktion die Kollegin Kerstin Vieregge. Es ist ihre erste Parlamentsrede.
