Ob wirklich Rechtsverstöße vorliegen oder nur Gesetzeslücken genutzt wurden, ist hier völlig unerheblich. Wirklich entscheidend ist doch, dass viele Menschen, insbesondere in der Nähe von stark befahrenen Straßen, seit Jahren viel mehr Abgase einatmen, als zulässig ist. Sie bekommen Asthma, Krebs und Herz-Kreislauf-Erkrankungen. Wenn also die Autoindustrie seit Jahren die gesetzlich geregelten Abgasgrenzwerte bewusst überschreitet, die Menschen also bewusst diesen Risiken aussetzt und sie dabei nicht nur völlig im Unklaren darüber lässt, nein, sie auch noch permanent belügt und täuscht, dann ist das in meinen Augen strafbar, und damit muss endlich Schluss sein.
Aber, Kolleginnen und Kollegen, die politische Verantwortung für diese nicht abreißen wollende Kette von Skandalen trägt eindeutig eine abgewirtschaftete Bundesregierung: eine Umweltministerin Hendricks, die das Thema Luftreinhaltung irgendwie verschlafen hat,
ein nicht mehr amtierender Verkehrsminister Dobrindt, der bayerischen Hirngespinsten hinterherläuft, und schließlich eine Bundeskanzlerin Merkel, die die Interessen der Autoindustrie offenbar über alles stellt. Liebe Bundesregierung, wir brauchen endlich einen gesetzlichen Rahmen. Hören Sie auf, mit der Autoindustrie zu kuscheln, und ziehen Sie die notwendigen Schlussfolgerungen aus dieser Never-ending Story!
Dazu gehört zuallererst die gesetzliche Verpflichtung der Autoindustrie zur flächendeckenden Nachrüstung mit SCR-Systemen in allen 7 bis 8 Millionen betroffenen Fahrzeugen. Nur so kann relativ schnell eine effektive Senkung der Stickoxidwerte überhaupt erreicht werden.
Und leiten Sie endlich Strafzahlungen für die Autoindustrie ein! Wie kann es sein, dass die Autoindustrie seit Jahren Autos verkauft, die viel mehr Schadstoffe ausstoßen, als in ihren Hochglanzbroschüren und bei der Zulassung angegeben worden ist, und der ganze Vorgang insgesamt straffrei bleibt? Überlegen Sie doch einmal, was für ein Signal Sie damit senden! Sie sagen doch damit: Die Autoindustrie steht über dem Gesetz. Die Gesetze gelten für normale Menschen, aber nicht für die deutsche Autoindustrie.
Die darf selbst entscheiden, wann sie welches Fehlverhalten einräumt und wann sie gedenkt – aber auch nur freiwillig – Abhilfe zu schaffen. Dem Ganzen die Krone setzt noch die Tatsache auf, dass die Autoindustrie gerade wieder kräftig verdient, unter anderem mit ihren eigenen Betrügereien.
