– warten Sie ab, Geduld –, also Lohn- und Rentenkürzungen, vertiefen Sie Krisen und nehmen Euro-Staaten die Möglichkeit,
die Wirtschaft im Abschwung zu stützen, also das Instrument, das Deutschland 2009 erfolgreich angewandt hat.
Ich sage nur: Abwrackprämie. Es soll aber Taschengeld vom EWF geben, wenn Löhne und Renten brav gekürzt werden und die Konjunktur hierdurch abschmiert. Das ist, als würde man einem Komapatienten eine Herzdruckmassage verpassen, ihm aber gleichzeitig Blut abnehmen. Fakt ist: Die EZB verfehlt permanent ihr Inflationsziel, weil die Löhne nicht vom Fleck kommen. Die Arbeitsmarktreformen haben die Geldpolitik kastriert.
Es ist doch völlig verrückt, bei niedrigen Zinsen nicht mehr zu investieren. Wenn Staaten nicht investieren, landet das billige Geld der EZB auf den Finanzmärkten, nicht in der realen Wirtschaft, und neue Finanzblasen drohen.
Ein Europäischer Währungsfonds würde ja Sinn machen, wenn er öffentliche Investitionen in der Krise stabilisierte. Hätte der EWF eine Banklizenz, könnte er sich bei der EZB refinanzieren, der ja bereits die Staatsanleihen ausgehen, weil Deutschland zu wenig investiert. Ein EWF, der die Kürzungspolitik in Europa vertieft, wird die Euro-Zone nicht stabilisieren, sondern die europäische Idee zerstören. Deswegen, lieber Herr Kollege Kahrs, geht es nicht um die Frage, ob wir mehr oder weniger Europa wollen, sondern um die Frage, welches Europa wir wollen. Die Linke steht für ein Europa von Wohlstand und sozialer Gerechtigkeit.
Vielen Dank.
Nächste Rednerin ist die Abgeordnete der Grünen Dr. Franziska Brantner.
