Sehr geehrter Herr Präsident! Meine sehr verehrten Damen und Herren! Voltaire soll den Jemen einmal als das angenehmste Land der Erde bezeichnet haben. Leider entspricht die Situation – sie ist vielfach beschrieben worden – im Jemen genau dem Gegenteil. Die Menschen, ob sie schon lange dort leben oder ob sie dort gestrandet sind, weil sie aus Somalia geflüchtet sind, müssen den Jemen seit vielen Monaten eher als Hölle auf Erden begreifen.
Deshalb will ich noch einmal einführend kurz darauf hinweisen: Ja, es ist die größte humanitäre Katastrophe, die sich zurzeit in der Welt abspielt. Es fehlt an allem: an Nahrung, an sauberem Trinkwasser, an einer funktionierenden Gesundheitsversorgung. Über 22 Millionen Menschen – zwei Drittel der Bevölkerung – sind auf Hilfe, insbesondere auf Nahrungshilfe, angewiesen. Die Vereinten Nationen und ihre Hilfswerke kämpfen gegen Diphtherie und vor allem gegen die weltweit größte Cholera-Epidemie. Mehr als 90 Prozent des Gebietes des Jemens sind hiervon betroffen.
Zur Lagebeschreibung gehört auch, zu sagen: Die militärische Intervention der saudi-arabisch geführten Koalition konnte den Konflikt nicht entscheiden oder gar lösen. Das Gegenteil ist der Fall. Die humanitäre Lage im Land hat sich im Zuge von Seeblockaden und der Zerstörung ziviler Ziele dramatisch verschlechtert. Der ehemalige VN-Sondergesandte für den Jemen, Ismail Ould Cheikh Ahmed, hat sich drei Jahre lang vergeblich um eine politische Lösung bemüht. Doch trotz der wachsenden internationalen Kritik und der katastrophalen Lage im Land hält die saudisch geführte Koalition an ihrem Kurs fest. Auf der anderen Seite tragen auch die Huthi-Rebellen ihren Teil zur Eskalation bei. Mit Raketenangriffen auf Saudi-Arabien nehmen sie zudem bewusst auch zivile Opfer in Kauf.
Herr Kollege, Herr Neu hätte noch eine Zwischenfrage. Gestatten Sie das?
Bezieht sich die Frage auf meine Ausführungen, oder wollen Sie gleich wieder zu den Rüstungsexporten kommen?
– Bitte.
