Frau Präsidentin! Liebe Kolleginnen und Kollegen! Liebe Kollegen von der AfD, seien Sie in dieser Debatte doch ehrlich. Es geht Ihnen nicht um die Rechte von Frauen, sondern einfach um Provokation und um Selbstbestätigung in der vermeintlich eigenen Opferrolle.
Frauenrechte sind Ihnen im Kern doch überhaupt nichts wert. Die vergangenen Monate haben das ganz deutlich gezeigt.
Auf Bundestagswahlplakaten der AfD waren halbnackte Frauen unter dem Motto: „WIR STEH’N AUF BIKINIS“, zu sehen.
Ein AfD-Mitglied des Abgeordnetenhauses von Berlin, Gunnar Lindemann, empfiehlt anderen Facebook-Nutzern preiswerte ukrainische Frauen.
Der in Mecklenburg-Vorpommern über die AfD-Liste gewählte Landtagsabgeordnete Arppe setzt dem Ganzen noch die Krone auf. Er fordert die Vergewaltigung von Frauen und Kindern und ruft zur Tötung von Menschen mit anderen Meinungen auf.
An diesen Chats sind noch weitere Landtagsabgeordnete Ihrer Partei beteiligt. Das ist pervers, das ist abartig, und ich sage Ihnen: Schämen Sie sich dafür!
Zurück zum Frauenmarsch vom Samstag. Ja, Gewalt gegen Frauen ist ein Problem in unserer Gesellschaft. Insbesondere – das habe ich hier bereits mehrfach gesagt – haben einige junge muslimische Männer ein falsches Frauen- und Gesellschaftsbild.
