Wir haben dann auch – dies sage ich unter Bezugnahme auf die letzte Debatte – nach dem schrecklichen Anschlag auf dem Breitscheidplatz das Abschiebungsrecht entsprechend verschärft. Wir haben die Hürden deutlich gesenkt, dass ausreisepflichtige Gefährder in Abschiebehaft genommen werden können. Wir haben die Möglichkeit geschaffen, dass Gefährder mit der elektronischen Fußfessel überwacht werden. Wir haben die Möglichkeit geschaffen, dass Personen, die als Gefährder eingestuft sind oder die nicht bereit sind, ihre Identität preiszugeben, mit einer Residenzpflicht versehen werden. Wir haben die Möglichkeit geschaffen, dass Asylbewerber verpflichtet werden, bis zu zwei Jahre in einer Erstaufnahmeeinrichtung zu verbleiben.
Wir haben weitgehende Maßnahmen vorgenommen, um das Ausweisungs- und Abschiebungsrecht in Deutschland deutlich restriktiver zu fassen und zu verschärfen.
Meine sehr verehrten Kolleginnen und Kollegen, ich komme nun zum dritten Punkt. Die geplante Vorgehensweise der AfD ist nun einmal verfassungswidrig. Ich bin schon etwas verwundert, sehr geehrter Herr Kollege Reusch: Sie sind Volljurist und sagen: Na ja, das Argument der Verfassungswidrigkeit ist ein Totschlagargument.
Gerade eine Partei, die wie die AfD immer vorgibt, sehr vaterlandslieb zu sein und einen besonderen Bezug zu unserem Heimatland zu haben, sollte aus meiner Sicht schon mehr Respekt und auch Anerkennung gegenüber unserer Verfassung haben.
Es ist nun einmal so – das sage ich ganz deutlich –, dass die Präventivhaft in Deutschland unzulässig ist.
Man kann eine Person nicht einfach in Haft nehmen, wenn sie sich nicht vorher strafbar gemacht hat.
Dass Sie, Herr Reusch, selbst erkannt haben, dass Ihr Gesetzentwurf verfassungswidrig ist, erkennt man schon daran, dass Sie nicht nur den Gesetzentwurf einbringen, sondern diesen mit einem Antrag begleiten. Dieser ist lapidar auf zwei Seiten gefasst.
In diesem Antrag fordern Sie die Bundesregierung auf, mit den Bundesländern in Verhandlungen über eine Neuordnung der Gesetzgebungszuständigkeit im Bereich des allgemeinen Gefahrenabwehrrechts einzutreten. Dieser Satz entlarvt Sie vollends; denn Sie gestehen mit diesem Satz ein, dass Ihr begleitender Gesetzentwurf himmelschreiend verfassungswidrig ist.
Der Bund hat in diesem Bereich keine Gesetzgebungszuständigkeit. Sie verweisen sogar in der Begründung Ihres Antrags darauf, dass beispielsweise der Freistaat Bayern von seiner Zuständigkeit Gebrauch gemacht hat, indem die Möglichkeit, bekannte Gefährder in Haft zu nehmen, von 14 Tagen auf mittlerweile drei Monate erweitert wurde.
Insoweit ist der Dreiklang wieder vollends erfüllt. Erstens: Sie als AfD beschäftigen sich mit einem Thema, in dem Fall mit dem Thema der Ausländerkriminalität. Die hohe Ausländerkriminalität ist tatsächlich ein Thema, und ich werde auch noch etwas dazu sagen, was wir als Unionsfraktion gemeinsam mit der SPD vorhaben, um hier in der laufenden Legislaturperiode weitere Verschärfungen vorzunehmen. Zweitens: Sie erwecken zu Unrecht den Eindruck, wir hätten nichts getan. Und drittens: Sie bieten nur Scheinlösungen.
Wir als Große Koalition haben uns im Koalitionsvertrag darauf verständigt, dass wir diese fünf Deliktsgruppen, die ich vorhin erwähnt habe, noch um den Sozialleistungsbetrug und die Verstöße gegen das Betäubungsmittelgesetz erweitern werden. Wenn also Delikte dieser beiden Gruppen begangen werden, reicht dann schon eine Freiheitsstrafe von nur einem Jahr, die auch zur Bewährung ausgesetzt sein kann, aus, um das Ausweisungsinteresse des Staates zu indizieren.
Wir haben uns gemeinsam mit der SPD auch darauf verständigt, dass wir die Instrumente der Abschiebehaft und auch des Ausreisegewahrsams insgesamt praktikabler gestalten wollen. Das ist aus meiner Sicht ein sachgerechter und wohlgemerkt verfassungsgemäßer Ansatz, den wir hoffentlich ab kommenden Montag dann entsprechend weiter vorantreiben werden.
Herzlichen Dank für die Aufmerksamkeit.
Nächster Redner ist der Abgeordnete Uli Grötsch für die Fraktion der SPD.
