Herr Präsident! Meine sehr geehrten Damen und Herren! Ich fürchte, mit dem Eintritt der AfD in die Parlamente und in den Deutschen Bundestag tritt die deutsche Erinnerungskultur, ein Phänomen, auf das wir sehr stolz sein können, in eine neue Phase ein.
Wir alle spüren, dass die repräsentative Demokratie unter Druck geraten ist, dass allein der Umstand, dass Sie hier sitzen, auch immer eine Anfrage an uns alle ist,
was wir tun können, um unsere Politik zu erklären und zu transportieren.
Ich will meine Rede etwas anders intonieren, als das in der von mir geschätzten Rede von Konstantin von Notz geschehen ist. Ich habe mir in den Monaten, die wir jetzt nebeneinandersitzen müssen, angeschaut, wie Sie sich verhalten.
Ich habe am Anfang gedacht: Sie befassen sich mit einzelnen Themen, Sie steigen in Sachdebatten ein. – Ich habe merken müssen, wie Sie die Ambivalenz kultivieren, das Schillernde des Begriffs, wie Sie sich daran begeistern, dass das Wort „entartet“ in einer Rede von Ihnen untergebracht worden ist – entartete Pässe –, und am Ende dann vorbereitete Zitate von anderen haben, die das auch benutzen. Sie legen es immer darauf an, in einer Art Ambivalenz
Ihre im Kern letztlich menschenfeindlichen Positionen am Ende durchzusetzen und uns hier vorher vorzutragen.
Ich habe – ich glaube, das machen viele in diesem Parlament – mit mir gerungen, wie ich damit umgehe. Ich glaube, wir haben noch keine endgültige Antwort gefunden.
Ich habe mir gesagt: Wir wollen keine Ächtung durch Verfahren. – Ich habe Sie deswegen in Ausschussvorsitze gewählt,
mit meiner Stimme, weil ich mir gesagt habe: Wir müssen den Schmerz, den diese Positionen uns zufügen, im Verfahren aushalten. Ich habe gesagt: Ich gucke mir genau an, wie Sie dort agieren. – Ich musste feststellen: Sie tun alles, um letztlich die Ängste, von denen Sie anscheinend selbst ergriffen worden sind, auf andere zu übertragen, um Ambivalenzen, um Entartungen und Formulierungen, die jenseits allen Geschmacks sind, in dieses Parlament zu tragen,
und das ist einfach erbärmlich.
