Sehr geehrter Herr Präsident! Meine sehr geehrten Damen und Herren! Zu Beginn meiner ersten Rede hier muss ich sagen: Ich fühle mich beschämt und zu Hause zugleich. Zum einen fühle ich mich beschämt, weil ich nicht gedacht hätte, dass in diesem Hause, an diesem Ort im deutschen Parlament wieder solch diffamierendes Gerede zu hören ist und solch völkische Floskeln verwendet werden.
Ich fühle mich zugleich zu Hause, weil ich im Sächsischen Landtag zehn Jahre lang neben den Nazis der NPD sitzen musste.
Aber so viel Mühe Sie sich auch geben, meine Damen und Herren von der AfD: An deren Boshaftigkeit kommen Sie noch nicht ganz heran. Im Verhältnis zu denen geht es bei Ihnen zu wie beim Kindergeburtstag, wenn auch einem Kindergeburtstag mit vielen Grauhaarigen.
Herr Kollege Martens, gestatten Sie eine Zwischenfrage des Kollegen Brandner?
Im Moment nicht, danke. Meine erste Rede möchte ich ungestört halten.
Meine Damen und Herren, das Verlangen nach der Wiedereinführung der Optionspflicht wird damit begründet, dass die Gewährung der Staatsangehörigkeit – so als sei dies ein Gnadenakt – ein Bekenntnis voraussetzen würde. Welches Bekenntnis sollte denn ein Säugling ablegen können? Mein Vorredner hat es schon erwähnt: Auch der deutscheste Säugling kann kein Bekenntnis ablegen.
Meine Damen und Herren, als Jurist weiß man: Das Wichtige steht immer im Kleingedruckten. Deswegen lohnt es sich, die Begründung dieses Gesetzentwurfes einmal durchzusehen. Eine Auseinandersetzung mit der Faktenlage, irgendwelche Wertungen oder Prognosen künftiger Entwicklungen werden Sie dort vergeblich suchen.
Stattdessen finden Sie dort unbewiesene Behauptungen, Unterstellungen oder wie jetzt in der mündlichen Begründung den Gebrauch von völkischen Kategorien wie zum Beispiel die Entwicklung von irgendwelchen Geburtenzahlen.
Wenn behauptet wird, dass Konfliktpotenziale „das Zusammenleben in einer Gesellschaft mit massenhafter doppelter Staatsbürgerschaft“ prägen,
