Ich kann noch unendlich lange reden, sehr gerne.
Das fürchte ich schon.
Ich rede mich gerade erst in Rage.
Frau Esken, bitte.
Herr Kollege Thomae, was schätzen Sie, wie viele Jahre ein geflüchteter Mensch hier bei uns gut integriert sein muss, um Deutsch zu sprechen, eine Wohnung zu haben, diese Wohnung bezahlen zu können, eine Arbeit zu haben, damit Sie ihm erlauben würden, seine Familie nachzuholen?
Frau Kollegin, da schätzen Sie mich völlig falsch ein. Wir haben bereits eine ganze Reihe von Menschen, die seit gar nicht allzu langer Zeit hier leben, gut Deutsch sprechen, sich redlich verhalten, gegen die kein Einwand besteht, die hier arbeiten und in der Lage sind, ihre Familie nachzuholen. Ich kann Ihnen keine Zahlen nennen. Aber dass es solche Fälle bereits jetzt gibt, daran kann in meinen Augen kein Zweifel bestehen.
Was wir erreichen wollen, ist, dass Menschen, die Leistung zeigen, ihre Familien nachholen können. Das aber ist in Ihrem Entwurf nicht zu erkennen. Deswegen sind wir der Meinung, dass das, was Sie uns hier vorlegen, für eine christlich ausgerichtete Regierung nicht der große Wurf sein kann. Ich glaube, Sie verschieben die Lösung dieses Problems auf einen noch zu erlassenden Gesetzentwurf, der dann kommen soll, wenn die Tinte unter dem Koalitionsvertrag trocken ist. Was dann kommt, darauf sind wir sehr gespannt. Ich bin jedenfalls gespannt, Frau Nahles, Herr Schulz, wie Sie Ihrer Partei das, was hier von Ihnen als Kompromiss ausgehandelt worden ist, schmackhaft machen wollen.
Wir sind sehr gespannt, wie es mit diesem Thema weitergehen wird.
Vielen Dank.
Danke sehr. – Jetzt hat das Wort der Vorsitzende der Fraktion Die Linke, Dr. Dietmar Bartsch.
