Der Antrag der FDP doktert also nur an den Symptomen herum und verleitet die Frauen dazu, den Kinderwunsch immer weiter aufzuschieben.
Stattdessen brauchen wir in Deutschland endlich wieder ein gesellschaftliches Klima, um die demografische Krise mit einem natürlichen Verständnis und einer aktivierenden Bevölkerungspolitik in den Griff zu bekommen.
Wir müssen junge Paare durch Ehestartkredite wieder früher fördern. Wir brauchen höhere Kinderfreibeträge und mit dem Familiensplitting auch eine steuerliche Entlastung.
Nicht zuletzt müssen wir die Erziehungszeiten endlich auf die Renten- und Krankenversicherungsleistungen anrechnen. Mit diesen Maßnahmen, meine Damen und Herren, schaffen wir eine Willkommenskultur für Kinder.
In diesem Sinne stimmen wir der Überweisung an den Ausschuss zu und freuen uns auf die weitere Beratung.
Vielen Dank.
Herr Kollege Huber, vielen Dank für Ihren Beitrag. – Als Nächstes erteile ich das Wort Frau Katrin Werner für Die Linke.
