Sehr geehrte Frau Präsidentin! Sehr geehrte Damen und Herren! Die Pflege zu stärken, ist eine zentrale Aufgabe unserer Fraktion.
Bereits in der letzten Wahlperiode haben wir die größte Reform der Pflegeversicherung seit 20 Jahren durchgeführt. Wir haben durch die Pflegestärkungsgesetze das Leistungsniveau für die Pflegebedürftigen massiv gestärkt. Wir haben die Demenzkranken gleichgestellt. Wir haben die Leistungen in der letzten Legislaturperiode um insgesamt 53 Prozent erhöht. Das ist eine großartige Leistung, gerade unseres Gesundheitsministers. Ihm danke ich an dieser Stelle im Namen unserer Fraktion ganz herzlich. Das ist eine großartige und nachhaltige Leistung für die Pflegebedürftigen in Deutschland.
Jetzt geht es um eine deutliche und nachhaltige Verbesserung der Arbeitsbedingungen für die Pflegekräfte, und zwar weitestgehend so, dass die Pflegebedürftigen nicht zusätzlich belastet werden. Deshalb steht im Koalitionsvertrag der Satz:
In der Altenpflege sollen die Sachleistungen kontinuierlich an die Personalentwicklung angepasst werden.
Wir haben mit den Sozialdemokraten vereinbart, dass Veränderungen der Personalkosten bei den Pflegesachleistungen berücksichtigt werden müssen. Das heißt, die bessere Finanzierung wird zukünftig nicht auf dem Rücken der Pflegebedürftigen abgeladen;
sie erfolgt über die Kranken- und die Pflegeversicherung.
