Die Linke will nicht, dass es in Deutschland so kommt. Wir fordern Sie auf: Handeln Sie!
Ein weiterer Faktor für das Insektensterben ist übrigens die steigende Zahl der Monokulturen. Monokulturen zerstören Lebensräume für die Insekten und damit auch die natürlichen Fressfeinde. Es treten vermehrt Schädlinge auf. Die vielen Pestizide werden also auch wegen der Monokulturen gebraucht. Es ist ein kranker Kreislauf. Mit diesem kranken Kreislauf fahren Pestizidgroßhändler wie Monsanto ungestört ihre Milliardengewinne ein.
Es gibt aktuell sechs Konzerne, die den Markt kontrollieren – den von Pestiziden und vom Saatgut. Die Unternehmen verkaufen beides: erst die Pestizide und dann das passende Saatgut, das diese Pestizide überlebt. Man muss Jahr für Jahr neues Saatgut kaufen. So werden die Bauern in die totale Abhängigkeit getrieben. Es ist ein Milliardengeschäft auf Kosten der Menschen, auf Kosten der Natur, auf Kosten unseres gesamten Ökosystems. Wir müssen uns aus diesem Würgegriff der Giftmischer endlich befreien.
Die Linke fordert die Regierung auf, nicht länger vor den Konzerninteressen in die Knie zu gehen. Wir brauchen endlich eine Politik für die Bauern, für den Erhalt unserer natürlichen Lebensgrundlagen und für die Gesundheit der Menschen. Wir brauchen die Agrarwende. Die Pestizide einzudämmen, wäre ein Schritt in die richtige Richtung.
Vielen Dank.
Liebe Kollegin, ich bin sicher, dass Ihre Rede weder umsonst noch vergebens war. – Als nächster Redner hat der Kollege Artur Auernhammer von der CDU/CSU das Wort.
