Ich will zum Schluss kommen, liebe Frau Präsidentin. – Eine Umweltpolitik, die auf Verbote und Bevormundung der Menschen setzt, passt einfach nicht mehr in die Zeit. Flächendeckende Fahrverbote sind für uns kaltherzige Enteignungen. Die wird es mit uns nicht geben. Wir wollen keine blauen Plaketten. Wir wollen Innovation und Selbstbestimmung. Dafür kämpfen wir.
Und ich will, dass Sie jetzt wirklich zum Ende kommen.
Meine sehr geehrten Damen und Herren, das ist der Schluss meiner Rede. Wir beschließen den Tag, wie wir ihn heute begonnen haben, auf Initiative der AfD.
Ein Wort somit zur deutschen Sprache als Kulturgut. Meine sehr geehrten Damen und Herren aller im Parlament vertretenen Parteien, ein Zitat meines Freundes Peter:
Wer mit Fremdworten nicht konfekt ist, sollte nicht damit renovieren, ansonsten muss er die Konsonanten ziehen.
Vielen Dank.
Die Aktuelle Stunde ist beendet.
Wir sind am Schluss der heutigen Debatte angelangt. Ich wünsche Ihnen ein spannendes, erfolgreiches Wochenende – je nachdem, wie Erfolg bemessen wird.
Ich berufe die nächste Sitzung des Deutschen Bundestages auf Mittwoch, den 14. März 2018, 13 Uhr, ein.
Die Sitzung ist geschlossen.
17. Sitzung, Seite 1500 A: Die Zahl der für den Abgeordneten Dr. Reinhard Brandl abgegebenen Ja-Stimmen ist wie folgt zu lesen: 583
