Ja, gerne.
Bitte sehr.
Danke, Herr Präsident. – Danke, Herr Kollege Färber, dass Sie die Frage zulassen – Sie haben jetzt sehr auf den Ökolandbau abgezielt. Ich möchte Sie deshalb fragen, ob Sie mir zustimmen, dass wir eigentlich jetzt an einem Zeitpunkt angekommen sind, an dem es nicht mehr um gegenseitige Schuldzuweisungen geht und um die Frage, welche Landwirtschaft besser oder schlechter arbeitet, sondern darum, dass wir Lösungen brauchen. Deshalb haben wir sie aufgeschrieben.
Das haben wir aus genau dem Grund gemacht, den Sie gerade benannt haben, weil wir im Weinbau durchaus ein Problem haben, weil wir mehr Investitionsmittel in die Forschung stecken müssen und dass es unsere gesamtgesellschaftliche Aufgabe ist, das zu tun, dass wir nämlich genau hier die Alternativen anbieten möchten. Deshalb frage ich Sie nochmals: Stimmen Sie mir zu, dass es jetzt darum geht, Lösungen zu erarbeiten, und dass wir uns darum gemeinsam bemühen müssen?
Vielen Dank, lieber Herr Kollege Ebner. Wenn Sie mir noch ein bisschen zugehört hätten, dann wäre ich auf diesen Bereich noch zu sprechen gekommen; denn es geht in der Tat um eine Lösung für die Landwirtschaft insgesamt. Aber vielleicht lassen Sie mich meine Rede zu Ende bringen.
Ich gehe gerade auf Ihren Antrag ein. Ich weiß ja, dass Sie persönlich viele Dinge besser wissen, als es manchmal aus den Anträgen ersichtlich wird.
Mir liegt eben nur der Antrag vor, auf den ich jetzt eingehe und den Sie hier im Hause eingebracht haben.
Aber ich möchte, ohne auf der Ökolandwirtschaft herumtrampeln zu wollen, einfach ein paar Dinge sagen. Ein Beispiel ist die Verwendung von Pyrethrinen. Diese werden aus Chrysanthemenarten gewonnen, und sie werden auch im Bioanbau als Insektizide zur Schädlingsbekämpfung eingesetzt. Doch sie wirken auf alle Insektenarten neurotoxisch, auch auf Nützlinge.
Was mich an diesen Dingen besonders stört, ist, dass diese Chrysanthemen, die in Kenia und in Südamerika angebaut werden, eben nicht ökologisch angebaut werden, sondern dass Pestizide und Organophosphate für ihren Schutz eingesetzt werden. Das ist ein klassisches Beispiel dafür, wie man ein Problem nur ins Ausland verlagert. Wir können doch nicht hier sagen, wir arbeiten ökologisch, und dann die Produktionsmittel für diesen ökologischen Landbau in anderen Ländern erzeugen. Das ist alles andere als ökologisch.
