Dann haben Sie auch das Problem der fehlenden Sanktionsmöglichkeiten positiv gelöst. Bisher haben Sie es leider sträflich versäumt, zumindest Sanktionen bei der Nichterfüllung von Auflagen beim LTE-Ausbau festzulegen.
Man muss sich das einmal vorstellen: Sie haben den Netzbetreibern Auflagen gemacht. Aber Sie haben es versäumt, für die Nichterfüllung entsprechende Sanktionen festzulegen.
Das haben Sie damals nicht gemacht. Das müssen Sie sich einmal durch den Kopf gehen lassen! Das ist nicht nur dilettantisch, das ist hochgradig schädlich.
Ich werde überrascht sein, wenn Sie in diesem Punkt Ihrem Koalitionsvertrag folgen.
Legen Sie verbindliche quantifizierbare und nachprüfbare Meilensteine während des Aufbaus für die Erfüllung von Auflagen fest, statt erst am Ende eine einmalige Überprüfung ohne Konsequenzen vorzusehen.
Herr Kollege, kommen Sie langsam zum Ende.
Ich bin gleich fertig. – Vereinbaren Sie Auflagen, die die tatsächliche nutzbare Verfügbarkeit besonders in der Fläche sicherstellt. Nur so sind Smarthome, Smartcity und Smartfarming realisierbar.
Herr Kollege.
Beenden Sie endlich Ihre verhängnisvolle Negativstrategie bei der digitalen Agenda!
Vielen Dank, meine Damen und Herren, für Ihr Zuhören.
Als Nächstes redet die Kollegin Daniela Kluckert von der FDP-Fraktion.
