Wir als CDU/CSU-Fraktion verurteilen jede Form von Geschichtsverklärung, von Verharmlosung des politischen Extremismus. Der Umgang mit den Verbrechen des Nationalsozialismus ist eine Verantwortung, die wir Parlamentarier gemeinsam tragen sollten. Ich kann daher nicht verstehen, warum sich ausgerechnet die Kolleginnen und Kollegen der Linken kürzlich bei der Abstimmung über die Einsetzung des Antisemitismusbeauftragten hier im Deutschen Bundestag enthalten haben.
Sie hätten hier die Chance gehabt, ein überparteiliches Signal gegen Antisemitismus zu setzen. Aber die haben Sie nicht genutzt. Mit Ihrem Abstimmungsverhalten haben Sie gezeigt, dass Ihnen innerparteiliches Klein-Klein offenbar wichtiger ist, als gegen Antisemitismus vorzugehen.
Apropos Linkspartei: Als ostdeutscher Abgeordneter denkt man beim Thema Erinnerungskultur zwangsläufig immer auch an 40 Jahre SED-Diktatur, an über 200 000 politische Häftlinge der DDR sowie an die unzähligen Toten an der innerdeutschen Grenze.
Wer über Demokratie und Erinnerungskultur in Deutschland spricht, der muss immer über zwei deutsche Diktaturen sprechen.
Eine Verkürzung auf den Rechtsextremismus wird dieser Debatte im Übrigen auch nicht gerecht; denn laut den jüngsten Zahlen des Bundesamtes für Verfassungsschutz gab es im letzten Jahr mehr linksextreme als rechtsextreme Gewalttaten.
– Gewalttaten. Lesen Sie es nach. – Es muss daher unser aller Ziel sein, gemeinsam gegen Hetze und jede Form von Extremismus zu kämpfen.
Die Bundesregierung unterstützt diesen Kampf mit zahlreichen Programmen wie „Vielfalt tut gut“, „Toleranz fördern – Kompetenz stärken“ oder die „Initiative Demokratie stärken“. Für uns als CDU/CSU-Fraktion ist klar, dass solche Programme nicht dazu missbraucht werden dürfen, um antidemokratische Gruppierungen zu finanzieren. Aus diesem Grund haben wir 2011 die sogenannte Extremismusklausel eingeführt. Damit mussten sich Personen und Organisationen zur freiheitlich-demokratischen Grundordnung bekennen und zusichern, dass sie nicht mit antidemokratischen Kräften kooperieren – an sich eine Selbstverständlichkeit, aber offenbar nicht für Ex-Familienministerin Schwesig; denn aufgrund ihrer Initiative wurde diese Klausel 2014 wieder abgeschafft.
Liebe Genossinnen und Genossen der SPD, ist die Unterstützung von Linksextremisten wirklich so unverzichtbar für Ihre politische Präventionsarbeit?
Ich wünsche mir, dass künftige Debatten zur deutschen Erinnerungskultur weder ideologisch noch einseitig verkürzt geführt werden;
