– Genau. – Um Amtsdeutsch kann es ihr nicht gehen; denn das ist bereits gesetzlich verankert. Ihr geht es um völkisches Deutsch, um Sprache als Mittel zur Ausgrenzung.
Was soll dann bitte konkret folgen? Die Einsetzung einer Reichs- – Pardon, einer Bundeskulturkammer? Die entscheidende Frage lautet nicht, welche Sprache man spricht, sondern, was man sagt und was man wieder sagbar macht. Da ist die AfD Vorreiter.
Seit Jahren arbeitet sie daran, Unsägliches wieder sagbar zu machen. Da wird völkisch schwadroniert, was das Zeug hält.
An einer Stelle wird die Vorlage sogar ein bisschen konkret. Die AfD will der Freiheit der Programmgestaltung des öffentlich-rechtlichen Rundfunks ans Leder.
Da soll reguliert werden – im Sinne der AfD, versteht sich. Vielen Dank auch!
Es ist schon ein starkes Stück, dass ausgerechnet diese Partei, die Sprache vor allem nutzt, um Hass zu säen,
um den gesellschaftlichen Diskurs zu sabotieren, um auszugrenzen und anzugreifen, um Frauen zu beleidigen, um Homosexuelle verächtlich zu machen, um Zugewanderte zu diffamieren, um politische Gegner niederzubrüllen und anzupöbeln, Sprache als Kulturgut im Grundgesetz verankern will. Unfassbar!
Wenn etwas im Grundgesetz fehlt, dann ist es Kultur als Staatsziel, und zwar Kultur in all ihrer Buntheit.
Frau Kollegin, achten Sie bitte auf Ihre Redezeit; sie ist schon abgelaufen.
Danke. Ich bin im Prinzip fertig.
Lassen Sie mich mit Heinrich Heine schließen:
Fatal ist mir das Lumpenpack, das, um die Herzen zu rühren, den Patriotismus trägt zur Schau, mit allen seinen Geschwüren.
