Zum Abschluss noch eins, Herr Kauder. Man könnte noch zu vielen Dingen etwas sagen. Zu Europa müsste man dringend etwas sagen. Hören Sie endlich auf, Macrons Vorschläge immer als Transferunion zu diffamieren!
Herr Kauder, man müsste auch dringend etwas zu dem sagen, was Sie zur NATO, zu Afrin und zur Türkei gesagt haben. Verdammt noch mal: Sie haben ja recht. Aber was macht diese Bundesregierung? Dann muss diese Bundesregierung endlich einmal den NATO-Rat anrufen, anstatt in einer Tour weiter Waffen dorthin zu liefern.
Sie sagen hier das Richtige, und das Gegenteil wird von Ihrer Bundesregierung gemacht. Daher erwarte ich von Ihnen als Regierungsfraktionen, dass Sie sich durchsetzen.
Deshalb zum Abschluss nur eines: In den ersten Wochen hat man erkennen können, dass die Koalitionsfraktionen und ‑parteien vor allem mit sich selbst beschäftigt sind: Herr Spahn gegen Annegret Kramp-Karrenbauer; Frau Nahles und die SPD waren sowieso mit sich selbst beschäftigt. Bei der CSU gibt es einen Wettbewerb zwischen Seehofer und Söder, wer am weitesten nach rechts ausschlägt. Hören Sie damit auf; denn wir brauchen dringend eine Regierung, die die großen Probleme dieses Landes anpackt. Tun Sie das! Das wünsche ich mir nicht nur als Opposition, das wünsche ich mir vor allem als Bürger dieses Landes.
Vielen Dank.
Ich rufe für die SPD-Fraktion den Kollegen Christian Petry auf.
