Fazit: Die bisherigen Vorschläge zur „Wohnraumbremse“ sind zum Scheitern verurteilt. Milliarden in den objektbezogenen sozialen Wohnungsbau zu stecken, ist unsinnig. Das zeigt der bürokratische Aufwand, das dokumentiert die aktuelle Fehlbelegungsquote von geschätzten 54 Prozent, und das manifestiert sich in der immer größeren Anzahl von Anspruchsberechtigten durch die kontinuierliche Anhebung der Einkommensgrenzen und die mangelnde Verlaufskontrolle. Vielmehr benötigen wir eine intelligente, personenbezogene Förderung des sozialen Wohnungsbaus. Das alte Modell taugt bestenfalls zur Linderung des größten Mangels bei fehlenden Investoren. Im Grunde stammt es aus der Klamottenkiste sozialistischer Planwirtschaft.
Vor langer Zeit war der Wohnungsmangel in Deutschland schon einmal ähnlich groß. Doch da gab es in der Bundesrepublik Deutschland ein Wirtschaftsmodell, das unser Land generell wieder aufblühen ließ. Vor allem entstanden überall neue Wohnungen. Dieses Modell, meine sehr geehrten Damen und Herren, nannte man soziale Marktwirtschaft.
Der Wohnungsmarkt wurde liberal gestaltet. Ohne „Wohnraumbremse“ wurden Investoren animiert, Wohnraum aller Art zu erstellen – eben auch preiswerten. Die Politik gab den Markt frei, und das zahlte sich aus. Dennoch herrschte kein blindwütiger Neoliberalismus oder inhumaner Kapitalismus; denn der Staat half den sozial Schwachen. Sie konnten ihr Grundrecht auf Wohnen verwirklichen. Die AfD fordert daher, zu diesem Modell der sozialen Marktwirtschaft zurückzukehren.
Wir fordern die Befreiung des Wohnungsmarktes von der „Wohnraumbremse“ und die Unterstützung der sozial Schwachen durch ein angemessenes und kontinuierlich anzupassendes Wohngeld. Das, was wir in den letzten 20 Jahren – auch im Wohnungsbau – erlebt haben, ist der reine Ökosozialismus. Die jetzt geforderte Entbürokratisierung löst nicht alle Probleme, aber sie hilft und ist ein Schritt in die richtige Richtung. Deswegen unterstützen wir die Überweisung an den Ausschuss.
Vielen Dank.
Für die Fraktion der SPD spricht jetzt die Abgeordnete Ulli Nissen.
