Wenn selbst der Energiewendestaatssekretär Rainer Baake,
der viel Geduld mit Verschleppungen bewiesen hat, nun unter Protest das Wirtschaftsministerium verlässt,
dann ist die Frage berechtigt, wer sich denn jetzt noch für Klimaschutz zuständig fühlt.
Okay, Sie. Aber wie? Mit welcher Prioritätensetzung? Sie haben nach Amtsantritt sehr schnell von Industriepolitik geredet, die in Ihrem Ministerium irgendwie mit Umweltpolitik versöhnt werden müsse. Ich dachte: Auweia, jetzt ist der SPD-interne Konflikt der letzten Legislatur zwischen Industriepolitik im Wirtschaftsministerium und Umweltpolitik im Umweltministerium in einer Person zusammengeführt.
Nun haben Sie heute von sozialökologischer Industriepolitik geredet. Allerdings meinen Sie, sie gebe es schon. Das kann ich für die zwölf Jahre, die ich Mitglied im Deutschen Bundestag bin, nicht bestätigen. Eine ökologische Industriepolitik hat gerade Ihre Gewerkschaft, die IG BCE, an vielen Stellen verhindert. Die grüne Frage ist in der Tat auch eine rote Frage, aber gerade als grüne Frage ist sie noch lange nicht beantwortet.
Der Koalitionsvertrag spricht von der umfassenden Bekämpfung des Insektensterbens, und Sie haben das Aktionsprogramm Insektenschutz genannt. Das heißt genau was? Weiß das irgendjemand in der Regierung? Ich vermute, nein. Aber jeder wird wissen, dass Insektenschutz nicht ohne eine Veränderung der Praxis in der Landwirtschaft zu haben sein wird.
An den Widerstand des Landwirtschaftsministeriums, wenn es um die Begrenzung von Stickstoffeinträgen, von Neonicotinoiden, von Glyphosat oder darum geht, dass nicht länger zu viele Tiere auf zu wenig Fläche sein dürfen, erinnern sich viele von uns. Leider hat sich der Blick von vorgestern auf die Probleme von heute und morgen immer wieder durchgesetzt. Deswegen sind wir bei diesen Themen keinen Schritt weiter.
Ähnlich ist es beim Thema Luftreinhaltung. Im Konflikt zwischen menschlicher Gesundheit und Wirtschaftsinteressen hat sich die alte Bundesregierung auf die Seite der Industrie gestellt. Der neue Verkehrsminister setzt diese Linie fort; das wundert nicht wirklich. Ich will Ihnen ganz klar sagen: Das Kapitel „Umwelt und Gesundheit“ im Koalitionsvertrag und die darin vorgesehene Weiterentwicklung eines Aktionsprogramms Umwelt und Gesundheit können Sie schreddern – das ist für die Füße –, wenn Sie es nicht fertigbringen, im Dieselkonflikt ganz klar die Priorität „menschliche Gesundheit“ zu setzen.
Lassen Sie mich der Ministerin noch ein Versprechen mitgeben. Frau Ministerin Schulze, wenn Sie sich entsprechend Ihrer Vorstellungsrede
in Ihrem neuen Amt klar für den Erhalt unserer natürlichen Lebensgrundlagen positionieren, wenn es Ihnen gelingt, die dafür notwendigen Maßnahmen in die parlamentarische Beratung zu bringen, dann haben Sie unsere volle Unterstützung. Wenn Sie stattdessen Teil der Ignoranz gegenüber umweltpolitischen Belangen werden, wie wir sie gestern und heute beim Wirtschafts-, Verkehrs- und Landwirtschaftsministerium wieder realisieren mussten, dann stoßen Sie auf unseren erbitterten Widerstand.
Für die SPD-Fraktion erteile ich das Wort dem Kollegen Carsten Träger.
