Herr Präsident! Liebe Kolleginnen und Kollegen! Liebe Zuschauer und vor allen Dingen – heute ist Zukunftstag! – auch liebe junge Menschen, darunter drei aus meinem Wahlkreis, die dieser Debatte entsprechend folgen. Hier geht es nämlich um eure Zukunft. Hier geht es um das, was wir machen wollen, damit die berufliche Bildung, die wir heute auf der Basis des Berufsbildungsberichtes debattieren, auch weiterhin kraftvoll ausgestattet ist. Viele bezeichnen sie als Exportschlager, und was wir an der beruflichen Bildung haben, sieht man mitunter, wenn man aus dem Ausland zurückschaut. Ich habe mich gerade letzte Woche in Serbien über die Einführung der beruflichen Bildung informiert, die es dort seit letztem Jahr gibt. Angesichts der Jugendarbeitslosigkeit, der Passungsprobleme und dergleichen mehr, mit denen außerhalb eines solchen Systems gekämpft wird, weiß man, was man an diesem System hat.
Insofern zeigt der Berufsbildungsbericht auch die Qualitäten auf. Einiges wurde schon angesprochen. Das Angebot übersteigt die Nachfrage. 523 000 Ausbildungsverträge sind ein sehr positives Zeichen, dass dieses Produkt entsprechend am Markt ankommt. Die Zahl der Ausbildungsbetriebe bleibt konstant, und trotz des Rückgangs der Zahl der Schulabgänger wird die duale Ausbildung eher mehr als weniger nachgefragt. Wir haben in der vergangenen Legislaturperiode dieses Produkt auch gepflegt. Wir haben die Berufsbildungsketten bis zum Abschluss gestärkt. Wir haben die Potenzialanalysen eingeführt bzw. gestärkt.
An dieser Stelle möchte ich anmerken: Bei aller Liebe, Rainer, es gibt keine Menschen ohne Talente. Wir müssen sie nur finden; das ist das Entscheidende.
Wir haben die überbetrieblichen Ausbildungsstätten gestärkt. Die Allianz für Aus- und Weiterbildung stand die letzten drei Jahre und steht auch in dieser Legislaturperiode auf der Agenda.
Es ist aber auch richtig: In diesem Bericht stehen auch einige Dinge, die nachdenklich stimmen und es notwendig machen, dass wir dieses Produkt, diesen Exportschlager, weiterentwickeln.
Ich nenne die Passungsprobleme. Es gibt 49 000 unbesetzte und 24 000 nicht vermittelte Kräfte.
