Danke, Herr Präsident. – Meine sehr verehrten Damen und Herren! Liebe Kolleginnen und Kollegen! Wenn wir heute Morgen über Demokratie sprechen, dann können wir ruhig erst einmal sagen: Wir sind froh, dass wir sie haben. Wir dürfen nicht müde werden, sie zu schützen und sie lebendig zu gestalten.
Diese Demokratie ist wahrlich nicht vom Himmel gefallen. Hier sind wir vielen zu Dank verpflichtet. Sie muss immer wieder neu eingeübt werden. Ich habe gestern mit Erzieherinnen und Erziehern einer Kindertagesstätte gesprochen. Dort wird jede Woche eine Kinderkonferenz veranstaltet. Schon die Kleinsten dürfen ihre Themen einbringen und zu bestimmten Fragen, die sie betreffen, entscheiden. Ich finde das großartig, und ich will die Gelegenheit nutzen, allen zu danken, die politische Bildung im Großen, aber auch im Kleinen machen und dafür sorgen, dass unsere Demokratie weitergetragen wird.
Der vorliegende Antrag beschäftigt sich nur mit einem Ausschnitt, nämlich mit der direkten Demokratie. Ich bin für die direkte Demokratie und sehe auch, dass wir Baustellen haben. Aber ich glaube, wir müssen dieses Thema ein bisschen weiter fassen.
Wir haben ein System einer repräsentativen Demokratie, das seit vielen Jahren für Stabilität in diesem Land gesorgt hat.
Repräsentativität bedeutet, dass wir hier abbilden sollen, was draußen im Land ist.
Jetzt frage ich uns einmal: Gelingt uns das denn?
