Frau Präsidentin! Meine Damen und Herren! Liebe Kolleginnen und Kollegen der FDP, Ihr Gesetzentwurf erinnert mich stark an das Jahr 2009. Die FDP hatte damals ganz schnell mit der CDU/CSU die sogenannte Mövenpick-Steuer durchgeboxt
und damit vielen Hoteliers durch eine drastische Senkung der Umsatzsteuer ein richtig tolles Geschenk gemacht.
Wenig später kam dann aber heraus, dass die FDP durch großzügige Spenden in Millionenhöhe des Besitzers der Mövenpick-Hotelkette, August von Finck, wohl dazu motiviert wurde.
Aus der FDP wurde die Mövenpick-Partei.
Offensichtlich ist sie es geblieben. Denn auch heute greift die FDP mit ihrem Gesetzentwurf wieder die heftigen Wünsche ihrer Klientel aus dem Hotel- und Gaststättengewerbe auf.
Doch diesmal wird es kein grünes Licht geben; denn Sie, liebe Kolleginnen und Kollegen der FDP, sind ja nicht in Regierungsverantwortung und können Ihre Gesetzesvorhaben somit nicht umsetzen.
Das haben Sie vermasselt. Pech für Ihre Klientel. Glück für die Millionen Arbeitnehmerinnen und Arbeitnehmer!
Frau Kollegin, erlauben Sie eine Zwischenfrage?
Nein, das möchte ich nicht.
Denn was hätte die Gesetzesänderung der FDP zur Folge, meine Damen und Herren? Die in unserem Arbeitszeitgesetz festgelegte tägliche Höchstarbeitszeit soll durch eine wöchentliche Arbeitszeit von durchschnittlich 48 Stunden ersetzt werden. Maßgeblich ist dann lediglich die Ruhezeit von elf Stunden zwischen zwei Arbeitseinsätzen. Wer rechnen kann, weiß: Elf Stunden Ruhezeit bedeuten 13 Stunden Arbeit abzüglich der Pausen. Multipliziert mit sechs Arbeitstagen kommt man schließlich auf bis zu 78 Stunden in der Woche.
