Sehr geehrter Herr Präsident! Sehr geehrte Abgeordnete, zumindest die, die noch da sind!
Frau Bundesministerin, Ihre Erklärung und die der neuen, alten, inzwischen gar nicht mehr so großen Koalition ist geprägt von einer ideologisch verzerrten Wahrnehmung der Realität. Das gilt auch für Ihre Haltung zur syrischen Regierung. Sie haben gestern und vorgestern keine Gelegenheit ausgelassen, den Überlebenskampf einer multireligiösen, multikulturellen, säkularen syrischen Gesellschaft gegenüber einer extremistischen, theokratischen Sklavenhalterideologie anzuprangern. Ganz anders verhielt es sich, als die Assad-Regierung in Übereinstimmung mit Ihrem ideologischen Klimakatechismus im November 2017 die Ratifizierung des Pariser Klimaabkommens angekündigt hatte. Da war Ihnen dieses Regime plötzlich gar nicht mehr so unrecht; denn mit diesem Argument konnten Sie nun die Trump-Administration als alleinigen Apostat in der Klimafrage brandmarken.
Wir sind kalendarisch in dieser Woche in den Frühling eingestiegen. In Bayern wurde der kälteste Frühlingsbeginn seit mindestens 138 Jahren, wenn nicht sogar seit Beginn der Aufzeichnungen, dokumentiert; aber das nur am Rande.
Vorgestern hat sich der neue Bundesaußenminister, der jetzt leider nicht da ist, geäußert – ich zitiere ihn –: Ziel ist die „Freiheit der Wissenschaft“. – Schöne, hehre Worte. Aber wie frei ist die Wissenschaft in unserem Land denn wirklich?
Vor circa vier Wochen fand in der Bremer Landesvertretung der parlamentarische Abend der Meeresforschung statt. Unter anderem sprach dort Professor Latif, einer der Hohepriester in der Klimareligion, über die Gefahr eines Erliegens des Golfstroms und darüber, welche furchtbaren Auswirkungen dies haben könnte. Bemerkenswert war, dass wirklich jedes beobachtete und dokumentierte Phänomen krampfhaft mit dem Klimawandel in Verbindung gebracht werden musste.
Zu wenige Fische: der Klimawandel. – Zu viele Fische: der Klimawandel. – Zu warm: Klimawandel. – Zu kalt: Klimawandel. – Zu salzig: Klimawandel. – Nicht salzig genug: Klimawandel. – Klimawandel, Klimawandel, Klimawandel.
