Die nächste Zukunftsfrage ist das Thema Hartz IV, das die Kollegin Kipping schon angesprochen hat. Was ist eigentlich von dem Teil unseres Systems der sozialen Sicherung zu halten, das ein menschenwürdiges Existenzminimum sicherstellen soll, von den Betroffenen aber vielfach als mangelhaft und von den Beschäftigten als Bedrohung empfunden wird? Da müssen wir uns nichts vormachen. Ich will die Arbeit der Mitarbeiterinnen und Mitarbeiter in den Jobcentern nicht schlechtmachen, aber: Wer beschäftigt ist, arbeitslos zu werden droht und vielleicht vor Augen hat, in den Bezug von Arbeitslosengeld II zu kommen, hat im Moment nicht das Grundgefühl: „Super, ich komme jetzt in eine Struktur, die mich auffängt, unterstützt und motiviert“, sondern hat Angst. Auf diese wirklich krasse Kluft zwischen dem, was der Gesetzgeber mit der Grundsicherung für Arbeitsuchende früher einmal angestrebt hat, und dem, was in weiten Teilen der Bevölkerung wahrgenommen wird, gibt der Koalitionsvertrag keine Antwort – keine einzige!
Dabei zeigt die jüngste Debatte um Hartz IV, wie dringend notwendig eine grundsätzliche Debatte über die Wirklichkeit der Arbeitsförderung und der Existenzsicherung wäre. Wir müssen uns fragen: Wie gestalten wir Absicherung so, dass sie Menschen ermutigt, motiviert, dass sie zusätzliche Anreize schafft? Wie erreichen wir das Ziel einer individuellen und sanktionsfreien Grundsicherung? Das ist die Debatte der Zeit, und die werden wir als Grüne führen.
Am Ende möchte ich durchaus persönlich etwas sagen, weil mich das, was man in den vergangenen Tagen erleben musste, ein bisschen betroffen gemacht hat, aber vor allem auch sehr geärgert hat. Es bringt überhaupt nichts, arme Geringverdiener gegen arbeitslose Arme auszuspielen und gegeneinander in Stellung zu bringen.
Und ich halte auch überhaupt nichts davon, Arme mit deutschem Pass gegen Arme mit nichtdeutscher Nationalität auszuspielen und gegeneinander in Stellung zu bringen. Das ist eine fruchtlose Debatte.
Das bringt keinem der Betroffenen etwas. Was hat denn die alleinerziehende Mutter, die mit einem Teilzeitjob versucht, irgendwie über die Runden zu kommen, davon, wenn Jens Spahn so durch die öffentliche Debatte marodiert? Ich habe manchmal eher das Gefühl, dass sich einige von ihrem eigenen Nichtstun entlasten wollen und dann lieber solche Dinge anzetteln.
Wir sollten uns lieber darum bemühen, der Würde derjenigen, die meist ungewollt in solche Situationen von Abhängigkeit geraten sind, gerecht zu werden. Das wäre unser Job.
Danke schön.
Vielen Dank, Herr Kollege Kurth. – Als Nächstes für die SPD die Kollegin Katja Mast. Da ich es unfair fände, Sie nur eine Minute zu genießen, haben Sie jetzt zwei Minuten, Frau Mast.
