Die komplizierte Realität ist Ihnen fern. Sie verwechseln besonders gerne Ursache und Wirkung, Herr Hofreiter. Das ist der Klassiker der links-grünen Hypermoral.
Die Gewalttaten islamischer Gruppen werden von Ihnen verschwiegen oder verharmlost, so eben auch in Myanmar. Im Namen des Islam darf man offenbar Menschen umbringen, ohne dass sich die Altparteien darüber beklagen.
Einzelne Fakten zur Lage in Myanmar – früher Burma oder Birma – sind unbestritten. Die Menschen im Grenzbereich von Bangladesch und Myanmar müssen in den letzten Jahren mit zunehmender Gewalt leben. Hunderttausende sammeln sich in Flüchtlingscamps. Das birmanische Militär geht hart gegen vermutete oder tatsächliche Rebellen vor. Unbestritten sind aber auch die paramilitärischen Angriffe islamischer Terroristen. Humanitäre Hilfe für die Menschen in den Flüchtlingslagern sollte für uns im Vordergrund stehen.
Dabei muss auch Bangladesch in die Pflicht genommen werden. Das Land verweigert die Integration seiner Migranten.
Hans-Bernd Zöllner, einer der größten Kenner der Region, warnt vor Ihrer einseitigen Sichtweise. Muslimische Rebellen attackieren buddhistische Sicherheitskräfte, das Militär schlägt zurück; das ist die Kernaussage. Ich kann die Ministerpräsidentin gut verstehen. Was ist daran falsch, dass die Ministerpräsidentin von Myanmar anders handelt als die Bundesregierung?
Wollen Sie dem birmanischen Volk vorschreiben, dass der Islam zu Myanmar gehört? Dann sagen Sie es bitte, und schwurbeln Sie nicht lange herum.
Wer benutzt den Kampfbegriff „Rohingya“ am lautesten? Ataullah Jununi, der unbestrittene Anführer der Moslemrebellen. Er ist in Pakistan geboren, in Mekka radikalisiert. Militärisch ausgebildet zettelte er einen Bürgerkrieg an, um im buddhistischen Myanmar einen islamischen Staat zu errichten.
Spender aus Saudi-Arabien und von anderswo sollen den Feldzug finanzieren. Das sind offenbar Ihre Freunde, verehrte Politiker der Altparteien.
Kann es sein, dass Ihnen einmal wieder der links-grüne Mief Ihren Blick auf die Realität in der Welt vernebelt?
Kann es sein, dass die Ministerpräsidentin von Myanmar besser weiß, was für ihr Land richtig ist, als wir hier im fernen Berlin?
Kann es sein, dass Aung San Suu Kyi es besser weiß als Andrea Nahles und Angela Merkel?
