dann spielen wir genau denen in die Hände, die Nationalismus und Abschottung predigen.
Darauf gibt es eine Antwort. Dafür gibt es Instrumente. Sie müssten sie nur endlich nutzen. Die Instrumente wären, faire Handelsverträge zu gestalten:
faire Handelsverträge mit effektiven Regeln zur Bekämpfung von Steuerflucht, zur Regulierung der Finanzmärkte und mit Maßnahmen zum Schutz von Menschenrechten, Abkommen, die endlich der Umsetzung des Pariser Klimavertrages dienen, und Abkommen, die regeln, unter welchen ökologischen und sozialen Standards Produkte hergestellt werden müssen, die hier auf den Märkten verkauft werden.
Das alles können Sie regeln. Das alles sind die Instrumente, die Sie haben, um die Globalisierung gerecht zu gestalten. Dafür hätten Sie unsere Unterstützung.
Ich sage Ihnen – ich meine das wirklich ernst –: Die einzige vernünftige Antwort, die Sie gegen die Nationalisten dieser Welt geben können, ist, die Globalisierung endlich gerecht zu gestalten.
Vielen Dank, Katharina Dröge.
