Herr Präsident! Meine Damen und Herren! Liebe Kolleginnen und Kollegen! Um meinen geschätzten Koalitionspartner schon einmal in Wallungen zu bringen, will ich vorweg sagen: Es ist ja nicht unbekannt, dass die SPD für die Bürgerversicherung ist.
Wir müssten uns über den Antrag der Linken nicht unterhalten, wenn wir ein gemeinsames Versicherungssystem hätten. Das ist Fakt. Die Probleme, die wir hier diskutieren, die auch die Linke in ihrem Antrag anspricht, resultieren aus diesen zwei unterschiedlichen Systemen, die nebeneinander existieren und unterschiedliche Voraussetzungen haben.
Man muss das noch einmal erklären: Man kann ja aus ideologischen Gründen gegen eine Bürgerversicherung sein.
– Ich wusste, dass ich Sie damit kriege. – Trotzdem möchte ich auf das Thema, das hier zur Debatte steht, eingehen. Die Beamten haben – das wurde hier gerade angesprochen – ein Wahlrecht. Es ist aber kein echtes Wahlrecht. Ein Beamter kann zwar entscheiden, ob er in die gesetzliche oder in die private Krankenversicherung geht. Wir müssen uns aber fragen: Wer geht denn in die gesetzliche Krankenversicherung? Das sind diejenigen, die vielleicht viele Kinder, eine Behinderung oder schon schwere Erkrankungen haben. Für sie würde es sonst richtig teuer.
Eines ist doch klar: Wir haben unterschiedliche Voraussetzungen in den beiden Systemen. Bei der gesetzlichen Krankenversicherung spielt das Einkommen zwar bis zu einer gewissen Grenze eine Rolle, Erkrankungen spielen aber keine Rolle, weil das Solidaritätsprinzip zugrunde liegt. In der privaten Krankenversicherung wird es im Alter richtig teuer bzw. wenn ich Erkrankungen habe. Deshalb ist es für Beamte am Anfang ihrer Laufbahn schwierig, eine echte Wahl zu treffen. Sie werden quasi in die private Krankenversicherung gedrängt, auch wenn sie krank sind oder Behinderungen haben. Zudem werden sie noch bestraft, weil sie den Beitrag in der PKV komplett alleine bezahlen müssen. Das ist doch das Thema, um das es hier eigentlich geht.
Deshalb lohnt es sich, im Ausschuss einmal darüber zu reden, ob das gerechtfertigt ist und ob – wenn man auf einer Wahlfreiheit besteht – das eine echte Wahlfreiheit ist.
Die SPD sagt: Man kann das auch ganz anders regeln, nämlich indem man eine Bürgerversicherung einführt.
Gerade ist vom Hamburger Modell die Rede gewesen. Ich finde, das ist ein erster richtiger Weg. Die Regelungen sollen zum 1. August 2018 in Kraft treten. Hier wird den Beamten – übrigens zu Beginn der Laufbahn, nicht einfach so zwischendurch – zumindest angeboten, dass sie die monatliche Pauschale in Anspruch nehmen können. Ich weiß nicht, ob das verfassungswidrig ist. Ich bin keine Juristin. Es ist aber eine freiwillige Entscheidung, wenn man diese Pauschale annimmt. Ich finde es richtig, diese Entscheidungsmöglichkeit zu bieten. Vielleicht sollten wir erst einmal abwarten, wie dieses Modell funktioniert, und es nicht schon jetzt in Bausch und Bogen kaputtreden. Auch diejenigen, die jetzt schon in der GKV sind und ihre Beiträge alleine zahlen, bekommen diesen Zuschuss bzw. diese Pauschale. Das ist ein richtiger Schritt.
