Im Oktober wird die Antarktis-Kommission sich mit dem Thema „Unterschutzstellung des Weddellmeeres in der Antarktis“ beschäftigen. Wir haben dazu in den letzten Jahren mit unseren Forschungsmöglichkeiten, insbesondere mit unseren Forschungsschiffen, die entsprechenden wissenschaftlichen Grundlagen gelegt. Ich glaube, wir sollten als Deutscher Bundestag in einem interministeriellen Antrag die Bemühungen der Bundesregierung, die in dieser Kommission mitarbeitet, unterstützen, weil es wichtig ist, dass Teile des Weddellmeeres unter Schutz gestellt werden.
Ich freue mich da auf eine gute Zusammenarbeit.
Abschließend muss ich als Lausitzer natürlich etwas zu dem Thema Kohleausstieg sagen. Dass wir dieses Thema in der Kommission diskutieren werden und diskutieren müssen, ist ganz klar, aber ich warne davor, nur die Arbeitsplätze zu subsumieren. Ich warne davor, nur auf die Versorgungssicherheit und die preiswerte Energie abzustellen. Das hat natürlich erste Priorität. Aber es sind auch andere Fragen zu berücksichtigen. Ich habe das schon einmal in der vergangenen Legislaturperiode angesprochen, wurde dafür aber kritisiert. Woher kommen 6 Millionen Tonnen Gips, wenn die REA-Anlagen nicht mehr laufen? Wo lassen die Städte Berlin, Dresden und Chemnitz die jährlich 800 000 Tonnen konditionierte Abfälle, die sie in den Kraftwerken mitverbrennen lassen? Brauchen wir neue Müllverbrennungsanlagen? Vielleicht war es in Berlin eine kluge Entscheidung, das Tempelhofer Feld nicht zu bebauen. Da wäre ja ausreichend Platz.
Aber es spielen noch andere Fragen eine Rolle. Die sollten wir wirklich konstruktiv diskutieren, im Interesse der drei Kohleregionen. Ich freue mich da auch auf Ihre Unterstützung, Frau Ministerin.
Herzlichen Dank für die Aufmerksamkeit.
Vielen Dank. – Weitere Wortmeldungen zu diesem Bereich liegen nicht vor.
