Die Bezeichnung „Abbrecherquote“ ist nicht richtig; das möchte ich hier noch einmal wiederholen. Es handelt sich oft um aufgelöste Ausbildungsverhältnisse, die teilweise in anderen Zusammenhängen fortgeführt werden.
Eben fiel das Wort „klischeefrei“. Es geht, glaube ich, nicht darum, dass die Beratung klischeefrei stattfinden sollte. Wenn man sich die Top-Ten-Liste der Berufe mit Abbrüchen anschaut, dann stellt man fest, dass der Beruf des Kochs mit 48 Prozent bereits auf Platz zwei liegt. Der Beruf des Kochs, so schön und inspirierend er ist, hat nichts mit den Challenges von „The Taste“ oder vergleichbaren Sendungen zu tun. Das heißt, man sollte sich auch hier anschauen, inwieweit Klischees, die in anderen Bereichen, zum Beispiel in Fernsehserien, vermittelt werden, hinterher dazu führen, dass Auszubildende auf dem harten Boden der Realität aufschlagen.
Ein weiterer Punkt, der schon angesprochen wurde, ist der Rückgang der Zahl ausbildender Kleinstbetriebe. Um eine Zahl zu nennen: Ihr Anteil ist um 0,2 Prozentpunkte zurückgegangen, zum ersten Mal auf unter 20 Prozent, aber nur um 0,2 Prozentpunkte. Dennoch ist das ein wichtiger Punkt. Warum? Stichwort „Digitalisierung“.
Wenn man nachfragt, warum sich Kleinstbetriebe aus der Ausbildung verabschieden – ich mag es sehr, wenn man mit den Leuten spricht, die sich auskennen –, dann hört man zum Beispiel: Wir haben zwei, drei Jahre ausgeschrieben, haben aber keine Bewerber bekommen. Deswegen hören wir jetzt auf. – Oder für einen Kleinstbetrieb mit Meister, Geselle und vielleicht einer Bürokraft ist unter Umständen Ausbildung nicht ohne Weiteres zu stemmen. Insofern müssen wir genau an dieser Stelle ansetzen.
Wenn man sich außerdem anschaut, warum sich junge Menschen nicht öfter um eine betriebliche Ausbildung in Kleinstbetrieben bewerben, kommt man zu dem Schluss: Nach 13 Jahren Kuscheln mit den Mitschülern ist es mitunter angenehmer, mit den Kommilitonen weiterzukuscheln, als in einem Betrieb auf einmal ganz alleine zu sein. Es gibt wunderbare Beispiele dafür, wie sich Kleinbetriebe zusammenschließen – in meinem Wahlkreis gibt es zum Beispiel im Bereich der Lagerlogistik ein solches Beispiel – und eine überbetriebliche Gruppe von Auszubildenden schaffen, die in den einzelnen Betrieben unterschiedliche Techniken kennenlernen. Gerade da müssen wir ansetzen.
– Sowieso!
