Was heißt das? Die Mittel, die ich für das Arbeitslosengeld II ausgebe, kann ich nehmen, um den Weg in Arbeit zu finanzieren. Ich finde, wir haben im Koalitionsvertrag miteinander eine tolle Vereinbarung getroffen, um unser Vorhaben anzugehen, denen, die es am Arbeitsmarkt am schwersten haben, den Weg in Arbeit zu ebnen.
Ich will noch ein kurzes Wort zu der sogenannten Hartz-IV-Debatte sagen. Verehrte Kolleginnen und Kollegen, es kann doch nicht in erster Linie darum gehen, ob der Regelsatz zu hoch oder zu niedrig ist. Das ist doch nicht die erste Frage, sondern die erste Frage lautet: Wie komme ich raus aus Hartz IV und Arbeitslosengeld II? Das wollen wir organisieren.
Verehrte Kolleginnen und Kollegen, in der Tat ist eine unserer wichtigsten Aufgaben, unsere Alterssicherung auf sichere Füße zu stellen. Verehrter Kollege Vogel, die typische FDP-Rede ist, es würde zulasten der jungen Generation gehen.
Der Kollege Gröhe hat schon gesagt: Generationengerechtigkeit heißt, ich muss auf beide – auf die Älteren wie auf die Jungen – schauen.
Uns war wichtig, etwas Ehrgeizigeres festzulegen als das, was heute im Gesetz steht, nämlich dass der Beitragssatz für die Jüngeren bis zum Jahr 2025 nicht über 20 Prozent steigen darf.
Andererseits helfen wir zielgerichtet denen, die es besonders schwer haben. Ein wichtiger Punkt ist zum Beispiel, dass wir die Erwerbsminderungsrente verbessern wollen. Wer aufgrund einer Krankheit oder eines Unfalls nicht mehr arbeiten kann, nicht mehr für das Alter vorsorgen kann – auch nicht privat –, der verdient die Hilfe des Sozialstaates. Es ist richtig, die Erwerbsminderungsrente für diese Menschen deutlich zu verbessern.
Angesichts der Zuwächse im Bereich der Grundsicherung sehen wir, dass viele Leute dabei sind, die überhaupt keinen Anspruch an die Rentenversicherung haben.
Es ist ebenso notwendig, eine verpflichtende Altersvorsorge für Selbstständige in Deutschland einzuführen. Jeder muss dann, wenn er Geld verdient, etwas auf die Seite legen können, um im Alter davon leben zu können. Es ist höchste Zeit für eine verpflichtende Altersvorsorge für Selbstständige. Wir haben sie in dieser Koalition miteinander vereinbart.
Es ist doch so: Die 18,6 Prozent Rentenversicherungsbeitrag, die wir seit 1. Januar dieses Jahres haben, sind ein historisch niedriger Beitrag, der nur durch die gute wirtschaftliche Entwicklung möglich wurde. Alle früheren Prognosen haben etwas ganz anderes vorausgesagt. Das heißt, wir haben Handlungsmöglichkeiten.
Meine sehr geehrten Damen und Herren, entgegen all dem Gejammer in vielen Bundestagsdebatten und öffentlichen Debatten gibt es in diesem Jahr die Sensation, dass am 1. Juli nicht nur die Rente um über 3 Prozent steigt, sondern auch das Rentenniveau ansteigt. Ich hätte mir gewünscht, dass gerade die Oppositionsredner, die sonst immer die Jammerorgie über das sinkende Rentenniveau anstimmen, heute Freudentänze aufführen, weil am 1. Juli 2018 das Rentenniveau steigt.
In der Tat ist die Frage: Was ist eigentlich das große Zukunftsprojekt der Großen Koalition?
