Herr Präsident, vielen Dank. – Liebe Kolleginnen und Kollegen! Keine andere Partei in diesem Hause verfolgt das Thema Grenzsicherung so intensiv wie die CSU.
Wir haben in Bayern lange vor der Flüchtlingskrise aus den Erkenntnissen der vorübergehenden Grenzkontrollen anlässlich des G-7-Gipfels weitreichende Konsequenzen gezogen.
Wir haben die Schleierfahndung massiv ausgebaut, mit dem Erfolg, dass wir im ersten Halbjahr 2017 Zehntausende Aufgriffe durch die Polizei hatten. Die CSU hat bereits vor drei Jahren erkannt, dass wir bis auf Weiteres wieder auf das Instrument der Binnengrenzkontrollen zurückgreifen müssen.
Wir haben deshalb im September 2015 die Binnengrenzkontrollen auf Bundesebene wieder eingeführt, die die Bundespolizei mit Unterstützung der bayerischen Polizei erfolgreich durchführt.
Sie wissen, dass Bayern mit der geplanten Einführung einer bayerischen Grenzpolizei einen deutlichen Schritt weiter gehen wird. Sie haben den Bundesinnenminister gehört, der bereits in der vergangenen Woche deutlich gemacht hat, wohin die Reise bei der Aufenthaltsbeendigung und beim Grenzschutz gehen wird. Ich verrate Ihnen nicht zu viel über diesen Mann, unseren neuen Bundesinnenminister, wenn ich sage, dass er hier keine Ruhe geben wird. Die CSU wird bei diesem Thema keine Ruhe geben, liebe Kolleginnen und Kollegen.
Auch für die Koalition insgesamt gilt, dass wir uns auf ein striktes Bekenntnis zu Artikel 16a Grundgesetz geeinigt haben. Ich füge hinzu: Ein striktes Bekenntnis zum Asylgrundrecht schließt die Dimension der Rechte, die mit dem Asylgrundrecht einhergehen, ebenso ein wie die Grenzen, die dem Grundrecht immanent sind.
Wir werden alles tun, was notwendig ist, um diese Grenzen einzuhalten.
Herr Kollege Kuffer, ich bitte um Entschuldigung. Der Kollege möchte gerne eine Zwischenfrage stellen.
Nein, danke.
