Ich denke, das brauche ich nicht zu machen. Die Zwischenfragen haben andere Funktionen, als hier aufzuklären. Deshalb fahre ich jetzt fort.
Ich muss Sie trotzdem fragen.
Wir wollen alle zwei Jahre die Wirkung der kalten Progression definieren. Es gibt einen Steuerprogressionsbericht. Diesen werden wir beherzigen. Wer sich das noch einmal genauer anschaut – ich kann es nur bis in das Jahr 1998 zurück beurteilen –, stellt fest, dass die Wirkung der kalten Progression übrigens nicht nur kompensiert, sondern sogar überkompensiert wurde.
Jetzt müssten wir ein bisschen rechnen. Das ist vielleicht zu viel für die letzten 27 Sekunden Redezeit. Wer es aber genauer nachrechnen will, der kommt sehr schnell zu dem Ergebnis, dass die kalte Progression für uns im Grunde bedeutungslos ist. Genauso verhält es sich mit diesem Antrag. Deshalb halten wir an den bewährten Methoden fest.
Ich möchte noch auf einen Punkt eingehen. Vorhin fiel das Stichwort „Steuermehreinnahmen infolge der kalten Progression“. Ich habe schon gezeigt, dass das Quatsch ist. Ich will aber daran erinnern und Sie fragen: Hatten wir einen Beschäftigungsaufwuchs? Gab es schon einmal 44 Millionen Beschäftigte? Haben wir Lohnzuwächse gehabt? Könnte es sein, dass die Einkommensteuermehreinnahmen auch auf solche Effekte zurückgehen?
Herr Kollege Binding, kommen Sie bitte zum Schluss.
Mehr möchte ich gar nicht sagen. Jeder hat gemerkt, worauf das hinausläuft. Ich glaube, es ist alles gesagt.
Schönen Dank und einen schönen Nachmittag.
Vielen Dank, Herr Kollege Binding. Das haben Sie jetzt davon. Ich erteile das Wort zu einer Kurzintervention dem Abgeordneten Dürr.
