Meine Damen und Herren, wenn wir über faire Handelspraktiken reden, dann reden wir doch einmal über Amazon. Das ist sicherlich ein bemerkenswertes Unternehmen; aber schauen Sie sich doch einmal an, welche Monopolstellung es sich mittlerweile erworben hat, gesponsert auch durch die US-Steuerpolitik. Diese Monopolstellung widerspricht jeglichem Gedanken der sozialen Marktwirtschaft und jeglichem Gedanken des Wettbewerbes. Das heißt: Wir müssen auch einmal darüber reden, welche Bedeutung Kartell- und Monopolpolitik in diesem Lande haben.
Wenn wir über Wirtschaftspolitik reden, dann müssen wir auch darüber reden, dass wir – daran glaube ich übrigens immer noch – die besten Autos auf der Welt bauen, tolle Maschinen und dass viele Menschen unsere Produkte haben wollen.
An die Adresse der Grünen und der Linken: Wir werden nicht schlechter wegen unseres Außenhandelsüberschusses. Wir wollen weiter gute Produkte für den Weltmarkt produzieren.
Wir hatten es in den vergangenen Jahren relativ leicht mit unseren Exporten. Unsere Währung war komplett unterbewertet. Wir haben niedrige Zinsen gehabt. Es wäre an der Zeit, wieder einmal über Produktivität in diesem Land zu reden.
Ich goutiere ausdrücklich, dass wir große Lohnerhöhungen gehabt haben. Das gehört dazu. Aber wohin führt das?
Was passiert mit den Sozialversicherungsbeiträgen, mit den Energiepreisen, und was machen wir mit den Bürokratielasten für unsere Unternehmen?
