Wenn es in diesem Zusammenhang um Heimat geht, dann drängt sich mir immer mehr die Frage auf, ob Herr Seehofer wirklich geeignet ist, die Heimat zu schützen, oder ob unser Land nicht vielmehr vor diesem Minister geschützt werden müsste.
Die bürgerrechtliche Bilanz der im Herbst abgewählten Großen Koalition war schon unterirdisch. Mit der Vorratsdatenspeicherung – die Kollegen von der FDP haben sie schon erwähnt –, der Fluggastdatenspeicherung und der Neuregelung der Ausland-Ausland-Fernmeldeaufklärung des BND haben Union und SPD vor allem auf die massenhafte Speicherung und Auswertung von Daten ins Blaue hinein gesetzt. Der neue Koalitionsvertrag ist im Kern die Fortsetzung dieser Agenda. Die Bundesbehörden sollen weiter gestärkt und ausgebaut werden. Es geht nicht um bessere Koordination oder Unterstützung der Landesbehörden, sondern um eine Führungsrolle des Bundes bis hin zu einem Direktionsrecht, beispielsweise gegenüber den Landesämtern für Verfassungsschutz. Damit legen die Koalitionäre nicht nur die Axt an die Grundrechte, sondern auch an die föderalen Wurzeln unserer Sicherheitsarchitektur.
Beim Datenschutz herrscht Rat- und Tatenlosigkeit. Jede Woche, Herr Seehofer, erscheinen in überregionalen Zeitungen Artikel, in denen die Schwierigkeiten bei der Umsetzung der EU-Datenschutz-Grundverordnung gerade für kleinere Unternehmen beklagt werden. Und die Koalition? Die Koalition will eine Evaluation der Verordnung im Jahr 2019 abwarten. Mehr haben Union und SPD zu diesem komplexen Thema nicht zu sagen.
Stattdessen wollen Sie eine Debatte über Dateneigentum führen. Offensichtlich hat diese Koalition nicht verstanden, worum es beim Schutz von Daten geht: um den Schutz der Menschenwürde, um den Schutz eines privaten Kernbereichs, der weder vom Staat noch von Unternehmen berührt werden darf. Wer „Dateneigentum“ und „Datenrecht“ sagt, der spricht eben nicht mehr von Daten„schutz“, sondern der will diesen inneren Bereich zum Objekt staatlicher Ausspähung und kommerzieller Ausbeutung machen. Wir als Linke wollen das nicht.
Ganz nach vorn stellen Sie neue Stellen bei den Polizeien des Bundes und der Länder. Doch die ganze Vereinbarung ist an vielen Stellen ein ungedeckter Wechsel. Es ist noch gar nicht lange her, dass alle an einer neuen Regierung beteiligten Parteien in den Ländern bei der Polizei massiv Personal abgebaut haben. Das geschah unter dem Druck von Schuldenbremse und fehlenden Steuereinnahmen der Länder. Von denen wird nun aber erwartet, dass sie bei der Polizei 7 500 neue Stellen schaffen. Woher die Länder die finanziellen Mittel dafür nehmen sollen, verraten Sie nicht.
Herr Seehofer will und soll ja nun bekanntlich ein Superministerium führen, zu dem auch der Bereich Bauen und Wohnen gehört. Um dem Wohnraummangel zu begegnen, setzt die kleine GroKo vor allem auf Neubau und Wohneigentumsbildung. Die in diesem Zusammenhang geplanten Steuererleichterungen über Sonderabschreibung und einen Freibetrag bei der Grunderwerbsteuer oder auch eine neue Eigenheimzulage bedeuten letztlich milliardenschwere Subventionen ohne jegliche Sozialbindung. Wir als Linke halten das eindeutig für den falschen Weg.
Die neue alte Koalition hat die Brisanz der Wohnungsnot als soziale Frage noch nicht einmal ansatzweise erkannt. Mit den geplanten Schwerpunktsetzungen wird der Mangel an bezahlbaren, barrierefreien und umweltgerechten Wohnungen definitiv nicht auszugleichen sein. Die minimalen Verbesserungen bei der Mietpreisbremse oder der Modernisierungsumlage sind reine Symbolpolitik
und helfen den allermeisten Mieterinnen und Mietern leider nicht.
