Ist es Ihr Begriff von wissenschaftlicher Freiheit, wie Ihr Ex-Kanzler Schröder Herrn Kirchhof behandelt und bezeichnet hat: „Ach, der Professor aus Heidelberg!“?
Sie wagen es also, das Wort von wissenschaftlicher Freiheit in den Mund zu nehmen?
Sie waren die Ersten, die entsprechend ausgegrenzt haben. Das zeigt auch sehr stark die Tatsache, wie Sie mit der Expertise, die gerade zum Euro von sogenannten Fachleuten – Professoren und Andersdenkenden – vorgetragen wird, umgehen. Den Begriff „wissenschaftliche Freiheit“ sollten Sie überhaupt nicht in den Mund nehmen.
Wenn hier jemand Wissenschaft diskriminiert hat, dann waren Sie das gerade oder Ihre Kollegin.
Und das ist ein wirklich so schwaches Beispiel, da brauche ich gar nicht viel zu antworten. Herr Kirchhof war überhaupt nicht beeinträchtigt, in Heidelberg weiterzuforschen. Und: Ein Kommentar muss in einer pluralistischen Demokratie auch möglich sein. Das ist also gar kein Beweis für Wissenschaftseinschränkungen.
Die zweite Frage: Wie werden wir morgen arbeiten? Was tun wir heute, damit künftige Generationen von Facharbeitern gut ausgebildet sind, mit dem digitalen Wandel umgehen können? Es ist ganz wichtig, Arbeitsforschung, aber auch Dienstleistungsforschung zu betreiben, weil wir im Bereich der Dienstleistungen viel zu schlecht aufgestellt sind.
