Das Drohpotenzial, wie es auch in den USA bei diesem Instrument üblich ist, ist immens hoch. Hier werden Beklagte regelmäßig in Vergleiche gezwungen, um einem nicht vorhersehbaren insbesondere medialen Druck vorzubeugen.
Deswegen enden solche Verfahren in den USA – so wird es auch bei Ihrem Vorschlag sein – zu 90 Prozent in einem Vergleich. Zu 90 Prozent! Die Folge ist eine Klage­industrie – ein gefundenes Fressen für die entsprechenden Kanzleien. Das Thema „myRight/Hausfeld“ spielt in Deutschland ja heute schon eine Rolle.
Am Ende eines solchen Verfahrens steht im Zweifel übrigens auch kein rechtssicheres Urteil, auf das sich irgendjemand berufen kann, sondern nur ein abgekaufter Vergleich, von dem kein einziger Verbraucher in diesem Land etwas hat.
Das kann doch nicht ernsthaft in Ihrem Interesse sein. Das kann es nun wirklich nicht sein.
Bezeichnend ist auch Folgendes: Erinnern Sie sich einmal an die Anhörung von 2015. Damals hat Ihr Sachverständiger, Professor Halfmeier, der Ihren vorliegenden Entwurf entscheidend mitverfasst hat, zu diesen Fragen interessante Aussagen gemacht. Er schlägt nämlich einen für die Anwälte der Klägerseite vergütungsbezogenen Anreiz im Kostenrecht sowie Erfolgshonorare vor.
In seiner Stellungnahme zur Anhörung heißt es zudem:
Aus gesamtgesellschaftlicher Sicht ist es kaum relevant, ob etwa der durch rechtswidrige AGB in einem Lebensversicherungsvertrag geschädigte Verbraucher X seinen exakten Schaden ersetzt erhält oder nicht.
