Erlauben Sie mir kurz den Hinweis: Es mag sein, dass die Antwort Sie nicht zufriedenstellt, von befriedigen will ich gar nicht reden.
Aber der Redner antwortet so, wie er es für richtig hält, auch wenn es Ihnen möglicherweise nicht ausreichend erscheint.
Vielen Dank, Herr Präsident. – Ich möchte dies nicht weiter definieren.
Auf Bundesebene haben das Bundesministerium für Gesundheit, das Bundesministerium für Ernährung und Landwirtschaft und das Bundesministerium für Bildung und Forschung bereits im Mai 2015 die Deutsche Antibiotika-Resistenzstrategie auf den Weg gebracht. Dort werden viele Maßnahmen zusammengeführt, die zu einer Reduzierung des Antibiotikaeinsatzes in der Human- und in der Veterinärmedizin beitragen werden. Ein Konzept zur Reduzierung des Antibiotikaeinsatzes in der Nutztierhaltung wurde bereits mit der 16. Novelle des Arzneimittelgesetzes verankert. Das hatte einen riesigen bürokratischen Aufwand für unsere Betriebe zur Folge, den sie auch geleistet haben. Das sollten wir auch anerkennen.
Deshalb, meine sehr verehrten Damen und Herren, noch einmal Respekt für alle Bäuerinnen und Bauern, für alle Tierärzte, die mit ihrer Arbeit vor allem dazu beitragen, den Antibiotikaeinsatz in der Tierhaltung zu reduzieren. Wir sollten uns auch in der gesamten Diskussion wieder auf die Humanmedizin konzentrieren; denn hier ist ein wesentlich größeres Einsparpotenzial als in der Tierhaltung.
Vielen Dank.
Herzlichen Dank, Herr Kollege Auernhammer. – Als letztem Redner in dieser Debatte erteile ich dem Abgeordneten Rainer Spiering für die SPD-Fraktion das Wort.
