Hochgeschätzter Herr Präsident! Kolleginnen und Kollegen! Meine Damen und Herren! Luftqualität ist Lebensqualität; aber Lebensqualität ist auch Bewegungsfreiheit und Mobilität.
Das ist der Kraftstoff einer pulsierenden Wirtschaft.
Meine Damen und Herren, in den vergangenen Jahren haben wir dank der Entscheidungen im Deutschen Bundestag eine gute Finanzausstattung für das Bundesministerium für Verkehr und digitale Infrastruktur bekommen. Danke dafür. Ich sage: Weiter so! Wir müssen dieses hohe Niveau verstetigen. Dort, wo wir zusätzliche Mittel brauchen, bitten wir um Ihre Unterstützung; denn es geht uns alle an. Auch Sie werden von den Bürgerinnen und Bürgern vor Ort angesprochen, warum diese Maßnahme langsamer durchgeführt wird oder jene Maßnahme gar nicht kommt. Deswegen müssen wir vorankommen, müssen wir effizienter werden. Das soll unser gemeinsames Ziel sein. Wir wollen unsere Wirtschaft und unsere Mobilität am Laufen halten.
Jetzt geht es darum, dass wir die Mittel, die uns zur Verfügung stehen, schneller und effizienter abfließen lassen. Aktuell stehen wir in der Verkehrspolitik vor großen Herausforderungen. Das können wir fast täglich in den Medien verfolgen. Das sind Herausforderungen, für mich aber auch Ansporn und Motivation. Mit meinem Politikverständnis geht einher, dass der Begriff „Problem“ von „Pro“ kommt und nicht von „Kontra“. Das „Pro“ bedeutet für mich vorwärts, nach vorn, und zwar mit ganz konkreten Maßnahmen.
Wir sind mittendrin, statt nur dabei. Die Umsetzung läuft beim Thema Diesel, beim Thema „Luftqualität in den Städten“ auf Hochtouren. Wer etwas anderes behauptet, liegt völlig falsch.
Ich darf Ihnen ein paar Rahmendaten nennen, wichtige Meilensteine, die vereinbart und erreicht sind: Der verpflichtende Rückruf von 2,46 Millionen VW-Fahrzeugen ist nahezu abgeschlossen. Genauer gesagt liegt die Quote nach jetzigem Stand bei über 92 Prozent. Das ist eine gute Botschaft. Zum Softwareupdate: Über die Hälfte der insgesamt 2,84 Millionen Fahrzeuge sind bereits nachgerüstet oder stehen kurz davor. Genau 1,62 Millionen Fahrzeuge sind in Bearbeitung. Damit werden wir bis Ende 2018 die NOx-Emissionen von 5,3 Millionen Fahrzeugen um bis zu 30 Prozent reduzieren.
– Das wäre mein nächster Satz gewesen. – Das reicht nicht, liebe Kolleginnen und Kollegen. Deswegen habe ich gleich zu Beginn meiner Amtszeit vor einer Woche dieses Thema intensiv bearbeitet. Ich kann Ihnen heute mitteilen, dass wir die Förderrichtlinie für die Umrüstung von Dieselbussen im ÖPNV veröffentlichen werden. Wir reden in der Gesamtheit von 28 000 Stadtbussen in Deutschland. 107 Millionen Euro nehmen wir in die Hand, um den Ausstoß von Tausenden von Stadtbussen zu optimieren.
Im nächsten Schritt wollen wir die Förderung auf die Fahrzeuge der öffentlichen Infrastruktur, beispielsweise Müllwagen, Paketdienste und Krankenwagen,
ausweiten und diese auf moderne Technologie umrüsten, damit unsere Innenstädte sauberer werden.
