Vielen Dank, Frau Präsidentin. – Habe ich das eben richtig verstanden, dass der Kollege Hampel für die AfD-Fraktion erklärt hat, dass die Bundeswehr ein verwahrloster Trümmerhaufen ist?
Wo ist denn der Kollege Hampel überhaupt? Ich sehe ihn gar nicht mehr. Es ist schon ein bisschen peinlich, hier eine Debatte zu führen, Behauptungen aufzustellen und dann aus dem Saal zu verschwinden.
Meine Damen und Herren, wer die Bundeswehr als verwahrlosten Trümmerhaufen bezeichnet, der beleidigt 180 000 Soldaten, die ihr Leben für dieses Land hingeben. Das ist eine unglaubliche Entgleisung, die hier im Deutschen Bundestag nicht zu dulden ist!
Ansonsten freue ich mich und ist es absolut richtig, dass wir hier Debatten über Wirtschafts- und Finanzpolitik führen. Das ist gut, und das sollten wir an dieser Stelle viel öfter machen. Zu den Zöllen von Herrn Trump ist viel gesagt worden; das meiste war auch richtig. Aber vielleicht, meine Damen und Herren, betrachten wir das auch als Weckruf, uns mit unserer Wirtschafts- und Finanzpolitik einmal näher zu beschäftigen. Sie haben die Frage gestellt: Welche Auswirkungen hat das auf die Finanzplanung? Diese Frage ist richtig. Wir sind eine exportorientierte Nation. Ein Großteil unseres Bruttosozialproduktes wird durch Exporte erwirtschaftet. Wenn die Vereinigten Staaten Zölle erheben, wenn es eine Wirtschaftskrise in China oder Konflikte in Osteuropa gibt, ist es natürlich so, dass das unsere Wirtschaft betrifft. Deswegen sollten wir sehr vorsichtig sein; denn das betrifft auch unsere Steuereinnahmen. Wer jetzt schon anfängt, die Steuereinnahmen für die nächsten Jahre zu verballern, der sollte damit sehr vorsichtig sein; denn das gilt auch für die Ausgabenseite.
Otto Fricke, bevor du klatschst: Das gilt auch für Forderungen, einfach einmal auf 20 Milliarden Euro Einnahmen aus dem Solidaritätszuschlag zu verzichten.
Das gehört nämlich auch zur Wahrheit dazu.
In der Wirtschaftspolitik sind es auch noch ein paar andere Fragen, die uns beschäftigen sollten. Welche Haltung haben wir eigentlich als Deutscher Bundestag zum Thema Freihandel?
Die Zölle sind angesprochen worden. Die EU ist kein Musterschüler im Bereich Zölle. Da sollten wir uns auch an die eigene Nase fassen. Welche Haltung haben wir zum Thema Handelsauseinandersetzung? Ich bin froh, dass bis auf die Rednerin der Grünen keiner gesagt hat: Wir wollen jetzt Zölle mit Gegenzöllen beantworten. – Ich glaube, das führt zu nichts. Das führt zu Verlierern auf beiden Seiten. Ein Handelskrieg führt außerdem zu einem Verlust an Arbeitsplätzen, auch hier in Deutschland.
Denn Handel und freier Wettbewerb haben immer auch zu Innovation beigetragen, meine Damen und Herren.
Wir sollten uns aber auch überlegen, ob die Frage der Zölle die einzige ist.
Wir sollten uns überlegen: Wie sieht es denn eigentlich mit fairem Wettbewerb im Bereich Steuerdumping aus? Da müssen wir gar nicht in die Vereinigten Staaten gehen.
Da können wir auch in die Niederlande gehen. Das ist ganz nah.
Wie sieht es denn aus mit Unternehmen wie Amazon, die wenig Ertragsteuer auf dieser Welt zahlen?
Wie ist denn das Konkurrenzverhältnis zu unseren lokalen Einzelhändlern?
Das hat auch etwas mit fairen Handelspraktiken zu tun.
