Herr Präsident! Werte Kolleginnen und Kollegen! Die Linke-Fraktion beschäftigt sich mit den Selbstständigen – da rauft man sich meistens die Haare, da man in der Regel weiß, dass dabei eine Gängelung der Selbstständigen herauskommt.
Wenn man den Antrag liest und bis zum Ende liest, dann verstärkt sich dieser Eindruck. Natürlich gibt es auch bei Selbstständigen Probleme; das wollen wir nicht verschweigen. Die Große Koalition geht diese Probleme jetzt an. Die Lösung dieser Probleme ist bei uns bestens aufgehoben.
Es gibt derzeit Probleme bei der Altersversorgung von Selbstständigen. Wir sind der Meinung, dass Selbstständige einen eigenständigen Beitrag für ihre Vorsorge leisten müssen. Das steht außer Zweifel; denn es kann nicht sein, dass sich Selbstständige unter Umständen im Alter auf die Solidargemeinschaft verlassen. Deshalb soll jeder eine Vorsorgeverpflichtung eingehen. Diese Vorsorgeverpflichtung muss so ausgestaltet sein, dass sie auf der einen Seite für den Selbstständigen finanziell tragbar ist, auf der anderen Seite sicherstellt, im Alter über ein Einkommen zu verfügen, das über dem Grundsicherungsniveau liegt.
Von daher, Herr Kollege Birkwald, sind wir uns im Prinzip einig, nur über den Weg können wir nicht einig werden; denn wir propagieren die Freiheit der Selbstständigen, Sie hingegen wollen diese Freiheit einschränken, indem Sie sie verpflichten wollen, nur in die gesetzliche Rentenversicherung einzuzahlen. Dadurch verhindern Sie, dass alternative Wege beschritten werden. Das, glaube ich, ist der große Unterschied. Dass die Anlagen natürlich mündelsicher sein müssen, nicht pfändbar sein dürfen, tatsächlich für eine dauerhafte Rentenleistung zur Verfügung stehen müssen und dergleichen mehr, steht außer Frage.
Das zweite Problem, das aufgelistet wird, ist der Beitrag zur Krankenversicherung. Entgegen dem Antrag der Linken besteht schon heute die Verpflichtung, eine Krankenversicherung abzuschließen. In Ihrem Antrag wird zum Ausdruck gebracht, diese Verpflichtung gäbe es noch nicht. Aber es gibt die Verpflichtung, eine Krankenversicherung abzuschließen. Natürlich stellt sich die Frage, auf welcher Grundlage man das macht. Da sehen Sie natürlich nur die gesetzliche Krankenversicherung. Wir stehen auch hier wieder für ein pluralistisches System und wollen, dass auch eine private Krankenversicherung die Grundlage sein kann. Hier ist natürlich mitentscheidend, wie hoch der Beitrag ist, den der Einzelne zu zahlen hat.
Herr Kollege!
