Herr Präsident! Meine Damen und Herren! Liebe Gäste! Ich würde mich in diesem Haus wirklich sehr gern mehr darüber unterhalten, wie wir Europa besser, stärker, solidarischer machen können, und weniger darüber, wie wir sozusagen ein friedliches Bündnis mit einem Anliegen sofort zunichtemachen können.
Das ist aber genau die Intention Ihres Antrags. Das Anliegen, lückenlose Grenzkontrollen einzuführen, ist europafeindlich. Es ist geschichtsvergessen. Wenn man nüchtern draufblickt, dann ist klar: Nicht das Agieren der Bundesregierung in den letzten Jahren ist staatsgefährdend, sondern genau das, was Sie hier fordern.
Es ist eine maßlose Verhöhnung der Wählerinnen und Wähler, im Übrigen auch Ihrer eigenen, wenn Sie sich nicht mal die Mühe machen, Ihre absurden Forderungen auch nur ansatzweise mit irgendwas zu unterfüttern. Mich überrascht das nicht; denn das ist ja Ihr Kalkül. Ihnen reicht es, wenn lediglich eine Überschrift transportiert wird; denn genau da endet Ihr politischer Gestaltungswille: bei der Überschrift.
Genau deshalb kann man sich mit Ihrem Antrag, egal wie man ihn dreht und wendet – ich habe es häufiger getan –, nicht sachlich auseinandersetzen. Er verharrt bei einer Überschrift, und Sie selbst sind zu feige, auch nur einen Teil Ihrer Forderungen wenigstens ansatzweise zu unterfüttern.
Sie wollen eine lückenlose Kontrolle der deutschen Grenze, auch der grünen Grenze; das steht ja explizit drin.
Sie trauen sich aber nicht, gleichzeitig zu sagen, dass dies nur umgesetzt werden kann, wenn wir um Deutschland eine Mauer bauen. Sie trauen sich nicht, die enormen Kosten eines solchen Anliegens zu benennen. Sie trauen sich auch nicht, zu sagen, was für ein unfassbares Polizeiaufgebot das zur Folge hätte. Sie trauen sich nicht, zu sagen, dass dafür Polizei aus anderen Bereichen abgezogen werden müsste. Sie trauen sich nicht, zu sagen, was für enorme wirtschaftliche Einbußen das Abdichten der deutschen Grenze zur Folge hätte. Sie trauen sich auch nicht, zu sagen, dass man Ihre Forderungen nur dann umsetzen kann, wenn man im Zweifel auch bereit ist, die Waffe auf Menschen zu richten. Und: Sie trauen sich nicht, festzustellen, dass sich Deutschland durch so eine Maßnahme mit einem Satz aus der Europäischen Union hinausbewegen würde. – Okay.
Das überrascht auch nicht; denn Sie sind eine europafeindliche Partei.
