Beweisanträge von Beschuldigten und Nebenklägern sollen künftig im Vorabverfahren abgelehnt werden. Das NSU-Verfahren lässt grüßen. Da war schon die Nebenklage den meisten lästig. Grundrechte werden so ausgehöhlt, ohne dass Ermittlungserfolge dadurch nachgewiesen wären. Sicherheit wird suggeriert statt hergestellt. Wir als Linke lehnen diesen Ansatz ab und sehen uns da mit der Anwaltschaft in einem Boot.
Das Strafrecht muss allerdings – da stimme ich Ihnen zu – umfassend bereinigt werden. Seine Funktion als Ultima Ratio muss wiederhergestellt werden. Überflüssige Straftatbestände sind zu streichen, sei es die Beleidigung des Bundespräsidenten oder das Erschleichen von Leistungen.
Wir haben einen Gesetzentwurf, der sich zur Ersatzfreiheitsstrafe verhalten wird. Das ist ein gutes Thema; denn die Ersatzfreiheitsstrafe trifft leider überwiegend arme Menschen. Vor dem Hintergrund, dass kurze Haftstrafen eine Resozialisierung eher verhindern als befördern, wollen wir die Ersatzfreiheitsstrafe abschaffen.
Zum § 219a StGB hat der Kollege Thomae von der FDP-Fraktion schon dankenswerterweise etwas referiert. Ich werde mir weitere Ausführungen dazu sparen. Ich bin an dieser Stelle mit der FDP einig. Das ist erstaunlich, nicht wahr?
Lassen Sie mich noch etwas zum Verbraucherschutz sagen. Frau Ministerin, Sie wollen die Bürgerrechte beim Verbraucherschutz stärken, indem Sie Musterfeststellungsklagen gegen Unternehmen einführen. Das begrüßen wir. Das bisherige Ungleichgewicht – hier ein großer Konzern, dort der einzelne Verbraucher – muss ein Ende finden. Die bisherige Rechtslage gibt den Verbrauchern keine einfachen Instrumente an die Hand, um gegen betrügerische Konzerne vorzugehen. VW lässt grüßen. Die Lehre kann nur sein: Verbraucherrechte müssen deutlich gestärkt werden. Klagemöglichkeiten müssen substanziell erweitert werden.
Bei der Verbraucherklage und der Musterfeststellungsklage sind wir in der Tat der Meinung, dass das Opt-out-Prinzip, demzufolge das Ergebnis der Klage quasi auf die Nichtkläger übertragen wird, das Beste ist, um die Verbraucherrechte zu schützen. An dieser Stelle würden wir gerne mit Ihnen gesetzgeberisch weiterdenken.
Erfolgreicher Verbraucherschutz kann aber nur gelingen, wenn ein Unternehmensstrafrecht in Kraft gesetzt wird, das diesen Namen auch verdient. Zu Facebook wurde hinreichend etwas gesagt; das sehen wir genauso wie Sie. Nutzen Sie die Möglichkeit, solchen Konzernen rechtliche Grenzen zu setzen.
Zum Schluss noch ein Punkt, der mir als langjähriger Richter am Sozialgericht ein besonderes Bedürfnis ist. Wir haben viel über die Justiz gesprochen; sie ist wichtig. Die Gerichte sind wichtig. Besonders wichtig sind aus unserer Sicht aber die Sozialgerichte; denn diese sind wichtig für das Funktionieren des Sozialstaats. Sie sind seit mehr als zehn Jahren dauerbelastet. Die Kolleginnen und Kollegen machen eine tolle Arbeit. Die Dauerbelastung ist aber die Folge einer verfehlten Sozialpolitik. Für diese steht – das kann ich Ihnen nicht ersparen – Ihre Partei mit der verfehlten Agenda-Politik. Wir stehen als Partei dafür, diese abzuschaffen.
Vielen Dank.
Das Wort hat Katja Keul für die Fraktion Bündnis 90/Die Grünen.
