vor allem nicht in einer Zeit, in der die Staatskassen durch den anhaltenden Erfolg bei Wachstum und Beschäftigung gut gefüllt sind. Zu einer erfolgreichen Politik für Mittelstand und Mittelschicht gehören Steuerentlastungen.
Wir müssen deutlich sehen, dass letzten Endes jede Analyse, die untersucht, wie sich die Steuerquote im Verhältnis zum Bruttoinlandsprodukt entwickelt, zeigt, dass die Steuerquote von 2016 auf 2017 relativ stabil geblieben ist, sich nämlich nur um 0,1 Prozent erhöht hat. Das heißt, Ihr Argument „Diese Situation hat nichts mit Rekordbeschäftigung und Wachstum, sondern mit einer Überforderung der Bürgerinnen und Bürger zu tun“ ist widerlegt. Die Steuerquote ist, wie gesagt, nur um 0,1 Prozent gestiegen.
Natürlich können wir uns auch eine niedrigere Steuerquote vorstellen, aber Tatsache ist, dass Ihr Argument, dass unsere Finanzpolitik nicht die Ursache für die Rekordbeschäftigung und das Wachstum ist, dadurch einfach widerlegt ist. Das muss man hier noch einmal deutlich festhalten.
Zu einer erfolgreichen Politik für Mittelstand und Mittelschicht gehören zweifellos steuerliche Anreize, Steuerentlastungen, Steuergerechtigkeit und Steuerentbürokratisierungen. Diese Themen bleiben in dieser Koalition auf der Tagesordnung.
Der Antrag der AfD ist deshalb überflüssig. Wir brauchen keinen Nachhilfeunterricht – von Ihnen schon gar nicht –, sondern wir werden unsere Aufgabe und Verantwortung gemeinsam, sachlich und inhaltlich orientiert wahrnehmen.
In diesem Sinne: Herzlichen Dank für Ihre Aufmerksamkeit.
Nächster Redner ist der Kollege Markus Herbrand, FDP.
