Bei diesen ganzen Rechenbeispielen muss man auch festhalten: Wenn man eine Bürgerversicherung schaffen und die PKV zerschlagen würde, dann würde ein funktionierendes System verloren gehen, das mit einem jährlichen Budget von circa 15 bis 16 Milliarden Euro zur medizinischen Infrastruktur beiträgt. Hierfür sehe ich keinen Ausgleich; das ist rechnerisch nicht nachvollziehbar.
Dieses Geld, meine sehr geehrten Damen und Herren, brauchen wir natürlich. Wir brauchen es für Investitionen in ein funktionierendes Vorsorgesystem.
Ich möchte hier schon festhalten: Die Linken halten gemäß ihrem Konzept zur Bürgerversicherung die überproportionalen Beiträge der PKV zur Finanzierung der medizinischen Infrastruktur
anscheinend für entbehrlich. Liebe Kolleginnen und Kollegen, wo möchten Sie denn dieses Geld herholen? Wo ist hier Ihr Ansatz? Man kann nicht nur fordern und nicht sagen, wie man es bezahlen will. Das ist in meinen Augen wirklich schändlich. Deshalb sind wir – das sage ich in aller Deutlichkeit – dagegen.
Meine sehr geehrten Damen und Herren, wir können gerne – dazu lade ich alle ein – parteiübergreifend über mögliche Reformen der Krankenversicherung diskutieren. Das ist auch notwendig. Doch die Vorschläge sollten konstruktiv und auch ökonomisch sinnvoll sein. Der Antrag der Linken ist es nicht. Deshalb lehnen wir ihn ab.
Herzlichen Dank.
Der letzte Redner zu diesem Punkt ist der Kollege Helge Lindh von der SPD-Fraktion.
