Herr Präsident! Liebe Kolleginnen und Kollegen! Am 20. Januar 2018 begann die Invasion der Türkei in die Region um die Stadt Afrin in Syrien. Seit wir dies erleben, haben wir hier im Deutschen Bundestag eine Aktuelle Stunde und eine Vereinbarte Debatte dazu durchgeführt. Auch sonst haben wir über den Nahen Osten, über Syrien und im Speziellen über Afrin gesprochen. Ich will darauf hinweisen, dass alle unsere Redner klargestellt haben, dass das Vorgehen der Türkei nicht angemessen, nicht verhältnismäßig und deshalb auch ein Völkerrechtsbruch ist.
Es ist in der Tat so, dass es richtig ist, über Afrin zu sprechen; schließlich sagt die Syrische Beobachtungsstelle für Menschenrechte, dass dort etwa 300 000 Menschen eingeschlossen sind. Der türkische Staatspräsident Erdogan sagt, dass dies eine saubere militärische Aktion sei.
Aber das stimmt nicht: Das, was Augenzeugen sagen, das, was Hilfsorganisationen sagen, ist, dass es tote Kinder und tote Zivilisten gibt, dass die Infrastruktur zerstört ist. Mehr als 30 Schulen und anderes mehr seien bombardiert worden. Deshalb ist vollkommen klar: Es ist ein Völkerrechtsbruch. Daran gibt es kein Vertun, und das müssen wir auch den Türken in aller Klarheit und Deutlichkeit sagen.
Es ist nicht so – das weiß jeder hier –, dass man in Syrien Gut und Böse leicht trennen könnte. Natürlich stimmt es, dass die YPG auch mit der PKK zusammenarbeitet, dass man sich abspricht, dass Waffen ausgetauscht werden, dass es in Afrin und in benachbarten Kantonen, die von den Kurden bewohnt sind, oder dass es auch im Kandil-Gebirge im Nordirak PKK-Lager gibt, von wo aus Anschläge in der Türkei verübt werden. Ja, das ist alles richtig. Aber mit der Formel „Krieg gegen Terror“ kann man nicht alles rechtfertigen.
Insoweit gehen wir mit dem, was in den vier Anträgen steht, durchaus einig.
Warum ist den Anträgen dann trotzdem nicht zu folgen?
– Ja, das sage ich Ihnen gerne.
