Herr Präsident! Meine Damen und Herren! Immer wenn ich Herrn Glaser höre, schafft er eine Steuer ab. Neulich war es die Grundsteuer, heute ist es die Grunderwerbsteuer. Neulich ging es um Steuereinahmen in Höhe von 14 Milliarden Euro, heute sind es 13 Milliarden Euro. Das kann man ja mal so locker machen; wir haben es ja.
Irgendwie müssen wir seriös miteinander reden; so geht das nicht.
Wenn die FDP in einem Antrag warnt, dass etwas „nicht zum Luxusgut werden“ sollte, dann werde auch ich hellhörig. Ich finde, es geht schon um eine ernsthafte Fragestellung, nämlich darum: Wie kann man eigentlich die Bildung von Wohneigentum erleichtern? Die FDP verfolgt dabei ein – wie soll ich sagen? – ideologisches Ziel: Sie möchte uns sozusagen zu einer Eigentümernation machen.
– Ja, man folgt einer Idee. Das ist eine Ideologie.
Wenn Sie etwas vortragen, ist das immer Ausdruck einer Ideologie.
– Ja, Illusionismus auch.
