Sehr geehrter Herr Präsident! Sehr geehrte Kolleginnen und Kollegen! Im Gesetzentwurf der AfD zur Änderung des Deutsche-Welle-Gesetzes geht es nur vordergründig darum, die Staatsnähe in den Gremien der Deutschen Welle zu verringern. Die Haltung der AfD, die Deutsche Welle würde als Regierungsmedium, das tendenziös agiere, missbraucht, bestätigt, nebenbei bemerkt, was Erhebungen ohnehin belegen: Die Deutsche Welle wird ihrem Auftrag, eine starke Stimme des demokratischen, freiheitlichen und weltoffenen Deutschlands zu sein, gerecht.
Das ist der AfD natürlich ein Dorn im Auge – auch eine Art von Kompliment an das Team der Deutschen Welle.
Worum es daneben und übergeordnet geht, belegt die Behauptung im Gesetzentwurf:
Diesen klaren verfassungsgerichtlichen Vorgaben wird das Deutsche-Welle-Gesetz in seiner aktuellen Form nicht gerecht.
Diese Aussage ist so perfide wie falsch.
Sie ist falsch, weil sich das Gerichtsurteil, auf das sich die AfD als Beleg bezieht, auf beitragsfinanzierte öffentlich-rechtliche Sender im Inland bezieht. Die Deutsche Welle hingegen sendet im Ausland und finanziert sich ausschließlich aus dem Etat des Bundes, also aus Steuergeldern. Die Besetzung der Gremien ist also gesetzeskonform und legitim.
Ob sie gefällt, ist eine ganz andere Frage.
Perfide, sehr geehrte Kolleginnen und Kollegen, ist diese falsche Aussage auch deswegen, weil sie offen transportieren soll – das haben wir ja eindrucksvoll gehört –, Deutschland sei kein demokratischer Rechtsstaat und wir, die demokratisch gesinnten Mitglieder dieses Hohen Hauses, seien lediglich willfährige Handlanger eines linksideologischen Schurkensystems. Darum geht es der AfD eigentlich: um die Skandalisierung und Diffamierung dieser unserer Demokratie.
Dazu gehört auch, dass sich die AfD gebetsmühlenartig als einzig wahre Opposition in diesem Parlament bezeichnet.
Diese Aussage trifft leider zu. Das hat ihr Redner heute Morgen eindringlich demonstriert. Sie sind hier tatsächlich die einzige Opposition zu Freiheit, Vielfalt, Weltoffenheit, Demokratie und Menschlichkeit.
Woche für Woche erleben wir Ihre Attacken: Abschaffung der Doppelstaatlichkeit, Verengung auf eine Sprache, die deutsche, mittels Grundgesetz, Schließung der deutschen Grenzen.
Was sich nicht im engen nationalen, besser: nationalistischen Rahmen bewegt, wird als Ideologie diffamiert. Man fragt sich bei jeder dieser Initiativen: Was folgt als Nächstes?
Abschaffung des öffentlich-rechtlichen Rundfunks?
Kennzeichnungspflicht für Geflüchtete, möglichst nach Status?
