Herr Präsident! Meine sehr geehrten Damen und Herren! Liebe Kolleginnen und liebe Kollegen! Das ist heute eine gute Gelegenheit, dem kompletten Haus beizubringen, wie Parlamentsarbeit in Deutschland funktioniert. Das, was wir eben gehört haben, und das, was wir in dem Antrag lesen können, zeichnet allenfalls ein Zerrbild der Wirklichkeit und passt in das Muster, das hier offensichtlich vertreten wird. Das Plenum wird zu einer Showveranstaltung genutzt. Hier wird provoziert, aber es wird von ganz rechts keine Sacharbeit geleistet.
Sehr geehrter Herr Kollege Brandner, es gab in Deutschland zwei Parlamente, die immer komplett getagt haben. Das eine Parlament hat in der Kroll-Oper getagt und das andere in Erichs Lampenladen. In diese Zeiten wollen wir nicht zurück.
Auch wenn Sie es nicht hören wollen, sage ich Ihnen in aller Deutlichkeit: Der Deutsche Bundestag ist ein Rede- und Arbeitsparlament. Wenn Sie nicht verstanden haben, was Arbeitsparlament in Abgrenzung zu Redeparlament bedeutet, dann ist das Ihr Problem.
Wir sind ein Redeparlament, weil wir hier im Plenum Meinungen austauschen, der Öffentlichkeit darstellen, warum wir ein Gesetz einbringen, warum wir dafürstimmen oder warum wir anderer Meinung sind. Wir reden und diskutieren hier, um einen Antrag zu begründen oder um zu begründen, warum wir ihn ablehnen. Das sind wir der Öffentlichkeit schuldig, weil wir transparent darstellen müssen, worüber wir streiten. Denn Parlamentsarbeit ist immer auch Streit in der Sache.
Aber wir sind eben auch ein Arbeitsparlament, weil wir die Grundlagen dafür erarbeiten müssen, dass wir hier streiten.
Da gibt es eine Fülle von vorbereitenden Gremiensitzungen – allein diese Woche sind es über den Daumen gepeilt 70 Stunden Ausschussarbeit –, die wir in einer solchen Sitzungswoche unterbringen müssen. Vorbereitende Gremien, Anhörungen, Gespräche mit Experten, Verbänden, Kollegen und Berichterstattergespräche: All das dient der Vorbereitung der Auseinandersetzung im Plenum und ist mindestens genauso wichtig wie das, was wir als Redeparlament abliefern.
Es kommt noch etwas dazu, was bei Ihnen offenbar überhaupt keine Rolle spielt. In meinem Wahlkreis habe ich noch nie jemanden von der AfD gesehen. Wahlkreisarbeit findet bei Ihnen einfach nicht statt.
Wir halten Kontakt zum Bürger und erklären ihm unsere Politik.
All diese Elemente, die ich beschrieben habe, sind mindestens genauso wichtig wie das, was wir in aller Ruhe und Gelassenheit und auch in aller Sachlichkeit dann der Öffentlichkeit präsentieren und darstellen.
In ganz wenigen Fällen tagen Ausschüsse parallel zum Plenum. Das sind vor allem der 1. Untersuchungsausschuss, der donnerstags um 11 Uhr beginnt und oft bis Mitternacht dauert und deshalb nicht montags oder freitags tagen kann – dann würde er mit seiner Arbeit nicht über die Runden kommen und die Zeugen nicht komplett vernehmen können –, und der 1. Ausschuss, der sich mit Immunitätsangelegenheiten befasst, die auch relativ schnell behandelt werden müssen. Deshalb ist es gar nicht möglich, nicht auch Gremiensitzungen parallel zum Plenum zu haben.
Aber Sie haben damit aus zweierlei Gründen ein Problem, liebe Kolleginnen und Kollegen von der AfD. Der erste Grund ist, dass die Ausschüsse nichtöffentlich tagen. Da hat man eben keine Bühne, um Provokationen zu machen, eine Show abzuhalten und Videos zu drehen, mit denen man sich seine Wahrheit zusammenbastelt.
Der zweite Grund ist, dass wir in den Ausschüssen natürlich hart in der Sache arbeiten müssen.
Das kann man nicht, wenn man hier stundenlang die Sessel warmhält.
