Vielen Dank, Frau Präsidentin. – Liebe Kolleginnen und Kollegen! Es ist schon eine sehr einseitige und auch gewagte Aussage, liebe Frau Kollegin Nestle, dass Deutschland sich nicht zum Klimaschutz bekenne bzw. dass wir uns nicht zu unseren Klimaschutzmaßnahmen bekennen würden.
Dabei wissen Sie doch ganz genau, wie komplex die Materie ist. Sie wissen auch genau, dass wir schon seit 1990 nahezu 30 Prozent der CO2-Emissionen reduziert haben,
und das in einem Industrieland, in einem Wohlstandsland, in einem Land, wo Arbeitsplätze jetzt schon rar sind. Das ist doch eine Leistung, auf die wir uns berufen können.
Wir haben doch sehr viele Maßnahmen ergriffen. Sie alle kennen sie: das EEG, das Erneuerbare-Energien-Wärmegesetz, die KWK-Gesetzgebung, die EnEV, das CO2-Gebäudesanierungsprogramm, das Klimaschutzkonzept Straßenverkehr, der Nationale Aktionsplan Energieeffizienz und, und, und. Das wichtigste Instrument ist für mich in der Tat – es wurde ja angesprochen – der europäische Emissionshandel; denn er orientiert sich am Markt, und er ist technologieoffen, und er hat bis jetzt auch die besten Ergebnisse gebracht. Deswegen sagen wir: Klimapolitik muss europäisch geregelt werden,
muss europäisch gedacht werden und gemacht werden. Aktionismus und nationale Alleingänge helfen dem Klima nicht; das wissen Sie auch. Und wenn sie auch noch so gut gemeint sind: Sie sind wirkungslos, sie schaden der Volkswirtschaft, und vor allen Dingen geht die Akzeptanz bei den Menschen mit höheren Preisen als Folge von Klimaschutzmaßnahmen verloren.
In der Tat kann aber ein CO2-Bepreisungssystem, wenn es möglichst global ausgerichtet ist, marktwirtschaftlich und effizient sein. Der Sachverständigenrat zur Begutachtung der gesamtwirtschaftlichen Entwicklung hat in seinem letzten Jahresgutachten dazu eindeutig Stellung bezogen – Zitat –:
Darüber hinaus ist es volkswirtschaftlich ineffizient, zunächst die globalen Klimaziele auf nationaler Ebene aufzuteilen und dann mit nicht international abgestimmten Maßnahmen umzusetzen.
