Dieses Spektakel von Aachen erinnerte übrigens wirklich an surreale DDR-Endzeitfolklore. Diese totalen EU-ropäer feierten sich selbst und ihren Sonnenkönig unbeirrbar. Der Zahlmeister Deutschland zeichnete den Zahlungsforderer Macron für dessen Zahlungsforderungen aus, Laudatio der Kanzlerin inklusive. Mehr Selbstaufgabe geht gar nicht.
Viertens: die Migrations- und Integrationskosten. Auch sie sind im Haushaltsentwurf oft unvollständig und intransparent deklariert. Man feiert seitens der Bundesregierung die angeblich höheren Sozialleistungen. Doch vielfach sind dies einfach nur versteckte Zuwanderungskosten. Über 50 Prozent der Hartz-IV-Empfänger haben einen Migrationshintergrund. Ähnlich sieht es im sozialen Wohnungsbau aus, dessen Mittel wegen der uferlosen Zuwanderung permanent gesteigert werden müssen. Irgendwo müssen die jährlich Hunderttausende mittellosen Bereicherer aus aller Welt ja untergebracht werden.
Auch nicht zu vergessen sind die Propagandakosten pro Migration, etwa die 100 Millionen Euro im Haushalt des sogenannten „Demokratie leben!“-Programms, das ein Programm zur Unterdrückung jeder Kritik an der Grenz­auflösungspolitik ist.
Hier wird mit öffentlichen Mitteln an linksextreme und selbst antidemokratische Vereine, wie zum Beispiel die Amadeu-Antonio-Stiftung
oder Erdogans DITIB, die öffentliche Meinung einfach gekauft.
Fünftens – auch das fehlt –: höhere EU-Beiträge. Kommissar Oettinger hat eben absurde 12 Milliarden Euro als deutschen Mehrbeitrag pro Jahr an die EU gefordert.
Auch diese Gelder haben wir in der mittelfristigen Finanzplanung bis 2020 nicht gefunden. Im Übrigen wären diese 12 Milliarden ziemlich genau der Betrag, den England nach dem Brexit nicht mehr bezahlen wird. Deutschland würde damit alleine die Lücke schließen, die der Brexit reißt – ein völliger Wahnsinn!
Weiterhin fällt auf: Der Haushalt enthält einige taktisch klar geplante Wahlgeschenke schon im Hinblick auf die Bundestagswahl 2021, diese zumeist in Form von Subventionen und Ausgabenerhöhungen, leider kaum in Form von Investitionen und Steuersenkungen. Das gilt für die ganz „zufällig“ ab 2021 greifenden Förderungen des Wohneigentums für Familien, wobei das neue Baukindergeld in Höhe von 400 Millionen Euro pro Jahr noch nicht einmal die Euro-Rettungskosten von zwölf Stunden erreicht.
So viel zu den Prioritäten dieser Regierung. Auch die allgemeine Kindergelderhöhung greift voll erst ab 2021. Und auch die Veränderung beim Solidaritätszuschlag greift erstens viel zu kurz und zweitens auch erst ab 2021. Selbst 30 Jahre nach der deutschen Einheit soll der Soli immer noch nicht abgeschafft werden, zumindest nicht ganz.
Last, not least: Obwohl es eigentlich keine neue Regierungskonstellation gibt, gönnt sich die alte-neue GroKo 200 zusätzliche und gut dotierte Planstellen in den neu zugeschnittenen Ministerien: Alleine das Innenministerium bekommt 100 neue Stellen, und im BMF wird gleich ein neues sogenanntes „Vizekanzleramt“ geschaffen, eine völlig neue Teilbehörde mit 41 Stellen.
Zusammenfassend: Diese Regierung ist teuer. GroKo steht für „große Kosten“.
Statt überfälliger Steuersenkungen – wir hoffen auf ein paar mehr, aber das ist bis jetzt nicht erkennbar – sehen wir im Entwurf explodierende Ausgaben, während andererseits die großen Risiken durch die Euro-Rettung schlichtweg ignoriert werden. Es ist ein Haushalt der Täuschungen und zudem ein klassisch sozialistischer: Das Verteilen von nicht nachhaltigen Einnahmen steht im Vordergrund. Man nimmt keine Rücksicht auf den deutschen Steuerzahler, dessen Fleiß die aktuelle Geldschwemme überhaupt erst ermöglicht hat.
Dieser Steuerbürger wird mit Schönwetterpropaganda beruhigt, während er gleichzeitig zahlen muss wie nie zuvor in der Geschichte dieses Landes.
Herzlichen Dank.
Nächster Redner ist der Kollege Eckhardt Rehberg, CDU/CSU.
