Ich will es noch einmal sagen, nur damit es in Ihren Kopf hineinkommt: Jedes Jahr müssen durchschnittlich 26 Millionen Menschen ihre Heimat wegen extremer Klimaschäden verlassen. Die Unwetter nehmen zu. 2017 haben Stürme, Erdbeben, Überschwemmungen einen Schaden in Höhe von 330 Milliarden Euro verursacht. Das ist die Wirklichkeit, übrigens auch die ökonomische Wirklichkeit. Daran messen wir Sie.
Hier auf der Regierungsbank sitzt das große ökologische Schweigekartell Deutschlands. Vergangenes Jahr haben Sie noch alle gelacht, als über das Bienensterben geredet worden ist. Jetzt macht man das nicht, wenn man mal daran denkt, dass das vielleicht ein Problem ist.
In Hannover hat gerade ein Supermarkt gezeigt, wie es ohne Bienen aussehen würde. Die haben 60 Prozent der Produkte aus ihren Regalen genommen. Ohne Bienen gäbe es kein Obst, keine Babynahrung und – vielleicht das Schlimmste für manche – keine Schokolade.
Das alles ist systemrelevant. Täglich verschwinden bis zu 100 Tierarten, und es entstehen keine neuen. Ich will eine Politik, die dafür sorgt, dass 2020 mit dem Artensterben Schluss ist. Ich will eine Regierung, die das tut. Meine Damen und Herren, Sie von der Regierung müssen das wollen, wenn Sie irgendetwas für die Zukunft dieses Landes und die Zukunft dieser Erde tun wollen. So geht es nicht weiter.
– Sie können ruhig darüber lachen. Wenn man sich die AfD anschaut und zuhört wie sie über Heimat und solche Dinge redet, kann ich nur sagen: Wenn Sie daran nicht denken, wenn Sie darüber lachen können, dann haben Sie komplett verfehlt, was deutsche Politiker in dieser Zeit tun müssen.
Schauen wir uns die Verschmutzung der Meere durch Plastik an oder die Auswirkungen der Verschmutzung durch den Diesel; dazu haben wir heute etwas gehört. Das war dieselbe Platte, die ich schon hundertmal gehört habe, und es war dieselbe Platte, die ich immer von der Autolobby höre. Natürlich geht es darum, dass unsere Automobilindustrie das macht, was sie verschlafen hat, nämlich in die Zukunft zu investieren; aber es muss doch auch darum gehen, dass die Leute, die von eben dieser Autoindustrie betrogen worden sind, jetzt tatsächlich eine Entschädigung und eine Hardwarenachrüstung bekommen. Das nicht zu veranlassen, ist echtes Versagen von Politik.
Das führt auch zu einem Misstrauen, das die Menschen weiterhin haben werden. Auch da kann man fragen: Wer war eigentlich in den vergangenen Jahren – Neustart hin oder her – zuständig? Zuständig war im Wesentlichen immer die CSU, dafür, dass das alles passieren konnte, dafür, dass die Themen unter der Decke gehalten wurden, und dafür, dass die Autoindustrie einfach so weitermachen konnte.
Ich finde, was in Ihrer Rede, Frau Merkel, am meisten gefehlt hat, ist die große Frage: „Wie will man eigentlich den Zusammenhalt in dieser Gesellschaft gestalten?“ Sie haben gesagt, Sie hätten erkannt, dass die Menschen nicht mehr darauf schauen wollen, wer zuständig ist. Deswegen kommen jetzt Grundgesetzänderungen; darüber können und müssen wir auch reden. Aber nur um das Zuständigsein allein geht es nicht; es geht auch um großes Denken.
Nehmen wir mal das schöne Beispiel „Wohnen“. Das ist eine der größten sozialen Fragen dieser Zeit. Die Leute flüchten vom Land in die Städte, weil sie Jobs und bessere Infrastruktur suchen. Was sie finden, sind schlechte Luft, keine Kitaplätze, verdammt teure Wohnungen, unbezahlbare Mieten und keinen geeigneten Wohnraum. Dann sagen Sie: Baukindergeld.
Wir sagen: Diese 22 Milliarden Euro helfen keinem Einzigen, der die Miete nicht mehr bezahlen kann.
Das sind Steuergelder, die in den ohnehin schon überhitzten Wohnungsmarkt hineinfließen. Das ist kein geeignetes Instrument.
Es geht doch um die Fragen: Wie wollen wir zusammenleben? Wie organisieren wir unsere Städte? Wie ist die Infrastruktur im Bereich der Pflege aufgestellt? Haben wir genügend Kitas? Wie ist es mit der Integration, meinen wir das wirklich ernst, ja oder nein? Ich erwarte von einer Regierung, die über Zusammenleben redet, nicht, dass sie an diesen oder jenen Punkt ein kleines Bonbon verteilt, sondern dass sie die Strukturfrage, das Auseinandertriften der Gesellschaft, die Armutsfrage, die Frage: „Wie lebt die Alleinerziehende, die am Ende des Monats nicht einmal das Geld hat, mit ihren Kindern ‚Jim Knopf‘ im Kino anzuschauen?“, in den Mittelpunkt ihrer Politik stellt; denn die größte Gefahr ist, dass der Zusammenhalt nicht mehr funktioniert.
Da hilft auch ganz bestimmt kein Heimatministerium, was noch mehr dafür sorgt, dass es zum Auseinanderdriften kommt.
Frau Kollegin, Sie denken an Ihre Zeit?
Da hilft nur, dass Sie sich aufraffen und dieses Land zu einem machen, das modern ist, den Zusammenhalt will und die ökologischen Fragen endlich in den Mittelpunkt stellt. Auch das hat Ihnen Herr Macron vorgemacht, und Sie machen es im kleinen Karo. So, meine Damen und Herren, geht es nicht weiter.
Für die CDU/CSU-Fraktion hat nun das Wort der Kollege Volker Kauder.
