Herr Präsident! Liebe Kolleginnen und Kollegen! Weiterhin gilt: Demokratie ist und bleibt keine Zuschauerveranstaltung. Wir alle hier, drinnen und draußen, stehen auf der Bühne, und wir spielen tagtäglich um unser freiheitliches Leben in dieser Demokratie, sei es mit Instrumenten der indirekten, sei es mit Instrumenten der direkten Demokratie. Weiterhin gilt auch, dass jede ernsthafte Debatte über die Stärkung der Demokratie per se eine gute Debatte ist.
Holen wir uns – das meine ich jetzt sehr ernst – diese Demokratie zurück. Ich habe den Eindruck, dass wir in den letzten Jahren, in den letzten Monaten, in den letzten Wochen manchmal den Diskurs und das Agendasetting allzu sehr denen überlassen haben, auch hier im Parlament, die mit den Mitteln der Demokratie ebendiese Demokratie infrage stellen, und das darf nicht sein.
Das ist die entscheidende Frage einer wehrhaften Demokratie. Wir – ich spreche jetzt im Namen der Liebhaberinnen und Liebhaber der Demokratie – müssen viel lauter sein. Wir müssen endlich viel lauter sein als die Gegner der Demokratie.
Erlauben Sie mir an dieser Stelle einmal sozialdemokratisches Selbstlob. Das ist sicherlich gestattet; denn man kann Sozialdemokraten so manches vorwerfen, aber sicher nicht einen Mangel an Selbstkritik und ein Übermaß an Selbstlob.
Wir haben das Dreiklassenwahlrecht abgeschafft, wir haben für das Frauenwahlrecht gekämpft, für das Wahlrecht ab 18 Jahren, und wir haben – mein Kollege Castellucci erwähnte es schon – fast genau vor fünf Jahren zwei noch detailliertere Gesetzentwürfe zur direkten Demokratie eingebracht. Wir haben diese Vorarbeit geleistet, und das war notwendig.
Gleichwohl sehen wir auch, dass mit der direkten Demokratie auch eine Janusköpfigkeit verbunden ist. Das liegt nicht an dem Instrument der direkten Demokratie als solcher, sondern an den Fragen ihrer Instrumentalisierung und an den Überzeugungen sowie der Haltung, die damit verbunden sind. Um es deutlich zu sagen: Wenn Plebiszite populistisch missbraucht werden, um damit die repräsentative Demokratie verächtlich zu machen und Minderheitenschutz sowie Grundrechte zu schleifen, dann stärkt diese Form falscher direkter Demokratie alles Mögliche, aber nicht die Demokratie.
Deshalb kommt es – ich wiederhole mich –
