Unsere Maßnahmen zielen auf die Lebensqualität in den Städten und Dörfern. Wir wollen Ortskerne auch in ländlichen Regionen revitalisieren und auch dort Baulücken schließen. Wie notwendig es ist, sich mit diesen Themen auseinanderzusetzen, hat Herr Lischka gerade eben – nicht als Opposition, sondern als Anreicherung, glaube ich – deutlich zum Ausdruck gebracht.
Über viele Jahre war die Sicherung und Schaffung von ausreichendem und bezahlbarem Wohnraum kein Thema. Seit einigen Jahren ist es das, und heute ist es die zentrale soziale Frage. Wir reagieren darauf mit einer Wohnraum­initiative: Wir schaffen 1,5 Millionen neue Wohnungen bzw. die Voraussetzungen dafür. Wir investieren 2 Milliarden Euro mehr für den Bau von Sozialwohnungen. Wir wollen die Baulandmobilisierung verbessern und der Bodenspekulation steuerlich entgegenwirken. Herr Ruppert, wenn Sie möchten, dann können Sie die Grunderwerbsteuer in Nordrhein-Westfalen, so wie Sie es versprochen haben, senken. Wir machen es jedenfalls nur dann, wenn sich auch große Immobilienunternehmen der Grunderwerbsteuer nicht durch Vertragsgestaltungen wie beispielsweise Share Deals entziehen.
Zur Baulandmobilisierung gehört auch, dass die bundeseigenen Grundstücke den Kommunen von der Bundesimmobilienanstalt kostengünstig und nicht zu Höchstpreisen überlassen werden.
Dazu gehört auch, zu klären, ob bereits aufgegebene Kasernenstandorte dem Wohnungsmarkt jetzt möglicherweise doch nicht zur Verfügung gestellt werden sollen. Herr Minister, ich habe die Bitte, dass Sie mit den Kollegen im Kabinett für Klarheit sorgen.
Mit dem Baukindergeld unterstützen wir junge Familien. Wir wollen fördern, aber wir wollen keine Fehlanreize geben. Darauf werden wir sicherlich achten müssen. Wir fördern den privaten Wohnungsbau mit einer steuerlichen Förderung; wohlgemerkt: nicht irgendwie, sondern im bezahlbaren Mietpreissegment.
In Verbindung mit Städtebauförderung und Dorferneuerung wirken die Maßnahmen ebenso in ländlichen Räumen wie auch in Ballungsgebieten. Sie entlasten damit auch die Wohnungsmärkte in städtischen Zentren. Das ist, glaube ich, wichtig. Um dort die Mietenspiralen zu bremsen, werden wir die Umlage von Modernisierungskosten begrenzen, die Mietpreisbremse verschärfen und eine Kappungsgrenze nach Modernisierungen einführen. Wir wollen Mieter nicht aus ihrem Zuhause herausmodernisieren.
Ich bin dem Kollegen Gerster sehr dankbar, dass er auf die Notwendigkeit der Anpassung des Wohngeldes hingewiesen hat.
Um gleichwertige Lebensverhältnisse herzustellen, ist ein bundesweites Glasfasernetz nötig. Ich freue mich sehr über den Beschluss des Kabinetts, dass der Bund zur Förderung des Breitbandausbaus jetzt zusätzlich 2,4 Milliarden Euro zur Verfügung stellen wird, weil die jüngsten Ergebnisse der Steuerschätzung dies ermöglichen. Das ist gut so. Vielen Dank an den Bundesfinanzminister Olaf Scholz.
Wir wollen auch bessere Chancen für strukturschwache Regionen. Ein gesamtdeutsches Fördersystem soll Wachstum und Arbeit nach Bedarf fördern und nicht nach Himmelsrichtungen.
Liebe Kolleginnen und Kollegen, ich glaube, wir machen eine fortschrittliche Politik für bessere Lebensverhältnisse in Städten, Dörfern und Regionen. Heimat ist für uns keine rückwärtsgewandte Heimattümelei. Es ist auch kein Kampfbegriff gegen Modernisierung und Aufklärung. Es ist schon gar nicht ein Begriff, der sozusagen für reaktionäre Sprachkonditorei in Anspruch genommen werden kann.
Wir gestalten Heimat als einen Ort, an dem Menschen gerne leben, wo sie sich wohlfühlen und wo sie zu Hause sind: auf dem Dorf, im Quartier, im Viertel, im Kiez oder auf dem Kiez, wie die Hamburger sagen. Mir gefällt es jedenfalls, wenn unser Bundespräsident sagt:
