Aber man darf hier nicht als Frau Baronin von Münchhausen auftreten und die Menschen verdummen wollen. Sie sollten bei aller Polemik, bei aller politischen Auseinandersetzung bei den Fakten bleiben und nicht Unwahrheiten hier im Deutschen Bundestag verbreiten.
Sie sollten erst einmal anfangen, den Bundeshaushalt zu lesen, ehe Sie sich hierhinstellen, um über den Bundeshaushalt zu reden. Es ist Voraussetzung, um sachgerechte Politik zu machen, dass man weiß, worüber man spricht, liebe Kolleginnen und Kollegen.
Lassen Sie mich zum Schluss noch zwei Baustellen ansprechen, die wir, wie ich glaube, haben:
Erstens. Ich glaube, es ist wichtig – das richte ich insbesondere an den Koalitionspartner –, dass wir das Thema Trassenpreise im Blick haben. Dafür war Vorsorge getroffen in der Finanzplanung.
Zweitens. Wir haben aktuell eine Rücklage der Bundesagentur für Arbeit in Höhe von 20 Milliarden Euro. Sie wird nach den Prognosen auf 25,5 Milliarden Euro aufwachsen, wenn nichts entnommen wird, und so geht es immer weiter bis zu über 40 Milliarden Euro im Jahr 2022. Ich glaube, dass es kein Problem darstellen würde, den Beitrag zur Arbeitslosenversicherung statt um 0,3 Prozentpunkte um 0,5 Prozentpunkte abzusenken. Dies würde allen Arbeitnehmern zugutekommen, gerade den Beziehern niedriger und mittlerer Einkommen.
Herzlichen Dank.
Der Abgeordnete Boehringer hat zu einer Kurzintervention das Wort.
