Ich lebe in einer Wanderregion. Wir wandern sehr viel in Nordhessen. Tolle Landschaft! Kommen Sie mal vorbei! Was hat denn die Wanderschule in Nieste bei mir im Wahlkreis gemacht? Sie hat einen Energielehrpfad angelegt. Sie können mittlerweile durch die Söhre oder durch den Kaufunger Wald wandern und lernen, wie die Energiewende funktioniert und welchen Beitrag die Windkraft dazu leistet. Das führt zu mehr Akzeptanz.
Also: Das wären die richtigen Maßnahmen und nicht irgendwelche Länderöffnungsklauseln, die ein Instrument der Verhinderungsplanung sind. Wir wollen die Energiewende ermöglichen und sie nicht verhindern.
Herr Koeppen, die Einladung steht. Bringen Sie gleich Herrn Dr. Neumann mit. Sie sind herzlich eingeladen, vorbeizukommen.
Lassen Sie uns konkret darüber diskutieren, wie wir die Energiewende beschleunigen können, anstatt hier solche Scheindebatten zu führen. Wir möchten hier endlich etwas tun. Wir möchten bei der KWK vorankommen; da besteht Handlungsbedarf. Wir wollen möglichst zeitnah die beihilflichen Vorgaben der EU-Kommission umsetzen. Sie stehen da auf der Bremse. Es tut mir leid, dass ich heute meinem Koalitionspartner sagen muss, dass er dort etwas bremst und dass aus dem 100-Tage-Erneuerbare-Energien-Gesetz nichts wird. Ich glaube, das ist klar, wenn man den Zeitplan sieht. Aber ich bin zuversichtlich – die Hoffnung stirbt bekanntlich zuletzt –, dass wir wenigstens ein 200-Tage-Erneuerbare-Energien-Gesetz hinbekommen, wenn wir alle das bevorstehende Wochenende nutzen, um zu uns zu kommen, und uns dann auf das verständigen, was im Koalitionsvertrag steht. Wenn wir das konsequent und nachhaltig umsetzen, dann gelingt uns die Energiewende. Und dafür steht die SPD.
Vielen Dank und Glück auf!
Ich erteile das Wort dem Kollegen Mario Mieruch.
