Frau Präsidentin! Meine Damen und Herren! Ich weiß ja nicht, wo der Wirtschaftsminister im Moment ist, aber, Herr Linnemann, das war ja schon ein starker Auftritt hier.
Ihre Fraktion hat einen entsprechenden Antrag der FDP zur Senkung des Beitragssatzes zur Arbeitslosenversicherung um 0,5 Prozentpunkte im Ausschuss abgelehnt. Gleichzeitig legen Sie hier einen solch vollmundigen Auftritt hin. Das ist nun wirklich nicht glaubwürdig.
In der Hoffnung, dass mir der Wirtschaftsminister während meiner Redezeit doch noch die Ehre gibt,
werde ich meine Rede jetzt mal ein wenig umstellen.
Lassen Sie uns als Erstes über Elektromobilität reden. Dafür sind im Haushalt 275 Millionen Euro vorgesehen. Die Bürger nehmen das Angebot aber gar nicht an. Im Jahr 2016 gab es glatte 9 044 Anträge, in 2017 waren es knapp 38 000, und auch in diesem Jahr sieht es von der Prognose her nicht besser aus. Sollten wir nicht vielleicht überlegen, diesen Haushaltspunkt ganz aufzulösen?
Das von Herrn Gabriel gesetzte Ziel werden wir, wenn das Tempo entsprechend bleibt, in genau 23 Jahren erreichen. Für die CDU/CSU kann ich da nur sagen: Das wäre dann die zehnte Legislaturperiode von Frau Merkel. Wäre es nicht sinnvoll und sollte die Koalition nicht den Mut haben, diesen Haushaltspunkt komplett zu streichen? Man kann Elektromobilität nämlich nur dann erfolgreich im Markt durchsetzen, wenn die Produkte attraktiv sind – und nicht durch Subventionen.
Zweiter Punkt: Luft- und Raumfahrt. Sie ist für uns eine wichtige Schlüsselindustrie und ein bedeutender Industriezweig in Deutschland, der sicherlich auch für unsere Verteidigungspolitik und Außenpolitik wichtig ist.
In diesem Bereich gibt es Unterschiede: Die europäischen Aktivitäten der ESA werden sehr stark gefördert – mit einem Plus von 13 Prozent –, der nationale Bereich für DLR dagegen nur mit einer Art Inflationsausgleich von 3 Prozent. Wenn man nach Frankreich schaut, zeigt sich: Die Franzosen nehmen dieses Thema sehr viel ernster. Sie fördern Raum- und Luftfahrt national doppelt so stark wie Deutschland.
Wir sollten in diesem Bereich durchaus mehr tun. Wenn wir auf die Subventionen für den Ausbau der Elektromobilität verzichten würden, hätten wir dafür einen sehr, sehr großen Spielraum.
Leider ist der Wirtschaftsminister immer noch nicht da. Ich darf ihn dennoch zitieren. Er hat nämlich in der Regierungserklärung vom 22. März gesagt:
… manchmal muss man auch als Wirtschaftsminister den Mut haben, weniger zu tun oder vielleicht auch gar nichts zu tun, …
Wenn ich diesen Haushalt insgesamt sehe, habe ich den Eindruck, dass der Herr Minister den entsprechenden Mut gehabt hat. Denn der Haushalt in diesem Bereich ist eigentlich nicht mehr oder weniger als eine Kopie der Haushalte der letzten Jahre.
Aber kommen wir zu einem Punkt, den der Wirtschaftsminister aktuell aufgerufen hat.
– Da kommt er ja gerade.
