Herr Dr. Harbarth, ist Ihnen bekannt, dass insbesondere die Union die Einschränkung durchgesetzt hat, dass bestimmte Personen, unter anderem die große Zahl der Afghanen, nicht an Integrationskursen teilnehmen dürfen?
Für uns, Frau Kollegin, ist der Schutz, den Flüchtlinge in diesem Land finden, ein Schutz auf Zeit. Für uns ist die zentrale Frage zu Beginn des Aufenthalts: Wer hat in diesem Land eine Perspektive, dauerhaft bleiben zu können, und wer hat eine Perspektive, dieses Land rasch verlassen zu müssen?
Bei denjenigen, die dieses Land rasch verlassen müssen, geht es nicht um Integration, sondern es geht darum, sie rasch in ihre Heimatländer zurückzuführen.
Wenn Sie berücksichtigen, wie das Auswärtige Amt die Sicherheitslage in Afghanistan beschreibt, dann stellen Sie fest, dass es bei der Gruppe der Afghanen ganz entscheidend darum geht, dass wir unsere Bemühungen verstärken, sie wieder in ihre Heimat zurückzuführen, statt sie in unser Land zu integrieren.
Meine Damen und Herren, erlauben Sie mir, ein Wort zum viel diskutierten Thema des Familiennachzugs für Gefährder zu sagen, das Gegenstand eines Änderungsantrags sein wird, auf den sich die Koalitionsfraktionen bereits verständigt haben. Die Haltung der Union war von Anfang an klar: Es kann keinen Familiennachzug für Gefährder geben. Wir wollen alles unternehmen, damit Gefährder Deutschland verlassen müssen. Wir werden ganz gewiss gegen ihre Ausweisung nicht noch das Hindernis einer vorhergehenden Familienzusammenführung auftürmen.
Bei der Ausweisung wollen wir im Übrigen so weit gehen, dass wir die gesetzlichen Möglichkeiten schaffen, um sogenannten Doppelstaatlern die deutsche Staatsangehörigkeit zu entziehen. Der Staat muss hier mit aller Konsequenz vorgehen. Wer sich in einem solchen Ausmaß gegen die Werte unserer freiheitlich-demokratischen Grundordnung gestellt hat, dass er im Ausland für eine Terrororganisation kämpft, dem muss klar sein, dass es keinen Weg zurück nach Deutschland geben kann bzw. dass er seinen Platz in der deutschen Gesellschaft verwirkt hat.
