Im Augenblick muss sich die Wissenschaft gegen Falsch­meldungen wehren; sie muss sich aber auch gegen einen großen Verwertungsdruck wehren. Wir müssen hier als Politikerinnen und Politiker an ihrer Seite stehen und die Wissenschaft davor schützen, von Konzernen immer mehr in ihren Dienst gezwungen zu werden.
Was für VW oder BASF gut ist, muss automatisch auch für die Gesellschaft gut sein! Wir wissen doch alle, meine Damen und Herren, dass dem nicht so ist. Wir brauchen keine Appelle der Bundesregierung an die Wissenschaft. Wir brauchen verlässliche Rahmenbedingungen. Viele Wissenschaftlerinnen und Wissenschaftler hangeln sich von einer befristeten Stelle zur nächsten; das darf so nicht weitergehen.
Sie sind gezwungen, wertvolle Zeit mit endlosen Projektanträgen und für die Einwerbung von Drittmitteln zu verschwenden.
Im Grundgesetz steht:
Kunst und Wissenschaft, Forschung und Lehre sind frei.
Aber – das muss ich hinzufügen –: nicht frei von den Gesetzen des Kapitalismus. Mein Appell: Verteidigen wir das Grundgesetz, und zwar in seinem Wortlaut!
Vielen Dank.
Vielen Dank, Frau Dr. Lötzsch. – Als Nächstes für die Fraktion Bündnis 90/Die Grünen der Kollege Kai Gehring.
