Sie war der Lage entsprechend. Sie war der Ernsthaftigkeit der Lage geschuldet, sagen wir es mal so.
Wir konnten auch auf gewissen Vorarbeiten aufbauen, obwohl wir uns das nie eingestanden haben; egal. – Jedenfalls hat uns umgetrieben, dass die Bürgerinnen und Bürger in Deutschland das Leben aus der Perspektive betrachten „Wie stellt sich das für mich dar?“ und nicht aus der Perspektive betrachten: Wer ist gerade für was zuständig? Deshalb sind wir an einigen Stellen über uns hinausgewachsen, so sage ich es mal als CDU-Mitglied. Wir haben jetzt die Möglichkeit, Schulen nicht nur in finanzschwachen Kommunen zu fördern.
– Wir arbeiten daran und hoffen auf tätige Mithilfe. Wir wissen auch, dass wir diese Mithilfe brauchen. – Wir haben uns entschlossen, mehr für den sozialen Wohnungsbau zu tun. Wir haben uns entschlossen, mehr für die Gemeindeverkehrsfinanzierung zu tun – all das ist mit Grundgesetzänderungen verbunden.
Liebe Kolleginnen und Kollegen, das ist für den Bund in der Kombination mit dem Bund-Länder-Finanzausgleich nicht so eine triviale Entscheidung; denn durch den neuen Bund-Länder-Finanzausgleich, der in dieser Legislaturperiode, nämlich im Jahr 2020, in Kraft tritt, schwächt der Bund auch seine finanziellen Möglichkeiten. Olaf Scholz hat gestern richtigerweise darauf hingewiesen: Wenn wir die Verantwortung für den sozialen Wohnungsbau den Ländern geben, wenn der Bund mehr in den Bund-Länder-Finanzausgleich gibt, wenn beim Gemeindeverkehrsfinanzierungsgesetz der Schwerpunkt bei den Ländern liegt und sich in der Folge die Investitionssumme des Bundes um die entsprechenden Anteile verringert, dann darf man nicht sagen: Der Bund investiert nicht mehr. – So kann man das nicht machen.
Wir haben gesagt: Wir geben das Geld dahin, wo am besten damit gearbeitet werden kann. Das darf man dann aber nicht als Erstes 14 Tage später wieder vergessen. Trotzdem investieren wir ja mehr. Wir investieren übrigens nicht nur Steuergelder, sondern wir haben auch die Erlöse aus der Versteigerung der 5G-Frequenzen; wir werden daraus etwas machen.
Unser Problem ist im Augenblick nicht, dass wir zu wenig Geld für Investitionen haben; unser Problem ist, eine Baufirma zu finden und Genehmigungen zu erhalten. Deshalb müssen wir die Verfahren im Genehmigungsrecht beschleunigen und versuchen, für mehr Gründungen zu sorgen, damit wir da vorankommen.
Im Wohnungsbaubereich ist es außerdem richtig und wichtig, die AfA und das Baukindergeld einzuführen. Das alles sind Incentives, wie man heute so sagt, also Anreize, um besser zu leben.
– Ja, die letzten Jahre haben wir schon viel gemacht, aber noch nicht genug. So ist das Leben, Herr Bartsch.
Ansonsten müssten wir ja irgendwann aufhören, Abgeordnete zu sein. Politik wird immer wieder neue Aufgaben haben. Das ist das Schöne und Spannende.
Meine Damen und Herren, der Riesenbereich der Sicherheit ist für uns wichtig. Auch hier werden wir Kooperationen eingehen. Der Pakt für den Rechtsstaat ist überhaupt nicht denkbar, wenn man nicht mit Kommunen und Ländern zusammenarbeitet. Das heißt, die ganze Koalition ist auf ein sehr kooperatives Verhalten des gesamten föderalen Systems angelegt.
Ich setze darauf, dass das, was wir an Geldern für bestimmte Zwecke ausgeben, von den Ländern und Kommunen dann auch wirklich für diese Zwecke verwendet wird. Da werden wir schon sehr darauf achten, dass das nicht irgendwo verschwindet.
Meine Damen und Herren, ein Riesenbereich neben der Sicherheit ist natürlich auch die Steuerung und Ordnung der Migration im Innern. Deshalb haben wir uns für die AnKER-Zentren entschieden. Ich finde, jetzt sollten auch alle dazu stehen. Die Vorschläge des Bundesinnenministers an dieser Stelle sind wirklich sehr praxis­orientiert. Mit Verlaub: Wenn man am 19. April, wo wir noch nicht einmal 100 Tage im Amt waren, aufgrund von Missständen im BAMF, die Missstände sind, sagt, der Minister habe die Sache nicht im Griff, muss ich dazu ehrlich sagen: Das ist etwas komisch. – Unter Koalitionsfreunden wollte ich das noch einmal angemerkt haben.
Wir orientieren die sozialen Sicherungssysteme auf die Zukunft. Gestern wurde die Rentenkommission eingesetzt; das wird ein hartes Stück Arbeit. Wir werden natürlich in Pflege und Gesundheit Riesenkraftanstrengungen machen müssen. Wir brauchen mehr Fachkräfte; auch hier gibt es ein Riesenproblem. Ich glaube, wir alle sind uns im Übrigen einig – das fällt ja in weiten Teilen in die Kompetenz der Länder –: Dass man in den Pflegeausbildungsberufen bis vor kurzem Schulgeld bezahlt hat und keine Ausbildungsvergütung bekam, gehört zu den Anachronismen der Bundesrepublik Deutschland. Dass man das, kurz bevor die Republik 70 wird, noch abschafft, dafür bin ich sehr dankbar, liebe Freunde.
Es geht auch darum, die natürlichen Lebensgrundlagen zu sichern. Ich nenne das Stichwort „Klimaschutz“. Wir werden eine Kommission einsetzen, die sich mit dem Ausstieg aus der Braunkohle befasst.
Sie erinnern sich: Vor mehr als zehn Jahren haben wir uns mit dem Ausstieg aus der Steinkohle befasst. Wir haben es so hinbekommen, dass dieses Jahr die letzte Grube schließt, aber die Menschen, die dort gearbeitet haben, diesen Wechsel auch verkraften konnten und er mit ihnen gestaltet wurde.
So muss es auch bei der Braunkohle sein: erst fragen, was aus der Region wird, dann aussteigen, und nicht erst Aussteigedaten festlegen und sich dann überlegen, was aus den Menschen wird. Nur so wird ein Schuh daraus.
Wir werden auch auf eine lebenswerte Umwelt achten: mehr Tierwohl, mehr vernünftige Landwirtschaft. Ich hoffe nur, dass die Europäische Union in der Lage ist, die Entbürokratisierung der zweiten Säule, die sich diesem Thema widmet, hinzubekommen. Ansonsten werden wir es nicht schaffen.
Ich will mit etwas schließen, was vielleicht manch einem ein bisschen klein vorkommt, was aber ein großes Thema ist: Am 20. Mai, nächste Woche, wird zum ersten Mal der Weltbienentag stattfinden – im Übrigen eine Initiative von slowenischen Imkern. Die Bienen stehen inzwischen pars pro poto für das, was wir unter Artenvielfalt, unter Natur, darunter, wie sie funktionieren muss und soll und wie wir sie schützen müssen, verstehen. Deshalb sollten wir an diesem Tag an die Artenvielfalt denken und etwas Gutes für die Bienen tun. Deutschland, Julia Klöckner, und der slowenische Agrarminister haben hierzu eine Vereinbarung geschlossen, wie wir auf diesem Feld mit Slowenien zusammenarbeiten wollen – ein kleines Teilchen eines guten, ganz präzisen und konkreten Einsatzes.
Meine Damen und Herren, Sie sehen: Wir haben viel Arbeit. Wir wollen das auch tun. Die Bundesregierung wird mit Nachdruck arbeiten.
Herzlichen Dank. Alles Gute.
Jetzt hat das Wort der Vorsitzende der FDP-Fraktion, Christian Lindner.
