Deshalb ist es richtig und gut, den ESM weiterzuentwickeln,
ihm auch Aufgaben zu geben in Richtung eines internationalen Währungsfonds. Das können wir alleine. Und deshalb stimme ich auch zu, dass, wenn der Risikoabbau national weit vorangegangen ist, wir einen Common Backstop haben und dieser Common Backstop auch beim ESM angesiedelt sein könnte, so wie der Bundesfinanzminister das gestern gesagt hat.
Dann haben wir die Aufgabe, zu überlegen: Wie können wir die Konvergenz der Euro-Zone und die Stabilität der Euro-Zone sicherstellen?
Da finden im Augenblick Gespräche statt. Wir haben im Augenblick zwei Projekte. Das eine Projekt ist die Euro-Zone, auch die finanzielle Ausstattung, meinetwegen ein Investitionshaushalt oder Ähnliches, wie wir es in unserer Koalitionsvereinbarung geschrieben haben. Aber gleichzeitig haben wir die Beratungen zur mittelfristigen finanziellen Vorausschau in Europa. Jetzt sage ich mal: Der Finanzminister ist großzügig, aber irgendwie gelten auch für ihn die Grundrechenarten. Das heißt, deutlich mehr in den europäischen Haushalt und noch deutlich mehr in den Euro-Zonen-Haushalt geben und trotzdem die Stabilitätskriterien einhalten, das ist natürlich nicht ganz einfach. Deshalb werden wir mit Frankreich genau über die Wechselwirkungen sprechen: Was müssen wir in den Haushalt packen? Nach dem Austritt Großbritanniens sind 85 Prozent des Bruttoinlandsprodukts der Europäischen Union in der Euro-Zone. Weitere Frage: Was müssen wir speziell als Absicherung gegebenenfalls noch im Euro-Haushalt machen? Diese Gespräche finden statt, und wir werden bis zum Juni-Rat darüber Einvernehmen erzielen. Das ist im Übrigen die einzige noch richtig offene Frage – unter all den Vorschlägen, die gemacht wurden. Ich glaube, dass wir schon ganz schön weit vorangekommen sind.
Dann, liebe Kolleginnen und Kollegen, geht es natürlich auch um die Erweiterung. Hier geht es im Wesentlichen um die Frage: Wie geht es weiter mit dem westlichen Balkan? Ich werde heute nach Sofia fliegen. Wir werden uns morgen mit Vertretern der Mitgliedstaaten des westlichen Balkans treffen. Dass sie die europäische Perspektive haben, ist unbestritten. Jetzt ist die Frage: Wie und unter welchen Bedingungen können wir das machen? Aber ich kann nur sagen: Der westliche Balkan und die Situation dort entscheiden über Krieg und Frieden in unserer absoluten Nachbarschaft. Schauen Sie nur, wie schnell dort die Funken hochschlagen zwischen Serbien und Kosovo, innerhalb von Bosnien und Herzegowina, wie schwierig es ist, die Namensfrage von Mazedonien zu klären, wie man um Grenzabkommen ringt. Kosovo hat nun endlich mit Montenegro ein Grenzabkommen geschlossen – ein Riesenerfolg, wenn man sich vor Augen führt, dass selbst heute noch keine Klarheit zwischen Slowenien und Kroatien über den Seezugang herrscht, obwohl Kroatien und Slowenien Mitglieder der Europäischen Union sind. Im Übrigen ist das wieder ein Grund, zu sagen: Bevor Grenzfragen nicht geklärt sind, niemals Beitritt eines Landes! Das muss ich im Rückblick sagen.
Es ist immens wichtig, dass wir uns um diese Fragen kümmern und zur wirtschaftlichen Stärkung beitragen.
Das alles ist wichtig für Europa. Um unser Wohlstandsversprechen in Europa einzuhalten, geht es jetzt auch um die Schaffung eines digitalen Binnenmarktes. Wir haben eine Unzahl von Verordnungen, die wir umsetzen oder noch verhandeln müssen. Hier geht es sehr stark um die Wettbewerbsfähigkeit Europas, und deshalb geht es auch sehr stark um die Wettbewerbsfähigkeit Deutschlands.
Liebe Kolleginnen und Kollegen, ich habe das schon oft gesagt und sage das heute wieder: Vielleicht ist das ambitionierteste Projekt – weil wir zum Teil ganz neu denken müssen – die Frage: Wie gestalten wir diesen umfassenden gesellschaftlichen Wandel, der mit der Digitalisierung verbunden ist? Es geht nicht nur darum, dass wir die Infrastruktur ausbauen müssen; das müssen wir auch. Und da können wir auch besser werden.
Eines Tages muss es möglich sein, die App wieder abzuschaffen, mit der man die Funklöcher der Bundesnetzagentur mitteilt. Allerdings zu glauben, dass es reicht, dies den Telekommunikationsanbietern mitzuteilen, ist nicht sehr erfolgversprechend, weil damit die Funklöcher noch nicht weg sind. Die Anbieter brauchen manchmal Druck. Natürlich müssen wir nach der Tatsache, dass wir uns auf den 50-Megabit-pro-Sekunde-Ausbau konzentriert haben, in Zukunft nur noch Breitbandanschlüsse, also Glasfaser oder Kabel, fördern; das ist klar. Dazu haben wir die entsprechenden Programme, dazu haben wir die Vorhaben. Der Bundesfinanzminister hat gesagt, dass zusätzliche Mittel in einen Digitalfonds kommen, damit wir anfangen können und nicht wieder zwei Jahre warten müssen, bevor es endlich losgeht.
Die Ausschreibungen müssen so sein, dass die Leute vor Ort die Mittel auch nutzen können und nicht in Bürokratie ersticken; auch das haben wir gelernt. Daran werden wir arbeiten.
Aber das geht ja weiter. Es geht um Forschung und Entwicklung. Wir zählen zu den fünf Ländern, die am meisten für Forschung und Entwicklung ausgeben. Aber es ist richtig, dass wir uns vorgenommen haben, den Anteil, der heute bei 2,94 Prozent des Bruttoinlandsprodukts liegt, auf 3,5 Prozent im Jahre 2025 zu erhöhen, weil es heute Länder gibt, die bereits diese 3,5 Prozent erreicht haben.
Da ist es natürlich von entscheidender Bedeutung, dass wir im industriellen Bereich, insbesondere im Mobilitätsbereich bei der Digitalisierung vorne mit dabei sind. Bei der Digitalisierung im Konsumentenbereich haben wir den Anschluss ja verloren. Da nutzen wir alle asiatische oder amerikanische Geräte; daran haben wir uns gewöhnt – okay. Das werden wir auch so schnell nicht aufholen.
Aber jetzt, wo es um unsere industriellen Grundlagen geht, um das Internet der Dinge – wir sind ein Land, das noch eine hohe industrielle Wertschöpfung hat –, da müssen wir vorne mit dabei sein. Da reichen Platz fünf, Platz sechs oder sonst was nicht aus; sonst werden wir kein führendes Industrieland mehr sein.
Ich fange bei der Mobilität an. Die Mobilität wird sich dramatisch verändern. Deshalb ist es natürlich nicht nur zu kritisieren, sondern eigentlich auch unfassbar, sage ich mal, welches Vertrauen die deutsche Automobilindustrie im Zusammenhang mit dem Dieselskandal verspielt hat.
Es ist jetzt unsere Aufgabe, der Industrie zu sagen: Ihr müsst verlorengegangenes Vertrauen selber wiedergutmachen; das ist nicht die Aufgabe der Politik.
Aber ich sage auch: Es kann auch nicht in unserem Interesse sein, dass wir durch politische Maßnahmen die Automobilindustrie so schwächen, dass sie keine Kraft mehr für die eigentlichen Zukunftsinvestitionen hat. Das ist die Auseinandersetzung, die wir jetzt führen, zum Beispiel um Hardwarenachrüstung.
Die Gutachten liegen jetzt auf dem Tisch. Sie müssen bewertet werden. Dann werden wir auch die Kommunen wieder einladen. Dann wird das Forum Diesel tagen. Aber, meine Damen und Herren, Tausende von Euro – egal ob es 2 000, 3 000 oder 5 000 sind – und zwei bis drei Jahre Beschäftigung zahlreicher Ingenieure mit der Frage, wie man die Typenzulassung kriegt, weil man an dem Motor etwas geändert hat: Ist das die richtige Beschäftigung für die Automobilindustrie? Oder müssen wir nicht alle Kräfte zusammennehmen und der Automobilindustrie sagen: „Ihr müsst jetzt in die Mobilität der Zukunft investieren, ins autonome Fahren, in alternative Antriebe; dabei unterstützen wir euch“?
Da gibt es für mich einen Punkt, der mich seit Jahren umtreibt. Ich bin froh, dass da bei der Wirtschaft jetzt ein Umdenken stattfindet: die Tatsache, dass behauptet wird, die Batteriezellproduktion könnten wir in Europa nicht mehr haben. Ich sage Ihnen: Die Batterie macht rund 40 Prozent der Wertschöpfung eines Autos der Zukunft aus – jetzt nehmen wir mal an, die Elektromobilität ist die Antriebstechnologie der Zukunft, was nicht sicher ist –, und dazu kommt noch 20 bis 30 Prozent digitale Wertschöpfung. Der eine Teil kommt dann aus Amerika oder Asien; der andere Teil, die Batterie, kommt auch, definitiv, aus Asien. Was ist dann noch die Wertschöpfung, die wir hier in Europa haben?
Deshalb sage ich: Wir brauchen eine strukturierte Förderung. Die Europäische Kommission sieht solche Möglichkeiten vor. Wir machen das jetzt schon bei Chips, wo wir eine Kraftanstrengung vornehmen, um auch in die Zellproduktion einzusteigen. Nur, ohne wirtschaftlichen Druck und ohne wirtschaftliche Mitmacher geht das natürlich nicht; das können wir nicht als Staat machen. Deshalb bin ich dankbar, dass einige in der Automobilindustrie da umdenken. Wir werden das unterstützen.
Wir brauchen die konsequente Digitalisierung von Verwaltung, was im Übrigen kompatibel mit der Gesundheitskarte sein sollte. Das sage ich dem Geburtstagskind Jens Spahn heute mal. Er hat heute Geburtstag.
Wir brauchen einen Zugang der Bürgerinnen und Bürger für alle Verwaltungsleistungen. Das zu schaffen, wird natürliche eine große Kraftanstrengung sein. Und wir brauchen eine nationale Bildungsoffensive, sowohl durch den DigitalPakt Schule als auch im Bereich der Weiterbildung der Arbeitnehmerinnen und Arbeitnehmer. Denn die Veränderungen, die jetzt im technischen Bereich stattfinden, haben natürlich massive Auswirkungen auf das, was in Zukunft gebraucht wird.
Wir haben heute schon einen großen Fachkräftebedarf, den wir befriedigen müssen. Deshalb ist es richtig, dass wir ein Fachkräftezuwanderungsgesetz auf den Weg bringen werden; denn wir wollen die Wirtschaft stärken. Das Ganze hängt im Augenblick gar nicht mehr an den hohen Sozialabgaben oder an der Steuerfrage; es hängt daran, dass man in Deutschland einfach niemanden mehr findet. Da müssen wir helfen, dass die Wirtschaft in Deutschland bleiben kann und hier Wertschöpfung betreibt und dass sie nicht irgendwohin weggehen muss, weil sie hier keine Fachkräfte findet.
Deshalb ist das die richtige Antwort.
