für die Euro-Zone für sie vorstellbar ist, also noch mehr staatliche Programme, noch mehr staatliche Wirtschaftsförderung, ohne zu fragen: Brauchen wir das eigentlich? Oder bräuchten wir nicht vielmehr private Investitionen, Innovationen und unternehmerische Initiative, statt noch mehr Steuergelder für falsche Programme auszugeben.
Was man sagen kann, Herr Minister – egal ob Sie diesen Investivhaushalt wollen oder nicht; darüber kann man streiten –: Der Finanzplan, den Sie vorgelegt haben, über den wir heute diskutieren, ist eigentlich schon überholt, wenn Sie einen solchen Investivhaushalt machen wollen; denn dann müssen Sie dafür zusätzliche Mittel einstellen. Wir beraten also im Grunde über einen Finanzplan, der heute schon nicht mehr aktuell ist, weil Sie bereits zusätzliche Maßnahmen planen.
Wichtig für die Stabilität in Europa ist natürlich auch, dass wir in Deutschland stabiles Wachstum haben. Sie kündigen im Koalitionsvertrag an, dass der Solidaritätszuschlag im Jahr 2021 halb abgebaut werden soll. Sie wollen den Soli also zur Hälfte abschaffen.
Sie, Herr Scholz, der Bundesfinanzminister, haben am Dienstag gesagt, dass Sie den Soli eigentlich auch komplett abschaffen wollen. Sie haben nur nicht gesagt, wann. Und Sie haben uns vor allem nicht schlüssig erklärt, ob das die Haltung der gesamten Bundesregierung und ob das die Haltung der sie tragenden Fraktionen ist. Das ist eine Ankündigungspolitik, die im Widerspruch steht zu allem, was Ihre eigene Fraktion hier monatelang vorgetragen hat. Das ist nicht die Klarheit, die die deutschen Bürgerinnen und Bürger brauchen;
vielmehr brauchen sie klare Ansagen, die nachher auch eingehalten werden und die verbindlich sind.
Wenn Sie beim Soli einmal genau hinschauen, dann stellen Sie fest, dass es ernstzunehmende Gutachten gibt, die besagen, dass die Abschaffung 2020 erfolgen muss, und zwar für alle Steuerzahler. Sie können also nicht einen Teil weiterhin belasten und einen anderen Teil nicht. Wenn Sie das, was Sie im Koalitionsvertrag vereinbart haben, die halbe Abschaffung des Solidaritätszuschlags, umsetzen, dann sage ich Ihnen eines voraus – das kann weder in Ihrem noch in unser aller Interesse sein –: Wir werden ab dem Jahr 2020 eine Flut von Einsprüchen von Bürgerinnen und Bürgern haben, die gegen ihre Steuerbescheide vorgehen – übrigens mit guten Argumenten und mit Fug und Recht. Sie werden nachher derjenige sein, der für finanzielle Risiken im Bundeshaushalt geradestehen muss, weil eben nicht klar ist, ob der Solidaritätszuschlag ab 2020 überhaupt noch erhoben werden darf. Verhindern Sie dieses Chaos. Verhindern Sie, dass unsere Finanzämter mit Millionen von Einsprüchen überschwemmt werden. Machen Sie einfach gleich den richtigen Schritt: Abschaffung des Solidaritätszuschlags ab 2020. Vermeiden Sie diese ganzen schwierigen Auseinandersetzungen.
In diesem Zusammenhang haben Sie am Dienstag auch angekündigt, dass Sie Steuermehreinnahmen zum Abbau der kalten Progression nutzen wollen. Da habe ich bisher von der SPD-Fraktion immer gehört, diese sei gar kein so großes Problem. Auch da frage ich Sie: Ist das eigentlich die Haltung der Regierung? Ist das die Haltung der Koalition? Wenn Sie die Bezieher mittlerer Einkommen entlasten wollen, wenn Sie wie wir der Meinung sind, dass die Steuereinnahmen auch Spielräume dafür bieten, dann bringen Sie es Ihrer eigenen Koalition bei. Leisten Sie hier Überzeugungsarbeit, und setzen Sie es dann um! Wir werden die Allerletzten sein, die Ihnen dabei im Wege stehen, Herr Minister.
Bemerkenswert, Herr Minister, ist allerdings auch, was Sie in dieser Woche nicht gesagt haben: Im Koalitionsvertrag steht kein Wort zur Steuererhöhung bei der Abgeltungsteuer. Kein Wort von Ihnen zur Finanztransaktionsteuer. Sollte das der Einsicht geschuldet sein, dass Steuererhöhungen und neue Steuern falsch sind, dann haben Sie auch da die Freien Demokraten an Ihrer Seite. Aber ich frage Sie: Sprechen Sie hier eigentlich für die Regierung? Was ist überhaupt die Haltung der Regierung zur Steuererhöhung bei der Abgeltungsteuer und zur geplanten Finanztransaktionsteuer? Beantworten Sie diese Fragen einmal; in dieser Haushaltswoche hätten Sie dazu die Gelegenheit gehabt.
Liebe Kolleginnen und Kollegen, ich komme zum Schluss. Wir brauchen in Deutschland eine klare prinzipiengeleitete Finanzpolitik, ein verantwortungsvolles Wirtschaften von Staaten und Banken in Europa und die Entlastung der Mittelschicht in Deutschland. Das ist der Weg, den wir vorschlagen. Wenn Sie das machen wollen, Herr Minister, haben Sie uns mehr auf Ihrer Seite als vermutlich einen guten Teil Ihrer eigenen Koalition.
Das Wort für die Fraktion Die Linke hat die Kollegin Dr. Gesine Lötzsch.
