Frau Präsidentin! Meine Damen und Herren! Es war ja vorauszusehen, Herr Mayer und Frau Rößner, dass die berechtigte Kritik der AfD hier im Plenum wieder als populistisches Schüren von Ängsten und Panikmache interpretiert wird.
Dazu kann ich nur sagen: Sie verwechseln hier Ross und Reiter. Die Ängste werden nicht von uns geschürt. Sie haben diese Verordnung erlassen,
welche drakonische Strafen in Höhe von bis zu 20 Millionen Euro für diejenigen vorsieht, die sich diesem bürokratischen Irrsinn nicht beugen wollen oder können.
Die Ängste der Menschen sind real. In Anbetracht des deutschen Abmahnunwesens sind sie auch realistisch. Vor zwei Wochen war sogar in der „Zeit“ zu lesen, dass es der deutschen Mittelschicht längst nicht so gut geht, wie hier immer behauptet wurde. Viele Menschen befürchten den sozialen Abstieg, und ihre Befürchtungen sind berechtigt. Viele von Ihnen, die hier im Plenum sitzen, haben ja selbst an dem Dokumentarfilmprojekt teilgenommen, auf das ich hier anspiele, Stichwort „Ungleichland“.
Jeder dritte Arbeitnehmer in Deutschland sieht sich finanziell nicht in der Lage, plötzliche Ausgaben von 1 000 Euro zu stemmen. Bei freischaffenden Journalisten, Fotografen, Künstlern sieht die Lage wohl nicht viel besser aus. Schon alleine die Androhung eines Bußgeldes in nur dreistelliger Höhe treibt viele dieser Menschen in die Verzweiflung und an den Rand des Ruins. Sie alle sind verantwortlich dafür, dass so große Unklarheit darüber herrscht, wie dieses Gesetz auszulegen ist und mit welcher Rigorosität Datenschutzdelikte am Ende verfolgt werden.
Darf ich unbehelligt fotografieren oder nicht? Wie verträgt sich die Datenschutz-Grundverordnung mit der im Grundgesetz verankerten Freiheit der Meinungsäußerung oder der Informationsfreiheit?
