Italien gibt inzwischen Bonds mit Minizinsen und einer Laufzeit von 50 Jahren heraus. Machen Sie es, Herr Minister, wie Italien,
und begeben Sie diese Anleihen, bei denen Deutschland dann auch noch die Zinsen bezahlen soll. Fällig werden solche Anleihen dann garantiert nicht mehr in Euro; denn die Tilgung 2070 wird garantiert nicht stattfinden.
Natürlich ist das Ironie. Aber das ist die Realsatire, die wir in Italien erleben.
Fünftens. Zum Dauerthema EWF haben wir von Minister Scholz leider erneut nur orakelhafte Andeutungen gehört. Will die Regierung nun den EWF nach Unionsrecht – was nach einhelliger Meinung aller Experten illegal wäre –, wenn ja, bis wann?
Diese Fragen werden auch Budgetwirkungen haben, zumal der EWF ja als Letzthafter beim Bankenabwicklungsfonds und auch bei der Einlagensicherung fungieren soll. Die Summen, um die es hier geht, können im Fall einer Bankenkrise in die Billionen gehen.
Natürlich ist auch der Common Backstop, also die Letzthaftungsfunktion, eine Chiffre für – wie immer – „Deutschland zahlt im Ernstfall alles“.
Das ist verfassungswidriger Transfersozialismus – ganz klar nach AEUV.
