Dabei haben Sie, Herr Scheuer – lassen Sie mich das als Berliner formulieren –, an anderer Stelle bewiesen, dass Sie durchaus analytischen Verstand haben, und zwar bei Ihrer Einlassung zum Flughafen Tegel. Leider haben Sie aber offensichtlich nicht das Durchsetzungsvermögen in Ihrer Koalition oder auch in der Union – Herr Dobrindt hat es ja auch schon versucht –, um Ihren Ankündigungen zum Thema „Offenhaltung des Flughafens Tegel“ gegebenenfalls auch entsprechende Schwerpunkte in den Haushaltsansätzen folgen zu lassen. Das wäre ein Punkt, bei dem Sie, glaube ich, durchaus die Mehrheit – vielleicht die stille Mehrheit – dieses Hauses hinter sich hätten;
denn all diejenigen Kolleginnen und Kollegen, die in Sitzungswochen zwei, drei oder vier Stunden längere Fahrzeiten benötigen würden, wenn der Flughafen Tegel geschlossen ist, würden gegebenenfalls Änderungen aufseiten des Bundes zustimmen.
Sie, Herr Minister Scheuer, haben die Chance, in den nächsten Jahren den Politikstil Ihrer Vorgänger – Tagespolitik nach Umfragen – abzuschütteln und sich darauf zu besinnen, dass der große Investitionshaushalt, den Sie in den nächsten Jahren verantworten,
sich als eine Art Grundlage und Bollwerk für den volkswirtschaftlichen Wohlstand in der Bundesrepublik Deutschland darstellt und nicht in einer ineffizienten Mittelverwaltung verharrt, wie es offensichtlich in den letzten Jahren unter der Verantwortung Ihres Vorgängers der Fall war.
Ich danke Ihnen.
Als Nächster spricht für die Fraktion Die Linke der Kollege Victor Perli, der heute seine erste Rede im Bundestag hält.
