Sehr geehrter Herr Präsident! Sehr geehrte Damen und Herren! Man kann wie die AfD immer am Thema vorbeireden und das Thema verfehlen oder dazu sprechen. Ich spreche dazu und zu dem Antrag der FDP, der zunächst eingebracht, dann wieder zurückgezogen und durch den Antrag zum Thema Nachzahlungszinsen – auf ihn freue ich mich auch schon – ersetzt wurde. Dann folgte wieder die Rolle rückwärts.
Wieso? Weil es ein Schaufensterantrag der FDP ist, in sich widersprüchlich und in den Teilen auch peinlich. Das hat man auch gemerkt.
Sie fordern nämlich die Bundesregierung auf, „darauf hinzuwirken, dass Körperschaften, deren Repräsentanten bei der Verfolgung des gemeinnützigen Zwecks der Körperschaft gegen die geltenden Strafgesetze verstoßen oder zu einem solchen Rechtsbruch aufrufen, grundsätzlich nicht mehr in den Genuss der Steuerbegünstigung der Gemeinnützigkeit kommen dürfen“.
Das ist so, als würde man die FDP auffordern müssen, Klientelpolitik für Superreiche zu machen, sehr geehrte Damen und Herren von der FDP.
Denn diese Aufforderung ist völlig unnötig. Denn alles ist in der Abgabenordnung oder im Anwendungserlass bereits geregelt. Die Anerkennung der Gemeinnützigkeit einer Körperschaft hat sich nach § 52 der Abgabenordnung an deren Tätigkeit auszurichten; sollte sie gegen Strafgesetze verstoßen, zu Rechtsbruch aufrufen oder ihn rechtfertigen, ist die Zuerkennung der Gemeinnützigkeit bereits nach geltendem Recht ausgeschlossen, meine sehr geehrten Damen und Herren.
Zu den Repräsentanten ist der Anwendungserlass zur Abgabenordnung zu § 63 Nummer 5 zu zitieren:
