Guten Morgen, Herr Präsident! Sie hatten eine Stunde weniger Schlaf als ich. Insofern können wir uns vergleichen. Aber ich glaube, wir können uns noch ganz gut sehen lassen.
Ich bin auch jünger als Sie.
Wir arbeiten ja daran, dass die Debatten ein bisschen beschleunigt werden.
Ich möchte zunächst einmal wissen: Wo ist eigentlich der Kollege Hollnagel? Den sehe ich noch nicht oder nicht mehr.
Dem wollte ich eigentlich eine Antwort geben auf seine Anmerkung, die Europäische Zentralbank sei nicht unabhängig. Vielleicht geben Sie es ihm weiter. Die Unabhängigkeit der Europäischen Zentralbank richtet sich nämlich nach europäischem Recht, und der Europäische Gerichtshof hat diese Unabhängigkeit zu beurteilen. Er hat sie in einem ganz zentralen Verfahren bestätigt. Ich glaube, daran müssen wir unsere Unabhängigkeitsdiskussion messen. Wir haben unsere Kriterien in gemeinsamer Überzeugung auf Europa und auf die europäischen Institutionen übertragen.
Ich bin dann doch etwas überrascht gewesen, mit welcher Radikalität er gesagt hat: Die Banken können pleitegehen; das ist sozusagen ordnungspolitisch richtig; dann müssen eben die Kunden der Banken schauen, wo sie bleiben. – Das ist wirklich eine Ohrfeige für Einleger, für Anleger, für Sparer vor allen Dingen und für die Arbeitnehmer, die Vertrauen in uns und in das Bankensystem haben, dass sie dort, wo sie etwas deponieren, auch abgesichert sind. Diese radikale marktwirtschaftliche These hatte ich in dieser Weise allenfalls vom Wilden Westen her erwartet. Aber dass es von Ihnen kommt, überrascht, ehrlich gesagt, auch nicht mehr.
