Frau Präsidentin! Herr Minister Müller! Liebe Kolleginnen! Liebe Kollegen! Dass im Vorfeld dieser Haushaltswoche der Haushalt des BMZ – Stichwort: ODA-Quote – und der Verteidigungshaushalt Gegenstand der öffentlichen, ja auch der koalitionsinternen Debatte waren, zeigt nicht zuletzt: Wir brauchen eine öffentliche Debatte über die gewachsene internationale Verantwortung unseres Landes.
Für uns als Unionsfraktion ist klar: Investitionen im eigenen Land in eine gute Zukunft – Stichworte: Bildung, Forschung, sozialer Zusammenhalt – und ein klares Bekenntnis zur gewachsenen internationalen Verantwortung gehören untrennbar zusammen. Ein Deutschland, das sich abschottet oder seiner Verantwortung entzieht, kann keine gute Zukunft haben, meine Damen, meine Herren.
Wir bekennen uns zu unserer Verantwortung und versuchen, die Lage der Menschen in den ärmsten Ländern der Welt, der Menschen, die von Bürgerkriegen und Ausbeutungen in dramatischer Weise betroffen sind, nachhaltig zu verbessern. Dies ist ein Gebot der Humanität, dem wir uns als christliche Demokraten verpflichtet fühlen, international und auch weil es in unserem eigenen Interesse ist.
Ich möchte an dieser Stelle, bevor wir über das Geld reden – das gehört sich so in einer Haushaltsdebatte – danksagen, dass das Geld, das zur Verfügung gestellt wird, die Arbeit von Menschen möglich macht, die als Freiwillige, als Ehrenamtliche oder im Hauptamt oft unter Inkaufnahme eines erheblichen persönlichen Risikos Dienst am Menschen in Not tun. Das ist etwas, was unser aller Dank verdient, meine Damen, meine Herren.
Der Haushaltsentwurf ist ein deutliches Zeichen des Bekenntnisses zu dieser Verantwortung. 9,4 Milliarden Euro – das ist Rekordwert; das ist eine Steigerung um mehr als 10 Prozent im Vergleich zum Vorjahr. Da wir so markante Worte zur ODA-Quote von Kollegin Hajduk von den Grünen gehört haben, will ich anmerken: Seit 2005 gibt es im BMZ-Haushalt ein Plus von 130 Prozent. In derselben Zeit hat das Ausgabevolumen insgesamt eine Steigerung um 30 Prozent erfahren.
30 Prozent Steigerung, 130 Prozent in der internationalen Solidarität – und dies nach sieben mageren rot-grünen Jahren der Stagnation bei 4 Milliarden Euro. Unvergessen ist jedem, dass damals Heidemarie Wieczorek-­Zeul von Joschka Fischer Häme und nicht Hilfe erfahren hat. Ich denke, daran werden auch Sie noch mit Scham denken.
Es ist Gott sei Dank lange her, dass Sie dafür Verantwortung getragen haben; deswegen ist es ein Blick in die für Sie peinliche Geschichte. Unsere Taten bewirken die 130-prozentige Steigerung des Etats bei einem Gesamt­etatanstieg von 30 Prozent.
Wir ruhen uns darauf nicht aus;
