Damit hätten wir immerhin ein materielles Recht, das eine effiziente Verfolgung ermöglichen würde. Damit das funktioniert, brauchen wir auch verfahrensrechtliche Maßnahmen. Die Rechnungshöfe und andere Prüfstellen erstellen ihre Berichte. Wir müssen sie verpflichten, wenn sie einen Anfangsverdacht auf eine solche Straftat haben, dies bei der Staatsanwaltschaft anzuzeigen. Die Staatsanwaltschaften wären dadurch ein Stück weit entlastet, weil sie eine bereits wohl vorbereitete Strafanzeige bekommen, von Fachleuten erstellt und nicht von irgendjemandem, der sich nur so etwas denkt.
Um die Sache zu vervollkommnen und um Staatsanwaltschaften die nötige Motivation zu geben – so sie denn fehlen sollte, so etwas zu verfolgen –, müssen sie das formelle Beschwerderecht nach § 172 StPO bekommen. Das heißt, sie müssen vor Gericht die Anklageerhebung erzwingen können. Stellen Sie sich die Hierarchie in einem Bundesland vor. Wenn dann gegen einen Bundesminister ermittelt wird, dann ist das für eine Staatsanwaltschaft gar nicht so einfach, gegen einen solch hochrangigen Politiker Anklage zu erheben. Wenn man das vor Gericht erzwingen kann, sieht die Sache völlig anders aus.
Wir brauchen gleichfalls einen Tatbestand der Unterlassung von öffentlichen Ausschreibungen, wenn sie ohne Not unterbleibt. Hierfür schlagen wir die Einführung einer Ordnungswidrigkeit mit einer Geldbuße bis zu 100 000 Euro vor.
Mit dem materiellen zusammen mit dem verfahrensrechtlichen Teil haben wir ein durchaus scharfes Instrument. Auf diese Weise könnten wir – da wetten wir – Milliarden Euro sparen, jedes Jahr. Diejenigen, die zum Thema Steuergeldverschwendung arbeiten, sagen, dass das so viel ausmacht.
An dieser Stelle kommt normalerweise der Spruch: „Ich freue mich auf eine angeregte Diskussion im Ausschuss.“ Tja, wir alle wissen, da wird nicht viel bei herumkommen; denn Anträge der AfD werden üblicherweise nicht ernsthaft diskutiert, sondern schlank abgelehnt. Das wird auch diesem Antrag passieren. Umso gespannter bin ich darauf, was sich die mir nachfolgenden Redner einfallen lassen, um zu begründen, weshalb man das alles nicht braucht. Gerne genommen wird an dieser Stelle immer der handwerkliche Fehler. Vorsicht Falle! Wir sind nicht in der dritten Lesung, sondern in der ersten. Handwerkliche Fehler könnte man im Ausschuss ohne Weiteres noch ausbügeln. Man könnte Änderungsanträge stellen usw.
Sie können natürlich auch sagen: Das stimmt alles nicht, wir leben sowieso in der besten aller denkbaren Welten, und da gibt es so etwas überhaupt nicht; Steuergeldverschwendung in nennenswertem Maß findet in diesem Land nicht statt. – Ich bin gespannt, was Sie sich einfallen lassen. Jedenfalls: Wir sehen uns im Ausschuss.
Jetzt erteile ich das Wort dem Kollegen Dr. Jan-Marco Luczak, CDU/CSU.
