Frau Präsidentin! Meine Damen und Herren! Frau Ministerin, schön, dass Sie da sind.
– Es ist in einer Aktuellen Stunde ja nicht immer so, dass die Ministerin oder der Minister kommt.
Zu dem Vorschlag der Europäischen Kommission – ich will es gleich ganz direkt sagen, und ich ahne schon, dass wir etwas unterschiedlicher Meinung sind –: Wir finden diesen Vorschlag zur GAP-Reform, zur Agrarreform, enttäuschend, weil das, was sich in den letzten Jahren bewegt hat, wie weggeblasen scheint. Man muss im wahrsten Sinne des Wortes sagen: Das ist nicht nur wie weggeblasen, sondern das ist eigentlich ein Rückschritt auf der ganzen Linie. Der Vorschlag missachtet eigentlich alles, wozu wir uns bei Klimaschutz, bei Tierschutz und bei Artenvielfalt verpflichtet haben. Er folgt nur kurzfristigen Interessen.
Man könnte meinen, das sei im Labor entwickelt worden. Da wir uns gerade mit der Landwirtschaft beschäftigen, würde ich sagen: Das wurde im Silo entwickelt – ohne Beachtung dessen, was draußen drumherum passiert.
Wenn wir uns mal die Ernährungssituation weltweit ansehen und das herunterbrechen, dann wissen wir: Auf der einen Seite hungern 815 Millionen Menschen, auf der anderen Seite leben wir im Überfluss, und wir müssen uns sogar mit der Frage „Food Waste“ beschäftigen – also damit, dass Lebensmittel weggeworfen werden – und Gegenstrategien haben.
14 bis 18 Prozent der Treibhausgasemissionen kommen aus dem Bereich „Landwirtschaft und Ernährung“. Wenn wir die ganze Kette genauer berücksichtigen, den Transport, die Entwaldung, die Produktionsverfahren, Food Waste usw., dann sehen wir, dass 40 bis 50 Prozent der Treibhausgasemissionen allein aus diesem Bereich kommen.
Was bietet uns die Kommission als Lösung an? Etwas, was quasi im Silo entwickelt wurde. Das ist wahrscheinlich das Klein-Klein der Vorschläge der Agrarminister, die sie in Brüssel vorgebracht haben. Am Ende zählt nur die Produktion, das Ziel, immer mehr zu produzieren. Aber wir haben auf UN-Ebene auch Nachhaltigkeitsziele unterschrieben.
Wo ist dann das Klimaziel? Wo geht es denn um die Themen Wasser, Biodiversität, Ökosysteme oder menschliche Gesundheit? Das alles ist hier schon diskutiert worden.
40 Prozent des EU-Haushaltes werden für den Agrarbereich ausgegeben. Und was gestalten wir damit? Das passt überhaupt nicht zu den politischen Zielen, die wir uns gesetzt haben.
Es macht sich auch niemand die Mühe, sich mal damit auseinanderzusetzen, wie denn die Zukunft in den einzelnen Segmenten dieses Bereiches aussehen wird.
120 Prozent des Bedarfs an Schweinefleisch produzieren wir. Ich weiß nicht, wer das alles essen soll.
