Niger und Mali, zwei Länder, die im Fokus Europas und der USA stehen, haben – ach Wunder – nicht nur massive Probleme durch Terror, Hunger und Nichtteilhabe, sondern eben auch ganz viele Rohstoffe wie Uran und Kobalt; Kobalt, liebe Grüne, das die E-Mobilität-Produzenten dringend brauchen und Lieferanten aus der Schweiz und China gerne liefern: 10 Kilogramm pro Auto, so rechnet man, abgearbeitet durch Kinderarbeit und Terror. Das ist die grüne Blutrealität, liebe Freunde;
denn E-Mobilität ist nicht nur nicht CO 2 -neutral, sondern wird auch durch Duldung menschenunwürdiger Arbeit in Afrika zu einem grünen Dilemma. Aber darüber reden wir jetzt besser nicht. – Herr Müller, vielleicht wäre es ein guter Ansatz, neben Ihrem grünen Knopf demnächst ein grünes Lenkrad für Fairtrade-Elektroauto-Mobilität einzuführen.
Auf das Uran haben gerade unsere französischen Freunde ein Auge geworfen. Ausbau und Festigung der Kernenergie ist das Ziel. Auch hier sind die USA, China und Frankreich die großen postkolonialen Akteure.
In Syrien herrscht ein Krieg, der weiter von außen gesteuert wird. Ziel: das Verlegen einer Gaspipeline durch Syrien. Akteure: Frankreich und die USA. Deutsche Embargos? Fehlanzeige! Und wo bleiben Sie da, Herr Müller?
Deutschland liefert weiter und immer weiter Entwicklungshilfe. Es ist oft kaum nachvollziehbar, in welchen Kanälen die Gelder versumpfen. Die einen zerstören, wir bauen wieder auf. Vielleicht ist das ja die Aufgabe in unserem globalen Spiel, weil wir eben nicht mitbomben: Wir kleben Pflaster auf die offenen Wunden von Ländern, die klinisch tot sind, aber immer weiter künstlich beatmet werden.
Wollen wir helfen, müssen wir die Tatsachen endlich beim Namen nennen, damit es massiven Druck von außen gibt. Das Elend unserer Welt entsteht durch die Ausbeutung von Mensch und Planet. Da helfen nur wirklich real existierende Leuchtturmprojekte und nicht ständig neue Hochglanzprospekte.
Im Gebiss des Bundeshaushaltes ist der Zahn der Entwicklungspolitik – Herr Müller, Ihres Zukunftsprojektes – an der Wurzel entzündet, er ist faul. Da hilft auch keine Hochglanzfüllung. Da hilft nur eins: ziehen und neu denken! Und dann kann es auch etwas werden mit dem kräftigen Zubeißen sinnvoller Entwicklungspolitik. Dann kann es auch mit dem Toreschießen klappen: Tore für die Wahrheit, Tore für die Menschheit und Tore für Deutschland.
Danke schön.
Das Wort hat die Kollegin Gabi Weber für die SPD-Fraktion.
