In der Summe muss er 400 Seiten durcharbeiten, um einen Einmalbeitrag anlegen zu dürfen. Entscheidet er sich danach, 50 Euro monatlich anzulegen, bekommt er diese 400 Seiten noch einmal auf den Tisch geknallt.
Wir glauben, darüber könnte man Anlegerschutz realisieren. Wir machen das Gegenteil: Wir stärken nicht den Anlegerschutz, sondern wir schwächen den Anlegerschutz damit,
weil die Menschen zu Hause bleiben, ihr Geld im Zweifel unters Kopfkissen legen und eben keine sinnvollen Anlagen für das Alter wählen. Das ist unsere Realität. Deshalb, glaube ich, müssen wir im Anlegerschutz neu denken.
Wir müssen im Kern die Rechte der Anleger im Verhältnis zwischen Anleger und den entsprechenden Verkäufern stärken. Gegenüber den Emittenten auf der anderen Seite müssen wir die Rolle des Anlegers in diesem Dreiklang viel stärker herausarbeiten. Daran sollten wir als Deutscher Bundestag arbeiten und nicht einer Regulierungsillusion unterliegen, indem wir glauben, wir hätten damit etwas für den Anlegerschutz getan.
Das, was wir tun, führt am Ende dazu, dass wir damit zufrieden sind, etwas vorgelegt zu haben, und dass die Banken im Zweifel durch ihren Wust an Bürokratie aus der Haftung raus sind. Das ist aber kein Anlegerschutz, sondern das führt dazu, dass die Menschen in ihren Freiheiten eher eingeschränkt sind, zu Hause bleiben und nicht fürs Alter vorsorgen.
Deshalb sollten wir alles dafür tun, dass sich diese Richtung ändert. Unabhängig von diesem Gesetz sollten wir stärker für Freiheit in der Anlagepolitik werben.
Vielen Dank.
Als Nächstes spricht für die Fraktion Die Linke der Kollege Hubertus Zdebel.
