Sehr geehrter Herr Präsident! Liebe Kolleginnen und Kollegen! Ich möchte mit einem außergewöhnlichen Lob für den Abgeordneten Gehrke beginnen, weil das die erste Rede der AfD war, in der das Wort „Flüchtling“ nicht vorkam und in der der Flüchtling nicht für alles verantwortlich gemacht wurde.
Lieber Herr Theurer, es hat mich gepfupfert, dass Sie in Ihrer Rede Minister Spahn beim Thema Digitalisierung angehen. Ich bin seit 16 Jahren im Deutschen Bundestag und habe 4 Jahre FDP-Minister miterlebt. Ich kann mich an Diskussionen und Debatten mit Jens Spahn erinnern, in denen wir Herrn Rösler und Herrn Bahr bekniet haben, mehr beim Thema Digitalisierung zu machen. Einmal ging es um 50 Cent für einen elektronischen Entlassbrief. Selbst dazu war man nicht bereit.
Deswegen ist es, glaube ich, nicht angebracht, dass Sie uns dafür verantwortlich machen. Sie hätten wunderbare Dinge auf den Weg bringen können.
Was von 4 Jahren FDP an der Spitze des Gesundheitsministeriums übrig bleibt, ist die Abschaffung der Praxisgebühr. Das ist der größte Sündenfall in 16 Jahren Gesundheitspolitik. Demgegenüber wäre Eigenverantwortung wichtig gewesen.
– Dazu habe ich andere Informationen.
Meine sehr verehrten Damen und Herren, wir reden heute über den Einzelplan Gesundheit mit einem Gesamtvolumen in Höhe von 15,2 Milliarden Euro. Lieber Herr Gehrke, Sie kritisieren, dass es nur eine Erhöhung von 41 Millionen Euro gab. Ich glaube, es ist ein ganz wichtiger Punkt, deutlich zu machen, dass das ein Zeichen von Stabilität ist. Wenn man die zurückliegenden Jahre betrachtet und sieht, wie schwierig es bei der Finanzierung der gesetzlichen Krankenversicherung war, dann ist es, glaube ich, gut, zu wissen, dass wir in diesen Bereich Kontinuität hineingebracht haben und dass wir den Steuerzuschuss in Höhe von 14,5 Milliarden Euro unverändert lassen.
Das ist in doppelter Hinsicht ein gutes Zeichen.
Herr Kollege, gestatten Sie eine Zwischenfrage?
