Herr Präsident! Werte Kolleginnen und Kollegen! Herr Kollege Friedhoff, Sie haben auf die Frage, über die hier heute aufgrund der Anträge diskutiert werden soll, keine Antwort gegeben, sondern Sie haben wieder einmal versucht, alles ins AfD-Schema – Grenzen zu, möglichst keiner rein und alles, was fremd ist, erst mal als fremd klassifizieren – zu pressen.
Ich sage Ihnen, es gibt mindestens drei gute Gründe, weshalb wir eine intensivere Zusammenarbeit mit Afrika brauchen.
– Hören Sie einfach mal zu. Sie auch, Herr Friedhoff.
Erstens. Der erste wichtige Grund ist der menschliche Anstand.
Zu menschlichem Anstand gehört, dass wir als Menschen miteinander umgehen, dass wir uns da unterstützen, wo jemand Unterstützung braucht.
Dazu kommt auch eine gewisse historische Verantwortung, die Europa in Afrika immer noch hat.
Zweitens. Jeder weiß: Man kann nicht auf Dauer in Sicherheit leben, wenn es den Nachbarn schlecht geht, wenn die Nachbarschaft instabil ist. Es liegt also in unserem ureigenen Sicherheitsinteresse, mehr für Entwicklung in Afrika zu tun, mehr für Stabilität zu tun; das ist unser Interesse.
Drittens. Auch die wirtschaftliche Vernunft gebietet eine intensivere Zusammenarbeit; denn Afrika bietet enorme Chancen für wirtschaftliche Zusammenarbeit.
Afrika ist ein Kontinent mit einer sehr jungen dynamischen Bevölkerung.
Ja, ich weiß, es gibt viele Staaten in einer fragilen Situation. Es gibt Katastrophen auf diesem Kontinent. Aber es gibt auch positive Entwicklungen: positive wirtschaftliche und gesellschaftliche Entwicklungen. Und es geht auf diesem Kontinent voran. Es ist nicht umsonst, zusammenzuarbeiten
und sich miteinander zu engagieren, sondern das bringt auch etwas.
Die Entwicklungszusammenarbeit der letzten Jahre hat auch dazu geführt, dass sich die Kindersterblichkeit halbiert hat, dass die Zahl der Menschen in absoluter Armut prozentual abgenommen hat, Das zeigt: Wir können etwas bewegen, wenn wir gemeinsam anpacken.
Ich will aber genauso deutlich sagen: Deshalb hat sich diese Koalition vorgenommen – und das steht im Koalitionsvertrag –:
