Liebe Kolleginnen und Kollegen, wir wollen auch den Wohnungsbau fördern. Das ist in zahlreichen Großstädten besonders notwendig und dringend geboten. Deshalb wollen wir den sozialen Wohnungsbau fördern, nämlich mit 1,5 Milliarden Euro. Wir wollen mehr, und heute haben wir von Herrn Rehberg auch eine Zusage für eine Verdoppelung bekommen.
– Sie haben von 3 Milliarden Euro gesprochen, Herr Rehberg. Aber das reicht uns nicht. Deshalb haben wir als SPD im Koalitionsvertrag durchgesetzt, dass sich die Politik der BImA, der Bundesanstalt für Immobilienaufgaben, künftig stärker an der sozialen Wohnraumförderung beteiligen soll.
Das ist gut, und das geschieht auch mit diesem Haushalt. Wir werden in Zukunft eine Wende in der Liegenschaftspolitik des Bundes haben.
Künftig sollen demnach Grundstücke im Wege des Direktverkaufs ohne Bieterverfahren unterhalb des Verkehrswertes – das ist ein Novum – Kommunen angeboten werden.
Das ist eine echte Wende für Deutschland und für eine gute Wohnungsbaupolitik.
Liebe Kolleginnen und Kollegen, das reicht uns nicht. Gleichzeitig stehen wir auch vor einer anderen Herausforderung. Die FDP möchte Freibeträge für die Grunderwerbsteuer. Wir möchten erst den Missbrauch bei der Grunderwerbsteuer in Form von Share Deals beenden.
Den Ländern entgehen hier jährlich Steuereinnahmen von zig Millionen Euro. Wir brauchen hier klare und verfassungskonforme Lösungen. Wir arbeiten daran, um endlich gegen Spekulationen mit Wohnraum vorgehen zu können.
Liebe Kolleginnen und Kollegen, gute Steuerpolitik ist auch immer eine Frage der Solidarität und Gerechtigkeit. Deswegen wollen wir in der Koalition die Abgeltungsteuer abschaffen und uns für die Einführung einer Finanztransaktionsteuer einsetzen.
Hier wollen wir noch einmal betonen, dass uns wichtig ist, dass die Besteuerung von Derivaten im Rahmen einer Finanztransaktionsteuer beibehalten wird.
Frau Kollegin, gestatten Sie eine Zwischenfrage des Kollegen Dürr?
