Sehr geehrter Herr Präsident! Meine sehr verehrten Kolleginnen und Kollegen! Liebe Damen und Herren! In den letzten Wochen ist ja sehr viel über das geltende Recht und darüber, dass es durchgesetzt werden muss, gesprochen worden. Alles richtig. Dabei ist nur zum Teil bewusst ein falscher Eindruck erzeugt worden. Und dagegen wehre ich mich ganz entschieden. Wir haben unzählige Richterinnen, Staatsanwälte, Polizisten, Rechtsanwältinnen, Rechtspflegerinnen, Gerichtsvollzieher, Beschäftigte im Strafvollzug, die sich jeden Tag sehr engagiert für unseren Rechtsstaat einsetzen. Ich bin wirklich erschüttert darüber, wie in diesem Hause, aber auch außerhalb dieses Hauses teilweise dieses Engagement, diese Arbeit schlechtgeredet wird. Dagegen wehre ich mich ganz entschieden.
Unser Rechtsstaat funktioniert ausgesprochen gut. Ich bin dankbar für den Einsatz unzähliger Beschäftigter bei Polizei und Justiz.
Ich bin auch dankbar für unsere rechtsstaatlichen Verfahren; denn, meine Damen und Herren, mein Engagement gilt dem Schutz unseres Rechtsstaates. In diesem Zusammenhang wurde in öffentlichen Debatten immer wieder unterstellt, dass für die Probleme in unserem Land vor allen Dingen folgende Personen verantwortlich sind: Rechtsanwältinnen und Rechtsanwälte, die Rechte ihrer Mandanten wahrnehmen, Richterinnen und Richter, die sich die Zeit nehmen, die sie brauchen, um ein Urteil zu fällen. Natürlich bin auch ich dafür, dass Gerichtsverfahren so schnell wie möglich abgeschlossen werden.
Was aber nicht geht, ist, rechtsstaatliche Verfahren einfach entfallen zu lassen. Diesen Vorschlag hört man ja auch. Wenn Sie genau hinschauen, dann stellen Sie fest, dass es oft genug so ist, dass Gerichte Entscheidungen aufheben müssen, weil sie rechtswidrig sind. Ich möchte mir nicht vorstellen, wie die Qualität von Verwaltungsakten aussieht, wenn nicht zu befürchten ist, dass diese Verwaltungsakte gerichtlich überprüft werden. Das täte ihnen mit Sicherheit kein Gutes.
Wir müssen hier wirklich aufpassen. Etwas Grundlegendes für unseren Rechtsstaat, etwas Positives wie der Rechtsschutz soll plötzlich einen negativen Beigeschmack bekommen, etwas sein, was lästig fällt. „Vorsicht an der Bahnsteigkante!“, kann ich da nur sagen. Man gewöhnt sich leicht an solche unerhörten Forderungen, sodass man plötzlich das Gefühl bekommt, sie wären normal. Das haben wir in den letzten Jahren schon an einigen Stellen erlebt. Es soll ja sogar zum Schimpfwort geworden sein, ein guter Mensch zu sein.
– Ja, dass Sie sich jetzt aufregen, das habe ich mir gedacht. Es ist der rhetorische Versuch, das Gute im Menschen negativ zu konnotieren. Ich kann Ihnen gar nicht sagen, was ich dabei empfinde. Wie arm muss man innerlich sein, um das hinzukriegen. Ganz ehrlich: Sie tun mir aufrichtig leid.
Meine Damen und Herren, ich werbe für eine Rückkehr zur Sachpolitik. Deshalb müssen wir die vielen richtigen und guten Projekte umsetzen, auf die wir uns im Koalitionsvertrag geeinigt haben. Das ist jedenfalls mein Ansatz, und der spiegelt sich zum Glück auch im vorliegenden Haushaltsentwurf wider, für den ich mich beim Parlament und bei allen Abgeordneten, die daran mitgewirkt haben, ausdrücklich bedanke.
Zuallererst haben wir vor, den Rechtsstaat ganz praktisch zu stärken. Auf der Ebene der Regierungschefinnen und ‑chefs werden wir mit dem Pakt für den Rechtsstaat eine umfassende Qualitätsoffensive starten.
– Ja, es gibt Chefinnen, es gibt Regierungschefinnen, zum Beispiel in meinem Bundesland die ganz wundervolle Malu Dreyer, die eine wirklich ausgezeichnete Ministerpräsidentin ist.
Es ist auch richtig, dass das auf der Ebene der Chefinnen und Chefs passiert;
denn – Sie wissen es – mein Etat ist der kleinste dieser Regierung, und das ist auch in den Bundesländern so. Die Justizressorts verfügen in der Regel nicht über die Mittel, um zum Beispiel 2 000 zusätzliche Stellen für Richterinnen und Richter einfach so zu schaffen. Deswegen ist es richtig, dass diese Verantwortung am Ende auf der obersten Ebene ressortiert.
Es geht dabei um vieles: um Qualifizierung, um Fortbildung, um Digitalisierung der Justiz und eben um diese besagten 2 000 zusätzlichen Stellen für Richterinnen und Richter und Staatsanwältinnen und Staatsanwälte sowie natürlich um weitere Stellen im nichtrichterlichen Bereich.
Im Rahmen des Sofortprogramms Personal schaffen wir auf der Bundesebene jetzt 34 neue Stellen beim Generalbundesanwalt. Auch das ist eine kleine, aber eine sehr wichtige Behörde. Auch in anderen Bereichen verbessern wir die Arbeitsbedingungen; das hat auch mein Kollege aus dem Innenministerium schon gesagt. Mein großer Dank gilt dem Finanzministerium dafür, dass wir die Befristungen endlich aufheben können. Im Bundesamt für Justiz können wir beispielsweise 87 Stellen entfristen. Das ist wirklich sehr wichtig, um mehr Personal zu bekommen und am Ende bessere Arbeitsergebnisse zu erhalten.
Wir werden auch den Rechtsstaat begreifbarer machen und zeigen, wie kostbar er ist. Wir wissen aus unserer Vergangenheit – das sehen wir auch gerade wieder in anderen Ländern –, wie verletzbar der Rechtsstaat ist. Um die Bedeutung des Rechtsstaats anschaulich zu vermitteln, wollen wir unter anderem das Forum Recht in Karlsruhe schaffen, in der „Residenz des Rechts“, wie die Stadt selbst von sich sagt. Auch dafür stehen jetzt Mittel im Haushalt zur Verfügung.
Wir haben mit unserem sparsamen Etat noch mehr vor. Sie wissen, dass wir die Eine-für-alle-Klage bereits umgesetzt haben. Das ist das erste Vorhaben aus dem Koalitionsvertrag, das umgesetzt wurde.
Jetzt werden die Mittel für den Verbraucherzentrale Bundesverband erhöht. Das ist eine sehr gute Entwicklung. Auch dafür ein herzlicher Dank!
