Gehen wir einige Monate zurück. Da haben wir das Mietenpaket aus dem Koalitionsvertrag gemeinsam präsentiert. Wir haben gesagt: Es ist ein gutes Paket. Es ist ein wirksames Paket mit vielen Bausteinen. – Einige Monate später kommen Sie mit einem neuen Papier und dokumentieren damit, dass Sie das, was Sie der Bevölkerung vor einigen Monaten verkauft haben, selbst als wirkungslos erachten.
Wenn wir aber über einen wehrhaften, über einer starken Rechtsstaat reden, dann, liebe Kolleginnen und Kollegen, ist natürlich auch die Opposition in der Pflicht.
Wenn wir dann über bestimmte Vorfälle reden, seien es die auf der Kölner Domplatte, sei es die Causa Amri, seien es jetzt die Vorfälle in Chemnitz,
dann klingt das tatsächlich alles sehr einmütig: Wo war denn die Polizei? Solche Fehler dürfen nicht passieren. Da muss der Rechtsstaat agieren.
Wenn dann aber zum Beispiel der Freistaat Bayern sein Polizeiaufgabengesetz novelliert, um die Polizei fit zu machen für die Herausforderungen der Zukunft, für die Verbrechensbekämpfung in der digitalen Welt und für die Terrorismusbekämpfung, dann kommen Sie als Allererstes, heben die Hand und sagen: Ihr macht einen Polizeistaat.
Herr Präsident, ich glaube, da will jemand eine Frage stellen.
