Links, ganz links.
Kollege Diether Dehm, darf ich den Absatz noch zu Ende bringen, und wir machen das am Ende? – Super.
Sie entscheiden es selbst, Frau Kollegin.
Wir arbeiten mit Russland, besonders mit der jungen Generation, die auch in Zukunft Wege der Verständigung finden muss.
Sie sehen an den Beispielen: Es gibt für uns alle genug zu tun. Das Auswärtige Amt beginnt nun einen Prozess, der eine neue Strategie für unsere internationale Kultur- und Bildungspolitik aufgreift und 2020 in eine neue Ausrichtung münden soll; denn dann wird die Kulturabteilung 100 Jahre alt. Wir setzen auch hier auf Zusammenarbeit und den Austausch mit dem Deutschen Bundestag.
Schon heute arbeiten wir zusammen mit den französischen Partnern auch daran, gemeinsame Kulturinstitute aufzubauen, und wir werden unsere Arbeit in Afrika erweitern.
Lieber Dennis Rohde, auch ich gehöre zu einer Generation, für die Demokratie und Rechtsstaatlichkeit und Freiheit selbstverständlich waren; aber sie sind es eben nicht. Auch deswegen müssen kommende Generationen die Möglichkeit haben, eigene Zugänge zur Welt und auch zu unserer Geschichte zu finden – über die Partnerschaftsvereine der Kommunen, die im Übrigen als internationale Akteure immer wichtiger werden, über Freiwilligen- und Austauschdienste. Das werden wir fördern; denn, liebe Kolleginnen und Kollegen, Demokratie ist Teil unserer politischen Kultur, und wir müssen aufpassen, dass sie nicht unter die Räder kommt.
Ich wünsche mir, dass all diejenigen, die Verantwortung tragen, sie annehmen und konstruktiv für ein stabiles, weltoffenes Deutschland eintreten. Wir brauchen Kooperation und Zusammenarbeit statt nationaler Abschottung. Das ist unsere Verantwortung in allen Fragen unseres Zusammenlebens und bei unseren politischen Entscheidungen.
Herzlichen Dank.
