Wer weiß, wie lange die CSU noch eine Volkspartei ist, wenn sie in dieser Art und Weise an ihrer eigenen Bevölkerung vorbeiregiert.
Aber Effizienz ist bei parteinahen Stiftungen ohnehin kein Thema.
Hierzu das Auswärtige Amt: Das Kriterium der Effizienz ist bei Maßnahmen der politischen Stiftungen oft nur sehr eingeschränkt anwendbar. – Wer so handelt, braucht sich nicht zu wundern, dass Bürger jedes Vertrauen in Parteien oder deren Stiftungen verlieren. Der Frust über die abgehobenen Politiker, die in einer Parallelwelt leben,
wächst verständlicherweise ins Unermessliche, und genau deshalb ist die AfD hier im Deutschen Bundestag.
Sie müssen zum Ende kommen.
Sofort. – Wir sind wirtschaftlich und sparsam. Wir, die AfD, fordern eine klare und transparente Politik;
denn nur so bekommen wir das Schiff Deutschland wieder auf Kurs.
Danke schön.
Das Wort zu einer Kurzintervention erhält die Kollegin Deligöz.
