Sehr geehrter Präsident! Kolleginnen und Kollegen! Liebe Gäste! Es geht um den Haushaltsentwurf 2019 des Bundesministeriums für Ernährung und Landwirtschaft. Dieser Entwurf zeigt, dass Sie, Frau Klöckner, mit Ihrem Ministerium die falschen Schwerpunkte setzen und an falschen Strukturen festhalten. Die Dürreschäden in diesem Sommer haben es deutlich gezeigt: Die Landwirtschaft in Deutschland ist ein Hochrisikosystem, und dieses System muss korrigiert werden, Kolleginnen und Kollegen.
340 Millionen Euro Sonderhilfen für die Landwirte wegen der Dürre gab es in diesem Jahr, und es war auch richtig, zu helfen; denn teilweise waren Existenzen bedroht. Die Bodenspekulanten warten nur darauf, dass die Betriebe aufgeben müssen, damit sie das Land billig kaufen können.
Aber dass diese Hilfen notwendig waren, hat strukturelle Ursachen. Warum ist denn die Landwirtschaft so anfällig für solche Umweltereignisse? Sie ist so anfällig, weil sie ein System ist, das auf maximale Ausbeutung setzt und das auch nur bei einer maximalen Ausbeutung der Ressourcen funktioniert.
Bei den Dumpingpreisen für die landwirtschaftlichen Produkte bleiben keine Reserven, um Verluste ausgleichen zu können, schon gar nicht, wenn man Mitarbeiterinnen und Mitarbeiter anständig bezahlen, die Tiere anständig halten und die Natur schützen will.
Alle seriösen Experten sagen voraus, dass Klimaveränderungen, extreme Wetterlagen, zunehmen werden. Wenn wir dieses Agrarsystem nicht ändern, werden Bund und Länder in den nächsten Jahren immer wieder Sonderhilfen zahlen müssen. Als Folge der Politik der Bundesregierung werden also noch mehr Steuergelder in dieses falsche System gepumpt werden müssen. Das ist Unsinn, liebe Kolleginnen und Kollegen!
In unserer Landwirtschaft muss die Betonung endlich wieder auf „Land“ liegen und nicht auf „Wirtschaft“.
Der Erhalt unserer Ressourcen muss im Vordergrund stehen.
Wir brauchen einen Innovationsschub hin zu einer nachhaltigen und klimaschonenden Landwirtschaft. Die falsche Subventionspolitik, nach der Subventionen nur nach der Größe der Betriebe vergeben werden, muss beendet werden. Stattdessen müssen die nachhaltig wirtschaftenden Betriebe unterstützt werden. Und wir müssen die Landwirtinnen und Landwirte aus dem Würgegriff der großen Handelsketten befreien, die ihnen erbarmungslos immer niedrigere Preise diktieren.
Wir brauchen faire Erzeugerpreise.
