Sehr verehrter Herr Kollege Dürr, wir hatten in den letzten Wochen schon häufig Gelegenheit, über dieses Thema im Haushaltsausschuss zu diskutieren, und darum muss ich Ihnen schon sagen, dass ich es ein bisschen befremdlich finde, dass Sie uns im Haus hier jetzt schon zum zweiten Mal ermahnt haben, dass wir uns ehrlich machen sollen.
Denn das, was Sie hier gerade gesagt haben, entbehrt jeder Form der Ehrlichkeit.
Sie bedienen hier wirklich Ressentiments, möglicherweise auch die „Bild“-Zeitung,
indem Sie behaupten, es sei ein viertes Paket,
obwohl Sie ganz genau wissen, dass es das dritte Paket ist und dass in diesem dritten Paket vor vielen Jahren knapp 86 Milliarden Euro zur Verfügung gestellt worden sind, von denen jetzt ungefähr 25 Milliarden Euro gar nicht gebraucht werden,
und das ist eine gute Botschaft.
Das ist eine Botschaft des Erfolgs für Europa und für Deutschland. Ich finde es nicht in Ordnung, dass Sie hier in diesem Hohen Hause
solche, entschuldigen Sie bitte, Dinge verbreiten, die schlicht nicht wahr sind. Das ist Diffamierung.
Frau Kollegin Hagedorn, ich will das nur in aller Klarheit sagen – ich werde auch gleich noch mal aus den Debatten genau zu diesem Thema zitieren, die hier 2015 geführt wurden, als die FDP nicht im Deutschen Bundestag war; dann können wir über Ehrlichkeit reden an der Stelle –: Wenn man nachträglich Bedingungen eines festgelegten Pakets ändert, wenn man nachträglich der Auffassung ist, dass mehr Liquidität rein muss, als ursprünglich vereinbart war, wenn man nachträglich Zinsen senkt, dann sind das faktische Schuldenerleichterungen, und dann ist das ein neues Paket. Alles andere, Frau Kollegin, ist irrational.
Jetzt will ich Ihnen sagen, wie das Hohe Haus 2015 hier diskutiert hat, und den damaligen Bundesfinanzminister Wolfgang Schäuble zitieren. Im Rahmen der Debatten über das dritte Hilfspaket für Griechenland hat Schäuble klar gesagt:
Wiederum ist auch klar, dass ein Schuldenschnitt nicht möglich ist.
Und weiter – Stichwort „IWF“ –:
