Ja, und das ist noch nicht alles.
Wir haben glaubwürdige Hinweise von Zeugen aus dem Umfeld des Opfers. Freunde des Toten von Chemnitz sagen, dass es nach diesem ach so tollen Friedenskonzert dieser linksradikalen Schmuddelrocker, zu dem der Bundespräsident schändlicherweise aufgerufen hat,
den Versuch massiver Gewalttaten gegeben hat, unter anderem den Versuch, die Erinnerungsstätte für den Toten am Tatort nicht nur zu schänden, sondern zu zerstören. Wir wissen von Zeugen, dass über eine Stunde lang die Polizei beschäftigt war, bis sie die Lage im Griff hatte.
Über 1 000 Besucher dieses ach so tollen linksradikalen Konzerts haben versucht, die Gedenkstätte in Chemnitz zu zerstören.
Herr Kollege Braun,
Kurzinterventionen müssen kurz sein. – Herr Kollege von Notz, Sie können antworten. – Herr Kollege Braun, wenn Sie stehen bleiben,
ersparen Sie sich, das zu fordern, wie Sie es kürzlich getan haben.
