denn bei uns ist die Welt noch einigermaßen in Ordnung. Die AfD Sachsen wird dafür sorgen, dass das auch so bleibt.
Vielen Dank.
Herzlichen Dank, Herr Kollege Maier.
Bevor ich das Wort erteile, erlauben Sie mir bitte eine Bemerkung. Niemand in diesem Saal kann sich darüber beschweren, dass ein Redner aufgrund der massenhaften Zurufe das Gefühl hat, niedergebrüllt zu werden, wenn er sich als Abgeordneter selber daran beteiligt. Das sage ich in Richtung der drei Fraktionen auf der linken Seite.
Ich mache das genauso bei der AfD-Fraktion. Wenn ihre Abgeordneten massenhaft dazwischenrufen, bitte ich auch darum, die Ordnung zu beachten. Das gilt wechselseitig, oder es gilt gar nicht. Ein Recht hat keine Farbe, sondern es ist in gleicher Weise anzuwenden. Ich bitte wirklich darum, das zu beachten; denn das Bild, das wir da abgeben, ist kein gutes.
Als nächster Redner hat für die SPD-Fraktion der Kollege Michael Groß das Wort.
