Frau Kollegin, bitte.
… dank dieser unglaublich generösen, mutigen, menschlichen Geste, die hier gemacht wurde. … Hass ist ganz einfach Gift, und letzten Endes vergiftet man sich selbst.
Es bleibt die Hoffnung, dass der Verstand siegt.
Vielen Dank für Ihre Aufmerksamkeit.
Frau Kollegin, ich bitte inständig, meine Bitten zu erhören, weil ich sonst hier wirklich drastische Maßnahmen ergreifen muss. Es kann nicht sein, dass jeder Redner versucht, 30 Sekunden oder eine Minute länger zu reden. Das führt zu nichts.
– Das hat mit „Mein Gott“ nichts zu tun. Das schreibt die Geschäftsordnung vor, und die gilt für alle gleichermaßen, auch für die Grünen oder für die Sozialdemokraten.
Als nächster Redner hat das Wort der Kollege Detlef Seif für die CDU/CSU-Fraktion.
