die bis heute Teil des Portfolios des Bundes sind. Sie sollten das wissen. Sie und ich sind ja Berichterstatter zum Einzelplan 32 des Bundeshaushaltes, und da wird dieses Portfolio, das heute in München bei der FMS Wertmanagement verwaltet wird, konsolidiert, indem Zahlungen rein- und rausgeschoben werden. Das sind die Fakten. Insofern ist es nicht falsch, hier zu sagen, dass die Abschiebung,
die Abschreibung dieser Kredite auf die lange Bank geschoben wird. Das ist genau das Gleiche wie bei allen Krediten, über die wir hier reden. Das war also kein Faktenfehler. Das sind die Fakten.
Sie meinten auch, beim Thema „falsche Terminologie“ wieder einmal Mimimi machen zu müssen und Stilfragen aufmachen zu müssen. Das ist ja das Einzige, was Ihnen hier noch einfällt gegen unsere Argumente.
„Endsieg“, meine Damen und Herren, ist ein Nazibegriff. „Endsiegpropaganda“ ist das genaue Gegenteil. Es ist ein abwertender Begriff gegen die Endsiegideologie des Naziregimes.
Genau so habe ich ihn auf meiner Homepage auch gebraucht. Ich habe „Endsiegpropaganda“ gebraucht im Sinne von: Das Ende ist klar. 1944/45 wusste das Naziregime, dass es zu Ende gehen würde.
Die Propaganda wurde aufrechterhalten. Da gibt es durchaus Analogien zu einigem, was wir hier heute gehört haben: Das Ende ist sicher, aber es wird noch geleugnet. Deshalb ist das in keiner Weise eine Verharmlosung der Zeit von 1933 bis 1945. Ich bitte, diesen Blödsinn endlich einzustellen.
Herzlichen Dank.
Herr Kollege Kindler, Sie mögen offensichtlich, also dürfen Sie antworten.
