Entsprechende Signale gibt es auch von der Bundesregierung dazu. Die Vorfinanzierung wünsche ich mir nicht nur; sie wird auch in den nächsten Monaten kommen müssen.
Das Ganze gilt doch auch für die sogenannten grauen Flecken: Das sind Gebiete, die bereits 30 Megabit pro Sekunde erhalten. Sie sind von der Förderung ausgeschlossen. Aber für eine Gigabit-Gesellschaft brauchen wir auch hier höhere Bandbreiten.
Meine Damen und Herren, unser Förderprogramm hat dem Markt neue Impulse gegeben: Die Telekommunikationsunternehmen investieren in die Netze. Allerdings gibt es immer wieder Fälle, dass Netzanbieter ihre Kabel direkt neben die geförderten Netze legen wollen. Diese Doppelverlegung unterläuft die gesamten Fördervoraussetzungen.
Kurze Erklärung: Ich denke, wir sollten hier ganz klar differenzieren. Investitionen in Netze sind immer gut, und der Wettbewerb zwischen den Unternehmen treibt den Ausbau voran. Aber: Geförderte Netze müssen wir stärker schützen. Denn hier werden weiße Flecken in Gegenden erschlossen, wo es bisher gar keinen Wettbewerb gegeben hat. Deshalb müssen wir dafür sorgen, dass die Förderprojekte in den Landkreisen weiter rentabel bleiben. Die Bundesnetzagentur, denke ich, ist hier gefordert, als Mediator einzuschreiten und entsprechend zu vermitteln.
Meine Damen und Herren, abschließend noch einige Worte zum Thema Cybersicherheit. Denn der Erfolg der Digitalisierung wird maßgeblich von unseren Maßnahmen in diesem Bereich abhängen. Eine aktuelle Zahl zur Veranschaulichung: 55 Milliarden Euro an Schäden entstehen jährlich durch Cybercrime. Und dabei sind wir in Deutschland noch nicht einmal voll digitalisiert. Deshalb müssen wir das Bundesamt für Sicherheit in der Informationstechnik, kurz BSI, personell stärken. Ein Vergleich macht das, denke ich, deutlich: Das Eisenbahn-Bundesamt – zuständig für die Sicherheit auf der Schiene – hat 1 200 Mitarbeiter. Das BSI – zuständig für die Sicherheit im Netz – kommt gerade einmal auf 800 Mitarbeiter. Das BSI ist heute schon als Sicherheitsberater für den Mittelstand tätig. Auch hier gilt es: weiter ausbauen und die Zahl der Mitarbeiter erhöhen.
Und wir müssen unsere Wirtschaft mit Digitalstrategien und Netzwerken fit machen. Nur so können wir uns auf dem Weltmarkt gegenüber China und auch den USA behaupten.
Deshalb müssen wir gerade in diesen Fragen die Internationalisierung im Blick behalten. Denn unsere Unternehmen brauchen globale Märkte. Meine Damen und Herren, beim Thema Digitalisierung kommt es auf Geschwindigkeit an: Wir machen weiter Tempo bei Breitband, künstlicher Intelligenz und Cybersicherheit. So machen wir unsere Wirtschaft fit für die Herausforderungen von morgen.
Vielen Dank für die Aufmerksamkeit.
Herzlichen Dank, Herr Kollege. – Als Nächstes für die AfD-Fraktion der Kollege Uwe Schulz.
