Es geht um selbstständige Überwachung von Programmen, darum, die wirtschaftliche Lage in den Mitgliedstaaten beurteilen zu können, um damit Krisen frühzeitiger erkennen zu können. In der Folge werden wir eine größere Unabhängigkeit vom Internationalen Währungsfonds haben. Die Mitwirkungsrechte des Deutschen Bundestages – so haben wir es im Koalitionsvertrag vereinbart, und so wird es auch bleiben – bleiben davon unberührt.
Drittens – und das ist vielleicht das Schwierigste –: die Wettbewerbsfähigkeit der Euro-Länder. Denn wenn die Konvergenz nicht gegeben ist, wenn die unterschiedliche Wettbewerbsfähigkeit zu groß ist, dann ist es schwierig, die Stabilität einer Währung auf Dauer zu erhalten. Deshalb haben wir uns verabredet, im Rahmen der Europäischen Union einen zusätzlichen Euro-Raum-Haushalt – wir haben das im Koalitionsvertrag einen „Investivhaushalt“ genannt – zu entwickeln: ab 2021 parallel zu der mittelfristigen finanziellen Vorausschau, zu der nächsten Etappe, um zusätzlich für die Länder, die eine Währung teilen, die Konvergenz und die Stabilität zu erhöhen. Dabei muss die Leistungsfähigkeit der Besten der Maßstab sein und nicht der Durchschnitt aller.
Meine Damen und Herren, mit diesen Vereinbarungen setzen wir nicht mehr und nicht weniger um als wichtige Eckpunkte des Koalitionsvertrages. Dabei gilt natürlich: Jeder muss sich an die vereinbarten Regeln halten; jeder Mitgliedstaat ist für seinen Haushalt selbst verantwortlich; Haftung und Kontrolle gehören zusammen; es wird keine Schuldenunion geben;
Stabilität und Wachstum bedingen einander. Deshalb, meine Damen und Herren, werden wir am Freitag, also morgen, auf dem Europäischen Rat in einem Format der 19 Mitgliedstaaten des Euro-Raums plus derer, die sonst noch an dieser Sitzung teilnehmen wollen, über die deutsch-französischen Vorschläge debattieren.
Liebe Kolleginnen und Kollegen, auch jenseits der Wirtschafts- und Währungsunion brauchen wir strategische Konzepte für die Zukunft Europas. Da geht es um die Frage unserer wirtschaftlichen Leistungsfähigkeit. Deutschland und Frankreich haben vorgeschlagen, gerade im Bereich der Innovationen sehr viel mehr zu tun. Ich kann das heute hier nicht ausführen, wir alle wissen aber: Die Digitalisierung, die künstliche Intelligenz sind Herausforderungen, bei denen Europa nicht da steht, wo Europa stehen sollte. Wir werden hier als einzelne Mitgliedstaaten nicht aufholen, sondern wir müssen gemeinsam handeln, um strategisch wieder innovationsfähig zu werden.
Wir müssen in der Außenpolitik kohärenter, schlagkräftiger werden. Deutschland wird jetzt auch seine Möglichkeit, als nichtständiges Mitglied im UN-Sicherheitsrat zu arbeiten, nutzen, um die europäische Koordinierung in internationalen Fragen voranzutreiben, zuallererst natürlich mit Frankreich. Aus aktuellem Anlass werden wir auch über Handelsfragen sprechen müssen. Die Europäische Union hat als Antwort auf die von uns nicht akzeptierten Zölle auf Stahl und Aluminium ihrerseits Zölle verhängt. Wir halten diese Zölle, die von den Vereinigten Staaten verhängt wurden, für rechtswidrig; aber wir wollen mit den Vereinigten Staaten von Amerika ins Gespräch gehen – in welcher Weise wir ins Gespräch gehen, müssen wir miteinander besprechen –, um weitere Zölle und damit weitere Schritte in Richtung eines Handelskrieges zu vermeiden. Ich glaube, das ist im multilateralen, im gemeinsamen Interesse der Vereinigten Staaten von Amerika, Europas und vieler anderer Länder auf der Welt.
Liebe Kolleginnen und Kollegen, wir werden natürlich auch – deshalb ist vielleicht die heutige Regierungserklärung besonders wichtig – über das Thema der Migration beraten,
und zwar heute Abend. Wir sind – das will ich ganz offen sagen – noch nicht da, wo wir sein wollen.
Das Gemeinsame Europäische Asylsystem, wie wir es eigentlich jetzt im Juni verabschieden wollten, werden wir auf dem Rat zu achtundzwanzigst nicht verabschieden können. Von sieben Rechtsakten, die dazu notwendig wären, sind fünf mehr oder weniger geeint; aber bei zwei wichtigen gibt es noch politischen Beratungsbedarf. Das eine ist die Asylverfahrensrichtlinie. Das hört sich so einfach an; aber da geht es um nicht mehr und nicht weniger als um gleiche Standards bei der Gewährung von Asyl in allen europäischen Mitgliedstaaten. Das Zweite ist die sogenannte Dublin‑IV-Verordnung, also die Weiterentwicklung der heute geltenden Dublin‑III-Verordnung, die auch die solidarische Verteilung von Migranten und Flüchtlingen zwischen den europäischen Mitgliedstaaten beinhaltet.
Jetzt sagen viele: Die europäische Lösung kommt nicht; da warten wir schon drei Jahre drauf. – Das möchte ich noch einmal zum Anlass nehmen, zu sagen, dass das natürlich so nicht stimmt. Alle in Europa sind sich einig:
Es geht darum, illegale Migration zu reduzieren, Schleppern und Schleusern das Handwerk zu legen und, wenn wir über einen Austausch zwischen den Herkunftsländern und den europäischen Ländern sprechen, zwischen Staaten legale Vereinbarungen zu treffen.
Wir haben im Übrigen auf dem europäischen Kontinent damit gute Erfahrungen gemacht, als wir die Länder des westlichen Balkans zu sicheren Herkunftsländern erklärt haben, als wir damit die Rückführung von Menschen ermöglicht haben, die kein Anrecht auf Asyl hatten,
und im Gegenzug Arbeitserlaubnisse für in Deutschland vorhandene Arbeitsplätze möglich gemacht haben. Dieses System funktioniert im großen Ganzen sehr gut. Das ist schon eine der Vereinbarungen, die wir hinbekommen haben.
Wir hatten im Jahre 2014 etwa 200 000 ankommende Flüchtlinge in Deutschland, 2015 bis August 400 000. Wir haben dann bis zum Jahresende eine Prognose von 800 000 gestellt. Es waren zum Schluss 890 000.
Ich will noch einmal darauf verweisen, dass der 4. September 2015, um den sich ja heute viele Diskussionen ranken, mitnichten eine unilaterale Aktion war. Es waren schon 400 000 Flüchtlinge gekommen. Es waren sehr viele in Ungarn. Der ungarische Ministerpräsident hat den österreichischen Bundeskanzler gebeten, zu helfen. Der österreichische Bundeskanzler Werner Faymann hat mich angerufen. Die Außenministerien haben sich koordiniert, weil gerade ein Außenministerrat stattfand. Wir haben gesagt: In einer Ausnahmesituation werden wir helfen. – Das haben wir getan. Das halte ich im Rückblick auch nach wie vor für richtig, meine Damen und Herren.
In dieser Ausnahmesituation hat Deutschland für eine Zeit auf die Rücküberstellung im Rahmen des Dublin-Verfahrens verzichtet.
Das ist das sogenannte Selbsteintrittsrecht. Es ist vor dem Europäischen Gerichtshof beklagt worden.
Es gab im Sommer 2017 ein Urteil, dass das politisch möglich und damit rechtlich nicht fragwürdig war. Das wurde ganz eindeutig vom Europäischen Gerichtshof so festgestellt. Es gab dann im Zusammenhang mit der sehr hohen Zahl von ankommenden Flüchtlingen die Frage der Rückweisung an der deutschen Grenze. Der Bundesinnenminister hat damals gesagt: Nein. In einer solchen Ausnahmesituation von ungefähr 8 000 bis 9 000 ankommenden Flüchtlingen jeden Tag sehen selbst die EU-Verträge vor, dass man zur Herstellung von Recht und Ordnung die Möglichkeit alleiniger nationaler Maßnahmen hat. – Davon haben wir nicht Gebrauch gemacht, meine Damen und Herren.
Aber diese Ausnahmesituation existiert heute nicht mehr. Heute haben wir eine völlig andere Situation. Die Zahl der ankommenden Flüchtlinge ist deutlich geringer. Deshalb gilt wieder genau die Rechtssituation wie vor dem September 2015,
nämlich das europäische Recht mit Vorrang vor dem deutschen Recht – mit der Ausnahme, dass wir etwas haben, was wir vor 2015 nicht hatten, nämlich relativ lang andauernde Kontrollen an einigen Punkten an der deutsch-österreichischen Grenze.
Meine Damen und Herren, woran zeigt sich, dass sich die Verhältnisse geändert haben? Der Rückgang der Seeanlandungen in der Ägäis beträgt seit 2015 97 Prozent, der Rückgang der Seeanlandungen im zentralen Mittelmeer aktuell im Vergleich zum Zeitraum des Vorjahres 77 Prozent. Dies unterstreicht zweierlei – das sind europäische Anstrengungen –: zum Ersten die Wirksamkeit des EU-Türkei-Abkommens, das heute vielfach als ein Modellabkommen angesehen wird, im Übrigen auch eine NATO-Aktivität in der Ägäis, und zum Zweiten, dass wir mit Blick auf Libyen die europäische Mission Sophia mit verschiedenen Schritten gestaltet haben.
Der erste Schritt war, Menschen in Not zu helfen. Der zweite Schritt war, zu sagen: Wir bilden die libysche Küstenwache aus. – Diese libysche Küstenwache ist heute in einem Zustand, dass sie selber Menschen in libyschen Hoheitsgewässern retten kann. Deshalb will ich an dieser Stelle auch sagen: Es gibt eine Verpflichtung, dass man die libysche Küstenwache ihre Arbeit machen lässt, und es gibt kein Recht, anstelle der libyschen Küstenwache einfach Dinge zu tun. Libyen hat auch ein Recht auf den Schutz seiner Küsten.
Ich möchte übrigens Italien und Malta ganz besonders für die Ausbildung der libyschen Küstenwache danken.
Wir haben die Grenzschutzagentur Frontex gegründet. Sie ist noch nicht ausreichend ausgestattet, aber sie arbeitet. Sie muss zu einer wirklichen europäischen Grenzpolizei, die dann noch mehr Vollmachten und Möglichkeiten hat, weiterentwickelt werden.
Die Asylzahlen in Deutschland sind zurückgegangen – wir können damit noch nicht zufrieden sein; das will ich ausdrücklich sagen –, aber sie sind auch in diesem Jahr bis Ende Mai geringer als im vergangenen Jahr. Um deutlich zu machen: „Wir wollen, dass sich 2015 nicht wiederholt“, haben wir im Koalitionsvertrag eine Vielzahl von Maßnahmen und auch eine Richtgröße vereinbart, die angestrebt wird, um auch das Thema der Integrationsfähigkeit im Auge zu haben.
Wir haben inzwischen den Familiennachzug für subsidiär Geschützte geregelt; es gibt keinen Rechtsanspruch mehr, sondern eine bestimmte Zahl pro Monat. Wir haben vereinbart, dass wir zur Erhöhung der Effizienz – denn wir brauchen natürlich nationale Maßnahmen – AnKER-Zentren bilden. Ich möchte wirklich an alle Ministerpräsidenten und alle Länder appellieren, diesen Teil des Koalitionsvertrages jetzt auch schnellstmöglich umzusetzen; denn das ist von der Koalition mit den Bundesländern gemeinsam verhandelt worden, meine Damen und Herren.
Ich betone ausdrücklich: Der Bundesinnenminister hat, nachdem er sich in seinem neuen Amt die Situation angeschaut hat, richtigerweise die Punkte zusammengestellt, bei denen weiterer Handlungsbedarf besteht. Wenn ein so schreckliches, erschütterndes Ereignis wie der Mord an Susanna passiert und sich hinterher ergibt,
dass Verwaltungsgerichtsverfahren über lange Zeit nicht stattgefunden haben, dann können wir uns mit einem solchen Zustand nicht abfinden – genauso wenig wie mit dem Zustand, dass sich Leibwächter von bin Laden über Jahre hier in Deutschland aufhalten, meine Damen und Herren.
Deshalb besteht Handlungsbedarf. Dabei geht es immer um Ordnung, Steuerung, wirksam, nachhaltig.
Es geht um unsere innere Sicherheit, und es geht um die innere Sicherheit der gesamten Europäischen Union. Dazu sind nationale Maßnahmen und auch europäische Maßnahmen notwendig.
Meine Damen und Herren, es ist so wichtig, die AnKER-Zentren zu gründen, weil wir gerade bei nicht berechtigten Schutzsuchenden in dem Moment der Verteilung in die Kommune natürlich eine Situation erleben, in der es immer schwerer wird, die Rückführung zu gestalten.
Deshalb müssen wir besser werden, und zwar in drei Dimensionen. Das hat auch am letzten Sonntag beim Treffen der Staats- und Regierungschefs aus 16 Ländern eine Rolle gespielt. Alle haben gesagt: Als Erstes und Wichtigstes geht es um die externe Dimension. Es geht um die Frage, wie wir Schleusern und Schleppern das Handwerk legen können. Dabei muss folgendes Prinzip gelten: Wenn wir möchten, dass Menschen aus Afrika, die in den meisten Fällen keine Asylberechtigung haben, nicht mehr unter Opferung bzw. Gefährdung des eigenen Lebens, unter Zahlung von viel Geld, unter Unterstützung von kriminellen Strukturen nach Europa kommen,
dann müssen wir auch mit den afrikanischen Staaten darüber sprechen, wie wir Rückführungen gestalten
und vielleicht auch Menschen davon abhalten können, erst durch die Wüste zu gehen und dann ihr Leben aufs Spiel zu setzen. Wir müssen mit den Menschen sprechen. Wir dürfen nicht einfach nur über die afrikanischen Staaten reden, sondern wir müssen versuchen – so wie mit der Türkei –, mit den afrikanischen Staaten Abmachungen zu treffen, die auch zu ihrem Wohle sind, zum Bespiel mit Blick auf legale Studienplätze und Arbeitsmöglichkeiten. Das geht nicht über die Köpfe Afrikas hinweg, sonst wird das keinen Erfolg haben, meine Damen und Herren.
Was immer wir tun, wir werden es in Zusammenarbeit mit dem UNHCR und mit der Internationalen Organisation für Migration tun. Meine Damen und Herren, wir werden den Grenzschutz stärken; darüber habe ich schon gesprochen. Das ist die zweite Dimension.
Die dritte Dimension ist: Wir werden natürlich auch die sogenannte Sekundärmigration stärken – –
besser ordnen und steuern müssen. – Mein Gott! Echt mal!
Denn es müssen zwei Dinge gelten. Das Erste ist: Diejenigen, die in Europa Schutz suchen, können sich nicht das Land innerhalb der Europäischen Union aussuchen, in dem sie einen Asylantrag stellen, meine Damen und Herren.
