Sehr geehrte Frau Präsidentin! Meine sehr geehrten Damen und Herren! Ich möchte etwas zum Einzelplan 60 sagen. Keine Sorge, mir ist völlig klar, dass es sich hier um den Haushalt des Bundesministeriums für Bildung und Forschung, den Einzelplan 30, handelt. Aber im Einzelplan 60 stehen die Mittel für eines der wichtigsten bildungspolitischen Vorhaben, das wir uns miteinander gegeben haben, nämlich den DigitalPakt Schule.
Dank unseres sozialdemokratischen Finanzministers Olaf Scholz steht die Anschubfinanzierung von 2,4 Milliarden Euro für das Sondervermögen „Digitale Infrastruktur“ früher als gedacht bereit.
„Anschieben“ ist ein gutes Stichwort, wenn es um den DigitalPakt geht.
Wir wollen etwas ganz Wichtiges anschieben: Wir wollen die Schülerinnen und Schüler in unserem Land besser auf das Leben und Arbeiten in der digitalen Welt vorbereiten.
Wir wollen das Lernen in der Schule leichter und moderner machen, und wir wollen gemeinsam – im Schulterschluss von Bund, Ländern und Schulträgern – die Stärkung der digitalen Infrastruktur voranbringen.
Herr Kollege Schipanski, bei aller koalitionären Zuneigung: Das ewige Ausspielen, Bund gegen Länder, ist bildungspolitisch ebenso wenig sinnvoll wie die unwahre Behauptung, die SPD würde die akademische Bildung über die berufliche stellen.
