Sehr geehrter Herr Präsident! Meine sehr geehrten Damen und Herren! Ich entbiete Ihnen einen schönen Abendwunsch: Entspannung, schöne Worte. Vielleicht muss man da auch ein bisschen Wasser in den Wein schütten.
Die Deutsche Welle hat einen ganz klaren gesetzlichen Auftrag: Deutschland als europäisch gewachsene Kulturnation und freiheitlich verfassten demokratischen Rechtsstaat verständlich zu machen. Das steht im Gesetz. Wir denken, dass die Deutsche Welle diesem Auftrag operativ gerecht wird. Aber auch inhaltlich? Denn zwischen bloßer Vermittlung der deutschen Kultur und der Werte und aktiver politischer Einflussnahme im Ausland ist nur ein hauchdünner Unterschied.
Die Deutsche Welle definiert als Zielgruppe explizit Personen in exponierter Stellung und – ich zitiere aus den vorliegenden Papieren – „sogenannte Multiplikatoren, die ... die Einstellungen ihrer Mitmenschen zu beeinflussen versuchen“. Ist das reine Außendarstellung deutscher Sichtweisen? Ist das nicht, dass Beeinflusser gezielt beeinflusst werden?
Der besagte Unterschied wird verwaschen. Aber in wessen Auftrag passiert das, und mit welcher Intention passiert das? Wie wird diese Agitation sozusagen begründet? Entweder ist dies eine Selbstermächtigung der Deutschen Welle zu aktiver politischer Beeinflussung in anderen Staaten – das führt dann letztlich zu einer inoffiziellen Nebenaußenpolitik, die jedweder demokratischen Kontrolle entbehrt –,
oder es geschieht in Abstimmung und Absprache mit der Bundesregierung, und dann mutiert die Deutsche Welle zum Regierungssender.
Es wäre dann doch allzu scheinheilig, zu behaupten – und ich zitiere aus den Papieren –, dass die Deutsche Welle „frei von staatlicher Einflussnahme“ wäre. Sie merken was?
In beiden Szenarien entzieht sich das aktive politische Handeln der Deutschen Welle der notwendigen parlamentarischen Kontrolle und einer entsprechenden Legitimation. Dies ist nicht aus der Luft gegriffen. Das zeigt die Entschließung der CDU/CSU und der SPD, die die Deutsche Welle in entlarvender Freimütigkeit als – das zitiere ich wieder – „wichtiges Instrument“ zur Verfolgung wichtiger Ziele benennt. Noch schlimmer: In dieser Entschließung schlagen die Koalitionsfraktionen allen Ernstes vor – ich zitiere das –:
… aufgrund seiner außenpolitischen Dimension sollte das weitere Vorgehen unter Wahrung der Staatsferne des
– zu errichtenden türkischsprachigen –
