Herr Präsident! Liebe Kolleginnen und Kollegen! Nach der fast vollständigen Zerstörung unserer Stadt am 11. September 1944 wurde der Wiederaufbau völlig anders, nämlich als autogerechte Stadt angelegt, genauso wie in vielen anderen deutschen Städten in dieser Zeit. Drumherum entstanden im Laufe der Jahre unvorstellbar viele Autobahnkilometer. Das Ganze ergab das fossile Mobilitätsleitbild für Jahrzehnte, mit fatalen Folgen, wie wir alle wissen.
Und heute? Immer mehr Menschen geht das hemmungslose Zubetonieren ihrer Umgebung auf die Nerven. Sie spüren, dass diese Politik längst an ihre Grenzen gestoßen ist, dass es so nicht weitergehen kann. Sie kämpfen für Radwege. Sie kämpfen für den ÖPNV. Sie kämpfen gegen Lärm und dicke Luft in ihren Städten.
Herr Minister, sogar in Ihrem eigenen Bundesland, in Bayern, schwindet zunehmend die Akzeptanz für den rasanten Flächenverbrauch. Bayern ist nämlich auch da Spitzenreiter. Aber anstatt nun Deutschland für die Herausforderungen der Zukunft wie Klimakrise, saubere Luft und emissionsfreie Mobilität für alle fit zu machen, klammern Sie sich genauso wie Generationen von Verkehrsministern an Beton, Blechkarawanen und freie Fahrt für freie Bürger. Herr Scheuer, so wird das nichts.
Das „Sofortprogramm Saubere Luft“ ist mit 1 Milliarde Euro über fünf Jahre ausgestattet. Genauso viel legen Sie allein in diesem Haushalt für Straßenbau obendrauf.
Anstatt selbst zu handeln, schieben Sie die Verantwortung, für saubere Luft in unseren Städten zu sorgen, an die Kommunen ab. Gewiss, es ist natürlich vernünftig, kommunale Fahrzeuge nachzurüsten oder auszutauschen. Wenn allerdings die kommunale Fahrzeugflotte weniger als 5 Prozent der Stickoxidemissionen ausmacht, der Rest aber von Privat- und Pendler-Pkw erzeugt wird, dann wird doch eines deutlich, Herr Scheuer: Mit Maßnahmen auf kommunaler Ebene ist das Problem nicht zu lösen.
Ein Verkehrsminister, der das nicht erkennt, der muss kenntnismäßig nachgerüstet oder eben ausgetauscht werden.
