Wenn Trump mit Zöllen auf Autoimporte droht, trifft das besonders die deutsche Autoindustrie. Liebe Kolleginnen und Kollegen von der CSU, mit Audi und BMW trifft es insbesondere Bayern.
Wer also die Handlungsfähigkeit der EU mutwillig beschädigt, der wirft einen sehr gefährlichen Bumerang und trifft sich am Ende nur selbst.
Denn Deutschland ist alleine zu klein, um den Angriffen Trumps zu widerstehen. Deutschland ist alleine auch zu klein, um sich gegen Putin durchzusetzen. Deutschland ist alleine auch zu klein, um es mit der enormen Wirtschaftsmacht Chinas aufzunehmen. Die Europäische Union dagegen ist die größte Wirtschaftsmacht der Welt. Deshalb haben alle europäischen Länder und auch wir das ureigenste Interesse, die Europäische Union zusammenzuhalten und zu stärken.
Liebe Kolleginnen und Kollegen, die Herausforderungen sind radikal, und Politik müsste deshalb umso stärker zeigen, dass sie die Probleme lösen kann und lösen will. Aber diese Bundesregierung zeigt in den letzten Wochen vor allem eines: dass sie die Probleme nicht lösen kann und teilweise auch nicht lösen will. Es sind auch diese 13 Merkel’schen Jahre des Beschwichtigens, des Aussitzens, der öffentlich weder erklärten noch begründeten Wendemanöver, die heute entschlossenes Handeln nötig machen oder nötig machen würden. Heute bekommen wir alle die Quittung für eine Politik des Stillstands, des Nichthandelns, des Lösens von Problemen, das höchstens darin besteht, dass man ein Pflästerchen auf die Probleme klebt.
Das Bundesamt für Migration und Flüchtlinge ist eine Behörde, die doch seit Jahren nicht funktioniert, nicht erst seit 2014.
Schauen Sie sich doch einmal die Fehleranfälligkeit an! 44 Prozent der Geflüchteten, die gegen die Asylbescheide klagen, bekommen recht. Kennen Sie noch irgendeine andere Behörde, wo 44 Prozent der Bescheide, die hinausgeschickt werden, in erster Instanz, wenn sie beklagt werden, von den Verwaltungsgerichten als falsch deklariert werden?
Schauen wir uns den nächsten Bereich an: Die Mieten in der Großstadt Berlin haben sich in den letzten Jahren verdoppelt. Oder der nächste Bereich: Die NO X -Belastung in den Städten ist – seit Jahren bekannt – so hoch, dass inzwischen klar ist, dass Fahrverbote notwendig sind. Wer zahlt am Ende dafür die Zeche? Die von der Autoindustrie betrogenen und von dieser Bundesregierung im Stich gelassenen Dieselkäufer!
Nehmen wir den nächsten Bereich. Nach der großspurigen Ankündigung eines Dieselfonds ist bislang kein einziger Cent an die Städte geflossen, damit sie mehr Geld in Bus und Bahn stecken können. Oder der nächste Bereich: Merkel hat großspurig von künstlicher Intelligenz gesprochen. Schauen wir uns doch den Ausbau des Breitbandes an. Ich meine, da versprechen Sie seit Jahren Milliardenbeträge – seit Jahren! Und abgeflossen für Baumaßnahmen sind inzwischen 3 Millionen Euro. Es sind 0,09 Prozent. Das heißt, die Tragik dieser Regierung ist doch, dass, selbst wenn Sie mal was Gutes wollen, Sie nicht in der Lage sind, es umzusetzen.
Nehmen wir das nächste Beispiel. Frau Merkel und auch Sie, Frau Nahles, haben vom Familienentlastungsgesetz gesprochen – ist ja schön! Dann schauen wir uns an, wer davon profitiert, und dann schauen wir uns an, wie es den ärmsten Kindern geht. Die ärmsten Kinder bekommen davon gar nichts. Mensch, wenn Sie sich schon bemühen, dann machen Sie es doch bitte wenigstens einigermaßen richtig.
Statt diesen ganzen Stapel an Herausforderungen endlich abzuarbeiten, haben Sie, Frau Merkel, sich von der CSU und dem rechten Flügel der CDU – er war fleißig mit dabei – die letzten Wochen erpressen lassen. Sie haben damit die gesamte Bundesrepublik und Europa gleich in Geiselhaft genommen. Was die geplanten Abfanglager in Afrika angeht: Wenn Sie Schutzsuchende der Willkür libyscher Warlords ausliefern und das dann auch noch „libysche Küstenwache“ nennen – was für ein Euphemismus für die Verbrecherbande in diesem gescheiterten Staat! –,
wenn Sie bei uns in Deutschland Inhaftierungslager zulassen, dann hat das, ehrlich gesagt, mit diesen vielbeschworenen europäischen Werten von Solidarität, Humanität und Rechtsstaatlichkeit nur noch verdammt wenig zu tun.
Das ist ein Dammbruch der Unmenschlichkeit, was Sie da organisieren.
