Nein, jetzt gerade nicht. – Solange dies nicht geschieht, können wir Sozialdemokraten keinem gewaltsamen Eingreifen in Syrien zustimmen, schon gar nicht angesichts ernstzunehmender Berichte, wonach ein Staatschef in einer vergleichbaren Situation vor einigen Monaten öffentlich die Liquidierung politischer Akteure gefordert hat. Wenn es uns nicht bald gelingt, dem Recht des Stärkeren das Recht der Völkergemeinschaft entgegenzusetzen, werden wir Jahrzehnte der Anarchie erleben. Das ist es, was vermieden werden muss mit allen Mitteln der Diplomatie und des Völkerrechts.
Im Übrigen möchte ich hier etwas Wichtiges klarstellen. Über Militäreinsätze entscheidet in Deutschland der Bundestag.
Souverän und verantwortungsbewusst haben wir das hier immer getan.
Nun zum Bundeshaushalt. „Keine Entlastung!“, haben Sie eben gerufen, Herr Lindner. 10 Milliarden Euro Entlastung beim Soli ab 2019, 8 Milliarden Euro Entlastung der Arbeitnehmerinnen und Arbeitnehmer sowie der Rentnerinnen und Rentner durch die Wiederherstellung der Parität, Absenkung des Beitragssatzes in der Arbeitslosenversicherung um 0,5 Prozentpunkte, das ist ein großer Batzen Entlastung, den wir durch diesen Haushalt ermöglichen und den wir zum Teil bereits durch unsere Politik für die Menschen in unserem Land zur Verfügung gestellt haben.
Dieser Haushalt setzt auch Schwerpunkte, nämlich bei der sozialen Sicherheit und den Zukunftschancen, und zwar ohne neue Schulden. Finanzminister Olaf Scholz hat hier einen waschechten Investitionshaushalt vorgelegt. 151 Milliarden Euro bis 2022, das ist eine Rekordsumme. Wir wollen Milliarden zur Verfügung stellen, weil es diese Investitionen in unserem Land braucht, zum Beispiel in den Breitbandausbau, auf den gerade die mittelständische Wirtschaft, aber auch viele private Haushalte und ländliche Regionen warten, oder in den Digitalpakt für die Schulen, den wir möglichst bald auf den Weg bringen müssen; denn schnelles Internet und auch das Erlernen digitaler Medien und Kompetenzen gehören in jeden Klassenraum in Deutschland; darum muss es jetzt gehen.
Ich habe eben ein Lob an die Grünen und die FDP anfügen wollen, da sie sich gemeinsam an die Bundeskanzlerin gewandt haben, um die Grundgesetzänderung zu ermöglichen. Als ich das aber eben hier mitbekommen habe, habe ich gedacht, dass wir lieber noch einmal eine Friedensfachkraft vorbeischicken, damit es angesichts der Auseinandersetzungen auch in Zukunft zu Gemeinsamkeiten kommt. Ich bin trotzdem froh, dass wir hier – hoffentlich – eine gemeinsame Mehrheit für eine Grundgesetzänderung haben, die das Kooperationsverbot so öffnet, dass wir seitens des Bundes den Schulen in Deutschland Hilfe zugutekommen lassen können; das ist ein ganz wichtiger Punkt.
Bis 2022 werden wir insgesamt 95 Milliarden Euro in Bildung und Forschung stecken. Das ist doch ein klares Signal dafür, dass das ein wesentlicher Schwerpunkt des Haushaltes ist. Frau Karliczek, zögern Sie bitte nicht, uns Ihre Gesetzentwürfe zuzuleiten.
Wir haben jetzt sehr viele Mittel, um die Bildungschancen junger Menschen zu erhöhen. Wir warten sehnlichst zum Beispiel auf Ihren Gesetzentwurf zum BAföG. Dafür stehen nämlich deutlich mehr Gelder zur Verfügung als bisher. Trotzdem werden weniger junge Menschen gefördert, und diese erhalten im Durchschnitt weniger Geld. Hier brauchen wir dringend eine Trendwende. Also in die Hufe bitte! Das wäre sehr nett; denn das wäre etwas, was wirklich vielen in unserem Land helfen würde.
Meine sehr geehrten Damen und Herren, Bildung fängt aber früher an. Deswegen bin ich froh, dass es das Gute-Kita-Gesetz von Franziska Giffey gibt. Investieren können wir 5,5 Milliarden Euro für mehr Personal, längere Öffnungszeiten, gutes Essen, Gesundheitsförderung, Sprachbildung, vernünftige Gruppengrößen, gut ausgestattete Räume, Fortbildung für die Fachkräfte. Das ist es nämlich, was hinter diesem Namen steckt. Es ist nötig, damit es jedes Kind in Deutschland packt. Das ist der eigentliche Kern dieses Gute-Kita-Gesetzes.
Deswegen muss es schleunigst her. Mehr Förderung und weniger Gebühren gehören in dieses Gute-Kita-Gesetz hinein.
Meine sehr geehrten Damen und Herren, so zufrieden die SPD mit diesem Bundeshaushalt ist, so klar ist auch: Wir brauchen weitere Offensiven, vor allem eine sozialpolitische Offensive, wenn es um bezahlbares Wohnen geht.
