Herr Präsident! Meine Damen und Herren! Vor kurzem konnte man bei „Stern TV“ eine Frau sehen, die von ihrem neugeborenen Kind getrennt worden war, weil sie ins Gefängnis musste, um ihre Ersatzfreiheitsstrafe abzusitzen.
Eine Ersatzfreiheitsstrafe muss man verbüßen, wenn man eine Geldstrafe nicht bezahlt. Ein Tagessatz Geldstrafe entspricht dabei einem Tag im Knast. Bei der Frau war es so: Weil sie kein Geld hatte, war sie schwarzgefahren. Die Geldstrafe, die man ihr vor Gericht aufbrummte, konnte sie von ihrem mageren Hartz‑IV-Satz nicht bezahlen. Deshalb musste sie ins Gefängnis.
Das Beispiel zeigt nicht nur, wie unverhältnismäßig die Ersatzfreiheitsstrafe sein kann – wegen eines nicht gekauften Bustickets mehrere Wochen vom neugeborenen Kind getrennt zu werden. Das Beispiel zeigt auch: Die Ersatzfreiheitsstrafe trifft vor allem Menschen, die arm, mittellos, erwerbslos oder obdachlos sind. Es darf nicht sein, dass man, weil man arm ist, ins Gefängnis muss. Mit Gerechtigkeit hat das nichts zu tun.
Ich will Ihnen drei weitere Gründe nennen, warum die Ersatzfreiheitsstrafe abgeschafft gehört:
Erstens. Sie ist aus kriminalpolitischer Sicht hochproblematisch. Bei der Ersatzfreiheitsstrafe geht es fast immer um eine kurze Freiheitsstrafe. In § 47 Strafgesetzbuch ist festgehalten, dass die „kurze Freiheitsstrafe nur in Ausnahmefällen“ verhängt werden darf. Die Idee dahinter ist, dass kurze Freiheitsstrafen resozialisierungsfeindlich sind. Es besteht sogar die Gefahr, im Gefängnis erst recht auf die schiefe Bahn zu geraten. Die Ersatzfreiheitsstrafe erfüllt also keinen Strafzweck, sie ist sinnlos.
Zweitens. Die Ersatzfreiheitsstrafe kostet Jahr für Jahr 200 Millionen Euro. Ein Hafttag kostet pro Gefangenem etwa 140 Euro.
Wenn also jemand zum Beispiel kein Busticket für 2,50 Euro kauft und deshalb zu 30 Tagessätzen verurteilt wird,
die er nicht zahlen kann, dann landet er 30 Tage im Knast.
Das Ganze kostet den Steuerzahler 4 200 Euro – 4 200 Euro Haftkosten, weil ein Ticket für 2,50 Euro nicht gekauft wurde. Und es geht bei der Ersatzfreiheitsstrafe fast immer um Bagatelldelikte. Es ist irre, was da für Millionenbeträge ausgegeben werden.
Drittens. Andere EU-Länder kommen ohne Ersatzfreiheitsstrafe klar. In Dänemark gibt es keine Ersatzfreiheitsstrafe für zahlungsunfähige Menschen. In Schweden ist die Ersatzfreiheitsstrafe de facto abgeschafft. In Italien wurde die Ersatzfreiheitsstrafe für verfassungswidrig erklärt. Viele Länder in Europa setzen mehr auf gemeinnützige Arbeit als auf Ersatzfreiheitsstrafen, und das, meine Damen und Herren, schlagen wir heute als Linke mit unserem Gesetzentwurf als Alternative vor.
Das Prinzip des „Schwitzens statt Sitzens“ ist deutlich resozialisierungsfreundlicher;
