Herr Präsident! Meine sehr verehrten Damen und Herren! Liebe Kolleginnen und Kollegen! Am Mittwoch war Integrationsgipfel im Kanzleramt, und es war eine ziemlich bunte Veranstaltung mit Vertreterinnen und Vertretern von Migrantenorganisationen, Kirchen, Religionsgemeinschaften usw. Mein Eindruck ist: Die Integration von denen in Deutschland ist ein Pappenstiel im Vergleich zur Integration der CSU in unsere Bundesregierung.
Man kann gut oder schlecht finden, was eine Regierung tut; aber handlungsfähig muss sie sein.
Der Zirkus geht nun schon mehrere Jahre, nur unterbrochen durch die Bundestagswahl. Der gestrige Tag war wirklich ein Symbol: vier Stunden Sitzungsunterbrechung – Sie blockieren, dass wir hier vorankommen.
Das ist eine Zumutung für den Koalitionspartner und für unser Land. Das geht so nicht weiter.
Wir haben eben eine Sondersitzung des Innenausschusses unterbrochen, um zu dieser Debatte zu kommen. Da geht es um die Aufklärung der Vorfälle in der Bremer Außenstelle des Bundesamts für Migration und Flüchtlinge.
Herr Innenminister, ich habe den Eindruck, Sie haben viele Baustellen – da müssen Sie nicht dauernd neue aufmachen. Politik erschöpft sich nicht im Ankündigen immer neuer Pläne. Es soll bitte auch etwas umgesetzt werden – das steht jetzt auf der Tagesordnung –,
und zwar nicht irgendwas, sondern das, was wir vereinbart haben. Entschuldigung, wir haben einen Koalitionsvertrag – wofür haben wir denn so was? –,
