Wir lösen die Probleme nicht, dazu fordere ich uns aber auf. Bundestag, Bundesrat, lasst uns einen Einwanderungs- und Integrationskonsens finden! Das wäre das Mittel, um die da kleinzumachen.
So, wie Sie das versuchen, wird es jedenfalls nicht gelingen.
Herr Scholz fordert eine Rentengarantie bis 2040, die kein Mensch bezahlen kann,
und Sie sagen, Sie wollen diese Rentengarantie, damit es in Deutschland keinen Trump gibt. Das heißt, mit sozialer Absicherung und sozialen Leistungen soll Populismus bekämpft werden.
Das Konzept wird nicht funktionieren. Das Beispiel Schweden vom Wochenende sollte Sie eines Besseren belehrt haben.
Glauben Sie mal eines: So ehrenwert das Motiv ist, die Spaltung zwischen Arm und Reich zu bekämpfen, und so richtig es ist, zielgerichtet gegen Altersarmut vorzugehen, die Spaltung der Gesellschaft in diejenigen, die für Abschottung sind, und in diejenigen, die für Offenheit sind, und die Spaltung der Gesellschaft in Arm und Reich bekämpft man nicht, indem man eine neue Spaltung einführt, nämlich die zwischen Jung und Alt.
Das genau ist Gegenstand Ihrer Politik.
Bei dem, was Sie für die Mitte der Gesellschaft beschließen wollen, sprechen Sie, Frau Bundeskanzlerin, von „Entlastung“: Arbeitslosenversicherungsbeitrag runter, Pflegeversicherungsbeitrag rauf, Rentenversicherungsbeitrag kann nicht sinken, sondern muss steigen. Da sprechen Sie gegenüber den Menschen, übrigens auch gegenüber den Mindestlohnbeziehern, von Entlastung. Die Menschen haben doch das Gefühl, dass die Lebenswirklichkeit der arbeitenden Mitte, von Millionen Menschen im Deutschen Bundestag gar nicht ankommt, wenn wir in dieser Weise sprechen. Also, eine wirkliche Entlastung ist nötig und möglich.
Auch der Mietenstopp ist, finde ich, der untaugliche Versuch, mit Populismus gegen Populismus zu arbeiten. Der Wissenschaftliche Beirat beim Bundeswirtschaftsministerium sagt: Mietpreisbremse funktioniert nicht. Wir brauchen marktwirtschaftliche Anreize, Investitionen, sinkende Baukosten, mehr Bauland. – Richtig so! Da sagt Frau Barley für die Politik, das sei alles Unsinn.
Wo ist denn noch einmal das Sturmgeschütz der sozialen Marktwirtschaft, der Bundeswirtschaftsminister? Er ist nicht da. In der Debatte zu diesem Thema war er auch nicht da.
– Wo ist er? – Da ist Herr Altmaier, Entschuldigung. Er ist normalerweise unübersehbar.
