Die Munich Re hat für das Jahr 2017 einen Bericht vorgelegt. Das ist das erste Jahr ohne El-Niño-Einfluss – das ist genau das, was Sie sagen –, ohne den Einfluss von natürlichen Klimaschwankungen. Das Jahr 2017 war das wärmste Jahr. Das ist ein deutlicher Ausdruck des menschgemachten Klimawandels, sagt Munich Re, der größte Rückversicherer. Wenn Sie nicht uns glauben, dann glauben Sie wenigstens denen. Denn denen geht es um bares Geld; das sind keine Ideologen.
– Anscheinend habe ich einen wunden Punkt getroffen. Sie brauchen aber gar nicht dazwischenzurufen. Ich bin lauter, auch ohne Mikrofon, meine sehr verehrten Damen und Herren.
Wenn Sie schon nicht uns glauben und wenn Sie nicht der Munich Re glauben, dann glauben Sie doch Ihren eigenen Wählern! Es gibt aus dem letzten Jahr eine Umfrage im Auftrag des RWI, des Rheinisch-Westfälischen Instituts für Wirtschaftsforschung – die habe ich bisher selten zitiert –,
zu der Frage, wie es mit der Akzeptanz der Energiewende aussieht. 59 Prozent der AfD-Wähler finden die Energiewende gut oder wollen sich sogar selbst daran beteiligen. 59 Prozent Ihrer Wähler! Ich finde: Entweder Sie folgen ihnen, oder wir fordern die Wähler auf, eine andere Partei zu wählen. Es gibt nämlich gute und sinnvolle Alternativen. In diesem Sinne: Alles Gute und Glück auf!
Vielen Dank.
Meine Damen und Herren, ich habe schon mehrere Zwischenfragen und Kurzinterventionen auch von Ihrer Seite zugelassen. Deshalb bitte ich um Verständnis, wenn ich keine weiteren zulasse.
Wir kommen zum Ende dieses Punktes. Weitere Redner sind nicht vorgesehen. Ich schließe die Aussprache.
Interfraktionell wird Überweisung der Vorlage auf Drucksache 19/2998 an die in der Tagesordnung aufgeführten Ausschüsse vorgeschlagen. – Ich sehe, dass Sie damit einverstanden sind. Dann ist die Überweisung so beschlossen.
