Wir sollten ihnen gemeinsam danken, dass sie es tun. Aber wir erleben eben das, was wir jetzt erleben: Sie dürfen zum Beispiel an keinen Hafen heranfahren, oder es ist Glückssache, welches Land sich gerade beteiligt. Deswegen sage ich jetzt noch einmal: Unsere Aufgabe muss es sein, Lösungen so zu gestalten, dass diese privaten Initiativen nicht sein müssen. Diese Aufgabe muss komplett in staatlicher Zuständigkeit bewältigt werden. Es muss eine klare Struktur herrschen, welchen Hafen mit entsprechender Infrastruktur die Schiffe jeweils anfahren und welche Verfahren ganz genau in europäischer Zielsetzung erfolgen.
Würden wir diese Aufgabe allein verschiedenen zivilen Organisationen überlassen, wäre die Abschreckung für Schleuser und Kriminelle – auch das muss man sagen – deutlich geringer. Wir alle miteinander, die dort schon Gespräche geführt haben, wissen sehr genau, welche falschen Versprechungen den Menschen gemacht werden und dass sie auch daran glauben.
Damit würden wir noch mehr Menschen in Gefahr bringen.
Deswegen wäre es jetzt eine wichtige Aufgabe des Bundesinnenministers, endlich Verhandlungen mit Staaten zu führen, aus denen die Menschen ohne Asylchancen kommen. Denn wenn bei uns schnelle und faire Verfahren durchgeführt werden, dann müssen Menschen, die keine Chance auf Asyl haben und kein Asyl bekommen, wieder in ihre Heimatländer zurückkehren. Da müssen wir das klare Signal senden, dass es nicht Glückssache ist, ob man hier Asyl bekommt, sondern es klare Verfahren sind, die darüber entscheiden, ob man in einem europäischen Land – und auch nicht in einem Land, das man sich aussucht, sondern in einem europäischen Land, dem man zugewiesen wurde – dann auch wirklich bleiben darf oder nicht.
Liebe Kolleginnen und Kollegen, Europa muss für Rationalität stehen, nicht für Einfallslosigkeit und schon gar nicht für Abschottung, wie es einige hier gerne wollen. Wir brauchen doch mehr europäischen Mut und mehr europäische Solidarität und weniger nationalstaatliche Angst und Einmauerung. Das brauchen wir in allen Hauptstädten Europas und nicht nur bei einigen Mutigen, die sich in diesen Tagen wieder zeigen.
Vielen Dank, Kollegin Özoğuz. – Guten Tag, liebe Kolleginnen und Kollegen! Nächste Rednerin für die FDP-Fraktion in dieser Aktuellen Stunde: Gyde Jensen.
