Es ist ja richtig: Weder die Vereinten Nationen noch die Europäische Union sind perfekt. Aber die Frage muss doch gestattet sein: Was wäre denn die Alternative dazu? Wäre denn die Regel, dass der Starke sich das Recht nimmt, das er sich nehmen kann, dass der Starke sich durchsetzt, wirklich eine Alternative zu einer gemeinsamen Ordnung? Ich mag mir das nicht vorstellen, und wenn man in die Geschichte schaut, weiß man, dass das nicht gutgeht. Das kann und darf keine Alternative in der internationalen Ordnung sein. Die Alternative für uns muss sein: internationale Zusammenarbeit, europäische Zusammenarbeit, Konflikte frühzeitig entschärfen und dafür sorgen, dass sich alle an die Regeln halten.
Bei der Frage, wie wir wichtige globale Probleme lösen können, stoßen wir doch sofort an eine Grenze. Wie sollen wir denn ein Problem wie den Klimawandel bewältigen, wenn jedes Land zuallererst nach seinen Interessen handelt,
wenn jedes Land zuerst auf die nächste Wahl schaut? Es ist dann schlicht unmöglich, ein solches Problem zu lösen; denn die Lösung der großen Fragen erfordert, dass man das Eigeninteresse ein Stück weit zurückstellt, das gemeinsame Interesse in den Vordergrund stellt und gemeinsame Lösungen anstrebt, die nur möglich sind, wenn jeder einen Schritt zurück tritt, wenn jeder ein Stück von seinem Interesse abgibt, damit das gemeinsame Interesse verfolgt werden kann.
Herr Kollege Schmidt, das, was Sie eben erwähnt haben, ist nicht richtig: Deutschland hat nicht zugegeben, die Ziele von Paris nicht einzuhalten. Richtig ist: Wir haben selbstgesteckte Ziele, die wir jetzt noch nicht einhalten, weshalb der Zeitplan verlängert wird. Das ist ein wichtiger Unterschied. Die Bundesrepublik steht zu den Klimaschutzzielen von Paris. Die Bundesregierung wird alles unternehmen, diese Ziele in den kommenden Jahren zu erreichen.
Herr Kollege, kommen Sie bitte zum Schluss.
Zum Schluss, Herr Präsident: Ich glaube, wir stehen an einem Scheideweg. Wir müssen uns entscheiden, ob wir Teil der Lösung sein wollen, nämlich Teil der Staaten, die sich für eine internationale Ordnung, für gemeinsame Regeln einsetzen, oder – –
Herr Kollege, ich habe Ihnen gerade das Wort entzogen. Ich verweise auf § 35 Absatz 3 der Geschäftsordnung. Ihre Rede ist zu Ende.
Als Nächstes erteile ich dem Kollegen Christian Schmidt von der CDU/CSU-Fraktion das Wort.
