– Sie können gerne eine Zwischenfrage stellen; der Kollege hat auch ganz vorbildlich eine Frage gestellt –: Wir müssen mehr für die Binnenkonjunktur tun und natürlich auch den Ländern, denen es gegenwärtig nicht so gut geht – das Beispiel Afrika wurde in der Debatte gebracht –, helfen, Stichwort „Hilfe vor Ort“. Das ist ein weites Feld. Das fängt bei der Frage an, wie wir die Sicherheit in diesen Ländern sicherstellen, nicht nur für unsere Entwicklungshelfer, und wie wir sicherstellen, dass demokratische Strukturen das Geld in die Kanäle lenken, die für uns wichtig sind, wie Wasserversorgung und Energieversorgung.
Das sind wichtige Herausforderungen. Das ist nicht so einfach zu bewältigen. Es fällt mir auch nicht leicht, Bundeswehrsoldaten nach Mali zu schicken. Aber ich glaube, wir müssen die Voraussetzungen dafür schaffen, dass die Mittel, die wir für die Entwicklungshilfe bereitstellen, auch bei den Menschen ankommen, die sie so dringend nötig haben.
Ein Punkt ist mir ganz besonders wichtig. Wir haben vor wenigen Tagen in Berlin den 70. Jahrestag der Luftbrücke begehen können. Ich sage das als Ostdeutscher zu Westberlin: Ich bin mit RIAS Berlin, also mit dem Rundfunk im amerikanischen Sektor, groß geworden. Wir sind den Amerikanern zu großem Dank verpflichtet, gerade auch an dieser Stelle, in dieser Stadt.
Umso mehr schmerzt es mich, dass dieser amerikanische Präsident offensichtlich alles über Bord wirft, was die guten Handelsbeziehungen zu den USA ausgemacht hat. Das schmerzt mich sehr.
Aber jetzt komme ich zu einem anderen Thema. Sehr geehrter Herr Bundesminister – und ich glaube, ich sollte auch den Außenminister ansprechen –,
wir sollten mutiger sein, auch wieder Kontakte zu Russland zu knüpfen.
Das sage ich Ihnen ganz ehrlich: Ich war als Wirtschaftsminister öfter in Russland – WM-Spielorte wie Nischnij Nowgorod oder Kasan kenne ich relativ gut –, und ich weiß, wie mühsam es ist, Vertrauen aufzubauen. Ich weiß aber auch, dass die Bereitschaft der Russen da ist, mit uns gemeinsam Dinge voranzubringen, ob im wissenschaftlichen Bereich oder im wirtschaftlichen Bereich. Ich denke, wir sollten auch sehen, dass wir unsere Netzwerke dort wieder ausbauen, weil das für unsere Zukunft wichtig ist.
Ich komme zum Schluss und stelle fest: Dieser Haushaltsplan ist – auch wenn er wahrscheinlich nur fünf Monate zur Umsetzung kommt; er muss ja erst einmal verkündet werden –, ein solider Haushalt. Sehr geehrter Herr Bundeswirtschaftsminister, ich bin mir sicher: Sie werden jetzt auch irgendwann die Lücke beim Staatssekretär für Energie schließen. Das ist ganz besonders wichtig. Denn die Debatte hat auch deutlich gemacht, dass wir da viel tun müssen.
In diesem Sinne würde ich mich sehr freuen, wenn das Haus diesem Haushaltsplan zustimmen könnte.
Ich schließe die Aussprache.
Wir kommen zur Abstimmung über den Einzelplan 09 – Bundesministerium für Wirtschaft und Energie – in der Ausschussfassung. Wer stimmt dafür? – Wer stimmt dagegen? – Wer enthält sich? – Der Einzelplan 09 ist mit den Stimmen der Koalitionsfraktionen gegen die Stimmen der Oppositionsfraktionen angenommen, und es gab in den Reihen der Grünenfraktion eine Korrektur des Abstimmungsverhaltens.
