Herr Präsident! Liebe Kolleginnen und Kollegen! Herr Brandt, Sie haben eben noch einmal Italien angesprochen. Ich möchte schon sagen: Wenn wir wirklich Lösungen näherkommen wollen, dann müssen wir die Geschichte auch immer wieder im Ganzen betrachten. Sie wissen selber, dass Italien 2013, als über 360 Leute vor der Küste der Insel Lampedusa ertrunken sind, das Programm Mare Nostrum aufgesetzt hat. Die Italiener haben das allein gemacht und auch allein bezahlt. Es gab keinen EU-rechtlichen Rahmen dafür, und es gab auch keine Unterstützung durch andere Mitgliedstaaten.
Ich finde, wir sollten zumindest versuchen, da mit einer gewissen Nüchternheit draufzuschauen.
Wenn die flüchtlingspolitische Antwort Europas – jetzt gehe ich mal einen Schritt weiter – eben nur Dublin III lautet, dann machen viele europäische Staaten nicht mit, andere fühlen sich alleingelassen. Damit alle mitmachen, brauchen wir diese gegenseitigen Anreize, und wir brauchen eine sinnvolle Aufgabenteilung in Europa. Das machen ja jetzt einige schon vorbildlich vor.
– Natürlich, aber wir müssen ja auch einer Lösung näherkommen.
Im Juni 2015 – das wurde eben erwähnt – begann ja dann die gemeinsame Mission EUNAVFOR MED, welche Schleuser-Netzwerke bekämpfen sollte und Migranten und Flüchtlinge von dieser lebensgefährlichen Überfahrt über das Mittelmeer abhalten sollte. Wir haben über diese Einsätze hier nun schon zweimal sehr ausführlich debattiert. Deswegen möchte ich nur noch einmal sagen: Auch wenn es nicht der eigentliche Auftrag ist, wurden dadurch über 48 000 Menschen gerettet, allein 22 500 – der Kollege Frei hat es gesagt – durch deutsche Schiffe, durch unsere Soldatinnen und Soldaten. Das waren wichtige Einsätze und lebensrettende Maßnahmen, und dafür kann man an dieser Stelle doch auch Danke sagen, dass das funktioniert.
Private Initiativen wie jetzt auch die Mission Lifeline ergänzen diesen Einsatz. Ich stimme Ihnen übrigens an dieser Stelle ausdrücklich zu, dass ich überhaupt nicht verstehen kann, warum man nicht mal genauer hinschaut, was das eigentlich für Menschen sind. Es sind ehemalige Matrosen, es sind Mittelständler, es sind Kapitäne, die einfach nicht mehr zusehen wollen, wie Menschen ertrinken. Deswegen muss ich schon sagen: Ich kann überhaupt nicht verstehen, wie man diese Menschen hier kriminalisieren kann.
