Sehr geehrte Frau Präsidentin! Sehr geehrte Kolleginnen und Kollegen! Gut, dass wir zur Kaffeezeit am Freitagnachmittag über das spannende Thema Geldwäsche im Bundestag reden, gut, dass die Linken bei der Bekämpfung der Geldwäsche richtig Gas geben möchten; schlecht nur: Wer im Glashaus sitzt, sollte nicht mit Steinen werfen. Hätte Die Linke diesen Ehrgeiz bei der Aufklärung der Geldwäsche nicht vor Jahren schon selbst zeigen können?
Lieber Kollege De Masi, ich schätze Sie persönlich sehr, auch in der Sache, auch im Hinblick auf Ihre kritischen Nachfragen. Die Erläuterungen dazu teile ich in der Regel nicht. Aber wieso klärt Ihre Partei nicht selbst bei der Geldwäsche auf? Wie scheinheilig ist das denn, wenn die Linksfraktion heute einen Antrag zur Geldwäsche einbringt,
obwohl vor ein paar Tagen aus gewaschenem SED-Vermögen 185 Millionen Euro ausgeschüttet wurden?
Liebe Kollegen der Linken, auch wenn das wehtut, muss das gesagt werden: Ihre Vorgängerparteien, SED und PDS, haben Millionen Euro ins Ausland gebracht und wollten diese waschen. Mit Ihrem Antrag wollen Sie den Bock zum Gärtner machen.
Es sitzen heute noch Genossen in Ihren Reihen, die damals Verantwortung getragen haben.
Wieso übernehmen Sie nicht jetzt die Verantwortung und sagen uns endlich, wo Ihre Millionen an gewaschenem Vermögen versteckt sind?
Kollege Müller, gestatten Sie eine Frage oder Bemerkung des Abgeordneten Klaus Ernst?
