Weltweit – wir haben es vorher schon gehört – sind 1 600 Kohlekraftwerke im Bau, davon allein 486 in China und 193 in Indien. Völlig egal also, wie viel Deutschland von seinem 2-Prozent-Anteil an den CO 2 -Emissionen einspart – 20 Prozent, 50 Prozent oder gar 100 Prozent –, egal wie viele Kohlekraftwerke wir abschalten –
wir erreichen damit nichts anderes als die Zerstörung von Millionen von Arbeitsplätzen und gefährden die Sicherheit der Menschen in unserem Land.
Wie der grüne baden-württembergische Umweltminister Untersteller zu Recht beklagt, riskieren wir mit der Energiewende flächendeckende Blackouts, bei denen Millionen Menschen tagelang ohne Strom sein werden. Das Büro für Technikfolgenabschätzung beim Deutschen Bundestag rechnet für diese Fälle mit Tausenden von Toten.
Im Stromnetz muss nämlich immer
– hören Sie einfach mal zu, Mensch!
Sie verstehen überhaupt nichts von Technik – genau so viel Strom vorhanden sein, wie gerade benötigt wird;
sonst bricht nämlich das Stromnetz zusammen. Nur gerade mal 1 Prozent der Windenergie steht zu jedem Zeitpunkt zur Verfügung. Das heißt, neben jede Windkraftanlage muss man zum Beispiel ein Kohlekraftwerk stellen –
für den Fall, dass zum Beispiel mal wieder der Wind gerade nicht weht.
Herr Kollege, gestatten Sie eine Zwischenfrage?
Ich gestatte keine Zwischenfrage. Ich würde das gern zu Ende bringen. Gern eine Kurzintervention danach.
Durch Windenergie kann also kein einziges Kohlekraftwerk abgeschaltet werden; sonst droht das Dunkeldeutschland grüner Ideologie.
