Und alle 7 Milliarden haben dann auch Anspruch auf Bleiberecht, ausdrücklich Staatsbürgerschaft und Sozialleistungen.
Dem unbeteiligten Beobachter Ihres Parteitages musste der Gedanke kommen: Linke, alle doof, außer Sahra.
Denn nur Frau Wagenknecht hat den Irrsinn abgelehnt und wurde dafür folgerichtig ausgebuht. Aber im Namen der AfD danke ich ihr ausdrücklich für ihre Offenheit. Damit wird deutlich, worauf Ihre Forderung nach offenen Grenzen hinausläuft: Deutschland wird abgeschafft, der Sozialstaat wird geschreddert, und die Dritte Welt kommt nach Europa.
Wir werden Ihre zentralen Punkte kopieren und einfach in den Fußgängerzonen in Ostdeutschland während des Wahlkampfes verteilen und sie plakatieren. Das ist der beste Wahlkampf, den wir machen können. Darauf freuen wir uns schon jetzt.
Ronald Reagan hat gesagt: Eine Nation, die ihre Grenzen nicht kontrollieren kann, ist keine Nation. – Wir werden alles dafür tun, dass wir eine Nation bleiben.
Vielen Dank.
Das Wort hat die Kollegin Dr. Eva Högl für die SPD-Fraktion.
