Herr Präsident! Meine Damen und Herren! Heute liegt uns eine Ausbildungs- und Prüfungsverordnung für Pflegefachkräfte zur Abstimmung vor. Erlauben Sie mir, dass ich darauf hinweise, dass wir als Grüne eine eigene Reform vorgeschlagen hatten mit einer integrierten Ausbildung, die sicher, was die inhaltliche Vertiefung der Abschlüsse, gerade im letzten Abschnitt der Ausbildung, angeht, besser gewesen wäre als das, was Sie jetzt vorgelegt haben.
Andererseits ist auch klar, dass es jetzt darum geht, dass die Ausbildungsstätten endlich Sicherheit bekommen, wie sie sich auf eine neugeordnete Ausbildung vorbereiten können. Von daher werden wir uns jetzt darauf konzentrieren, die Umsetzung kritisch zu begleiten.
Lassen Sie mich aber auch sagen: Hinter der praktischen Umsetzung stehen noch viele Fragezeichen; auch das ist in der Anhörung deutlich geworden. Wie wollen Sie eine praktische Ausbildung für 40 000 Auszubildende in der Generalistik an über 300 Kinderstationen in diesem Land ermöglichen? Dahinter steht ein ganz, ganz großes Fragezeichen.
Da muss ich Ihnen sagen: Wir werden genau hinschauen, wie das in der Praxis umgesetzt wird.
Dem Entschließungsantrag der Linken werden wir zustimmen, obwohl wir ihm nicht hundertprozentig in allen Punkten folgen können.
Mir ist wichtig, jetzt zur Anlage 4 dieser Ausbildungsverordnung zu kommen, wo es um die eigenständige Altenpflegefachausbildung geht. Ich sage: Vom Referentenentwurf bis zur jetzigen Vorlage ist eine Altenpflegefachausbildung zweiter Klasse entstanden.
Herr Minister Spahn, ich habe ehrlich gesagt nicht verstanden, was Sie vorhin mit Ihrer Warnung bezüglich der Wortwahl meinten. Sie können uns Parlamentarier ja nicht gemeint haben. Meinten Sie alle Fachleute in der Anhörung am Montag, die alle diese Altenpflegeausbildung, wie sie jetzt vorliegt, kritisiert haben?
Oder meinten Sie vielleicht die Mitarbeiter in Ihrem Ministerium, die den Referentenentwurf vorgelegt haben, den Sie nachträglich abgeschwächt haben? Oder meinten Sie vielleicht die beiden Mitarbeiterinnen bzw. Professorinnen, die wesentlich an der Erarbeitung beteiligt waren und gestern einen Brandbrief an Sie geschrieben haben, in dem sie völlig zu Recht gesagt haben, dass eine hochwertige Versorgung so nicht gewährleistet ist,
wenn desaströse Gehälter und die Unterbewertung des Berufsbilds zementiert werden?
