Das ist konkretes Handeln, und das hat bisher dazu geführt, dass jeder fünfte Flüchtling, der seit 2015 zu uns gekommen ist, jetzt in sozialversicherungspflichtiger Beschäftigung ist.
Herr Kollege Middelberg, kommen Sie bitte zum Schluss.
Zu dem, was wir in der Migrations- und Integrationspolitik tun, könnte ich Ihnen hier noch eine halbe Stunde lang konkrete Ergebnisse liefern.
Das können Sie nicht; kommen Sie bitte zum Schluss.
Herzlichen Dank.
Als Nächstes hat der Kollege Dr. Gottfried Curio für die AfD-Fraktion das Wort.
