Herr Präsident! Sehr geehrte Abgeordnete! Sehr geehrte Frau Ministerin! Auf 1,5 Grad Celsius wollen Sie uns nun also einschwören mit dem vorliegenden ­IPCC-Bericht und dem vorläufigen vom BUND initiierten Rodungsstopp im Hambacher Forst. Dieser Wald, um den sich gerade die gesamte rot-grüne Welt zu drehen scheint, wurde 2016 zur Abholzung freigegeben – von einer rot-grünen Landesregierung. Herzlichen Glückwunsch!
An die Damen und Herren vom BUND habe ich einige Fragen. Sie berichten von mehreren Kisten an Unterlagen, die belegen, dass die Bechsteinfledermaus oder das Große Mausohr im Hambacher Forst ihr Zuhause haben. Wurden diese Unterlagen eigentlich erst nach dem Regierungswechsel in NRW 2017 erstellt? Und wo wohnten diese Fledermäuse, als in Düsseldorf noch eine rot-grüne Regierung am Schalten und Walten und Roden war? Sind diese Fledermäuse vielleicht erst unter Schwarz-Gelb dahin gezogen? Fragen über Fragen. Oder ist es vielleicht so, dass es weder den Melonenparteien noch dem BUND tatsächlich um Wald und Fledermäuse geht, sondern einzig darum, mit solchen ideologisierten Kampagnen ihre eigene Existenz zu rechtfertigen?
Blicken wir einen Wald weiter nach Aachen. Dort kreischen die Kettensägen und holzen fleißig ab, damit Windkraftanlagen errichtet werden können. Diese liefern zwar viel weniger Strom als ein Braunkraftkohlewerk, töten dafür aber viel mehr Tiere, vor allem Vögel und – Fledermäuse!
Wir werden sehen, ob die Damen und Herren des BUND auch dort vor Gericht ziehen und einen Rodungsstopp erwirken. Ich denke, nicht.
Dabei sind in NRW durch bereits errichtete bzw. in Bau und Planung befindliche Windkraftanlagen circa 160 Hektar Wald betroffen, und niemand hat dort nach der Bechsteinfledermaus oder dem Großen Mausohr gesucht.
Wir halten also fest: Es gibt nicht nur guten Wald und schlechten Wald; es gibt auch gute und schlechte Fledermäuse.
Beachtet man dann noch, dass alle Windkraftanlagen, die in allen Wäldern Deutschlands je errichtet wurden oder derzeit geplant sind, auch zusammen nicht annähernd an die Stromproduktion des Braunkohlekraftwerks Niederaußem heranreichen können, in dem die Verstromung der Hambacher Kohle stattfindet, erkennt man erst den gesamten Grad an Heuchelei hierbei.
– Ich erwarte Ihre Gegendarstellung.
