Sehr geehrte Frau Präsidentin! Liebe Kolleginnen und Kollegen! Die Zurückdrängung des „Islamischen Staates“ ist keine rein militärische Aufgabe. Im Gegenteil: Korruption, Misswirtschaft, systematische Ausgrenzung ethnischer und religiöser Gruppen, schlechte Regierungsführung sind ebenfalls weltweit Nährboden für den „Islamischen Staat“. Deswegen wird es darauf ankommen, ob die neue irakische Regierung, die sich in den nächsten Tagen bildet, diese Herausforderung annimmt, die Menschen integriert, eine gute Regierungsführung zeigt und insbesondere das, was die Menschen im Irak erwarten, nämlich soziale Gerechtigkeit, auch erfüllt.
Meine Damen und Herren, wir engagieren uns deswegen insbesondere mit zivilen Mitteln. Seit 2014 hat die Bundesrepublik Deutschland, hat dieser Deutsche Bundestag 1,4 Milliarden Euro für humanitäre Hilfe, für Wiederaufbau, für Beratungsleistungen zur Verfügung gestellt. Dem Irak kommt auch zugute, dass wir insbesondere die Nachbarländer in dieser Situation mit großen Summen unterstützen. Ich glaube, es ist notwendig, daran zu erinnern. Wir wollen nicht alleine mit militärischen Antworten auf diese Herausforderungen reagieren, sondern insbesondere mit zivilen und politischen Maßnahmen.
Kollege Mützenich, gestatten Sie eine Frage oder Bemerkung des Kollegen Lambsdorff?
Wenn er schon weiß, was ich sagen will, ja.
Ich habe nur eine Frage, lieber Herr Mützenich. Wir schätzen uns ja, wir kennen uns lange. Deshalb wundert mich der Einstieg in Ihre Rede. Kennen Sie in diesem Haus irgendeinen oder irgendeine, der oder die glauben würde, man könne den IS allein mit militärischen Mitteln bekämpfen? Glauben Sie wirklich, dass hier so jemand sitzt? Glauben Sie, dass in der NATO jemand das glaubt oder in der Allianz gegen den „Islamischen Staat“? Ich glaube das nämlich nicht. Ich glaube, Sie bauen hier einen Popanz auf.
Lieber Herr Kollege Lambsdorff, ich will keinen Popanz aufbauen, aber ich glaube, Reden hier im Deutschen Bundestag müssen aufklärerischer Natur sein.
Sie dürfen sich nicht nur an die Abgeordneten wenden, sondern müssen auch zeigen, dass dieses Parlament eine hohe Verantwortung im Rahmen einer demokratischen Sicherheitspolitik hat. Ich bin stolz, dass ich der sozialdemokratischen Fraktion angehöre, die eben nicht alleine über Sicherheitspolitik debattiert, sondern auch über Friedenspolitik, über zivile Mittel. Das wollte ich mit diesem Einstieg deutlich machen.
Ich spreche Ihnen das gar nicht ab. – Vielen Dank.
Auch wenn wir uns mit zivilen Mitteln engagieren, sage ich trotzdem – auch für uns Sozialdemokraten, lieber Herr Kollege Lambsdorff –, dass der IS auch mit militärischen Mitteln zurückgedrängt werden muss.
Das war für uns in der SPD-Fraktion ein schwerer Lernprozess. Aber wir haben uns dazu bekannt. Sie waren noch nicht Mitglied im Deutschen Bundestag, als wir uns hier sozusagen zerrissen haben in der Frage, ob wir auch Waffen in den Nordirak liefern dürfen. Aber wir wissen: Es gibt Gewalträume, es gibt eine Bürgerkriegsökonomie, die leider eben insbesondere auch militärisch von regionalen Mächten unterfüttert wird. Deswegen haben wir uns damals zu diesem Einsatz bekannt.
Alle Fraktionen des Deutschen Bundestages haben damals von Anfang an dieses Mandat parlamentarisch intensiv begleitet. Ich bin froh, dass das für ein selbstbewusstes Parlament steht. Dieses Parlament macht, seitdem das Bundesverfassungsgericht entschieden hat, aus dieser Verantwortung des Bundesverfassungsgerichts mehr. Jetzt formulieren wir Mandate mit. Jetzt diskutieren wir. Jetzt stellen wir auch Bedingungen. Ich finde, deswegen haben wir es verfassungsrechtlich, völkerrechtlich gut begründet. Ich hätte mir gewünscht, dass zum Beispiel auch Beschlüsse der Generalversammlung der Vereinten Nationen zur Begründung herangezogen worden wären. Aber die Erneuerung des Beschlusses im Sicherheitsrat war auch notwendig, sodass der Deutsche Bundestag weiß, es ist völkerrechtlich und verfassungsrechtlich mandatiert.
Kollege Mützenich, gestatten Sie eine Frage oder Bemerkung des Kollegen Pflüger?
Ja. Halten Sie die Uhr dann bitte an?
