Drittens verhindert ein guter Deal, dass der Brexit den Standortwettbewerb mit Lohn- und Steuerdumping weiter anheizt. May hat ja kürzlich die Katze aus dem Sack gelassen: Die Tories wollen nach dem Brexit durch Niedrigsteuern Investitionen aus anderen Ländern abwerben. – Hier muss die EU unnachgiebig sein und mit Straf- bzw. Quellensteuern drohen.
Übrigens wäre auch hier Corbyn der bessere Verhandlungspartner.
Viertens gehört zu einem guten Deal natürlich eine gute Perspektive für die künftigen Beziehungen. Dafür muss die EU ihr Dogma der Unteilbarkeit der Binnenmarktfreiheiten verändern. Wir müssen Großbritannien bei Abkommen wie Kanada, Singapur oder andere Länder behandeln.
Herr Präsident, ich komme zum Schluss. – Es ist viel von rechten Entwicklungen in Europa berichtet worden. Ich bin dankbar und glücklich, dass am Wochenende 240 000 Menschen hier in Berlin gegen Rassismus und Ausländerfeindlichkeit und für mehr Sozialstaatlichkeit auf der Straße waren.
Ich gratuliere allen Organisationen, die daran teilgenommen haben; denn es war ein gutes Zeichen für Deutschland und für Europa, dass wir den rechten Tendenzen etwas entgegenzusetzen haben.
Vielen Dank.
Jetzt hat das Wort die Kollegin Dr. Franziska Brantner, Bündnis 90/Die Grünen.
