Wo sind die Nazijäger, wenn man sie einmal wirklich bräuchte?
Viertens. Minister Maas, hier vorgestern: Das deutsche Interesse hat einen Namen. Es heißt „Europa“. – Gemeint hat der Außenminister natürlich EU-ropa, wie immer. Die EU-ropa-Politik der Bundesregierung lautet: Es funktioniert nicht. Also machen wir mehr Europa. – Die SPD will gar das Einstimmigkeitsprinzip bei der EU aufgeben, also die EU-Regierung etablieren, den EU-Haushalt, den EU-Bundesstaat. Das ist alles illegal. Man träumt. Wie Macron träumen auch Schulz und Scholz von all diesen illegalen Dingen. Wo ist der Verfassungsschutz, wenn man ihn braucht? Das ist glatt illegal!
Die AfD macht bei diesen Rechtsbrüchen nicht mit. Wir machen Politik für Deutschland und Europa, aber nicht für EU-ropa.
Fünftens: Kosten der Zuwanderung. Das ist ein Dauerthema. Aber es ist nun einmal so: Selbst die offiziell zugegebenen Immigrationskosten entsprechen in diesem Haushalt der Summe der Einzelpläne der Ministerien für Familie, Senioren, Frauen und Jugend, für Umwelt und des Äußeren. Wo sind die Sozial- und Umweltaktivisten, wenn man sie bräuchte?
Sechstens. Man hat durchaus Geld für einige interessante Dinge: Distriktentwicklung in Ghana, Geschlechtergerechtigkeit in Mosambik, Wohnraum in der Ukraine. Man hat natürlich auch Geld für Türkei-Finanzhilfen, noch mehr, als wir schon wussten. Heute Morgen bekam ich noch einmal zusätzliche Hilfen in Höhe von 500 Millionen Euro auf den Tisch; das wurde in Brüssel bereits beschlossen. Wirklich diskutiert haben wir über diesen Aufwuchs nicht. Das ist Geld für Diktator Erdogan, der völkerrechtsbrechende Angriffskrieger in Syrien.
Aber das scheint diese Bundesregierung nicht zu stören. Man ist in Syrien ja sogar selbst bellizistisch unterwegs. Wo sind die Friedensaktivisten, wenn man sie bräuchte? Wo ist auch hier der Verfassungsschutz?
