Menschen in diesem Land wollen selbstbestimmt in einer freien, emanzipierten Gesellschaft leben. Da gehört sexuelle Selbstbestimmung selbstverständlich dazu, und zwar ohne einen § 219a und ohne Bevormundung.
Liebe Kolleginnen und Kollegen, mal konkret: Was wäre denn, wenn § 219a aus dem Strafgesetzbuch gestrichen wäre? Dann könnten Frauen sich im Falle einer ungewollten Schwangerschaft schnell, ohne Beschränkungen und online bei einer Ärztin oder einem Arzt fachlich informieren und bekämen so sehr viel mehr Sicherheit.
Ungewollt Schwangere könnten – ohne auf Listen von Beratungsstellen warten zu müssen – selbst herausfinden, wo und bei welcher Ärztin oder bei welchem Arzt sie Beratung und Hilfe bekämen. Und Ärztinnen könnten eine bestmögliche Versorgung von Frauen gewährleisten und so ihrer Staatsaufgabe – ich wiederhole das noch mal: es ist eine Staatsaufgabe – verantwortlich nachkommen.
Ärztinnen würden nicht mehr Gefahr laufen, verklagt zu werden. Darum geht es hier.
Und sehr wichtig ist auch: Die medizinische Ausbildung könnte endlich erweitert werden. Dann könnte es auch möglich sein, dass in der medizinischen Ausbildung gelehrt wird, wie man Schwangerschaftsabbrüche professionell vornimmt.
Kollegin Schauws, gestatten Sie eine Frage oder Bemerkung?
