auch das ist ein richtiger und wichtiger Punkt. Wir brauchen mehr Bauland in Deutschland. Eins ist auch klar – das sehen wir schon heute –: Allein über Nachverdichtung und Dachgeschossausbau wird uns die Bewältigung dieser Herausforderung nicht gelingen. Wir brauchen neues Bauland. Wir brauchen die Entwicklung neuer Stadtteile, und wir müssen auch den Kommunen Mut machen, neue Stadtteile zu entwickeln. Auch das werden wir als Große Koalition anpacken.
Es geht auch um Baulandpreise. Liebe Frau Lay, Sie tragen in Berlin Verantwortung. Allein in Berlin sind die Baulandpreise im letzten Jahr um 77 Prozent gestiegen. Auch das ist ein Beispiel Ihrer falschen Politik. Hier setzen wir mit unserer Baulandkommission an. Wir werden den Investoren preiswertes Bauland zur Verfügung stellen. Denn: Wer bezahlbare Mieten will, liebe Kolleginnen und Kollegen, muss auch bezahlbar bauen. Auch das gehört zur Wahrheit.
Herr Kollege, die Redezeit ist vorbei.
Wir werden für faire und verlässliche Rahmenbedingungen sorgen, wir werden Anreize für mehr Bautätigkeit setzen, wir werden auf einfache und schlanke Genehmigungsverfahren hinwirken, und wir werden für mehr Bauland sorgen, liebe Kolleginnen und Kollegen.
Ein letzter Wunsch an die Länder: Wir haben in Deutschland 16 Landesbauordnungen –
Herr Kollege, bitte, Sie sind jetzt am Ende der Redezeit.
– lieber Herr Präsident –, ich meine, das sind 15 zu viel. Wir arbeiten daran: mehr bezahlbaren Wohnraum in Deutschland.
Herzlichen Dank.
Der nächste Redner ist der Kollege Frank Magnitz für die AfD-Fraktion.
