Herr Lucassen, bitte.
Danke, Herr Kollege Brandl. – Auch Ihren Vorredner betreffend, möchte ich zwei Dinge klarstellen, da sie anscheinend ein bisschen aus Ihrem Blickwinkel geraten sind. Sie sind – genauso wie wir alle – verantwortlicher Angehöriger dieses Bundestags und gehören als Abgeordneter der Legislative an. Das andere sind unsere Streitkräfte. Diese haben Sie vor Ort gesehen. Unsere Streitkräfte leisten einen tollen Beitrag. Dazu müssen wir hier nicht dauernd ein Kerzchen anzünden und ihnen danken. Das ist selbstverständlich. Das machen die Soldaten gerne und gut.
Es schadet aber auch nicht, wenn man den Soldaten einmal Danke sagt.
Des Weiteren haben Sie über dieses politische In­strument zu entscheiden. Als die Soldaten vor Ort gefragt haben, wie die Fraktionen entscheiden werden, gab es nur einen Abgeordneten – Sie sind dabei gewesen und werden das mitbekommen haben –, der den Soldaten eine klare Antwort gegeben hat. Das war ich.
Alle anderen haben sich vor einer Antwort gedrückt und gesagt: vorbehaltlich der Fraktion. – Ich habe den Soldaten gesagt:
Klar, die AfD-Fraktion wird dem Einsatz nicht weiter zustimmen. – Nehmen Sie das einfach zur Kenntnis. Das verstehen Soldaten, unabhängig davon, ob sie ihren Auftrag gut durchführen oder nicht.
Danke.
