Auf meine Nachfrage konnte er natürlich keine wissenschaftliche Begründung geben und zog sich auf die Erderwärmung seit der Kleinen Eiszeit zurück. Übrigens: Hätte es diese natürliche Rückerwärmung seit dem Ende der Kleinen Eiszeit nicht gegeben, wären wir noch immer in einer ziemlich unbehaglichen, teilweise für Flora und Fauna sehr lebensfeindlichen Kaltzeit. Natürlich beziehen Sie sich auf das Pariser Übereinkommen, das niemanden ernsthaft bindet. Deswegen ist es auch kein Abkommen, und nur deswegen wurde es auch angenommen. Aber Sie wollen, dass sich Deutschland – wie so oft – lammfromm per Grundgesetz an dieses Abkommen bindet. Es ist Ihnen dabei völlig egal, dass, selbst wenn man der Ideologie und den Berechnungen der Computermodellierer glaubte – das tun die AfD und viele unabhängige Wissenschaftler nicht –, bei einem völligen Verzicht Deutschlands auf alle fossilen Energieträger in allen Bereichen irgendwann in ferner, unbekannter Zukunft nur eine Minderung der Welttemperatur von 0,000653 Grad Celsius herauskäme. Für diese 0,000653 Grad Celsius wollen Sie, Ihrer Ersatzreligion, wie ich vorhin beschrieb, folgend, unseren Wohlstand opfern. Sie wollen die Zukunft Deutschlands Ihrer Ideologie, die im Gewand der Wissenschaft auftritt, zwangsweise unterordnen.
Was kommt als Nächstes, falls Sie mit dieser Attacke auf unsere Freiheit Erfolg haben sollten? Kommt dann die gesetzlich garantierte Verfolgung der Leute, welche heute schon von Ihnen als Klimaleugner diffamiert werden? Sind dann alle kriminell, die wissenschaftliche Beweise für eine Hypothese fordern, die die Steuerzahler schon mehrere Hundert Milliarden Euro gekostet hat? Zuzutrauen wäre es Ihnen, wenn man sieht, wie Sie – auch heute – die kriminellen Baumschützer im Hambacher Forst bejubelnd unterstützen.
Jubeln können die Polizeibeamten vor Ort nicht. Sie werden mit Molotowcocktails beworfen und mit Kot überschüttet. Menschen, die anderer Meinung sind, werden durch den Wald gejagt. Genau diese Kriminellen bejubeln Sie. Gleichzeitig lassen Sie es zu bzw. ordnen teilweise selber an, dass für Windräder ein Vielfaches dessen gerodet wird, was im Hambacher Forst vorgesehen ist.
Übrigens, liebe Grüne, mit Ihren Bemühungen müssen Sie sich ein wenig sputen. Die Zeit Ihrer Unterstützer läuft ab, zumindest die der Klimakanzlerin; das durften wir vorgestern erleben. Wir von der AfD werden die Kanzlerin nicht daran hindern, weiter an ihrem eigenen Sturz zu arbeiten. Dieser ist unserer Meinung nach längst überfällig. Aber Sie werden wir daran hindern, unser Grundgesetz zu missbrauchen.
Vielen Dank.
Das Wort hat der Kollege Klaus Mindrup für die SPD-Fraktion.
