Sie haben gesagt: Da gehören viele nicht hin. – Jetzt wüssten wir von Ihnen einmal gerne: Wer der Studierenden gehört denn nicht an eine Hochschule, wenn das Hochschulzugangsberechtigte sind, die die Eingangstests bestanden haben, die Zugangsvoraussetzungen etc. haben? Welche Gruppe wollen Sie denn weg von der Uni haben? Wir sagen sehr klar: Es muss ein durchlässiges, es muss ein inklusives Hochschulsystem geben. Sie scheinen offensichtlich ein Bildungskastensystem haben zu wollen, dass Arbeiterkinder immer Arbeiterkinder bleiben und Elite immer Elite bleibt. Sagen Sie hier einmal sehr klar: Wer gehört denn da nicht hin?
Vielen Dank für die Frage, Herr Kollege Gehring. Die lässt sich ganz einfach beantworten. – Ach so, Sie waren noch nicht fertig?
Sie haben auch gesagt, alle würden ihr Studium abbrechen.
Nein, jeder Dritte. Fast jeder dritte Student bricht sein Studium ab.
Ach, jeder Dritte. Auch diese Zahl ist aber falsch, ein Fake. Ich finde es wichtig, das festzuhalten.
Herr Kollege, wir machen hier keinen Dialog. Herr Kollege Gehring, Sie stellen eine Frage, die wird beantwortet. Ein Dialog ist nicht zulässig.
Vielen Dank für den Belehrungsversuch, Herr Gehring. Sie können diese Zahl gerne im Faktencheck nachprüfen: Fast jeder Dritte bricht sein Studium ab.
Gerade weil diese Abbrecherquote so hoch ist, sagen wir: Wir brauchen bessere Steuerungsmechanismen, zusätzlich zum Abitur. Ich komme gleich noch dazu, welche das sind.
Wir haben noch weitere Vorschläge. Ich komme jetzt gleich dazu, welche das sein können.
Wir stehen nämlich ein für Eignungsprüfungen, zusätzlich zum Abitur, weil das Abitur aufgrund der linken Bildungspolitik in vielen Bundesländern leider nichts mehr wert ist und keine Steuerungsmechanismen mehr entfaltet. Die Kapazitätsverordnung an den Hochschulen zwingt die Hochschulen, immer mehr Studenten aufzunehmen. Davon müssen wir wegkommen; denn die Qualität kann so gar nicht erhöht werden.
Da müssen wir dringend heran. Auch die FDP hat das erkannt, Sie nicht. Wir brauchen eine bessere Beratung und stärkere Berufsorientierung. Schließlich darf auch die Einführung von Studiengebühren – noch ein Aufreger für Sie – kein Tabu sein, insbesondere für Studenten aus dem Ausland.
Fazit: Wer Qualität will, muss sich vom Sozialismus verabschieden. Die Uni für alle bringt keine bessere Qualität. Davon müssen wir weg.
Ich danke Ihnen für Ihre Aufmerksamkeit.
Vielen Dank. – Als nächste Rednerin hat das Wort die Kollegin Dr. Wiebke Esdar, SPD-Fraktion.
