– Natürlich war das die Frage. – Es geht um zwei unterschiedliche Bemessungsgrundlagen. Der Selbstständige zahlt seine Steuern auf sein zu versteuerndes Einkommen, und er kann bestimmte Sachen auch nicht abziehen. Aber es geht darum, dass er die Kosten von seinen Einnahmen abziehen muss; denn das, was er an Einnahmen hat, ist doch nicht das, was für ihn übrig bleibt.
Genau das ist es.
Sie werden es einfach nicht verstehen. Wir können es mal bei einem Kaffee oder einem Glas Wein besprechen. Da werde ich Sie mit einem Steuerberater zusammenbringen. Ich bin mein Leben lang selbstständig gewesen. Ich weiß, wie es läuft. Sie anscheinend nicht, Frau Kollegin. Aber das kriegen wir auch noch hin.
Herr Minister, kurz noch zum Morbi-RSA. Da kann ich Sie nur herzlich bitten: Werden Sie aktiv; denn es ist ganz wichtig, dass beim Morbi-RSA ganz schnell etwas passiert. Sie können sich sicher sein, dass wir als konstruktive Opposition Sie dabei unterstützen werden.
Da ich gerade bei Ihnen bin, Herr Minister: Ja, es tut mir leid; es wird ja auch immer gesagt: Ihr kritisiert immer so viel an den Gesetzen, und ihr sagt gar nichts Positives.
Ich weiß ja auch: Männer sind sensibel. Deswegen, Herr Minister Spahn, will ich Sie auch mal loben: Ja, positiv ist – es wurde schon gesagt –, dass für ehemalige Soldaten ein nahtloser Übergang in die GKV sichergestellt wird. Das begrüßen wir sehr. Die Menschen, die unserem Land gedient haben, verdienen auch unsere besondere Unterstützung.
Deswegen war das eine gute Maßnahme.
Positiv finden wir auch, dass Bezieher von Kranken- und Mutterschaftsgeld jetzt endlich nur ihre tatsächlichen Einnahmen verbeitragen müssen. Vorher mussten sie ja auch den Mindestbeitrag zahlen. Das finden auch wir toll, dass Sie das umgesetzt haben, was unsere Sachverständigen in der Anhörung verdeutlicht haben. Also, das war jetzt ein Lob. Ich hoffe, Sie haben es mitbekommen. – Gut, wunderbar.
Ansonsten muss ich aber sagen, dass der Gesetzentwurf mehr Schattenseiten hat als Positives. Deswegen werden wir dagegenstimmen.
Ganz herzlichen Dank.
Nächster Redner: Dr. Achim Kessler für die Fraktion Die Linke.
