Frau Präsidentin! Liebe Kolleginnen und Kollegen! Mit den heute Abend aufgesetzten Beratungspunkten zum Solidaritätszuschlag versucht ein Teil der Opposition dem nachzukommen, wozu sie sich wohl verpflichtet fühlt: die Regierung so ein bisschen zu quälen. Sie versuchen es zumindest.
Die AfD und die FDP versuchen heute in ganz ungewohnter Eintracht, das schärfste Schwert der Schwachen zu nutzen: Das ist die Öffentlichkeit.
Aber die Öffentlichkeit soll heute Abend hier hinters Licht geführt werden.
Ihnen, Kolleginnen und Kollegen von AfD und FDP, geht es ja heute nicht um die Sache.
Es geht Ihnen heute nicht um fachlich-politische Auseinandersetzungen zu diesem Thema. Ihnen geht es darum, die Redezeit im Plenum zum wiederholten Mal zu nutzen, um Ihre bekannten Vorschläge zur sofortigen Abschaffung des Solidaritätszuschlags zu präsentieren.
Das ist dem Wahlkampf geschuldet, das wissen wir nun alle.
Dass dieses Thema heute auf der Tagesordnung steht, ist einem Geschäftsordnungskniff geschuldet. Sie haben § 62 Absatz 2 der Geschäftsordnung des Bundestages herangezogen, um heute diese Debatte überhaupt führen zu können. Dieser Paragraf besagt ja sinngemäß, dass eine Fraktion verlangen kann,
dass der Ausschuss dem Bundestag einen Bericht zum Stand der Beratungen erstattet und dieser Bericht dann auch auf die Tagesordnung gesetzt wird, wenn eine Vorlage zehn Wochen nach der Überweisung an den Ausschuss nicht erledigt ist. Ja, eine Beschlussfassung über einen Gesetzentwurf im Ausschuss darf tatsächlich nicht ohne irgendeinen Grund verhindert werden;
das ist völlig richtig. Aber wir sind doch mittendrin. Wir sind mitten in einem noch nicht abgeschlossenen politischen Meinungsbildungsprozess,
in einem politischen Abstimmungsprozess.
