Guten Morgen, Herr Präsident! Guten Morgen, liebe Kolleginnen und Kollegen! Sehr geehrte Gäste auf der Tribüne! Wir debattieren heute über einen Antrag, der eine Änderung des TARGET2-Systems fordert.
TARGET2 ist ein System des Zahlungsverkehrs, über das nationale und vor allem grenzüberschreitende Euro-Zahlungen schnell und mit sofortiger Gültigkeit abgewickelt werden. Kurz zusammengefasst: Das ­TARGET2-System sorgt dafür, dass Handel und Dienstleistungen im Euro-Raum problemlos und rechtssicher möglich sind.
Jetzt gehe ich mal davon aus, dass die meisten von Ihnen – zumindest die Gäste auf der Tribüne – noch nicht viel über das TARGET2-System gehört haben. Weil mein Kollege Lothar Binding, der sonst immer wunderbar erklärt, erst nach mir drankommt, nutze ich die Gelegenheit, das TARGET2-System einmal aus der Sicht eines ganz normalen Bürgers oder einer ganz normalen Bürgerin zu erklären.
Wenn ich beschließe, meinem Vater zu Weihnachten einen Rentierpullover – natürlich nicht aus echtem Rentierfell, sondern gestrickt – in Finnland zu bestellen, dann kann ich das machen: Ich bestelle den Pullover und überweise das Geld von meinem Konto – natürlich bei der Sparkasse – auf das Konto des finnischen Händlers; so denke ich mir das als Kunde.
In Wirklichkeit funktioniert das anders im Euro-Raum. In Wirklichkeit ist es so, dass die Sparkasse mein Geld der Bundesbank überweist. Dann passiert in Finnland etwas ganz Ähnliches: Die finnische Zentralbank überweist das Geld, wenn es angekommen ist, an den Händler. Dazwischen ist die EZB. Jetzt kommt das TARGET2-System ins Spiel: Die EZB verbucht nämlich eine Forderung der finnischen Zentralbank und eine Verbindlichkeit der Bundesbank. So, bis hierhin ist alles klar. In den meisten Fällen erübrigt sich dann eine direkte Geldüberweisung, weil nicht nur ich einen Pullover in Finnland bestelle, sondern am gleichen Tag vielleicht ein Finne eine Kuckucksuhr im Schwarzwald bestellt. Und nicht nur wir beide bestellen etwas, sondern an dem Tag bestellen ganz viele Menschen. Deshalb erübrigen sich Überweisungen, die Fälligkeiten verrechnen sich. Über TARGET2 geschieht das alles täglich im gesamten Euro-Raum und vereinfacht den Geldverkehr natürlich enorm. Ohne dieses System wäre ein reibungsloser Geldverkehr zwischen den Euro-Staaten in der heutigen Form überhaupt nicht möglich.
Eine denkbare Alternative zu diesem komplizierten Zahlungssystem wäre übrigens – so viel zur Lehrstunde „TARGET2, was steckt dahinter?“ –, wenn man die Zentralbanken der Euro-Länder abschaffen würde, wenn man also quasi nur die EZB hätte. Dann hätte man dieses komplizierte System nicht mehr. Dann würde sich auch das – angebliche – Problem erübrigen, das dem Antrag der AfD zugrunde liegt. Aber so weit – das wäre dann die Fiskalunion – sind wir im Euro-Raum noch nicht.
Das ist bedauerlich; aber das wird hoffentlich irgendwann einmal kommen.
