Herr Präsident! Liebe Kolleginnen und Kollegen! Zunächst mein Dank an die Grünen. Ich finde, es ist richtig, dass wir uns, wenn wir einen solchen internationalen Bericht vorgelegt bekommen, auch hier im Parlament im Rahmen einer Aktuellen Stunde damit auseinandersetzen.
Wir haben da etwas vor uns – das zeigt diese Aktuelle Stunde –, was weit über Legislaturperioden hinausreicht. Deswegen, finde ich, muss eine Aktuelle Stunde wie diese dazu dienen, die Frage zu stellen: Fühlen wir uns in unserer Demokratie und als Parlament eigentlich in der Lage, eine solche Menschheitsaufgabe gemeinsam zu lösen? Nach dem, was ich hier gehört habe, sage ich:
Eine Gruppe scheint nicht einmal bereit zu sein, das zu akzeptieren, was uns Tausende von Wissenschaftlern weltweit derzeit sagen. Dann ist man, glaube ich, draußen.
Dann kann man nichts mehr machen. Aber Sie werden sich vielleicht irgendwann einmal gegenüber Ihren Kindern oder Ihren Enkeln verantworten und erklären müssen, warum Sie hier solche Haltungen eingenommen haben. Ich hoffe, wir machen das wett.
Was die anderen betrifft, glaube ich, ist die Grundsatzfrage, die wir stellen müssen, Herr Köhler: Sind wir bereit, zu akzeptieren, dass wir uns als Bundesrepublik Deutschland und als Europäische Union völkerrechtlich verpflichtet haben – beispielsweise im Rahmen der völkerrechtlichen Verpflichtung im Hinblick auf das Klimaschutzziel 2030 –, zu liefern? Denn eins ist klar: Wenn wir mit unseren CO 2 -Fußabdrücken nicht liefern, werden wir viele Menschen und viele Länder dieser Welt niemals dazu bewegen können, ebenfalls eine Wende mitzutragen, liebe Kolleginnen und Kollegen.
Wie schaffen wir es gegebenenfalls, miteinander um den besten Weg zu ringen? Damit diese Aktuelle Stunde einen Sinn hat – und ich finde, sie soll einen Sinn haben –, möchte ich festhalten, Olli Krischer: So schlecht ist das, was wir im Koalitionsvertrag vereinbart haben, gar nicht.
Aber: Es steht da nur drin,
