Frau Präsidentin! Liebe Kolleginnen und Kollegen! 7,5 Millionen Menschen in Deutschland haben einen Minijob. Das sind 7,5 Millionen Menschen, die in den letzten fünf Jahren von der allgemein guten wirtschaftlichen Entwicklung und von der sehr guten Lohnentwicklung abgekoppelt geblieben sind, weil Sie es in den letzten Jahren versäumt haben, die starre Minijobgrenze von 450 Euro anzuheben.
Das ist ungerecht, und das kann nicht richtig sein.
Ich denke beispielsweise an den 18-jährigen Niklas, der mir gestern Abend noch schrieb – er wohnt in Freising –, dass er mit dem 450-Euro-Job das Geld für seinen Führerschein verdient. Ich denke an die Schülerin, die in der Bäckerei arbeitet, in der ich mir samstagvormittags meine Brötchen kaufe, und die die Eigentümerfamilie in den Randzeiten entlastet. Und ich denke an den Oberstabsfeldwebel, der von seinem Einkommen natürlich seine Familie ernähren kann, der sich aber mit einem 450-Euro-Job sein Hobby, das Motorradfahren, extra finanzieren kann. Ich denke an die vielen Studierenden in Deutschland, die sich mit ihrem Minijob in Gastronomie und im Handel ihr Studium erleichtern, um einen Lebensstandard zu haben, der angemessen ist.
Überall, liebe Kolleginnen und Kollegen, steigen die Löhne. Die Menschen verdienen in ihren Berufen mehr, und die meisten Menschen bekommen tatsächlich auch mehr. Ausgerechnet aber die Minijobber bleiben zurück. Für sie wirkt sich die allgemein gute Entwicklung bei den Löhnen nicht im Geldbeutel aus. Liebe Kolleginnen und Kollegen der Großen Koalition, Sie haben es in den letzten fünf Jahren versäumt, diese starre Einkommensgrenze von 450 Euro anzuheben. Das ist ungerecht, und das wollen wir ändern.
Ganz besonders bitter ist es natürlich für die 700 000 Minijobber, die einen Arbeitslohn in Höhe des Mindestlohns haben. Der Mindestlohn steigt jedes Jahr; das ist richtig und auch gut so. Aber das wirkt sich gerade bei den Geringverdienern nicht im Geldbeutel aus.
Warum? Weil die Minijobgrenze starr bei 450 Euro beibehalten wurde. Das kann nicht richtig sein. Das muss geändert werden.
