Auch der Städtetag zum Beispiel formuliert mittlerweile einen Bedarf an deutlich längeren Bindungsfristen. Das heißt, das Problem ist erkannt. Die Bindungsfristen sind ja in den zurückliegenden 30 Jahren immer kürzer geworden. Wir brauchen also nicht nur deutlich mehr Bundesmittel für Wohnraumförderung, sondern wir brauchen auch deutlich längere Bindungsfristen und letzten Endes am besten eine neue Gemeinnützigkeit, um mindestens 100 000 Wohnungen dauerhaft preiswert zu halten.
Verehrte Damen und Herren, natürlich ist auch uns klar, dass wir die Probleme auf dem Wohnungsmarkt nur lösen werden, wenn wir die Probleme im ländlichen Raum lösen,
gemeinsam mit den Wohnungsbauproblemen in den Großstädten. Wir müssen die Themen „Leerstand“ und „Attraktivität im ländlichen Raum“ angehen. Wir brauchen dort bessere Infrastruktur.
Noch ein letzter Punkt: Was wir unbedingt in Angriff nehmen müssen, ist die bodenlose Bodenspekulation in unserem Land,
die dazu geführt hat, dass man heutzutage überhaupt nicht mehr preiswert bauen kann, selbst wenn man preisbewusst baut, weil der Bodenpreis schon vorher eine Miete erzeugt hat, die keiner mehr bezahlen kann. Deswegen müssen wir uns dringend um das Thema Bodenpreise kümmern und dieses Spiel, das zahlreiche Spekulanten in unseren Städten treiben, dringend beenden.
Herzlichen Dank für Ihre Aufmerksamkeit.
Vielen Dank. – Ich lasse jetzt zwei Kurzinterventionen zu. Der Erste ist der Kollege Timon Gremmels. Lieber Herr Kollege, Sie haben das Wort.
