Sehr geehrter Herr Präsident! Sehr geehrte Damen und Herren! Liebe Kollegen! Zur Desinformation, liebe Bundeskanzlerin, ein Wort: Sie haben den Bundesverfassungsschutzpräsidenten geschasst, weil er Ihrer Desinformation widersprochen hat, und haben damit gezeigt, was Sie für ein Demokratieverständnis haben.
Zum Brexit. Ich möchte zitieren:
Ich kann nicht ausschließen, dass der britische Austritt Lust auf mehr machen würde in anderen Ländern.
So EU-Kommissionspräsident Juncker im Mai 2016, wenige Wochen vor der Abstimmung über den Brexit. Dank solcher Aussagen war von Anfang an klar, wie die Marschrichtung der Kommission und auch die der Bundeskanzlerin aussehen würde: Statt das Ergebnis einer demokratischen Volksabstimmung eines Partnerlandes in Demut zur Kenntnis zu nehmen und Selbstkritik zu üben, ist man sich in Brüssel sofort einig: Es muss ein Exempel statuiert werden. Großbritannien muss bestraft werden. – Das ist Ihre Politik.
Daran ändert auch die nun beschlossene halbherzige Verlängerung der Übergangsfrist nichts; denn der Zugang zum Binnenmarkt ist für die Briten bereits jetzt eingeschränkt. Die Verhandlungsführung der Europäischen Union mit der zweitstärksten europäischen Volkswirtschaft ist unfair, ja, sie ist unverantwortlich.
Die EU-Bürokraten haben Angst. Ohne Drohgebärden lässt sich die Union anscheinend auch nicht mehr zusammenhalten. Und das haben ja auch Sie, Frau Bundeskanzlerin, in Ihrer Rede überdeutlich ausgedrückt: Parteien, die es wagen, zu widersprechen, werden sanktioniert.
Vernunft spielt anscheinend grundsätzlich keine Rolle mehr. Gesinnungs- statt Verantwortungsethik, das ist Ihre oberste Handlungsmaxime.
Wenn die historisch gewachsenen Wirtschaftsbeziehungen zwischen Großbritannien und dem übrigen Kontinent leichtfertig destabilisiert werden, so wie Sie es tun, wenn kollektive Selbstschädigung betrieben wird, wird Europa weltwirtschaftlich das Nachsehen haben. Das trifft vor allem Deutschland; denn Großbritannien ist einer unserer wichtigsten Handelspartner. Für diese Herausforderung brauchen wir Antworten – Antworten, die Sie bis heute, auch in Ihrer Rede, nicht geliefert haben. Wir hingegen sehr wohl.
Es ist im Interesse unseres Landes, dass der freie Warenaustausch mit dem Vereinigten Königreich sicher und auf Augenhöhe geregelt wird.
Auch muss für künftige Austrittkandidaten der Exit-Artikel 50 der europäischen Verträge reformiert werden. Das habe ich bereits vor dem Brexit gefordert.
Die Frage, was hinter der Ausgangstür kommt, muss doch klar definiert werden, und das passende Vertragsformat ist auch dafür bereits da: das Abkommen über den Europäischen Wirtschaftsraum, den EWR, von 1992. Garantiert sind hier die vier Freiheiten, die Freiheiten des Waren-, Kapital-, Dienstleistungs- und Personenverkehrs. Dabei müssen wir aber den Personenverkehr neu fassen. Wir brauchen einen freien Verkehr von Arbeitnehmern und Selbstständigen, keinen freien Zugang in die Sozialsysteme.
