Sehr geehrter Herr Präsident! Meine sehr verehrten Damen und Herren! Liebe Frau Ministerin! Sehr geehrter Herr Krischer, Sie haben leider nur einen Satz zur internationalen Ebene dieses Berichts gesagt. Das ist wirklich traurig. Frau Ministerin, was Sie hier gerade abgelassen haben, zeigt genau das Problem. Sie haben nur von sich selber gesprochen. Sie haben davon gesprochen, welche Position Sie einnehmen. Sie haben aber nicht über eine gemeinsame Position, über ein gemeinsames strategisches Vorgehen gesprochen.
Das ist die große Herausforderung, vor der wir stehen.
Man kann den IPCC-Bericht so auslegen, dass eine schwarzmalerische Weltuntergangsstimmung erzeugt wird, die uns dazu verleiten soll, hektisch und aktionistisch und ohne jeglichen Plan und Strategie vorzugehen. Man kann diesen Bericht aber auch so lesen, dass wir die Probleme an der Wurzel packen und aus der Not des Klimawandels eine Tugend machen, eine Tugend, die dazu führt, dass wir ein gemeinsames Handeln der internationalen Völkergemeinschaft hinbekommen.
Die Herausforderungen durch den Klimawandel bringen uns in eine historisch einmalige Situation. Denn das erste Mal haben wir eine menschengemachte Krise, die wir nur durch menschengemachtes Handeln wieder lösen können. Die Diskussion hier in Deutschland zeigt auch nach dem IPCC-Bericht, in welche fatale Richtung es geht.
Ja, Herr Krischer, der Hambacher Forst ist ein Symbol. Er ist aber auch ein Symbol für eine überhitzte Debatte über den Kohleausstieg, die nicht mehr in Sachlichkeit, sondern nur noch in Symbolik geführt wird.
Das ist tatsächlich die große Frage unserer Klimapolitik.
Wir führen diese Debatte, wie wir gerade gehört haben – jetzt gibt es auch eine Debatte über Gas; ich bin gespannt, wie wir das machen wollen –, ohne Rücksicht auf Verluste,
ohne Rücksicht auf die Versorgungssicherheit, auf den Strompreis, auf die Zukunft der Menschen, die in den Regionen leben. Der Erfolg der Energiewende hängt doch nicht davon ab, wie viel Windkrafträder wir gebaut haben.
Der Erfolg der Energiewende hängt davon ab, ob wir es hinkriegen, unser Wirtschaftswachstum und unsere gute Beschäftigungssituation zu verbinden mit einer Reduktion des CO 2 -Ausstoßes. Darin liegt der Erfolg der Energiewende, und nicht darin, wie groß der Anteil der erneuerbaren Energien ist.
Meine Damen und Herren, Sie hatten als Beispiel das Geschacher um die CO 2 -Grenzwerte angesprochen. Bisher zeigen die aktuellen Grenzwerte nicht, dass sich die Situation mit Blick auf den Klimawandel verbessert hat. Wir haben keinen Klimaschutz erreicht. Aber was machen wir jetzt? Wir wollen noch mehr von dem, was nicht funktioniert. Das ist doch völlig absurd.
Niemand, keiner hier, hat mir bisher erklären können, warum wir den Rebound-Effekt nicht erneut haben werden, warum wir 2027 nicht wieder hier stehen und exakt die gleiche Diskussion führen. Es ist Wahnsinn, immer das Gleiche zu tun und zu hoffen, dass etwas Neues dabei herauskommt.
Totaler Nonsens! Es tut mir leid.
