– Jetzt hören Sie doch mal bitte auf, hier so rumzuschreien!
Da steht nämlich: Wir brauchen eine Erhöhung des Kindergeldes und auch des Kinderfreibetrages. – Aber wir haben eben auch deutlich gemacht – mit Ihnen, Frau Schön –, dass dies auch bei Kindern aus armen Familien ankommen muss. Das geschieht mit diesem Gesetz eben nicht.
Wir müssen doch alle Kinder und alle Familien in den Mittelpunkt stellen, damit nicht ein Teil der Familien, die dieses Gesetz lesen, sagt: Oh Gott, bei mir kommt es gar nicht an. – Und das sind viele: Das sind 3 Millionen Kinder, die Sie mit diesem Gesetz außen vor lassen. Das ist der Punkt, den wir hier kritisieren.
Sie müssen gar nicht so rumschreien; Sie schreiben es in Ihrem eigenen Gesetzentwurf. Lesen Sie bitte Seite 2 Ihres eigenen Gesetzentwurfes. Dort steht:
Die Erhöhung des Kindergeldes hat Auswirkungen auf die Leistung der Grundsicherung für Arbeitssuchende. Das erhöhte Kindergeld führt bei einer Anrechnung auf die Leistungen zur Sicherung des Lebensunterhaltes zu Einsparungen im SGB II in Höhe von … 130 Millionen Euro …
Dann geht es so noch weiter. Da schreiben Sie schwarz auf weiß: Dieses Geld kommt bei Kindern im SGB-II-Bezug nicht an. – Das müssen Sie dringend ändern.
Es gibt eben, Herr Steininger, nicht nur die Ida, deren Eltern arbeiten, sondern es gibt auch Hunderttausende von Idas, deren Eltern derzeit leider nicht arbeiten, und die sind auf einen Kinderzuschlag angewiesen, wegen dem Sie, Herr Schrodi, hier die ganze Zeit rumschreien.
Aber leider ist die automatische Auszahlung des Kinderzuschlags eben nicht in diesem Gesetzentwurf mit drin; dafür haben wir in den Jamaika-Verhandlungen massiv gestritten.
Und warum haben wir dafür so massiv gestritten? Frau Schön, Sie haben es selber gesagt: Sie haben zwei kleine Kinder. Ich auch. Wir alle wissen, wie das ist, wenn die Kinder mit löchrigen Gummistiefeln in die Kita müssen. Wir alle wissen, wie das ist, wenn ein Kind nicht zum Kindergeburtstag kommt, weil die alleinerziehende Mutter sagt: Ich kann mir das am Ende des Monats nicht leisten.
Deswegen: Sie können hier keine Zeit vergeuden. In dieses Gesetz gehören die automatische Auszahlung des Kinderzuschlages und eine Erhöhung der Kinderregelsätze beim SGB-II-Bezug hinein; denn auch 15‑jährige Jungs im Teenageralter haben es verdient, zu diesem Land und zu dieser Familienpolitik dazuzugehören. Das ist im Sinne der Demokratie und im Sinne von uns allen.
Herzlichen Dank.
Nächste Rednerin ist die Kollegin Dr. Wiebke Esdar, SPD-Fraktion.
