Ich weiß nicht, ob es bei meinen letzten Reden nicht so deutlich wurde; ich wiederhole meine Forderung bei diesem Thema jedoch sehr gerne, weil es eine zentrale Fehlentwicklung in der gesetzlichen Rentenversicherung ist: Die gesetzliche Rentenversicherung wird schon seit Jahren mit versicherungsfremden Leistungen belastet. Das sind Leistungen, die eigentlich aus Steuern finanziert werden müssen. Alle neu von Ihnen geplanten Leistungen sind versicherungsfremd: die Erhöhung bei der Mütterrente, die Entlastung der Geringverdiener, die Erhöhung der Anrechnungszeiten bei der Erwerbsminderungsrente. Hier wurden keine Anwartschaften in Form von Beiträgen erworben. Aus diesem Grunde sind diese Leistungen auch aus Steuermitteln zu bezahlen.
Allein diese drei von Ihnen neu geplanten Vorhaben kosten die Versicherten in der gesetzlichen Rentenversicherung im Jahr 2019 4,1 Milliarden Euro.
Ihre Strategie ist Abwarten, bis die gesetzliche Rentenversicherung Ihnen signalisiert, dass sie Bundesmittel benötigt, um ihre Pflichten erfüllen zu können. Nur: Das ist der falsche Weg, den Sie, Herr Minister Heil, da beschreiten. Die gesetzliche Rentenversicherung mag noch gute Beitragseinnahmen haben und kann Ihre Wahlgeschenke noch finanzieren – nur, zu welchem Preis? Bei dieser Rechnung benötigen wir auch keine höheren mathematischen Kenntnisse, das ist wirklich recht einfach: Wenn versicherungsfremde Leistungen durch die gesetzliche Rentenversicherung getragen werden müssen, dann wird die Summe, die an die Rentenempfänger ausgeschüttet wird, logischerweise kleiner. Die heutigen Rentner sind es, die Ihre Wahlkampfgeschenke mit einer geringeren Rente finanzieren müssen.
An dieser Stelle hätte ich mir eine Zusammenstellung der versicherungsfremden Leistungen gewünscht – das ist leider nicht erfolgt –, dann wäre Ihnen sehr schnell klar geworden, wie lächerlich Ihre Jahreszahlung von 500 Millionen Euro eigentlich ist. Als ein kleines Gegenbeispiel: Die jährliche Erleichterung, die den Rentenbeitragszahlern aufgrund Ihrer doppelten Haltelinien verwehrt bleibt, beträgt rund 3,6 Milliarden Euro.
Die Bundesregierung predigt ständig, die Bürger sollen doch bitte privat vorsorgen und sich nicht nur auf die gesetzliche Rentenversicherung verlassen.
Gleichzeitig erschweren Sie den Bürgern die private Vorsorge, wenn Sie Beitragssenkungen nicht so wie geplant durchführen. Mit Ausnahme des Jahres 2023 liegt der Beitragssatz bis 2025 laut geltendem Recht immer unter dem von Ihnen festgelegten Beitragssatz.
Irgendwie müssen die Wahlkampfgeschenke ja finanziert werden.
