Ich denke, das Frauenbild, das hinter dieser Regelung steht, ist ein ganz positives; denn die gesetzliche Regelung stellt ausschließlich darauf ab, welche Entscheidung die Frau am Ende nach der Beratung trifft. Sie braucht sich nicht zu rechtfertigen. Sie braucht sich nirgendwo zu erklären. Sie hat dann Zugang zu dem Arzt, den sie frei wählen kann. Da gibt es überhaupt keine Einschränkungen.
Der zweite Irrtum ist, dass es ein Informationsverbot für Frauen gäbe. Das Einzige, was § 219a wirklich ausschließen möchte, ist, dass durch diejenigen informiert und geworben wird, die selber kommerziell anbieten.
Das ist die einzige Einschränkung. Ansonsten gibt es öffentliche Informationen ohne eigenes Interesse, ohne jede Einschränkung. Deshalb können zum Beispiel auch Listen von Ärzten im Internet veröffentlicht werden. Ebenfalls völlig unproblematisch ist die individuelle Beratung durch den Arzt, wenn die Entscheidung über das Ob der Abtreibung gefällt ist und es konkret darum geht, welche Narkose angewandt wird, welche Methode gewählt wird und dergleichen mehr. Sie tun manchmal so, als gäbe es Informationen für die Frauen nur im Darknet. Das ist wirklich absurd.
Zusätzlich zu all diesen öffentlichen Informationsquellen sind die Beratungsstellen für die Beratung da. Sie beraten umfassend – nicht nur über die medizinischen Dinge. Schließlich geht es im Rahmen der Frage, ob eine Abtreibung durchgeführt wird, noch um ganz andere Aspekte: Wie kann ich eine Ausbildung mit einem Kind fortsetzen? Welche Unterhaltsansprüche habe ich gegen den Vater? Wie kann ich denn mit dem Kind leben? Dazu soll ermutigt werden, und dazu ist diese Beratung da.
Der dritte Irrtum ist, dass durch § 219a Frauen angeblich keine Ärzte finden. Das ist nicht so; denn wenn es da Probleme gibt, dann liegen sie nicht an § 219a. Im Gesetz ist geregelt, dass jeder Arzt ohne Probleme die Information, dass er Abtreibungen durchführen will, der Beratungsstelle – jeder Beratungsstelle in ganz Deutschland übrigens – mitteilen kann. Frauen können sich dann dort darüber informieren, wer Abtreibungen vornimmt, und zwar deutschlandweit. Effektiver geht es doch gar nicht. Damit erreicht man jede Frau, die darüber nachdenkt, eine Abtreibung zu machen. Sie hat dann die freie Wahl.
Ich würde Ihnen raten: Fragen Sie doch einmal alle Ärzte, die da ein Problem haben, ob sie ihre Adresse allen Beratungsstellen in Deutschland gegeben haben. Dann werden sie nämlich kein Problem haben, an die Frauen heranzukommen, die über eine Abtreibung nachdenken.
Entscheidend ist aber – das möchte ich hier auch noch einmal zu bedenken geben –: Wir müssen doch vom Kind her denken. Das Kind ist kein Zellhaufen und kein Schwangerschaftsgewebe, sondern Mensch von Anfang an. Deshalb hat es das Recht auf Schutz verdient durch die bestmögliche Beratung und auf die Ermunterung bzw. die Ermutigung zu dem Kind.
Kollegin Winkelmeier-Becker, ich habe die Uhr angehalten.
Das ist keine ärztliche Leistung. Deshalb ist § 219a in diesem Schutzkonzept zentral.
Danke schön.
