Ich glaube, mit solchen Projekten können wir die Werte, die unser Land ausmachen, vorleben und einüben. Solche Projekte sollen auch von diesem Geld, das wir an den Zentralrat der Juden geben, unterstützt werden und am besten in ganz Deutschland stattfinden können.
Vielleicht schließt sich Ihre Besuchergruppe da auch mal an und kann davon auch mal etwas lernen.
Es ist gesagt worden – und ich schließe mich dem an –: Wir können froh sein, dass in diesem Land heute wieder rund 100 000 Menschen jüdischen Glaubens leben, dass das Leben der Juden plural ist, dass sie hier teilhaben. Wir müssen dafür arbeiten, dass sie das ohne Angst tun können.
Dieser Staatsvertrag ist ein guter Staatsvertrag, und er findet unsere uneingeschränkte Unterstützung.
Vielen Dank.
Vielen Dank, Herr Kollege Professor Castellucci. – Als Nächstes spricht für die FDP-Fraktion der Kollege Dr. Stefan Ruppert.
