Herr Präsident! Liebe Kolleginnen und Kollegen! Ich glaube, die Konfliktlinie ist gerade noch einmal deutlich geworden. In der Tat geht es darum, wie wir eine Lösung, die wir wollen, finanzieren.
Ich will noch einmal darstellen, welche Probleme in der Anhörung deutlich geworden sind. Wir haben immer noch Produkte für die betriebliche oder private Altersvorsorge, die unterschiedlich verbeitragt werden. Das ist übrigens ein Thema, das wir noch generell angehen müssen. Die Frage ist ja, ob wir Beiträge in der Ansparphase oder hinterher in der Auszahlungsphase erheben wollen. Dieser Punkt ist noch offen; das haben wir bei vielen Produkten noch nicht geklärt. Wir haben das nur beim Betriebsrentenstärkungsgesetz gemacht, indem wir das Produkt „Riester“ sowohl für die betriebliche als auch für die private Vorsorge hinterher beitragsfrei gestellt haben. Das trifft für andere Produkte aber nicht zu.
Deshalb müssen wir uns das noch einmal anschauen. Ich finde, das rechtfertigt schon, dass wir sagen, wir haben noch Beratungsbedarf, auch zu diesem Punkt,
übrigens zusammen mit den Kollegen aus dem Bereich Arbeit und Soziales, weil es um die Rente und die Förderung an sich geht.
Das Thema, um das es jetzt aber geht, ist, ob wir – das ist eine politische Frage –, wenn wir die Betriebsrenten für die Zukunft stärken wollen, das über das Steuersystem machen wollen oder ob wir wollen, dass die Menschen in der Auszahlungsphase am Ende nur den halben Beitrag statt wie jetzt den vollen Beitrag bezahlen. Rudolf Henke hat gerade erklärt, wir haben ein Leistungsprinzip in der gesetzlichen Krankenversicherung; eigentlich müssten wir alles heranziehen, was da ist. Die Frage ist: Machen wir das zu 50 Prozent oder zu 100 Prozent? Die SPD will das zu 50 Prozent machen, und zwar mit der politischen Argumentation, dass wir die Betriebsrenten stärken wollen.
Wir können nämlich nicht einerseits den Menschen sagen, sie sollen vorsorgen, und das dann aber andererseits nicht fördern und es zudem so kompliziert machen, dass ein Arbeitgeber nicht mehr in der Lage ist, seinem Arbeitnehmer die verschiedenen Produkte und Verbeitragungen zu erklären.
Deshalb haben wir auch hier eine Baustelle.
