Herr Präsident! Meine sehr geehrten Damen und Herren! Ich glaube, es ist Zeit, ein wenig innezuhalten und sich zu fragen, wie man Antisemitismus bekämpft. Es ist wahrscheinlich wohlfeil, immer auf eine Gruppe zu zeigen und zu sagen: Antisemitismus geht vor allem von links oder von rechts oder vom Islamismus aus. – Am schwierigsten und am glaubwürdigsten wird es aber, wenn man sich selbst hinterfragt. Und als Vertreter einer Partei der Mitte sage ich: Er geht auch von der Mitte der Gesellschaft aus. – Deswegen ist es für uns alle die Aufgabe, ihn nicht auf einer Seite abzubuchen, sondern den Schmerz zu spüren, den uns diese Äußerungen allen zufügen, und das zu bearbeiten.
Meine Partei hat nach 1945 natürlich antisemitische Äußerungen erlebt. Wir haben uns damit auseinandergesetzt. Wir haben Nazis gehabt, die in die FDP eingetreten sind – wie in andere Parteien übrigens auch. Wir haben das bearbeitet und aufgearbeitet. Wir haben uns davon emanzipiert. Wir haben eine Partei in die Mitte der Gesellschaft geführt, und wir sind sensibel. Damit haben Sie nicht mal angefangen. Im Gegenteil: Sie brechen auf in eine Richtung, die einseitig Antisemitismus zuordnet.
Wer aufhört, sich selbst Fragen zu stellen, sich zu hinterfragen: „Wo war ich an dem Tag? Was habe ich gemacht?“, der soll nicht andere anklagen und auf andere mit dem Finger zeigen, sondern jeder arbeite bitte auf seiner Baustelle. Ihre ist sicherlich nicht die kleinste, ganz im Gegenteil.
Es ist sinnvoll, diesen Vertrag abzuschließen. Bei all dem, was wir auch immer bedauernd sagen müssen, weil wir merken, dass Menschen in unserem Land wieder Angst haben, nur weil sie einer bestimmten Glaubensrichtung angehören, ist es sinnvoll, auch mal darüber zu reden, was für wunderbares jüdisches Leben es in Deutschland gibt, wie plural es ist.
Da gibt es die ELES, eine Stiftung für Stipendiaten, die besonders begabt sind. Es gibt liberale Rabbinerseminare, orthodoxe Rabbinerseminare, es gibt gesellschaftliche Initiativen, da bildet sich eine neue jüdische Denkfabrik – morgen mit einer hochinteressanten Konferenz –, da sind Menschen mitten in dieser Gesellschaft. Sie gestalten sie mit und helfen, dass aus der freiheitlich-demokratischen Grundordnung noch mehr wird; sie leben Pluralismus, und dafür sage ich den Jüdinnen und Juden in Deutschland an dieser Stelle ganz herzlichen Dank – genauso wie für die Arbeit des Zentralrats der Juden in Deutschland.
Jüdisches Leben kann aus der Sicht von uns Deutschen, die wir die deutsche Geschichte und ihre größte Katastrophe kennen, nie aus der Normalperspektive betrachtet werden, und trotzdem wünsche ich mir, dass wir irgendwann in einer Gesellschaft leben, in der wir diese Vielfalt noch stärker wahrnehmen und in der sie uns noch stärker erfreuen kann, weil die Probleme des Antisemitismus etwas kleiner werden. Es wäre leider eine Illusion, zu glauben, dass wir sie jemals ganz beseitigt haben. Nein, diese Fragen – auch an uns selbst – werden immer bleiben.
Herr Kollege Ruppert, erlauben Sie eine Zwischenfrage des Kollegen Dr. Baumann?
