2060 sinken wir aktuell auf ein Rentenniveau von circa 41 Prozent, und Sie wollen uns jetzt mit einer Berechnung, ausgelegt auf einen Anteil vom Bruttoinlandsprodukt, weismachen, dass die Leute, wenn sie jetzt mehr zahlen würden, im Alter eine deutlich höhere Rente hätten – wohl wissend, dass der Altersquotient auf 65 Senioren pro 100 Erwerbstätige steigen wird, wohl wissend dass wir letztendlich nur einen Kuchen zu verteilen haben, der von den Erwerbstätigen finanziert werden muss und natürlich unter den Rentnern aufgeteilt wird? Sie stellen sich tatsächlich hierhin und sagen: Wenn Sie 20 oder 30 Euro mehr Rentenbeiträge im Monat zahlen, dann werden Sie am Ende eine deutlich bessere Rente haben. – Wollen Sie das den Leuten wirklich so vermitteln?
Ich glaube, das war eine Superfrage. Dann kann ich Ihnen nämlich erstens erklären, dass wir im Durchschnitt um die 1 Prozent Arbeitsproduktivitätssteigerung und Wirtschaftswachstum haben.
Das wird in all diesen Debatten, bei denen immer nur über Köpfe gesprochen wird, nicht erwähnt. Der Kuchen wird größer; es ist also mehr zum Verteilen da.
Zweitens. Hier sitzt Andrea Nahles, heute Fraktionsvorsitzende. Sie war aber einmal Arbeitsministerin und hat ein Rentenpaket vorgelegt. Da hat sie – vielen Dank dafür! – freundlicherweise auch mal unsere Vorschläge durchgerechnet.
Dabei kam heraus, dass es, wenn wir das Rentenniveau wieder auf 53 Prozent anhöben, keinen Cent teurer wäre als Ihr Dreisäulensystem. Ihr rechnet nämlich nie die Kosten für Riester, 4 Prozent vom Bruttoeinkommen, und für eine Betriebsrente aus.
Ich habe beim Ministerium angefragt, und die haben mir gesagt: Man braucht im Jahr 2030 einen Beitragssatz von 29 Prozent – den haben wir aber auch 2030 im Dreisäulensystem –; dann würden Arbeitgeber 10,9 Prozent zahlen, Arbeitnehmer 10,9 Prozent, die Arbeitnehmer aber noch 4 Prozent für Riester und 3,2 Prozent für eine kapitalgedeckte Betriebsrente. Das heißt, wenn man ehrlich ist, sind die Kosten immer gleich. Ich will das nur nicht den von Finanzmarktinteressen getriebenen Kapitalmärkten überlassen, sondern dem guten Solidarsystem der gesetzlichen Rentenversicherung.
Wir haben das alles durchgerechnet; Sie können es haben. Rechnen Sie bei der Arbeitsproduktivität, und zwar konservativ, mit 1 Prozent. Rechnen Sie beim Wirtschaftswachstum, konservativ, mit 1 Prozent. Herr Professor Dr. Gerd Bosbach – nicht zu verwechseln mit Wolfgang Bosbach; nur damit das klar ist –
ist Professor für Statistik, Empirie und Mathematik an der Fachhochschule Koblenz, Standort Remagen. Er hat ausgerechnet, dass bei 1 Prozent Produktivitätssteigerung die Renten für die Babyboomer so zu finanzieren sind, dass auch für sie Artikel 1 des Grundgesetzes „Die Würde des Menschen ist unantastbar“ gilt.
Das dazu; jetzt mache ich aber weiter. – Ich sage, liebe Koalition, lieber Herr Minister Heil: Sie wollen das derzeit viel zu niedrige Rentenniveau einfrieren. Der Sinkflug geht nicht weiter; okay. Aber Einfrieren reicht nicht. Wir Linken wollen eine gesetzliche Rente, die auch 2040 und 2060 noch den Lebensstandard sichern wird, und deswegen wollen wir zügig zu einem Rentenniveau von 53 Prozent zurückkehren.
Nun zur Mütterrente. Herr Heil, herzlichen Dank dafür, dass Sie den vermutlich verfassungswidrigen Plan der CSU, nur für Mütter oder Väter mit drei oder mehr Kindern die Mütterrente zu erhöhen, verhindert haben! Danke dafür! Viele Eltern, auch bayerische Eltern, Herr Dobrindt, mit ein oder zwei Kindern werden erleichtert sein.
Aber, Herr Minister, Sie bleiben auf halber Strecke stehen. Warum? Ab Januar 2019 sollen Mütter oder Väter für ein Kind, das vor 1992 geboren wurde, statt 62,06 Euro Mütterrente 80 Euro erhalten. Halbe Strecke! Warum? Die Mütter im Osten werden für dasselbe Kind nur 76,73 Euro bekommen.
