Leider sind Sie von CSU und FDP aber unehrlich. Sie haben unsere entsprechenden Anträge zur Verhinderung der Fahrverbote hier in diesem Haus abgelehnt. Ich muss leider annehmen, Herr Scheuer, dass Sie hier nur wegen der Landtagswahl in Bayern so tun, als wollten Sie Fahrverbote tatsächlich effektiv verhindern.
Die Bürger in einigen und um einige unserer Metropolen wie Stuttgart, Hamburg und Frankfurt, neuerdings auch Berlin, sehen sich von realen Fahrverboten bedroht. Dass zukünftig viele unserer Bürger und nicht Sie ihr Auto stehen lassen müssen, ist ungerecht und zynisch. Herr Scheuer, Sie können sich offensichtlich gegen die Umweltministerin, Frau Schulze, hier überhaupt nicht durchsetzen.
Frau Schulze vertritt in der Regierung die Position der Grünen. Fatal für unser Land ist es, dass die CSU neuerdings ja sogar offen ist für Koalitionen mit den Grünen.
Sie können das hier gerne bestreiten.
Von Grünen, Linken und der SPD wird hier immer wieder ganz bewusst etwas sehr Entscheidendes vermischt: Verschiedene Untersuchungen von Umweltorganisationen und Kraftfahrt-Bundesamt haben gezeigt, dass die Abgasgrenzwerte, die für die Zulassung eines Fahrzeugs vorgeschrieben sind, im Realbetrieb nicht erreicht werden. Jeder, der auch nur einmal in seinem Leben in einem technischen Bereich gearbeitet hat, weiß, dass andere Testbedingungen zu einem anderen Ergebnis führen können. Die höheren Abgaswerte des Realbetriebs im Vergleich zum Laborbetrieb sind daher kein Betrug, sondern ein wissenschaftlicher Fakt. Diesen Zusammenhang wollen oder können Sie eben nicht verstehen.
Sie auf der linken Seite dieses Parlaments stellen es so dar, als handele es sich um Betrug. Damit schaffen Sie die emotionale Basis für Ihre Hetze gegen die Autohersteller.
Treffen wird das nicht irgendwelche abstrakten Unternehmen, sondern die dortigen Arbeitnehmer, zum Beispiel bei Audi, BMW und in der Zulieferindustrie in Süddeutschland. Wieso erzählen Sie den Menschen eigentlich nicht, dass es nur ein einziger deutscher Autohersteller, bei dem Sozialdemokraten im Aufsichtsrat sitzen, war, bei dem Fahrzeuge mit Schummelsoftware benutzt wurden?
Ja, ist so. Das hat der Untersuchungsausschuss dieses Bundestages zu diesem Thema eindeutig bestätigt.
Ja, es ist Position der AfD, dass diese betroffenen Kunden von dem entsprechenden Hersteller zu entschädigen sind, sofern das nicht bereits geschehen ist.
Alle anderen deutschen Automobilhersteller haben lediglich die schwammige Gesetzeslage ausgenutzt,
die Sie als Union, SPD und Grüne zu verantworten haben.
Die Abweichung zwischen Realbetrieb und Laborbetrieb bei Abgasmessungen ist kein Skandal. Der Skandal ist
