Worauf kommt es an? Es kommt auf ein gutes Beispiel an und aufs Vorleben. Ich will Ihnen ein Beispiel dafür geben, wie das bearbeitet werden kann.
– Frau Weidel, Sie wollen die Flüchtlinge nicht, und Sie bemühen deswegen alle Argumente, die Ihnen einfallen können, um sich gegen Flüchtlinge zu positionieren.
Wir wollen die Probleme, die wir sehen und die angesprochen werden müssen, lösen, und wenn Sie mir zuhören würden, würden Sie hören, wie das gehen kann.
Es gibt nämlich ein gutes Projekt, das der Zentralrat der Muslime gemeinsam mit der Union progressiver Juden in Deutschland aufgesetzt hat.
Anfang August haben 25 junge Juden und muslimische Flüchtlinge aus dem Irak und aus Syrien die KZ-Gedenkstätte Auschwitz-Birkenau besucht. Das ist eine dieser Gedenkstätten, die von Besuchergruppen von Ihnen in Zweifel gezogen werden und zu der wir blöde Äußerungen hören müssen.
– Hören Sie mal zu. – Bei dieser Veranstaltung wurde eine gemeinsame interreligiöse Feier gefeiert, und es wurde der Opfer des Nationalsozialismus gedacht.
