Sehr geehrter Herr Präsident! Verehrte Kolleginnen und Kollegen! Wir erleben heute wieder eine verzerrte Debatte. Den Beitrag der AfD kann man auch mit den Worten zusammenfassen: Ordentliche sachliche Arbeit an gesetzgeberischen Verbesserungen bringt überhaupt nichts. Was von Grünen und Linken kommt, läuft auf den Vorwurf hinaus, es gehe hier um eine inhumane Infragestellung des individuellen Asylgrundrechts. – Beides ist falsch.
Es hilft nichts, erst einmal etwas zu unterstellen, um sich dann daran abzuarbeiten. Das ist ein Unernst, der in krassem Widerspruch zu dem in dieser Situation notwendigen Ernst steht. Einer der großen Schätze dieser Bundesrepublik ist das vergleichsweise hohe Vertrauen in das Funktionieren ihrer Institutionen. Dieses Vertrauen wird hier leichtfertig aufs Spiel gesetzt. Es geht in der Demokratie – da hat Herr Kollege Lindh recht – um Argumente, aber auch um die Redlichkeit der Argumente. Diese Redlichkeit vermisse ich bei den Kollegen von den Grünen.
Sie stellen in dieser Debatte nämlich immer wieder in den Raum, es werde allein an die Anerkennungsquote angeknüpft, und sagen auf dieser Basis, das sei alles nicht in Ordnung.
Die Anerkennungsquote ist selbstverständlich ein wichtiges Indiz. Das hat auch das Bundesverfassungsgericht festgehalten. Hinzu müssen entsprechende Lageberichte und deren angemessene Beurteilung kommen.
Wenn Sie von den Grünen dem Konzept der sicheren Herkunftsstaaten aber – Herr Habeck hat es ja sogar einmal wörtlich gesagt – das „Stigma der Willkür“ verpassen, arbeiten Sie aus Ihrer Richtung ähnlich wie manche von rechts und suggerieren, es gehe an unseren Behörden und Gerichten willkürlich zu.
Selbstverständlich ist eine niedrige Anerkennungsquote ein wertvolles Indiz.
