Die sächsische Polizei war innerhalb von nur einer Minute vor Ort. Sie hat durch ihr schnelles Eingreifen Schlimmeres verhindert, da die Täter von der weiteren Tatausführung abließen. Derartige Ausschreitungen und Straftaten haben mit einem legitimen demokratischen Protest und dem Wahrnehmen des Grundrechts auf Demonstrations- und Versammlungsfreiheit nichts mehr zu tun.
Dieses Grundrecht zu gewährleisten und zu schützen, ist unser aller Auftrag, ganz besonders hier im politischen Raum.
Die Bundesregierung hat in der Regierungspressekonferenz am 27. August zu diesen Ereignissen politisch Stellung genommen und sie sehr deutlich verurteilt. Persönlich bin ich der festen Überzeugung, dass die Ereignisse in Chemnitz nicht nur uns, sondern der gesamten Bevölkerung in Deutschland bewusst gemacht haben, wie weit die von mir eingangs erwähnte Anschlussfähigkeit rechtsextremer Bewegungen an bürgerlichen Protest bereits fortgeschritten ist.
Das Zusammenstehen der demokratischen Kräfte in unserem Land über die Grenzen verschiedener politischer Ansichten hinweg ist deshalb dringend notwendig.
Meine sehr verehrten Kolleginnen und Kollegen, ich möchte diese Aktuelle Stunde auch zum Anlass nehmen, um auf die Rolle der Sicherheitsbehörden des Bundes und des Freistaates Sachsen einzugehen. Die Bewältigung des Einsatzes in Chemnitz zur Abwehr von Gefahren und zur Verfolgung von Straftaten oblag zu jeder Zeit den zuständigen Sicherheitsbehörden des Freistaates Sachsen. Gleiches gilt jetzt für die Strafverfolgung, die der sächsischen Justiz obliegt. Sachsen und der Bund haben in Chemnitz – das möchte ich ausdrücklich betonen – in vorbildlicher Weise zusammengearbeitet und tun dies auch weiterhin, bis heute. Der Bund hat mit der Bundespolizei Amtshilfe unter der Verantwortung des Freistaates Sachsen geleistet. Insgesamt waren dabei rund 1 400 Einsatzkräfte der Bundespolizei im Einsatz.
Das Bundeskriminalamt und das Bundesamt für Verfassungsschutz sind an der Auswertung und Bewertung der Ereignisse in Chemnitz eng beteiligt. Insbesondere werden Erkenntnisse, sowohl aus dem Bereich Rechts- als auch aus dem Bereich Linksextremismus, im Zusammenhang mit den Ausschreitungen und den Veranstaltungen in den nachfolgenden Tagen durch das Bundesamt für Verfassungsschutz bewertet. Die Sicherheitsbehörden des Bundes und der Länder haben die weitere Entwicklung im Zusammenhang mit den Ereignissen in Chemnitz sehr wachsam im Blick und stehen hierzu über die zuständigen Gremien in einem stetigen und intensiven Austausch. Ihnen gelten hierfür – das möchte ich auch ausdrücklich betonen – meine Anerkennung und mein Dank.
Dies gilt insbesondere für die Beamtinnen und Beamten der Bundespolizei, aber auch für die Beamtinnen und Beamten der sächsischen Landespolizei.
Auch die sächsische Justiz hat durch ihr schnelles und konsequentes Vorgehen gegen die Straftäter von Chemnitz die Entschlossenheit und die schnelle Reaktionsfähigkeit unseres Rechtsstaates unter Beweis gestellt.
Schon zweieinhalb Wochen nach den Ausschreitungen erfolgte die erste Verurteilung wegen des Zeigens des Hitlergrußes. Das Strafmaß: immerhin acht Monate auf Bewährung und dazu 2 000 Euro Geldstrafe. Inzwischen gibt es mindestens drei Verurteilungen wegen des Zeigens nationalsozialistischer Symbole und Kennzeichen, aber auch wegen Straftaten gegen die Polizistinnen und Polizisten im Einsatz. Aus meiner Sicht sendet die sächsische Justiz hier genau die richtigen Signale in Richtung rechtsextremistischer Chaoten. Im Falle des antisemitischen Angriffs auf das jüdische Restaurant „Shalom“ wird inzwischen auch wegen der Straftat des Landfriedensbruchs gegen die Angreifer ermittelt. Ich möchte nochmals betonen: Der Schutz der Versammlungs- und Demonstrationsfreiheit ist für uns, die Bundesregierung ein zentrales Anliegen, das wir gegen Angriffe von rechts wie von links konsequent und entschieden verteidigen werden.
Meine sehr verehrten Kolleginnen und Kollegen, eine umfassende Bewertung der Ereignisse von Chemnitz durch den Präsidenten des Bundesamtes für Verfassungsschutz, Herrn Dr. Hans-Georg Maaßen, ist in der Sondersitzung des Innenausschusses des Deutschen Bundestages am 12. September dieses Jahres erfolgt. Aufgrund der weiteren Geschehnisse im Anschluss, die Ihnen allen bestens bekannt sind, haben sich die drei Parteivorsitzenden der Regierungskoalition am vergangenen Sonntag politisch darauf geeinigt, das Amt des Präsidenten des Bundesamtes für Verfassungsschutz neu zu besetzen und Herrn Hans-Georg Maaßen in das Bundesministerium des Innern, für Bau und Heimat wechseln zu lassen. Ich möchte noch einmal ausdrücklich betonen, dass Dr. Hans-Georg Maaßen aus meiner Sicht ein außerordentlich verdienter, erfahrener und hochkompetenter Sicherheitsexperte ist und ich es persönlich außerordentlich begrüße, dass er uns im Bundesinnenministerium erhalten bleibt.
Der Bundesinnenminister hat am 19. September 2018 in einer Pressekonferenz das weitere Verfahren zur Umsetzung dieser Einigung erläutert. Diesen Ausführungen habe ich nichts weiter hinzuzufügen.
Ich danke Ihnen ganz herzlich für Ihre Aufmerksamkeit.
Vielen Dank, Stephan Mayer. – Nächster Redner: Wolfgang Kubicki für die FDP-Fraktion.
