Sehr geehrte Frau Präsidentin! Liebe Kolleginnen und Kollegen! Sehr verehrte Damen und Herren! Lassen Sie mich zu Beginn einmal klarstellen, dass wir in Deutschland im weltweiten Vergleich die sichersten, die am besten kontrollierten und auch die besten Lebensmittel haben.
Darüber hinaus haben wir die besten Kontrolleure sowie die besten und mitunter strengsten Vorschriften.
Ich bin überzeugter Lebensmittelhandwerker und Lebensmittelunternehmer. Ich habe vier Jahre die Änderung des LFGB begleitet; deshalb freue ich mich, dass ich heute darüber sprechen darf. Ich habe hier einige Dinge gehört: Ja, es ist richtig: Das Bundesverfassungsgericht hat geurteilt, man solle die Löschfrist festlegen. Das steht jetzt im Raum. Sie wird auf sechs Monate festgelegt. Man kann darüber diskutieren, ob das zu kurz oder zu lang ist. Für mich persönlich ist es zu lang; denn wer einmal im Internet steht, steht immer im Netz. Also, so leicht geht das nicht raus.
Lassen Sie mich eines mal erklären: Ich stehe als Lebensmittelunternehmer Rainer – ich nehme jetzt exemplarisch für viele andere meinen Namen, damit ich keinen anderen verwenden muss – im Netz, nicht weil ich einen gesundheitsrelevanten Fehler gemacht habe, sondern einen Bürokratiefehler. In Sachsen gibt es einen Bußgeldkatalog für so etwas. Da steht zum Beispiel, dass man bei der Nichtmeldung einer Schlachtung, was in der Hektik vor Weihnachten durchaus passieren kann, 500 Euro Bußgeld zahlen muss. Das steht dann auch im Netz mit dem jeweiligen Namen.
Ein Großunternehmer, der ebenfalls einen Schaden in der Bürokratie verursacht hat, der aber ein No-Name-­Produkt einer großen Handelskette herstellt, steht ebenfalls im Netz. Wer, glauben Sie, hat am Ende der Tage einen Schaden? Der kleine Lebensmittelunternehmer, der mit seinem Namen wirbt, hat den Schaden, obwohl er eigentlich „nur“ einen bürokratischen Fehler gemacht hat. Deshalb bitte ich darum, dass wir in der Zeit, in der über dieses Gesetz noch verhandelt wird, miteinander reden, damit wir eventuell gesundheitsrelevante Aspekte in diese 350 Euro einbeziehen. Dann wäre ich damit einverstanden.
Wenn es dann noch bürokratische Hemmnisse gäbe, dann müsste man diese Schwelle erheblich erhöhen; denn es soll zu nicht unerheblichen Verstößen gekommen sein. Jetzt stelle ich die Frage in den Raum: Bei einem Bußgeldrahmen bis 50 000 Euro, sind da 350 Euro Bußgeld nicht unerheblich? Meine sehr verehrten Damen und Herren, ich bin absolut dafür – dazu stehe ich auch mit meiner Ehre als Lebensmittelunternehmer –, dass diejenigen, die nicht ordentlich wirtschaften, die die Gesundheit der Menschen aufs Spiel setzen, bestraft werden und dass deren Name auch genannt wird; aber es muss noch verhältnismäßig bleiben.
Man muss den Großen, der einen Lebensmittelskandal verursacht hat, schon wesentlich stärker – ich sage es mal auf Bayerisch – „auf die Schultern klopfen“ – nicht auf den Kopf hauen; das will ich nicht – als einen, der einmal ein kleines bürokratisches Missverständnis erzeugt hat. Deshalb bitte ich darum, dass die Koalition noch mal in sich geht, sich Gedanken darüber macht.
– Das ist durch die Regierung gegangen. Aber Sie wissen genau, liebe Kollegin, dass in der Regel kein Gesetz aus diesem Haus so rausgeht, wie es hineingegangen ist.
Mit dieser Hoffnung lebe ich, und deshalb mein eindringlicher Appell heute – ich wollte das nur klarstellen –,
