Der Webfehler des ganzen Konstrukts Mindestlohn ist doch, dass er seit seiner Einführung zu gering bemessen war.
Deswegen, Kolleginnen und Kollegen, muss der Mindestlohn jetzt einmalig auf ein ordentliches Niveau angehoben werden.
Dann machen die Empfehlungen der Mindestlohnkommission künftig auch Sinn.
Ich habe das übliche Getöse der FDP vernommen, dass wir einen politischen Lohn festlegen und in die Tarifautonomie eingreifen wollen.
Ihre Argumente waren bei der Einführung des Mindestlohns die gleichen, und sie waren schon damals falsch.
Hören Sie doch endlich auf, der Arbeitgeberlobby nach dem Mund zu reden!
Die Linke ist nur ein Korrektiv für eine Situation, die die Politik erst herbeigeführt hat. Jahrelang hat eine Regierung nach der anderen den Sozialstaat zerschlagen, die Sozialversicherungssysteme zerlegt und damit die Gewerkschaften geschwächt.
Mittlerweile fällt gerade mal jeder Zweite unter die Tarifbindung bzw. steht unter dem Schutz eines Tarifvertrages. Es gibt bislang keine Antwort der Bundesregierung, wie damit umzugehen ist. Es ist bis jetzt nichts unternommen worden, um die Tarifbindung gesetzlich zu stärken.
Wenn Gewerkschaften keinen flächendeckenden Schutz mehr gewährleisten können, dann muss eine gesetzliche Lohnuntergrenze her.
Der Gesetzgeber muss im Übrigen auch bei den Kontrollen des Mindestlohns handeln. Zig Unternehmen zahlen den Mindestlohn gar nicht erst. Wie kann es denn sein, dass die Bundesregierung zulässt, dass 2 Millionen Menschen um ihren Mindestlohn betrogen werden?
– Hören Sie zu! – Wenn Unternehmen im Schnitt nur alle 44 Jahre einer Kontrolle unterzogen werden,
dann ist das die politische Einladung zu Lohndrückerei und zu Lohnraub.
