Können Sie mir von daher folgen, dass die Beitragssteigerungen bei der privaten Rentenversicherung, die notwendig sind, weil auch die Leute in der privaten Rentenversicherung älter werden, deutlich höher sein werden, als das bei der gesetzlichen Rentenversicherung zu erwarten ist?
Lieber Kollege Ernst, offenbar haben Sie einen Grundmechanismus unserer gesetzlichen Rentenversicherung nicht verstanden.
Bei einer umlagefinanzierten Rente wird nämlich anders als bei einer kapitalgedeckten gar kein Geld für den Einzelnen angespart,
sondern es wird insofern zwischen den Generationen verteilt, als dass die Generation, die heute arbeitet, die Rente derjenigen zahlt, die in Rente ist.
Lieber Kollege Ernst, man muss sich entscheiden: Bei einer dynamischen, umlagefinanzierten Rente kann man entweder dafür sorgen, dass die Renten in dem Maße wie die Löhne steigen – eins zu eins –, oder man kümmert sich darum, dass man die Folgen der Alterung der Gesellschaft in den Griff bekommt. Beides gleichzeitig geht nicht. Dasselbe Geld kann man nicht zweimal ausgeben.
Von der Bundesregierung – anders als von der Linkspartei –
