Vielen Dank. – Herr Präsident! Sehr verehrte Kolleginnen und Kollegen! Die Linksfraktion im Bundestag hat die Verhandlungen zum UN-Migrationspakt von Anfang an begrüßt. Migration ist ein globales Thema, und es ist höchste Zeit, dass wir auch eine internationale Verständigung zu einem solch globalen Thema haben.
Jetzt aber führt Rechtsaußen eine regelrechte Angstkampagne gegen diese UN-Erklärung. Sie führen hier Argumente an, wie etwa: Infolge dieses Paktes würden Millionen Menschen nach Deutschland zuwandern. – Das hält der Realität schlicht nicht stand.
Und es verwundert umso mehr, als die AfD die Möglichkeit einer Beteiligung an den Debatten der UNO in New York nicht wahrgenommen hat, als dieser Pakt verhandelt wurde. Ja wo waren Sie denn mit Ihrer Kritik?
Den Boden für diese schäbige Angstkampagne der AfD hat allerdings diese Bundesregierung mit ihrer Informationspolitik bereitet.
Ich war im zurückliegenden Jahr dreimal als einzige Abgeordnete des Deutschen Bundestages bei den Debatten und Verhandlungen des Migrationspaktes in New York. Immer wieder wurde seitens der Bundesregierung gesagt, dass das auch im Bundestag und in Deutschland öffentlich debattiert werden würde. Nichts davon ist passiert. Das finde ich wirklich unverantwortlich.
Frau Dağdelen, gestatten Sie eine Zwischenfrage von der AfD?
