Sehr geehrter Herr Präsident! Sehr geehrte Kolleginnen und Kollegen! Ich rate dazu, den Kollegen Brandner hier heute Abend nicht so wichtig zu nehmen. Das ist jemand, der nimmt das Parlament nicht ernst. Er ist in der letzten Sitzungswoche hier nach seiner Rede abgezogen und hat uns bis 1.30 Uhr beraten lassen, hat sich von den Mitarbeiterinnen und Mitarbeitern des Saaldienstes verabschiedet mit den Worten: Schönen Abend noch. – Das ist aus Ihrer Sicht anscheinend ganz besonders witzig; denn diese Leute fahren mit der S-Bahn nach Hause und sind dann nächtens irgendwann da.
Aber das interessiert Sie ja alles nicht; denn die Verächtlichmachung des Parlamentes ist ja eine Ihrer Spezialitäten.
Und das sollten all diejenigen wissen, die Ihnen heute Aufmerksamkeit geschenkt haben.
Meine Damen und Herren, gerade aus Respekt nicht nur vor diesem Parlament, auch aus Respekt vor den Bundespräsidenten a. D., vor dem Amt und vor dem jetzigen Amtsinhaber disqualifiziert Sie die Art, der Stil, wie dieser miserable Gesetzentwurf eingebracht wurde, ein zweites Mal.
Es gibt überhaupt keine Linie bei der AfD. In der einen Woche wird im Haushaltausschuss beantragt, den gesamten Etat für den Bundespräsidenten zu streichen.
In der nächsten Woche wird ein Gesetzentwurf vorgelegt, in dem der sogenannte Ehrensold kurzerhand halbiert werden soll. Das ist ohne Sinn und Verstand: Schnellschuss statt Sorgfalt. Lassen Sie uns also bitte nicht ernsthaft darüber weiter diskutieren.
Liebe Kolleginnen und Kollegen, ich will an dieser Stelle sagen: Gerade weil wir darüber nicht sprechen sollten, sollten wir uns aber zwischen demokratischen Fraktionen darüber verständigen, dass es nach dem Bericht des Bundesrechnungshofes klaren Regelungsbedarf gibt.
Ich finde, dass man an dieser Stelle entsprechende Maßnahmen gemeinsam vereinbaren sollte.
– Ich will Sie gar nicht dabei haben. Haben Sie das noch nicht gemerkt?
