Liebe Kolleginnen und Kollegen! Kollege Boehringer, ich weiß, warum Sie nicht über Portugal reden wollen: weil es eine Erfolgsgeschichte ist
und zeigt, dass die europäischen Instrumente – damals erstmals gemeinsam mit der FDP und dann mit der SPD eingesetzt – greifen.
Sie müssten dann auch etwas Positives über Europa bzw. die Euro-Zone sagen. Das kommt Ihnen natürlich nicht über die Lippen, weil ja in Ihrem Weltbild Europa Teufelszeug ist. Deswegen haben Sie mal wieder eine Ausflucht gesucht mit dem Thema TARGET2.
Erste Richtigstellung: Sie können doch für Ihren TARGET-­Antrag eine Kernzeitdebatte beantragen. Dann können Sie eine Stunde oder auch länger darüber reden.
Zweite Bemerkung: Einen solchen Schwachsinn habe ich noch nicht erlebt,
dass wir am Mittwoch eine Anhörung beantragen sollen, wenn am Freitag über den Antrag abgestimmt werden soll. Sollten wir das zwischen Mittwochnachmittag und Freitagmittag machen?
