Herr Präsident! Sehr geehrte Damen und Herren! Herr Macron hat kürzlich eine Liebeserklärung an Deutschland gerichtet. Die schönste Liebeserklärung an Europa wäre es ja, wenn diese Regierung endlich mehr in Krankenhäuser und in Schulen investieren würde.
Bei der öffentlichen Investitionsquote sind wir Mittelmaß. Wir müssen aber doch den Anspruch haben, Spitze in Europa zu sein.
Wenn wir die Binnenwirtschaft nicht stärken, werden wir immer mehr ins Ausland exportieren, also mehr verkaufen als wir dort einkaufen. Wenn ich immer mehr verkaufe, Herr Scholz, als ich bei anderen einkaufe, dann müssen die anderen bei mir Schulden machen. So hat der Euro keine Zukunft.
Wir verdanken die schwarze Null den niedrigen Zinsen. Wenn wir aber wie bei den Autobahnen öffentliches Eigentum privatisieren, ist das am Ende teurer für die Steuerzahler, weil sie dann bei den ÖPP-Projekten auch die Rendite der Konzerne finanzieren müssen. So wird die schwarze Null zum schwarzen Loch.
Mehr Investitionen erfordern Steuergerechtigkeit. Internetkonzerne wie Google zahlen oft weniger als 1 Prozent Steuern auf ihre Gewinne in der EU. Sie machen Geld mit Werbung, mit Daten in Deutschland. Sie verdienen, wenn wir googeln, wie es so schön heißt. Google schickt die Gewinne aber nach Irland. Herr Scholz, Sie torpedieren die Digitalsteuer; Sie vertrösten auf das Jahr 2021
und eine Einigung in der OECD.
In der OECD, lieber Herr Kahrs, gibt es aber noch mehr Steueroasen als in der EU, und die USA blockieren.
Ich biete Ihnen deshalb eine Saalwette an: Wetten, dass Sie 2021 gar nicht mehr regieren, Herr Scholz?
Umgekehrt wird ein Schuh daraus. Führen Sie eine virtuelle Betriebsstätte ein, um die Gewinne von Google und Co in Deutschland zu ermitteln! Erheben Sie eine Steuer auf die Werbeeinnahmen von Google, die mit deutschen Nutzerdaten erzielt werden! Das ist die einzige Sprache, die Herr Trump versteht.
Ihr früherer Finanzminister in Nordrhein-Westfalen, Norbert Walter-Borjans – guter Mann –,
