Herr Präsident! Liebe Kolleginnen und Kollegen! Gemessen an all dem Geld, das in unserem Gesundheitswesen ist – wir haben die Summen gehört –, könnte es viel besser sein; das muss uns Ansporn sein. Über-, Unter- und Fehlversorgung sind leider immer noch an der Tagesordnung. Arme Menschen sterben in unserem reichen Land eher als wohlhabende, und sie haben gleichzeitig einen schlechteren Zugang zu Gesundheitsförderung und Gesundheitsversorgung; das ist beschämend.
Nicht nur auf dem Land fehlen Haus- und Kinderärzte. All das muss sich ändern. Gibt es denn Lösungen in diesem Haushalt? Gibt es echte Strukturreformen? Nein, Fehlanzeige, die brauchen wir aber; denn Strukturen sind in unserem Gesundheitswesen das A und O.
Beispiel Organspende: Wie schafft es denn der Organspendeweltmeister Spanien, so viel besser zu sein, so viel mehr Menschen zu helfen als wir? Wir waren neulich mit fünf Abgeordneten des Gesundheitsausschusses vor Ort und haben gefragt: Was ist denn Ihr Erfolgsrezept? Die Antwort lautete: Organisation, ganz klare, transparente Strukturen. Die Spanierinnen und Spanier setzen dabei im Übrigen komplett auf Freiwilligkeit.
Politik kann und Politik muss für gute Strukturen sorgen.
Beispiel Notfallversorgung: Landauf, landab platzen die Notaufnahmen aus allen Nähten; das muss sich ändern. Die Menschen sitzen nicht aus Jux und Tollerei in den Notaufnahmen; sie sitzen da, weil sie in Not sind und nicht wissen, wo sie sich sonst hinwenden sollen. Die strikte Trennung zwischen ambulanten und stationären Angeboten schadet auch da, wie übrigens überall im Gesundheitswesen, der Versorgung.
Das ließe sich ändern.
Herr Minister Spahn, ich frage mich, warum Sie nicht mutiger sind und die verkrusteten Strukturen im Gesundheitswesen wirklich und ernsthaft adressieren. Ich finde, dass Sie sowohl die Patientinnen und Patienten als auch insbesondere die nichtärztlichen Berufsgruppen zu wenig im Blick haben.
Das sage ich ausdrücklich als Ärztin. Eine gute Gesundheitsversorgung entscheidet sich gerade daran, wie die verschiedenen Berufsgruppen zusammenarbeiten.
Schauen wir auf die Geburtshilfe: Die Arbeitsbedingungen in den Kreißsälen müssen besser werden;
