Das bedeutet dann auch Umweltstandards, Verbraucherschutzstandards, Standards bei der Daseinsvorsorge. Das steht für uns im Mittelpunkt.
Aber die größte Schwäche des Antrags ist, dass er kein Wort über die Euro-Zone verliert. Dabei ist das einer der wichtigsten Bereiche, bei dem Deutschland und Frankreich vorangehen müssen. Hier geht es, Herr Hampel, nicht darum, sich gegenseitig in die Tasche zu greifen – wo ist eigentlich Herr Hampel? ist egal –, sondern es geht darum, dass wir gemeinsam in unsere gemeinsame Zukunft investieren. Das steht auf der Tagesordnung und ist auch dringend notwendig, meine Damen und Herren.
Es bringt nichts, liebe Kolleginnen und Kollegen von CDU, CSU und SPD, von der Großen Koalition, wenn Sie hier immer wieder die Prinzipien erwähnen, um die es richtigerweise geht – Herr Hardt, Sie haben es sehr schön ausgedrückt –, aber in der Realität die Politik dem nicht entspricht. Ich kann nur sagen, dass es okay ist, wenn man nicht alle Vorschläge von Herrn Macron sofort akzeptiert; man kann auch Nein sagen.
Hier habe ich den Anspruch an Sie, dass Sie eine Alternative vorlegen, dass Sie sagen, was Sie wollen. Bis jetzt haben wir nur einen Vorschlag von Finanzminister Scholz: die Arbeitslosenversicherung. Aber davon will in der Regierung niemand etwas hören. Von daher haben wir bis jetzt noch keine Antwort von der Regierung dazu, was wir nach vorne gerichtet haben wollen. Das ist eine verpasste Chance. So geht deutsch-französische Kooperation eben nicht.
Ich bin beim Suchen in unserer Geschichte auf einen Satz von Helmut Kohl gestoßen:
Wir werden die Grenzen zwischen unseren Ländern abschaffen.
Das hat er 1984 gesagt. Das war das Versprechen von Mitterrand und Kohl, das jetzt im Schengener Grenzkodex verankert ist. Dieses Versprechen scheinen einige vergessen zu haben. Ich erinnere nur an die Grenzkontrollen zwischen Deutschland und Österreich, die seit mittlerweile drei Jahren existieren. Die Fakten heute sind aber, dass nur noch 15 Prozent der Asylbewerber über Bayern nach Deutschland einreisen. In acht Wochen, also zwei Monaten, hat die Bayerische Grenzpolizei genau vier Asylbewerber abgewiesen. Das heißt, wir haben diese Grenzkontrollen in einer wichtigen Region wegen vier Personen in zwei Monaten. Das hat nichts mehr zu tun mit dem Versprechen von Helmut Kohl, ein freies Europa gemeinsam zu gestalten.
Kommen Sie dahin wieder zurück. Lassen Sie uns die neuen Nachbarschaftsregionen gemeinsam ausgestalten. Dafür haben wir gute Vorschläge erarbeitet. Ich hoffe, dass wir es im Januar gemeinsam beschließen.
Ich danke Ihnen.
Vielen Dank, Franziska Brantner. – Nächster Redner: Andreas Jung für die CDU/CSU-Fraktion.
