Wer ein paarmal ohne Fahrschein in der U-Bahn erwischt wird, der kann im Zweifel im Knast landen,
aber wer gegen die Mietpreisbremse verstößt, der muss kein Bußgeld fürchten. Entschuldigung, hier läuft ja wohl wirklich etwas schief.
Das Schärfste ist: Die Mietpreisbremse ist ja von vornherein nur auf fünf Jahre angelegt. Das heißt, in anderthalb Jahren läuft sie in den ersten Bundesländern schon wieder aus. Wie absurd ist das denn? Sie machen hier viel Tamtam und sagen, Sie stellen sich vor die Rechte der Mieterinnen und Mieter, und in anderthalb Jahren gilt das Gesetz gar nicht mehr. Das ist doch wirklich ein Stück aus dem Tollhaus, meine Damen und Herren.
Die Mietpreisbremse muss nachgebessert werden, und zwar richtig. Das Wichtigste wäre, dass sie jetzt erst einmal entfristet wird. Darüber wollen wir heute auch abstimmen lassen, und zwar namentlich; denn im Koalitionsvertrag konnten Sie sich nicht einigen. Jetzt ist auch nichts dabei herausgekommen. Kein Mensch glaubt, dass es Ihnen gelingt, sich noch zu einigen. Ich bin wirklich gespannt, ob Sie dieses Instrument überhaupt wollen oder ob es Ihnen nur um Kosmetik und um Wählertäuschung geht. Das braucht wirklich kein Mensch.
Meine Damen und Herren, wir Linke fordern eine Mietpreisbremse ohne Ausnahmen, flächendeckend und unbefristet und mit einem richtigen Deckel. Wir wollen auch die Bestandsmieten deckeln. Keine Mieterhöhung über dem Inflationsausgleich: Ich freue mich sehr, dass die SPD diese Forderung von uns in ihr Zwölf-Punkte-Papier übernommen hat. Ich bin aber auch gespannt, ob Sie denn gleich in der Abstimmung auch dazu stehen oder ob das nur wieder eine Forderung für den Presseverteiler war.
Bei der Absenkung der Modernisierungsumlage läuft das Spiel ja so: Der Mieter bezahlt die Modernisierung alleine. Wenn sie abbezahlt ist, zahlt er weiter eine überhöhte Miete und der Vermieter kassiert nur noch. Nach altem Recht war das schon nach neun Jahren der Fall. Nach der neuen Regelung ist das dann erst nach zwölf Jahren der Fall. Entschuldigung, das ist wirklich kein großer Wurf.
Meine Damen und Herren, die Modernisierungsumlage als dauerhaftes Mietsteigerungsinstrument lehnen wir als Linke ab. Wir wollen sie abschaffen.
Zu guter Letzt: Der Kündigungsschutz fehlt in diesem Gesetz komplett. Angesichts der Tatsache, dass 70 Prozent der Städter inzwischen Angst haben, ihre Wohnung zu verlieren, halte ich das für einen großen Skandal.
Kommen Sie bitte zum Schluss.
Meine Damen und Herren, diese Mietpreisbremse verdient ihren Namen nicht. Sie ist reiner Etikettenschwindel. Wir als Linke haben viele Anträge vorgelegt, die die Rechte von Mieterinnen und Mietern tatsächlich schützen. Ich bitte Sie um Zustimmung.
Vielen Dank.
Vielen Dank, Caren Lay. – Nächster Redner für Bündnis 90/Die Grünen: Chris Kühn.
