Doch, das muss jetzt sein. Ich will mir nicht vorwerfen lassen, dass ich das nicht aushalten könnte.
Vielen Dank, Frau Scheer. Vielen Dank, Herr Präsident. – Sie haben von den Chancen gesprochen, die sich aus diesem Segment ergeben. Es ist circa 16 bis 18 Jahre her, als ein grüner Umweltminister uns 1 Million Jobs versprochen hat, die in dem Sektor erneuerbare Energien auf uns warten. Er hat gesagt, es werde lediglich eine Kugel Eis im Monat kosten.
Beides hat sich im Nachhinein als eine, sagen wir, überoptimistische Empfehlung entpuppt. Wie sehen denn nach 16 Jahren des Herumwurstelns mit sehr, sehr teuren Stromrechnungen für die Verbraucher und einem Jobangebot, das negativ ist, die Chancen in diesem Sektor aus? Wenn Sie mal konkret werden könnten, bitte.
Das tue ich sehr gerne, und zwar sieht das so aus, dass wir bis dato schon über 400 000 Jobs im Bereich der erneuerbaren Energien geschaffen haben. Die Frage ist beantwortet.
Ich komme zurück zu den Fragen, die noch anstehen. Es ist auch wichtig, noch einmal hervorzuheben, was man national tun kann und auch tun muss. Es ist mit der Energiewende bisher gelungen – das habe ich schon an anderer Stelle erwähnt –, dass wir allein mit den hiesigen Maßnahmen schon über 1 Milliarde Tonnen CO 2 eingespart haben. Wenn man sich vergegenwärtigt, dass, um das 2-Grad-Ziel zu erreichen, ein Minus von 8,8 Milliarden Tonnen CO 2 pro Jahr weltweit erforderlich ist, dann zeigt das die Dimension, die allein deutschlandweit erreichbar ist. Zudem ist die Ausstrahlungswirkung hervorzuheben, die von nationalen Maßnahmen ausgeht.
Es ist jetzt alles ein bisschen durcheinandergegangen, was die Zeit angeht; meine Redezeit ist jetzt um. Ich will aber ganz zuletzt noch ein paar Punkte ansprechen, die ich zurzeit schwierig finde, auch in der Großen Koalition.
Wir haben morgen über ein Energiepaket bzw. über ein Mantelgesetz zu entscheiden.
