Sehr geehrter Herr Präsident! Sehr geehrter Herr Bundesminister Spahn! Liebe Kolleginnen und Kollegen! Meine Damen und Herren! An einem Tag wie heute, an dem unsere Bundeskanzlerin auf 13 Jahre erfolgreiche Arbeit zurückblickt,
darf man, nein, muss man, wenn man diese Debatte verfolgt, unsere Kanzlerin zitieren, die gestern an dieser Stelle sagte – ich zitiere –:
Das Schöne an freiheitlichen Debatten ist, dass jeder über das spricht, was er für das Land für wichtig hält.
Und Frau Bas, ich finde es gut – auch das ist wichtig –, dass die SPD darüber spricht, welche Erfolge sie in der Vergangenheit hatte, damit sie auch mit diesen guten Politikansätzen aus dem Umfragetief, das sie derzeit hat, herauskommt. Das wäre auch uns wichtig.
Für mich, meine Damen und Herren, sind die großen Volkserkrankungen Adipositas und Diabetes mellitus und deren Auswirkungen wichtig. Halb Deutschland ist zu dick. Daran ist besonders dramatisch, dass das zunehmend auch auf Kinder und Jugendliche zutrifft. Ich bin unserem Gesundheitsminister daher außerordentlich dankbar, dass wir dieses Thema im aktuellen Haushaltsentwurf angehen und – ja, Frau Klein-Schmeink – in Ihrem Sinne mutig angehen, mit Blick in die Zukunft. Wir stellen 3 Millionen Euro zur Verbesserung der gesundheitlichen Situation von Kindern und Jugendlichen zur Verfügung. Wir wollen, dass schon Kinder und Jugendliche lernen, was ein gesundes, was ein gesundheitsbewusstes Leben bedeutet.
– Ja. ich denke, das ist doch einen Beifall wert.
