Weiterhin lernten wir in dieser Woche: Die Nationale Klimaschutzinitiative der Bundesregierung hat in den etwa zehn Jahren ihres Bestehens so viel CO 2 eingespart, wie allein beim Moorbrand in Meppen im September freigesetzt wurde. Es ist dasselbe absurde Missverhältnis von Aufwand und Wirkung wie bei den Forderungen der CO 2 -Klimagläubigen nach Verringerung des menschengemachten deutschen CO 2 -Ausstoßes. Eine 0,00004-prozentige Verringerung des weltweiten CO 2 -Gesamtvolumens soll das Weltklima retten, und die Steuerzahler sollen das glauben und mit weiteren Milliarden bezahlen. Ein Wahnsinn! Nichts ist daran seriös.
In ähnlicher Verwirrung holte die SPD gestern gleich die ganz große Keule raus. „Menschenverachtend“ sei es, wenn die AfD sagt, dass erneuerbare Energien für nordafrikanische Moscheen vielleicht nicht zwingend die Fluchtbewegungen nach Europa und Deutschland stoppen und darum nicht mit deutschem Steuergeld gefördert gehören. Frau Kollegin Steffen, wenn wir einfach nur Positionen aus dem Haushalt zitieren, dann ist das bei Ihnen menschenverachtend? Nein, das Aufzählen dieser Wahrheiten ist die Aufgabe der Opposition, und wir werden das weiterhin tun. Wenn Sie das nicht wollen, dann ist das eher steuerzahlerverachtend. Die SPD war hier eindeutig zu lange nicht mehr Opposition. Sie sollten diese Arbeit wieder einmal üben.
Darum vielleicht gleich noch weitere millionenschwere Weltbeglückungsmaßnahmen aus Ihrem vorliegenden Haushalt – auch das sind Zitate; keine Menschenverachtung –: Förderung eines zivilgesellschaftlichen Gendernetzwerks – in China; Verbesserung der sexuellen und reproduktiven Gesundheit – in Bolivien; gendergerechte Förderung von Kleinbauern – in Mbulu; Förderung einer argumentativ hinterlegten Debattenkultur – beim Radiosender Al Arabiya –, also arabische Debattenkultur, Istanbul und so; Empowerment von Jugendlichen durch Kooperation mit erwachsenen Künstlerinnen und Künstlern – in Sichuan.
Weiterhin – auch sehr erwähnenswert – die Projekte der parteinahen Stiftungen. Auch diese Projekte werden weitgehend aus dem Staatshaushalt finanziert. Die Rosa-­Luxemburg-Stiftung der Linken finanziert millionenschwer einen – ich zitiere – Dialog zu sozialer Gerechtigkeit, sozial-ökologischer Transformation, partizipativer Politik und gerechten internationalen Beziehungen Südostasiens.
Kein Problem, man hat es ja! – Ja, es klingt gut. – Die Rosa-Luxemburg-Stiftung bekommt im Jahr mehr als 60 Millionen Euro Steuergeld. Die Konrad-Adenauer-­Stiftung erhält 11 Millionen Euro. Das ist aber wohlgemerkt nur der Zuschuss zu den Verwaltungskosten. Die Hanns-Seidel-Stiftung der CSU stärkt die Zivilgesellschaft in Ostafrika mit 4 Millionen Euro. Ist es wirklich „menschenverachtend“, wenn wir auf diese Fehlverwendungen im Haushalt hinweisen?
Die Finanzierung der sechs parteinahen Stiftungen ist ohnehin eine skandalöse Selbstbedienung der Altparteien. Hier werden ohne explizites Stiftungsgesetz – immer noch; unseres wurde abgelehnt – in einem haushalterisch höchst intransparenten Prozess insgesamt 600 Millionen Euro Steuergeld ausgezahlt. Wir sprechen hier von einem Volumen, das das der lediglich falsch zurückgebuchten AfD-Spende um 200 000 Prozent übersteigt – das auch in Richtung Medien – 200 000 Prozent!.
Abschließend einige Worte des Dankes: Ein Haushaltsgesetz mit 3 000 Seiten Umfang, fast 1 600 Änderungsanträgen, diskutierten und abgestimmt in 54 Stunden Ausschusssitzung, alles noch ohne Berichterstatterrunden. Die Regierung hat zwar leider 80 Prozent ihrer Anträge erst in der Bereinigungssitzung eingebracht und sie so längeren Debatten entzogen, doch insgesamt hat sich gezeigt: Man kann in den Ausschüssen ganz gut und ordentlich miteinander umgehen. Dafür Dank an alle berichterstattenden Kollegen und Referenten aller Fraktionen und an alle Regierungsvertreter, besonders an die des BMF, und ganz besonders – Herr Rohde hat es schon erwähnt – auch an die Kollegen des Haushaltsausschusssekretariats. Das Team ist ja heute anwesend.
Ohne Ihre eingespielte, sachkundige und auch noch in den Nachtstunden konzentrierte Arbeit hätten wir es nicht schaffen können. Es war auch diesmal wieder eine sehr zuverlässige und wertvolle Arbeitsleistung.
Herzlichen Dank.
Für die CDU/CSU-Fraktion hat das Wort der Kollege Alois Rainer.
