Parlamentarische Kontrolle übt man nicht aus durch Schaufensterdebatten, sondern durch gute Sacharbeit.
Wir haben in dieser Woche einen Antrag vorgelegt, um dem UN-Migrationspakt eine klare Note beizugeben.
– Frau Storch, Zwischenfragen sind in einer Aktuellen Stunde nicht zulässig. Da können Sie noch etwas dazulernen. – Wir haben hier einen klaren Antrag zu diesem Pakt vorgelegt, dem Sie nicht zugestimmt haben. Ganz ehrlich: Sie beschränken sich lieber darauf, Fake News zu verbreiten und das Ganze in Ihren Echokammern in den sozialen Netzwerken zu diskutieren. Das ist nicht unser Niveau.
Ich habe mir einmal Ihre Internetseite angeschaut. Sie werben auf Ihrer Internetseite ja damit, dass man für Sie spenden soll, damit Sie den Migrationspakt verhindern. 1 Million Euro wollen Sie sammeln.
Aber ich gebe Ihnen einen guten Tipp: Ein gutes Lehrbuch im Völkerrecht kostet 59,95 Euro oder ist in unserer Bibliothek kostenlos.
Würde Ihnen guttun!
Herzlichen Dank.
Die Kollegin Dr. Daniela De Ridder ist die nächste Rednerin für die SPD-Fraktion.
