wird gerade erwähnt. – Das sollte man in einem Rechtsstaat nicht machen, sondern es wird erst ermittelt, und dann wird überprüft, wer was begangen hat, und dann kommt es zu einer Verurteilung. Wenn es eine deutsche Bank war, muss sie auch entsprechend verurteilt werden, aber nicht schon vorher hier im Hause.
Bitte erlauben Sie mir eine Abschlussbemerkung, liebe Frau Kiziltepe. Eine Anzeigepflicht für nationale Steuergestaltungsmodelle würde genau diesen Fall nicht abdecken. Das wäre genauso, wie wenn ein Sparkassenräuber vorher bei der Sparkasse anruft und sagt: Ich mache morgen einen Banküberfall. – Glauben Sie denn wirklich, dass einer, der Steuerbetrug begeht, vorher eine Anzeige macht? Genau das ist damit nicht abgedeckt.
Erlauben Sie mir eine letzte Bemerkung – die meine ich in allem Ernst –: Mit dieser Debatte hier versuchen Sie, die Bundesregierung, die Finanzverwaltung, den Finanzminister in ein schlechtes Licht zu rücken. Das haben sie nicht verdient.
Wir tun alles, um Missbrauch in Deutschland zu verhindern, und die Finanzverwaltung tut das auch. Deswegen breche ich eine Lanze für die Finanzverwaltung. Wir sollten sie lieber unterstützen, anstatt sie an den Pranger zu stellen. Dafür werden wir uns in den nächsten Wochen und Monaten einsetzen, um hier Aufklärung zu betreiben und das Ganze dann auch einer gerechten Strafe zuzuführen.
Herzlichen Dank.
Vielen Dank. – Nächster Redner ist der Abgeordnete Detlev Spangenberg für die Fraktion der AfD.
