wobei Sie sich eigentlich zu wichtigen Sachen hätten äußern müssen. Kein Wort von Ihnen zur Nullzinspolitik, die den deutschen Sparer 20 Milliarden Euro im Jahr kostet!
Kein Wort, Herr Kahrs, zu Hartz IV, das von Ihrer SPD installiert worden ist und durch das es Millionen Arbeitnehmern ans Vermögen geht! Dazu, Herr Kahrs, hätten Sie reden müssen.
Kein Wort, Herr Kahrs, zu SPD-Aufsichtsräten wie ­Hohmann-Dennhardt zum Beispiel, die nach kurzer Zeit im Aufsichtsrat von VW Abfindungen in Millionenhöhe kassiert hat! SPD, Herr Kahrs.
Kein Wort zu Ihrem Oberbürgermeister von Regensburg, der unter Korruptionsverdacht steht! Ich weiß nicht, ob er noch im Knast sitzt; jedenfalls saß er im Knast. Dazu, Herr Kahrs, hätten Sie reden müssen.
Kein Wort, Herr Kahrs, zu einem Herrn Tauss und einem Herrn Edathy, mit dem Sie ja wohl gewissermaßen unter einer Decke steckten.
Herr Kahrs, kümmern Sie sich um Ihre SPD, und lamentieren Sie nicht über unsere AfD. Ihre SPD, Ihre Spezialdemokraten, Herr Kahrs, haben es nötig, dass Sie sich darum kümmern; denn diese SPD braucht in Deutschland kein Mensch, und das ist es auch, was diese SPD mit Frau Merkel verbindet: Die braucht nämlich in Deutschland auch kein Mensch.
Herr Rehberg, auch Sie – leider ist meine Redezeit gleich schon um, da komme ich gar nicht mehr zu den Verschwendungen – sprachen natürlich den mutmaßlichen Spendenskandal der AfD an. Nichts ist natürlich billiger, als auf so einen Zug aufzuspringen,
den Herr Kahrs, wahrscheinlich unterstützt durch Herrn Schulz, aufs Gleis gesetzt hat.
Herr Rehberg, gestern war dieser mutmaßliche Spendenskandal bei uns Thema in der Fraktion.
Können Sie sich vorstellen, dass der eine oder andere Fraktionär tatsächlich Skrupel hätte, sich mit Spenden oder auch Schwarzgeld an einen Bundestagspräsidenten zu wenden, der ganz große Erfahrung mit Schwarzgeld und Spenden hat und damit in der Vergangenheit nicht gerade brillierte?
Darauf, Herr Rehberg, hätten Sie vielleicht auch einmal eingehen sollen. Nicht immer auf die anderen zeigen. Sie wissen selber: Zeigen Sie mit einem Finger auf die anderen, zeigen drei Finger auf Sie zurück.
Das geht Ihnen, Herr Rehberg, genauso wie Herrn Kahrs.
Meine Damen und Herren, um auf die Verschwendungen des Herrn Steinmeier einzugehen, zu denen ich eigentlich Ausführungen machen wollte, fehlt mir jetzt leider die Zeit. Oder gestatten Sie einen Zuschlag, Herr Schäuble? – Nein, er gestattet mir keinen Zuschlag, sodass ich mit diesen Worten schließe.
Vielen Dank.
Nächster Redner ist Andreas Jung, CDU/CSU.
