Das ist ein schöner Wahlkreis, das stimmt.
Du erlebst dort ein genauso hohes Schulniveau und genauso tolle Schulen, wie du sie in München und in Regensburg erlebst. Überhaupt kein Thema! Deshalb: Bayern löst das erstklassig.
Um das noch mal klarzustellen: Wir strecken uns, wir wollen das tun, wir beschließen diesen Haushalt. Aber es muss doch endlich einmal gesagt werden, dass es nicht so ist: Der Bund macht nichts, und die Länder strecken sich und können nichts tun. – Die Länder könnten, sie haben das Geld, und der Bund unterstützt. Wir müssen das gemeinsam machen.
Nächstes Thema. Es wird in vielen dieser Debatten heute der Eindruck erweckt, als würden wir vonseiten des Bundes zu wenig machen. – Das stimmt schlichtweg nicht. Schauen Sie sich einmal die internationale Wertschätzung an, die Deutschland genießt. Ob Sie in den USA sind, ob Sie in Japan sind, ob Sie in Europa unterwegs sind oder wo auch immer: Die Wertschätzung für das, was wir in den letzten Jahren auf Bundesebene in Forschung und Bildung erreicht haben, ist außerordentlich hoch.
Wenn das Weltwirtschaftsforum bei seinen Untersuchungen feststellt, dass kein Land so innovativ ist wie Deutschland, dass Deutschland im Jahr 2018 Innovationsmeister ist, dann kann uns das doch ein ganzes Stück stolz machen. Dann hängt das auch damit zusammen, dass wir eben etwas machen und anschippern und kärrnern.
Sehr geehrte Damen, sehr geehrte Herren, Strukturreformen sind notwendig. Geld ist notwendig. Aber das wird in Zukunft nicht reichen, weil der Schlüsselbegriff in den nächsten Jahren nach meiner festen Überzeugung – wir reden da in unserer Arbeitsgruppe sehr intensiv über einzelne Projekte – das Thema Qualität sein wird. Ich sage ein Beispiel: lebenslanges Lernen.
Früher hätte man gesagt: Programm auflegen, mehr Geld zur Verfügung stellen. Dann gibt es die allgemeinen, traditionellen, konventionellen Bildungsträger, und die werden das unter die Leute bringen. – Wenn wir aber die Situation haben, dass sich die Gesellschaft verändert hat, dass die Gesellschaft ausdifferenziert ist, dass sie hochspezialisiert ist und die Digitalisierung voranschreitet, dann stellen wir letztendlich fest, dass sowohl bei den Arbeitnehmern als auch bei den Unternehmen der Schulungsbedarf immer individualisierter wird und diese Standardpakete diese Probleme einfach nicht lösen werden. Standardpakete zu formulieren, wird teilweise schlichtweg ins Leere gehen. Deswegen ist es notwendig, diese individuellen Bedürfnisse zusammenzuführen.
Wenn wir lebenslanges Lernen und Weiterbildung auf ein neues Niveau bringen wollen, dann müssen wir technologische Möglichkeiten wie eine Plattform generieren und sie weiter nutzen. Genau darum geht es: Statt die bestehenden Strukturen einfach mit mehr Geld auszustatten, müssen wir im Jahr 2018 die Themen durchdenken und fragen: Wo braucht es eine neue Qualität? Wo ist es möglich, durch Technologie zu unterstützen? Beispielsweise beim Thema „lebenslanges Lernen“ ist das zwingend notwendig.
Deswegen bin ich zum Beispiel froh, dass der Kollege Heilmann mit seinem Vorschlag zur Plattform Milla erste Gedankenimpulse gegeben hat. Auch im Ministerium wird darüber nachgedacht. Genau in diese Richtung müssen wir denken, liebe Kolleginnen und Kollegen.
Qualität ist ein Schlüsselbegriff. Ich nenne noch andere Themen.
