Frau Präsidentin! Liebe Kolleginnen und Kollegen! Ich danke Ihnen, Herr Herrmann, erst einmal für Ihre wiederholte Erläuterung Ihrer deskriptiven Nutzung des Ausdrucks „Ausländer“. Darf ich daraus schließen, dass Sie damit sagen wollen, dass Ihre Fraktionskollegen den Begriff standardisiert, normativ, diffamierend verwenden? Ich weiß es nicht; aber das könnte ja ein Schluss aus dieser Erklärung sein.
– Ja, zu viele Fremdwörter, ich weiß. Das schadet Ihrem Deutsch.
Ich wollte mich eigentlich nicht ärgern. Ich tue es jetzt aber schon wieder. Ich habe mich besonders geärgert über Ihren Antrag zur Altersfeststellung.
Ich wollte heute aber – und ich bleibe meinen Prinzipien treu – Furor und Empörung
in der Frage der Integration zurückfahren.
Gerade weil ich Sie aufgrund Ihrer Positionierung besonders wertschätze, Frau Jelpke, muss ich gestehen, dass ich mich besonders geärgert habe, dass Sie in der Debatte über sichere Herkunftsstaaten heute Morgen ausführten, dass wir mit unserem Gesetzentwurf – ich zitiere – „eine eklatante Missachtung der Lehren aus der deutschen Geschichte“ begingen. Ich finde, soweit Sie für sich beanspruchen können, Lehren aus der Geschichte zu ziehen, können wir das auch tun. Wir können das sowohl zu dem Gesetzentwurf zu den sicheren Herkunftsstaaten tun, aber auch zu dem Gesetzentwurf, um den es jetzt hier geht. Ich denke, wir müssen uns nicht gegenseitig belehren, wer die besseren Lehren aus der Geschichte zieht. Wenn jemand meint, im Besitz der absoluten Wahrheit zu sein, ohne jeden Zweifel, ist mir das fremd. Ich nehme für uns in Anspruch, dass wir auch Zweifel haben und dass wir nicht immer alles richtig machen. Ich würde mich freuen, wenn wir auch in Fragen der Integration interfraktionell zu dieser Haltung kämen.
Unabhängig davon sind wir aber der Überzeugung, dass dieser Gesetzentwurf ein guter ist. Wir sehen uns darin durch die Anhörung bestätigt. Manche mögen eine andere Interpretation haben. Die Anhörung hat uns aber gezeigt: Das ist ein vernünftiger Gesetzentwurf. Ein solches Gesetz bedeutet in der Verwaltungspraxis konkret Beschleunigung, aber – das ist ein nicht unerheblicher Grund – eine solche Beschleunigung kann auch eine Zumutung darstellen; das ist gar nicht zu leugnen. Sie bedeutet nämlich einerseits eine zusätzliche Belastung für die Betroffenen, kann andererseits aber auch eine Vereinfachung für die Betroffenen darstellen. Herr Mazanke aus Berlin hat das deutlich geschildert. In der Praxis sieht es dort nämlich so aus, dass viele Verfahren zur Erteilung von Niederlassungserlaubnissen oder zum Familiennachzug zu subsidiär Schutzberechtigten nicht weiterbehandelt werden können, weil Widerruf- und Rücknahmeverfahren nicht beendet werden können. Er hat anschaulich dargelegt, dass durch dieses Gesetz eine Beschleunigung des Verfahrens möglich ist.
Wenn es uns gelingen kann, sowohl die Verwaltungspraxis zu verbessern als auch eine Verbesserung für die Betroffenen herbeizuführen, die nichts befürchten müssen, wenn sie glaubhafte und wahrhafte Angaben gemacht haben, dann ist das, glaube ich, eine Leistung. Wir sollten also alle daran arbeiten, die Verwaltungspraxis zu beschleunigen und auch in der Hinsicht Lehren aus der Vergangenheit ziehen.
Wir haben auch Veränderungen vorgenommen, indem wir maßvoll die Ratschläge des Bundesrates in Bezug auf die Datennutzung und in Bezug auf die erkennungsdienstliche Behandlung aufgenommen haben. Wir haben sie aber nur insoweit aufgenommen, wie sie nicht über das Ziel hinausschießen.
Wir haben ebenfalls – auch das kann man deutlich sagen, weil es sonst unehrlich wäre – in der Anhörung erkannt, dass die Möglichkeit besteht, dass eine Welle von Klagen den Gegeneffekt erreicht, nämlich keine Beschleunigung, sondern eine Verlangsamung. Genau aus diesem Grund ist die aufschiebende Wirkung ausgeschlossen, und es greift das einstweilige Verfahren, das sogenannte Eilverfahren.
Sehr geehrte Damen und Herren, Sie können, wenn Sie den Gesetzentwurf ablehnen, für sich in Anspruch nehmen – ich habe es vorhin geschildert –, dass Sie die Maßnahmen für nicht verantwortbar, für ethisch fraglich halten. Ich würde aber behaupten, dass wir als regierungstragende Koalition dasselbe tun können; denn wir gehen davon aus, dass es eben nicht selbstverständlich ist, dass das Asylrecht von der Bevölkerung angenommen wird,
sondern wir dafür werben müssen, dass möglichst viele Menschen dieses humanitäre Asylrecht und unseren Ansatz eines humanitären Pragmatismus – ich werde das so oft wiederholen, bis Sie es nicht mehr hören können; denn dann habe ich es oft genug gesagt – mittragen. Wenn es uns gelingt, Unklarheiten auszuräumen, das Gefühl und die Überzeugung zu wecken, dass wir das, was 2015/2016 in der Schnelligkeit an Unklarheiten entstanden ist, dass wir Unsicherheiten, Verunsicherung, die populistisch genutzt werden könnten, beseitigen, ist das allein schon ein Mehrwert dieser Gesetzgebung, den man nicht unterschätzen sollte.
Einen weiteren Punkt wage ich zu erwähnen: Sie wollen ja – das wurde auch schon bei den Anhörungen im Ausschuss gesagt – skandalisieren und erwecken den Eindruck – ich halte das für einen falschen Eindruck –, gegenüber allen anerkannten Asylbewerbern, subsidiär Schutzberechtigten, Genfer Konventionsflüchtlingen werde ein Generalverdacht ausgesprochen und deshalb werde jetzt plötzlich das Widerrufsverfahren eingeführt. Das ist aber nicht der Fall. Es ist bereits standardisiert.
– Wenn Sie jetzt „anlasslos“ dazwischenrufen, haben Sie dem Vertreter des BAMF vielleicht nicht genau zugehört.
