Liebe Genossinnen und Genossen von der SPD, die Brückenfrauen aus Artern haben mich um Rat gefragt: „Warum tut die SPD so etwas?“ Die Brückenfrauen sind eine streitbereite Gruppe von Frauen, die sich für das Gemeinwohl einsetzt. Sie fragen, warum sie als Mütter, die ihre Kinder vor 1992 geboren haben, schlechter behandelt werden.
Wollen Sie diesen Müttern sagen, dass wir kein Geld für sie haben? Wir von der AfD fordern die volle Mütterrente für alle Kinder und vor allem die Freistellung der Mütterrente von der Inanspruchnahme bei der Grundsicherung.
Meine Damen und Herren von der SPD, Ihre Wähler sind auch die in der DDR geschiedenen Frauen. Obwohl diese kämpfend bis vor die UNO gezogen sind, verweigern Sie als SPD diesen Frauen die Gerechtigkeit. Wir als AfD fordern einen Härtefallfonds für den fehlenden Versorgungsausgleich der DDR-Geschiedenen. Sie machen gar nichts. Was ist mit der Zusatzversorgung der DDR-Reichsbahner? Das sind 100 000 ehemalige Beschäftigte, die Sie im Regen stehen lassen. Bei der Wiedervereinigung wurden sie vergessen, genauso wie andere: Bergleute, Postler, Krankenschwestern und Künstler. Für die machen Sie nichts.
Liebe Genossinnen und Genossen von der SPD, warum Sie keiner mehr wählt, ist jetzt kein Geheimnis mehr. Ich stehe hier vor Ihnen als Vertreter einer neuen Volkspartei, der Partei der Arbeiter und Angestellten.
Ich sage Ihnen: Wir machen es besser.
Sie können noch 20 solcher vollkommen untauglichen Rentenkonzepte auf den Weg bringen; aber Ihr Abstieg zur Splitterpartei wird dadurch nicht aufgehalten.
