es steht ja auch im Protokoll. Wir wollen, dass die Leute durch unsere finanziellen Aufwendungen dort bleiben können. Das tut uns allen in der Tat gut.
Meine Damen und Herren, wir haben gute Möglichkeiten, weil wir ein wirtschaftlich starkes Land sind. Vor wenigen Tagen, sehr geehrter Herr Präsident, haben wir das Fest des Heiligen Martin gefeiert. Der Heilige Martin steht für Barmherzigkeit, weil er dem armen Mann die Hälfte seines Mantels gegeben hat. Aber er musste dafür einen Mantel haben. Wenn er keinen Mantel gehabt hätte, hätte er ihm die Hälfte nicht geben können. Das ist doch der richtige Ausdruck von Barmherzigkeit: Nur dann, wenn ich wirtschaftlich stark bin, kann ich anderen auch so helfen, wie wir das tun.
Das ist ein innerer Zusammenhang, der manchen offensichtlich nicht so gut geläufig, nicht so gut bekannt ist.
Meine sehr geehrten Damen und Herren, wir stehen vor großen Aufgaben, weltweit. Die Welt scheint in manchen Teilen aus den Fugen geraten zu sein, hat Ihr Vorgänger, Herr Steinmeier, einmal formuliert; recht hat er. Wir haben manche Aufgaben – lieber Bijan, du hast das gesagt – zu Nachfolgeregelungen zu meistern. Wie soll es im Jemen und in Syrien und andernorts weitergehen? Aber wir sind hier in einer starken Gemeinschaft. Wir machen das in der Europäischen Union und in der Gemeinschaft der NATO, und wir werden da zu guten Lösungen kommen.
Wir möchten auch zu guten Lösungen in Israel kommen. Wir stärken dort das Hilfswerk der Vereinten Nationen, die sogenannte UNRWA. Wir sind schon etwas darüber erschüttert, dass die amerikanische Regierung ihren Beitrag – 370 Millionen Euro leistet sie für das Hilfswerk in den palästinensischen Gebieten – auf null zusammenstreichen möchte. Ich bitte Sie ausdrücklich, Herr Bundesaußenminister, dass Sie, wenn wir nicht ständiges Mitglied im Sicherheitsrat der Vereinten Nationen sind, Ihre Funktion dazu nutzen, die Amerikaner wieder auf die Spur zu bringen, damit die Situation dort verbessert wird.
Wenn es zum Zusammenbruch der fundamentalen Überlebenssituation dort kommen würde, bin ich mir nicht sicher, wie wir eine dritte Intifada verhindern könnten.
Meine sehr geehrten Damen und Herren, wir haben auch viel Geld für ein Schmuckstück unserer Außenpolitik eingesetzt, die Auswärtige Kultur- und Bildungsarbeit. Da werden wir uns auch in der Zukunft von niemandem überholen lassen.
Ich danke herzlich für die Zusammenarbeit. Wir geben heute das finanzielle Rüstzeug, Herr Bundesaußenminister, für die Arbeit in den nächsten zwölf Monaten. Wir sind guten Mutes, dass wir alle Voraussetzungen schaffen, um eine gute Außenpolitik auch künftig zu finanzieren.
Herzlichen Dank.
Für die Fraktion Die Linke hat das Wort der Kollege Dr. Gregor Gysi; er eilt herbei aus der hintersten Reihe.
