Meine Damen und Herren, das, was gerade hier geäußert wurde, war ein wunderschönes Potpourri aus a) Emotionen und b) Falschaussagen.
Wir wollen das einmal der Reihe nach durchgehen.
Jeder hier, auch wenn er keine Universität besucht hat, ist selbstverständlich gleichberechtigt.
Aber deswegen pauschal etwas zu verunglimpfen, liebe Frau Kollegin, ist nicht richtig.
Dann haben Sie gerade etwas von „antisemitisch“ erzählt. Ich möchte Sie darauf hinweisen, dass Israel diesem Globalen Pakt für Migration nicht beitreten wird.
Ganz dezidiert: Israel und dort maßgebliche Leute bezeichnen diesen Pakt als Pakt der Wölfe, und in ein Land, in dem man Schafe hat, lässt man keine fremden Wölfe hinein. Das tut man nicht. Von daher hat Israel das ganz klar abgelehnt.
Sie sagen, wir seien antisemitisch. Dann müssten Sie auch sagen, dass Australien, USA, Tschechien und Polen, Österreich, Ungarn, Kroatien etc. antisemitisch sind. Ich habe nächste Woche einen Termin mit dem Schweizer Botschafter. Er ist für Sie bestimmt auch antisemitisch, wenn er sich gegen einen Pakt, der sein Land schädigt, wendet.
Schauen Sie, wir machen nichts anderes, als dass wir die Interessen unseres Landes – genauso wie andere Länder – wahrnehmen.
Dazu sind wir als Volksvertreter definitiv verpflichtet.
