natürlich ohne von dieser Gemeinsamkeit auch nur ein einziges Wörtchen zu sagen. So schreibt die „Frankfurter Allgemeine Sonntagszeitung“ vom 18. November 2018 gleich in der Überschrift auf Seite 21: „… irres Fahrverbot“. Derart massive Vorwürfe aus den Medien gegenüber der Politik – „Bezug zur Realität … ganz verloren, „… irres Fahrverbot“ – müssten doch ein Weckruf für Berlin sein.
Was steht auf dem Spiel? Für eine gegriffene Zahl, nämlich 40 Mikrogramm Stickstoffdioxid pro Quadratmeter, während in den USA 100 Mikrogramm gelten, setzen die Bundesregierung und die sie tragenden Fraktionen nicht weniger als den Wirtschaftsstandort Deutschland aufs Spiel.
Die Grünen und die Linken hier im Hause mögen der Meinung sein, es träfe in erster Linie Firmenchefs und Aufsichtsräte. Nein, es trifft in erster Linie abhängig Beschäftigte, Arbeiter und Angestellte, deren Anwalt in der Vergangenheit die SPD war. Wenn diese sogenannten kleinen Leute ihren Arbeitsplatz nicht mehr mit ihrem legal erworbenen Diesel-Pkw erreichen können, dann sind sie die wirklichen Opfer der völlig verfehlten Grenzwerte.
Was hilft? Ad hoc muss ein Moratorium her. Da bin ich ganz dicht bei Christian Lindner. In dieser Moratoriumsphase muss eine breitangelegte, seriöse wissenschaftliche Arbeit geleistet werden. Erst wenn wirklich belastbare Ergebnisse vorliegen, kommt das Thema wieder auf den Tisch.
Bis dahin: Keine Fahrverbote, kein wirtschaftlicher Selbstmord unseres Landes! Frau Ministerin, wo ein Wille ist, ist auch ein Weg.
Danke schön.
Für die CDU/CSU-Fraktion hat nun der Abgeordnete Dr. Georg Nüßlein das Wort.
