Die AfD versucht jetzt, die Vereinbarung gegen den ausdrücklichen Vereinbarungstext auszulegen.
Sie liest das Gegenteil heraus, und das ist so grotesk wie unsinnig. Was Sie machen, ist Verschwörungstheorie pur, sehr geehrte Kolleginnen und Kollegen.
Der Vertrag redet auch über die positiven Seiten von Migration; denn es gibt neben der ungewollten, neben der erzwungenen Migration auch gewollte Migration. Es gibt wirtschaftlich starke Regionen, die Fachkräfte brauchen. Es gibt Menschen, die neue Herausforderungen suchen. Es gibt Menschen, die ihre Lebensbedingungen selbst verbessern wollen. Das ist nichts Neues. Das zieht sich auch durch unsere deutsche Geschichte immer wieder. Dazu gehört auch unser wirtschaftlicher Erfolg. Das kann man auch in anderen Regionen der Welt beobachten. Schauen Sie einmal ins Silicon Valley! Dort sind 50 Prozent aller Gründer von Start-ups nicht in den USA geboren, sondern eingewandert.
Zuwanderung, wirtschaftliche Leistungsfähigkeit und Innovation gehören eben auch zusammen, werte Kolleginnen und Kollegen.
Das alles macht klar: Der Pakt für eine geordnete und sichere Migration liegt in unserem deutschen Interesse. Deshalb hat die Bundesregierung intensiv an diesem Pakt mitgearbeitet.
Deshalb wird Deutschland auch im Dezember diesem Pakt zustimmen. Da können Sie hier noch so laut schreien, wie Sie wollen.
Der AfD geht es nicht um unser Land. Mit Ihrer verleumderischen Kampagne wollen Sie nur eines: Angst und Hass schüren in diesem Land.
Dagegen setzen wir uns zur Wehr.
Gestatten Sie mir einen letzten Gedanken. Morgen werden wir hier im Bundestag an den 9. November erinnern und damit auch an die Reichspogromnacht 1938.
Es begann damit, dass Bürger, dass jüdische Bürger als andersartig, als fremd diffamiert wurden.
Es begann damit, dass Menschen ausgegrenzt wurden. Es begann damit, dass Menschen für alle Probleme im Land verantwortlich gemacht wurden.
Und dann brannten jüdische Geschäfte, brannten jüdische Häuser, brannten Synagogen. Und am Ende stand millionenfacher Mord.
Das ist die Geschichte, an die wir morgen erinnern.
Und heute leben in diesem Land 20 Millionen Menschen, die eine Zuwanderungsgeschichte haben, 20 Millionen Menschen, die unsere Nachbarn sind, manche seit Generationen, manche erst neu.
Was die AfD mit ihrer Hetzkampagne tut, ist im wahrsten Sinne des Wortes Feuer legen. Sie hetzen Menschen gegeneinander auf.
Die Lehre aus dem 9. November und der daraus folgenden schrecklichen Geschichte steht in Artikel 1 unseres Grundgesetzes:
Die Würde des Menschen ist unantastbar.
