Ich schwöre ...,
– fährt Heine fort –
der zehnte Teil von dem, was jene Leute in Deutschland erduldet haben, hätte in Frankreich sechsunddreißig Revolutionen hervorgebracht ...
Angesichts der landesweiten Proteste französischer Autofahrer gegen die Benzinpreiserhöhungen der Regierung musste ich spontan an Heinrich Heine und diesen Satz denken.
Die Wutrede einer 51-jährigen Bretonin und Dieselfahrerin wurde von Millionen Franzosen angeklickt: „Vor zehn Jahren habt ihr uns dazu gebracht, Diesel zu kaufen, weil sie als umweltfreundlicher galten“, ruft die Bretonin an die Adresse von Präsident Macron, Ihrem Heiligen, und jetzt wolle man die Dieselfahrer mit einer deftigen Steuererhöhung abkassieren. – Ob diese Demonstrationen auch Deutschland bald erreichen? Gründe dafür gäbe es genügend.
Immerhin hat die Deutsche Umwelthilfe gerade vor Gericht ein Dieselfahrverbot auf der A 40 durchgesetzt, einer Hauptverkehrsader des Ruhrgebiets. Das trifft Pendler noch härter als Preiserhöhungen. Werden die Dieselfahrer in NRW jetzt auf die Straße gehen? Wohl eher nicht! Heinrich Heine kannte den Grund: Die deutsche Geduld und die französische unterscheiden sich sehr.
Meine Damen und Herren, wir alle haben den bewegenden Auftritt von Emmanuel Macron vor dem Deutschen Bundestag miterlebt, seinen Aufruf zum noch festeren deutsch-französischen Schulterschluss und zur deutsch-französischen Solidarität gehört. Ja, meine Damen und Herren, den protestierenden französischen Autofahrern gehört unsere ungeteilte Sympathie.
