Vielen Dank, dass Sie die Zwischenfrage zulassen. Ich habe nämlich eine Rückfrage zu den Zahlen in Ihrem Antrag.
Sie behaupten in Ihrem Antrag – das ist die Drucksache 19/6424 –, dass nur 15 Prozent der MINT-Studierenden Inländer seien. Zum einen ist diese Zahl überhaupt nicht an der im Antrag angegebenen Stelle der Studie zu finden, zum anderen ist diese Zahl völlig aus der Luft gegriffen. Laut der von Ihnen zitierten Studie sind nämlich 41 Prozent der sogenannten Bildungsinländer in einem MINT-Fach eingeschrieben. Unter den ausländischen Studierenden liegt der Anteil der MINT-Studierenden bei 50 Prozent. Insgesamt beträgt der Anteil der ausländischen Studierenden an allen Studierenden aber nur 13,5 Prozent. Das bedeutet: Wir reden über 6,75 Prozent ausländische MINT-Studierende unter allen Studierenden. Das heißt, der Anteil der deutschen MINT-Studierenden liegt bei 93 Prozent und nicht, wie in Ihrem Antrag behauptet, bei 15 Prozent. Können Sie das aufklären? Das ist meine erste Frage.
Die zweite Frage. Sie zielen in Ihrem Antrag darauf ab, dass mehr Asiaten als europäische Studierende in Deutschland studieren. Das ist ebenfalls falsch; es ist im Übrigen auch wieder falsch belegt. Der Anteil der Studierenden aus europäischen Ländern liegt bei 47 Prozent, der aus der Europäischen Union bei 32 Prozent und der aus Asien bei 33 Prozent. Das heißt, Sie setzen in Ihrem Antrag die EU mit Europa gleich, um Ihre sehr ketzerische und im Übrigen auch falsche Behauptung zu untermauern, Deutschland öffne sich dem fernen Asien mehr als Europa. Können Sie sich dazu verhalten?
Wie kommt es zu den vielen falschen Zahlen in Ihrem Antrag? Können Sie nicht richtig zitieren, oder sind sie absichtlich gefälscht wiedergegeben?
Sehr geehrte Frau Kollegin, das war ja keine Frage, sondern eine Unterstellung, dass unsere Zahlen falsch und nicht richtig recherchiert sind.
– Darf ich nun antworten?
