Damit will ich mich ausdrücklich an die junge Generation richten, unter anderem an die jungen Menschen auf der Tribüne: Es gibt zwei Politikmodelle, die ich grob unterscheiden möchte: Das eine Modell ist das Modell derer, die man Klimaleugner nennt; wir haben ja gerade die Rede von Frau Höchst gehört. Die sagen: Das ist alles nicht schlimm, das wird nicht kommen, und deswegen brauchen wir heute nichts zu tun.
Es gibt zwei Möglichkeiten, wie das enden kann: Die erste Variante ist, dass in 20 Jahren tatsächlich nichts kommt. – Okay, dann ist es so gelaufen. Die zweite Variante ist, dass der Klimawandel mit voller Härte einsetzt und die junge Generation, von der einige hier auf der Tribüne sitzen, das ausbaden muss, was wir heute versäumt haben.
Herr Kollege, kommen Sie bitte zum Schluss.
Deswegen ist unser Kurs richtig, heute dem Klimawandel mit moderner Technologie, mit zukunftsorientierter Energienutzung zu begegnen und das Beste dafür zu tun, dass diese Generation eine Chance hat.
Vielen Dank.
Herzlichen Dank. – Als nächster Redner hat das Wort der Kollege Dr. Lukas Köhler, FDP-Fraktion.
