– Ich gestatte Ihnen sogar, sich jetzt wieder hinzusetzen. Sonst wäre es unfair.
Was will ich damit sagen? Wir haben zwei Kommissionen,
die den Auftrag haben, den gordischen Knoten zu durchschlagen, den Sie und auch ich durchschlagen wollen. Die erste Kommission nennt sich Ministerpräsidentenkonferenz, und die zweite Kommission nennt sich Innenministerkonferenz. Meine Damen und Herren, da sitzen wir alle zusammen drin.
Alle zusammen sind wir dafür verantwortlich, dass sich diese Dinge nicht bewegen und wir sie nicht konstruktiv diskutieren. Und wenn die Regierungen in diesem Land, mit dieser bunten Farbenlehre, nicht in der Lage sind, diesen Knoten zu durchschlagen, dann ist es eine Aufgabe für uns hier in diesem Parlament.
Dann müssen wir uns dem Selbsttest aussetzen, ob wir in der Lage sind, so konstruktiv gemeinsam über all die strittigen Punkte zu diskutieren, dass wir zu einem Plan kommen. Ich glaube, dass solch ein Plan hochnotwendig ist.
Jetzt verrate ich Ihnen, warum ich nur 80 Prozent Ihres Antrags gut finde. Wenn wir das schaffen und eine nationale Sicherheitsstrategie, die wir gemeinsam entwickeln, obendrauf setzen, könnte ich mir – der Staatssekretär hält sich vielleicht besser die Ohren zu –
