Frau Präsidentin! Meine sehr verehrten Kolleginnen und Kollegen! Zunächst einmal möchte ich feststellen: Die Debatte, die wir hier führen, betrifft ein wichtiges ethisches Thema, aber die Sprache, in der sie seitens der AfD geführt wird, ist schockierend, nicht angemessen und ein Tiefpunkt der Debattenkultur.
Sie werfen alles durcheinander.
Sie machen keinen Unterschied zwischen einem Fötus, einem Baby und einem Kind. Sie machen keinen Unterschied.
Bevor das Kind geboren ist, ist es ein Fötus. Es macht einen Unterschied, ob ein Kind oder ein Fötus abgetrieben wird.
Nicht jede Tötung ist ein Mord. Die Art und Weise, wie Sie die Debatte hier führen, vergiftet jede ethische Debatte, eine ethische Debatte, wie wir sie hier im Haus dringend benötigen.
Ich weise ausdrücklich darauf hin, dass ausgerechnet die AfD sich darüber Sorgen macht, dass die Jusos auf dem Boden des Grundgesetzes stehen.
Das ist ein Hohn. Es hat doch keine Jugendorganisation von Parteien dieses Parlaments mehr Probleme mit dem Grundgesetz als Ihre Jugendorganisation.
Der Hintergrund der Debatte ist doch § 219a. Bei § 219a ist meine Position als Arzt ganz simpel.
Selbstverständlich ist es richtig, dass wir Ärzte über Eingriffe, die wir legal durchführen können, auch informieren dürfen. Das ist eine Selbstverständlichkeit, eine Klarheit.
Es ist genauso selbstverständlich, dass wir für solche Eingriffe nicht werben dürfen. Wir dürfen für keinen unserer Eingriffe werben. Wir sind keine Kaufleute. Wir sind Ärzte. Daher ist es auch falsch, zu sagen: Das ist eine Gewissensentscheidung. – Ich brauche mein Gewissen nicht zu konsultieren, um zu wissen, dass ein legaler Eingriff durch einen Arzt auch der Information durch den Arzt bedarf. Das ist eine Selbstverständlichkeit.
