Meine Damen und Herren, in einer Welt, in der alle fünf Sekunden ein Kind stirbt, klingt Artikel 28 so unerfüllt wie revolutionär. Darin heißt es:
Jeder Mensch hat Anspruch auf eine soziale und internationale Ordnung, in welcher die in der vorliegenden Erklärung angeführten Rechte und Freiheiten voll verwirklicht werden können.
Stattdessen hungern 840 Millionen Menschen auf der Welt – obwohl man die Menschheit zweimal ernähren könnte. Warum? Weil vor den Menschenrechten der Konzernprofit regiert.
Wann endlich findet sich in diesem Hohen Hause eine Mehrheit, diesen Räubern in den Chefetagen mit dem scharfen Schwert der Gesetze endlich entgegenzutreten, zum Beispiel dem Konzern Bayer-Monsanto mit einem jährlichen Gewinn von 3 Milliarden Euro – mit Glyphosat, mit krebserregenden Chemikalien, mit gentechnisch veränderter Baumwolle und Mais, mit Missernten und Selbstmorden von indischen Bauern. Würden wir diesen Völkermördern in Nadelstreifen
endlich entschlossen entgegentreten, dann müssten sich auch nicht 70 Millionen Menschen auf die Flucht begeben.
Diese Konzerne machen satte Gewinne an der Börse mit Krieg, Hunger und Flucht. Und wenn dann Menschen davor fliehen müssen, machen rechte Parteien Gewinne auch noch auf dem Rücken der Geflüchteten. Darum sind deren Profite übrigens der AfD so heilig; denn sie haben ein gemeinsames Geschäftsmodell, und das heißt Elend. Deshalb können übrigens Rechtsparteien auch niemals Menschenrechtsparteien werden.
Ja, meine Damen und Herren, man muss die Feinde der Menschenrechte auch beim Namen nennen: Goldman Sachs, BlackRock, Daimler, Heckler & Koch, die Deutsche Bank und noch so manch ein Konzern, der schon früher, wie thyssenkrupp zum Beispiel, auf der Spendenliste von Faschisten und Rechtsparteien gestanden hat.
Im Übrigen betrifft das nicht nur die AfD. Weisen Sie Parteispenden von Menschenrechtsverletzern zurück!
Oder machen Sie endlich eine Politik, dass die Ihnen gar nichts mehr spenden wollen! Nehmen Sie sich an den Linken ein Beispiel!
Rheinmetall zum Beispiel hat einen Jahresumsatz von 6 Milliarden Euro – mit nichts anderem als dem Export von Mordwerkzeug in alle Welt, an Saudi-Arabien zum Beispiel, Deutschlands zweitbesten Kunden. Die Bundesregierung sonnt sich ja gerade darin, einen Rüstungsexportstopp an Saudi-Arabien verhängt zu haben. Gilt das übrigens auch für deren Tochterunternehmen?
Frau Kollegin, erlauben Sie?
Nein. – Oder fahren Sie die Rüstungsexporte nur für zwei, drei Monate runter, bis Gras über Khashoggis Leiche gewachsen ist? Die Linke sagt grundsätzlich Nein; Menschenrechte und Rüstungsexporte vertragen sich nicht.
Meine Damen und Herren, die Präambel der Allgemeinen Erklärung der Menschenrechte stellt zudem fest, es ist notwendig,
… Menschenrechte … zu schützen, damit der Mensch nicht gezwungen wird, als letztes Mittel zum Aufstand gegen Tyrannei und Unterdrückung zu greifen.
Nun werden Sie sagen: Emmanuel Macron ist doch kein Tyrann, und die Gelbwesten haben auch deshalb nicht das Widerstandsrecht als letztes Mittel. Aber wenn man tagtäglich mit der Angst und Panik leben muss: „Wie bezahle ich mein Essen, meinen Strom, meine Miete?“,
auch das ist eine Art der Tyrannei.
