– Dass man mit so wenigen Abgeordneten hier so einen Krach macht, das kann nur die Linkspartei.
Wir schauen uns die Bankenseite an. Haben Sie als Antragsteller eigentlich schon mal eine Bank von innen gesehen?
– Ja, Dispozins beantragt; ich weiß. – Als gelernter Bankkaufmann und studierter Betriebswirt, Schwerpunkt Bankbetriebswirtschaftslehre, will ich Ihnen da mal ein bisschen was erklären. Der Hauptrefinanzierungssatz der EZB dient der Beleihung von erstklassigen Wertpapieren, die die Bank zuvor erworben hat, also gute Bonitäten. Mit der Refinanzierung von Dispositionskrediten hat dieser Satz nichts, aber auch gar nichts zu tun.
Vielmehr kommt hier ein Mix aus Einlagen, ausstehenden Inhaberschuldverschreibungen und diversen Eigenkapitalprodukten zur Anwendung. Dazu kommen noch die Kreditmarge zur Abdeckung des Kreditausfallrisikos sowie die operativen Kosten, die die Bank hat, und ja, auch das gebundene Eigenkapital will verzinst werden. Überlassen Sie den Banken bitte ihre Produkt- und Kundenkalkulation selber. Sie müssen sich im Wettbewerb behaupten. Da muss eine Linke überhaupt nicht eingreifen.
Wir leben nicht in einer sozialistischen Planwirtschaft, und das ist auch gut so.
So, wir kommen zu Punkt zwei:
