Es ist ein klares Signal für einen Aufbruch. Was ich heute hier höre, das ist doch richtig kleinmütig.
Es ist ein Aufbruch in die Zukunft, und da geht es nicht nur um den Kohleausstieg, sondern es geht um die Zukunft von Arbeitsplätzen in Deutschland – im Osten und im Westen, in ganz Deutschland.
Herr Lindner, Sie sind ja ein junger Mann,
und ich habe immer gedacht, Sie haben ein gutes Gedächtnis. Mein Kollege Miersch hat schon darauf hingewiesen, was uns die Laufzeitverlängerung heute noch kostet und was nach der Entscheidung für diese Verlängerung noch hinzukam.
– Moment, ich bin noch nicht fertig, Herr Lindner.
– Jetzt hören Sie doch einfach mal zu! – Sie haben daraus nichts gelernt. Es kam damals richtig teuer, und der Steuerzahler saß auch nicht mit am Tisch, als Sie uns das präsentiert haben, und die Steuerzahler müssen das Ergebnis heute noch verkraften.
Zu Ihrer Kritik an einer Kommission. Ich kann mich irgendwie daran erinnern: 2010/2011 gab es eine Kommission für einen gesellschaftlichen Konsens. Ich finde, man muss nicht immer warten, bis das Kind in den Brunnen gefallen ist – wie bei Fukushima –; wir handeln verantwortungsbewusst, und wir handeln rechtzeitig. Wir machen uns jetzt Gedanken, wie wir die Arbeitsplätze in Zukunft sichern.
Ihr ewiger Verweis auf den Emissionshandel – Sie tragen ihn wie eine Monstranz vor sich her –:
