Sehr geehrter Herr Präsident! Meine Damen und Herren! Werte Gäste! Der vorliegende Antrag, den wir heute beraten, erzeugt in mir einen Zwiespalt. Natürlich ist man als Familienpolitiker in Deutschland froh über jeden Euro, der für Familienpolitik, Kinderpolitik und Jugendpolitik ausgegeben wird. Wir haben heute lang und breit über das sogenannte Gute-Kita-Gesetz diskutiert. Ich hatte den Eindruck, dass nicht das gesamte Haus der Meinung war, dass es wirklich ein gutes Kita-Gesetz ist.
Im Kielwasser dieses Gute-Kita-Gesetzes macht Die Linke nun einen weiteren Vorschlag und bringt einen Antrag ein, über den wir jetzt reden wollen. Die politische Intention dieses Antrages ist sehr schnell klar. Ich habe als Schüler einen Besuch in der Volkskammer hinter mich gebracht. In der Regierung saß damals eine Frau mit blauen Haaren. Das war unsere Bildungsministerin.
Sie war auch für Schulen und alles, was dazugehört, zuständig.
Der jetzige Finanzminister Olaf Scholz hat es 2012 auf den Punkt gebracht und gesagt, worum es eigentlich geht – Zitat –: Es geht um die Lufthoheit über den Kinderbetten. – Und der Vorschlag, den der verehrte Kollege Müller hier macht, ist nichts anderes als der Versuch, zentralistisch zu regieren, zentralistisch Regelungen herbeizuführen, die uns in einen Staat führen sollen, in dem Politiker bestimmen, wie Eltern ihre Kinder erziehen.
2012 war die Position der CDU scheinbar noch streitbar; denn das Zitat, welches ich eben vorgetragen habe, von Herrn Scholz, SPD, entstammt einer Diskussion über Familienpolitik. Damals schien es also noch Dissens zu geben.
Ich bin kein Berufspolitiker und bin auch stolz darauf. Ich möchte auch keiner werden.
Ich sitze im Familienausschuss, schaue mir das alles an und wundere mich. Wir haben im Familienausschuss Positionen zu vertreten, die faktisch nicht mehr diskutiert werden. Es geht darum, ganz starre Strukturen und Regeln in der Diskussion einzuhalten. Diskussion in dem Sinne findet nicht statt. Es wird vom Blatt vorgetragen.
Man möge dann bitte die Redezeit so einhalten, dass das alles passt.
