Bitte, Frau Kollegin Motschmann.
Frau Kollegin, es gibt in Deutschland 100 000 Abtreibungen im Jahr. Offenbar sind 100 000 Frauen an die nötigen Informationen gekommen. Für wie blöd halten Sie eigentlich die Frauen, dass Sie annehmen, dass sie aufgrund der derzeitigen Rechtsprechung nicht an die notwendigen Informationen kommen? Das ist so leicht und so unkompliziert.
Ich habe noch nicht eine Frau getroffen, die abtreiben wollte und nicht die nötigen Informationen bekommen hat.
Erklären Sie mir also bitte mal, warum Sie hier an diesem Gesetz was ändern wollen.
Vielen Dank für diese Frage. – Das ergibt sich ja gerade aus dem Urteil gegen die Frau Hänel; denn die aktuelle Lage führt dazu, dass Ärztinnen und Ärzte genau wegen dieser Situation zu Freiheitsstrafen und Geldstrafen verurteilt werden, und das kann ja wohl nicht sein. – Damit ist Ihre Frage beantwortet.
Ich hatte Ihnen gerade gesagt, dass Sie es letztlich sind, die den Konflikt eskalieren, wenn Sie bei § 219a nicht handeln; denn die sogenannten Lebensschützer stehen schon bereit, die alten Gräben wieder aufzureißen, wie wir das heute an der Aktuellen Stunde der AfD ja auch sehen konnten. Diese nutzen die Defizite des Gesetzes nämlich, um flächendeckend Strafanzeigen zu erstatten, und das trifft vor allem die Ärztinnen und Ärzte, die letztlich den Kompromiss von 1993 praktisch umsetzen und die Durchführung legaler Abbrüche sicherstellen.
Nur die Streichung dieses Straftatbestandes kann verhindern, dass wir in den kommenden Monaten eine Verurteilung nach der anderen erleben müssen.
Die FDP wollte Ihnen mit einem Entwurf, der nur teilweise Streichungen enthielt, sogar noch Brücken bauen. Aber auch diesen Weg sind Sie nicht mitgegangen.
Ich bin froh, dass die FDP deshalb mit dem heutigen Antrag nun auch die Streichung des gesamten Tatbestandes fordert. Dieser Antrag findet unsere volle Zustimmung.
Nun zur SPD. Wenn Sie noch einen Funken Glaubwürdigkeit verteidigen wollen, dann lassen Sie uns in der nächsten Ausschusssitzung über unsere Gesetzentwürfe debattieren. Wir wären nach wie vor bereit, dem Entwurf der SPD zuzustimmen. Das, was Ihre Ministerinnen gestern Abend aufgeschrieben haben, ist rechtsstaatlich gesehen grober Unfug, und gerade die Justizministerin müsste das eigentlich wissen.
Ein überschießender, teilweise verfassungswidriger Straftatbestand wird durch eine Ergänzung nicht geheilt. Gerade im Strafrecht, dem schärfsten Schwert des Rechtsstaates gegen seine Bürger, gelten der Bestimmtheitsgrundsatz und das Gebot der Rechtsklarheit.
Stehen Sie zu Ihrem bisherigen Gesetzentwurf, und lassen Sie uns den hier im Januar 2019 mit einer klaren Mehrheit aus FDP, SPD, Grünen und Linken verabschieden!
Würden Sie bitte zum Schluss kommen, Frau Kollegin!
Es mag sein, dass Ihre Koalition dann am Ende ist; aber die SPD hätte im Abgang noch einmal Rückgrat bewiesen und einen unhaltbaren Zustand beseitigt.
Frau Kollegin, kommen Sie bitte zum Schluss.
Die betroffenen Ärztinnen, Ärzte und Frauen würden es Ihnen danken.
Vielen Dank, Frau Kollegin Keul. – Als Nächster spricht zu uns der Kollege Dr. Volker Ullrich, CDU/CSU-Fraktion.
