Herr Präsident! Meine Damen und Herren! Als Tony Blair den Sozialstaat der Londoner Börse unterwarf, als die Tories Hunderttausende von Industriearbeitsplätzen in Billiglohnländer verschoben, trieben sie der UKIP die Hasen in die Küche. Als Cameron die Null-Stunden-Arbeitsverträge ohne jede Einkommenssicherheit einführte, zimmerte er damit die Mehrheit für den Brexit. Zwischen 2010 und 2013 waren die Löhne der Briten um 5,5 Prozent gesunken, so stark wie nach Portugal und Griechenland nirgends sonst in der EU. Wo immer in der Welt an Sozialem und an Gesundheit gekürzt wird, sinkt die Lebenserwartung. Die Todesrate in Großbritannien stieg um 5 Prozent, in absoluter Zahl um 120 000 Menschen, laut Oxford-Studie mit einem erheblichen Anstieg der Zahl der Selbstmorde.
Im Winter 2018 stauten sich vor den Notaufnahmen die Krankenwagen. In den Kliniken selbst starben Patienten auf den Gängen. 55 000 Operationen wurden abgesagt. Die Hölle, und das, obwohl in London, einem Paradies für Finanzhaie, Tag für Tag Milliarden gehandelt werden! Aber die Großspekulanten bleiben unversteuert. Das stinkt zum Himmel.
Grassierende EU-Feindlichkeit wird auch durch Angstrenten geschürt. So liegt trotz der steigenden Altersarmut bei uns in Großbritannien die maximale staatliche Rente noch um 65 Prozent unter der deutschen. Gleichzeitig wurde London zum Mekka für Börsenschmarotzer und Immobilienspekulanten, etwa für griechische Steuerflüchtlinge, deren Steuermilliarden jetzt in ihrer Heimat fehlen.
Von der Million polnischer Arbeitskräfte wurden die meisten angeworben, um Schuftereien zu Dreckslöhnen zu leisten, die viele Briten zu Recht für unzumutbar hielten. Auf dem Rücken dieser Polen haben sich nicht nur britische Finanzhaie bereichert. Deren Supergewinne und die Stimmengewinne rechter Demagogieparteien, wie UKIP, sind zwei Seiten einer Medaille. Die strammen deutschen Kameraden von UKIP sitzen hier rechts vom Pult.
Herr Hebner, Sie sprachen eben gegen Fremdbestimmung. Ich will Ihnen einmal sagen, was Fremdbestimmung ist: Als enthüllt wurde, wie britische Superreiche, inklusive Staatschef Cameron, mit Briefkastenfirmen in Panama die Briten um Steuermilliarden beraubt hatten, stand am 13. Dezember 2017 Ihr Abgeordneter Holm hier am Mikrofon mit einem Loblied der AfD auf die Panama Papers als Modell für superreiche Steuerhinterzieher. – Eine schöne Alternative für Deutschland sind Sie, eine, die gegen deutschen Unterrichtsausfall und gegen das Vordringen von deutschen multiresistenten Keimen in deutschen Krankenhäusern mit jährlich 40 000 deutschen Toten den Steuerbetrug via Panama Papers empfiehlt.
Gehen Sie nach Panama zu Ihren Steuerhinterziehern, gehen Sie zu Ihrem rechten Kumpanen Bolsonaro nach Brasilien! Eine Alternative für Deutschland sind Sie nicht!
Wenn jetzt auf dem AfD-Parteitag für einen deutschen Brexit geworben wurde, kann man Ihren Wählern nur raten: Schaut nach England; nur die allerdümmsten Kälber wählen ihre Schlächter selber.
Das Geschäftsmodell von UKIP, Lega Nord, AfD und den Großaktionären hinter diesen Rechtsparteien – Herrn Finck zum Beispiel –
