– Ich bitte, die Ordnung und die Aufmerksamkeit herzustellen.
– Ich bitte alle Abgeordneten, erst einmal die notwendige Aufmerksamkeit herzustellen.
Ich habe das Abstimmungsergebnis noch gar nicht vollständig bekannt gegeben. Also, der Vollständigkeit halber: Abgegeben wurden 414 Stimmen. Mit Ja haben 413 Abgeordnete gestimmt, und es gab eine Enthaltung.
– Mir sei eine persönliche Bemerkung erlaubt. Eine solche Begeisterung für eine Ausschussüberweisung habe ich in 20 Jahren Mitgliedschaft im Deutschen Bundestag nicht erlebt.
Aber fürs Protokoll halten wir fest: Die Drucksachen 19/5077, 19/6420, 19/6426 und 19/6424 sind offensichtlich mit großer Begeisterung des gesamten Hauses überwiesen worden.
Damit fahren wir mit unseren Beratungen fort.
