Sehr geehrter Herr Präsident! Liebe Kolleginnen und Kollegen! „Schnellstmögliche Wiederherstellung von Demokratie und Rechtsstaatlichkeit“, so lautet der ambitionierte Titel unserer Debatte. Dabei muss man festhalten, dass die demokratischen Strukturen seit Jahren abgebaut worden sind und dass man jetzt an einem Punkt angelangt ist, an dem wir tatsächlich nicht mehr zurückhaltend sein können. Nennen wir es beim Namen: Venezuela ist ein autoritäres Regime, Venezuela ist eine Diktatur mit einer korrupten Führungsebene, in der Menschenrechte seit Jahren mit Füßen getreten werden. Das Land steckt in einer humanitären Krise. Nicht mal die Grundnahrungsmittel sind in ausreichender Menge für die Bevölkerung verfügbar. In Krankenhäusern reichen grundlegende Medikamente nicht. Das wurde hier schon alles dargestellt.
Dass Vertreter der Fraktion Die Linke dies alles mit billiger Ablenkung einfach beiseitewischen, die illegitime Führung des Landes verteidigen und das legitime Aufbegehren der Opposition als Putschversuch deklarieren,
den – ich darf Frau Dağdelen zitieren – „jeder aufrechte Demokrat“ verurteilen müsse, ist für mich eine Verhöhnung von 30 Millionen Menschen in Venezuela. Das ist für mich ein Skandal und zeigt, dass Sie in Ihrer eigenen sozialistischen Vergangenheit immer noch gefangen sind.
Dass Nichtregierungsorganisationen von Justizwillkür, vielen politischen Gefangenen und außergerichtlichen Hinrichtungen berichten, interessiert Sie halt nicht. In der heutigen Presse wird eine Sozialarbeiterin zitiert. Sie berichtet:
Jeder von uns hat einen Freund, der im Gefängnis sitzt oder schon mal misshandelt wurde.
Weiter heißt es:
