heißt: Erst die Menschen durch Verarmung zornig machen, und dann den Zorn auf die Allerärmsten umlenken. Und „Bild“ und die britischen Hetzer von der Zeitung „The Sun“ hetzen dabei kräftig an ihrer Seite mit.
Wer aber Migration sozial und human neu regeln möchte, darf die Arbeitnehmerfreizügigkeit nicht zu einem transnationalen Ausplünderungsmodell machen, sondern muss die Angstursachen durch höhere Löhne und Renten bekämpfen.
Entgegen Frau Baerbock und deren Original, Herrn Lambsdorff, und dem Antrag der FDP warnen wir, wie übrigens auch Peter Gauweiler von der CSU, jetzt vor einer Strafexpedition mit knallhartem Brexit, um andere Völker abzuschrecken und auf EU-Linie zu zwingen. Deutsche Konzernherrenmanier fährt diese undemokratische, kapitalliberale EU noch restlos gegen die Wand. Neu verhandeln heißt die Devise, auch die EU-Verträge, damit Sozialstaatlichkeit dort endlich so festgeschrieben wird wie in den antifaschistischen Nationalverfassungen in Europa.
– Ja, diese Verfassungen sind einmal erkämpft worden. Da steht eine Sozialstaatsbindung des Eigentums drin, im Unterschied zum Lissabon-Vertrag.
Nicht die Briten, sondern die Eliten haben die EU in die Krise gestürzt. Die Rechten können weder europäische Integration noch Großbritannien regieren – oder anderswo.
Die May mag weitermerkeln, sie hat es versiebt, und May sollte gehen. Labour liegt endlich in den Umfragen deutlich vor den Tories. Jeremy Corbyn könnte es besser. Herr Außenminister, bei Ihrem Faible für schwarzen britischen Humor: Wir können es auch einmal mit einer roten Regierung versuchen.
Vielen Dank. – Nächste Rednerin ist für die Fraktion Bündnis 90/Die Grünen die Kollegin Dr. Franziska Brantner.
