Erstens. Um Demokratie in der EU zu stärken, will die AfD ausgerechnet das Europäische Parlament abschaffen.
Das muss man sich einmal auf der Zunge zergehen lassen. Warum treten Sie denn überhaupt bei der Europawahl an?
Wollen Sie sich selbst abschaffen, oder wollen Sie Herrn Jörg Meuthen sozusagen auf diesem Weg entsorgen? Das muss man sich einmal fragen.
Zweitens. Sie fordern allen Ernstes den EU-Austritt Deutschlands, und zwar nicht mit einem fixen Datum. Das konnten Sie aus taktischen Gründen gerade noch verhindern; ich verstehe das schon. Aber schon 2016 hat Ihr heimlicher Parteichef Björn Höcke gesagt, auch das deutsche Volk wolle sich von der EU-Sklaverei befreien. Was ist das für eine Sprache? Was ist das für eine geschichtsvergessene Verdrehung der Realität?
Sie wollen den Dexit, wenn die EU nicht auf Ihre Reformvorschläge eingeht. Das ist eine anmaßende und rücksichtslose Vorgehensweise; denn damit wollen Sie Ihre kruden Vorstellungen von Europa anderen Mitgliedstaaten einseitig aufdrücken. Die fatale Sprengkraft, die ein deutscher Austritt auf uns und den gesamten Kontinent hätte, nehmen Sie billigend in Kauf. AfD steht für mich nicht für „Alternative für Deutschland“, sondern für „Aus für Deutschland“, Aus für Europa, Aus für Frieden, Freiheit, Wohlstand auf unserem Kontinent. Sie sind keine Alternative, Sie sind vielmehr eine Gefahr für Deutschland und Europa.
Meine Damen und Herren, das Brexit-Übergangsgesetz, über das wir heute in der zweiten und dritten Lesung entscheiden,
gilt nur für den geregelten Brexit. Es tritt deshalb nur dann in Kraft, wenn auch das Austrittsabkommen in Kraft tritt. Auch wenn aus heutiger Sicht das Inkrafttreten unwahrscheinlicher geworden ist, sollten wir an dem Gesetzesvorhaben festhalten; denn wir wollen uns weiterhin auf alle Eventualitäten vorbereiten. Es ist im Übrigen auch ein Signal dafür, dass unser Weg über dieses Abkommen der Weg ist, den wir weiter beschreiten wollen.
Deshalb bitte ich um Ihre Zustimmung.
Herzlichen Dank.
