Damit bin ich beim letzten Punkt; das ist vielleicht der entscheidende Punkt. Sie von den Grünen und den Linken sagen, wir könnten Konzernen keine Klageprivilegien einräumen, wir müssten diese Privilegien beenden. Nein, es geht nicht um Privilegien, sondern es geht darum, dass im Sinne gelebter Subsidiarität denen, die aus einem Investitionsschutzabkommen Rechte ableiten, auf einem verkürzten Weg die Wahrnehmung dieser Rechte gestattet wird. Das wird demokratisch legitimiert. Das ist demokratisch legitimiert, weil wir darüber entschieden haben.
Wenn Sie sagen, solche Schiedsgerichte könnten entsprechende Schadenssummen auswerfen, dann sage ich: Ja, aber die Alternative ist, dass Gesetze rückabgewickelt werden. Ich muss sagen: Ich möchte nicht, dass durch Schiedsgerichte Gesetze abgewickelt werden; dann lieber Schadenersatz.
Ihr Verhalten ist im Übrigen widersprüchlich, weil Sie im Zusammenhang mit der Musterfeststellungsklage fordern – möglicherweise zu Recht –, dass Schadenersatz in Geld geleistet wird, und zwar in viel größerem Umfang. Warum soll das in die eine Richtung nicht möglich sein, in die andere aber doch? Das passt nicht zusammen.
Schließlich haben Sie gesagt, Investitionsgerichte seien mit der deutschen Tradition nicht vereinbar. Der Deutsche Richterbund hätte dies gesagt. Nein, es geht um die Frage, ob die Richter unabhängig sind und ob sie unabhängig bestellt sind. Das heißt, das Verfahren ist entscheidend. Es ist nicht so, dass es in Deutschland nicht auch Kritikpunkte gibt. Ich nenne den Richter Reuschle aus Stuttgart oder den Insolvenzrichter Frind aus Hamburg. Es ist nicht so, dass aus dem Ausland nicht auch auf solche Fälle geguckt wird. Deshalb kann ich durchaus verstehen, dass an der einen oder anderen Stelle Fragezeichen gesetzt werden.
In diesem Sinne sage ich: Lassen Sie uns über die Sache weiterdiskutieren. Das ist ein Ansatz für die Diskussion; aber über Weihnachten machen wir Pause. Gesegnete Weihnachten und eine neue Debattenkultur im nächsten Jahr!
Vielen Dank. Alles Gute!
Vielen Dank, Dr. Hirte. – Nächster Redner: Falko Mohrs für die SPD-Fraktion.
