Danke für die Zulassung der Frage, lieber Dr. Ploß. – Es ist ja generationsübergreifend so, dass immer die gleiche Rhetorik die europäische Angelegenheit begleitet,
von wegen: Jedes Land ist einzeln zu klein, selbst das relativ große Deutschland usw. usf. – Auf der anderen Seite sehen wir aber, dass Norwegen oder die Schweiz durchaus direkt mit China und sogar mit den USA Verträge schließen.
„Small is beautiful“, hat mal Hermann Lübbe, ein Philosoph, der sich von der Schweiz aus des Ganzen angenommen hat, gesagt.
Zunächst eine Korrektur: Wir wollen eine Substanzreform; der Dexit ist kein Selbstzweck, kein L’art pour l’art. Um das zu bewirken, muss man eventuell einen anderen Ansatz verfolgen, nachdem es jetzt über 60 Jahre nichts mit einer Substanzreform geworden ist. Wir müssen auch feststellen, dass der Binnenmarkt eigentlich nicht realisiert wurde. Der Cecchini-Report hat Ende der 80er-Jahre festgestellt, dass in den damals vier Jahrzehnten noch nicht mal der Binnenmarkt verwirklicht wurde.
Die wohlwollendste Kritik – der können Sie sich vielleicht anschließen – ist doch, dass wir es bei der EU mit einer Versicherung zu tun haben, mit einer Überversicherungsgesellschaft.
Die Kommission agiert als Vorstand einer solchen Versicherung. Es wird mit einem grellen Prospekt gearbeitet.
Es gibt Leistungsversprechen, die im Fall des Falles nicht eingehalten werden.
Würden Sie die Leistungsversprechen von Schengen und Dublin, die uns ja dahin geführt haben, zu sagen, dass wir den großen Rahmen, die gemeinsame Außengrenze haben wollen, als erfüllt ansehen? Wenn nein, was ist Ihr Ansatz, um zu erzwingen, dass das, was im Kleingedruckten steht, auch geliefert wird?
Danke schön.
