Es gab eine Ausnahme: das Fachgespräch mit Frau Kathinka Beckmann von der Hochschule Koblenz. Sie hat untersucht, wie deutsche Ämter im ASD arbeiten. Diese Diskussion führte wirklich weiter. Es wurde klar, dass es in Deutschland bis jetzt nicht gelungen ist, die einfachsten Strukturen zu schaffen. Es ist nämlich unklar, wie in einzelnen Bundesländern problematische Fälle, die womöglich zum Kindesentzug führen können, in Familien behandelt und untersucht werden. Hierbei eine Vereinheitlichung zu schaffen, scheint mir sinnvoll. Darüber sollten wir reden.
Der Antrag der Linken beklagt weiterhin einen akuten Fachkräftemangel. Wir haben zu konstatieren, dass das so ist. Wir müssen aber auch fragen: Woran liegt das? Woher rührt dieser Fachkräftemangel? Wenn wir uns anschauen, was in diesem Land seit 2015 passiert ist,
dann sehen wir, dass der Bedarf an Kindergartenplätzen rapide gestiegen ist. Warum? Nicht weil deutsche Familien mehr Kinder bekommen haben,
sondern weil Migrantenfamilien das Recht bekommen, ihre Kinder in unseren Kindergärten unterzubringen.
Dagegen ist grundsätzlich auch nichts zu sagen. Aber wenn man einen solchen Prozess in Gang setzt, dann muss man auch Lösungsansätze haben und sagen, wie man das finanzieren will. Dieser Antrag von Herrn Müller enthält nicht einen einzigen Lösungsvorschlag, keine Zahl. Es ist nichts zu finden.
Ich möchte aber Folgendes sagen, weil es denjenigen, die uns zuschauen, vielleicht nicht so ganz klar ist: Pro Tag kostet ein unbegleiteter minderjähriger Ausländer 166 Euro, pro Monat 5 250 Euro,
