– Nein, Frau Kipping.
Die Zahl der Baustarts – das ist ja das, was wirklich zählt – steigt nicht etwa, obwohl die Nachfrage nach oben geht, sondern sinkt.
Die Anzahl der neugebauten Sozialwohnungen ist verschwindend gering. Die Linke schmückt sich mit Zahlen aus dem Jahre 2017, die natürlich die Vorgängerregierung zu verantworten hat.
Die Ziele der landeseigenen Wohnungsbaugesellschaften haben Sie 20 Prozent niedriger angesetzt als Ihre Vorgängerregierung, und auch diese niedrigeren Ziele verfehlen Sie. Wenn man das von heute an hochrechnet, hätten Sie nur die Hälfte dessen erzielt, was vorher erzielt worden ist.
Die Vorstände der landeseigenen Wohnungsbaugesellschaften haben vor gut zwölf Monaten einen Brandbrief an Frau Lompscher geschrieben. Damit haben sie ihren Job riskiert, weil Frau Lompscher ja letztlich ihre Vorgesetzte ist. Einige Vorstände haben inzwischen entnervt das Handtuch geworfen.
Im Ernst-Thälmann-Park, am Pankower Tor, auf der Fischerinsel – wahrscheinlich alles Hochburgen der Linkspartei – werden wichtige Entwicklungsvorhaben verzögert und Tausende von Wohnungen in Berlin nicht gebaut. Ja, selbst Dachgeschossausbauten wollen Sie nicht, weil Sie nicht wollen, dass Bäume beschnitten werden.
Ganz zum Schluss: Raten Sie mal, wie viele Grundstücke gemeinnützige Genossenschaften zum Bau von Wohnungen in Berlin bekommen haben?
Drei; drei Grundstücke in einem ganzen Jahr!
Private Wohnungsbaugesellschaften haben kein einziges Grundstück bekommen.
Das hat aber einen Zusammenhang: Die Linke betreibt in Berlin eine immer schlimmer werdende Verknappung von Wohnraum mit desaströsen Langfristschäden. Und Sie sagen jetzt: Der Bund soll das Problem mit Geld lösen. – Meine Damen und Herren, so wird das nicht weitergehen.
Sie, Frau Kipping, sagen, Wohnen sei ein Grundrecht. Das stimmt schon. Aber Frau Lompscher sorgt in Berlin dafür, dass das immer schwieriger zu realisieren wird. Und ich finde, auch das gehört hier zum Thema dazu.
Der Irrsinn hat bei Ihnen insofern ja auch System, als Sie nach dem Parteitagsbeschluss in Berlin jetzt diese Wohnungsbauunternehmen vergesellschaften wollen. Selbst der dem linken Flügel der Grünen angehörende Daniel Wesener hat kommentiert: „Bei allem Verständnis für die Nöte der Mieter sollte man seriös bleiben.“ Recht hat er. Das, was Sie betreiben, ist unseriös, populistisch und im Ergebnis unsozial.
Ihre Enteignungsforderungen spalten die Gesellschaft. Damit begeben Sie sich leider auf das Niveau der AfD. Ehrlich gesagt: Bitte überarbeiten Sie Ihren Antrag, damit man Ihnen diesen Vorwurf nicht weiter machen muss.
Vielen Dank.
Das Wort hat der Abgeordnete Jörg Schneider für die AfD-Fraktion.
