Bis 2030 die von den Städten ausgehende Umweltbelastung pro Kopf senken, unter anderem mit besonderer Aufmerksamkeit auf der Luftqualität und der kommunalen und sonstigen Abfallbehandlung.
Für die SPD ist die Umsetzung der Nachhaltigkeitsziele ein wichtiges Thema – die Luftqualität muss deutlich verbessert werden.
Frau Kollegin Nissen, darf ich Sie ganz kurz unterbrechen, ich habe die Zeit angehalten.
Ich möchte die Kolleginnen und Kollegen wirklich darum bitten, der Rednerin zumindest zuzuhören, auch wenn es Spaß macht, sich wiederzutreffen. Ich bitte die Kolleginnen und Kollegen in den Reihen zwischen FDP und CDU/CSU, die zur Rudelbildung neigen, davon Abstand zu nehmen und sich hinzusetzen.
Frau Kollegin Nissen, der Kollege Hampel möchte eine Zwischenfrage stellen. Erlauben Sie das?
Nein.
