Ich würde Sie jetzt bitten, mit Ja oder Nein zu antworten.
Dann gestatte ich es nicht.
– Sie hätte sich ja stellen können.
100 Jahre nachdem Marie Juchacz als erste Parlamentarierin, als Freie und Gleiche in diesem Haus gesprochen hat, möchte ich meine Redezeit dazu nutzen, Ihnen darzulegen, wofür die SPD steht
und welche Haltung wir zu dem Thema haben, anstatt sie zu verschwenden.
Wir wollen den Frauenanteil im Deutschen Bundestag unter Beachtung folgender Grundsätze erhöhen: Die Quotenregelungen, die die Parteien des Deutschen Bundestages festgelegt haben – und einige praktizieren sie; wir haben es gerade gehört –, möchten wir harmonisieren und zu einer gesetzlichen Regel ausgestalten. Die hohen verfassungsrechtlichen Hürden im Hinblick auf die Eingriffe wollen wir aber auch politisch und verfassungsrechtlich würdigen. Die bisherige Praxis der durch den vorliegenden Gesetzentwurf verächtlich gemachten Parteien, die dem Wahlvolk bei jeder Wahl geschlechtsbezogen quotierte Listen vorlegen, ist im Übrigen zu keiner Zeit auch nur ansatzweise von Wahlleitungen oder der Verfassungsrechtsprechung beanstandet worden.
Der Schutzauftrag von Artikel 3 Absatz 2 Grundgesetz muss mit den Wahlrechtsgrundsätzen in Artikel 38 Grundgesetz innerhalb unseres Systems von Erst- und Zweitstimmen in Einklang gebracht werden. Die Frauenanteile in den Fraktionen zeigen, dass es bereits jetzt möglich ist, mehr und echte Gleichberechtigung herzustellen, wenn alle Parteien dazu verpflichtet würden, ihre Listen zu quotieren.
Die primäre Möglichkeit, ein Bundestagsmandat zu erreichen, ist allerdings immer noch das Direktmandat. Hier entscheiden sich die Parteien in ihren Gliederungen und vergeben eine einzige Kandidatur je Wahlkreis. Welches Verhältnis unter Männern und Frauen der direkt gewählten Abgeordneten am Ende zustande kommt,
ist ausschließlich dem Wählerwillen vorbehalten, und das tastet derzeit auch niemand an.
Quoten im Rahmen von Listen verursachen Unwuchten, aber genau das ist ihre Aufgabe: eine Unwucht zum Ausgleich einer anderen Unwucht. Sie greifen in die demokratischen Mehrheitswahlergebnisse ein, indem sie einen möglicherweise überlegenen Zählwert eines Stimm­ergebnisses im Hinblick auf den Erfolg, der sich realisieren soll, verkürzen. Wenn man jedoch die Rahmenbedingungen parteiinterner Wahlen gemeinsam setzt, dann kann man sich auf eine solche Auseinandersetzung bei Entscheidungen und Spitzenkandidaturen – dazu zähle ich jetzt auch einfach mal die Direktmandate – einstellen. Dafür garantieren sie diesen benachteiligungsfreien Zugang. Diesen benachteiligungsfreien Zugang müssen wir im Übrigen auch auf die Landeslisten ausdehnen und vollstrecken.
Die praktizierte Umsetzung des heute geltenden Wahlrechtes von Grünen, Linken und SPD führt heute schon verfassungsrechtssicher zu einer Steigerung des Frauenanteils des gesamten Deutschen Bundestages und wird ein jedes Mal im Rahmen einer demokratischen Entscheidung von der jeweiligen Parteibasis bestätigend fortgeschrieben.
Seien wir doch mal ehrlich – und das wäre meine Frage an Sie gewesen, Frau von Storch –: Sie schaffen es in Ihrem Gesetzentwurf nicht, mehr als zwei Fundstellen beizubringen, die von einer Unzulässigkeit wahlrechtlicher Geschlechterquoten sprechen. Diese zwei Fundstellen sind auch noch in sich derartig verwoben, dass sie aufeinander verweisen. Wenn Sie hier Gesetzentwürfe vorlegen, dann bitte ich Sie: Arbeiten Sie handwerklich, wissenschaftlich und politisch auch präzise.
Nicht alles, was umstritten ist, ist gleichzeitig auch rechtswidrig oder verfassungswidrig. Es ist ein Diskurs. Keine Quote hat je eine Mandatsträgerin oder einen Mandatsträger hervorgebracht, sondern es war stets der Mut einer jeden Frau und eines jeden Mannes, sich in einem chancengerechten – chancengerechten! – Wettbewerb in der demokratischen Auseinandersetzung zu stellen, um für ihre oder seine Überzeugung zu werben und mit diesen Überzeugungen aufgestellt und am Ende auch gewählt zu werden.
Folgt man hingegen dem AfD-Entwurf, verstößt man gegen den grundgesetzlichen Schutzauftrag der Gleichberechtigung. Im Übrigen verstößt man gegen diverse Regelungen des Parteiengesetzes – Kollege Heveling hat es gerade dargestellt; deshalb spare ich mir das jetzt –, und nebenbei – und das ist besonders verwerflich – tritt man 100 Jahre hart erkämpftes Frauenwahlrecht.
Das ist die AfD-Position, und das sollen alle Frauen in diesem Lande auch hören.
Der Grundsatz der Gleichheit der Wahl ist keine Gleichmacherei, sondern die Herstellung von Gleichheit von Chancen. Ein Anwendungsdefizit, wie der Gesetzentwurf es darlegt, ist aus meiner Sicht nicht erkennbar.
