Das kann doch nicht Ihr Ernst sein, obwohl das klar grundgesetzwidrig ist, obwohl bei einem Ausschluss auch klar ist, dass wir aus der Menge der Betroffenen von 85 000 Menschen berechtigte Wahlprüfungsbeschwerden erwarten dürfen.
Für wie dumm halten Sie eigentlich die Menschen, wenn Sie den Antrag, der dieses Ziel verfolgt, überschreiben mit „Für die Einführung eines inklusiven Wahlrechts“? Die anderen Anträge, die heute vorliegen, wären für die schnelle Einführung eines inklusiven Wahlrechts sehr geeignet; Ihrer ist das nicht.
Wie verschwurbelt ist eigentlich die Argumentation, zu sagen: „Die Wahlrechtsausschlüsse betreffen passives und aktives Wahlrecht. Im Normalfall ist vielleicht jeder Tausendste vom passiven Wahlrecht betroffen; das aktive betrifft alle. Weil wir es beim passiven Wahlrecht nicht mehr umsetzen können, nehmen wir gleich auch das aktive Wahlrecht nicht mit in den Blick und lassen auch das weg“? Und dann versuchen Sie in den letzten Tagen auch noch, sich mit Pressemitteilungen, die gar nichts mit dem zu tun haben, was Sie noch vor zwei, drei Wochen gesagt haben, als Macher beim Wegfall der Wahlrechtsausschlüsse zu inszenieren. Das ist, liebe Kolleginnen und Kollegen insbesondere von der Union, nur noch peinlich.
Bewahren Sie heute den Rechtsstaat! Verhindern Sie, dass zur Europawahl in diesem Jahr wiederum Menschen beleidigend durch pauschale Wahlrechtsausschlüsse ausgeschlossen werden! Verhindern Sie Tausende von Wahlprüfungsbeschwerden!
Ich komme zum Ende mit einem letzten Appell: Kolleginnen und Kollegen von der SPD und von der Union, denken Sie an das Motto des Behindertenbeauftragten Ihrer Bundesregierung: Inklusion ist zunächst eine Frage der Haltung. – Ihre Haltung werden Sie heute in der namentlichen Abstimmung zeigen müssen.
Vielen Dank.
Vielen Dank, Herr Kollege Beeck. – Als nächster Redner spricht zu uns der Kollege Sören Pellmann, Fraktion Die Linke.
