Aber auch heute gibt es noch einige Sachverhalte, die im Gesetz nicht geregelt sind. Diese haben wir in eigenen Änderungsanträgen und in einem Entschließungsantrag im Finanzausschuss dargelegt.
Zwei konkrete Punkte: Erstens. Im Einkommensteuergesetz werden nach der neuen Regelung unterschiedliche Brexit-Übergangsfristen für „Wohn-Riester“ und „Geld-Riester“ gewählt. Das ist nicht nachvollziehbar. Die Begründung war, es hätte Steuergestaltung stattfinden können. Wir sind der Auffassung: Der Abschluss eines Riester-Vertrages ist kein Mittel für unerwünschte Steuergestaltungen, sondern der Altersvorsorge.
Zweitens. Mit einer weiteren Änderung in § 53b Kreditwesengesetz wollen wir sicherstellen, dass deutsche Wirtschafts- und Finanzunternehmen vorübergehend weiterhin Zugang zu liquiden Handelsplätzen haben. In der Anhörung ist klar geworden: So schnell kann die Umstellung auf neue Handelsplätze in der EU nicht stattfinden. Es wurde auch klar, dass die dort getroffene Unterscheidung zwischen Bestands- und Neugeschäft nicht eindeutig ist.
Wir wollen auf die bestehenden Geschäftsbeziehungen abstellen, um Härten zu vermeiden und Rechtssicherheit zu schaffen.
Wir alle wissen nicht, was in der Zeit nach dem Austritt wirklich passiert. Deshalb: Stimmen Sie unserem Entschließungsantrag zu! Wir wollen einheitliche Fristenlösungen in Europa, damit es keine Regulierungsarbitrage gibt, und wir wollen Fristen immer wieder überprüfen, auch mit Blick auf das langfristige Geschäft der Versicherungsverträge.
Es geht weder um die Beibehaltung des uneingeschränkten Zugangs zum Binnenmarkt, noch geht es darum, ein Exempel zu statuieren. Europa ist zu wichtig, als dass wir nicht die richtige Balance zwischen klarer Verhandlungsposition, aber auch pragmatischer Lösung im Sinne der Menschen und Wirtschaft auf beiden Seiten des Ärmelkanals finden.
Das Gesetz ist nicht vollständig, aber die Inhalte sind wichtig. Wir stimmen daher zu.
Vielen Dank. – Nächster Redner ist für die Fraktion Die Linke der Kollege Jörg Cezanne.
