Für alle, die es noch nicht mitbekommen haben: Am Ende der Beratung ist die Frau frei in ihrer Entscheidung. Sie braucht niemandem etwas zu erklären. Sie braucht nichts zu rechtfertigen. – Deshalb: Alle, die hier weiter die Freiheit der Frau reklamieren, haben bitte zur Kenntnis zu nehmen, dass die Frau diese Entscheidung frei treffen kann. Es ist der Ausdruck des höchsten Respektes gegenüber der Frau, dass sie diese Entscheidung alleine trifft und auch alleine verantwortet.
Ich fände es im Übrigen auch gut, wenn wir zusätzlich eine Liste der Beratungsstellen ins Netz stellen würden.
Mit dem Kompromiss legen wir auch den Streit darüber bei, ob Ärzte auf ihrer Homepage über die Tatsache, dass sie Abtreibungen durchführen, informieren dürfen. Gerade war von den unausgelasteten Mathematikstudenten die Rede. Für sie habe auch ich keine Sympathie. Sie kommen mir ein bisschen vor wie die Deutsche Umwelthilfe der Abtreibungsärzte.
Die DUH ist auch nicht unbedingt mit viel Sympathie verbunden.
Frau Kollegin, kommen Sie zum Schluss.
Was uns hier vereint, ist der Wille, den gesellschaftlichen und politischen Kompromiss, den wir in diesem Land haben, weiterzutragen, ihm ein Update zu geben. Ich glaube, in diesem Sinne werden wir die Beratungen führen.
Herzlichen Dank.
