Herr Präsident! Meine Damen und Herren! Mich freut sehr, dass sich die Sozialdemokratie dem im Grundgesetz festgeschriebenen Auftrag des Sozialstaates wieder widmet.
Das macht Hoffnung auf einen Paradigmenwechsel in der Sozialpolitik. Es scheint sich offensichtlich etwas zu bewegen, wenn auch bisher nur verbal. Soziale Themen sollen wieder im Mittelpunkt stehen. Das ist sehr vernünftig. Aber es sind natürlich Taten gefragt. Handeln, nicht reden! Denn nur so lässt sich Glaubwürdigkeit herstellen.
Deshalb müssen wir den vorliegenden Gesetzentwurf natürlich auch unter diesem Gesichtspunkt bewerten. Ich will zunächst einmal festhalten, dass wir offensichtlich ein schwerwiegendes Problem haben. Dieses Problem ist nicht vom Himmel gefallen. Dazu gehört, dass seit dem Jahre 2005 die Bundeskanzlerin Angela Merkel heißt. Sie trägt für den jetzigen Zustand natürlich wesentlich Verantwortung. Wir haben keine Chancengleichheit für Kinder in Deutschland. Wir haben ein Problem mit Kinderarmut, das nicht gelöst wird. Die Zahl der betroffenen Kinder ist in den letzten Jahren sogar gestiegen. Der Kinderschutzbund spricht von über 4 Millionen Kindern, die arm sind oder von Armut bedroht sind. Aber jedes Kind muss uns gleich viel wert sein.
Jedes Kind muss die Chancen haben, seine Fähigkeiten und Fertigkeiten in unserem Land zu entwickeln. Das ist unsere hoffentlich gemeinsame Verantwortung; dies müssen wir angehen.
Jetzt zur Sache selbst. Erst einmal – wie immer – zum Positiven. Lyrik beherrschen Sie ausgesprochen gut. Es ist wunderbar geschrieben. Starke-Familien-Gesetz – das klingt gut.
Um es klar zu sagen: Starke Familien brauchen keinen starken Gesetzestitel, sondern sie brauchen ein starkes und ein einfaches Hilfesystem.
Entscheidend ist doch, was dahintersteckt.
