Herr Präsident! Meine sehr verehrten Damen und Herren! Ein vermeintliches Geheimabkommen zwischen Deutschland und Frankreich zur Rüstungskooperation steht zur Debatte. Wir wissen nicht genau, was drinsteht. Tatsache ist, dass nach Presseberichten ein Abkommen nicht vorliegt, sondern ein Schriftwechsel zwischen Élysée-Palast und Kanzleramt über Grundzüge möglicher zukünftiger Rüstungszusammenarbeit.
Ich will für die SPD-Fraktion festhalten: Es spricht überhaupt nichts dagegen, dass das Kanzleramt oder das federführende Wirtschaftsministerium dem Parlament in geeigneter Form diese Information zur Verfügung stellt, meine verehrten Damen und Herren.
Es spricht überhaupt nichts dagegen. Man muss nur festhalten: Es gibt kein Abkommen, sondern es gibt Regierungsabsprachen, wie man dieses Thema weiter behandelt. Ich glaube, um diese Frage muss man keine Skandalisierung betreiben.
In der Sache ist für die SPD-Fraktion völlig klar: Der Koalitionsvertrag ist die Richtschnur für das Handeln Deutschlands beim Rüstungsexport. Es gibt drei Punkte, die uns wichtig sind und die die SPD auch im jetzigen Koalitionsvertrag durchgesetzt hat.
Erster Punkt: keine Kleinwaffenexporte in Drittstaaten. Ich würde sagen, wenn wir die letzten Statistiken anschauen, können wir feststellen: Klappt doch schon ganz gut. Es ist gut, dass wir erreicht haben, dass diese Kleinwaffenexporte in Drittstaaten quasi nicht mehr existieren. So ist es richtig.
Zweitens. Die Jemen-Klausel gilt. Das ist ja stadtbekannt und in den Medien ausgebreitet.
Drittens haben wir eine Schärfung der Rüstungsexportrichtlinien vereinbart. Für die SPD-Fraktion will ich da festhalten: Wir erwarten schon, bevor man in die Weite der europäischen Zusammenarbeit geht, dass man erst einmal die Hausaufgaben in Berlin macht und dass wir vom Wirtschaftsministerium, das federführend in der Sache ist, endlich Antwort darauf bekommen, wie wir diese Schärfung der Rüstungsexportrichtlinien durchsetzen wollen.
Ich appelliere auch an die Kolleginnen und Kollegen von der CDU/CSU, dass wir diese Überarbeitung der Rüstungsexportrichtlinien ernst nehmen und endlich zu einem Ergebnis führen.
