Werter Herr Präsident! Frau Ministerin! Sehr geehrte Damen und Herren! Mann, Mann, Mann – Familienförderung ist ein Kernanliegen der AfD. Der Grundgedanke, auf dem dieser Gesetzentwurf fußt, findet daher in weiten Teilen unsere Zustimmung. Leider haben Sie immer noch nicht die Zeichen der Zeit erkannt und setzen die Politik der Abschaffung Deutschlands fort. Ihr Starkes-Familien-Gesetz ist in Wahrheit – gemessen an dem, was nötig wäre – ein Schwaches-Familien-Gesetz.
Trotz aller familienpolitischen Maßnahmen – und seien sie noch so gefeiert – erlebt Deutschland seit Jahren eine dramatische Zunahme der Ehe- und Kinderlosigkeit. Zudem sorgt das Verschwinden normaler und mittelgroßer Familien für eine Schrumpfung unserer angestammten Bevölkerung um circa 250 000 Personen pro Jahr. Meine Damen und Herren, Ihre familienpolitischen Maßnahmen haben in den letzten Jahrzehnten nicht zu einer Trendumkehr geführt. Nehmen Sie das doch bitte mal endlich zur Kenntnis.
Hurra, 8 Euro mehr Kindergeld, kostenloses Schulessen! Jetzt kann ich mir eine Zukunft für meine Kinder Gott sei Dank vorstellen und schreite flugs zur Zeugung. Was für ein Schwachsinn!
Ihre Familienpolitik inklusive des vorliegenden Gesetzes taugt allenfalls dazu, Familien finanziell nicht noch schlechter zu stellen. Was wir von der Regierung wirklich erwarten, ist eine aktivierende und wertschätzende Familienpolitik, die eine höhere Geburtenrate der einheimischen Bevölkerung erreicht; denn die liegt seit vielen Jahrzehnten mit einem recht konstanten Wert von 1,4 Kindern weit unter dem bestandserhaltenden Niveau.
Kinder sind in diesem Land zunehmend zu einem Armutsrisiko geworden. So verwundert es nicht, dass jährlich rund 100 000 Abtreibungen zum großen Teil aufgrund von sozialer Indikation stattfinden.
Fazit: Ihre christdemokratische und sozialdemokratische Familienpolitik, die ist gar keine.
