Herr Präsident! Meine Damen und Herren! Die heutige Debatte hinkt. Sie hinkt deswegen, weil hier jeder versucht, die anderen mit den eigenen Vorschlägen zu überbieten, und eigentlich keiner deutlich macht, wie gefährlich der Antrag der Linken ist. Der Antrag der Linken und die Vorschläge, die Sie heute machen, legen letztendlich die Axt an das, was unseren Sozialstaat einmal stark gemacht hat:
Maß und Mitte in der Sozialpolitik, den Fokus immer darauf gerichtet, den gesellschaftlichen Frieden zu wahren, niemanden zu bevorzugen, niemanden zu benachteiligen, die Gesellschaft nicht zu spalten.
Worum geht es ganz konkret? Die Linke möchte die Rentensystematik so, wie wir sie kennen, aushebeln.
Sie wirft damit die Prinzipien der Gerechtigkeit, die wir in unserem Rentensystem sehr stark verankert haben, über Bord. Mir wird es angst um unseren gesellschaftlichen Frieden, weil Sie mit den Vorschlägen, die Sie hier einbringen, den Neid in unserer Gesellschaft schüren.
– Ich finde es erstaunlich, wie lustig Sie das finden. Das ist unglaublich.
Mir wird vor allem angst um jene, die all das einmal zu finanzieren haben.
Meine Damen und Herren, der Antrag der Linken dreht sich – ich will es einmal so sagen – im Wesentlichen um drei Punkte.
Punkt eins. Sie wollen das sogenannte Äquivalenzprinzip abschaffen.
Was ist das Äquivalenzprinzip? Dabei geht es im Wesentlichen darum, dass man in der gesetzlichen Rente das herausbekommt, was man einmal eingezahlt hat. Sie möchten künftig aber auch Zeiten der Langzeitarbeitslosigkeit in der gesetzlichen Rente berücksichtigen.
Sie möchten niedrige Löhne künstlich aufwerten. Sie möchten natürlich auch eine Mindestrente einführen, sozusagen ein bedingungsloses Grundeinkommen in der Rente,
und damit mehr und mehr versicherungsfremde Leistungen in der gesetzlichen Rente einführen. Damit, meine Damen und Herren, wird die gesetzliche Rente mehr und mehr zum Spielball der Politik. Das können wir nicht wollen.
Ich sage Ihnen noch eines. Das Rentensystem, so wie wir es haben, ist solide. Es ist mir wichtig, das an dieser Stelle zu sagen. Natürlich: Nicht bei jedem reicht die Rente immer aus, nicht jeder ist zufrieden mit dem, was er am Ende rausbekommt.
Aber das System als solches, so wie es funktioniert, so wie es die Mütter und Väter dieses Sozialstaates einmal aufgebaut haben, ist im tieferen Sinne auch gerecht.
Punkt zwei. Sie gefährden mit Ihren Vorschlägen im Antrag den gesellschaftlichen Frieden. Sie schüren einen Neid in der Gesellschaft, das ist unglaublich.
Sie wollen eine Erwerbstätigenversicherung für alle. Sie machen die Menschen glauben: Wenn jeder in die gesetzliche Rente einzahlt, dann wird sich die Situation des Einzelnen verbessern. – Das tut es nicht.
– Nein, das tut es nicht.
