Damit ist diese Frage erledigt, Herr Kollege Hampel. – Frau Kollegin Nissen, Sie dürfen fortfahren.
Wegen schlechter Luft drohen vielerorts Fahrverbote. Wir müssen handeln! Dazu gehört auch, dass Autos, die erheblich zu Schadstoffemissionen beitragen, technisch nachgerüstet werden. Das bringt innerorts eine Reduzierung von 70 Prozent, außerorts von 90 Prozent. Schon 2017 hatte die damalige Bundesministerin Barbara Hendricks die technische Nachrüstung gefordert. Leider wurde dies aus dem CSU-geführten Verkehrsministerium – ich bin höflich – lange quasi boykottiert. Wertvolle Zeit ist verstrichen, liebe Kolleginnen und Kollegen.
Noch im Spätherbst wurden im Anschreiben des Kraftfahrt-Bundesamtes die Betroffenen nur auf Umtauschprämien für Neufahrzeuge hingewiesen, schrägerweise mit direkten Verkaufskontaktdaten der Hersteller BMW, Daimler und VW. Nicht alle Menschen wollen oder können sich ein Neufahrzeug kaufen. Die SPD ist auf deren Seite.
Mit der 13. Änderung des BImSchG schaffen wir die Voraussetzung, dass ordnungsgemäß nachgerüstete Fahrzeuge und Euro-6-Autos von möglichen Fahrverboten ausgenommen werden. Dann werden die Menschen ihre Fahrzeuge nachrüsten, aus unserer Sicht natürlich auf Kosten der Autohersteller. Diese haben auch im Prospekt mit umweltfreundlichen Fahrzeugen geworben.
Des Weiteren wollen wir die Mobilität in den Städten erhalten. Dazu gehört für uns auch, dass wir die Nutzung von Bussen, Bahnen sowie E-Carsharing-Fahrzeugen als Alternative fördern wollen. Ich bin selber seit zehn Jahren elektromobil in Frankfurt unterwegs. Um eine weitere attraktive Alternative zu bieten, wollen wir von Fahrverboten betroffene Kommunen dabei unterstützen, ein 365-Euro-ÖPNV-Jahresticket anzubieten. Das finde ich klasse, liebe Kolleginnen und Kollegen.
Unser Ziel ist saubere Luft und eine funktionierende Mobilität.
Liebe Kolleginnen und Kollegen, die technische Nachrüstung schont die Umwelt, stabilisiert den Fahrzeugwert und ermöglicht gemäß unserem heutigen Gesetz auch die Einfahrt in Verbotszonen. 38 000 Meisterbetriebe haben uns mitgeteilt: Wir können nachrüsten. – Sie haben uns aufgefordert, Regeln zu schaffen, damit sie endlich mit der Nachrüstung beginnen können. Dies machen wir heute.
Ich bitte Sie um Unterstützung des heutigen Gesetzentwurfs.
Vielen Dank, verehrte Kollegin Nissen. – Als letzter Redner zu dem Tagesordnungspunkt hat das Wort der Kollege Felix Schreiner, CDU/CSU-Fraktion.
