Herr Präsident! Liebe Kolleginnen und Kollegen! Wer sich diese Debatte angeschaut hat, konnte feststellen: Es herrscht Einigkeit in diesem Plenum, und zwar in zwei Punkten:
Erster Punkt. Einigkeit besteht darüber, dass die größte oder eine der größten Herausforderungen in dieser Zeit die massive globale Ressourcenverschwendung ist, der massive Eingriff in die Umwelt, in die Natur.
Zweiter Punkt. Wir sind uns einig darüber, dass es gut ist, wenn sich junge Menschen engagieren, wenn sie voller Empathie, voller Begeisterung und voller Hilfsbereitschaft für eine lebenswerte Zukunft kämpfen und streiten. Das ist unbestritten.
Aber dafür brauchen wir nicht Greta; denn das haben die jungen Leute schon immer gemacht, jedenfalls die, die ich kenne, in den Wahlkreisen, in den Vereinen, in den Schulen, beim THW, bei der Feuerwehr, bei den Jugendorganisationen. Darauf können wir stolz sein; denn das ist der Kitt, der die Gesellschaft zusammenhält.
Nicht einig sind wir uns in der Tat bei der Herangehensweise, bei den Maßnahmen, wie wir zu den entsprechenden Zielen kommen. Ich glaube nicht, dass wir Kronzeugen brauchen. Die Frage muss erlaubt sein: Ist es gerechtfertigt, Kinder für seine ganz speziellen politischen Ziele zu
instrumentalisieren?
Natürlich ist es so, dass Umweltschutz und Naturschutz gerade bei der Jugend ganz besonders im Fokus stehen. Das ist aber schon immer so gewesen. Das war auch in meiner Jugend so. Auch in meiner Jugend haben wir, zu DDR-Zeiten,
in den Jugendorganisationen gekämpft.
