werden bestimmte Dinge wie das Einkommen und das Vermögen geprüft. Bei Ihrer Grundsicherung im Alter wäre es so, dass Kinder nur dann herangezogen werden, wenn sie mehr als 100 000 Euro Jahreseinkommen haben. Meine lieben Kolleginnen und Kollegen, ich schaue jetzt mal Sie alle hier an. 100 000 Euro Jahreseinkommen entsprechen ungefähr dem, was wir jährlich an Diäten erhalten. Liebe Kollegen der FDP, wären Sie mit Ihren Diäten nicht bereit, Ihre Eltern zu unterstützen, wenn sie bedürftig sein sollten? Ich frage mich, welche Kinderstube Sie haben und welche Motivation dahintersteht, diese Forderung in Ihrem Antrag so zu formulieren.
Auch beim nächsten Punkt kläre ich Sie gerne auf. Sie fordern in Ihrem Antrag, dass das angemessene Eigenheim bei der Bedarfsprüfung künftig nicht mehr einbezogen wird. Schauen Sie ins SGB XII – das ist immer lohnenswert –: Es wird schon heute nicht mehr angerechnet.
Noch ein letzter Satz zum Thema „Verschmelzung von Grundsicherung und Rente“. Ich kann nur davor warnen, das Solidarprinzip und das Versicherungsprinzip in unserem Lande zu verschmelzen. Die gesetzliche Rentenversicherung hätte auf einen Schlag die Aufgabe, die Bedürftigkeit von Menschen zu prüfen. Das macht sie bis zum heutigen Tag nicht. Das ist eine Aufgabe, mit der sie sicherlich überfordert sein würde, die nicht leistbar ist.
Noch ein Punkt. Herr Vogel, sind Sie sich sicher, dass wir in zehn Jahren nicht vor derselben Situation stehen und die Leute sagen: „Hm, ich muss zur Rentenversicherung; ich bin bedürftig“? Wir diskutieren über das Stigma Grundsicherung oder das Stigma Hartz IV oder was auch immer. Dass wir das mit der Grundrente umgehen können, ist, glaube ich, ein Trugschluss.
Kollegin Schimke, jetzt muss ich die Interessen des Kollegen Straubinger zumindest andeuten. Sie reden demnächst auf seine Kosten.
Ich komme zum Schluss. – Ich halte es mit einem Satz des ehemaligen Präsidenten des Bundesverfassungsgerichts, Hans-Jürgen Papier, der sagte: Zu fordern sind mehr Nachhaltigkeit, Folgerichtigkeit und Rationalität in der Sozialpolitik. – Dafür sollten wir uns einsetzen.
Vielen Dank.
Für die SPD-Fraktion hat nun Bernd Rützel das Wort.
