Ja, gestatte ich.
Sehr gut. – Herr Müller.
Ich wollte nur sichergehen, dass es auch zur Debatte beiträgt.
Das nehme ich als Kompliment. Herzlichen Dank.
Das weiß man erst hinterher.
Ich hatte ja in meiner Rede durchaus darauf hingewiesen, was wir an der Reform des Kinderzuschlages gut finden. Aber ich habe auch in der Regierungsbefragung letzten Mittwoch die Ministerin sowohl zum Kinderzuschlag als auch zum BuT gefragt: Was sind eigentlich die Maßnahmen der Bundesregierung, um die Inanspruchnahme auszuweiten? Die Antwort war: Wir werden vielfältige Maßnahmen ergreifen. – Da habe ich mich ein bisschen veräppelt gefühlt.
Jetzt hat die Kollegin Mast in ihrer Rede gesagt, die Abgeordneten des Bundestages sollen sozusagen als Boten der Bundesregierung durch die Republik reisen und sagen, was für schöne Gesetze beschlossen worden sind und dass die Menschen jetzt die entsprechenden Anträge stellen sollen. Das ist eigentlich nicht unser Job, sondern Aufgabe der Bundesregierung.
Jetzt würde ich gerne von Ihnen, Kollege Rix, wissen: Welche Maßnahmen würden Sie als sozialdemokratische Bundestagsfraktion vorschlagen, um die teilweise katastrophale Quote der Inanspruchnahme, die beim BuT zur Unterdeckung des garantierten Existenzminimums – Herr Lehmann hat darauf hingewiesen – führt, zu erhöhen, damit Kinder nicht mehr unter dem Existenzminimum leben, weil die Eltern möglicherweise überfordert sind mit der Antragsflut?
Es entsteht zum Beispiel weniger Aufwand dadurch, dass wir einen Bewilligungszeitraum von sechs Monaten einführen; das ist ein Beitrag zum Bürokratieabbau. Es entsteht zum Beispiel weniger Aufwand dadurch, dass wir die Abbruchkanten abschaffen. Auch das bedeutet weniger Bürokratie. Ein längerer Bezug bedeutet auch weniger Bürokratie. Die ganz konkreten gesetzlichen Maßnahmen bedeuten weniger Bürokratie. Die Leistungen werden leichter zugänglich, es gibt mehr Leute, die sie in Anspruch nehmen, und sie werden höher; das ist auch ein Beitrag zum Abbau von Bürokratie.
Das Gleiche gilt im Übrigen auch für die Abschaffung des Eigenanteils beim Mittagessen und bei der Schülerbeförderung. Das ist auch ein Abbau von Bürokratie; das bedeutet auch weniger Antragsaufwand. Also: So zu tun, als ob hier gar kein Abbau stattfindet, ist nicht fair.
Ich war dabei stehen geblieben, darüber zu sprechen, was stattdessen für Debatten aufgemacht werden. Einmal wird gesagt, dass die Maßnahmen nicht ausreichend seien. Gut, darüber kann man streiten; mehr geht immer. Aber ich stelle mindestens an die Adresse der FDP die Frage: Wo kommt das BuT eigentlich her? Es ist ja nicht irgendwie unter einer bösen Großen Koalition entstanden, sondern es ist entstanden unter Schwarz-Gelb.
– Ja, im Vermittlungsausschuss; aber es ist ja nicht so, dass die FDP daran nicht beteiligt war. Das sollte man zumindest auch erwähnen.
Man sollte in Bezug auf dieses Gesetz nicht so tun, als ob das Ganze kompletter Blödsinn wäre, sondern auch Verantwortung tragen und sagen: Ja, das ist auch unsere Maßnahme gewesen. – Auch das wäre fair, liebe Kolleginnen und Kollegen.
Stattdessen wird gesagt: Na ja, es gibt hier Milliarden an Geldern, die für Rente ausgegeben werden; aber viel zu wenig Geld wird gegen Kinderarmut ausgegeben. – Ich will mal darauf hinweisen, wie viele Milliarden durch den Verlust entstehen würden, wenn Sie alle Ihre Steuersenkungsprogramme durchsetzen würden. Das Geld wäre sinnvoller angebracht als Investition für Familien anstatt als Steuersenkung für Besserverdienende, liebe Kolleginnen und Kollegen.
Eine letzte Bemerkung will ich noch machen. Wenn ich in Kiel zum Tanken gefahren bin,
habe ich immer den Aufruf bekommen, ich solle bitte bei der Aktion „Mach MITTAG“ mitmachen, einer wohltätigen Aktion von einem Verband unter der Schirmherrschaft des derzeitigen Bürgermeisters und der ehemaligen Bürgermeisterin von Kiel, die gesagt haben: Wir sammeln den 1 Euro, damit die 1-Euro-Zuzahlung fürs Mittagessen für denjenigen, die im Bezug von Leistungen des Bildungs- und Teilhabepakets sind, nicht mehr notwendig ist. – Heute wurde verkündet, dass sich der Verein auflöst, weil diese Maßnahme jetzt Gesetz ist. Das ist mal eine gute Auflösung eines wohltätigen Vereins, auch wenn es noch viel zu tun gibt. An dieser Stelle herzlichen Dank an die Aktiven in diesem Verein und herzlichen Dank an alle Aktiven, die sich gegen Kinderarmut engagieren.
Herzlichen Dank für die Aufmerksamkeit.
Der Kollege Stephan Stracke ist der letzte Redner zu diesem Tagesordnungspunkt.
