Herr Präsident! Meine Damen und Herren! In der Tat zeigt schon der Titel dieser Aktuellen Stunde, welche verfassungswidrige Haltung die AfD hier erneut hineinbringt.
Das ist einfach nur schäbig und widerlich.
Der Kollege Weiß hat zu Recht auf das Verfassungsgerichtsurteil von 2012 verwiesen.
Herr Kollege Weiß, das Verfassungsgericht hat aber auch sehr deutlich gemacht, dass – ich zitiere – die Menschenwürde migrationspolitisch nicht relativiert werden darf.
Sie haben jetzt ankündigt, dass Sie erneute Repressionen planen. Wir haben das ja schon in einem ersten Entwurf lesen dürfen. Dazu muss ich Ihnen sagen: Es gibt immer wieder viele Gründe, warum Menschen aus diesem Land nicht ausreisen können. Nehmen Sie das auch einmal zur Kenntnis, und schaffen Sie hier nicht ständig ein Misstrauen. Denn die Mitwirkungspflicht kann unter Umständen auch einfach daran scheitern, dass man aus einem Land kommt, in dem man gar keine Papiere bekommt, wie das zum Beispiel in Syrien oder anderen Ländern der Fall ist.
Herr Weiß, wie Sie auch ganz genau wissen, hat die Bundesregierung erst kürzlich zugegeben, dass nach ihrer Auffassung das menschenwürdige Existenzminimum nicht gesichert ist. In diesem Zusammenhang ist doch der eigentliche Skandal, dass dieses niedrige Taschengeld von 135 Euro erst jetzt nach drei Jahren auf 150 Euro erhöht wird. Das ist doch nahezu lächerlich.
Denn – das hat Herr Weiß hier auch gesagt – der Bund hat sich sogar verpflichtet, die Leistungen der Asylsuchenden jährlich an die Inflation anzupassen.
Das wäre seit 2016 notwendig gewesen.
Alleinstehende Erwachsene sollen künftig mit 150 Euro – bislang waren es 135 Euro – Taschengeld auskommen. Zwar werden Unterkunft und Verpflegung bezahlt. Aber was muss von dem Taschengeld alles bezahlt werden? Zum Beispiel Handykarten, Bustickets, Zigaretten.
– Ja, da lachen Sie. Das müssen gerade diejenigen tun, die zurzeit in Spendenaffären ersticken und ihre Kohle von den Reichen abzocken.
Selbst Medikamente, die von den Kassen nicht bezahlt werden, müssen von diesen Geldern bezahlt werden. Da bleibt für Freizeit, Kultur oder dafür, auch einmal einen Kaffee mit Freunden zu trinken, nicht allzu viel übrig. Meine Damen und Herren, so darf Integration in unserem Land nicht aussehen.
Stattdessen hören wir ja auch aus Bayern Töne. Ich will einmal daran erinnern, dass CSU-Generalsekretär Markus Blume gesagt hat – ich zitiere –:
