Am Dienstag hat übrigens die EU-Außenbeauftragte Federica Mogherini vermeldet, dass es auch keine Fortschritte in den Verhandlungen mit Italien gibt. Die Frau hat ja sehr viel Ahnung, davon wird zumindest in Fachkreisen ausgegangen. Es wäre vielleicht ganz praktisch, wenn man sich da mal miteinander abstimmen würde.
Im Auswärtigen Ausschuss habe ich die Bundesregierung übrigens gefragt, wie sich ein Ende von Sophia auf Sea Guardian auswirken wird. Da gab es aber auch keine zufriedenstellenden Antworten. Man könnte also vermuten, dass Sea Guardian den Wegfall von Sophia zumindest teilweise kompensieren müsste, dass Sea Guardian zum Beispiel die Durchsetzung des Waffenembargos gegen Libyen übernehmen müsste; auch dazu habe ich heute bisher keinen Ton gehört. Schauen wir mal, wo die Reise in diesem Punkt hingeht.
Die Haushaltsplanung zeigt übrigens auch, dass die Mittel für Sea Guardian von bisher 6,3 Millionen Euro auf 2,9 Millionen Euro gekürzt werden. Das finden wir als FDP übrigens immer sehr, sehr löblich, wenn auch mal realistische Zahlen als Ansätze reingeschrieben werden. Vielleicht hat auch Herr Karl daran mitgewirkt, dass da mal ein bisschen Geld eingespart wird; das ist eine gute Sache.
Aber das zeigt mir zumindest, dass die Mission Sophia von Sea Guardian gar nicht übernommen werden könnte. Ich hoffe inständig, dass sich die Bundesregierung in dieser Frage nicht still und heimlich aus ihren Verpflichtungen gegenüber der NATO und der EU zurückziehen möchte.
Das würden wir Freien Demokraten – das hören Sie auch am Applaus meiner Fraktion – nämlich ausdrücklich missbilligen.
Wir werden dem Mandat erneut zustimmen, auch wenn die Ziele der Bundesregierung nicht eindeutig sind. Und wir mahnen ebenso eine Überprüfung des militärischen Einsatzes an.
Vielen Dank.
Das Wort hat der Kollege Matthias Höhn für die Fraktion Die Linke.
