Aber, liebe Kolleginnen und Kollegen, ich verstehe durchaus die Debatte dahinter. Sie ist wichtig; denn sie beschäftigt sich mit den Entwicklungen nach der Wiedervereinigung. Ich selbst bin 1987 in Gera in Ostthüringen geboren. Ich wuchs als Wendekind quasi mitten in der Transformationsphase auf. Für mich war es leicht, mich den Gegebenheiten anzupassen, weil ich ja nichts anderes kannte. Allerdings ging es meinen Eltern und denen meiner Freunde und Schulkameradinnen anders, und das prägte auch meine Erziehung. Mit der Wende brachen so manche Biografien und auch Karrieren. Wer zum Zeitpunkt des Mauerfalls als Ostdeutscher im Berufsleben war, wird durchaus gespürt haben, Ossi zu sein und vielleicht einen Wessi vor die Nase gesetzt bekommen zu haben. Nach Kompetenz wurde damals nicht gefragt. Diese Demütigungen wurden nicht vergessen.
Die Erfahrung von 30 Jahren Wandel ist vielen Westdeutschen fremd. Deshalb ist es endlich an der Zeit, die Erfahrungen der Ostdeutschen nach der Wende gesamtdeutsch zu diskutieren und so auch endlich ein gemeinsames Geschichtsbewusstsein zu entwickeln.
Dann würden Westdeutsche den Unmut ihrer ostdeutschen Mitbürgerinnen und Mitbürger über fehlende Repräsentanz in Führungsetagen sicher besser nachvollziehen und verstehen können. Mit besserem Verständnis füreinander wird es vielleicht endlich gelingen, die mentale Trennung zwischen Ost und West zu überwinden; denn sonst holt uns die Quotenfrage wieder ein.
Liebe Kolleginnen und Kollegen, die heutige Debatte zeigt, dass es nicht zu spät ist für entschlossenes Handeln. Der anstehende Generationenwechsel in ostdeutschen Führungsetagen muss unbedingt genutzt werden, um Ostdeutsche besser zu repräsentieren. Es ist eine berechtigte Forderung der Menschen zwischen Warnemünde und Hildburghausen, auch von Menschen vertreten zu werden, die eine ähnliche Lebenserfahrung haben. Die SPD-Bundestagsfraktion fordert deshalb, im „Jahresbericht der Bundesregierung zum Stand der Deutschen Einheit“ detaillierter über die Fortschritte institutioneller Repräsentanz von Ostdeutschen zu berichten und Veränderungen aufzuzeigen. Damit hier ein positiver Trend sichtbar wird, bedarf es handfester Maßnahmen, um die Beteiligung von Ostdeutschen in Spitzpositionen zu erhöhen.
Zu den zentralen Punkten gehört für uns Sozialdemokraten natürlich auch die verstärkte Ansiedelung von Bundesbehörden und Forschungseinrichtungen in Ostdeutschland, da, wo es Sinn macht. Aber auch bei der Berufung in hohe öffentliche Ämter muss eine stärkere Berücksichtigung Ostdeutscher zügig sichtbar werden. Die Herstellung gleichwertiger Lebensverhältnisse ist eine Aufgabe für das Hier und Jetzt. Die zahlreichen Studien zeigen, dass der Osten in der wirtschaftlichen Entwicklung weiterhin besonderer Förderung bedarf; denn nach der Wende verlor Ostdeutschland dauerhaft seine industrielle Entwicklungsbasis. Aber Digitalisierung und künstliche Intelligenz bieten ja auch Chancen. Warum nicht Ostdeutschland zur Modellregion für Digitalisierung machen? Warum nicht ein Drohnenzentrum am Flughafen Altenburg entwickeln? Das ist nur ein Beispiel.
Lassen Sie mich noch eines sagen: Neben den nötigen politischen und wirtschaftlichen Maßnahmen kann auch jeder und jede selbst etwas dazu beitragen, als Ostdeutsche erfolgreich im geeinten Deutschland aufzutreten. Dazu gehören Selbstbewusstsein in Bezug auf die eigene Identität, Leistung und das Zutrauen zu den Aufgaben, die vor uns liegen. Ich bin mir sicher: Wir können das.
Vielen Dank.
Für die FDP-Fraktion spricht nun Linda Teuteberg.
