Wie das dann nachher abgeglichen werden soll mit dem Fahrzeugregister, das können Sie nicht beantworten.
Das ist ein Problem, das für unheimlich viel Bürokratie und Gerichtsverfahren sorgen wird, genauso wie das ungelöste Problem, dass die ausländischen Fahrzeuge nicht erfasst werden und nicht abgeglichen werden können. Das heißt: Wer ein deutsches Fahrzeug hat und es im Ausland zulässt, wird nicht erfasst. Am Ende des Tages ist völlig klar: Sie sorgen damit für unheimlich viele Gerichtsverfahren. Das ist ein Arbeitsbeschaffungsprogramm für überlastete Gerichte. Das Gesetz ist also völlig unnötig und müsste eingestampft werden.
Die Frage der Kosten bleibt von Ihnen völlig unbeantwortet. Wir wollten in einer Kleinen Anfrage wissen, wie das mit den Geräten gehen soll. Auch der Deutsche Städtetag hat das thematisiert. Das bleibt offen. Auch die Frage der Softwarekombination ist weiterhin ungelöst.
Klar ist nur: Die Kommunen wollen das nicht, die Länder wollen das nicht. Das Ganze wird nicht nur Gerätekosten auslösen, sondern vor allem auch den Einsatz von unheimlich viel Personal bei den Kommunen erfordern, die am Ende des Tages das Ganze abgleichen müssen. Ich glaube, die Kommunen haben anderes zu tun, als dieses schwachsinnige Gesetz zu untersuchen.
Der entscheidende Aspekt ist: Dieses Gesetz ist nicht verhältnismäßig. Wegen einer Ordnungswidrigkeit mit einem Bußgeld in Höhe von 20 bzw. 80 Euro werden jetzt alle Autofahrer überwacht.
Das passt nicht zusammen, lieber Kollege Klare. Ihr Vergleich mit der Geschwindigkeitsüberwachung, den Sie eben gezogen haben, greift nicht, weil da ja nur der geblitzt wird, der zu schnell fährt. Wenn Sie hier alle Autofahrer erfassen und deren Daten abgleichen, ist das ein Eingriff in das Grundrecht auf informationelle Selbstbestimmung. Deswegen ist dieses Gesetz hochbedenklich. Der Bundesrat hat es abgelehnt, und ich bin der festen Überzeugung: Vor Gericht wird es hier Probleme geben, ähnlich wie bei Section Control in Niedersachsen, die die Liberalen bekämpft und fürs Erste erfolgreich gestoppt haben. Auch dieses Gesetz wird so nicht funktionieren. Minister Scheuer ist nicht nur der Fahrverbotsminister, sondern er ist mit diesem unnötigen Gesetz, das dringend gestoppt werden muss, auch der Autofahrerüberwachungsminister.
Vielen Dank, Herr Kollege Luksic. – Als nächster Redner hat das Wort der Kollege Andreas Wagner, Fraktion Die Linke.
