Zur AfD. Wie so häufig bei der AfD, ist sie zu spät und auch ein kleines bisschen hinterher. Zur Faktenlage: Seit den Beschlüssen – die vorhin schon angesprochen wurden – von 1992 besteht in der Tat der Auftrag an uns in der Politik, Bundesbehörden und -einrichtungen fair und vor allem vorrangig in den neuen Bundesländern anzusiedeln.
Nachdem man eine große Verwaltungs- und Behördenreform Anfang der 90er-Jahre auf den Weg gebracht hatte, hat man genau diesen zweiten Passus, nämlich auch künftig Verwaltungsbehörden und Bundesbeschäftigte vorrangig in den neuen Bundesländern anzusiedeln, häufig vergessen – um es freundlich zu formulieren. Ich will deswegen ganz klar sagen: Es gab durchaus Fehler in diesem Bereich. Ich will auch sagen, dass wir Nachholbedarf haben in diesem Bereich.
Aber zur Wahrheit gehört doch, dass gerade diese Bundesregierung in dem einen Jahr, wo sie jetzt im Amt ist, mehr auf den Weg gebracht hat
als vielleicht in den letzten zwanzig Jahren. Schauen Sie sich einmal an, wie viele Neuansiedelungen im letzten Jahr von der Bundesregierung organisiert wurden – um es beispielhaft zu nennen –: das Fernstraßen-Bundesamt in Leipzig; das Kompetenzzentrum Wald und Holz in Mecklenburg-Vorpommern; die Bildung eines weiteren Strafsenats des Bundesgerichtshofes in Leipzig; die Entscheidung zur Ansiedelung der Agentur für Disruptive Innovationen in der Cybersicherheit im Raum Halle-Leipzig; ein Ausbildungszentrum für den Zoll. Und wie Bundesminister Heil es vor wenigen Tagen vorgestellt hat: Alle fünf Zukunftszentren zur Bewältigung der digitalen Transformation sind in den neuen Bundesländern angesiedelt oder jedenfalls auf den Weg gebracht.
Ich möchte ausdrücklich allen Ministern danken, die daran mitgewirkt haben, und ich bin optimistisch, dass wir genau diesen Weg in den nächsten drei Jahren dieser Regierung fortsetzen werden
und dass weitere Behörden im Osten angesiedelt werden. Damit eröffnet sich nämlich für die Bürger in den neuen Bundesländern die Chance, durch die neugeschaffenen Stellen einen Job bei einer Bundesbehörde in ihrer Heimat zu finden.
Die möglichst vielfältige Präsenz des Staates mit Einrichtungen ist natürlich auch eine Voraussetzung dafür, dass Bürger Vertrauen in den Staat haben, weil der Staat einfach wahrnehmbar ist. Wenn einige Bundesländer die Dezentralisierung selbst nicht so ernst nehmen, dann ist es, glaube ich, wohlfeil, immer nur auf den Bund zu schauen und zu meinen, er solle alles regeln und organisieren. Ich glaube, hier gibt es eine gemeinsame Verantwortung von Bund und Ländern.
Mag sich die Quote am Anfang noch als Balsam für manche Ohren im Osten anhören, entpuppt sie sich doch bei genauerem Hinsehen eher als ein Bärendienst. Der Zweck beider hier zu debattierenden Anträge ist doch nichts anderes, als einen Budenzauber zu veranstalten, in der Hoffnung, dass der arme Ossi von seiner eigenen Opferrolle überzeugt wird, was am Ende natürlich nur Herr Gysi, Frau Wagenknecht oder vielleicht Frau Weidel können. Ich glaube, das ist der falsche Weg, insbesondere wenn wir über Symbolik reden.
Meine sehr geehrten Damen und Herren, ganz herzlichen Dank für Ihre Aufmerksamkeit.
Das Wort hat der Abgeordnete Dr. Anton Friesen für die AfD-Fraktion.
