Herr Präsident! Sehr geehrte Abgeordnete! Wenn Zehntausende Schüler auf die Straße gehen, um sich mit all ihrem jugendlichen Idealismus für eine gute Sache einzusetzen, dann muss einem eigentlich das Herz aufgehen – und ich meine das ganz ironiefrei –, besonders dann, wenn es um nicht weniger geht als die Rettung der Welt vor den Folgen der Profitgier und Verstocktheit der Erwachsenen. Im Fall der Fridays-for-Future-Proteste, die heute wieder hier in Berlin und andernorts stattgefunden haben, hat das allerdings ein arges Geschmäckle, wie man im Schwäbischen sagt, und nicht nur, weil auf einigen Transparenten stand: Ich wäre nicht hier, wenn Samstag wäre.
Von Bekannten weiß ich, wie das an Schulen abläuft: Der Vater eines Schülers ruft im Elternchat dazu auf, die Klasse seines Sohnes soll doch für die Proteste freigestellt werden. Es wird Druck auf die Lehrer und die Schulleitung ausgeübt, das Schulschwänzen zum guten Zweck der Klimarettung zu legitimieren. Lehrer, Eltern und Schüler, die sich widersetzen,
werden isoliert und an den moralischen Pranger gestellt, obwohl sie nichts anderes tun wollen, als Regeln und Gesetze einzuhalten.
Aber das ist ja kein Wunder in einem Land, wo sich die Kanzlerin höchstselbst hinstellt, diesen Menschen in den Rücken fällt und sagt:
Ich unterstütze sehr, dass Schülerinnen und Schüler für den Klimaschutz auf die Straße gehen und dafür kämpfen.
So erklärte sie es in ihrer opportunistischen Art in einer Videobotschaft. Meine Damen und Herren, so wird die Herrschaft es Unrechts im Namen einer gefühligen Hypermoral schon den Schulkindern eingeimpft.
Katarina Barley, SPD, setzt noch einen drauf. Sie meint, das allwöchentliche Schulschwänzen verdiene „hohen Respekt“. Wer so eine Justizministerin hat, braucht keine Rechtsbrecher mehr, meine Damen und Herren.
Schauen wir uns einmal die Gallionsfigur der Fridays-for-Future-Proteste, die 16-jährige Schwedin Greta Thunberg, näher an. Noch vor kurzem haben wir ja aus einer Broschüre der Amadeu-Antonio-Stiftung gelernt, vor Mädchen mit blonden Zöpfen müsse man sich in Acht nehmen, dahinter stecke meistens ein extremistisches Elternhaus.
Im Fall von Klima-Greta ist diese Warnung natürlich vergessen; denn es geht ja um die allerbeste Sache. Dabei wäre es gerade hier wichtig, genauer auf Hintermänner und ‑frauen zu schauen; denn es glaubt wohl kein Mensch hier im Saal, dass dieser unglaubliche Medienhype ohne geschäftstüchtige Eltern – Vater Svante ist nicht zufällig ein Drehbuchschreiber und Manager –, ohne findige NGOs und die mächtige Klimalobby möglich wäre. Das Mädchen mit dem Habitus einer 12-Jährigen wurde in Schweden schon zur „Frau des Jahres“ gewählt, jetzt wurde sie auch noch für den Friedensnobelpreis vorgeschlagen.
Das Ganze nimmt wahnhafte hysterische Züge an.
Im Grunde wird hier ein Kind in einer professionell inszenierten Kampagne missbraucht, in der es um Macht und sehr viel Geld geht – das ist die Wahrheit, meine Damen und Herren –,
und zwar auch noch ein krankes Kind; denn es ist bekannt, dass Greta Thunberg am Asperger-Syndrom,
