Ja, wir wollen auch die Verlängerung des Arbeitslosengeldbezuges. Gerade und vor allen Dingen dann, wenn man an Qualifizierungsmaßnahmen teilnimmt, sich also fort- und weiterbildet, darf es nicht damit enden, dass man nach Abschluss der Maßnahme in den Bezug von Langzeitarbeitslosengeld fällt. Deshalb ist es richtig, über die ALG‑I-Bezugsdauer zu diskutieren. Und wie können wir hier die Leute motivieren, in Qualifizierungsmaßnahmen zu gehen, und sie nicht demotivieren, indem wir für den Anschluss keine vernünftige Vorgabe machen?
Und ja, wir wollen einen anderen Schutz bei der Wohnung und auch beim Vermögen. Ja, wir wollen, dass der Schutzgedanke, der die Menschen heute so sehr belastet, von uns aus einem anderen Blickwinkel bearbeitet wird. Und ja, wir wollen den Wegfall unwürdiger Sanktionen; das ist doch selbstverständlich.
Wir wissen alle, dass selbst diejenigen, die das heute noch nicht so sehen, das schon in wenigen Monaten mit uns gemeinsam an dieser Stelle umsetzen werden.
Und ja, wenn wir eine Reform beim Wohngeld machen, ist das richtig. Und ja, wenn wir die Kindergrundsicherung umsetzen, ist das richtig. Das brauchen wir und werden es auch vorantreiben.
Und ja, wir wollen Hilfe aus einer Hand, um nicht mehr von Pontius zu Pilatus geschickt zu werden, sondern eine vernünftige, gute Aufstellung darüber zu bekommen, wie man die Leistungen, auf die man Anspruch hat, gut und sicher erhält.
Und ja, wir wollen eine Grundrente, die ihren Namen verdient, in der Rentenversicherung,
