Sehr geehrter Herr Präsident! Liebe Kolleginnen und Kollegen! In zweiter und dritter Lesung beraten wir den Gesetzentwurf der Bundesregierung zu den Übergangsregelungen im sozialen Bereich, falls es zum harten Brexit kommen sollte. Mit diesem Gesetz schaffen wir Rechtssicherheit und eine angemessene Absicherung bei Krankheit, Pflegebedürftigkeit, Arbeitslosigkeit und in weiteren Bereichen.
Seit der ersten Lesung dieses Gesetzentwurfes sind drei Wochen vergangen. Es sieht nicht so aus, dass es eine Einigung zwischen der EU und Großbritannien geben wird. Deshalb ist es richtig und wichtig, dass die Bundesregierung diesen Gesetzentwurf frühzeitig eingebracht hat. Das, meine sehr geehrten Damen und Herren, ist verantwortungsvolle Politik.
Hier geht es, liebe Kollegen, um 400 000 Menschen, um 400 000 individuelle Geschichten und Lebensentwürfe, die sich in einem geeinten Europa nicht mit nationalen Landesgrenzen befasst haben, für die der Austausch zwischen den Nationen und der europäische Alltag Lebensalltag geworden ist. Für diese Menschen schaffen wir mit diesem Gesetz Rechtssicherheit.
Eines, meine sehr geehrten Damen und Herren, wird bei der Brexit-Debatte deutlich: die Stärke der Europäischen Union,
die Stärke des einheitlichen Binnenmarktes und die Kraft der Koordinierung der Systeme der sozialen Sicherheit. Die geschaffene Freiheit ist die Stärke der EU. Herr Kleinwächter, es geht nicht um den Gegensatz von Freiheit und Selbstbestimmung, sondern es geht um die Kraft, die die Europäische Union in den letzten Jahrzehnten entwickelt hat.
Es geht vor allem um ein Grundprinzip der Europäischen Union, das Sie vielleicht vergessen haben: die Subsidiarität. Jede Ebene muss in ihrem Bereich regeln, was sie regeln kann. Man sieht bei der Brexit-Debatte genau, wie schwierig es ist, Dinge, die über Jahrzehnte zusammengewachsen sind, auseinanderzureißen. Diese Kraft, meine sehr geehrten Damen und Herren, liebe Kolleginnen und Kollegen, müssen wir in der Europäischen Union zurückgewinnen, um diese in den nächsten Monaten nicht den Populisten zu überlassen.
– Die Subsidiarität funktioniert sehr wohl, sehr geehrter Herr Kleinwächter; das sehen wir sehr gut. Es geht um die grenzüberschreitenden Dinge: um grenzüberschreitendes Leben und um grenzüberschreitendes Handeln. Das ist ein wesentlicher Bereich, den man auf die europäische Ebene übertragen hat bzw. weiter übertragen muss.
Sollte es zum Brexit kommen, meine sehr geehrten Damen und Herren, stärken diese Übergangsregelungen und auch die Debatten, die wir heute in diesem Haus führen, den europäischen Gedanken.
Herr Kleinwächter, es geht nicht um ein Chaosgesetz. Wir reden über das genaue Gegenteil. Sie haben gesagt: Der Kommissionsvorschlag ist besser. – Wenn Sie am Montag in der Anhörung der Experten besser aufgepasst hätten, wüssten Sie: Die sagen genau das Gegenteil. Unser Gesetzentwurf ist besser, weil er klarer regelt und den Menschen mehr Sicherheit gibt. – Das ist doch die Aufgabe, die wir haben: Wir müssen den Menschen, die ganz konkret betroffen sind, die in den letzten Jahren in Großbritannien gearbeitet und Ansprüche erworben haben, Sicherheit geben.
Hier geht es um den Einzelnen und nicht um Populismus.
Hier geht es nicht um Chaos, sondern um Vertrauen und um Rechtssicherheit. Das ist unsere Aufgabe in diesem Hohen Haus. Daran haben wir aus meiner Sicht sehr verlässlich gearbeitet.
– Ich habe sehr wohl zugehört, Herr Kleinwächter.
