Meine sehr verehrten Damen und Herren, ich möchte an dieser Stelle eines sagen: Was wir nicht machen sollten, ist, Kohleindustrie, Klimawandel und Atomausstieg auf einmal gegeneinander ausspielen zu wollen. Das wollen wir nicht.
Leider gibt es die ersten Vertreter, auch in der Bundesregierung, die genau das machen, die den Kohleausstieg und den Atomausstieg gegeneinander ausspielen. Herr Altmaier hat vor kurzem getwittert, dass Finnland noch immer auf Atomkraftwerke setze und diese sogar ausbaue und deswegen aus Kohle viel früher aussteigen könne und dass das in Frankreich und Großbritannien ebenfalls der Fall sei. Davor warnt die SPD. Wir dürfen nicht Atomausstieg und Kohleausstieg gegeneinander ausspielen. Wir machen das, wie das Klößeessen, nacheinander:
Bis 2022 steigen wir aus der Atomkraft aus, bis 2038 aus der Kohlekraft. Beides geht und beides funktioniert.
Gleichzeitig erhalten wir gute und hochqualifizierte Arbeitsplätze in Deutschland, weil durch erneuerbare Energien Arbeitsplätze und Wertschöpfung in den Regionen geschaffen werden. Das ist gut für unser Land und gut für die Umwelt.
Lassen Sie mich am Schluss eines deutlich sagen: Die beste Werbung im Ausland gegen Atomkraft ist, dass wir die Energiewende erfolgreich hinbekommen. Wenn wir das schaffen, wenn wir da gemeinsam an einem Strang ziehen, wenn das unser Erfolgsprojekt ist, dann kann die Energiewende Made in Deutschland ein Exportschlager sein, wovon andere Länder profitieren, die dann ebenfalls aus der Atomkraft aussteigen. Davon bin ich überzeugt.
Daran arbeitet die SPD mit all ihrer Kraft.
Ich danke Ihnen.
Vielen Dank. – Weitere Wortmeldungen liegen nicht vor. Ich schließe die Aussprache.
Wir kommen zu den Abstimmungen. Interfraktionell wird Überweisung der Vorlagen auf den Drucksachen 19/8284 und 19/8271 an die in der Tagesordnung aufgeführten Ausschüsse vorgeschlagen. Sind Sie damit einverstanden? – Dann ist die Überweisung so beschlossen.
