Herr Präsident! Liebe Kolleginnen und Kollegen! Ja, wir beschließen heute ein Übergangsgesetz. In der Tat hoffe auch ich, dass wir es nicht brauchen; ich habe bereits in der ersten Lesung darauf hingewiesen. Der Grund für die Notwendigkeit eines Gesetzes ist, dass sich bis heute an den Umständen nichts geändert hat. Das britische Parlament ist mit Blick auf die nordirische Grenzgestaltung nach wie vor hoch zerstritten. Am Ende wird dies die Schlüsselfrage sein, die schuld daran sein kann, dass Großbritannien dem Abkommen über den Austritt, das es mit der EU ausgehandelt hat, nicht zustimmen wird. Im Falle eines solchen No-Deal-Szenarios werden die sozialen Sicherungssysteme abrupt enden, und deswegen müssen wir für den Notfall vorsorgen.
Die SPD hat immer den Standpunkt vertreten, dass die Streitigkeiten des britischen Parlaments eben nicht auf dem Rücken der Bürgerinnen und Bürger ausgetragen werden dürfen. Es sind immerhin zwischen 300 000 und 400 000 Menschen betroffen. Ich danke deshalb auch sehr Bundesarbeitsminister Hubertus Heil, dass er schnell diesen Entwurf eines solchen Notgesetzes vorgelegt hat; denn – ja – wir schaffen damit Rechtssicherheit. Ich will das an drei Beispielen verdeutlichen.
Erstens. Wir sichern die Rentenansprüche, und wir sorgen dafür, dass Rentenleistungen weiterhin ausbezahlt werden.
Zweitens. Wir sichern Ausbildungsförderungen für junge Menschen, die zum Zeitpunkt des Brexits in Großbritannien eine Ausbildung oder ein Studium begonnen haben.
Und drittens. Wir sichern Krankenversicherungsleistungen und ‑beiträge, wenn die Menschen dies wünschen, innerhalb einer Frist von drei Monaten.
Die Fraktion Bündnis 90/Die Grünen hat beantragt, dass wir hier eine Frist von sechs Monaten gewähren; aber ich empfehle Ihnen, das noch einmal zu überdenken. Denn Sie müssen wissen: Der Brexit, sobald er vollzogen ist, sorgt dafür, dass keine Krankenversicherung mehr besteht. Wenn sich die Menschen Zeit lassen, das anzuzeigen, sind sie sechs Monate ohne Krankenversicherungsschutz unterwegs. Ich finde, das ist keine Besserstellung. Sie sollten sich das ernsthaft noch einmal überlegen.
Alle Expertinnen und Experten haben in der öffentlichen Anhörung diesem Übergangsgesetz zugestimmt, weil es Rechtssicherheit schafft. Aber ich sage an dieser Stelle auch – die Beratungen haben das vor Augen geführt –: Wir können nicht für alle Fälle vorsorgen; das wurde auch eben schon gesagt. Das ist so. Wir können beispielsweise nicht regeln, dass Dokumentationspflichten in Großbritannien weiterhin fortgeführt werden; das wäre wichtig mit Blick auf Arbeitsschutz und Gesundheitsschutz. Aber es ist nun mal, wie es ist. Wir können dafür nicht vorsorgen; da haben die Kollegen vom DGB in ihrer Stellungnahme recht.
Das zeigt jedoch auch eines, Kolleginnen und Kollegen: Die EU-weiten Regelungen bieten den Menschen viele Vorteile;
das wird uns doch in diesen Tagen an vielen Kleinigkeiten immer wieder bewusst. Und wenige Wochen vor der Europawahl wünsche ich mir sehr, dass dieser Brexit den Menschen in der Europäischen Union eines vor Augen führt: wie wichtig diese Europäische Union für die Menschen ist, welchen Wert und welche Bedeutung sie hat.
Zu diesen Forderungen, die ich immer wieder von ganz rechts außen höre, Deutschland hätte mit Großbritannien bilateral ein Abkommen schließen sollen, weil dies den Menschen Vorteile bringen würde,
sage ich Ihnen ganz ehrlich: Das ist nichts weiter als ein ideologisch motivierter Täuschungsversuch.
