Frau Präsidentin! Liebe Kolleginnen und Kollegen! Als genau vor 100 Jahren Marie Juchacz, eine tapfere Sozialdemokratin, als erste Frau eine Rede in der Weimarer Nationalversammlung hielt, löste das laut Protokoll Heiterkeit aus. Heute, 100 Jahre später, reden wir über feministische Außenpolitik, und wieder gibt es diese Heiterkeit.
– Ihr Männer dort drüben seid wirklich sehr, sehr berechenbar; aber es ist nicht klug.
Heiterkeit kann etwas Schönes sein – ich bin gerne dabei –; aber es gibt auch eine abschätzige Heiterkeit. Wir Frauen kennen das. Hinter dieser Heiterkeit verbirgt sich die Frage vieler – nicht aller – Männer, die ich in den letzten Tagen häufig gehört habe: „Was soll das denn jetzt?“ oder: „Habt ihr keine anderen Probleme?“ oder: „Wie albern ist das denn?“.
Übrigens ist diese Heiterkeit nicht selten der Humus für Chauvi-Witze, und davon haben wir Frauen genug!
Was bedeutet nun „feministische Außenpolitik“?
Sie bedeutet erstens die aktive Teilhabe von Frauen an der Außen- und Sicherheitspolitik.
Die Außenpolitik muss weiblicher werden.
Zu den Grünen, die den Antrag gestellt haben: Ihr habt leider keine einzige Frau als ordentliches Mitglied im Auswärtigen Ausschuss.
Das kann auch noch besser werden. So viel zur feministischen Außenpolitik.
