und wir wollen auch nicht, dass irgendwas nach unten gefahren wird. Aber auf der anderen Seite wollen wir kontrollieren, wer zu uns kommt; wir wollen das wissen. Und wir müssen notfalls auch die Möglichkeit haben, Leute, die hier nichts zu suchen haben, auch schon an der Grenze zurückzuweisen.
Das ist die klare Erklärung und das Signal des Werkstattgesprächs: Wir brauchen eine intelligente, flexible und der Lage angepasste Grenzüberwachung, die – nur als letztes Mittel – auch die Zurückweisung an der Grenze vorsieht.
Der Staat muss seine rechtlichen Möglichkeiten nutzen, die wir heute gesetzlich auch schon haben, um einer derart unkontrollierten Zuwanderung – 2015 und 2016 kamen teilweise 10 000 Menschen am Tag – entgegenzuwirken.
Meine Damen und Herren, erlauben Sie mir abschließend eine Anmerkung. Sie kennen ja Armin Schuster. Sie wissen, viele Innenpolitiker der Union arbeiten seit Jahren konstruktiv und kritisch an dem Thema. Und wenn diese Politiker begeistert sind, nicht nur vom Format, sondern auch von dem Ergebnis, das auf dem Tisch liegt, dann muss ich Ihnen sagen: Die CDU befindet sich auf einem guten Weg. Und wir haben es verdient, dass der Wähler uns das demnächst auch honoriert.
Vielen Dank.
Für die Fraktion der FDP hat das Wort die Kollegin Linda Teuteberg.
