Werter Herr Präsident! Sehr geehrte Kolleginnen und Kollegen! Nicht alles, was gedruckt steht, ist wahr. Diesen Leitsatz geben wir unseren Kindern oft mit auf den Weg, und gerade in Zeiten der Relotius-Affäre beim „Spiegel“ müssen wir feststellen: Fake News sind nicht eine Domäne der sogenannten alternativen Medien, sondern sind auch im Herzen der sogenannten Qualitätsmedien vorhanden.
Das ist insbesondere deswegen wichtig, weil sich die Aktuelle Stunde, die die Grünen beantragt haben, eben auch auf Recherchen des „Spiegel“ stützt. In heutigen Zeiten müssen wir eben alles hinterfragen.
Wenn die Recherchen zutreffend sind – da hätte ich mir, ehrlich gesagt, ein eindeutiges Eingeständnis von Herrn Dr. Pfeiffer gewünscht; das kam nicht –, dann ist das kein handfester Skandal, sondern dann ist das das Eintreten des Falles, den die AfD von Anfang an gesehen hat, nämlich dass der Vertrag von Aachen, den Merkel und Macron am 22. Januar unterzeichnet haben, nicht vornehmlich der deutsch-französischen Freundschaft dient, sondern vor allem französischen Interessen, die knallhart gegen die deutschen gestellt werden.
Wir haben in den letzten Wochen eindrucksvoll gesehen, wie das aussieht: bei der Debatte um Nord Stream 2 – ich darf daran erinnern –, bei Macrons Aussage, Deutschland würde er mit atomaren Waffen nicht verteidigen. Jetzt sehen wir es eben auch in der Debatte um Rüstungsexporte.
Ich sagte es schon damals:
Die Ortswahl? Macrons Idee. Der Vertrag? Macrons Idee. Die Zielsetzung? Macrons Idee. Seine Idee einer vertieften Europäischen Union – Deutschland zahlt, Frankreich schafft an – soll mit aller Vehemenz durchgesetzt werden.
Ich sagte das hier am 17. Januar und landete damit im Faktenfinder der Tagesschau, in einem Artikel mit dem Titel „Irreführende Behauptungen“ – Qualitätsmedien eben. Nur einen Monat später zeigt sich der wahre Geist von Aachen, und er ist – Kompliment! – bei den Grünen auch schon angekommen.
Vor einem Monat wollte das in diesem Haus hier wirklich keiner glauben. CDU/CSU, FDP und Grüne warben als Erste massiv für diesen Vertrag. Die Jamaika-Möchtegern-Koalition gerierte sich als Wurmfortsatz des Sonnenkönigs.
Jetzt erkennen es die Grünen im Titel dieser Aktuellen Stunde an. Sie heißt: „Haltung der Bundesregierung zu einem vermeintlich französisch-deutschen Abkommen zur Industriekooperation“. Französisch-deutsch – es geht um französische Interessen.
Mein Respekt, dass Sie das, spät aber endlich, erkannt haben!
Aber bevor Sie sich aufregen: Worum geht es denn inhaltlich konkret? In Aachen war nämlich nicht alles eitel Sonnenschein. Vielmehr machte Macron einen Geheimvertrag zu Rüstungsexporten zur Bedingung für die Unterzeichnung des Vertrages.
Macrons hochgelobte Freundschaft und Liebe zu Deutschland war also nicht so bedingungslos, wie er uns das immer weismachen wollte.
Merkel unterschrieb dann Folgendes über den Export deutsch-französischer Rüstungsgüter:
