Aber lieber spät als nie, sage ich mal. Jetzt geht es darum, das schnell zu schaffen.
Wir haben einen besseren Schutz der Außengrenzen, wir haben auch eine neue Partnerschaft mit Afrika definiert, an deren Umsetzung wir allerdings noch viel zu arbeiten haben.
Zur Wahrheit gehört aber auch, dass wir längst nicht alles erreicht haben. Es geht jetzt um die Frage: Kann man unter den 27 Mitgliedstaaten unterschiedliche Formen der Solidarität bei dem Thema „Bekämpfung der illegalen Migration“ und bei der Einführung einer regulären, legalen Migration haben? Können Mitgliedstaaten unterschiedliche Verantwortungen übernehmen? Ich sage eindeutig: Ja. Aber ich sage auch deutlich: Es kann nicht sein, dass einzelne Mitgliedstaaten erklären, dass sie sich an einer solidarischen Verteilung von Flüchtlingen nicht – gar nicht und überhaupt nicht – beteiligen.
Es geht also um Prinzipien; aber es kann natürlich ansonsten unterschiedliche Gewichte geben.
Dann, meine Damen und Herrn, geht es um unsere Handlungsfähigkeit nach außen – ich sage ausdrücklich: in Zusammenarbeit mit der NATO und nicht anderweitig –,
und da ist die Schaffung der Ständigen Strukturierten Zusammenarbeit, PESCO, von großer Bedeutung.
– Von großer Bedeutung! – Sie wird dazu führen, dass wir eine militärische Kohärenz unter den Mitgliedstaaten der Europäischen Union erreichen, gerade auch, was die Fähigkeit im Einsatz anbelangt.
Sie wird auch dazu führen, dass wir eine Rüstungsindustrie haben und Waffensysteme haben, die nicht so vielfältig sind, wie das heute der Fall ist.
Vielmehr werden wir gemeinsame Waffensysteme für die Zukunft entwickeln. Das ist allemal effizienter und besser hinsichtlich des Mitteleinsatzes.
Meine Damen und Herren, liebe Kolleginnen und Kollegen, hier sind wir in einem Gebiet, das uns alle beschäftigt und in dem es niemandem ganz leicht fällt, die Aufgaben der Zukunft auch wirklich zu akzeptieren und vollumfänglich unseren Beitrag zu leisten.
Da geht es auf der einen Seite um die finanzielle Ausstattung; darüber ist ja ausführlich diskutiert worden. Ich bitte, dass wir nicht nur das, was wir noch nicht geschafft haben, in den Mittelpunkt stellen, sondern vielleicht auch mal das, was wir seit den Beschlüssen von Wales schon auf den Weg gebracht haben. Wir sind gestartet bei 1,18 Prozent des Bruttoinlandsprodukts. Der gestern vorgestellte Haushaltsentwurf sagt 1,37 Prozent voraus – das in Zeiten des Wachstums. Das ist ein Schritt. Man kann sagen: „Das reicht noch nicht“, aber wir sollten uns nicht selbst demotivieren. Deshalb sage ich: Das sind wichtige Schritte, die wir gemacht haben im Hinblick auf die Bundeswehr, aber auch im Hinblick auf das Vertrauen in unsere Arbeit.
Ich sage aber auch: Wir haben für 2024 mit 1,5 Prozent eine Verpflichtung bei der NATO abgegeben. Das wirkt sich natürlich auch auf die Strukturierte Zusammenarbeit in der Europäischen Union aus, die noch nicht die Erwartungen aller im Bündnis erfüllt. Aber dass wir diese abgegebene Verpflichtung nun wirklich auch einhalten, dafür stehe ich, und dafür steht auch die Bundesregierung, meine Damen und Herren.
Das wird uns Kraft abverlangen.
