Ich mache aber gleich darauf aufmerksam: Das ist die letzte, die ich während Ihres Beitrages zulasse.
Danke, dass Sie die Zwischenfrage zulassen. – Seit 15 Jahren besteht unser Technologie- und Gründerzen­trum Halle mit seinem Förderkreis. Der Förderkreis hat diese 15 Jahre unlängst gefeiert. Da hat der ehemalige Ministerpräsident, seines Zeichens CDU ursprünglich, einen Vortrag gehalten. Insbesondere hat er darauf hingewiesen, dass im Osten nur 29 Prozent aller Beschäftigten nach der Wende in ihrem Beruf bleiben konnten. Das heißt, für alle anderen hat sich das Leben grundsätzlich geändert. Das ist eine prägende Erfahrung.
Meinen Sie nicht, dass es angesichts der gegenwärtigen Diskussion schon der Erwähnung wert wäre, dass es ein Spezifikum des Ostens ist, so etwas erlebt zu haben, und dass Ostdeutsche sich in vielen politischen Entscheidungen gedemütigt gefühlt haben? In vielen Entscheidungen sind eben genau nicht in ostdeutschen Ländern die Schwerpunkte gesetzt worden. Ich wollte nur einmal darauf hinweisen – falls Ihnen als jüngerem Menschen das noch nicht so zu Ohren gekommen ist.
Frau Kollegin Sitte, man muss ein bisschen weiter zurückblicken, vielleicht bis vor 1990, und sich überlegen, warum wir diesen erheblichen Bruch in den Erwerbsbiografien und auch in der Wirtschaft in den neuen Bundesländern hatten. Das lag doch daran, dass wir eine völlig marode DDR-Kombinatswirtschaft hatten, die von Ihrer Vorgängerpartei, Frau Kollegin Sitte, der SED, zu verantworten ist.
Und jetzt kommen Sie, diejenigen, die früher die Hütte angezündet haben, und sagen: Die Feuerwehr ist zu langsam. – Also, das ist, glaube ich, der falsche Weg. Ich glaube, Frau Kollegin Sitte, Sie bewegen sich in der falschen Richtung.
Ich habe es gerade schon einmal gesagt: Wir müssen doch dahin kommen, dass wir 30 Jahre nach der deutschen Einheit die tatsächlichen Probleme aufgreifen, dass wir uns darum kümmern, wo es besondere Benachteiligungen gibt. Aber wenn es um konkrete Dinge geht, dann muss man das auch bis zum Ende durchdeklinieren. Schauen Sie sich die konkrete Situation an: Was wäre, wenn Sie zum Beispiel in der Justiz das tatsächlich durchführen würden, sagen: „Ich vertrete spezifische ostdeutsche Interessen“?
Heißt das dann, dass ein ostdeutscher Richter im Streit zwischen einem Ostdeutschen und einem Westdeutschen sagen müsste: „Aufgrund meiner ostdeutschen Prägung habe ich jetzt natürlich eine besondere Präferenz für den Ostdeutschen“? Das kann doch nicht sein. Ein Richter muss natürlich nach Recht und Gesetz, unabhängig und frei entscheiden.
Um noch einmal den Altbundespräsidenten Gauck zu zitieren: Geht’s noch?
