So entstehen hier Informationen, die die Basis Ihrer Überlegungen sind.
Jetzt kommt der Minister Scholz in den Ausschuss. Wenn er kommt, ist er ja persönlich da; denn unpersönlich kann er ja nicht kommen. Er ist also persönlich da; man kann ihn fragen. Dann wird er gefragt und sagt: Wir haben Beobachterstatus. – Und er sagt weiter: Das ist für uns eine reine Finanzanlage. – Der Kauf von 15,6 Prozent der Commerzbank hat in der Entscheidungskompetenz nicht unmittelbar mit diesem Minister zu tun. Die persönliche Information wird jedenfalls in Misskredit gezogen, aber die selbstreferenzielle Scheininformation von Herrn Schäffler wird hier sozusagen zur Wahrheit hochstilisiert. Wenn das öffentliche Informationspolitik und Ausdruck von Vertrauen in einen Minister sein sollen, dann weiß ich nicht, wo wir sind, wenn es um das Stichwort „Glaubhaftigkeit“ geht.
Florian Toncar hat gesagt: Wenn die Fusion schiefgeht, dann ist das der maximale Schaden für die Steuerzahlerinnen und Steuerzahler. – Es kann sein, dass das der maximale Schaden ist. Aber das wissen Sie ja gar nicht. Sie haben auch nicht gezeigt, wieso das so sein soll und wieso überhaupt das Bail-in-fähige Kapital und das Eigenkapital nicht ausreichen würden, damit dies am Steuerzahler gar nicht hängen bleibt. Was Sie ganz vergessen haben, ist eine zehnjährige europäische Sicherheitspolitik, um genau das von den Steuerzahlern abzuwenden.
Ich glaube, wer so viel vergisst, der darf hier den Mund nicht zu voll nehmen.
Eine Gegenthese. Wenn etwas ohne Fusion schiefgeht, dann kann auch das ein maximaler Schaden sein. Eine Fusion ist weder hinreichend noch notwendig für Ihre These.
Lisa Paus hat etwas Gutes gesagt: Wir brauchen kein weiteres Milliardengrab in Deutschland. – Dem stimmen wir alle unumwunden, hundertprozentig zu.
Wir brauchen kein weiteres Milliardengrab.
