Frau Präsidentin! Liebe Kolleginnen und Kollegen! Zu Beginn der Legislaturperiode wollte uns die AfD ja noch jagen. Jetzt sehen wir an einem Gesetzentwurf, dass Sie sich große Sorgen um unsere parteiinternen Verfahren machen. Es ist wirklich schon rührend, dass Sie sich so sehr um uns kümmern.
Genauso rührend ist, dass Sie sich jetzt große Sorgen um die Gleichberechtigung zwischen Mann und Frau im Wahlrecht machen, und bemerkenswert ist, dass Sie angesichts eines Frauenanteils von 11 Prozent in der eigenen Fraktion als größtes Problem in diesem Feld die angeblich zu große Benachteiligung von Männern ausmachen. Das ist schon eine interessante Schwerpunktsetzung; das muss man sagen.
Liebe Kolleginnen und Kollegen, ich will aber ganz im Ernst sagen: In der Debatte und auch in den Punkten, die die AfD vorgebracht hat, sind auch richtige Punkte enthalten. Denn – das will ich ganz klar sagen – eine verpflichtende Quote im Wahlrecht, im Bundestagswahlrecht ist sicherlich nicht das erste Instrument der Wahl, um die politische Beteiligung von Frauen zu steigern.
Ich halte es sogar für falsch und für respektlos gegenüber den Frauen, die wir haben. Das ist gar nicht nötig.
Mit Blick auf das Brandenburger Paritätsgesetz, das hier mehrfach angesprochen wurde und nach dem Listenplätze zwangsweise alternierend an Männer und Frauen vergeben werden sollen, kann ich nur sagen: Das ist an verfassungsrechtlicher Dummheit kaum mehr zu überbieten.
Die Verfassungswidrigkeit ist diesem Brandenburger Paritätsgesetz auf die Stirn geschrieben,
