Ja, er kann ruhig die Frage stellen.
Vielen Dank, Frau Kollegin, dass Sie die Zwischenfrage zulassen. – Ich wollte nur höflich darauf aufmerksam machen, dass mit dem Begriff „Gender-Gaga“ auch noch ganz andere Dinge gemeint waren,
zum Beispiel der Wahnsinn, der bezüglich der Verunstaltung unserer deutschen Sprache betrieben wird, und Ähnliches. Gender-Gaga bezog sich also nicht unbedingt auf das, was Sie fälschlicherweise, wie ich glaube, darunter verstanden haben.
Wir sollten uns insofern einig sein, dass einiges von dem, was Sie gerade gesagt haben, durchaus mit dem übereinstimmt, was ich vorher auch benannt habe. Manchmal sind wir so weit gar nicht auseinander.
Ich nehme zur Kenntnis, dass Sie diesen Ausdruck in einem anderen Zusammenhang benutzt haben.
Dann gibt es dazu auch nichts mehr zu sagen.
Der erste Punkt ist leider wirklich die Wahl der Tätigkeit. Natürlich kann man sagen: Alle Frauen sollen in die technischen Berufe; alle Frauen sollen in die freie Wirtschaft. – Viele gehen übrigens auch zum Staat, weil sie einen sicheren Job wollen. Ich habe das selbst so gemacht. Ich habe auf viel Gehalt verzichtet, weil ich nicht in eine internationale Großkanzlei gegangen bin, sondern lieber Richterin geworden bin und mich für die Vereinbarung von Familie und Beruf entschieden habe. Deshalb ist es auch wichtig, die Jobs beim Staat und im sozialen Bereich aufzuwerten. Ich freue mich, dass die Ministerin, die leider nicht mehr da ist, das erkennt. Ich habe es gar nicht schlecht gefunden, dass wir diese doch erheblichen Tariferhöhungen für die Beschäftigten im öffentlichen Dienst haben. Wir brauchen uns nicht wundern, dass wir diese Differenz haben, wenn in der Industrie ganz anders bezahlt wird als im öffentlichen Bereich oder im sozialen Bereich. Auch wenn das natürlich für die Haushalte langfristig sehr belastend ist – der Ecki Rehberg schaut mich schon grimmig an –, müssen wir doch bereit sein, da mehr zu investieren, um eine Annäherung zu erreichen.
Der zweite Punkt sind natürlich Teilzeitarbeit und Auszeiten für Kinder, oft verbunden mit einem Karriereknick. Ich habe es gesagt: Zwei Drittel der Mütter arbeiten nur Teilzeit. Auch da müssen wir die Situation verbessern, indem wir die Rahmenbedingungen optimieren. Bessere Kinderbetreuung wurde schon angesprochen. Auch da machen wir seit Jahren viel, jetzt das Gute-Kita-Gesetz. Das betrifft nicht nur die Anzahl der Einrichtungen, wir brauchen auch eine Stärkung der Tagespflege und eine bessere Abdeckung der Betreuung in den Randzeiten, damit Frauen umfangreicher arbeiten können. Aber auch wenn wir dafür gesorgt haben, wird es Frauen mit kleinen Kindern geben, die trotzdem sagen: Ich will nur halbtags arbeiten.
In meinem Büro ist es so. Es sind gerade zwei Mütter nach der Geburt eines Kindes zurückgekommen. Ich habe sie heute noch mal gefragt: Warum bist du nur halbtags bzw. in Teilzeit zurückgekommen? Warum wolltest du keine Ganztagsstelle? – Sie haben mir beide – und es sind moderne Frauen – gesagt: Ich habe doch schon jahrelang gearbeitet. Jetzt möchte ich ein bisschen mehr Zeit für meine Kinder haben. – Ich finde, auch das gehört zur Wahrheit.
Rund-um-die-Uhr-Betreuung wollen wir, um denjenigen, die entsprechend arbeiten wollen, dieses zu ermöglichen. Wir wünschen uns aber auch ein bisschen Akzeptanz für diejenigen, die sagen: Mir reicht es, ein paar Jahre halbtags zu arbeiten. – Das gehört auch dazu.
Jeder, der eine Frau verurteilt, weil sie sich dafür entscheidet,
der kann sich vielleicht Feminist nennen, er ist aber kein Frauenfreund.
