Der Bund hat mit dem Investitionshochlauf für die Verkehrsinfrastruktur schon in der vergangenen Legislatur damit begonnen, die Mittel für Investitionen in die Schieneninfrastruktur zu erhöhen. Aktuell investieren der Bund und die Bahn mehr Geld in die Schiene als jemals zuvor.
Es sind zudem zahlreiche neue Bundesprogramme aufgelegt worden, um den Bahnverkehr in Deutschland zusätzlich voranzubringen. Dazu gehören auch Programme wie das Bahnhofsmodernisierungsprogramm aus der vergangenen Legislaturperiode.
Darüber hinaus gibt es viele positive Beispiele für Kooperationen mit Kommunen, die Bahnhöfe von der Bahn übernommen haben und jetzt besser dastehen als zuvor.
Ich möchte hier das schöne Beispiel aus Osterburken ansprechen. Solche Projekte könnten mit dem von Ihnen geforderten Stopp des Verkaufs von Bahnimmobilien und -grundstücken gar nicht mehr realisiert werden.
Wir haben das im Ausschuss ja schon eingehend diskutiert und den Antrag mit Ihren überholten Forderungen abgelehnt.
Meine Damen und Herren von den Linken, Sie zeigen mit Ihren Anträgen nicht nur, dass Sie mit überholten Ideen von gestern arbeiten,
sondern Sie zeigen auch Ihre Rückwärtsgewandtheit. Sie wollen nämlich Zeit, Geld und personelle Ressourcen dafür verschwenden, eine interaktive Karte zu erstellen – hochmodern –, auf der aber dann Strecken abgebildet werden, die es zur Mitte des letzten Jahrhunderts in der DDR und der damaligen Bundesrepublik einmal gegeben hat.
Ist es nicht sinnvoller, die Ressourcen zu verwenden, um zu schauen, wo in Zukunft Streckenaktivierungen oder Neubauten ermöglicht werden können, die das Netz ergänzen und effizienter machen oder für Lückenschlüsse sorgen?
Sie schreiben in Ihrem Antrag ja selbst, dass in Deutschland aktuell Strecken reaktiviert werden. Ich verstehe also nicht, warum Sie auch in Ihrem zweiten Antrag etwas fordern, was es bereits gibt.
Dann geben Sie uns ein weiteres Rätsel auf. Sie fordern nämlich, dass unerwartete Steigerungen bei den Fahrgastzahlen in zukünftige Bewertungen mit einfließen. Aber wenn sie doch unerwartet sind, wie soll man sie dann vorhersagen?
