Herr Präsident! Liebe Kolleginnen und Kollegen! Klimawandel, Globalisierung, Digitalisierung, Energiewende, Mobilitätswende sind Stichworte, die die Herausforderungen, vor denen die Industrie steht, deutlich machen. Eigentlich wäre es gut gewesen, wenn wir im Zusammenhang mit der industriepolitischen Strategie auch über solche Themen reden. Aber die AfD und die FDP verweigern sich eigentlich einer solchen Debatte. Der AfD zufolge ist der Euro schuld, ist Europa schuld – ohne einmal auf die Themen einzugehen. Der FDP fällt nichts ein als die alten Gassenhauer: Die Steuern für die Unternehmer sind zu hoch; die Lohnnebenkosten sind zu hoch; die Steuern müssen gesenkt werden.
Sie wollen Reichtumspflege, aber haben keine Antwort auf die Herausforderungen, die vor uns liegen.
Deshalb sage ich Ihnen eins: Damit die Politik ein bisschen wach wird, ist es ganz gut, dass die IG Metall für Ende Juni eine Großdemonstration hier in Berlin angemeldet hat, um endlich mal klarzumachen, dass angesichts dieser Herausforderungen Hunderttausende von Arbeitsplätzen in diesem Land industriepolitisch in Gefahr sind,
wenn die Politik nicht endlich handelt.
Da kommt man aber mit Ihren alten Gassenhauern nicht hin, sondern da müssen die Sachen gemacht werden, die Sie von der FDP verweigern.
Wir brauchen nämlich eine Industriepolitik, einen aktiven Staat. Wir brauchen mehr Zukunftsinvestitionen. Wir müssen neue Technologien fördern. Das alles lehnen Sie ab.
