Herr Präsident! Liebe Zuhörer! Liebe Gäste aus Niedersachsen auf der Tribüne! Wir beraten heute einen Antrag der FDP mit dem Titel „Steuerrecht vereinfachen – Bürokratie abbauen“. Das klingt schwungvoll, voller Elan. Sie haben bei solchen Anträgen grundsätzlich die volle Unterstützung der AfD. Wir setzen uns für die Rodung des Bürokratiedschungels ein und gegen den Wildwuchs im Steuerrecht.
Wir haben hier auch schon einige Anträge selbst eingebracht: zur Abschaffung des inzwischen verfassungswidrigen Solidaritätszuschlages und zur Grundsteuerabschaffung. Leider hat dieses Hohe Haus, haben Sie unsere Vorschläge so nicht mitgetragen.
Liebe FDP, wir schauen einmal zurück in die Jahre 2009 bis 2013. Sie wissen, was da war?
– Sie schauen nach vorne. Ja, ich weiß auch, warum. – Gut, ich beantworte Ihnen die Frage: Von 2009 bis 2013 hatten wir eine schwarz-gelbe Bundesregierung. Sie waren an der Regierung beteiligt. Aus dieser Zeit ist mir steuer- und finanzpolitisch nur eine Aktion von Ihnen in Erinnerung geblieben, und zwar ein Lobbygeschenk: die Senkung des Mehrwertsteuersatzes zugunsten der Hoteliers. Das hat zu einem Bürokratiezuwachs und zu einer deutlichen Verkomplizierung des Steuerrechts geführt. Hiermit haben Sie uns allen keinen Gefallen getan.
Sie sagten, Sie schauen lieber in die Zukunft. Das können wir sehr gerne tun. Thema Forschungsförderung: Was machen Sie hier? Sie wollen mit einzelnen Ausnahmetatbeständen arbeiten, wollen kleine Lobbygruppen bevorzugen.
Dafür sind wir nicht zu haben.
Wir gehen noch weiter zurück, ins Jahr 2005: Die CDU – jetzt kommen wir zu Ihnen – hatte damals einen ausgewiesenen Fachmann, Paul Kirchhof, Finanz- und Steuerrechtler. Er hatte eine echte Reform geplant. Er war damals Ihr designierter Finanzminister. Wer hat es verbockt? Die Bundeskanzlerin, die heute nicht da ist.
Sie ist mit einem gigantischen Umfragevorsprung in die Bundestagswahl gegangen. – Zur SPD kommen wir gleich noch.
Sie hat es gerade noch geschafft, sich mit einem hauchdünnen Vorsprung in die Große Koalition zu retten. Für eine echte Reform in Sachen Steuerrecht ist die SPD ja nicht zu haben. Dass das mit Paul Kirchhof nicht zu machen war, war auch klar. Insofern kamen von der CDU bzw. inzwischen der Großen Koalition keine großen Lösungen.
Wir reden hier ja Klartext:
