Sehr geehrter Herr Präsident! Meine sehr verehrten Damen und Herren! Liebe Zuschauer und Zuhörer! Für uns Freie Demokraten ist beim Klimaschutz nicht das Ob, sondern das Wie entscheidend. Schauen wir einmal auf das Wie des vorliegenden Gesetzentwurfes und des vorliegenden Antrags. In ihrem Gesetzentwurf fordern die Grünen einen Ausstieg aus der Braunkohleerzeugung – nicht aus der Nutzung – bis 2022. Der Atomstrom wird weg sein. Gegen Windenergie demonstrieren Sie inzwischen auch. Der Antrag der AfD ist ein pures Weiter-so. Sie präsentieren beide keinen vernünftigen Ansatz für eine klug gemachte Klimawende, die nicht nur funktioniert, sondern auch langfristig das Klima schont und der deutschen Volkswirtschaft nicht schadet.
Ich glaube, es ist ausreichend erwähnt worden, dass der Gesetzentwurf und der Antrag keinen Plan dafür enthalten, wie mit den betroffenen Regionen umzugehen ist, weder der Gesetzentwurf, der die sofortige Abschaltung vorsieht, noch der Antrag mit diesem Weiter-so. Wir können nicht leugnen, dass ein Veränderungsprozess stattfinden wird. Auch da brauchen wir kluge und langfristige Antworten.
Wenn wir nicht ausreichend Energie erzeugen können, werden wir weiterhin Atomstrom aus Frankreich beziehen und Kohlestrom aus Polen.
Das ist weder klimaschonend noch sozial verträglich; denn wir haben schon jetzt die höchsten Energiekosten in Europa.
Schauen wir auf das Wie der Freien Demokraten. Wir glauben, dass Deutschland mit seinen Innovationen und Erfindungen großes Potenzial hat, klimafreundliche Energieerzeugung für die Zukunft zu sichern.
Herr Kollege, gestatten Sie eine Zwischenfrage des Kollegen Hilse?
Gerne nach der Rede. – Dafür benötigen wir keinen hektischen Aktionismus der Bundesregierung und keine auf Panik- oder Angstmache basierenden weiteren Anträge.
Wir brauchen einen Masterplan für die Energiewende, die auf marktwirtschaftliche Anreize und Wettbewerb setzt.
Wir wollen – bitte zuhören; Zuhören erhellt – keine staatlichen Umverteilungsmechanismen à la CO 2 -Steuer. Wir wollen Anreize und marktwirtschaftliche Instrumente wie eine Weiterentwicklung des CO 2 -Zertifikatehandels über alle Sektoren, und das europaweit.
