Wir können in Deutschland nicht planlos alle konventionellen Kraftwerke stilllegen. Wenn wir das in Deutschland tun, dann fällt uns die Energiewende auf die Füße. Wir haben, wie ich schon sagte, den teuersten Strom; das kann man nicht oft genug wiederholen. Wir müssen Kernenergiestrom und auch Kohlestrom aus dem Ausland teuer zukaufen.
Wenn wir zu viel Strom aus erneuerbaren Energien produzieren, dann müssen wir sogar Geld dafür bezahlen, dass das Ausland diesen Strom abnimmt. Das ist ein völliger Anachronismus.
Mein Vorredner, Herr Koeppen von der CDU/CSU, hat es an dieser Stelle schon gesagt: Das EEG ist völlig aus dem Ruder gelaufen, meine Damen und Herren.
Wir hatten in 2017 329 sogenannte Stresstage, also Tage, an denen man schon mal das Eingreifen in die Stromnetze planen muss, und 2018 hatten wir davon 353, also ansteigende Kurve, permanent und dauernd; das sind Angaben der Bundesnetzagentur. Auch das zeigt den Verlust der Versorgungssicherheit auf.
Zur Gasversorgung. Was nun der Spitzenkandidat der EVP für Europa, Herr Manfred Weber von der CSU, macht, ist klar gegen unsere nationalen Interessen gerichtet.
Er versucht, das deutsch-russische Projekt der Gasleitung Nord Stream 2 zu torpedieren und zu verhindern. Er will damit etwas verhindern, was sogar die Bundesregierung unterstützt.
Dabei sind wir aufgrund der Energiewende noch mehr auf Gaslieferungen, vor allen Dingen auf kostengünstige Gaslieferungen aus Russland angewiesen.
Nun versucht Herr Weber von der CSU, auf Kosten des deutschen Steuerzahlers und des Energiekunden sein eigenes Süppchen zu kochen und uns in die Suppe zu spucken. Er will mit seinem Verrat an deutschen und auch europäischen Interessen dafür sorgen, dass seine persönlichen Chancen, zum EU-Kommissionspräsidenten gewählt zu werden, steigen. Er nimmt weder Rücksicht auf seine eigene Partei noch auf die Bundesregierung noch auf Deutschland. Er weiß nämlich, dass, wenn er die Interessen anderer Mitgliedstaaten vertritt, dann seine Wahlchancen steigen. Da kann ihm seine eigene Partei schlecht dazwischenreden. Mehrheit ist Mehrheit, er wird also unterstützt. Aber das, was Herr Weber hier macht, ist Verrat an deutschen Interessen.
Herr Weber hat unserem Vaterland sozusagen den Rücken zugekehrt.
Konsequent wäre es an dieser Stelle, wenn er sich um eine andere Staatsbürgerschaft bemühen würde und die deutsche Staatsbürgerschaft abgeben würde. Faktisch hat er das schon getan.
Vielleicht noch ein Aspekt zur europäischen Energiepolitik. Ich glaube, die europäische Solidarität besteht nicht darin, dass die Staaten ihre Kernkraftwerke an ihre Grenzen legen, hin zu den anderen Ländern. Ich glaube, das ist kein solidarisches Gebaren hier in Europa; das muss an dieser Stelle auch mal erwähnt werden.
Weil wir bei der Kernenergie sind: Die Grünen arbeiten sich daran gerade ab und machen das Tollhaus Deutschland perfekt. Sie sprechen von einer sogenannten Privilegierung der Kernkraft, die es aber nicht gibt. Es gibt keine Sonderstellung. Die AfD hält es für zielführender, die Kernkraftwerke hier bei uns – die sichersten in der Welt – länger laufen zu lassen,
aber leider gibt es dafür keine Mehrheit hier. Wenn sich die Grünen und die Grüninnen schon ins Knie schießen wollen, dann sagt die AfD: Nein, macht das bitte unter euch, aber nicht mit uns. Wir haben auch keine Antwort darauf, wie die Technologie der Kernenergie in Deutschland gehalten werden soll.
Herr Kollege, Ihre Redezeit ist abgelaufen.
Darauf gibt es keine Antwort. Wir sagen aber: Das wollen wir erreichen.
Vielen Dank.
Nächster Redner ist der Kollege Johann Saathoff, SPD.
