Ich glaube, das Letztere ist die Mehrheit, oder? – Nein? Sind wir uns nicht einig? – Also, darf ich noch einmal fragen: Wer gegen den Antrag der FDP ist, den bitte ich noch einmal um das Handzeichen. –
Das ist die Mehrheit. – Nein? Also, wir sind uns leider im Präsidium nicht einig,
sodass ich Sie jetzt bitte, den Saal zu verlassen; wir müssen einen Hammelsprung machen.
Wenn Sie bitte die Türen schließen und den Saal verlassen. –
Wenn Sie den Plenarsaal zügig verlassen würden, wäre ich Ihnen sehr dankbar; es muss vorangehen. – Ich darf Sie jetzt wirklich bitten, den Plenarsaal zu verlassen. – Darf ich mal fragen, ob die Türen mit Schriftführern besetzt sind? – Gut. Dann eröffne ich die Abstimmung.
Sind wir so weit? – Dann schließe ich die Abstimmung.
Liebe Kolleginnen und Kollegen, ich gebe das Abstimmungsergebnis bekannt: 441 Kollegen haben sich an der Abstimmung beteiligt. Mit Ja haben gestimmt 194, mit Nein 246, 1 Enthaltung. Damit ist der Antrag der FDP abgelehnt.
Ich begrüße unter uns ganz herzlich den Bundesminister des Innern, für Bau und Heimat, Horst Seehofer,
