Was muss konkret geändert werden? Wir meinen, Fördersätze und Freibeträge müssen sofort um mindestens 10 Prozent steigen und danach automatisch und regelmäßig, damit Schluss ist mit Willkür.
Studentisches Wohnen liegt uns in der Tat auch am Herzen, Frau Karliczek, und natürlich braucht es mehr Wohnheimplätze. Aber wo bleibt denn dann die Karliczek-­Seehofer-Initiative für ein Bauprogramm für studentisches Wohnen? Dafür sind Sie doch auch in der Verantwortung.
Nichtsdestotrotz müssen Sie bei der Wohnpauschale dringend nachbessern: Denn in München oder Hamburg finden Studierende für die 325 Euro, die Sie vorsehen, nirgendwo eine Bleibe. Darum ist eine Pauschale auf Basis der Stufen des Wohngeldgesetzes die richtige und gerechtere Antwort.
Wer studieren will, soll den Studienort danach aussuchen, wo das Studienangebot passt. Frau Karliczek riet, man möge dort studieren, wo man es sich leisten kann. Und das ist wirklich zynisch. Wenn Sie Exzellenzuniversitäten in teuren Städten fördern, dann müssen junge Talente armer Eltern auch dort studieren können. Wir wollen Bildung und Forschung in der Spitze und in der Breite fördern; nur das ist fair.
Weitere Reformpunkte, die überfällig sind: Unterstützung von Studierenden, die Angehörige pflegen, BAföG-Öffnung für Teilzeitstudierende, Förderung von Orientierungssemestern, die Förderlücke für Geflüchtete schließen. Das alles sind Fortschritte, die nicht nur wir, sondern auch der Bundesrat fordern. Sie gehören in die Novelle. Bessern Sie also nach!
Mehr Fortschritt brauchen wir auch bei der Vereinfachung von Anträgen und beim Online-BAföG. 590 Onlineanträge gab es im Zeitraum Juni 2017 bis April 2018. Das bewegt sich im lächerlichen Promillebereich. Den BAföG-Antrag an jeder Milchkanne ausfüllen zu können, muss der Anspruch sein. Dafür sollten Sie streiten, Frau Karliczek.
Ihre halbgare Novelle setzt auf Tarnen statt auf Transparenz. Die Regierung will den BAföG-Bericht von 2019 in das Jahr 2021 verschleppen. Dabei sagt das Gesetz klipp und klar: Alle zwei Jahre hat die Regierung dem Bundestag diesen Bericht vorzulegen. Und das aus einem guten Grund: So können wir flott auf Reformbedarfe reagieren und das BAföG auf der Höhe der Zeit halten. So soll es sein, und so soll es auch bleiben.
Union und SPD haben ganz offensichtlich keine Idee, wie sie den krassen Bedeutungsverlust des BAföGs stoppen. Die Debatte über die Weiterentwicklung der Studienfinanzierung ist überfällig. Wir wollen sie seit langem führen, FDP und Linke auch.
Als Grüne im Bundestag schlagen wir vor, das BAföG zu einem Zwei-Säulen-Modell auszuweiten: Wir wollen einen Studierendenzuschuss als Basis für alle plus einen Bedarfszuschuss für Studierende einkommensarmer Eltern. Beide Säulen sollen Vollzuschüsse sein; damit senken wir die Sorge vor Verschuldung auf null.
Das Gute am BAföG erhalten und die Nachteile korrigieren, darauf zielt unser Zwei-Säulen-Modell; denn die staatliche Studienfinanzierung muss gerechter, verlässlicher und leistungsfähiger werden.
Ministerin Karliczek, fangen Sie doch mal an zu kämpfen! Und Herr Minister Scholz – trotz der Klingbeil-­Oppositionsrede ist ja auch die SPD in der Regierung –,
öffnen Sie endlich Ihr Portemonnaie für ein besseres BAföG!
Denn ohne deutliche Korrekturen am Entwurf der 26. BAföG-Novelle, ohne eine echte Reform droht der 50. Geburtstag des BAföGs 2021 eher ein Trauerspiel als eine Freudenfeier zu werden. Sorgen Sie für eine Feier!
Jetzt erteile ich das Wort dem Kollegen Dr. Stefan Kaufmann, CDU/CSU.
