Was Menasse hier vorträgt, ist der Ruf nach den Vereinigten Staaten von Europa.
Diesen Traum träumen viele Angehörige der politischen Klasse, der Wirtschaftseliten und eben auch linke Intellektuelle. Menasse hat die Sache eben nur konsequent formuliert: Wer die Vereinigten Staaten von Europa will, muss die Nationalstaaten und die nationalen Parlamente abschaffen. Wer die Vereinigten Staaten von Europa will, muss die europäischen Souveräne entmachten.
Menasse hat ein Geheimnis verraten, für das die meisten Menschen noch nicht reif sind, weshalb dieser Prozess allmählich und gewissermaßen hinter ihrem Rücken abläuft, bis man sie eines Tages vor vollendete Tatsachen stellt.
Meine Damen und Herren, in seiner Rede in Warschau – sehr berühmt geworden – im Juli 2017 hat Donald Trump über die einzigartige westliche Tradition aus Individualität, Freiheit und Recht gesagt: Was wir besitzen, was wir ererbt haben von unseren Vorfahren, hat in diesem Ausmaß nirgendwo anders existiert. Und wenn wir daran scheitern, es zu bewahren, wird es nie wieder existieren. – Keiner kann behaupten, er wisse nicht, was auf dem Spiel steht. Und Ihre Politik führt leider genau dahin.
Ich bedanke mich.
Michael Grosse-Brömer, CDU/CSU, ist der nächste Redner.
