Stattdessen gehen Sie jetzt wie mit dem Rasenmäher über die Vielfalt des Internets und mähen alles weg. Ob ein ungerechtfertigter Verstoß gegen urheberrechtliche Bestimmungen vorliegt, eine Parodie oder anderes, das wird bald nicht mehr einwandfrei unterschieden werden. Dabei wären sogar Parodien, Memes oder auch Remixe von urheberrechtlicher Seite aus durchaus legitimiert. Das machen Sie alles kaputt.
Ich sage es Ihnen ganz ehrlich: Sie öffnen die Büchse der Pandora. Im Grunde ganz nach den Vorstellungen von George Orwell schaffen Sie hier mit Uploadfiltern die potenzielle Gefahr, dass diese irgendwann zu Wahrheitsfiltern werden. Das werden wir garantiert nicht durchlassen.
Zum Schluss möchte ich noch sagen: Meine sehr geehrten Damen und Herren, werden Sie Ihrer staatspolitischen Verantwortung wirklich gerecht!
Herr Abgeordneter.
Stimmen Sie im Europäischen Rat noch gegen die Richtlinie! Verhindern Sie Uploadfilter und diese unsägliche Richtlinie!
Vielen Dank.
Die nächste Rednerin: die Kollegin Tabea Rößner, Bündnis 90/Die Grünen.
