Ich starte gerne mit Adams; denn da stecken ja immer ein bisschen Wahrheit und Wahnsinn drin.
Das passt gelegentlich ganz gut zu unserer Arbeit, zumindest zu einem Teil derer, die unsere Arbeit teilen.
Von den Ozeanen auf die Bäume auf die Straße und auf denen nun demnächst mit E-Scootern – na klar: kein Holzweg. Ausdrücklich: Ja, das ist in Ordnung. – Aber dennoch, liebe Kolleginnen und Kollegen der FDP: Ihr Antrag wird abgelehnt. Als rheinisches Kind bin ich zwar grundsätzlich ein Vertreter der Philosophie „Et hätt noch immer jot jejange“,
aber manchmal geht es eben nicht gut. Schon deswegen müsste man sich vorher mal kurz ein paar Gedanken machen, und das ist hier auch angezeigt.
Elektrokleinstfahrzeuge sind wichtig, aus der Perspektive meines Ressorts „Wirtschaft und Energie“ gleich in mehrfacher Hinsicht. In Entwicklung, Herstellung und Vertrieb dieser kleinen Flitzer steckt Wertschöpfungspotenzial, und es muss in unser aller Interesse sein, dieses auch für die nationale Wirtschaft zu erschließen. Gleichzeitig eröffnen sich mit den Scootern und Co Perspektiven für Mobilitätskonzepte von morgen, und das ist mindestens genauso wichtig.
Erste Kurzzeitbetrachtungen lassen durchaus vermuten, dass Scooter dort, wo sie heute schon in hoher Zahl zum Einsatz kommen – in den USA und einigen europäischen Nachbarländern zum Beispiel –, einen nennenswerten Beitrag zur lokalen Entlastung des ÖPNV leisten können. Das ist gut; denn die ÖPNV-Nutzung nimmt ja auch in vielen Ballungszentren stetig zu. Noch wichtiger: Insbesondere für die erste und letzte Meile stellen Scooter auch eine echte Alternative zum Auto dar. Damit machen sie die E-Mobilität nachhaltiger, effizienter. Sie sind zugleich ein praktischer Anwendungsfall für die Sektorkopplung und helfen uns perspektivisch, immer mehr grüne Energie und damit die Energiewende auf der Straße auch voranzubringen.
Nachfrage und Anwendungen sind da.
