Ein Bekannter von mir ist mit seinem Unternehmen führend im Garten- und Landschaftsbau. Er ist auch im entsprechenden Verband aktiv. Was hat der früher immer gegen Gewerkschaften, gegen Betriebsräte und gegen Mitbestimmung gewettert! Die sollten sich raushalten. Die sollten sich auf keinen Fall in die unternehmerischen Entscheidungen einmischen. Mittlerweile ist er vom ­Saulus zum Paulus geworden. Er ist kuriert. Er ist ein Fan der Tarifvertragspolitik, weil er weiß: Wenn er es selber in die Hand nimmt, wenn er es selber regelt, ist es besser, als wenn es die Politik macht. Das ist Tarifautonomie. Aber wir werden es machen: Wir werden eingreifen.
Liebe Kolleginnen und Kollegen der Linken, es ist ja alles richtig, was ihr gesagt habt. Aber schaut doch einmal in das Sozialstaatspapier der SPD. Da sind diese Punkte drin. Da haben wir längst aufgeführt, dass das Vetorecht der Arbeitgeber, gerade was die Allgemeinverbindlichkeit betrifft, weg muss. Wir haben da Steuervergünstigungen für tarifgebundene Unternehmen hineingebracht. Wir wollen die Mitbestimmung insgesamt stärken. Diese Gewerkschaftsbekämpfung – modern sagt man Union-Busting; Gewerkschaftsbekämpfung ist aber besser – muss härter bestraft werden.
Und es ist auch nicht in Ordnung, wenn der billige Jakob das Geschäft macht und sich alle gegenseitig unterbieten. Das nützt am Ende niemandem. Deswegen brauchen wir ein Tariftreuegesetz auf Bundesebene. Das sind alles keine neuen Ideen, aber diese Ideen sind richtig.
Ich habe mich gefreut, als ich positive Anzeichen gesehen habe. Lidl hat uns einen Brief geschrieben, in dem steht, dass sie allen 79 000 Mitarbeiterinnen und Mitarbeitern mindestens 12,50 Euro pro Stunde zahlen. Wir brauchen einen Mindestlohn von 12 Euro pro Stunde, sogar 12,70 Euro, wenn er nicht irgendwann wieder auf Sozialhilfeniveau sein soll. Lidl fordert eine zwingende Tarifbindung für die eigene Branche. Wenn schon Lidl das fordert, dann ist es höchste Eisenbahn bzw. höchste Zeit, dass sich hier etwas tut. Ich werbe also dafür, die Tarifbindung zu stärken. Mit uns, mit der SPD, haben Sie den richtigen Partner dazu.
Vielen Dank.
Vielen Dank, Bernd Rützel. – Nächster Redner in der Debatte ist der Kollege Till Mansmann für die Fraktion der FDP.
