Und was ist, wenn ich Ihnen sage, dass der Autor der EU-Kommissar ist, der für die Sicherheitsunion zuständig ist? Ist das jetzt wieder in Ordnung, weil es ja ein Kommissar war? Und was ist, wenn ich Ihnen sage, dass es ein Brite war? Ist es jetzt wieder nicht legitim, weil es den Brexit gibt? Also: Sagen Sie es mir! Erklären Sie es!
Aber der absolute Knaller in Ihrem Antrag ist eigentlich: Sie möchten hier feststellen lassen, dass die AfD vor Strafzahlungen wegen illegaler Parteienfinanzierung steht.
Steht da drin, möchten Sie feststellen lassen. Da steht: „Der Deutsche Bundestag stellt fest: …“.
– Nein, das ist keine Tatsache. Wir sind in einem schwebenden Verfahren.
Ihre Verfahren sind abgeschlossen. Sie mussten zahlen. Fall Möllemann: Sie mussten zahlen.
Auch Sie verbreiten Fake News. Sie sind Fake News.
