Sehr geehrte Kolleginnen und Kollegen! Sehr geehrter Herr Präsident! Liebe Gäste auf der Tribüne! Ja, Herr Schäffler, Sie haben zwischendurch gar nicht so schlecht geredet, aber mit einer Unwahrheit aufgehört.
Es ist einfach nicht zutreffend, dass die Sozialdemokratie die Fusion von Commerzbank und Deutscher Bank betreibt.
Ich will aber zum Thema reden. Liebe Kolleginnen und Kollegen, am Dienstagabend um 22.15 Uhr erreichte uns der Antrag der AfD-Fraktion mit dem Titel „Target-Forderungen unabhängig vom Fortbestand des Euros besichern“ – ein provokanter Titel –, zu einer sehr unkollegialen Zeit und nicht einmal zwei Tage bis zur heutigen Debatte. Das scheint eine von vielen Retourkutschen zu sein, vielleicht für die nichtgewählte Bundestagsvizepräsidentin aus Ihren Reihen. Wie haben Sie es unmittelbar nach der gescheiterten Wahl selber formuliert? Jetzt zitiere ich ausnahmsweise einmal die AfD; Sie haben gesagt: Falls unsere Kandidatin nicht durchkommt, wollen wir die Arbeit des Bundestages systematisch behindern.
Damit wollen wir das Ansehen des Bundestages nachhaltig beschädigen und das Vertrauen in unsere Demokratie erschüttern. – Das ist ein wörtliches Zitat von Ihnen.
Liebe Kolleginnen und Kollegen, lassen Sie bitte die Frau Kollegin Steffen ausreden. Wenn Sie etwas zu sagen haben, können Sie eine Kurzintervention anmelden.
Liebe Frau Kollegin.
Da muss man sich doch zu Recht fragen, und das fragt auch die „Frankfurter Allgemeine Sonntagszeitung“ in ihrer aktuellen Ausgabe, die weiß Gott nicht den Ruf hat, eine, wie Sie immer so schön sagen, rot-links versiffte Zeitung zu sein:
Wie wichtig ist der Partei
– also Ihnen von der AfD –
