Das wäre auch WTO-konform. Dann können wir auch darauf achten, dass Menschenrechte und Arbeitnehmerrechte dort eingehalten werden. Denn es kann nicht sein, dass Kinderarbeit dort noch an der Tagesordnung ist. Wenn Produkte nach Deutschland geliefert werden, dann muss sichergestellt sein, dass Menschenrechte eingehalten werden, dass die Produkte ohne Kinderarbeit hergestellt wurden, dass eine faire Entlohnung der Menschen erfolgt. Da müssen wir auch mal schauen, ob wir nicht diese ganzen Kartelle aufbrechen können, die auch die Preise für Kaffee und Kakao weltweit so niedrig halten.
Herr Raabe, das machen wir jetzt nicht mehr.
Wir brauchen fairen statt freien Handel, meine sehr verehrten Damen und Herren.
Und wir brauchen die Einhaltung der Redezeit.
Vielen Dank.
Danke, Sascha Raabe. – Letzter Redner in der Debatte: Uwe Feiler für die CDU/CSU-Fraktion.
