da die Freiwilligendienste einen Bildungs- und Orientierungsansatz haben. Es ist schade, dass sich die FDP bei der Flexibilisierung der Freiwilligendienste enthält.
Ihnen danke ich für Ihre Aufmerksamkeit.
Vielen herzlichen Dank, Sylvia Pantel. – Damit schließe ich die Aussprache.
Wir kommen zur Abstimmung über den von der Bundesregierung eingebrachten Gesetzentwurf zur Einführung einer Teilzeitmöglichkeit in den Jugendfreiwilligendiensten sowie im Bundesfreiwilligendienst für Personen vor Vollendung des 27. Lebensjahres. Der Ausschuss für Familie, Senioren, Frauen und Jugend empfiehlt unter Buchstabe a seiner Beschlussempfehlung auf den Drucksachen 19/8611 und 19/8643, den Gesetzentwurf der Bundesregierung auf Drucksache 19/7839 anzunehmen. Ich bitte diejenigen, die dem Gesetzentwurf zustimmen wollen, um das Handzeichen. – Wer stimmt dagegen? – Wer enthält sich? – Der Gesetzentwurf ist damit in zweiter Beratung angenommen. Zugestimmt haben die Fraktionen von CDU/CSU, SPD, AfD und Bündnis 90/Die Grünen. Enthalten haben sich die Fraktion der FDP und Die Linke.
und Schlussabstimmung. Ich bitte diejenigen, die dem Gesetzentwurf zustimmen wollen, sich zu erheben. – Wer stimmt dagegen? – Aha, ein Kollege von der CSU.
Zwei Kollegen stimmen dagegen. Das gibt Ärger bei Ihnen zu Hause. Ich weiß, wo Sie herkommen.
Wer enthält sich? –
