setzen Sie die Unterstützung der Bevölkerung – der Zivilbevölkerung, auf die Sie sich berufen – für tatsächlich hilfsbedürftige Menschen vorsätzlich aufs Spiel.
Es gibt in unserer Gesellschaft immer noch einen breiten Konsens darüber, dass wir denjenigen, die wirklich unseres Schutzes bedürfen,
helfen, solange sie schutzbedürftig sind. Aber ich sage Ihnen auch: Wir können dieses Versprechen nur einlösen, wenn wir dafür sorgen, dass die Menschen, die unseren Schutz nicht oder nicht mehr brauchen, unser Land auch zügig wieder verlassen müssen.
Da sage ich Ihnen Folgendes zu Ihrem Vorschlag mit den kommunalen Modellen: Es ist auch nach geltendem Recht völlig unproblematisch möglich, dass sich Kommunen überdurchschnittlich engagieren, wenn sie sagen: Das können wir leisten. – Das geht darüber, dass innerhalb der Länder die Verteilung auf die Kommunen entsprechend den Leistungsfähigkeitserklärungen der Kommunen vorgenommen werden kann. Dazu müssen wir als Bundesgesetzgeber nicht tätig werden. Aber da, wo ich herkomme, sagen wir Folgendes: Liberal samma scho, aber bläd samma ned – Liberal sind wir schon, aber nicht blöde.
Über Modelle kommunaler Unterstützung wollen Sie uns Aufenthaltsrechte unter der Tür durchschieben, die wir als Bundesgesetzgeber nicht gewähren können, weil die Frage des Aufenthalts an der Grenze der Kommunen nicht halt macht; denn jemand, der die Eintrittskarte für das Bundesgebiet bekommt, wird sich über Grenzen von Kommunen und auch über Grenzen von Bundesländern hinweg bewegen, und die Aufenthaltsbeendigung endet immer wieder hier. Hier ist das Problem, das wir lösen müssen. Das verschweigen Sie.
Herr Kollege, kommen Sie zum Schluss, bitte.
Deshalb können wir das nicht mitmachen, können wir diesen Vorschlag nicht mittragen.
