Sehr geehrte Frau Präsidentin! Liebe Kolleginnen und Kollegen! Ich sehe, die Debatte ist wieder animiert. Bevor ich in meine Rede einsteige, muss ich noch ein paar Worte verlieren. Interessanterweise ist das ETS ja nicht der einzige Punkt in unserem Antrag, wird hier aber von vielen genannt. Wir beschreiben sieben Ansätze für eine europäische Energiepolitik.
– Sie haben ihn wahrscheinlich nicht gelesen, Herr Gremmels, nicht wahr?
Frau Nestle, ja, wir sind für eine CO 2 -Bepreisung, aber nicht für eine CO 2 -Steuer.
Das möchte ich noch einmal ganz klar herausstellen; denn eine CO 2 -Steuer ist für uns nicht zielführend.
Herr Beutin, ich fand es schon sehr interessant und auch ein bisschen amüsant, dass Sie uns Marktwirtschaft erklären.
Das ETS ist erfolgreich; das muss man sagen. Da hat die Marktwirtschaft gegriffen.
Meiner Wahrnehmung nach ist das sozialistische System in der ganzen Welt gescheitert.
Das nur zum Einstieg.
