Personalnotstand bei den Gerichten. 2018 kamen 65 dringend Tatverdächtige aus U-Haft frei, weil die Verfahren nicht rechtzeitig bearbeitet wurden. Die laufen jetzt wieder frei rum. Staatsversagen!
Clankriminalität. Der Essener Polizeipräsident sagt: Da ist die Integration voll gegen die Wand gefahren, weil sich viele dieser Leute gar nicht eingliedern wollen. Diese Menschen sehen den Staat nur als Beute an. In Essen wird ein Clanchef nicht angeklagt; das Sicherheitsrisiko sei zu hoch. Staatsversagen! Irrenhaus Deutschland 2019.
Der Täter von Chemnitz hätte längst abgeschoben sein müssen: Intensivtäter, Messerangriff, 14 Aliasnamen, Diebstahl, Schlägerei, Drogenhandel. Die Duldung war abgelaufen, er durfte bleiben und tötete.
Die Bürger dürfen Frau Merkels freundliches Gesicht ausbaden, eine tödliche Fahrlässigkeit an unterlassener Gefahrenprävention. Und wo der verzweifelte Bürger gegen dieses Unrecht demonstrierend aufbegehrt, tritt das Kanzleramt eine Desinformationskampagne ohnegleichen los, und ein Topsicherheitschef, der das enttarnt, wird als politisch unbequem entlassen.
Im Sicherheitsranking des Weltwirtschaftsforums liegt Deutschland 2017 auf Platz 51, zwei Jahre zuvor lag es noch auf Platz 20. Wenn Herr Seehofer sagt, Deutschland ist eines der sichersten Länder der Welt: Ja, meine Damen und Herren, für Kriminelle.
Ich danke Ihnen.
Nächste Rednerin ist für die Fraktion der SPD die Kollegin Dr. Eva Högl.
