Mein Ziel ist Bauen, Bauen, Bauen von bezahlbarem Wohnraum. Die rot-schwarze Bundesregierung hat dafür gesorgt, dass in dieser Legislaturperiode 5 Milliarden Euro für den sozialen Wohnungsbau bereitstehen. Die Stadt Frankfurt geht auch hier, beim Bauen, mit gutem Beispiel voran. Künftig soll bei allen neuen Baugebieten festgelegt werden, dass 50 Prozent der Flächen für den sozialgeförderten Wohnungsbau – hälftig auf dem 1. und dem 2. Förderweg – genutzt werden. Weitere 25 Prozent sollen für Konzeptvergaben reserviert werden. Danke an den SPD-Planungsdezernenten Mike Josef für diese super Initiative.
Leider stehen in angespannten Wohnungsmärkten aus miesen Spekulationsgründen viele Wohnungen leer. Diese müssen dem Wohnungsmarkt umgehend wieder zur Verfügung gestellt werden. In Frankfurt sind dies mehrere Tausend Wohnungen.
Liebe Grüne, in Hessen merkt ihr, wie es ist, in der Realität der Koalition zu sein. Leider hat die neugewählte schwarz-grüne Landesregierung kein Zweckentfremdungsverbot für Wohnungen eingeführt, obwohl die Grünen dies in ihrem Wahlprogramm versprochen haben. So ist die Realität. Die Enttäuschung der Mieterinitiative über die Grünen kann ich gut verstehen. Die Wut wird noch dadurch verstärkt, dass im schwarz-grünen Hessen die Kündigungsfrist nach Umwandlung von Miet- in Eigentumswohnungen nur bei acht und nicht bei maximal zehn Jahren liegt – ein Geschenk von zwei Jahren für die Immobilienspekulanten.
Wir als Bund haben gehandelt. Wir haben die Möglichkeit der Umlage nach Modernisierungen auf maximal 3 Euro gedeckelt. Ich selber setze mich für eine veränderte Kappungsgrenze bei Mieterhöhungen ein. Bisher dürfen in angespannten Wohnungsmärkten die Mieten innerhalb von drei Jahren um 15 Prozent erhöht werden, in anderen Gebieten sogar um 20 Prozent. Ich frage: Wer hat solche Gehaltssteigerungen? Deshalb müssen wir dies deutlich reduzieren. Meine Forderung: Maximal 2 Prozent pro Jahr! Auch hier geht Frankfurt mit gutem Beispiel voran. Bei der städtischen Wohnungsbaugesellschaft ABG Holding mit 50 000 Wohnungen haben wir den Mietanstieg auf 1 Prozent pro Jahr begrenzt. Von Frankfurt kann man lernen!
Ich finde es gut, dass die rot-schwarze Bundesregierung auf dem Wohngipfel unter anderem festgelegt hat, dass wir die Umwandlung von Miet- in Eigentumswohnungen einschränken und den Betrachtungszeitraum beim Mietspiegel ausweiten wollen. Die Reform des Wohngelds geht aktuell ins Kabinett: Wir wollen eine jährliche Dynamisierung.
Liebe Kolleginnen und Kollegen, wenn wir die Menschen mitnehmen wollen, müssen wir handeln. Dann hat auch ein Volksbegehren für Enteignung keinen Erfolg. Lassen Sie uns gemeinsam daran arbeiten, ausreichend bezahlbaren Wohnraum für die Menschen zu schaffen!
Ich bedanke mich bei meinem Praktikanten Nick ­Engelmann, der oben auf der Bühne sitzt und mich bei meiner Vorbereitung toll unterstützt hat.
Liebe Kolleginnen und Kollegen, lassen Sie uns handeln. Wir haben viel zu tun.
Ich danke Ihnen für die Aufmerksamkeit.
Die Kollegin Antje Tillmann hat das Wort für die CDU/CSU-Fraktion.
