Dann ist keiner mehr da, der mit uns spielt. Das ist die Situation, die kommen wird.
Wenn der Deutsche Bundestag wegen jeder Schraube, wegen jedem Splint, wegen jedem Lochblech, das irgendwo an einem Gerät ist, mehrere Debatten in einer Sitzungswoche führt, dann sagen die anderen: German-free, sonst macht es keinen Sinn. Deshalb bin ich froh, dass hier ein vernünftiger Kompromiss gefunden wurde. Wenn es nur um deutsche Komponenten geht, sind die Lieferungen weiterhin möglich. Es gibt keine neuen Aufträge.
Insofern rate ich unserem Koalitionspartner, wenn ich das vielleicht zum Schluss noch sagen kann – Herr Junge, auch mit Blick auf Ihre Aussage zu den Patrouillenbooten –: Wiegen Sie sich doch nicht in der Hoffnung, dass es irgendeinen Unterschied machen würde, an wen die nachher geliefert werden. Erst mal müssen wir einen Interessenten finden. Die sind nämlich eigens für einen Kunden gebaut worden. Wir können sie der Bundeswehr hinstellen, aber die braucht sie in der Konfiguration nicht. Andere Interessenten müssen wir erst finden. Und wenn der Käufer für die Grünen oder für die Linken nicht wie gemalt ist, dann werden Sie sich das Gleiche wieder anhören. Deshalb lügen Sie sich in die Tasche. Das ist nach dem Motto: Wasch mir den Pelz, aber mach mich nicht nass.
Wenn wir Verträge eingegangen sind, müssen wir vertragstreu sein. Wir sollten nicht versuchen, bei Leuten zu fischen, die für diese Themen überhaupt nicht ansprechbar sind. Es kommt darauf an, dass Deutschland verlässlich ist und verlässlich bleibt. Dafür steht die Union in diesem Haus.
Danke schön.
Das Wort hat der Abgeordnete Enrico Komning für die AfD-Fraktion.
