– Von den Grünen, ja.
Vielen Dank für die Gelegenheit, die Zwischenfrage zu stellen. – Frau Staatssekretärin, da Sie uns ermutigen, einfach darauf zu vertrauen, dass diese Regierung noch lange arbeiten will und die Punkte schon abgearbeitet werden, möchte ich jetzt auf das zu sprechen kommen, was Sie gerade zu einer europäischen Arbeitslosenversicherung gesagt haben. Uns ist sehr wohl bekannt, dass Finanzminister Scholz und die Sozialdemokraten Sympathien für diese Idee haben, aber mir ist bisher nicht bekannt oder bestätigt worden, dass dieses Vorhaben auch konsequent im Rahmen Ihrer Regierung weiterverfolgt wird. Wenn Sie das hier jetzt so vortragen, möchte ich fragen: Ist es so, dass die Idee einer Arbeitslosenrückversicherung, wie wir sie im Antrag skizziert haben, durch Ihr Regierungshandeln in dieser Legislaturperiode weiter vorangetrieben wird? Können Sie das für die Große Koalition sagen?
Liebe Kollegin Hajduk, ich habe das, glaube ich, eigentlich schon beantwortet, aber ich will es gerne noch einmal betonen. Ich habe gesagt, dass das in Meseberg vorgebracht worden ist und dort gemeinsam in der Großen Koalition ein Prüfauftrag gestellt wurde. Ich habe auch gesagt, dass dieser Vorschlag im Moment nicht Gegenstand von Regierungshandeln ist, er aber trotzdem nicht in der Schublade verschwunden ist.
Ich will Ihnen auch erklären, warum ich das so gesagt habe, Kollegin Hajduk. Letzten Endes befinden wir uns in vielen Bereichen auf europäischer Ebene immer noch mitten in Verhandlungen. Ich habe ja schon einige Stichworte genannt: die Fortentwicklung der Wirtschafts- und Währungsunion, der ESM, die Bankenunion, auch der Aufbau eines Euro-Zonenbudgets. Das alles sind Dinge, die wir uns gemeinsam mit Frankreich vorgenommen haben und die natürlich nicht über Nacht vervollkommnet werden.
Ich will darauf hinweisen – das habe ich gestern im Haushaltsausschuss schon getan –, dass Deutschland in der zweiten Jahreshälfte 2020 die EU-Ratspräsidentschaft innehaben wird. Das ist nach der Europawahl. Das ist nach der Amtsübernahme einer neuen Kommission. Dann wird es in Europa darauf ankommen, diese Dinge gemeinsam zusammenzuführen. Wir werden uns dann auf Augenhöhe mit allen anderen 26 Partnern auf ein Gesamtpaket verständigen müssen.
Ob das dann da eine Rolle spielt oder nicht – ich würde mir das wünschen, die Kollegen von der Union vielleicht nicht –, weiß ich nicht. Aber wir müssen am Ende zu guten Lösungen für Europa kommen. Dazu mag das ein Baustein sein. Denn – dieser Satz sei mir noch gestattet – ich glaube, es ist für jeden erkennbar gewesen, dass Emmanuel Macron in seinem Artikel, den er im März veröffentlicht hat, das Soziale eindeutig stärker betont als in der Rede in der Sorbonne. Insofern weckt das bei uns die Hoffnung, dass da mehr geht, als man am Anfang vermutet hat.
Frau Staatssekretärin, ich habe jetzt die Situation, dass Sie es geschafft haben, noch zwei weitere Wortmeldungen zu generieren. Gleichzeitig bin ich gehalten, dafür zu sorgen, dass sich die Redebeiträge hier nicht verdoppeln oder verdreifachen. Es haben sich gemeldet: der Abgeordnete Hebner aus der AfD-Fraktion und die Abgeordnete Brantner aus der Fraktion Bündnis 90/Die Grünen. Wenn Sie die Wortmeldungen überhaupt zulassen, dann würde ich dafür plädieren, dass sich beide jeweils maximal auf eine Minute beschränken. Wenn die Antwort, wenn es irgendwie geht, dann auch in einer Minute möglich ist, wäre das wunderbar. Dann können Sie zum sicherlich auch absehbaren Ende Ihres Beitrages kommen, und wir kommen in der Debatte voran.
Ich glaube, dass ich jetzt die Mehrheit des Parlamentes auf meiner Seite habe, wenn ich sage: Mit Blick auf den langen Debattentag
und da ich die Frage von Frau Hajduk beantwortet habe, haben vielleicht alle Kollegen dafür Verständnis, wenn ich jetzt einfach fortfahre. Ich habe auch nur noch gut eine halbe Minute Redezeit. In dieser möchte ich meinen Gedanken zu Ende führen.
Ich hatte ja gerade dargestellt, was eine Arbeitslosenrückversicherung ist. Nur die Länder, die eine Arbeitslosenversicherung haben und in diese Rückversicherung eingezahlt haben, haben überhaupt die Chance, etwas herauszubekommen. Das soll dazu beitragen bzw. einen Anreiz bieten, dass Länder, die keine Arbeitslosenversicherung haben, diese aufbauen. Eines ist auch richtig: Es ist kein Geschenk, sondern ein Darlehen.
Eine abschließende Bemerkung sei mir noch gestattet. Die Große Koalition – es war allerdings eine frühere – hat in einer großen Krise 2008/2009 gute Erfahrungen damit gemacht, dass wir das Geld hatten, um das Kurzarbeitergeld zu implementieren, übrigens unter einem Arbeits- und Sozialminister Olaf Scholz. Das hat uns, der Großen Koalition, und Deutschland damals geholfen, gut durch die Krise zu kommen, und das sollten wir doch auch unseren europäischen Nachbarn gönnen.
Das Wort hat Pascal Kober für die FDP-Fraktion.
