Sehr geehrter Herr Präsident! Liebe Kolleginnen und Kollegen! Liebe Zuschauerinnen und Zuschauer! Würden wir dem Antrag der Fraktion Die Linke heute zustimmen, so würden wir die Axt an die Wurzel der deutschen Wirtschaft und damit die Axt an unseren Wohlstand legen.
Sie fordern eine umfassende öffentliche länderspezifische Berichterstattungspflicht von multinationalen Konzernen und damit einen Bericht über alle wichtigen Konzernkennzahlen wie Umsatz, Gewinn und Steuern für jedes Land einzeln.
Bei dem sogenannten BEPS-Projekt, also dem international abgestimmten Vorgehen gegen schädlichen Steuerwettbewerb und gegen aggressive Steuergestaltungen international tätiger Unternehmen, sieht der Aktionspunkt 13 ein Country-by-Country Reporting, also eine Berichterstattung, vor, aber nicht öffentlich. Das ist der wesentliche Unterschied in der gesamten Diskussion, die wir heute führen.
Würde man die steuerlichen Zahlen veröffentlichen – Frau Kollegin Kiziltepe, es werden die handelsrechtlichen Zahlen veröffentlicht, nicht die steuerrechtlichen Zahlen –, so würde man das Ziel nicht erreichen und man würde bei vielen Ländern die Bereitschaft, dass sie auch intern reporten, verlieren. Deswegen brauchen wir einen Country-by-Country Report, aber einen internen. Wenn wir das so machen würden, wie Sie es vorschlagen, dann führt das zu einer Schwächung unserer Unternehmen und zu einem hohen Verlust der Wettbewerbsfähigkeit der deutschen Wirtschaft. Drittstaaten würden deutsche Konzernzahlen auswerten und sie im Wettbewerb gegen die deutschen Unternehmen einsetzen. Das kann doch nicht unser Ziel sein, liebe Kolleginnen und Kollegen.
Zudem besteht auch die ernsthafte Gefahr von Fehlinterpretationen. Der Kollege Güntzler hat schon ausführlich darauf hingewiesen.
Mit Ihrer Forderung würde man zunächst auch das oberste Prinzip des Steuergeheimnisses zum Schaden der eigenen Wirtschaft aufgeben.
Das ist mit uns als CDU/CSU-Fraktion nicht machbar.
