Ich werde jetzt also etwas grundsätzlicher. Laut Arbeitszeitgesetz müssen alle Überstunden dokumentiert werden. Aber wie sollen die nachgewiesen werden, wenn die anderen Stunden gar nicht dokumentiert werden? Der Arbeitgeber muss auch darauf achten, dass die gesetzlichen Grenzen bei der Arbeitszeit und die Ruhezeiten eingehalten werden. Schon allein deswegen muss der Arbeitgeber wissen, wann und wie viel seine Beschäftigten arbeiten. Für die Sozialversicherung muss auch das Arbeitsentgelt nachgewiesen werden, und zwar die Zusammensetzung und die zeitliche Zuordnung. Außerdem gibt es genau die gleichen Dokumentationspflichten im Arbeitnehmer-Entsendegesetz und bei der Arbeitnehmerüberlassung. Diese Dokumentationspflichten sind also nicht neu. Bevor Sie sich empören und etwas fordern, sollten Sie erst einmal die Gesetzeslage zur Kenntnis nehmen.
Die Dokumentation der Arbeitszeit ist im Übrigen auch keine unzumutbare Belastung für die Unternehmen. Im Gegenteil: Sie macht Sinn, und zwar für beide Seiten. Die Beschäftigten können damit ihre Arbeitsstunden nachweisen, damit sie gerecht entlohnt werden. Die Arbeitgeber können die Arbeitszeiten ihrer Beschäftigten kontrollieren. Mir kann keiner erzählen, dass daran niemand Interesse hat. Immerhin wurde die Stechuhr nicht von der Politik, sondern von den Unternehmen eingeführt.
Arbeitszeiten können auch ganz einfach erfasst werden. Viele Möglichkeiten sind hier genannt worden. Das ist kein Bürokratiemonster.
Hier sollte sich die FDP den eigenen Wahlslogan, der schon zitiert wurde, einfach einmal zu Herzen nehmen: Digital first, Bedenken second. – Ich finde, dass das auch bei der Dokumentation der Arbeitszeit gelten sollte.
Vielen Dank.
Nächster Redner ist der Kollege Torbjörn Kartes, CDU/CSU.
