Sehr geehrter Herr Präsident! Werte Kolleginnen und Kollegen! Ich will am Anfang sagen, dass ich es schon sehr befremdlich finde, mit welchem Fanatismus und wie unter Ausblendung der Realität hier von Linken über Grüne bis zur AfD gesprochen wird. Wenn von der AfD Worte wie „die Zwischenverwahrung von Menschen“ fallen, dann ist das eine menschenunwürdige Wortwahl.
Gegen eine solche Wortwahl verwahre ich mich im Namen meiner Fraktion.
Und wenn dann populistisch so getan wird, als ob man Schluss machen könnte mit Sozialleistungen für alle Asylbewerber – anerkannt wie nicht anerkannt –, dann ist dies unerträglich an einem Tag, an dem wir heute Morgen 70 Jahre Grundgesetz gefeiert haben. Sie scheren sich einen Dreck um das, was unser Bundesverfassungsgericht erklärt. Dieses hat nämlich mehrfach entschieden, dass eine gewisse Grundsicherung für Asylbewerber notwendig ist. Deswegen müssen Sie dies auch anerkennen und dürfen den Menschen nicht immer Sand in die Augen streuen.
Gehen wir noch mal zurück zum Ursprung: Es geht heute ausschließlich um Menschen, die nach einem langwierigen Verwaltungs- und Gerichtsverfahren – oft über mehrere Instanzen rechtsstaatlich abgehandelt – rechtskräftig verpflichtet wurden, unser Land zu verlassen, und dieser Aufforderung des deutschen Staates nicht folgen. Und deswegen müssen wir alle hier uns schon die Frage stellen: Wollen wir uns von denen, die dieser Pflicht schuldhaft nicht folgen, weiterhin auf der Nase herumtanzen lassen, oder wollen wir das, was wir in Gesetze gefasst haben, tatsächlich auch durchsetzen? Ich denke, wir als Demokraten müssen uns doch alle dahinter vereinigen können, dass wir Recht durchsetzen können und wollen, liebe Kolleginnen und Kollegen.
Ich finde es auch befremdlich, wenn Frau Kollegin Polat den Vorwurf einer „Orbanisierung“ erhebt. Dies ist, Frau Polat, bei aller Wertschätzung, eine Entgleisung.
Deswegen will ich Ihnen nochmals vorhalten, was Ihre Parteivorsitzende Baerbock in einem bemerkenswerten Interview – Sie kennen es – vom 19. Dezember 2018 in der „Süddeutschen Zeitung“ gesagt hat:
Abschiebungen können mit massiver menschlicher Härte verbunden sein. Das ist für uns ein schmerzhaftes Thema. Aber wenn wir das Recht auf Asyl aufrechterhalten wollen, müssen wir auch bei Rückführungen den Rechtsstaat durchsetzen.
Genau das hat Ihre Parteivorsitzende gesagt. – Insofern, liebe Kolleginnen und Kollegen: Nicht nur Lippenbekenntnisse abgeben, mit denen Sie populistisch die Menschen beruhigen wollen, sondern lassen Sie hier im Parlament, wo es darauf ankommt, auch Taten folgen!
Frau Jelpke hat ausgeführt, wir hätten gar kein Vollzugsdefizit. Ich weiß gar nicht, ob Sie die Antworten auf die vielen Anfragen, die Sie ständig an die Bundesregierung stellen, auch tatsächlich lesen und zur Kenntnis nehmen; denn daraus ist klar ersichtlich, dass beispielsweise im letzten Jahr die Mehrheit der Abschiebeversuche im Versuchsstadium stecken geblieben sind und wiederum von den nicht geglückten Abschiebeversuchen etwa die Hälfte daran gescheitert sind, dass wir der Menschen nicht habhaft geworden sind und diese nicht zu den Flughäfen und in die Flugzeuge bringen konnten.
– Ich gestatte eine Zwischenfrage, Herr Präside nt.
Gestatten Sie? – Okay.
