Das wirkliche geopolitische Problem entsteht gegenüber Polen, der Ukraine und dem Baltikum. Diese Länder betrachten die Pipeline mit Misstrauen. Das Verhältnis zu Polen ist ohnehin dank der Migrationspolitik schlecht und wird sich durch Nord Stream 2 nicht verbessern. Wir können unsere Energieversorgung aber nicht politischen Stimmungen unterordnen, die Folgen der Auflösung der Sowjetunion sind.
Das gilt ganz besonders gegenüber der Ukraine.
Das zweite Argument gegen die Pipeline lautet: Wir brauchen das Gas gar nicht. Die Pipeline sei nicht nur überflüssig, sie behindere die Energiewende. – Hier kann man eigentlich nur bitter lächeln. Ein Land, das aus der Atomenergie und der Kohleverstromung komplett aussteigt, steht vor dem Problem, dass sich mit Windkraft und Solarenergie eben keine stabile Grundlast herstellen lässt.
Wer sagt: „Wir brauchen das Gas nicht“, sollte wenigstens so redlich sein und fordern, die Laufzeit der Atomkraftwerke zu verlängern oder den Atomausstieg ganz aufzuheben;
denn das deutsche Versorgungssystem benötigt Kraftwerke, die schnell und verlässlich den fehlenden Strom einspeisen.
Nord Stream 2, meine Damen und Herren, ist ein typisches Beispiel für die Politik der Bundeskanzlerin. Es ist geradezu ein Kennzeichen ihrer Amtszeit, sich in Situationen zu bringen, wo am Ende nur die Wahl zwischen zwei Übeln bleibt. Die Kanzlerin ist ja nicht einmal mit der Schwesterpartei d’accord. Manfred Weber plädiert offen gegen Nord Stream 2, und zwar ganz bescheiden im Namen der EU, sozusagen als Europäer gegen deutsche Interessen.
Die Bundeskanzlerin bekommt jetzt die Quittung für die illusorische Energiewende samt dem überstürzten Atomausstieg, für das eingetrübte Verhältnis zu den USA und das ungeklärte zu Russland, für die Verärgerung der Ost- und Südosteuropäer durch deutsche Schulmeisterei und Ignoranz, also für viele Jahre diplomatische Stümperei.
Trotzdem, meine Damen und Herren – und das ist wahrscheinlich eine Premiere –, stellen wir uns in dieser Frage hinter die Kanzlerin und hinter die Bundesregierung. Wir brauchen Nord Stream 2. Die AfD-Fraktion wird das unterstützen.
