Wissen Sie, grundsätzlich bin ich froh, wenn wir solch wichtige Themen, die die Menschen draußen bewegen, hier diskutieren, liebe Kollegen der AfD.
Aber man muss es so deutlich sagen – jetzt kommen wir zum Kern Ihres Antrags –: Eine Subsidiaritätsklage an der Stelle bringt gegen Uploadfilter ungefähr genauso viel wie die Gründung eines Töpfervereins, nämlich gar nichts.
Am Inhalt dieser Richtlinie gibt es zweifellos extrem viel zu kritisieren. Das tun wir bereits; das habe ich gerade eben aufgelistet. Aber die Subsidiarität gehört zweifellos nicht dazu. Eine Klage wäre dementsprechend reine Symbolpolitik, und dabei werden wir nicht mitmachen; das sage ich Ihnen ganz deutlich.
So, und damit sind Sie drüber. Kommen Sie bitte zum Schluss.
Meine sehr geehrten Damen und Herren, die Urheberrechtsrichtlinie entspricht nicht unserem Verständnis von einem freien Internet. Aber ich sage Ihnen trotzdem: Bei diesem Antrag werden wir nicht mitmachen. Wir wollen einen digitalen harmonischen Binnenmarkt gestalten, aber nicht in dieser Form.
Vielen Dank, Roman Müller-Böhm. – Das Wort zu einer Kurz intervention – wie gesagt, nur eine pro Debatte – hat der Kollege Hoffmann.
