Frau Präsidentin! Die AfD fordert eine Streichorgie im EU-Haushalt im Interesse der EU-Bürger. Was den Konzernen nützt, soll hingegen nicht nur erhalten bleiben, sondern auch mehr werden. Da ist im AfD-Antrag zu lesen – ich zitiere –, dass „bei der Strukturpolitik eher auf Steuererleichterungen für Unternehmen als auf Subventionen“ zu setzen sei.
Mit Subventionen meint die AfD die EU-Fördergelder für Straßen, Schulen, Schwimmhallen insbesondere im Osten unseres Landes. Das erkennt man immer an diesen Schildern, auf denen dann steht: „Gefördert mit den Mitteln der EU“. Die AfD will auch bei Landwirtschaft und Kohäsion streichen, auf Deutsch: bei sozialem Zusammenhalt.
Liebe Kolleginnen und Kollegen, es reicht nicht, wenn wir uns hier alle gegenseitig versichern, wie unterirdisch der AfD-Antrag ist. Nötig sind auch ein paar grundlegende Erklärungen zum Staatswesen allgemein, sei es nun zum Staatswesen der EU sui generis oder zum traditionell bekannten Nationalstaat, den auch ich aus modischen Gründen nicht in den Abfalleimer werfen möchte.
Es gibt keine Zivilisation ohne Staatswesen und auch kein Staatswesen ohne ein Minimum an Umverteilung von oben nach unten, von den Superreichen zur breiten Mehrheit.
Ansonsten würde ein Staat, dessen Bürokratie nur die Superreichen bedient, die breiten Mehrheiten und die unteren Gehaltsgruppen vor den Kopf stoßen. Das ist übrigens der Grund, weshalb wir einen so großen Rückhalt für unser Grundgesetz haben und warum die EU an Rückhalt verliert. Es ist die mangelnde Sozialstaatlichkeit, auf die Gewerkschafter, Linke, Attac und viele andere immer hingewiesen haben, eine Sozialstaatlichkeit, wie sie sich in den Artikeln 14 und 15 des Grundgesetzes findet.
Das ist der eigentliche Kern des Widerspruchs von Linken, von Gewerkschaften und übrigens auch von der Arbeitsgemeinschaft für Arbeitnehmerfragen in der SPD gegen alle Sozialkürzungen, sei es in der EU oder in Deutschland, in Griechenland, in Portugal oder anderen Nationalstaaten.
Die AfD legt mit ihrem Plädoyer für Steuerkürzungen aber die Axt an jedes Staatswesen, an die EU und an den Nationalstaat, den Sie vorgeben zu verteidigen. Sie sind eigentlich Gegner jeglichen zivilisierten Staatswesens. Das ist der Kern.
– Herr Gauland, das glaube ich zutiefst.
