Sehr geehrte Präsidentin! Meine lieben Kolleginnen und Kollegen! Die vorliegenden Anträge können im Grunde genommen große Teile dieses Hauses von der Zielsetzung her, denke ich, unterschreiben. Es gibt eine diesen Zielen abtrünnige Fraktion, die sich an diesem Abend schon in anderer Hinsicht blamiert hat, nämlich mit der falschen Zitierung des Erneuerbare-Energien-Gesetzes. Aber sei’s drum!
Jetzt geht es um andere Anträge, zum einen um einen Antrag der FDP, zum anderen um einen Antrag der Grünen. Ich möchte hier auf zwei Punkte eingehen, und zwar zum einen auf die CO 2 -Bepreisung. Diese wird in beiden Anträgen thematisiert und ist zurzeit, wie ich finde, richtigerweise Gegenstand einer breiten Diskussion. Wir müssen uns aber darauf einlassen, dass das eben nicht nur eine Diskussion bleibt und ein Platzhalter ist, um etwas zu vertagen, sondern tatsächlich ein Aufruf und eine Grundlage dafür ist, Maßnahmen in Gang zu setzen.
Ich sage das deswegen, weil die Begrifflichkeit der CO 2 -Bepreisung – ich sage auch immer gerne: Schadstoffbepreisung – noch keine paar Minuten in der Diskussion war, da fing es schon mit bestimmten Differenzierungen an. Die Differenzierung vonseiten der FDP ist, man könne ja auch gleich eine Ausweitung des Emissionshandelssystems vornehmen; so steht es auch in Ihrem Antrag.
Ich muss dazu sagen, dass dann genau der Punkt erreicht ist, den ich gerade angemahnt habe: Man sollte daraus keine Vertagung stricken.
Wenn Sie allen Ernstes behaupten, dass man aus der Idee der Bepreisung einen erweiterten Emissionshandel machen sollte, dann ist doch absehbar, dass es sich um Jahre handeln wird
und nicht um Monate oder um Wochen. Es wird sich auch nicht um wenige Jahre handeln, sondern um viele Jahre, bis es wirklich greift. Das ist Ihnen bewusst, und trotzdem wählen Sie dieses Instrument. Da muss ich sagen: Das ist typisch für die Initiativen der FDP.
Es ist nicht zukunftsgewandt, und es ist eben auch nicht verantwortungsbewusst, wie der Titel Ihres Antrages suggeriert.
Ein weiteres Ablenkungsmanöver findet sich ebenfalls in Ihrem Antrag, und zwar indem Sie ziemlich stark auf das Instrument des CCS schielen. Auch da muss man sich einfach ehrlich machen.
– Ja, im IPCC steht auch etwas über Atomenergie.
