Frau Präsidentin! Meine sehr verehrten Damen und Herren! Lassen Sie mich zu der AfD nur so viel sagen: Wenn der Redner der AfD noch nicht mal weiß, was die Abkürzung des Gesetzes bedeutet, über das er hier spricht, dann sagt das doch alles über die Kompetenz der AfD aus. Es ist schon peinlich, sich dann hierhinzustellen.
Lassen Sie mich an dieser Stelle aber auch mal ein Loblied auf das Erneuerbare-Energien-Gesetz singen und vielleicht auch noch mal was zu seiner Historie sagen.
1998 stand in unserem SPD-Wahlprogramm das 100 000-Dächer-Solarstrom-Programm. Während die Grünen noch 5 D-Mark für den Liter Benzin gefordert haben, haben wir das 100 000-Dächer-Solarstrom-Programm auf den Weg gebracht. Aus dem Parlament heraus – Hermann Scheer, Hans-Josef Fell, und ich glaube, es war auch ein Kollege der CSU dabei – wurde dann gemeinsam das Erneuerbare-Energien-Gesetz geschaffen. Wir als Sozialdemokraten haben gesagt: Wir wollen zwar aus der Atomkraft aussteigen, aber wir wollen nicht nur sagen, was wir nicht wollen, sondern wir wollen auch sagen, was wir wollen, nämlich erneuerbare Energien in den Markt bringen. Dafür haben wir das EEG erkämpft.
Wenn ich das aus meinem Gespräch mit Hermann Scheer von vor ein paar Jahren noch richtig in Erinnerung habe, dann war das auch kein ganz leichter Kampf mit der Bundesregierung. Obwohl es damals eine rot-grüne Regierung war, mussten wir da als Parlament also auch Überzeugungsarbeit leisten. Das ist geglückt. Das Erneuerbare-Energien-Gesetz ist ein Erfolgsfaktor geworden.
Wir haben erneuerbare Energien in großem Maßstab in den Markt gebracht.
– Hören Sie doch auf mit diesen blöden Zwischenrufen. Das ist doch Quatsch. Hören Sie doch mal zu! Dann können Sie noch was lernen.
Die erneuerbaren Energien haben dezentrale Arbeitsplätze gebracht. Es gibt über 300 000 Arbeitsplätze im Bereich der erneuerbaren Energien, und zwar auch in den Dörfern. Als Beispiel nenne ich den Handwerksmeister, der die Erneuerbare-Energien-Anlagen plant, installiert und wartet.
– Das ist doch kein Zubrot.
