Frau Präsidentin! Verehrte Kolleginnen und Kollegen! Während wir hier im Bundestag debattieren, bombardiert die Luftwaffe Saudi-Arabiens ununterbrochen die jemenitische Hauptstadt Sanaa. Die Hilfsorganisation CARE berichtet, dass allein bei den 19 heftigen Luftangriffen heute Morgen sieben Menschen ums Leben gekommen sein sollen, darunter vier Kinder. Und uns erreichen dramatische Berichte aus der Hauptstadt:
„Eine Bombe fiel unweit unseres Büros, die Fenster hielten der Erschütterung kaum stand, der Boden bebte heftig. Wir sahen Rauch in der ganzen Stadt aufsteigen“, berichtet Alexandra Hilliard, die für CARE in Sana’a arbeitet. „Später hörten wir, dass eine Familie in einem Wohngebiet im Schlaf getötet wurde. Diese Familie ist gestern Abend nichts ahnend schlafen gegangen und wird nun nie wieder aufwachen.“
Zitat Ende.
Man könnte sich natürlich fragen: Was haben die Geschehnisse im Jemen mit uns hier in Berlin zu tun? Ich antworte: Ganz einfach, es sind deutsche Waffen in den Händen der islamistischen Kopf-ab-Diktatur Saudi-Arabien, mit denen im Jemen mit bombardiert und gemordet wird. Deshalb brauchen wir ganz dringend einen umfassenden, einen absoluten Rüstungsstopp für Saudi-Arabien, für Ägypten und alle anderen Länder, die an diesem mörderischen Krieg beteiligt sind.
„Aber hat denn die Bundesregierung nicht einen Stopp für Waffenlieferungen nach Saudi-Arabien erlassen?“, könnte man natürlich auch fragen. Nein; denn der sogenannte Lieferungsstopp steht nur auf dem Papier. Tatsächlich ist das Gegenteil der Fall. Wir haben es hier mit einem gezielten, ich würde sagen, Täuschungsmanöver der Bundesregierung zu tun; denn über Länder wie Frankreich, Großbritannien und Italien werden weiterhin Waffen geliefert, die in Saudi-Arabien oder eben auch in den Emiraten, die im Jemen bombardieren und Krieg führen, landen. Angesichts dessen, dass Sie dabei auch noch die europäische Idee und die europäischen Verpflichtungen als eine Ausrede bemühen, obwohl die Lieferungen in dieses Kriegsgebiet gegen europäisches Recht, gegen den Gemeinsamen Standpunkt der Europäischen Union verstoßen, sind Ihre Äußerungen meines Erachtens absolut zynisch.
Es bleibt dabei: Die Genehmigungen von Rüstungsexporten nach Saudi-Arabien sind auch ein eklatanter Verstoß gegen das Friedensgebot unseres Grundgesetzes.
Es ist auch ein Verbrechen und muss deshalb dringend gestoppt werden.
