Sehr geehrter Herr Präsident! Liebe Kolleginnen und Kollegen des Hauses! Sehr geehrte Gäste auf den Tribünen! Die berufliche Bildung in Deutschland ist exzellent. Sie ist der Grund dafür, dass unser Jobmotor läuft. Sie ist Innovationstreiber für unsere Wirtschaft, und sie ist das beste Mittel zur Integration breiter Schichten in die Arbeitswelt – und das seit Generationen.
Aber wo Licht ist, ist auch Schatten. Der Berufsbildungsbericht beschreibt, dass 25 Prozent aller Auszubildenden ihre Ausbildung vorzeitig abbrechen. Auszubildende werden zum Teil als Ersatzarbeitskräfte eingesetzt, oder die Vergütungen sind so niedrig, dass selbst Mehraufwendungen für gute Kleidung oder Monatstickets davon nicht bestritten werden können.
Leider wächst auch der Anteil von Betrieben, die nicht mehr ausreichend qualitätsgesichert ausbilden oder sich ganz aus der Ausbildung zurückziehen. Wenn wir also über ein Berufsbildungsmodernisierungsgesetz reden, dann geht es auch darum, das Versprechen zu halten, dass Modernisierung auch verbessern heißt. Und was zu verbessern ist, sind die Ausbildungsbedingungen.
Wir, die SPD, sind stolz darauf, dass wir die Mindestausbildungsvergütung jetzt durchgesetzt haben. Das ist ein Meilenstein in der Berufsbildungsgeschichte,
und es ist ein Versprechen an alle jungen Menschen: Eure Ausbildung ist etwas wert. Sie ist uns mindestens eine angemessene Vergütung wert, und ihr seid keine Bittsteller.
Wir freuen uns auch, dass diese Regelung auf Grundlage einer Sozialpartnerverständigung zustande gekommen ist, und zwar auf höchster Ebene von DGB und BDA, und eine Erhöhung automatisch erfolgt, nämlich entlang der durchschnittlichen Erhöhungen der Ausbildungsvergütungen, also auch der tariflichen Ausbildungsvergütung.
Herr Frömming, es tut mir leid. Sie haben offensichtlich keine Ahnung davon, wie Tarifautonomie funktioniert. Das ist nämlich auch Basis dessen, was Sozialpartner verabredet haben, und damit Respekt gegenüber der Sozialpartnerschaft und der Tarifautonomie. Sie sprechen von den Arbeitgebern, die überhaupt nicht tarifgebunden sind. Denen wird jetzt ein Riegel vorgeschoben.
Ich sage aber auch: Von einem Modernisierungsgesetz erwarte ich schon noch ein bisschen mehr. Ein echtes Signal der Modernisierung wäre es zum Beispiel, auch die dual Studierenden, deren Zahl wächst, endlich unter das Dach des Berufsbildungsgesetzes zu bringen.
Wo dual draufsteht, muss auch dual drin sein. Es zeigt sich aber, dass der Status der dual Studierenden nicht einheitlich geregelt ist. Dual Studierende bekommen mal einen Ausbildungsvertrag, mal einen Praktikumsvertrag, mal einen eigens ausgedachten Vertrag. Das Ganze ist umso unsinniger, als sogenannte ausbildungsintegriert dual Studierende vom BBiG bereits erfasst sind, alle anderen aber eben nicht.
Eine duale Ausbildung jedweder Art muss eine geschützte und qualitätsgesicherte Marke bleiben. Die Berufsbildung darf eben auch für dual Studierende kein Glücksspiel sein. Für ihre betriebliche Praxisphase haben sie ein Recht auf einen betrieblichen Ausbildungsplan und einen Anspruch auf einen echten Ausbildungsvertrag. Jetzt haben wir die Chance, das sauber zu regeln.
