Vor allem steht sie für Tierschutz, weil das Ferkel dann ohne Schmerzen kastriert werden kann. Aber alle diese Eigenschaften hat die Bundesregierung nicht im Blick, meine Damen und Herren. Somit quälen Sie weiterhin unsere Ferkel. Diese werden an der Vollnarkose mit Isofluran sterben,
da sie nicht zu ihrer Mutter zum Säugen kommen können.
Die wahren Tierschützer und die wahren Umweltschützer sind wir von der Alternative für Deutschland,
nicht Schwarz, Rot oder Grün, Gelb von Haus aus schon nicht. Es muss im Tierschutz endlich wieder vernünftig gehandelt werden.
Vielen Dank für die Aufmerksamkeit.
Habe die Ehre: Fünf Sekunden vor der Zeit! Servus!
Liebe Kolleginnen und Kollegen, es wird spannend sein, im Ältestenrat die einleitenden Äußerungen aufzurufen.
Die nächste Rednerin, Susanne Mittag für die SPD, gibt ihre Rede zu Protokoll. Der nächste Redner: für die FDP-Fraktion Dr. Gero Hocker.
