Herr Dr. Curio, mir fällt ein Wahlkampfslogan für Ihren nächsten Auftritt ein: Schlimmer geht immer. – Sie bestätigen das jedes Mal aufs Neue.
Sie haben gerade ein Meisterstück in Dialektik vollbracht. Wir erinnerten ja vor gut einer Stunde an 70 Jahre Grundgesetz. Ohne dieses Grundgesetz wären Sie nicht wählbar, säßen Sie nicht hier;
Ihre Rede ließe sich aber so zusammenfassen: Abschaffung des Grundgesetzes. – Wie Sie diese Dialektik hinbekommen, macht mich immer wieder sprachlos,
aber nicht völlig sprachlos. Deshalb verweise ich auf die Wortwahl.
Gerade wenn wir über eine so sensible Thematik wie „Rückkehr und Abschiebung“ sprechen, ist es sinnvoll, auf die Sprache zu achten. Die Garantie der Menschenwürde des Grundgesetzes geht davon aus, dass Menschen in ihrem Dasein um ihrer selbst willen geachtet werden und gerade nicht Dinge sind. Ich meine mich aber zu erinnern, dass Sie vorhin – das Protokoll wird es belegen – von „zwischenverwahrt“ gesprochen haben. Menschen werden nicht „zwischenverwahrt“.
Sie werden vielleicht in Gewahrsam genommen, inhaftiert, aber nicht „zwischenverwahrt“.
