sondern auch um die Menschen, die vollziehbar ausreisepflichtig sind, derer wir aber am Abschiebetag nicht habhaft werden.
Bei den Menschen mit ungeklärter Identität ist die Ausreisepflicht gegeben. Momentan sind das etwa 184 000 Menschen in Deutschland; davon liegen bei etwa 40 Prozent keine Passpapiere vor. Vor diesem Hintergrund ist es doch nur logisch und richtig, wenn wir von ihnen alles Zumutbare fordern, damit sie sich bei der Passpapierbeschaffung beteiligen.
Wer das nicht tut, der hat in der Tat mit Konsequenzen zu rechnen, etwa in der Form, dass er keine Arbeitserlaubnis mehr erhält.
Diese Menschengruppe muss erkennen – hören Sie bitte zu; ich habe Ihnen auch zugehört –, dass für sie hier in Deutschland keine Perspektive gegeben ist.
Da ich gerade bei Ihrer Frage bin, will ich noch sagen: Ich habe davon gesprochen, dass auch die Linken und die Grünen eine plumpe Stimmungsmache betreiben. Ich habe nach Ihrem Auftritt gestern Abend im Fernsehen heute mal geschaut, was die Grünen auf ihrer Homepage veröffentlichen. Da steht:
… die Möglichkeiten, Menschen in Ausreisegewahrsam zu nehmen, werden noch weiter ausgeweitet …
