Es geht weiter. Die AfD schreibt in ihrem Antrag, dass eine Reihe von hochprofitablen Unternehmen kaputtgemacht wurden.
Ich war damals Geschäftsführer in einem Schmuckbetrieb. Zunächst war der Beschiss – Entschuldigung –, dass wir bei dem, was wir im Westen verkauft haben, die Preise mal vier genommen haben. Aber als wir am 1. Juli 1990 Preise kalkulieren mussten und unsere Kosten dagegengesetzt haben – es war ordnungspolitisch nicht richtig, wohl aber gesellschaftspolitisch und sozial richtig, die Löhne und Gehälter eins zu eins umzustellen –, kamen wir nicht ansatzweise gegen die Schmuckindus­trie in Baden-Württemberg an, weil die Produktivität zu gering war. Nicht die Menschen waren das Entscheidende, sondern die Rahmenbedingungen. Wir hatten keine konkurrenzfähigen Produkte. Der Betrieb existiert heute noch, aber statt 700 Mitarbeiter sind es nur noch 35.
Zur Wahrheit der Treuhand gehört auch Folgendes: Sie wurde zur Modrow-Zeit gegründet, und am 17. Juni vor 29 Jahren hat die freigewählte Volkskammer das Treuhandgesetz beschlossen, mit dem Hauptauftrag „Privatisierung“.
Herr Kollege Bartsch, ich höre immer gerne zu, wenn Sie die Fehler bei der Treuhand beschreiben. Aber Sie vergessen die Rahmenbedingungen. Wie sah es denn vor gut 29 Jahren zur Jahreswende 1989/90 aus?
Zu Hunderttausenden sind die ehemaligen DDR-Bürger in den Westen gegangen. Wenn man nicht schnell den Pfad zur deutschen Einheit beschritten hätte, dann wäre der Exodus weitergegangen.
Der nächste Punkt. Die Sowjetunion hat der Warnow-Werft in Warnemünde kein Schiff mehr abgenommen. Damit war Schluss. Und waren wir nicht selbst Täter und Opfer zugleich? Herr Bartsch, haben Sie noch einen Kühlschrank des DKK Scharfenstein gekauft?
Herr Bartsch, haben Sie noch ein Fernsehgerät aus Staßfurt gekauft? Oder glauben Sie, dass ich, der für die EDV bei Ostsee-Schmuck verantwortlich war, mir noch einen Computer von Robotron gekauft habe? Nein, das alles waren keine wettbewerbsfähigen Produkte.
Deswegen waren wir Täter und Opfer zugleich. Von Wartburg und Trabant brauchen wir an dieser Stelle gar nicht zu reden.
Man kann immer darüber philosophieren, welche Alternativen es gegeben hätte. Es wäre sicherlich keine Alternative gewesen, den Genossen Bartsch als Chef der Treuhandanstalt zur Modrow-Zeit einzusetzen; denn wir hätten die alte Kommunalstruktur weitergeführt. Es wäre auch keine Alternative gewesen, Ostdeutschland zu einem eigenen Währungsgebiet zu machen. Das hätte alles nicht funktioniert. Deswegen war die schnelle Privatisierung die einzige Alternative. Ja, es waren Glückswanderer unterwegs. Ja, es war auch kriminelle Energie dabei. Aber wenn ich an die maroden Industriestrukturen in Bitterfeld im Jahr 1989 zurückdenke und das mit dem vergleiche, wie es dort heute aussieht:
Dort hat sich mit die modernste und sauberste Chemieindustrie, die es in Europa gibt, angesiedelt. 5 Milliarden Euro sind dort investiert worden. Viele Betriebe, die damals privatisiert worden sind, haben heute, so meine ich, einen guten Weg eingeschlagen, eine positive Entwicklung genommen.
