und auf die Erfolge unserer Haushaltspolitik verweisen. Die Schuldenbremse ist ein Erfolgsmodell, auch wenn es natürlich in jeder Partei Vertreter gibt, die das eventuell anders beurteilen.
Ein Blick auf die bisherigen Zahlen seit Einführung zeigt: Die Schuldenbremse funktioniert. Trotz oder vielleicht sogar gerade wegen der Schuldenbremse steigen die Investitionen im Zeitraum von 2020 bis 2023 auf 158 Milliarden Euro.
Mehr als 36 Milliarden Euro mehr als in der vergangenen Legislaturperiode.
Meine Damen und Herren, welche Botschaft kann Deutschland an Europa senden? Wir schaffen erstmals seit vielen Jahren, dass die Bundesrepublik Deutschland 2019 auch wieder die Maastricht-Stabilitätskriterien erfüllen wird, das heißt, die gesamtstaatliche Schuldenquote wird unter 60 Prozent gedrückt. Das ist der Erfolg einer soliden und ausgewogenen Haushaltspolitik, vor allem aber auch ein Erfolg vieler fleißiger Arbeitnehmerinnen und Arbeitnehmer und vieler ehrlicher Unternehmen in unserem Land.
Jetzt wird es spannend, meine Kolleginnen und Kollegen der FDP; denn manches aus Ihrem Antrag stimmt ja. Man muss sagen – ich habe es bereits erwähnt –: Da ist auch viel Lob für die Regierungsarbeit der Großen Koalition dabei. Ich zitiere mal ein paar Stellen aus Ihrem Antrag: „Haushaltsdefizit und öffentlicher Schuldenstand … gesunken“;
„Die Schuldenuhr des Bundes läuft … rückwärts“. Alles Aussagen, die man über die schwarz-gelbe Bundesregierung damals nicht treffen konnte.
Im Gegenteil: Ungern erinnere ich mich an Ereignisse Ihrer Lehrzeit in Regierungsverantwortung: Dazu gehören Rückzahlungen in Milliardenhöhe an Energiekonzerne wegen einer verfehlten Atompolitik.
Ich erinnere an die Mövenpick-Steuer, die ein großzügiges Lobbygeschenk war und letztendlich auch dazu führt, dass die AfD von ihren Vergünstigungen profitiert.
Jetzt behauptet die FDP in ihrem Antrag, dass sie Gerüchte aus dem Bundesfinanzministerium gehört hätte, wonach im BMF ganz ungeniert über die Auslagerung öffentlicher Investitionen nachgedacht werden würde.
