Herr Präsident! Meine Damen und Herren! Liebe Kolleginnen und Kollegen! Ich glaube, der größte Quatscher hat sich gerade hingesetzt.
Kommen wir zum Thema. Ich freue mich sehr, dass wir heute, wenn auch leider zu später Stunde, den Startschuss für unsere nationale Tourismusstrategie abfeuern können. Warum, liebe Kolleginnen und Kollegen, ist das so wichtig, warum ist diese Strategie so bedeutend? Tourismus ist zum überwiegenden Teil ein standortgebundenes Dienstleistungsgewerbe. Fast 3 Millionen Menschen arbeiten hier. Das ist enorm.
Genießt diese Branche aber auch die angemessene Aufmerksamkeit? Ich sage: Nein, das tut sie nicht. Tourismus wird in Deutschland leider nicht als wichtiger Motor für Beschäftigung und Wachstum wahrgenommen.
Woran liegt das? Das hängt vor allem mit den unterschiedlichen Zuständigkeiten zusammen. Tourismus ist Aufgabe der Länder, der Städte, der Kommunen. Aber auch auf Bundesebene und in der Privatwirtschaft befassen sich unterschiedlichste Akteure mit tourismuspolitischen Belangen. Was fehlt, ist eine gute Koordination und Vernetzung der verschachtelten Zuständigkeiten.
Meine Damen und Herren, die Bundesregierung wird zum ersten Mal in der Geschichte der Bundesrepublik eine umfassende Strategie zum Tourismus in Deutschland vorlegen.
Wir bündeln damit alle Kräfte für den Tourismus und stärken die Branche nachhaltig und sozial. Das hat es bisher in Deutschland nicht gegeben; das ist ein ganz gewaltiger Schritt.
Wir von der SPD haben die Tourismusstrategie in den Koalitionsvertrag hineinverhandelt.
