Drittens: Zusammenhalt im Bündnis; das ist ein ganz wichtiger Punkt.
Wir planen und produzieren als verlässlicher Partner gemeinsame Rüstungsprojekte, die wir selber wegen der enormen Entwicklungskosten und notwendigen Stückzahlen alleine nicht wirtschaftlich produzieren könnten.
Doch schon heute macht vor dem Hintergrund der permanenten Saudi-Arabien-Debatten das Schlagwort „German-free“ die Runde, also: Wir machen es lieber ohne die Deutschen.
Wollen Sie also einen Ausschluss Deutschlands aus all diesen internationalen Kooperationen?
Wenn ja, dann stehen Sie doch auch dazu, zeigen Sie die Konsequenzen auf, und zeigen Sie insbesondere Mitarbeitern von Krauss-Maffei, Rheinmetall, der Peene-Werft, Heckler & Koch oder der Airbus-Gruppe die Konsequenzen auf.
Aber Sie wollen doch eigentlich mehr. Sie wollen eine Isolierung Deutschlands bei den europäischen Partnern im Bündnis und den Ausstieg aus der NATO. Das ist doch ihr eigentliches Ziel.
Bundesaußenminister Heiko Maas hatte recht, als er am 10. März 2019 im Berliner „Tagesspiegel“ zur Haltung der Bundesregierung ausführte:
Das haben wir nicht nur mit Blick auf den Fall Khashoggi getan, sondern auch weil wir Druck ausüben und deutlich machen wollen, dass wir auch von Saudi-Arabien und den Vereinigten Arabischen Emiraten einen Beitrag zu einem Friedensprozess … erwarten.
Auf die Frage, ob wieder geliefert werden könne, antwortete er:
Das hängt davon ab, wie sich die Dinge entwickeln.
Wir von der Union unterstützen diese Haltung, und ich stimme Bundeswirtschaftsminister Peter Altmaier völlig zu, wenn er in der „SZ“ am 25. Oktober 2018 sagt:
Es hat keine Folgen positiver Art, wenn nur wir die Exporte nicht weiter durchführen, aber gleichzeitig andere Länder diese Lücke füllen.
Ich sage: Eine gemeinsame europäische Linie ist nötig; denn Saudi-Arabien erhält aus anderen Ländern weitaus mehr Rüstungsgüter als aus Deutschland. Um die Größenordnung der Rüstungsimporte zu vergleichen: USA 61 Prozent, Vereinigtes Königreich 23 Prozent, Frankreich 3,6 Prozent, Deutschland 1,7 Prozent.
Zum Antrag der AfD nur eine kurze Anmerkung. Es geht Ihnen allein darum, zwei Themen unanständig zu verknüpfen, nämlich ein Rüstungsexportverbot mit der Flüchtlingsproblematik im Mittelmeer. Es geht Ihnen gar nicht um eine sinnvolle mögliche Alternativverwendung, sondern allein um Schaufensteraussagen.
Was Sie in Ihrem Antrag machen, ist schlicht und einfach schäbig: Sie versuchen, die Angst der Mitarbeiter vor einem Arbeitsplatzverlust in parteipolitische Münze zu Ihren Gunsten umzuwandeln. Das ist Populismus pur.
Ich danke umso mehr der Bundesregierung, dass im Beschluss des Bundessicherheitsrates vom 28. März 2019 klar geregelt ist, dass auch eine Entschädigungsmöglichkeit für die Werften bzw. die Wehrindustrie für die nicht gelieferten Waffen besteht.
Das ist Politik, wie sie die Union macht: die internationale Fähigkeit Deutschlands zur Zusammenarbeit stärken, das Vertrauen in geschlossene Kooperationsverträge untermauern, deutsche wehrtechnische Industrie erhalten und stärken und damit Sicherheit und Arbeitsplätze in Deutschland. Das ist der Weg der Union.
Danke für die Aufmerksamkeit.
Vielen Dank, Bernhard Loos. – Die letzte Rednerin in dieser Debatte: Dr. Daniela De Ridder für die SPD-Fraktion.
