Das ist die Kernaufgabe, die wir haben.
Herr Oellers, Sie haben gerade gesagt, die Aufgabe dieser Werkstätten sei es, Leute in den ersten Arbeitsmarkt zu vermitteln. Das gelingt bei unter 1 Prozent aller Fälle. Das heißt, die Aufgabe ist nicht erfüllt. Alle diese Themen müssen auf den Prüfstand, nicht nur das Entgelt.
Frau Kollegin, kommen Sie bitte zum Schluss.
Es ist unbegreiflich für mich, dass man vier Jahre dafür braucht und all die anderen Themen unberührt bleiben. Deswegen ist das wieder einmal ein Abend, an dem ich sagen muss: Für die inklusive Gesellschaft tut diese Regierung nichts. Das tut mir leid.
Vielen Dank.
Als nächster Redner hat das Wort der Kollege Uwe Schummer, CDU/CSU-Fraktion.
