Frau Präsidentin! Liebe Kolleginnen und Kollegen! Das ist eine sehr interessante Aktuelle Stunde, die ja den Titel „Souveränität in der Energieversorgung sichern – Sanktionspolitik bei Nord Stream 2 entgegentreten“ trägt. Herr Gauland, wenn Sie als AfD diesen Titel für die von Ihnen beantragte Aktuelle Stunde wählen, dann müssen Sie auch etwas zur Sanktionspolitik Ihres Freundes Donald Trump sagen.
Er ist doch Ihr Vorbild des Rechtspopulismus. Es sind doch Ihre Leute, die gerade Sanktionspolitik androhen. Sagen Sie doch mal, was Donald Trump macht.
– Nein, Sie haben gar nichts gesagt.
Sie haben im Prinzip irgendwas dahergeredet, aber Sie haben nicht gesagt, dass die Sanktionspolitik von Donald Trump ausgeht.
Dem muss entgegengetreten werden. Da hat die AfD aber in dieser Aktuellen Stunde vollkommen versagt.
Herr Gremmels, es ist richtig, dass sich da einige wegducken; auch der Wirtschaftsminister duckt sich weg. Das Problem ist: Die Bundesregierung duckt sich komplett weg.
Auch Außenminister Heiko Maas aus Ihrer Partei wird jede Woche vom US-Botschafter vorgeführt. Wo ist denn der Außenminister, wenn es darum geht, dass wir eine souveräne Energiepolitik machen, dass wir eine souveräne Außenpolitik machen, bei der es um die Interessen von Deutschland und Europa und nicht um die Interessen von Amerika und um deren Fracking-Gas geht?
Auch der Außenminister Heiko Maas taucht völlig ab.
Und um die Sache auf den Gipfel zu treiben: Vor anderthalb Stunden hatten wir eine Sitzung des Europaausschusses mit der Kanzlerin. Liebe Zuschauerinnen und Zuschauer, liebe Fernsehzuschauer und liebe Interessierte aus der Industrie, ich habe die Kanzlerin zweimal gefragt: Was ist die Antwort der deutschen Bundesregierung auf die Sanktionsandrohungen der USA? – Zweimalige Antwort war: Das ist das Problem der Wirtschaft. Sie muss sich entscheiden, ob sie in Zukunft Geschäfte mit Amerika oder mit Russland oder mit wem auch immer machen will. – Eine deutsche Politik, die sich von den USA bedrohen lässt und keinerlei Antworten darauf findet, versagt auf ganzer Linie. Man kann da nicht mehr von einer souveränen und eigenständigen Politik reden.
Herr Pfeiffer, auch Sie haben sich hier jetzt für Nord Stream 2 ausgesprochen. Sagen Sie doch mal etwas zu dem, was in Amerika passiert! Wenn Trump erfolgreich ist, brauchen wir uns nicht mehr über Eigenständigkeit unterhalten.
Dann sind wir nur noch der Hinterhof amerikanischer Interessen. Wir als Linke lehnen dieses Duckmäusertum der deutschen Bundesregierung entschieden ab.
Ja, ich gebe einigen Vorrednern recht: Manfred Weber ist leider wegen dieses Themas völlig ungeeignet, EU-Kommissionspräsident zu werden.
