– Nein, nein, es hörte sich nicht anders an.
Wir beraten dieses Gesetz schon seit September bzw. seit April.
Ich habe ausdrücklich angeboten, dass wir die Sitzung – –
– Vielleicht hören Sie einfach mal zu.
Ich habe ausdrücklich angeboten, dass wir mit den Anhörungen zu früheren Uhrzeiten beginnen, dass wir die Ausschusssitzung fortsetzen, damit jeder so viele Fragen stellen kann, wie er will. Aber wenn sich die Fraktionen im Obleutegespräch darauf verständigen, dass die Sitzung um 12.45 Uhr enden soll,
dass Nachmittagssitzungen nicht gewünscht werden, und – im Gegenteil – erst vor einigen Wochen eine von mir anberaumte Nachmittagssitzung – um 16 Uhr – zur Abarbeitung von Oppositionspunkten – ausschließlich Oppositionspunkte! –
moniert wurde und gesagt wurde, wie man so unmöglich sein kann,
eine Zusatzsitzung anzuberaumen, dann frage ich Sie, was Sie für ein parlamentarisches Verständnis haben, wenn Ihre Arbeitszeit um 13 Uhr zu Ende ist.
Liebe Kolleginnen und Kollegen, voraussichtlich letzter Redner in dieser Debatte – aber heute weiß man nie – ist der Kollege Alexander Throm, CDU/CSU.
Ich bitte, ihm genauso zuzuhören wie allen anderen Rednern.
