Eine Aufgabenkritik ist natürlich notwendig, die Aufgabenerledigung und -kontrolle ebenso. Wir wollen daher eine Stärkung der Säule der sozialen Rechte und eine stärkere Finanzierung. Wir wollen Bildung und Forschung selbstverständlich auf hohem Niveau finanzieren. Wir wollen Sicherheit, und deshalb wollen wir Frontex ausbauen. Wir haben natürlich klassische Aufgaben. Den Kapitalmarkt und die Bankenunion im Auge zu behalten, ist ganz wichtig für die Wirtschaftskreisläufe. Auch die Investitionsprogramme für Beschäftigung und Wachstum sind uns wichtig.
All dies sind Dinge, die wir über die Europäische Union finanzieren wollen; das steht in unserem Programm. Das ist im mehrjährigen Finanzrahmen abzubilden. Wir werden eine Diskussion darüber führen, wie viel Geld man dafür braucht. Die FDP hat schon gesagt, dass sie nicht mehr geben will, stellt aber immer wieder neue Forderungen auf. Das ist Bestandteil des Programms. Wir werden diese Diskussion nach der Europawahl führen, und dann brauchen wir ein ausreichend großes Budget. Im Koalitionsvertrag haben wir festgelegt, dass Deutschland zu einem höheren Beitrag bereit ist.
Die Eigenmitteldebatte werden wir auch führen; denn es ist vollkommen klar: Wir brauchen Europa; denn wer glaubt, dass Deutschland die Antwort auf die Globalisierung, die Digitalisierung und auf die Anforderungen des Umweltschutzes oder des Grenzschutzes und der Sicherheit national geben kann, der hat wirklich keine Ahnung, wie die Welt funktioniert.
Wir brauchen ein starkes Europa. Wir brauchen ein friedliches Europa. Wir wollen ein offenes Europa. Was wir nicht brauchen, sind solche irrwitzigen Anträge der AfD.
Vielen Dank für Ihre Aufmerksamkeit. Glück auf!
Vielen Dank, Christian Petry. – Das Wort zu einer Kurzintervention hat Frau Dr. Malsack-Winkemann.
