Bis 2024 möchten Sie zusätzlich noch mal 118 Millionen Euro ausgeben. 118 Millionen! Das wären beispielsweise 235 000 neue PCs für Schüler an deutschen Schulen. Das wären knapp 500 brandneue Sportplätze, wo man sich den Frust über Ihre Politik abtrainieren könnte.
Sie könnten mit 118 Millionen Euro Kitaplätze schaffen, Sie könnten den Naturschutz fördern oder die Infrastruktur im ländlichen Raum verbessern. Alles sinnvolle Investitionen, für die nach Ihrer Lesart ja grundsätzlich nie Geld da ist. Aber ich sage Ihnen was: Selbst wenn Sie jedem deutschen Bürger von diesem Geld ein Hanuta und eine Capri-Sonne kaufen würden, wäre das immer noch eine bessere Investition als dieser Gesetzentwurf.
Aber es ist ja mittlerweile kein Geheimnis mehr, dass Ihnen die Menschen, die schon länger hier leben, nicht so sehr am Herzen liegen. Aber wenn Sie das Geld schon unbedingt für Fremde ausgeben wollen, wie wäre es dann damit, dass Sie dieses hart erarbeitete Geld der Steuerzahler für die Menschen ausgeben, die tatsächlich zu Recht hier sind, die Menschen, die wirklich vor Krieg und Terror geflohen sind oder die wegen ihres Glaubens oder ihrer politischen Einstellung verfolgt wurden? Wir als AfD-Fraktion stehen an der Seite dieser Menschen. Aber die Glücksritter, die Ausreisepflichtigen, die IS-Kämpfer und die Sozialhilfetouristen, für die gibt es eine Lösung, und das ist: abschieben, abschieben, abschieben.
Wie Sie sich vorstellen können, lehnen wir Ihren Gesetzentwurf natürlich ab.
Herzlichen Dank.
Liebe Kolleginnen und Kollegen, ich möchte an die Debatte des heutigen Vormittags zu 70 Jahren Grundgesetz erinnern, an Artikel 1 des Grundgesetzes: „Die Würde des Menschen ist unantastbar.“
– Es gibt keine Zwischenfragen.
