der Bundeswehr nicht nur die Einsatzbereitschaft der Streitkräfte vernichtet,
sondern Sie machen die Bundeswehr dadurch seit Jahren auch unattraktiver.
Junge Leute, die Soldat werden wollen, erwarten eine Welt, in der Begriffe wie Pflicht, Treue und Kameradschaft noch Bedeutung haben.
Sie wollen Teil von etwas Besonderem sein. Sie wollen geben, leisten und sich beweisen.
Sie wollen auch, dass die Panzer und Schiffe funktionieren, auf denen sie eingesetzt sind. Homeoffice, Gleitzeit und Diversity Management sind kein akzeptabler Ersatz. Deswegen kriegen Sie die Leute auch nicht.
Die Bundesregierung befindet sich auf der falschen Route und fährt in die falsche Richtung, und da sie beides nicht ändern will, wird sie das Ziel „einsatzbereite Streitkräfte“ nicht erreichen.
Meine Damen und Herren, wer den Zustand dieser Regierung sieht, weiß, dass sich an dieser falschen Politik nichts ändern wird. Das ist die Tragik. Die falschen Leute an den Hebeln der Macht erkennen nie, dass sie selbst das Problem sind. Deswegen ist die AfD gegründet worden
und hat in der deutschen Geschichte einen einmaligen Aufstieg in alle deutschen Parlamente hingelegt.
Und deswegen wird die AfD den Kampf um Deutschland weiterführen und gewinnen.
Wir wollen nicht, dass Sie unser Land und seine Institutionen ruinieren. Wir wollen das Richtige wieder selbstverständlich machen.
Und dazu gehört auch eine einsatzbereite und stolze Bundeswehr.
Für die SPD-Fraktion ist der nächste Redner der Kollege Thomas Hitschler.
