Sehr verehrte Frau Präsidentin! Meine Damen und Herren! Ja, Arbeit sollte sich immer lohnen, auch materiell, und wir als Politikerinnen und Politiker sind selbstverständlich aufgefordert, dies sicherzustellen. Das Thema, dass wir darauf achten müssen, ob gerade Durchschnitts- und Geringverdiener aktuell zu stark durch Steuern und Sozialabgaben belastet werden, wollen wir angehen, und das werden wir auch angehen.
– Sie gehen es nicht an. Gut ist, dass Sie jetzt einmal zuhören dürfen.
Wenn man mit Armut argumentiert und fordert, dass sich die Lebenssituation von Geringverdienern oder auch anderen Arbeitnehmern verbessert, dann ist erst einmal absolut wichtig und richtig, zu sagen: Dafür sind Löhne verantwortlich, dafür ist in einer freien Wirtschaft nicht per se der Staat verantwortlich. – Damit wir gute Löhne haben, brauchen wir eine stärkere Tarifbindung. Es muss leichter gemacht werden, Branchenmindestlöhne zu verabschieden. Darüber können Sie einmal nachdenken. Wir brauchen sowieso einen höheren Mindestlohn. Die Mindestlohnkommission muss gestärkt werden.
Was wir auch brauchen, liebe AfD,
ist ein europäischer Mindestlohn,
der in den jeweiligen Ländern die Produktivität dieser Länder berücksichtigt und auch dort vor Armut schützt. Er würde Europäerinnen und Europäer vor zu geringen Löhnen und Arbeitnehmerinnen und Arbeitnehmer in Deutschland vor einem falschen Dumpingwettbewerb in einem offenen Europa schützen.
