Vielen Dank. – Herr Präsident! Meine sehr verehrten Damen und Herren! Liebe Kolleginnen und Kollegen! Deutschland ist ein Einwanderungsland. Einwanderung braucht Regeln, sonst läuft sie ungeregelt, und mit diesem Fachkräfteeinwanderungsgesetz schaffen wir diese Regeln für unser Land. Es ist höchste Zeit. Es ist ein guter Tag für Deutschland, dass wir das heute tun.
Wir regeln, dass auch beruflich Qualifizierte in unser Land kommen können, nicht nur die Höchstqualifizierten und diejenigen, die schon einen hochdotierten Arbeitsvertrag in der Tasche haben. Wir regeln, dass Menschen zur Suche nach Arbeit oder zur Suche nach einer Ausbildung nach Deutschland kommen können. Wir regeln auch, dass Menschen, die sich hier über einen Asylantrag nach Deutschland begeben und festgestellt haben, dass sie kein Asylrecht haben, aber langwierige Verfahren erdulden mussten, die begonnen haben, sich hier zu integrieren, die hier arbeiten, die hier ihren Lebensunterhalt sichern können, hier auch ein Bleiberecht haben. Niemand versteht, dass wir einerseits Menschen aus dem Ausland anwerben, während wir gegenüber Menschen, die sich hier gut integriert haben und arbeiten, eine Abschiebung vollziehen. Es ist gut, dass wir diese Regelung heute hier verabschieden können.
Wir haben nun eine gesetzliche Grundlage, Einwanderung nach Deutschland zu steuern. Diese Einwanderung ist an strenge Voraussetzungen gebunden. Das soll auch so sein. Wir wollen behutsam vorgehen, und wir können nachsteuern, wenn das der Bedarf ergibt. Ich halte das für angemessen. Ich halte es für pragmatisch. Wir können dabei flexibel bleiben. Das nenne ich ein modernes Einwanderungsrecht.
Seit ich in den Bundestag gewählt wurde, setze ich mich dafür ein, dass wir legale Wege nach Deutschland eröffnen, auch um die irreguläre Migration zurückzudrängen, dass wir Geschäftsmodelle bekämpfen, bei denen Menschen in den Herkunftsländern vorgegaukelt wird, dass sie hier eine gute Zukunft haben und hier willkommen sind, egal ob sie die Voraussetzungen erfüllen. Diese Menschen lassen oft alles zurück und müssen ihr Geld für Schlepperorganisationen ausgeben. Am Ende werden sie auf Boote geschickt, die für die See nicht tauglich sind, und dort werden sie sich selbst überlassen, nur um am Ende, wenn sie es schaffen, festzustellen, dass es vergeblich war. Wir müssen diese Geschäftsmodelle unterbrechen. Das geht nicht mit Abschottung. Das geht, indem wir legale Wege eröffnen. Das tun wir mit diesem Einwanderungsgesetz. Deswegen ist es gut, dass es heute verabschiedet wird.
Herr Castellucci, gestatten Sie eine Zwischenfrage von den Linken?
Ich würde jetzt gerne am Stück vortragen.
Okay.
