Herr Präsident! Meine Damen und Herren! Nach den teilweise etwas apokalyptisch anmutenden Reden der Opposition über das BAföG kann man, glaube ich, am Ende noch mal versuchen, das eine oder andere ins rechte Licht zu rücken.
Worum geht es uns beim BAföG? Es geht darum: Leistung und Talent müssen darüber entscheiden, welchen Weg ein junger Mensch wählt. Deshalb richtet sich der vorliegende Gesetzentwurf an diejenigen, die gerade überlegen, ein Studium aufzunehmen; im Moment laufen die Abiturprüfungen. Er richtet sich an die Schülerinnen und Schüler, die nicht mehr zu Hause wohnen. Er richtet sich an diejenigen, deren Eltern gerade mit ihnen darüber diskutieren: Wie bekommen wir das mit dem Geld hi n, wenn du studieren gehst? Wer bezahlt Miete, Lebensunterhalt und Krankenversicherung? – Deswegen sage ich an der Stelle bewusst: Nutzt eure Chance! Euer Talent soll entscheiden, nicht der Geldbeutel eurer Eltern, und das BAföG ist das Instrument, das euch dabei unterstützt und hilft und nicht daran hindert, ein Studium aufzunehmen.
Augenblick mal, Herr Kollege. – Auch wenn jetzt gleich die Abstimmungen stattfinden und offenbar noch viel Diskussionsbedarf besteht, möchte ich alle bitten, den Lärmpegel etwas herunterzufahren und dem Redner die notwendige Aufmerksamkeit zu schenken. – Fahren Sie bitte fort.
Heute, meine Damen und Herren, machen wir dieses BAföG noch besser, noch verlässlicher, noch planbarer und lebensnäher. Unser Ziel ist: mehr Geld für mehr Menschen im BAföG. Deshalb erhöhen wir die Bedarfssätze kräftig, damit das BAföG mehr zum Leben reicht, und deswegen wollen wir in der namentlichen Abstimmung auch wissen, ob die Opposition bei der Erhöhung des Höchstsatzes auf 861 Euro mitgeht.
Deshalb heben wir die Wohnpauschale um knapp ein Drittel an, und deshalb machen wir bei den Freibeträgen einen großen Schritt nach vorne, damit wieder mehr Menschen BAföG beantragen können.
Herr Gehring, die Kritik der Grünen an der Stelle ist wirklich paradox; denn Sie beantragen eine sofortige Anhebung der Freibeträge um 10 Prozent und danach einen Inflationsausgleich.
Wir beantragen 16 Prozent in drei Schritten – nachhaltig, damit die Empfängerzahl nicht wieder sinkt.
Sie fordern weniger, als wir in der Novelle umsetzen, und erzählen den Leuten, dass mehr damit erreicht werden kann.
Das ist keine Trendumkehr. Unser Entwurf ist nachhaltiger und solider.
