Frau Präsidentin! Liebe Kolleginnen und Kollegen! Wir erleben ein uns allen jetzt schon ziemlich bekanntes Schauspiel: Donnerstagabend, nach 21 Uhr, ein neuer Beitrag aus der Reihe „Juristisches Halbwissen der Alternative für Deutschland“.
Es gibt aber diesmal eine Neuerung: Nicht Herr Brandner, der sonst immer der Zauberlehrling ist, tritt an, sondern Corinna Miazga.
Ich frage mich immer: Was soll das? Wissen Sie, ich versuche immer, das Beste aus solchen Debatten zu ziehen. Da muss ich sagen: Zum Jubiläum „70 Jahre Grundgesetz“ hat der Donnerstagabend irgendwie immer auch was Schönes; denn dann haben wir die Gelegenheit, die weniger bekannten Normen des Grundgesetzes ein bisschen im Parlament zu erörtern. Diesmal haben Sie sich eine schöne Norm ausgesucht: Artikel 23 Absatz 1a – Subsidiaritätsklage. In der Tat, das gab es noch nie im Deutschen Bundestag. Es ist doch schön, dass wir die Gelegenheit haben, mal darüber zu reden.
Frau Miazga, Sie haben gesagt, Sie nähmen das Grundgesetz und Artikel 23 Absatz 1a sehr ernst. Das ist sehr schön, aber es gibt einen Unterschied zwischen ernst nehmen und verstehen.
Denn man muss deutlich sagen: Verstanden haben Sie es anscheinend nicht.
Ich frage mich: Was machen wir jetzt?
