Sehr geehrter Herr Präsident! Liebe Kollegen! Wir reden über den Antrag und die Große Anfrage der Grünen zur internationalen Lage der Menschenrechte von Lesben, Schwulen, Bisexuellen, Transsexuellen, Transgendern und Intersexuellen. – An dieser Stelle fehlt ein Q. Ich glaube, Sie diskriminieren die Queeren.
Egal, in Antrag und Anfrage vermischen die Grünen absichtsvoll – ich sage ausdrücklich: legitime – Anliegen zum Schutz der persönlichen Freiheit und körperlichen Unversehrtheit mit links-grünem Ideologieexport und Klientelpolitik. Die Grünen und die Normalbürger leben auf zwei verschiedenen Planeten.
Die einen leben in der realen Welt, müssen hart arbeiten und ächzen unter Steuern und Abgaben, unter steigenden Energie- und Wohnkosten, sie müssen sich krummlegen, um ihren Lebensstandard zu halten. Die anderen leben in ihrer staatlich subventionierten links-grünen Scheinwelt,
ihnen geht es so gut, dass sie sich mit Geschlechtervielfalt in Burkina Faso, der Rolle der Transsexualität in der US-Armee, Intersexualität in Nepal und der Homoehe in Uruguay beschäftigen können.
Die Grünen fordern, das Diplomatische Korps in den Botschaften soll in LSBTTI-Rechten geschult werden; das soll elementarer Bestandteil der Ausbildung werden.
Die Bundesregierung handelt bereits in vorauseilendem Gehorsam ganz in diesem grünen Sinne – ich darf zitieren –: Deutsche Botschaften beteiligen sich an Gay-­Pride-Paraden
in Griechenland, Israel, Italien, Lettland und Litauen.
Dem deutschen Steuerzahler werden Rekordsteuern abgepresst, um dann damit Diplomaten zu bezahlen,
