Wenn Sie wirklich Antisemitismus bekämpfen wollten, hätten Sie zuletzt in Chemnitz die Nazis, mit denen Sie Seite an Seite marschiert sind, davon überzeugen sollen, keine Straftaten gegen Juden und jüdische Einrichtungen zu begehen.
Wenn Sie mit uns am Minderheitenschutz in Deutschland arbeiten wollen, dann wirken Sie auf Ihre Klientel ein. Halten Sie sie davon ab, Synagogen zu beschmieren,
mit Knüppeln auf Menschen und jüdische Restaurants einzuschlagen und Hass zu verbreiten; denn die wahre Gefahr kommt von rechts.
Weil die Lage so ernst ist, haben wir im April Felix Klein als Antisemitismusbeauftragten ernannt, der sowohl den Antisemitismus von rechts als auch von Muslimen im Blick und das Thema im Fokus der Öffentlichkeit behalten wird, natürlich genauso wie unsere Sicherheitsbehörden.
Was die Hisbollah angeht – wenn Sie mir noch einen Satz dazu erlauben –,
ist selbstverständlich ein Verbot erforderlichenfalls ein Thema; keine Frage. Aber dazu brauchen wir keine Aufforderung von Ihnen. Seien Sie dankbar, dass in unserem Rechtsstaat die Hürden für Verbote sehr hoch sind. Das ist auch richtig so.
Vereinsverbote sind nun mal keine Lappalie.
