Frau Präsidentin! Meine Damen und Herren! Unsere Deutsche Bahn: Jeder liebt sie, jeder hasst sie, jeder hat aber vor allem eine Meinung zu ihr. Das wird auch heute wieder deutlich, da jede Fraktion mindestens einen Antrag vorgelegt hat. Ja, so mancher hat sogar seine besonderen Erfahrungen mit ihr gemacht. So unterschiedlich diese auch gewesen sein mögen: Im Ziel sind wir uns alle einig, auch hier im Deutschen Bundestag – na ja, fast, würde ich sagen. Wir wollen die Schiene stärken. Dieses klare Signal braucht die Mobilitäts- und Verkehrspolitik in unserem Land, und wir schaffen es auch nur so, Mobilität für jedermann zu gewährleisten und gleichzeitig etwas für Umwelt und Klima zu tun.
Im Ziel geeint: Erst mal ein gutes Zeichen. Aber zum Ziel muss man ja irgendwie hinkommen. Und genau da trennen sich die Wege. Da wird dann wirklich deutlich, wer hier stringent aufs Ziel zusteuert, wer sich unterwegs verläuft und wer nur das Phrasenschwein füttert.
Fangen wir mal links an. Strecken reaktivieren: Klingt gut. Ich finde es sogar richtig gut. Bei mir zu Hause im Kreis machen wir das auch schon. Ab 2023 sind die Städte Harsewinkel, Verl, Gütersloh wieder im Stundentakt auf der Schiene miteinander verbunden.
Da ist man vor Ort aktiv geworden. Und siehe da: Die Prognose lautet: 6 Millionen eingesparte Pkw-Kilometer. Wer soll da was gegen haben?
Aber das Beispiel zeigt auch: Reaktivieren können wir schon. Wir sollten es dort machen, wo es sich lohnt. Da wissen die Kommunen meist besser Bescheid als der Bundesgesetzgeber.
Kommen wir zu meiner Rechten; nicht ganz rechts; denn der AfD-Antrag geht ein bisschen am Thema vorbei. Nein, ich schaue die Kollegen von den Liberalen an. Sie gehen in der Regel davon aus, dass der Bundesgesetzgeber nicht alles weiß und auch nicht alles können muss. So weit, so gut. Regelmäßig sind Sie sogar der Ansicht, dass die Unternehmen besser wissen, was gut für das Land ist. Mit Ihrem Antrag heute wollen Sie aber tief in das Geschäft eines Unternehmens eingreifen. Mein Kollege Donth hat es gerade gesagt. Sie wollen Unternehmensbeteiligungen der DB veräußern, um damit Geld einzunehmen. Sie wissen auch schon ganz genau, wo das Geld investiert werden soll.
Da passt doch irgendetwas nicht zusammen. Das ist doch sonst nicht Ihre Art. Aber sich selbst treu zu bleiben, schränkt ja auch die Freiheit ein. Entfesselung steht Ihnen deutlich besser.
Bevor Sie aber auf die Idee kommen, eine vollkommene Veräußerung der Deutschen Bahn wäre die passende Antwort, kann ich Ihnen nur sagen: Die Infrastruktur ist Daseinsvorsorge und gehört in die öffentliche Hand. Genau in diesem Sinne sollten wir die volkswirtschaftliche Orientierung im Stammbuch der Bahn festschreiben.
Frau Kollegin, erlauben Sie eine Zwischenfrage ober Bemerkung?
Nein.
