Frau Präsidentin! Liebe Kolleginnen und Kollegen! Stellen Sie sich vor, allen Frauen und allen Männern hier im Bundestag wäre die zentrale gesellschaftliche Bedeutung einer guten Geburtshilfe bewusst. Wie würden wir diskutieren? Was würden wir beschließen? Viele von uns sind Mütter, viele von uns sind Väter, ganz sicher aber sind wir alle geboren worden – mit der Hilfe einer Hebamme.
Wer letzte Woche im schönen Bremen war, weiß, welch zukunftsweisende Vorstellungen die Hebammen haben. 2 000 Hebammen haben sich in der vergangenen Woche zu einem großen Kongress in Bremen getroffen. Eine Botschaft war unüberhörbar: Die Hebammen wollen die Akademisierung.
Die Hebammen wollen die Aufwertung ihres Berufs. Sie wollen auf Augenhöhe mit Ärztinnen und Ärzten zusammenarbeiten.
Sie wollen die Verbesserung ihrer Arbeitsbedingungen, ja mehr noch: Sie wollen einen Kulturwechsel in der Geburtshilfe. Und recht haben sie. Es ist endlich an der Zeit, Mütter und Kinder ins Zentrum der Geburtshilfe zu rücken.
Immerhin hat Minister Spahn nun endlich eingesehen, dass EU-Verordnungen auch für ihn gelten. Doch, liebe Kolleginnen und Kollegen der Koalition, Sie sind spät dran: Bis 2020 muss die Ausbildung reformiert sein – so besagt es die EU-Verordnung.
Es ist nun nicht so überraschend gekommen, dass 2020 nächstes Jahr ist.
