Sehr geehrter Herr Präsident! Sehr geehrte Damen und Herren! Gestern hatten wir im Kulturausschuss eine Abstimmung zu der Frage, ob die Überprüfungsmöglichkeit verlängert werden soll. Es gab eine erfreulich große Mehrheit, eine erfreulich große Koalition dafür. Nur eine einzige Fraktion hat sich dem verweigert, und das war Die Linke.
Wir haben aber derzeit auch eine andere sehr große Koalition, und die hatte leider etwas weniger Erfreuliches vor, und darüber haben wir eben schon in der Aktuellen Stunde gesprochen. Leise und geräuschlos wollten Sie ein wichtiges Symbol des Widerstandes gegen die SED-Diktatur ins Archiv entsorgen.
Aber damit, meine Damen und Herren, haben wir Sie nicht durchkommen lassen, und deshalb beschimpfen Sie uns hier schon den ganzen Tag.
Diese Behörde, meine Damen und Herren, ist eine ungewöhnliche Behörde. Sie verdankt ihre Existenz nicht der Obrigkeit, sondern dem mutigen Einsatz der Bürger.
Der Bundesbeauftragte ist nach wie vor eine wichtige Institution. Seine Bedeutung als Mahner und Aufklärer wird nicht geringer, sondern größer, je länger die SED-Diktatur zurückliegt. Der jetzige Amtsinhaber ist offenbar seines Amtes müde geworden und wirkt bei Ihnen nun als Kronzeuge an der Abschaffung seines eigenen Amtes mit. Das finde ich tragisch und bedauerlich.
Wie praktisch aber, dass die Auflösung seiner Behörde und das Ende seiner Amtszeit auf denselben Tag fallen sollen, und, wie man hört, ist an einen neuen, auf Herrn Jahn vielleicht schon zugeschnittenen Posten ja bereits gedacht.
Man kennt sich, man hilft sich;
