Herr Präsident! Kolleginnen und Kollegen! Liebe Zuhörende! Außer der AfD wissen inzwischen alle, dass die fortschreitende Klimaerwärmung ein Umdenken erfordert: In Politik, Wirtschaft und Gesellschaft.
Was aber macht unsere Bundesregierung? Sie schnürt ein Klimapäckchen, das in keiner Weise den aktuellen Herausforderungen entspricht.
Als Linke kämpfen wir für Klimagerechtigkeit.
Was heißt das im Verkehr? Das heißt vor allem, die Menschen zum Umstieg auf klimafreundliche Verkehrsmittel zu bewegen und dabei niemanden von Mobilität auszuschließen. Sie aber trauen sich in Ihrem Klimapäckchen nur Minierhöhungen der Spritpreise zu. Das milliardenschwere Dieselprivileg wollen Sie aber erhalten. Wofür eigentlich, wenn doch sowieso ein Wechsel des Antriebs ansteht und ja auch bereits angelaufen ist?
An den Bereich Straßenbau wollen Sie gar nicht heran. Wir brauchen dringend ein Umsteuern der Investitionen weg von der Straße hin zur Schiene.
Dabei müsste zunächst mal der Bundesverkehrswegeplan gestoppt werden, der den Bau von immer neuen Straßen noch bis 2030 festschreibt. Dieser Plan ist auch längst von der Realität überholt und damit retro.
Doch nicht mal ein Tempolimit trauen Sie sich zu. Ein Tempolimit ist eine schnelle, einfache, wirkungsvolle und kostenlose Maßnahme zur Verbrauchsminderung und zur Erhöhung der Verkehrssicherheit. Sie dagegen zeigen nur, dass Sie gar nichts verstanden haben.
Sie wollen offenbar weiter mit Vollgas in die Klimakrise rasen.
Ebenso fehlt Ihnen auch die klare Perspektive dafür, dass wir kleinere, leichtere und verbrauchsärmere Fahrzeuge brauchen. Wir können es uns doch nicht leisten, die knappen erneuerbaren Energien in Elektro-SUV zu verballern.
