sondern es geht auch um Fragen wie Speicherfristen, Onlinedurchsuchung, Quellen-TKÜ.
Und da sage ich auch: Es geht ja dabei nicht nur um das Problem Extremismus von rechts, sondern auch um Kinderpornographie, Pädophile. Auch da müssen wir doch zu Potte kommen. Auch da haben wir Handlungsbedarf.
Ich möchte auch nicht, dass dieses Land zur Bedenkenrepublik wird und wir uns jetzt wegen Begrifflichkeiten den Weg verbauen. Wenn als Erstes, wenn wir über Kompetenzen reden, Datenschutzbedenken geltend gemacht werden – und Datenschutz ist ein hohes Gut; gut, dass wir ihn in dieser Form haben – bzw. die dicke Keule ausgepackt wird, bevor der erste Plan auf dem Tisch liegt, bevor die Diskussion in Fahrt kommt, dann schaden wir der guten gemeinsamen Sache.
Ich halte auch das Netzwerkdurchsetzungsgesetz eben nicht für einen Rohrkrepierer, sondern halte es für wichtig, dass wir auch da herangehen. Hasssprache – Hate Speech – ist doch ein Problem dieser Zeit. Und was all diese Begrifflichkeiten angeht: Ja, da unterscheiden wir uns wahrscheinlich in der Tat von den Kollegen hier auf Rechtsaußen. Wer „Lügenpresse“, „Verräter“, „Mahnmal der Schande“ und „Vogelschiss“ in sein Vokabular aufnimmt, der muss sich halt nicht wundern, wenn sich Menschen in diesen Echokammern daran aufgeilen und zu Tätern werden. Das ist ganz klar eine Form von Mitschuld.
Hinterfragen müssen wir auch, ob wir das Richtige tun. Die politische Bildung ist angeklungen. 82 Millionen, glaube ich, waren es, die den Wahl-O-Maten der Bundeszentrale für politische Bildung besuchten. Ich glaube, es gibt kein Programm gegen Extremismus, Islamismus, das eine ähnliche Konjunktur hat. Vielleicht müssen wir einmal schauen, wie wir da noch besser werden könnten; auch da gibt es Nachholbedarf.
Wenn die Mutter des Attentäters in Halle sagt, der Sohn habe ja gar keinen schlechten Eindruck gemacht, er habe nichts gegen Juden gehabt, nur gegen das Großkapital habe er gewettert, dann fehlt es vielleicht auch in der Bevölkerung an Feingespür, hier und da zu erkennen, wann sich jemand radikalisiert, und auch da besteht Handlungsbedarf.
Ich glaube, wir brauchen einen gesellschaftlichen Konsens, der da heißt: „Respektvoller Umgang miteinander“ und einen Rechtsstaat. Wer auf dem Boden des Grundgesetzes steht und Straftaten verurteilt, der wirkt gegen Extremismus.
Und ich finde es schräg – Schlussbemerkung –, wenn ich in der letzten Sitzungswoche hier das Abfeiern der Antifa sehe. Eine große Tageszeitung hat es schön auf den Punkt gebracht:
