Frau Präsidentin! Liebe Kolleginnen! Liebe Kollegen! Am Ende der Debatte bleibt festzuhalten, dass wir in vielen Teilen im Ziel einig sind, aber sehr über Begrifflichkeiten streiten. Wir reden über Feinheiten.
Festzuhalten ist doch: Wir haben nach den NSU-Morden einen Untersuchungsausschuss gehabt. Der hat einen Plan mit 47 Punkten aufgelegt. Ja, und die Länder und auch die beteiligten demokratischen Parteien dieses Hauses waren meines Wissens darin eingebunden.
Und ich habe in den letzten Monaten keine Länderregierung gehabt, keine Partei in diesem Haus, die gesagt hat: Ihr müsst mal gucken. Es gibt in Teilen – ich sage bewusst: in Teilen – der Gamerszene rechtsextreme Ausfälle.
Insofern stellen wir doch einmal fest – und vielleicht sind wir uns da wenigstens einig –, dass wir Verschiebungen in einem Phänomen haben, das – ja – Rechtsextremismus heißt, und wir in Teilen auch schauen müssen, dass wir diesen Verschiebungen gerecht werden.
Deswegen ist es richtig, dass der Bundesinnenminister 700 Stellen für die Bekämpfung des Rechtsextremismus anmeldet. Wir müssen auch die Sicherheitsbehörden in die Lage versetzen, auf eigene Erkenntnisse – und nicht nur auf Erkenntnisse befreundeter Dienste – zurückgreifen zu können, wenn es um die Bekämpfung geht.
Der Hinweis auf das Waffenrecht ist auch in Teilen fadenscheinig. Nehmen wir beispielsweise die Frage mit den Magazinen. Wenn wir uns leidenschaftlich darüber streiten, ob Magazine das große Problem dieser Welt sind, aber feststellen, dass ein Täter in Halle diese Dinger mit einem 3-D-Drucker produziert, dann stoßen wir doch damit die Jäger, die Sportschützen vor den Kopf, die wir genau für diesen Konsens brauchen,
dafür, einvernehmlich ein Waffenrecht zu schaffen. Wir sollten nicht den Konsens der Gesellschaft aufs Spiel setzen und eine weitere Spaltung riskieren.
Es geht hier auch nicht um Begrifflichkeiten wie Vorratsdatenspeicherung, an der Sie sich alle hochziehen,
