Die Rentenwerte in Ost und West anzugleichen, ist ein großer Erfolg. Aber es gibt keinen Grund, die Umrechnung der Löhne bis 2025 abzuschaffen, wie Union und SPD das beschlossen haben; denn in Ostdeutschland schuften doppelt so viele Menschen im Niedriglohnsektor wie in Westdeutschland.
Sie sagen, Frau Kolbe, mit der Umrechnung müsse jetzt Schluss sein; denn sonst erhielte eine ostdeutsche Facharbeiterin mit 3 000 Euro Bruttolohn mehr Rente als eine westdeutsche Fachkraft mit 3 000 Euro Bruttolohn. Viele Menschen im Osten können von 3 000 Euro brutto nur träumen, meine Damen und Herren.
In Wirklichkeit erhält die ostdeutsche Fachkraft mit einem vergleichbaren Beruf nur 2 490 Euro brutto und eben nicht 3 000 Euro wie die westdeutsche Fachkraft. Das ist euer aller Rechenfehler.
Meine Damen und Herren, solange das Lohnniveau in dem alten Bundesland mit dem niedrigsten durchschnittlichen Einkommen – das ist Schleswig-Holstein – noch deutlich über dem neuen Bundesland mit dem höchsten Durchschnittseinkommen liegt – das ist Sachsen –, so lange brauchen wir noch die Umrechnung. Deswegen ist die Umrechnung völlig richtig.
Die Umrechnung ist eben keine Höherwertung und auch keine Hochwertung. Sie sorgt vielmehr dafür, dass jemand, der in Erfurt 45 Jahre lang Haare schneidet, am Ende eine vergleichbare Rente erhält wie jemand, der in meiner Heimatstadt Köln 45 Jahre lang Haare geschnitten hat. Die Umrechnung ist ein hervorragendes Werkzeug; denn mit jedem Angleichungsschritt bei den Löhnen schmilzt sie ab. Sie löst sich von selbst auf, wenn Sie endlich Ihr Versprechen einhalten. Also: Sie muss so lange erhalten bleiben, bis sich etwas ändert in Dresden und im Eichsfeld. Am besten bald.
Herzlichen Dank.
Vielen Dank, Matthias W. Birkwald. – Nächster Redner: Albert Weiler für die CDU/CSU-Fraktion.
