Sehr geehrter Präsident! Werte Kolleginnen und Kollegen! Liebe Gäste! 30 Jahre – 30 Jahre! – nach dem Ende der DDR wird hier zum fünften Mal die Fristverlängerung der Regelüberprüfungen auf Stasimitarbeit beschlossen werden. Es wird ja nicht beschlossen, dass eine Möglichkeit bestehen bleibt, weiter zu überprüfen, sondern es geht darum, dass Regelüberprüfungen beschlossen werden sollen. Da kann ich nur sagen: Es lebe der Generalverdacht!
Wir sind dagegen; das wird Sie nicht überraschen.
Und nein, wir sind nicht deshalb dagegen, weil wir einen Schlussstrich wollen; ganz sicher nicht.
Was wir wollen, ist eine – böses Wort – Normalisierung im Umgang mit der DDR-Geschichte, eine Versachlichung auch. Die DDR war sehr viel mehr als Stasi; das habe ich vorhin schon gesagt.
Nun sollen aber Personen in herausgehobenen politischen und gesellschaftlichen Positionen bis 2030 regelüberprüft werden. Das sind all die, die in der DDR gelebt haben und bis 1971 dort geboren wurden. Das betrifft ehrenamtliche Bürgermeisterinnen genauso wie Mandatsträger oder Menschen, die eine höhere Laufbahn anstreben. Sie werden 2030 mindestens 59 Jahre alt sein, und es ist wohl anzunehmen, dass die Frist dann noch mal verlängert wird, damit einem auch ja keiner durch die Lappen geht, bevor sie dann endgültig Abschied nehmen von dieser Welt. Und es ist völlig egal, wie sie nach der Wende gelebt haben. Das kann doch nicht sein! Das kann doch nicht Ihr Ernst sein!
Wolfgang Thierse
hat schon 2011 gesagt, dass Überprüfungen nur im konkreten Verdachtsfall und bei besonders herausgehobenen Funktionen zu rechtfertigen seien und dass – ich zitiere –
