Herr Präsident! Meine sehr verehrten Damen und Herren! Liebe Kolleginnen und Kollegen! Eines wird beim Lesen des AfD-Antrages, mit dem die Aufgabe aller Klimaschutz- und Energiewendeziele gefordert wird, ganz klar: Die AfD ist die einzige Partei im Deutschen Bundestag, die den menschengemachten Klimawandel leugnet.
Das ist erschreckend in Zeiten, in denen das Eis der Polkappen und Gletscher immer schneller an Masse verliert und in denen die Zahl der Tropenstürme dramatisch zunimmt.
Aber wir müssen gar nicht so sehr in die Ferne schauen. Das Nahe liegt Ihnen ja vermutlich näher. Es reicht bereits ein Blick in unsere Heimat. Der deutsche Wald stirbt,
und auch die Landwirtschaft ächzt unter Hitze und Wassermangel.
Die AfD fordert in ihrem Antrag die Rückkehr zu einer faktenbasierten Klima- und Energiepolitik. Gerne doch! Sie sagen, der Klimawandel ist nicht menschengemacht. Fakt ist: 99 Prozent der Wissenschaftlerinnen und Wissenschaftler
sagen, dass der gegenwärtige Klimawandel sehr wohl von Menschen verursacht ist. Da fragt man sich: Wer ist hier der klimapolitische Geisterfahrer?
Ihre nächste These – es wird noch grotesker, hören Sie einmal zu! –:
