Sehr geehrter Herr Präsident! Verehrte Kollegen! Politischer Extremismus, egal welcher Couleur, ist eine existenzielle Bedrohung für unseren Staat und für unsere Gesellschaft.
Alle Fraktionen in diesem Hohen Haus distanzieren sich von Rechtsextremismus. Insbesondere meine Fraktion hat mehrfach dargelegt,
dass sie Rechtsextremismus ebenso kategorisch ablehnt wie jede andere Form des Extremismus.
Aber ein großer Teil dieses Hauses hat ein veritables Linksextremismus-Problem. Anke Domscheit-Berg von den Linken schrieb am 29. Juli auf Twitter: Ich bin Antifa.
Am 29. Juli sagte Grünenchefin Baerbock bei der ARD: Für mich ist die Antifa nicht per se eine linksextremistische Organisation.
Und ganz aktuell fordert Frau Renner auf Twitter: Mehr Personal bei der Antifa statt bei der Polizei und den Sicherheitsbehörden.
Ich sage klar und deutlich: Wer als Politiker die Antifa unterstützt, macht sich mit gewalttätigen Verfassungsfeinden gemein.
Wir sind nicht bereit, dies weiter hinzunehmen.
