Ich komme zu einem Punkt, der uns alle, zumindest in der Mitte des Plenums – von der SPD, den Grünen, der FDP und der Union – eint: Wir wollen die Gründungskultur in Deutschland stärken. – Die geschätzte Kollegin Müller hat angesprochen: Wir müssen weg von der analogen Verwaltung. Wir müssen zukunftsfähig werden. – Sie hat recht.
Dann schauen wir uns als Beispiel das Land Berlin an. Hier wächst eine Start-up-Kultur, die sich mittlerweile anschickt, London als Start-up-Platz Nummer eins in Europa zu überholen. Aber schauen wir in die Verwaltung des Landes Berlin: Da ist Grauen angesagt. Wenn Sie für die Anmeldung eines neugeborenen Kindes in Estland am Tag nach der Geburt eine E-Mail bekommen: „Herzlichen Glückwunsch zur Geburt Ihres Sohnes oder Ihrer Tochter; ab nächstem Monat überweisen wir das Geld auf das von Ihnen angegebene Konto“, dann ist das das Ergebnis einer digitalisierten Verwaltung. In Berlin – Rot-Rot-Grün – sorgt die Verwaltung dafür, dass man Wochen und Monate gar keinen Termin bekommt für die Anmeldung eines neugeborenen Kindes. Das geht weiter bei der Gründung von Unternehmen. Das geht weiter bei der Anmeldung von ausländischen Mitarbeitern. Die Start-up-Kultur in Berlin wächst nicht wegen der digitalen Verwaltung, sondern trotz dieser. Das ist der Zustand dieses Landes, das ist die Realität anschauen.
Meine sehr geehrten Damen und Herren, wir stehen jetzt in dieser Debatte – heute Morgen haben wir über das Klima, dann über die Kohle gesprochen; jetzt reden wir über die Gründungen – vor der Frage: Wer schafft eigentlich die technologischen Antworten und Lösungen, auch im Hinblick auf das Klimaproblem, im 21. Jahrhundert? Ist das etwa eine Greta Thunberg, die mit erhobenem Zeigefinger in Rumpelstilzchen-Manier auf dem Surfbrett der Verbotsdebatte daherkommt und die vor allem ganz viel mediale Aufmerksamkeit von allen Seiten der Welt bekommt? Oder sind es vielleicht doch fleißige, interessierte Jungen und Mädchen, wie sie hier auf dieser Tribüne sitzen, die sich anschicken, jeden Tag mehr über Chemie, über Biologie, über Physik, über die Naturwissenschaften zu lernen, die keine Aufmerksamkeit bekommen, aber jeden Tag vielleicht etwas dafür tun, wie wir mit technischen Lösungen Innovationen von morgen schaffen?
Wenn Gottlieb Daimler und Carl Benz nur mit dem erhobenen Zeigefinger gekommen wären und Verbotsdebatten angerührt hätten, dann würden wir heute nicht so starke, global agierende, wirtschaftlich erfolgreiche Firmen haben. Sie haben einen anderen Weg gewählt. Es waren die Tüftler und Macher in diesem Land, es waren die Gründer von gestern, die den heutigen Wirtschaftserfolg Deutschlands garantieren, und genau diese Kultur müssen wir wecken, wenn wir junge Leute in den Schulen ansprechen. Wir müssen ihnen Mut machen, zu gründen und einen Unternehmergeist zu wecken.
Da sind nicht nur wir im Bund gefragt, da sind auch die Länder gefragt. Denn wir brauchen in den Schulen „Wirtschaft“ als Schulfach, mehr Unternehmenspraktika, „Jugend forscht“ und andere Programme, die unterstützt werden müssen. Der Businessplan gehört ins Schulcurriculum, und Coding gehört als Fremdsprache genauso unterrichtet wie Französisch oder Englisch. Testen wir doch, wer bei Coding gut ist. Ein Teil von denen, die eine solche Sprache gut beherrschen, wird morgen und übermorgen den Wohlstand dieses Landes mit sichern.
Meine sehr geehrten Damen und Herren, der Antrag der FDP und der Grünen, der zum Ziel hat, die Gründungskultur zu stärken, deckt sich in vielerlei Hinsicht mit dem, was die Bundesregierung aktuell schon macht. Wenn wir uns EXIST anschauen – ein Programm, bei dem es darum geht, aus der Hochschule heraus zu gründen –, dann sehen wir, dass drei Viertel der geförderten EXIST-Gründerstipendiumprojekte und mehr als 80 Prozent der EXIST-Forschungstransferprojekte zu einer Unternehmensgründung führen. Wenn wir uns den Bereich Finanzierung anschauen, dann sehen wir, dass wir auf den Stufen eins und zwei die Erstfinanzierung von Start-ups in Deutschland in den letzten zehn Jahren auf gute Beine gestellt haben. Jetzt arbeiten wir daran, wie wir die Wachstumsphase von Gründungen hier in Deutschland weiter finanzieren können.
Das heißt, wir sehen in ganz vielen Bereichen sehr klar, dass wir, erstens, den Osten nicht schlechtreden müssen, sondern die Lebensleistung der Menschen von dort anerkennen müssen, dass wir, zweitens, viel für den Bereich Gründung tun und dass es, drittens, nicht nur eine Aufgabe des Bundes, sondern vor allem auch der Länder ist, sich hier mehr zu engagieren.
Herzlichen Dank.
Vielen Dank, Mark Hauptmann. – Nächster Redner: Frank Junge für die SPD-Fraktion.
