Das alles hat etwas mit Geld zu tun. Der Verteidigungsetat hat mit einem Haushaltsansatz von 44,9 Milliarden Euro eine Steigerung erfahren. Aber wir müssen noch stärker betonen, dass dies der Sicherheit unseres Landes dient; denn die Planungskurve fällt ab 2023 wieder ab. Deutsch-französische Kooperationen und deutsch-norwegische Kooperationen wären gefährdet, wenn wir keinen kontinuierlichen Anstieg hätten. Wir wollen ihn und wir fordern ihn, nicht wegen der Vereinigten Staaten, sondern weil es um die Sicherheit unseres Landes geht. Wir benötigen einen 360-Grad-Blick, und dafür brauchen wir die finanzielle Ausstattung. Deswegen fordern wir auch auf, diesem Haushalt zuzustimmen, meine Damen und Herren.
Ich will noch einmal deutlich machen, dass wir nicht alleine sind, sondern uns in Bündnissen befinden, im NATO-Bündnis und in der Europäischen Union, und die Partner um uns herum erwarten, dass wir unsere Verlässlichkeit zeigen, nicht nur indem wir das 2-Prozent-Ziel einhalten, sondern auch indem wir Verantwortung übernehmen und uns als Anlehnungspartner anbieten, wenn es darum geht, eine gemeinsame Sicherheitspolitik für Europa zu gestalten. Dieser Verantwortung wollen und müssen wir auch gerecht werden. Das ist Nachhaltigkeit. Das ist sicherheitspolitische Nachhaltigkeit, weil wir auch unseren zukünftigen Generationen ermöglichen wollen, in Frieden und Freiheit zu leben.
Wir müssen in die Ausrüstung investieren, um Frieden, Freiheit und auch Wohlstand zu erhalten.
Es ist notwendig, dass wir Verantwortung in den Einsätzen in Afghanistan und in Mali übernehmen. Es ist aber auch notwendig, dass wir den Anti-IS-Kampf weiter führen. Frau Verteidigungsministerin, Sie haben deutlich gemacht, welche Verletzungen Menschen, auch Frauen, zugefügt worden sind, dass Menschen vom IS gekillt worden sind, weil sie andersgläubig sind. Der IS ist noch nicht besiegt. Er schafft sich Brückenköpfe, um Europa zu gefährden. Da müssen wir gegenhalten. Wir müssen von Jordanien aus weiter unseren Beitrag zum Anti-IS-Kampf leisten und die Ausbildungsmission im Irak weiterführen. Denn es geht um Frieden und Freiheit, und dies ist zu gewährleisten durch den tollen Einsatz unserer Soldatinnen und Soldaten. Sie stehen ein für Einigkeit und Recht und Freiheit. Sie sind der Garant für den Frieden bei uns. Sie haben unsere volle Unterstützung verdient und auch die finanzielle Ausstattung.
Herzlichen Dank.
Vielen Dank. – Nächster Redner ist der Kollege Martin Hohmann für die Fraktion der AfD.
