Herr Präsident! Liebe Kolleginnen und Kollegen! Es ist ja verständlich, dass es die AfD stört, dass seit Monaten in der öffentlichen Debatte immer wieder darauf hingewiesen wird, dass Sie, liebe Kolleginnen und Kollegen, in der Arbeitsmarkt- und Sozialpolitik keine Konzepte und schon gar keine Lösungen anzubieten haben. Die Frage: „Wo ist eigentlich Ihr Rentenkonzept?“, ist ja schon zum geflügelten Wort geworden.
– Eben, weil es das nicht gibt. – Dieser sogenannte Antrag – so haben wir das zumindest interpretiert – sollte offenbar der Versuch sein, hier einmal richtig Substanz vorzulegen: Sozialgesetzbuch III, Arbeitslosengeld I – wichtiges arbeitsmarktpolitisches Thema – fünf Seiten Text. Ganze fünf Seiten!
Das Problem ist aber, dass Sie die fünf Seiten dafür nutzen, Seite um Seite darzulegen, was heute schon die Rechtslage ist.
Sie klären uns darüber auf, dass die Arbeitslosenversicherung eine Versicherung ist.
Sie klären uns darüber auf, dass die Bezugsdauer des Arbeitslosgengelds gestaffelt ist, usw. usf. Sie zitieren sogar Zeile um Zeile wörtlich aus dem Sozialgesetzbuch III. Das kann man so machen. Aber es wäre gut, dass Sie, wenn Sie Zahlen aus der Statistik der Bundesagentur für Arbeit referieren, es dann auch schaffen, die aktuellsten Zahlen zu verwenden, die seit vier Wochen vorliegen. Das haben Sie in dem Antrag nicht geschafft.
Nachdem man sich durch fünf Seiten gequält hat, kommen auf der fünften Seite dann tatsächlich – ich habe nachgezählt – sechseinhalb Zeilen Forderung. Doch bei diesen sechseinhalb Zeilen Forderung sind die ersten fünfeinhalb – Überraschung! – erneut Wiedergabe des aktuellen Rechts.
Liebe Kolleginnen und Kollegen, weil das so krass ist, weil zumindest ich das in sozialpolitischen Anträgen hier noch nicht erlebt habe, habe ich mir einmal die Mühe gemacht, das zu visualisieren. Wenn man den Antrag einmal darauf reduziert, was Ihre konkrete politische Forderung,
Ihr konkretes politisches Konzept ist, dann sieht das so aus:
Seite 1, Seite 2,
Seite 3, Seite 4
und Seite 5 – ein Satz.
Das ist der Satz. Der eine Satz!
Ein einziger Satz, liebe Kolleginnen und Kollegen, bildet den Gipfel Ihrer arbeitsmarkt- und sozialpolitischen Leistungsfähigkeit. Und der besagt dann auch nur – das ist wirklich bemerkenswert –, dass etwas, was es schon gibt, irgendwie – ich zitiere – „stärker" sein soll. „Stärker“, liebe Kolleginnen und Kollegen! Wie genau, was genau, für wen genau – da sind Sie dann schon wieder völlig blank. Das ist doch keine seriöse Arbeitsmarkt- und Sozialpolitik.
