Sehr geehrter Herr Präsident! Meine Damen und Herren! Wir haben hier einen Antrag der AfD-Fraktion zur Arbeitslosenversicherung vorliegen: Fünf Seiten ohne einen konkreten Vorschlag für die arbeitenden Menschen in unserem Land, fünf Seiten völlig ohne Substanz! Die AfD glaubt ja sogar – so steht es in dem Antrag –, dass der Beitragssatz noch immer bei 3 Prozent liegt und die Rahmenfrist jetzt schon bei 30 Monaten. Dabei ist der Beitragssatz längst auf 2,5 Prozent gesenkt, und die längere Rahmenfrist greift erst ab Januar nächsten Jahres.
Das zeigt doch eigentlich deutlich: Sie haben gar keine Ahnung von dieser Materie.
Die Linke weist schon seit 15 Jahren auf den Abbau des Sozialstaates hin. Seit 15 Jahren fordern wir eine stärkere Arbeitslosenversicherung für unsere Menschen in diesem Land.
Die AfD sieht jetzt die Möglichkeit, aus den Missständen Profit zu schlagen. Diese Methode hat System. Sie picken sich die einzelnen Punkte heraus und stellen sich mit Ihren Pseudoanträgen als Anwalt der kleinen Leute dar. Aber ist die AfD wirklich der Anwalt der kleinen Leute? Wir sagen: Nein.
Ich zitiere einmal aus den Reden der AfD, unter anderem hier im Bundestag – Frau von Storch, Sie kommen auch gleich dran –:
Das mit Abstand beste Programm zur Vermeidung von Arbeitslosigkeit und Wirtschaftsabschwung sind nicht aufgeblähte Töpfe der Sozialversicherungen, sondern ist der Abbau von Bürokratie, Abgaben und Steuern.
Sagte Martin Sichert am 19. Januar 2018; man höre genau hin. „Runter mit den Sozialabgaben“, sagte Frau Beatrix von Storch am 3. Juli 2018 zum Familienhaushalt.
Allerdings ist die Krönung des Ganzen Jörg Meuthen. Er will – es kam heute schon deutlich heraus – die Sozialversicherungen loswerden. Er sagte letztes Jahr auf dem AfD-Parteitag, dass er in der Rentenversicherung eine Abkehr vom zwangsfinanzierten Umlagesystem hin zur regelhaften privaten Vorsorge anstrebt.
Das ist der Sozialstaat, den die AfD will. Die AfD will die Sozialversicherungen finanziell ausbluten lassen oder gleich ganz abschaffen. Dafür sollten Sie sich schämen, meine Damen und Herren.
Das sind nicht die Interessen der kleinen Leute. Nein, das sind die Interessen der Großunternehmen und Gutverdienenden. Wer so viel verdient, dass es für eine private Absicherung reicht, will vielleicht keine Steuern und keine Abgaben zahlen; das mag sein. Aber erzählen Sie das mal bitte den Menschen, die sich jeden Tag für einen Niedriglohn abrackern, mit zwei und mit drei Jobs. Erzählen Sie das denen, die Angst haben, ihren Job zu verlieren – das sollten Sie einmal machen –, und all denen, die auf eine starke Sozialversicherung und einen verlässlichen Sozialstaat angewiesen sind, wenn es hart auf hart kommt. Erzählen Sie das denen; denn die glauben es nicht. Die brauchen nämlich eine starke Sozialversicherung.
Nein, die AfD ist nicht die Partei der kleinen Leute, sondern die Partei der Bonzen und Bosse.
Wer das nicht wahrhaben will – ich werde es Ihnen erklären, Herr Gauland –, muss sich einmal fragen:
