Geschätzter Herr Präsident! Ich könnte jetzt wieder die allgemeine Haushälterrede zu der Bedeutung und der Schwere des Haushaltes halten und Zahlen nennen. Aber ich versuche, bildlich nicht nur klarzumachen, dass das der größte Einzelhaushalt ist, sondern mit Blick auf das fleißig arbeitende Kabinett – das nicht richtig zuhört, was es aber sollte – auch einmal zu verdeutlichen, was dieser Haushalt für die Zukunft bedeutet.
Liebe Kolleginnen und Kollegen, liebe Bürger, stellen Sie sich vor: Das ist das, was der Bundeshaushalt in den Jahren 2019 bis 2023 an zusätzlichen Ausgabemöglichkeiten hat. Herr Minister, so viel. Jetzt überlegen Sie einmal, was von diesen zusätzlichen Ausgabemöglichkeiten – welchen Schluck aus dem Glas – sich der Kollege Heil gönnt.
Das gesamte Glas!
Jetzt können Sie sagen – wie es der Kollege Weiß zum Schrecken seiner eigenen Fraktion gesagt hat –: Und das ist gut so. – Sie könnten aber auch auf dieses Kabinett schauen, das dort sitzt und – bis auf die Kollegin Hagedorn, die etwas schreibt – denkt –: Das ist doch nicht schlimm. – Ist es denn richtig, wenn von den Mehreinnahmen, die ein Staat hat,
alles in Arbeit und Soziales fließt und nichts mehr in die Bildung, nichts mehr in den Bereich Nachhaltigkeit und nichts Zusätzliches in den Bereich Familie geht? Das ist die Krux dieses Haushaltes und dieser Bundesregierung, meine Damen und Herren.
Wenn wir dann weitergehen – auch das will ich noch verdeutlichen; es gibt Zahlen dazu –: Wir haben einen Aufwuchs von 100 Prozent bei den Mehreinnahmen. 103 Prozent, Kollege Heil. 103 Prozent!
– Ja, ich merke, Sie müssen die zusätzlichen 3 Prozent auch noch vertrinken. – 103 Prozent verwenden wir dafür.
In einem Sozialstaat könnten wir jetzt sagen: Das ist ja okay, weil eine soziale Marktwirtschaft einen starken Sozialstaat braucht. – Aber das muss dann nach der Frage der Bedürftigkeit gehen. Sie merken, da kommt man dann zu der Frage: Wie gehen Sie eigentlich mit dem Thema Grundrente um? Sie sprechen von Bedürftigkeitsprüfung. Eigentlich geht es um die Frage: Bedingungslose Grundrente oder bedingungsfreie Grundrente?
– Das merke ich doch an Ihrer Reaktion; Sie sind in der Vergangenheit.
Worüber wir hier eigentlich diskutieren müssten, ist die Frage: Bedingungsloses BAföG – ja oder nein? Aber was machen Sie beim BAföG? Die Mittel dafür werden um 300 Millionen Euro gesenkt. Das ist der Unterschied: Sie bewegen sich weiterhin nur in die Richtung, Vergangenheitslösungen darzustellen, statt in die Zukunft zu gehen und dort das Geld entsprechend auszugeben.
Dabei sind Sie dann auch noch – auch das will ich sagen – letztlich – Herr Präsident, ich hoffe, das ist ein besseres Wort als das, das die Kollegin Tack benutzt hat – bigott.
Herr Kollege Fricke, die Kollegin Mast würde Ihnen gerne eine Zwischenfrage stellen.
Gerne.
