Herr Präsident! Meine Damen und Herren! Lieber Kollege Hohmann, wer wie Sie die Bibel zitiert, müsste wissen, dass die Bewahrung der Schöpfung ein urkonservatives Thema ist,
bei dem wir uns dem lieben Gott unterwerfen und nicht den Grünen, und dass es aus den Gründen, die Sie angerissen haben, nämlich der Überlegung, dass man Ressourcen schonen muss, eigentlich Sinn macht, den Weg, den wir beschreiten wollen, mitzugehen. Ich glaube, dass das ein richtiger Weg ist, Ressourcen zu schonen und verantwortungsvoll mit unserer Schöpfung umzugehen.
Es gibt – lassen Sie mich das einleitend noch sagen – ein Narrativ auf der anderen Seite von denjenigen, die mit viel Alarmismus sagen: Alles zu wenig, alles zu spät. – Das treibt auch mich um, und ich möchte hier ganz klar zu Protokoll geben: Deutschland spielt eine immens wichtige Rolle beim Thema Klimaschutz. Klimaschutz ist ein internationales Thema, und es war niemand anderes als unsere Bundeskanzlerin, die dieses Thema auf der internationalen Agenda gehalten hat.
Klimaschutz ist ein Thema, das am Schluss nur mit erneuerbaren Energien vorangebracht werden kann,
und es sind die deutschen Stromverbraucher, die aktuell 26 Milliarden Euro pro Jahr dafür ausgeben, dass das Ganze marktgängig geworden ist.
Ich stelle die Frage, meine Damen und Herren: Hätte Deutschland das nicht gemacht, womit würden wir denn Klimaschutz betreiben wollen? Da kann man lamentieren: zu viel, zu teuer. – Das ist alles richtig. Fakt ist doch genau das.
Dann gibt es welche, die sagen, der große Teil der CO
Das will ich an der Stelle einmal ganz deutlich unterstreichen.
Klimaschutz ist das Topthema, nicht nur im Umweltbereich, sondern momentan das Thema, das die Politik insgesamt dominiert. Wenn Sie die Bürgerinnen und Bürger fragen, dann sagen Ihnen gut 80 Prozent: Das ist ein sehr wichtiges Thema. – Der Haken ist: Von diesen 80 Prozent sagen wiederum 80 Prozent, dass andere das Problem lösen sollen und dass sie insbesondere kein Geld für die Thematik ausgeben wollen. Das macht das Ganze politisch so schwierig.
Nun können wir eines tun: Wir können das Ganze politisch gut oder schlecht lösen. Wir können das Thema negativ belegen. Dann reden wir, wie etliche hier, über Verzicht, über das Thema „Weniger ist mehr“, was jedenfalls in meinem Wahlkreis nicht der Lebensrealität der Mehrheit entspricht. Wir können ankündigen, wie es die Bundesumweltministerin vorhin vorsichtig angedeutet hat, dass alles teurer wird. Dann müssen wir im Blick haben, welche soziale Konsequenz das hat, wenn am Schluss beispielsweise nur noch die Reichen Auto fahren können. Oder wir können das in Kauf nehmen, was ein Professor, der in diesem Bereich sehr bekannt ist – ich nenne keinen Namen –, mir und anderen gegenüber vor Kurzem angedeutet hat. Er hat nämlich gesagt: Das wird über kurz oder lang zu Veränderungen in der Siedlungsstruktur führen.
Zu glauben, dass wir durch Urbanisierung die Probleme lösen, ist falsch. Dass wir neue schaffen, ist sicherlich richtig.
Ich sage Ihnen, das ist letztendlich etwas, bei dem man das Thema Stadt und Land, Alternativen, Möglichkeiten tatsächlich im Blick haben muss. Und ich glaube, wir sollten uns einmal darüber Gedanken machen, ob man nicht das Thema Klimaschutz zu einem neuen Innovationsmotor entwickeln kann.
– Doch!
