Liebe Frau Präsidentin! Liebe Kolleginnen und Kollegen! Jetzt würde ich auch gerne sagen „Sehr geehrter Herr Minister!“, aber er ist ja gar nicht da. Sehr geehrte Frau Staatssekretärin! Schön, dass Sie da sind! Ich finde es sehr interessant, dass auch in dieser Abschlussdebatte die Redner der Koalition uns Grünen vorwerfen, keine konkreten Vorschläge zu machen.
Ich finde, das zeigt eigentlich nur, was Sie hier vorgelegt haben, nämlich einen Haushalt der offenen Baustellen. Warum legen Sie nicht diese konkreten Vorschläge vor?
Herr Kollege Berghegger, Sie haben es doch selber erwähnt: Wir sind hier am Ende der Haushaltswoche und haben alle keine Ahnung, was Sie im Bereich Klimaschutz machen werden.
Wir haben keine Ahnung, wann Sie Ihre konkreten Vorschläge vorlegen werden, aber sollen schon mal darüber beraten.
Sie wollen konkrete Vorschläge? Ich mache Ihnen noch einen: Lassen Sie uns doch an die klimaschädlichen Subventionen herangehen! Da können wir nicht nur Geld einsparen, sondern wirklich was gestalten.
Das wäre doch eine Alternative zu Ihrer Ideenlosigkeit und Planlosigkeit oder gar dem mangelnden Gestaltungswillen. Davon nämlich zeugt das, was Sie uns vorgelegt haben.
Zu Ihrem Argument, Sie seien gar nicht strukturell im Minus. Doch, das sind Sie. Sie greifen ja nicht nur in den Etat, Sie greifen auch in die Sozialkassen. Es sind 13 Milliarden Euro, die Sie über die Absenkung der Flüchtlingsreserve und die GMA verfügbar machen. Das ist das, was bekannt ist. Was die meisten aber unter den Tisch kehren, ist: Sie greifen auch in die Rentenkasse. Glauben Sie denn wirklich, die Mütterrente finanziert sich von allein?
10 Milliarden Euro, die vom Himmel herabfallen? Das geht zulasten der Versicherten, und auch das ist Teil Ihres strukturellen Minus. Machen Sie sich da doch mal ehrlich! Machen Sie doch mal, was dringend notwendig ist, nämlich Antworten auf die Fragen unserer Zeit zu geben! Da geht es um Zukunft und klimafitte Haushaltspolitik. Und Klimaschutz gibt es nicht zum Nulltarif, auch nicht für Sie.
Sie reden davon, dass die schwarze Null notwendig ist für die Generationengerechtigkeit.
Ist sie aber nicht. Zur Generationengerechtigkeit gehören nämlich auch Kindergärten. Zur Generationengerechtigkeit gehören Schulen.
