Learning Analytics reduziert unsere Schüler und auch Lehrkräfte auf reine Datenlieferanten. Alle erzeugen Daten. Lehrer sollen ihren Unterricht mit Cloud-Tools planen und in einer zentralen Cloud speichern, auf die weiß Gott wer nachher Zugriff hat. Wie weit sind wir dann eigentlich noch davon entfernt, lediglich Wirte einer allmächtigen Datenmatrix zu sein?
Das ist nicht unsere Welt, und das ist auch nicht mein Bildungsideal. Wir in der AfD vertreten das Bildungsideal von Humboldt: Schüler sollen mündige Erwachsene werden, die ganzheitlich gebildet sind. Deswegen werden wir Ihren Antrag ablehnen.
Der Digitalfetisch der FDP führt uns dann auch noch zum Thema Quantencomputer und Datensicherheit. Quantencomputer sind der Theorie nach in der Lage, in Sekunden oder Minuten komplexe Rechenoperationen auszuführen, für die die heutigen Supercomputer Jahre oder Jahrzehnte brauchen. Mit einem funktionstüchtigen Quantencomputer wären alle heute gängigen Verschlüsselungstechniken kinderleicht zu knacken.
Aber wie ist denn der aktuelle Forschungsstand? Momentan ist sich die Fachwelt noch nicht ganz sicher, ob der Beweis für die sogenannte Quantensouveränität bereits erbracht wurde oder nicht. Aber die FDP weiß es offenbar mal wieder besser
und sieht gleich Nachholbedarf bei der Bundesregierung. Was Sie komplett vergessen: Das Bundesforschungsministerium hat schon ein Forschungsprogramm zur Postquantenkryptografie. Das haben Sie nicht gelernt. Bloß weil einer Ihrer Referenten in irgendeinem Tech-Blog etwas Cooles gelesen hat, müssen Sie hier noch lange keinen Antrag stellen.
Abschließend dann noch zu dem Antrag der FDP zu einem Onlinekurs zur künstlichen Intelligenz nach finnischem Vorbild. Ich habe mir das angesehen. Die Finnen haben ja privatwirtschaftlich so einen Kurs aufgesetzt. Das ist eine gute Idee. Den ins Deutsche übersetzen zu lassen, dafür sind wir auch. Sachen auf Deutsch finden wir von der AfD grundsätzlich gut.
Ihr Antrag geht aber auch hier viel zu weit und dreht auch wieder hart an der Bürokratieschraube. „Privat vor Staat“: Das hatten Sie früher mal bei sich im Programm – heute leider nicht mehr.
Danke für die Aufmerksamkeit.
Vielen Dank, Herr Kollege Dr. Espendiller. – Als nächster Redner hat für die SPD-Fraktion der Kollege René Röspel das Wort.
