Frau Klöckner, Sie stehen hier immer und sagen, wir würden aus der Stadt heraus Forderungen stellen. Ich höre aus dem ländlichen Raum die Forderung, dass es endlich Planungssicherheit braucht. Ich höre von Bäuerinnen und Bauern in dieser Republik die Ansage: Bitte sagt uns endlich, wie wir zu einer anständigen Landwirtschaft kommen. Wir wollen keine Tierfabriken mehr,
und wir wollen auch nicht mehr gezwungen sein, mit Ackergiften zu arbeiten.
Die wollen Umstellungen, und die wollen eine Landwirtschaftsministerin haben, die an ihrer Seite steht. Die wollen eine Landwirtschaftsministerin haben, die klar erkennt, dass die Klimakrise auch bei einer Umstellung der Landwirtschaft bewältigt wird, und dafür wollen sie Hilfe. Sie wollen nicht, dass jemand Landwirtschaftsministerin ist, der nur an der Seite derjenigen steht, die glauben, die Funktionäre der Landwirtschaft zu sein. Wer echte Landwirtschaft will, wer zukunftsfähige Landwirtschaft will,
der muss jetzt umstellen und darf nicht im Klein-Klein immer diejenigen schützen, die weiterhin die alte Landwirtschaft verfechten.
Frau Abgeordnete Göring-Eckardt, mit Ihrer Zwischenfrage haben Sie das beste Beispiel für eine städtische Sicht geliefert, die ziemlich wenig mit dem Land und der Landwirtschaft zu tun hat.
Denn zu behaupten, dass Landwirte sagen, sie wollten eine anständige Landwirtschaft, unterstellt, dass sie heute eine unanständige Landwirtschaft haben, und das weise ich wirklich von uns.
Sie haben wieder von Agrarfabriken gesprochen. Sie selber wissen, dass es auch Ökobetriebe gibt, die Tausende Stück Geflügel haben.
– Ja, das ist der Punkt. Das sind keine Agrarfabriken. – Ich will einmal festhalten: Frau Göring-Eckardt sagt, Betriebe mit Tausenden Stück Geflügel sind nur dann keine Agrarfabriken, wenn die Wirtschaftsweise ihrer Vorstellung entspricht. Aber das ist es doch, was zur Spaltung in unserer Gesellschaft führt.
Es geht nicht um die Quantität, sondern um die Qualität der Bewirtschaftung. Wenn ein kleiner Betrieb, den Sie nie als „Agrarfabrik“ titulieren würden, nicht ordentlich mit Tieren und nicht ordentlich mit dem Boden umgeht, dann funktioniert die Gleichung „Klein ist gut“ nicht. Deshalb sage ich: Lassen Sie Kampfbegriffe wie „Ackergifte“ und „Agrarfabriken“ weg.
