Herr Bernstiel, im virtuellen und im nicht virtuellen Kontext ist es außerdem entscheidend, endlich von der Einzeltäterfokussierung wegzukommen und die rechtsextremen Vernetzungen zu erkennen und richtig einzuordnen.
Der Täter von Halle war eingebettet in Online-Communities,
in denen antisemitische und rassistische Positionen Normalität sind und rechtsterroristische Anschläge wie in Christchurch live übertragen werden, Communities, in denen ein Austausch über Waffenbau und Anschläge stattfindet und die dringend durch die Sicherheitsbehörden durchleuchtet werden müssen. Ja, es ist richtig: Dafür brauchen sie Expertise und nicht die Vorratsdatenspeicherung.
Was wir aber auch mehr denn je brauchen, ist eine nachhaltige Stärkung und Förderung zivilgesellschaftlicher Organisationen, die sich gegen Antisemitismus und Rassismus einsetzen. Lieber Lars Castellucci, wenn Lars Klingbeil kritisiert, dass die „Stimmen von zivilgesellschaftlichen Organisationen, Künstlern und auch aus der SPD, die in den letzten Jahren gewarnt haben, dass sich am rechten Rand etwas zusammenbraut“ nicht gehört wurden, kann ich nur sagen: Es ist schon die eigenen Partei, die hier gerade die Axt anlegt. Es war ein SPD-geführtes Ministerium, das das Bundesprogramm „Demokratie leben!“ um 8 Millionen Euro kürzen wollte; eine Forderung die am Tag des Anschlags von Halle noch schnell zurückgezogen wurde. Auch die Zukunft des Aussteigerprogramms Exit war bis gestern ungewiss. Aber die eigentliche Frage ist doch: Wie kann es sein, dass im aktuellen politischen Klima die Kürzung von Fördermitteln überhaupt in Betracht gezogen wird?
Wir brauchen eine verlässliche Förderung der Arbeit zur Demokratiebildung gegen Rechtsextremismus und Antisemitismus, und – da sind wir ganz bei Ihnen – es braucht ein Demokratiefördergesetz.
Liebe Kolleginnen und Kollegen, es ist natürlich richtig, nach dem Anschlag in Halle nicht in Aktionismus zu verfallen, aber wir dürfen uns auch nicht der Schockstarre hingeben. Unsere Vorschläge liegen auf dem Tisch. Ziehen Sie Konsequenzen und leiten Sie endlich die Zäsur in Ihrem Handeln ein.
Ganz herzlichen Dank.
Das Wort hat der Kollege Marc Henrichmann für die CDU/CSU-Fraktion.
