Donnerwetter! Im Haushalt null abgebildet! Mich würde mal interessieren, wenn es denn diesen breiten Konsens geben soll, was da real gemacht werden soll. Da müssen wir doch wirklich dringend ran. Sie setzen offensichtlich darauf, dass darüber nicht in Ernsthaftigkeit geredet wird.
Frau Merkel, Sie haben heute ein wunderbares Beispiel angeführt: das Thema Elektromobilität. Ich will nur mal feststellen: Sie waren es, die gesagt hat – nachlesbar –: Im Jahr 2020 werden wir 1 Million Elektroautos haben. – Das hat nicht Die Linke gesagt. Was ist die Realität?
Zum 1. Januar 2019 waren weniger als 90 000 zugelassen. Ja, was ist denn das? Was ist denn das für eine Glaubwürdigkeit? Elektromobilität kann sehr sinnvoll sein, aber wenn, dann müssen es doch Elektroautos sein, die bezahlbar sind. Das heißt, sie müssen unter 20 000 Euro kosten. Es muss ausreichend Ladestationen auch im ländlichen Raum geben; sonst sind die Menschen dort wieder mal abgehängt. Es muss natürlich technologische Lösungen geben, in der Kobalt-, in der Lithium-, in der Entsorgungsfrage usw. Ja, Christian Lindner, es ist in Ordnung, Technologieweltmeister zu sein. Nur, wenn Sie das gegen Moral stellen, dann ist das nicht in Ordnung.
Wir müssen in der Moral spitze sein und in der Technologie. Das ist die Aufgabe, die vor Deutschland steht.
Aber so, wie die Regierung das bisher angedeutet hat, würden beim Klimaschutz wieder mal vor allen Dingen die unteren und mittleren Einkommen belastet werden. Fakt ist doch, dass die reichsten 10 Prozent in Deutschland fast 50 Prozent des CO
Wenn Sie wirklich einmal etwas gegen den Klimawandel tun wollen, dann stärken Sie doch die Bahn! Aber Sie haben seit 1990 6 467 Kilometer Bahnstrecke stillgelegt. Das ist doch der Wahnsinn! Ausbau von Strecken wäre notwendig und nicht Stilllegung von Strecken, meine Damen und Herren.
Deshalb sind viele Menschen skeptisch bei Ihren Ankündigungen, und das ist auch logisch: Die Menschen haben die Erfahrung gemacht, dass so etwas immer auf ihre Kosten geht, während die Reichen reich bleiben und sich alle Annehmlichkeiten weiter leisten können. „Wieso sollen nur die Mittelschicht und die Armen etwas für den Klimaschutz tun?“, das ist ein berechtigter Einwand, den viele haben. Das ist auch eine berechtigte Sorge; denn in den letzten 20 Jahren ist es immer so gelaufen, dass sie diese Lasten zu tragen hatten.
Deswegen sollten wir doch mal über Dinge nachdenken, die allen bekannt sind: Streichung der Energiesteuerbefreiung für Kerosin – würde 7 Milliarden Euro bringen,
Streichung der Mehrwertsteuerbefreiung für internationale Flüge – 4,7 Milliarden Euro, pauschale Besteuerung privat genutzter Dienstwagen – 3 Milliarden Euro usw., usw.
Am Ende müssen wir dahin kommen, meine Damen und Herren, dass die Bahn unschlagbar günstig wird.
Aber um 50 Prozent sind die Bahntickets in den letzten 20 Jahren teurer geworden! Das ist doch ein unhaltbarer Zustand. Da muss man doch etwas tun! Die Bahn ist im Eigentum des Bundes. Wenn sie unschlagbar günstig werden soll, dann muss hier etwas getan werden.
Es muss am Ende darum gehen, dass die mittleren und unteren Einkommensgruppen und die kleinen und mittleren Unternehmen entlastet werden. Es muss darum gehen, Infrastruktur zu schaffen, die wirklich ein soziales und ein ökologisches Miteinander ermöglicht. Wenn dann die Einnahmen nicht reichen, dann muss man entweder die Ausgaben senken, oder man muss darüber nachdenken, wo und wie man Einnahmen erhöhen kann.
Bei diesen Riesenvermögen gibt es da, jedenfalls von uns, gute Vorschläge.
Steuern heißen „Steuern“, weil man ein Land damit steuert, meine Damen und Herren. Wenn es so ist, dass allein 630 000 Menschen in Deutschland ausschließlich von ihrem angehäuften Vermögen leben – die nichts mehr machen, die nur davon leben –, dann nenne ich das im Übrigen mal soziale Hängematte. Das ist die Realität, und da, finde ich, kann und muss man auch etwas abholen.
Das ist im Übrigen nicht nur eine Gerechtigkeitsfrage. Es kann doch nicht sein, dass in unserem reichen Land alte Menschen Flaschen sammeln müssen, um die Rente aufzubessern, dass die Zahl der Obdachlosen – heute ist Tag der Wohnungslosen – steigt, während auf der anderen Seite Leute in Saus und Braus leben! Diese Ungerechtigkeiten, meine Damen und Herren, die schlagen auch auf das zwischenmenschliche Klima durch. Das kann man doch nicht wirklich wollen! Wer vor dieser Realität die Augen verschließt, der hat in der Politik wirklich nichts zu suchen.
Frau Merkel, das ist Ihre letzte Legislaturperiode; Sie haben angekündigt, Sie wollen nicht wiedergewählt werden. Ich finde, das ist eine gute Gelegenheit, noch einmal sehr mutig zu sein und wirklich Deutschland auf einen Weg zu bringen, dass wir zukunftsfest werden, dass wir gestalten und dass wir nicht verwalten. Zukunfts- und zielorientierte Investitionen sind das Gebot der Stunde, meine Damen und Herren.
Ich habe Sorge, ob das alles mit der Union möglich ist. Ich habe nach der Rede von Rolf Mützenich die Hoffnung, dass es vielleicht irgendwann einen Mitte-links-Aufbruch gibt.
Das wäre gut für unser Land, für Europa und für die Welt.
Herzlichen Dank.
Jetzt erteile ich das Wort der Fraktionsvorsitzenden von Bündnis 90/Die Grünen, Katrin Göring-Eckardt.
