Meine Damen und Herren! Herr Minister Heil, Sie haben gerade wunderschön gesagt, dass Sie die Opfer nach den Taten in den Mittelpunkt stellen. Das ist der große Unterschied zu uns: Wir hingegen versuchen nämlich, dafür zu sorgen, dass sie gar nicht erst zu Opfern werden.
Artikel 1 des Grundgesetzes besagt:
Die Würde des Menschen ist unantastbar. Sie zu achten und zu schützen ist Verpflichtung aller staatlichen Gewalt.
Der Staat hat also an allererster Stelle dafür zu sorgen, dass den Menschen die Würde nicht genommen wird. Seine vordringlichste Aufgabe ist, Menschen zu schützen und Ursachen zu bekämpfen, die Menschen die Würde nehmen.
„Die Würde des Menschen ist unantastbar“, so steht es im Grundgesetz. Die Würde ist nicht mit Geld kompensierbar. Und zur Würde des Menschen gehört auch, dass jeder nach seinem freien Willen entscheiden darf.
Was Sie hier bei der Impfgesetzgebung machen, ist das Gegenteil davon. Sie wollen auf der einen Seite eine Impfpflicht für Masern einführen, obwohl in vielen – auch europäischen – Ländern mit Impfpflicht deutlich mehr Menschen an Masern erkranken als in Deutschland. Auf der anderen Seite wollen Sie dann die Entschädigung für Leute verbessern, die von der Impfung Schäden davontragen. Das ist etwas, was wir von der Regierung immer wieder sehen: Man ersetzt Freiwilligkeit durch Zwang, und für die auftretenden Schäden wird dann großzügig das hart verdiente Geld der Steuerzahler verteilt.
Lassen Sie uns doch mal den Geist des Grundgesetzes, den Geist der Würde des Menschen und der freiheitlich-demokratischen Grundordnung leben: Lassen wir jeden frei entscheiden, ob er geimpft werden möchte oder nicht!
Das wäre ein starkes Zeichen, dass der Staat die Würde und Eigenverantwortung der Bürger respektiert.
Aber zur Würde des Menschen gehört nicht nur die freie Entscheidung, sondern auch die psychische wie physische Unversehrtheit. Und auch hier ergreifen Sie keine Maßnahmen zum Schutz der Bürger, sondern Sie kennen nur den Griff in den Geldbeutel der Steuerzahler.
Terre des Femmes berichtet aktuell, dass in Deutschland über 70 000 Frauen genital verstümmelt sind und mehr als 17 600 Mädchen gefährdet sind, das gleiche Schicksal zu erleiden.
Seit Jahren steigen die Zahlen der Genitalverstümmelungen durch die Zuwanderung von Menschen aus archaischen Kulturkreisen. Warum schützen Sie denn diese Frauen nicht? Und was ist mit der Würde von Hunderttausenden jungen Frauen in Deutschland, die nicht frei sind in der Wahl ihres Ehepartners, weil sie aus Kulturen kommen, in denen sie zwangsverheiratet werden oder mit dem Tod bedroht werden, wenn sie jemanden aus einer anderen Kultur heiraten?
Das alles sind Opfer von sexueller Gewalt in Deutschland. Warum treten Sie denn Artikel 1 mit Füßen, wenn es um die Würde dieser Mädchen und dieser jungen Frauen in Deutschland geht?
Nach zwei Jahren Bundestag weiß ich, warum Sie sich hier so aufregen
und warum Sie diese Mädchen und Frauen nicht schützen. Sie müssten nämlich zugeben, dass Multikulti gescheitert ist;
denn der einzige Weg, diese Frauen und Mädchen zu schützen, ist, dass eine gleichberechtigte freiheitliche Leitkultur in unserem Land etabliert wird
und sich nicht jeder Zugereiste aufführen kann wie in seinem Heimatland.
