Vielen Dank, dass Sie die Frage erlauben, Frau Kollegin. – Sie haben ja nun eine lange Liste mit Versprechungen vorgetragen – Stichwort „Vollkaskofinanzierung“. Haben Sie eine ungefähre Ahnung, wie viele zig Milliarden das kostet? Wie wollen Sie das finanzieren?
Ich glaube, ich habe gerade erläutert, wie wir das finanzieren. Wir werden das auf breitere Füße stellen.
Wenn alle Menschen, die von Pflege profitieren – das sind alle –, in ein System einzahlen würden, dann hätten wir die Probleme nicht.
Wir müssen diese 34 Milliarden in die Pflege stecken. Es müsste eigentlich auch ein Anliegen der privaten Pflegeversicherung sein, dass das Geld in die Versorgung fließt; denn auch die Privatversicherten profitieren davon.
Die Leistungen sind gleich. Bei der Bürgerversicherung, der Krankenversicherung, sehe ich ein, dass das Konstrukt nicht ganz einfach umzusetzen ist. Bei der Pflege ist es einfach. Die Leistungen sind gleich. Das kann man relativ schnell machen.
– Von allen habe ich nicht gesprochen, aber ich kann Ihnen noch ein paar auflisten.
