Herr Präsident! Meine Damen und Herren! Die Praxis beweist, dass Sie von der Linken keine Ausbildungsförderung kennen.
Die Länder, in denen Sie regieren, sind Schlusslicht bei der Ausbildung. Während bundesweit 17,8 Prozent aller Betriebe ausbilden, sind es in den von Ihnen regierten Ländern: in Berlin winzige 10,3 Prozent, in Brandenburg mickrige 12,6 Prozent und in Thüringen maue 13,2 Prozent. Daran sieht man, dass Sozialismus immer nur eine Ursache für Probleme ist und niemals eine Lösung.
Kehren Sie doch bitte erst mal vor der eigenen Haustür, bevor Sie hier große Reden schwingen.
Aber auch abgesehen davon ist Ihr Antrag in der aktuellen Situation eine einzige Themaverfehlung. Es wundert mich nicht, dass Sie von der Linken so einen Antrag stellen; denn in Bayern und Baden-Württemberg, wo das Rückgrat des deutschen Wohlstands gerade in die Knie geht, sind Sie ja nicht existent.
Es ist völlig kontraproduktiv, Unternehmen staatlich zur Ausbildung zu nötigen, wenn man zugleich die Arbeitsplätze in großem Stil vernichtet und die jungen Leute nach der Ausbildung überhaupt keinen Arbeitsplatz mehr finden. Wer Ausbildungsplätze schaffen will, der sollte nicht Unternehmer gängeln, sondern der sollte ein politisches Klima schaffen, in dem Unternehmer auf Jahre hinweg planen können.
Ein Automobilzulieferer, der nicht weiß, ob es ihn Ende nächsten Jahres noch gibt, der Standorte schließen und Tausende Mitarbeiter entlassen muss, der wird keinen Azubi einstellen.
Und der Bäcker und der Metzger, deren Hauptkunden die Mitarbeiter dieses Zulieferers sind, werden auch keinen Azubi einstellen, wenn sie nicht wissen, wer die Leberkässemmel noch kaufen soll, wenn das Werk vor seiner Nase dichtgemacht hat. Im heutigen Klassenkampf ist der Gegner der Arbeiter bei Audi, BMW, Bosch, Continental und Siemens nicht der Arbeitgeber, sondern die Klasse der abgehobenen, machtgeilen sozialistischen Politbonzen,
die unter dem Vorwand angeblichen Klimaschutzes ihre Arbeitsplätze vernichten.
– Ja, schreien Sie nur. Politbonzen sind die, zu denen Sie hier alle gehören.
