Hören wir also auf, diese rückwärtsgewandte, umweltschädliche Technologie zu subventionieren und weiter zu unterstützen. Hören wir vor allen Dingen auf mit der manischen und pathologischen Propaganda für diese Technik, vor allem vor dem Hintergrund, dass die Dieseltechnologie zum Beispiel viel umweltfreundlicher ist.
Hören wir einfach damit auf, und fangen wir einfach an, mehr im Bereich Kernspaltung und Kernfusion zu forschen.
Es gibt auf dem Gebiet der Kernspaltung nunmehr die vierte Generation an Reaktoren, die nach menschlichem Ermessen vermutlich sicher sein wird.
Die Wissenschaftler werden noch feststellen, dass das so ist. Beim Zwei-Flüssigkeiten-Reaktor, Dual Fluid, kann keine Kettenreaktion vonstattengehen. Das Schöne ist: Wir können das Endlagerproblem lösen. Die Strahlung wird nur noch 300 Jahre anhalten, aber auch das werden wir lösen, wenn wir die bisher theoretisch ermittelten Forschungsergebnisse auch praktisch umsetzen. Das müssen wir eben, und dafür brauchen wir Geld.
Vor allen Dingen: Vernachlässigen wir nicht wie bisher die Kernfusion. Am Max-Planck-Institut für Plasmaphysik in Greifswald gibt es eklatante Engpässe in der Finanzierung. Die Wissenschaftler dort müssen betteln, damit sie entsprechende Kapazitäten für die Auswertung ihrer Versuchsreihen erhalten. Eine Versuchsreihe dauert drei Monate und die Auswertung dann zwei Jahre, weil kein Personal und vor allem keine Rechnerkapazität vorhanden sind. Das ist ein Skandal für unser Land. Die Asiaten laufen uns davon; denn sie wissen, wie wichtig Zukunftstechnologie ist. Sie investieren dort massiv. Es ist eine Schande für Europa, dass wir unseren Blick hier nicht öffnen, sondern immer noch an alten Technologien festhalten und die zukunftsweisenden Technologien verlieren. Das muss aufhören. Damit muss Schluss sein. Lassen wir bei uns endlich wieder ideologiefreie Wissenschaftler sprechen! Das fordern wir.
Vielen Dank.
Für die SPD-Fraktion hat nun Thomas Jurk das Wort.
