Ja, bitte.
– dass wir uns gemeinsam dazu entschließen, uns dem Hass in unserem Land und überall in der Welt zu stellen.
Meine Damen und Herren, zum Thema. Seit vielen Jahren setze ich mich für diejenigen ein, die im Rahmen des Rentenüberleitungsgesetzes benachteiligt worden sind. Es war mir sehr wichtig, und es ist mir mit meinen Kollegen auch gelungen, für Betroffene in der Grundsicherung eine Härtefallfondslösung im Koalitionsvertrag festzuhalten.
Das ist an die AfD und an die Linken adressiert, die das jetzt, glaube ich, bestreiten.
Dieser Härtefallfonds ist auf dem Weg. Aktuell erarbeitet eine Bund-Länder-Arbeitsgruppe konkrete Lösungsvorschläge, die noch in diesem Jahr vorgestellt werden sollen. Bereits in dieser Woche habe ich gemeinsam mit meinen Kollegen Peter Weiß, Daniela Kolbe und Ralf Kapschack mit Vertretern des runden Tisches zusammengesessen und über Lösungsvorschläge diskutiert. Dabei ist das herausgekommen, was hier von der Linken bestritten wird: Wir waren uns darin einig, dass die Anerkennung der Lebensleistung das Ziel sein soll und dass wir in der Lage sein sollten, dies umzusetzen.
Fest steht auch, dass sich die Bundesländer bei der Ausgestaltung des Härtefallfonds finanziell beteiligen müssen. Damit nehme ich gerade auch die Landesregierungen mit Beteiligung der Linken in die Pflicht, die an dieser Stelle zeigen können, dass es ihnen tatsächlich um das Wohl der Menschen geht und nicht um Sozialpopulismus kurz vor der Thüringen-Wahl. Denn gerade Ihr Antrag ist ein bunter Mix allgemeiner sozialpolitischer Forderungen, die ohne Konzept und ohne Finanzierungsvorschläge aufgelistet werden und nichts anderes als realitätsferne Wahlversprechungen sind.
Meine Damen und Herren, Ihr Plan ist so durchschaubar, dass hoffentlich niemand darauf hereinfallen wird. Die vorliegenden Anträge der Linken und der AfD zeigen, dass Links und Rechts sich nicht zu schade sind, rentenpolitische Fragen für eine Spaltung Deutschlands auszunutzen. Hier sollen Jung gegen Alt und Ost gegen West ausgespielt werden. Das riecht förmlich nach einer Griechenland-Koalition von Links und Rechts, das heißt einer Koalition zwischen AfD und Linken.
Ich bin sehr gespannt auf Thüringen.
Meine Damen und Herren, bei diesem Spiel machen wir nicht mit. Wir wollen Verlässlichkeit. Der Härtefallfonds wird bereits ausgearbeitet, die Rentenangleichung ist schon lange beschlossen, und deswegen lehnen wir Ihre Anträge ab.
Vielen Dank.
Vielen Dank, Kollege Weiler. – Nächster Redner: für die SPD-Fraktion Christoph Matschie.
