Liebe Kolleginnen und Kollegen! Herr Präsident! Ja, es ist in der Tat so: Die doppelte Herausforderung dieser Zeit heißt: Klimawandel bekämpfen und Konjunktur und Wirtschaft stützen. Das ist das, was wir zusammendenken. Da meinen manche ja, das sei ein unauflösbarer Gegensatz. – Nein, wir glauben, es ist sogar eine doppelte Chance, wenn wir Klima und Konjunktur zu einem Zukunftspaket für Deutschland mit dem klaren Ziel zusammenführen: mehr wirtschaftliches Wachstum bei weniger CO
Es hat hier ja einige Beiträge gegeben, in denen eine sehr einfache Lösung dafür präsentiert wurde, wenn man auf der einen Seite sehr viel in den Klimaschutz investieren und auf der anderen Seite Maßnahmen zur Stärkung der Wirtschaft ergreifen wolle. Diese ganz einfache Lösung hieß Staatsverschuldung. Die einfache Antwort auf die Probleme unserer Zeit: Staatsverschuldung!
Der Chefökonom von Verdi hat beispielsweise diese Woche verkündet, dass die 100-Euro-Scheine auf der Straße lägen und man sie nur aufheben müsse. – Meine Damen und Herren, wer die Staatsverschuldung hochtreibt, der sammelt kein Geld von der Straße, sondern der klaut es den nächsten Generationen. Das ist die Wahrheit.
Übrigens sei an dieser Stelle der Hinweis erlaubt: Das sind genau die Rezepte der Vergangenheit. Das sind die Rezepte, die uns in eine europäische Schuldenkrise hineingeführt haben.
Damals waren die Zinsen niedrig und die Ausgabenwünsche der Politik riesengroß. Das Ergebnis ist doch bekannt. Das lief nach dem Motto „heute billige Schulden machen, morgen teuer zurückzahlen“. – Das ist weder ökonomisch klug noch politisch verantwortungsvoll, meine Damen und Herren.
Das Schlimme dabei ist, dass manche aus der Euro-Schuldenkrise offensichtlich überhaupt nichts gelernt haben. Das zeigt ein Blick auf die Wortmeldungen dieser Woche: Der Vorsitzende der Grünen, Robert Habeck, hat gesagt, er will pro Jahr 35 Milliarden Euro neue Schulden in Deutschland machen und dafür sogar das Grundgesetz ändern. Liebe Kollegin Katrin Göring-Eckardt, Sie haben das dann vorhin „Schuldenbremse reformieren“ genannt. Das Grundgesetz zu ändern, nennen Sie „Schuldenbremse reformieren“.
Ich sage Ihnen, was Sie eigentlich wollen: Sie wollen unter dem Deckmantel der grünen Politik den Haushalt in rote Zahlen treiben. Das ist Ihr eigentliches Ziel.
Das werden wir übrigens nicht tun, weil wir genau für Politiker wie Sie mit solchen Ideen die Schuldenbremse ins Grundgesetz hineingeschrieben haben. Deswegen ändern wir sie an dieser Stelle nicht.
Herr Kollege Dobrindt, erlauben Sie eine Zwischenfrage?
Nein, ich erlaube keine.
