Ich will Ihnen auch sagen, warum. Das eigentliche Ziel der AfD ist doch Folgendes: Sie wollen doch alles kürzen, was mit der UN zu tun hat; Sie wollen alle Titel kürzen, die im Bereich der Menschenrechte sind; Sie wollen alle Titel kürzen, die im Bereich der humanitären Hilfe sind. Jetzt instrumentalisieren Sie den Bundesrechnungshof. Übrigens: Würden Sie die Berichte des Bundesrechnungshofes lesen, wüssten Sie, dass darin gar nicht das steht, was Sie hier behaupten. Das tun Sie aber nicht; das würde Ihnen ja nicht in den Plan passen.
Dann reden Sie hier von Gutmenschentum! Wenn es Gutmenschentum ist, sich für Menschenrechte einzusetzen, wenn es Gutmenschentum ist, sich für humanitäre Hilfe einzusetzen und für das, was in unserer Verfassung steht, wenn das Gutmenschentum ist, dann bin ich ein Gutmensch, und ich bin richtig stolz darauf, das sein zu können.
Herr Minister, Sie haben einige Baustellen. Das Geld zum Beispiel für die Opfer der Colonia Dignidad ist, obwohl es einen Bundestagsbeschluss gibt, in Ihrem Etat noch immer nicht eingestellt. Sie reden über Menschenrechte. Aber die Menschenrechtsbeauftragte ist immer noch nicht so ausgestattet, dass sie auch wirklich ihre Arbeit erledigen kann.
Sie reden davon, dass wir neue Strukturen im Haus brauchen. Aber wenn es um die Personalreserve geht, um die neue Personalplanung, wird im Moment nichts getan. Hier ist übrigens auch das Finanzministerium gefordert: Hören Sie endlich auf, dieses Amt als Gedöns abzuhandeln! Das Auswärtige Amt verdient mehr, und es liegt auch in unserer Verantwortung, die Rahmenbedingungen zu schaffen, damit das Amt ordentlich arbeiten kann. Denn die sind derzeit noch nicht vorhanden. Das ist die Lage.
Vielen Dank.
Der nächste Redner für die SPD-Fraktion: der Kollege Christoph Matschie.
