Eines kommt in Ihren Anträgen deutlich zu kurz: die viel zu hohe Steuer- und Abgabenlast der Unternehmen. Gerade Unternehmern, die sich in strukturschwachen oder ländlichen Räumen durchsetzen müssen, könnte man mit deutlich geringeren Gewerbe- und Körperschaftsteuersätzen das Leben erleichtern. Man könnte die Unternehmen und auch die Arbeitnehmer in Sonderwirtschaftsgebieten über einen befristeten Zeitraum bei Sozialversicherungsbeiträgen entlasten, ohne deren Ansprüche zu kürzen.
Das alles bedingt hohe staatliche Investitionen, die sich dann aber auszahlen, wenn sich in diesen zu benennenden Sonderwirtschaftsgebieten ein Markt, der sich selbst trägt, und eine Gesellschaft, die vital und wachsend ist, etabliert haben. Wir lehnen Ihren Freiheitszonenantrag ab, weil er sich für uns als Schaufensterantrag darstellt, der kein wirkliches Engagement für mehr Unternehmensgründungen erkennen lässt.
Aber was mich geradezu wütend macht, ist, dass solche Anträge überhaupt notwendig sind. Dem Ausbluten der strukturarmen Gebiete, vornehmlich im Osten, ist jahrzehntelang von dieser Bundesregierung tatenlos zugesehen worden, und Sie machen immer alles noch schlimmer. Sie von der Regierung sind es, die mit Ihrer blinden, inzwischen religiös-fanatischen Politik nicht nur eine neue Gründerkultur jahrelang verhindert haben; Sie haben auch die heute bestehenden gesellschafts-, sozial- und wirtschaftspolitischen mittelstands- und gründerfeindlichen Verhältnisse zu verantworten. Und Ihnen nimmt man doch nun wirklich nicht mehr ab, dass Sie an diesen Verhältnissen noch was ändern wollen.
Sie schimpfen uns Populisten. Dabei sind Sie es, die entgegen besserer Einsicht, entgegen allen Fakten einem grün-rot-goldenen Kalb hinterherlaufen und den Hohepriestern des heiligen Klimas huldigen, um einer lauten Bioladen-Wohlstandsminderheit aus Influencern, Schauspielern und vermeintlichen Sängern hinterherzulaufen, statt verantwortungsvolle Politik für das ganze Volk zu machen.
Meine Damen und Herren, Verantwortung heißt eben, auch mal schwierige Entscheidungen zu treffen, Entscheidungen, die in Kreuzberg und Eppendorf vielleicht nicht gut ankommen, die aber die Menschen in Güstrow, Gelsenkirchen und Gera wieder in Lohn und Brot bringen.
Bertolt Brecht hat einmal gesagt:
Kein Vormarsch ist so schwer wie der zurück zur Vernunft.
Ich beschwöre Sie, umzukehren und sich auf den Weg zu machen, auch wenn es noch so schwer wird, zum Wohle Ihres, zum Wohle unseres Volkes.
