– Nein, kommt es nicht. – Ich will das auch einmal visualisieren; denn ich glaube, dass das notwendig ist. Sie kommen damit in der öffentlichen Debatte noch viel zu gut durch.
Wir haben von drei verschiedenen Stellen Zahlen gesehen, die zeigen, wie ungenau Ihr Grundrentenmodell ist. Ihre eigenen Zahlen, Herr Minister, lieber Hubertus Heil, zeigen: Wenn man die Modelle mit Bedarfsprüfung, die Sie im Bund-Länder-Sozialpartnerdialog durchgerechnet haben, nimmt, kommt man zu dem Schluss, dass 97 Prozent der Empfänger gar nicht von Altersarmut betroffen wären. 97 Prozent! In den letzten Tagen des August wurde eine Studie vom IW veröffentlicht, die zeigt, dass Ihr Rentenmodell an 80 Prozent der konkret von Altersarmut Betroffenen vorbeigeht. Gestern hat das DIW Zahlen vorgelegt, das ja nun wirklich kein SPD-fernes Institut ist. Diese zeigen, dass langfristig 90 Prozent der Empfänger bei Ihrem Modell gar nicht von zu wenig Geld im Alter betroffen sind.
Das ist ein krass ungenaues Modell, und deswegen ist es ein schlechter Vorschlag.
Sie geben dafür zu viel Geld aus und haben zu wenig Geld zur Verfügung, um denjenigen zu helfen, die unsere Unterstützung gerade brauchen, nämlich all diejenigen, die 34 Jahre und 11 Monate oder weniger Versicherungszeit und im Alter auch zu wenig Geld haben. Für diese Menschen müssten wir zielgenau etwas tun.
Das Schöne ist – ich komme zum Schluss, Herr Präsident –:
Das DIW hat auch unterstrichen, dass es anders geht. Es unterstützt nämlich unseren Ansatz der Basisrente, mit dem wir deutlich machen, dass man dafür sorgen kann, dass jeder, der gearbeitet und eingezahlt hat, im Alter mehr als die Grundsicherung und mehr als diejenigen hat, die das nicht getan haben. Man kann auch dafür sorgen, dass diese Menschen im Alter nicht auf das Sozialamt gehen müssen. Ein modernes, zielgenaues Modell ist möglich,
und wir hoffen, dass Sie das in diesem Herbst noch vorlegen werden, liebe Kolleginnen und Kollegen.
Nächste Rednerin ist die Kollegin Dr. Gesine Lötzsch, Die Linke.
