stärken wir denen den Rücken, die jeden Tag an vielen Orten in diesem Land sich dem rechten Vormarsch entgegenstellen und sagen: Danke, Antifa!
Frau Kollegin Renner, darf ich Sie kurz zu mir bitten?
Liebe Kolleginnen und Kollegen, die Kollegin Renner trägt an ihrem Revers einen Sticker der Antifa. Ich erteile ihr dafür einen Ordnungsruf
und behalte mir vor, nach Erörterung im Präsidium des Deutschen Bundestages weiter gehende Ordnungsmaßnahmen gegen sie zu verhängen.
Frau Kollegin Kipping, ich erteile Ihnen ebenfalls einen Ordnungsruf für die Zwischenbemerkung.
Als nächste Rednerin spricht für die Fraktion Bündnis 90/Die Grünen die Kollegin Canan Bayram.
Frau Bayram, ganz kurz, bevor Sie anfangen: Wenn Sie weitere Ordnungsrufe haben wollen, melden Sie sich. Sitzungsleitende Maßnahmen des Präsidenten sind der Erörterung entzogen; das gilt grundsätzlich. Und noch einmal: Ich halte es nicht für opportun, Sticker der Antifa im Deutschen Bundestag zu tragen.
Frau Kollegin Bayram, Sie haben das Wort, und ich würde die Mitglieder der AfD-Fraktion bitten, auch dieser Rednerin zuzuhören, selbst wenn es Ihnen schwerfallen sollte.
