Bemerkenswert ist übrigens, dass in Ihrem Antrag mit keinem Wort die Novemberrevolution erwähnt wird. Die hat doch überhaupt erst dazu geführt, dass die Hohenzollern abdanken mussten. Die Novemberrevolution hat die Weimarer Verfassung doch überhaupt erst möglich gemacht.
Die Ursache des Scheiterns lag aber auch – da kommt man nicht dran vorbei – in der Verfassung selbst. Sie enthielt zwar vieles, was uns heute wertvoll ist, auch vieles, was wir heute als selbstverständlich empfinden. Viele Dinge wurden schon genannt: Wahlrecht, Frauenwahlrecht, Achtstundentag, Mutterschutz, Betriebsrätegesetz, Pressefreiheit und vieles, vieles mehr. Fakt ist aber auch, dass sich an der sozialen Ungerechtigkeit nichts änderte. Der Kaiser dankte ab; aber die alten Eliten blieben am Ruder.
Und in der Verfassung wurde mit der starken Stellung des Reichspräsidenten eine Art Minikaiser etabliert, der das Parlament auflösen und ohne parlamentarische Mehrheiten mithilfe von Notverordnungen regieren konnte. Wohin das führte, wissen wir hier alle.
Damit das Erinnern einen Sinn hat, müssen wir anerkennen, dass das Scheitern der Weimarer Republik entscheidend mit ihrem Entstehen zu tun hatte. Die Ermordung von Rosa Luxemburg und Karl Liebknecht steht exemplarisch für den rechten Terror schon zu Beginn der Weimarer Republik.
Dieser Antrag, dieses Thema hätte es wirklich verdient, im Kulturausschuss mit Sachverständigen debattiert zu werden. Wir bitten Sie deshalb, dem Vorschlag auf Überweisung in den Ausschuss zuzustimmen. Bei einer Sofortabstimmung wird sich meine Fraktion enthalten müssen; denn die wichtigste Lehre aus dem Scheitern der ersten deutschen parlamentarischen Republik ist, dass man sich verbünden muss gegen rechts. Mein Kollege von der FDP, der vor mir gesprochen hat, sieht das genauso; das finde ich gut. Gerade in diesen Zeiten des rechten Terrors wäre es richtig gewesen, diesen Antrag gemeinsam mit allen demokratischen Fraktionen einzubringen. Das wäre ein gutes Zeichen gewesen. Diese Chance wurde vertan.
Das führt den im Antrag formulierten Anspruch leider ad absurdum.
Eine Schlussbemerkung muss ich mir erlauben: Im Antrag heißt es – ich
zitiere –:
