Das ist ein ökonomischer und naturwissenschaftlicher Nonsens, der uns jetzt schon die höchsten Stromkosten in Europa beschert, Hunderttausende Haushalte von Geringverdienern und der Mittelschicht in existenzielle Bedrängnis bringt, die Versorgungssicherheit gefährdet und energieintensive Industrien nach und nach aus Deutschland vertreibt.
Ihr vorgeblicher Klimaschutz ist nichts anderes als ein monströses Deindustrialisierungsprogramm, verbunden mit veritabler Arbeitsplatzvernichtung. Sie verschwenden Abermilliarden, um imaginierte Weltuntergänge in ferner Zukunft abzuwenden. Sie lassen sich von fragwürdigen Lobbyisten wie der Deutschen Umwelthilfe – aus meiner Sicht gehört diese Lobbyorganisation verboten – am Gängelband führen
und zerstören dafür die Grundlagen unseres Wohlstands und unsere Fähigkeit, die ganz realen und drängenden Herausforderungen der kommenden Jahrzehnte zu meistern.
Ich nenne zum Beispiel die unbewältigten Folgen der ungeregelten Migration in die Sozialsysteme und die Kriminalstatistik.
– Ja, ich weiß schon, warum Sie so quietschen. – Der frühere Bundesnachrichtenchef, August Hanning, spricht von mehr als 2 Millionen überwiegend jungen Männern, die seit 2015 eingewandert sind. Und die nächste Welle steht schon vor der Tür. Die Bilder aus Lesbos sind ein Menetekel. Der Türkei-Deal, an den Sie sich ja so gerne und so lange geklammert haben, ist gescheitert. Die Balkanroute ist offen, und Sie verschließen einfach die Augen davor.
Wir könnten die Migration übers Mittelmeer beenden, wenn Sie bereit wären, mit Italien und anderen Mittelmeeranrainern dafür zu sorgen, dass keiner mehr illegal übers Meer nach Europa gelangen kann.
Was wird aber gemacht? Stattdessen ermuntern Sie die humanitären Schleuser und Menschenhändler, auch NGOs genannt,
lassen deren illegal eingeschleusten Passagiere noch nach Deutschland einfliegen und wollen sogar noch einen staatlichen Wassertaxidienst einrichten. Das ist wirklich nur noch grotesk, sehr geehrte Damen und Herren!
Eine wirksame Sicherung und Kontrolle der Grenzen ist möglich. Die Kosten würden sich jährlich im einstelligen Milliardenbereich bewegen – und das wissen Sie. Kein Vergleich mit den ökonomischen, politischen und vor allem gesellschaftlichen Folgekosten der anhaltenden ungeregelten Einwanderung! Sie wollen Millionen Bürger durch Verbote, Strafsteuern und dirigistische Maßnahmen in ihrer individuellen Mobilität einschränken, aber illegale Einwanderer können sich weiter frei und ungehindert über unsere Grenzen bewegen. Selbst wenn die Asyltäuschung auffliegt und der Aufenthaltstitel verweigert wird, müssen sie kaum eine Abschiebung fürchten.
Sie haben das Geld für die abseitigsten Partikularinteressen übrig, aber nicht für die effektive Kontrolle unserer Grenzen und den Schutz unserer Bürger, die Ihnen einen Rekordanteil des von ihnen erwirtschafteten Einkommens überlassen müssen. Die Gegenleistungen bleiben Sie schuldig.
Inzwischen hat jeder zweite Hartz-IV-Empfänger einen Migrationshintergrund. Dazu kommt: Fast zwei Drittel der sogenannten Flüchtlinge leben von Hartz IV. Also zwei Drittel Ihrer Fachkräfte leben von Hartz IV!
Asylzuwanderer sind übrigens überproportional kriminalitätsbelastet, gemessen am Bevölkerungsanteil. Schwere Sexual-, Raub- und Tötungsdelikte durch Zuwanderer haben erschreckend zugenommen.
