Frau Präsidentin! Meine Damen und Herren! Herr Hirte, ich habe Ihrer Rede zugehört. Ich habe Ihre öffentlichen Äußerungen zur Kenntnis genommen. Ehrlich gesagt: Das alles ist ein Trauerspiel. Sie müssen sich wirklich mal Ihre Arbeitsplatzbeschreibung anschauen. Ich glaube, es ist nicht Ihre einzige Aufgabe, die Bundesregierung zu verteidigen. Ihre Aufgabe ist es, ostdeutsche Interessen wahrzunehmen.
Gucken Sie sich mal an, was Frau Gleicke gemacht hat. Hospitieren Sie mal einen Monat bei ihr. Dann machen Sie das vielleicht mal ein bisschen besser. Sie müssen den Mut zur Kontroverse mit Ihrer Bundesregierung haben.
Was Sie in Ihrem Bericht öffentlich äußern, ist wirklich eine unverantwortliche Lobhudelei. Lassen Sie mich das an zwei Beispielen erläutern. Die ostdeutsche Wirtschaftsleistung liegt bei 75 Prozent, schreiben Sie in Ihrem Bericht. Das ist alles in Ordnung; das hört sich auch erst einmal passabel an.
Vergleichen wir aber mal diesen Wert mit dem Wert aus dem Jahr 1995. 1995 lag diese Quote bei 65 Prozent. Das heißt, Sie haben in knapp einem Vierteljahrhundert 10 Prozentpunkte Angleichung geschafft. Donnerwetter! Wenn Sie in dieser Geschwindigkeit weitermachen, dann erzielen wir Gleichheit im Jahre 2021. Doch so schnell.
- 2081. – Für die Ostlöhne gilt genau dasselbe. Inzwischen, sagen Sie, liegen diese bei 85 Prozent des Westniveaus. 85 Prozent! Im Jahr 2000 lag das Niveau bei 80 Prozent. Auch hier ist es so: Wenn im gleichen Tempo angeglichen wird, dann haben wir erst im Jahr 2073 eine vollständige Angleichung der Löhne. Das ist sehr konkret.
In meinem Bundesland Mecklenburg-Vorpommern zum Beispiel hat ein Mensch mit einem anerkannten Berufsabschluss einen Lohn von durchschnittlich circa 2 400 Euro. In Hamburg verdient ein Mensch ohne Berufsabschluss 2 500 Euro.
Es ist doch logisch, dass es unendlich viele Pendler gibt und die Abwanderung fortschreitet. Dagegen muss endlich etwas getan werden.
Das ist nicht allein Ihre Aufgabe; auch Gewerkschaften und auch Unternehmen sind hier gefordert.
Schauen wir uns das Armutsrisiko an. Das Armutsrisiko im Osten liegt laut Bericht bei 18 Prozent. Wie war das 1995? Da lag das Armutsrisiko bei 15 Prozent. Das heißt, dass heute mehr Menschen arm oder von Armut bedroht sind,
nach einem Vierteljahrhundert in Ost und West. Die Arbeitslosigkeit ist dabei im Übrigen ja relevant zurückgegangen.
Wer zynisch sein will, muss sagen: Die blühenden Landschaften entwickelten sich im Osten nicht, und im Westen gibt es sie auch nicht mehr. Stattdessen ist Gelsenkirchen jetzt genauso arm wie Bitterfeld. Herzlichen Glückwunsch! Lieber Herr Hirte, Ihre Lobhudelei zeigt Ihren Realitätsverlust. Das macht mich sprachlos.
Sie sind so weit weg von den Ostdeutschen wie Ostdeutschland von blühenden Landschaften.
Um es klar zu sagen: Natürlich ist sehr viel erreicht worden; das ist doch unbestritten. Viele Kommunalpolitiker von Union bis zur Linken, viele Ehrenamtliche haben unendlich viel geleistet; das alles ist völlig klar. Wir müssen das aber in einer solchen Debatte nicht allein nach vorne stellen. Die Mehrheit der Ostdeutschen, so steht es in Ihrem Bericht, ist unzufrieden mit der Einheit. Was ist das für ein Offenbarungseid?
Das ist doch unfassbar.
