Sehr geehrte Frau Präsidentin! Geschätzte Kolleginnen und Kollegen! Liebe Zuhörer! Die Rede von Herrn Höhn von der Linken war nicht etwa die Höhe der Debattenkultur, sondern Hohn für die Aufbauleistungen der Menschen in den neuen Bundesländern in den letzten 30 Jahren.
Sie haben hier gesagt – ich zitiere Sie –, dass der Aufbau Ost nicht geschafft ist.
Das ist ein Schlag in das Gesicht vieler Menschen. Ihre Partei hat die marode Staatswirtschaft zu verantworten, einen Unrechtsstaat und den Schürer-Plan. Gucken Sie einmal dort hinein. Die DDR war bankrott. Wie war denn die Ausgangssituation? Die Flüsse, die Böden, die Luft, alles war verschmutzt. Wir haben heute über das Thema Klima geredet. Wie hoch waren hier denn die Belastungen? Und was ist in den letzten 30 Jahren geschehen? Von der Wismut zur Bundesgartenschau 2007 in Gera und Ronneburg, von einer verseuchten Region aus DDR-Zeiten, die Sie parteilich mit zu verantworten hatten, zu blühenden Landschaften – das ist die Leistung, die wir in den letzten 30 Jahren gesehen haben.
Wir haben gesehen, dass sich die Menschen aus dem Osten aufgemacht haben mit Innovationsgeist, der ihnen nicht in der Schule vermittelt wurde, mit vielen Unternehmern, die mit Mitte 40 noch einmal neue Unternehmen gegründet haben, nicht aus der Hochschule heraus, sondern mitten im Leben stehend. Wir haben erlebt, wie viele Menschen Unternehmergeist entwickelt haben, selber gegründet haben, reinvestiert haben, sich eigene Märkte erarbeitet haben, vom lokalen deutschen zum europäischen Binnenmarkt, und die heute im globalen Wettbewerb im Weltmarkt aktiv sind. Wir erleben, dass mittlerweile die Zahlen, die wir uns im 30. Jahr nach der Wiedervereinigung anschauen – die ganz nüchternen Fakten –, dafür sprechen, dass eine ungemein starke Aufbauleistung hier in diesem Land erbracht worden ist.
Es gab vielleicht drei oder vier welthistorische Leistungen, die hier einzuordnen sind. Das ist einmal die Art und Weise, wie es die Chinesen in den letzten 40 Jahren geschafft haben, mehrere Hundert Millionen in die Mittelklasse zu holen, wie es ein Land wie Singapur geschafft hat, aus einem mückenverseuchten Sumpf eine starke Wirtschaftsleistung zu machen. Hinzu kommt die Leistung nach der Wiedervereinigung, nach dem Fall des Eisernen Vorhangs in Ostdeutschland, aber auch in Osteuropa, wie wir aus einem maroden System Marktwirtschaft gemacht haben und hier Millionen von Menschen in die Mittelschicht gebracht haben, die heute davon leben können.
Meine sehr geehrten Damen und Herren, das ist die Aufbauleistung, für die wir uns nicht schämen müssen, wie Sie es uns einreden wollen.
