ist nichts anderes als die Rückkehr zur Planwirtschaft, von der wir froh waren, dass wir sie endlich überwunden haben.
Hinzu kommt, wenn Sie sich einmal ehrlich machen: Dieser Mietendeckel ist die Bankrotterklärung Ihrer eigenen Politik. In allen Städten mit den größten Wohnkostenproblemen
– auch Frankfurt – regieren SPD, Grüne und Linke. Wir wissen aus der Geschichte,
wir wissen aus der Wissenschaft, wir wissen aus der gescheiterten Mietpreisbremse, dass solche Überregulierungen wie ein Mietendeckel gar nichts bringen, überhaupt nichts. Der Mietendeckel wird die Probleme am Wohnungsmarkt nicht lösen, sondern verschärfen.
Die Neubauzahlen – Berlin macht es vor – gehen zurück, weil niemand mehr in Wohnraum investiert. Die Schlangen bei den Wohnungsbesichtigungen werden deshalb noch länger. Statt 300, die keine Wohnung bekommen, müssen Sie Wohnraum für 500 regulieren. Die Klimaziele werden nicht erreicht, weil wegen des Mietendeckels niemand in den Klimaschutz investiert. Die Häuser werden vor sich hingammeln wie die Menschen. Die Menschen werden in Bruchbuden leben wie zu DDR-Zeiten.
Der Mietendeckel zerstört den Wohnungsmarkt. Er zerstört das Vertrauen und beendet den Neubau. Und damit schadet der Mietendeckel den Mietern. Das ist mit uns Freien Demokraten nicht zu machen.
– Es freut mich immer: Wenn die Linken nervös werden, kommen sie mit der AfD-Keule, meinetwegen.
Leider reden wir wegen der ständigen sozialistischen Nonsensideen nie über die tatsächliche Ursache des Problems. Die Mieten steigen, weil Millionen Wohnungen dort fehlen, wo die Menschen leben wollen, weil der ländliche Raum ausblutet.
Ich finde es beinahe traurig, dass ich in jeder Rede immer wieder erklären muss – ich sage es gern noch einmal, vielleicht bleibt es hängen –:
