Es gibt weitere Wünsche nach Zwischenfragen. Der Kollege Bystron war der Erste, der sich gemeldet hat. – Bitte, Herr Kollege Bystron.
Lieber Kollege Jung, vielen Dank, dass Sie die Frage zulassen. Sie haben jetzt gerade ausgeführt, wir seien gegen die deutsche Automobilindustrie. Ich muss Ihnen eines sagen: Die deutsche Automobilindustrie ist wettbewerbsfähig. Vor allem: Sie hat einen technologischen Vorsprung.
Ich habe über zehn Jahre in dem Bereich gearbeitet. Ich war bei allen A-Messen in der Welt – Detroit, Tokio, Frankfurt usw. – dabei, und es war ganz klar, dass wir vor allem mit der Dieseltechnologie einen technologischen Vorsprung vor allen anderen Mitbewerbern hatten.
Jetzt kommt eine künstlich in den Markt gedrängte, staatlich subventionierte Technologie, die unterlegen ist, nämlich das Elektroauto. Den Elektroantrieb gibt es seit über 100 Jahren. Er hat sich am Markt nicht durchgesetzt, weil er nicht wettbewerbsfähig war, und Sie unterstützen das auch noch. In welchen Ländern wird dieser Antrieb subventioniert? Vor allem in China und in den USA. Auch Sie unterstützen das, und damit machen Sie die deutsche Automobilindustrie kaputt; damit machen Sie unseren Wettbewerbsvorteil kaputt.
Mit Verlaub, ich bin weit davon entfernt, alles, was die Automobilindustrie uns vorschlägt, eins zu eins übernehmen zu wollen. Das müssen wir immer kritisch beobachten. Die Politik setzt den Rahmen. Aber das, was Sie gerade beschrieben haben, steht in einem diametralen Widerspruch zu dem, was die deutsche Automobilindustrie selber für richtig hält.
Natürlich sagt sie: Wir wollen auch weiterhin in Effizienz in der Dieseltechnologie investieren. Aber sie sagt auch – es ist doch öffentlich bekannt; Sie können es nachlesen –: Wir sehen die Zukunft im Bereich der Elektromobilität. Wir wollen sie auch in Deutschland auf den Markt bringen. Aber um sie auf den Markt zu bringen, müssen wir bestimmte Rahmenbedingungen haben. – Diese Rahmenbedingungen schaffen wir mit diesem Klimapaket. Wir müssen den Menschen sagen: Wir erwarten Veränderungen, und wir wollen dabei individuelle Mobilität erhalten. Zu dieser individuellen Mobilität gehört die Stärkung der Schiene, gehört die Stärkung des ÖPNV. – Das leisten wir mit diesem Paket: Zugfahren wird billiger, und es wird entsprechend investiert.
Aber auch in Zukunft gehört zur individuellen Mobilität, die ein Ausdruck von Freiheit ist, die ein Ausdruck von sozialer Teilhabe ist, selbstverständlich auch das Auto. Dafür muss das Auto aber klimafreundlicher werden; sonst erreichen wir die Ziele, die wir beim Klimaschutz anstreben, nicht. Sie negieren diese Ziele, weil Sie das, was wir als Wertgrundlagen beschreiben, was unser Papst als besonders wichtige Aufgabe beschreibt – „Verteidigung der Mutter Erde“ –,
was wir als einen wichtigen Beitrag zur Verteidigung unserer Heimat empfinden, weil es zum Beispiel um den deutschen Wald geht, ablehnen; das alles negieren Sie. Für uns ist das wichtig. Wenn das aber richtig ist, dann muss auch das Auto klimafreundlicher werden. Dazu ist Elektromobilität ein wichtiger Beitrag.
Mit der Förderung der Infrastruktur, mit Kaufprämien, mit steuerlichen Maßnahmen ermöglichen wir den Menschen, diese Technologie auch tatsächlich in Anspruch zu nehmen, sich so ein Auto zu kaufen, es im ländlichen Raum auch zu fahren. Damit ist unsere Antwort auf die Frage „Wie bringen wir Klimaschutz und Wirtschaftlichkeit zusammen?“ technologieoffen.
Herr Kollege Jung, es gibt eine Reihe von weiteren Wünschen nach Zwischenfragen aus der AfD-Fraktion.
Ich frage Sie, ob Sie noch eine weitere Zwischenfrage zulassen, und zwar vom Kollegen Hollnagel.
Ich würde eine Frage noch zulassen.
Eine noch. Weitere Zwischenfragen lasse ich dann nicht zu, weil wir sonst völlig aus dem Zeitplan kommen. – Bitte, Herr Kollege Hollnagel.
Herr Präsident! Vielen Dank für das Wort. – Herr Kollege Jung, ich habe eine ganz einfache Frage:
Wie viel kostet uns das Klimapaket auf der einen Seite, und wie viel bringt es an Effekt an nicht erhöhter Temperatur im Weltmaßstab? Wie groß ist der Effekt?
Wir werden mit diesem Klimapaket unserer Verantwortung, die wir für den Klimaschutz haben, gerecht. Weil Sie fragen: „Was ist die Auswirkung, die deutsche Maßnahmen auf das Weltklima haben?“, will ich einfach feststellen, dass wir doppelt so viel CO
Um Ihre Frage konkret zu beantworten: Wir werden es so umsetzen, dass es sozialverträglich geschieht. Unsere Antwort ist: konsequenter Klimaschutz auf der einen Seite, sozialverträglich und wirtschaftlich vernünftig auf der anderen Seite. So werden wir es tun, und deshalb werden wir die Menschen mitnehmen. – Herzlichen Dank.
Ich komme damit zum Schluss. Wir machen heute einen entscheidenden Schritt auf dem Weg, Klimaschutz konsequent umzusetzen, das Pariser Abkommen in Deutschland zu implementieren. Auf diesem Weg werden wir weitergehen.
Herzlichen Dank.
Jetzt erteile ich das Wort dem Kollegen Dr. Lukas Köhler, FDP.
