Sehr geehrter Herr Präsident! Liebe Kolleginnen und Kollegen! Wenn ich mir das Eigenlob in dieser Debatte von den Kolleginnen und Kollegen von Union und SPD anhöre, dann zeigt mir das: Sie haben beim Thema Klimaschutz zu wesentlichen Teilen der Gesellschaft und zur Realität den Kontakt verloren.
Viele der Maßnahmen, die Sie hier beschließen, die Sie in Ihren Ministerien erarbeiten, sind im besten Falle ungenügend, im schlechtesten Falle sogar kontraproduktiv. Bei dem hier angekündigten Klimajahr kann man nur als Fazit ziehen: Sie sind an der Menschheitsaufgabe Klimaschutz gescheitert.
Mit den Maßnahmen werden Sie Ihre selbstgesetzten Klimaziele nicht erreichen, geschweige das Pariser Klimaschutzabkommen einhalten.
Lassen Sie uns die Maßnahmen einmal konkret anschauen: Beim CO
Herr Kollege Hofreiter, gestatten Sie eine Zwischenfrage des Kollegen Rosemann aus der SPD?
Ja, warum net?
