nicht völlig einer Meinung sind, dass wir uns in Diskussionen befinden und dass wir bei der Frage der Anpassung des Tarifverlaufs – über die kalte Progression hinaus – nicht vorankommen, weil wir beim Spitzensteuersatz, wie in meiner Rede zum vorherigen Tagesordnungspunkt schon angedeutet, anderer Auffassung sind. Trotzdem bleibt es dabei: Die Bereinigung des Mittelstandsbauchs ist zwingend geboten.
Die Position des Koalitionspartners ist klar: Sie wollen eine Erhöhung des Spitzensteuersatzes. Wir wollen das nicht, weil wir glauben, dass das leistungsungerecht ist, und weil wir glauben, dass das der Wirtschaft, dem Mittelstand und der Leistungsbereitschaft in diesem Land insgesamt schaden würde. Deswegen sage ich: Wir bleiben koalitionstreu. Auch wenn es uns schwerfällt, diskutieren wir dieses Thema selbstverständlich weiter.
Drei Dinge zum Schluss:
Oberste Priorität hat für uns die Abschaffung des Solidaritätszuschlags.
Das ist eine große Aufgabe. Die gehen wir jetzt an, wie vorhin schon gesagt.
In einem zweiten Schritt müssen wird dann schauen, was für haushalterische Möglichkeiten wir haben, um eine Reduzierung des Mittelstandsbuckels anzugehen.
Die Vereinbarungen, die wir im Koalitionsvertrag getroffen haben, sind einzuhalten. Das bedeutet aber nicht, dass wir nicht weiter versuchen werden, mit unserem Koalitionspartner an weiteren vernünftigen Lösungen zu arbeiten. Deswegen sage ich: Auch wenn der Antrag der FDP grundsätzlich in die richtige Richtung weist, können wir als Koalitionär diesem Antrag heute nicht zustimmen.
Thomas Kemmerich, FDP, hat als nächster Redner das Wort.
