Herr Kollege Straubinger, ich weiß, dass Sie ein großer Freund der Tradition sind, und ich versuche, dem auch Rechnung zu tragen.
Das sieht man.
Ist Ihnen denn nicht aufgefallen, dass es Unterschiede gibt zu der Zeit, als wir beide jung waren,
als die Bienen noch überall gesummt haben, als die Schmetterlinge noch geflogen sind, als auf den Wiesen noch ein einziges Summen zu hören war? Ist Ihnen nicht der Gedanke gekommen, es könnte vielleicht an bestimmten Mitteln liegen, die zum sogenannten Pflanzenschutz verwendet werden, dass dies heute anders ist? Welche Erklärung haben Sie denn für den dramatischen Verlust unserer Lebensqualität und der Lebensqualität der Insekten? Ich weiß, dass Ihnen das genauso am Herzen liegt wie mir. Welche Erklärung haben Sie dafür?
Es ist wahr, dass mir die Bienen sehr am Herzen liegen. Vor allen Dingen sind Sie offensichtlich einer Fehlinformation aufgesessen: Die Anzahl der Bienenvölker – das ist entscheidend – hat in den letzten zehn Jahren in Deutschland erheblich zugenommen.
Das war auch die Falschbehauptung beim Volksbegehren in Bayern, dass die Bienen gefährdet seien. Im Gegenteil: Den Bienen ging es noch nie so gut wie heute. Lieber Herr Kollege, wir können uns darüber bei einem Bier austauschen, dann können wir die einzelnen Bienen durchzählen. Das wird sicherlich eine interessante Unterhaltung werden, lieber Herr Kollege Dehm.
Interessant ist auch, dass es in den jüngsten Feststellungen des Wissenschaftlichen Beirats des Bundeslandwirtschaftsministeriums heißt: Die Landwirtschaft hat ihren Anteil daran; aber entgegen landläufiger Darstellungen können beispielsweise nur 13 Prozent der Veränderungen der Biodiversität der Insekten auf Pflanzenschutzmittel zurückgeführt werden. Herr Kollege, Beiratsmitglieder wie Herr Professor Taube oder Herr Professor Grethe stehen sicherlich nicht im Verdacht, Lobbyisten für die chemische Industrie zu sein und den Einfluss der Pflanzenschutzmittel schöngerechnet zu haben.
Ich glaube, das sind beredte Beispiele für richtigen und vor allen Dingen nach guter landwirtschaftlicher Praxis eingesetzten Pflanzenschutz;
dieser wird auch in Zukunft unabdingbar sein. In diesem Sinne werden wir diesen Antrag der AfD ablehnen, der letztendlich den Verbotsgeruch trägt, der auch bei anderen Parteien feststellbar ist.
Herzlichen Dank für die Aufmerksamkeit.
Das Wort hat der Abgeordnete Stephan Protschka für die AfD-Fraktion.
