Meine Damen und Herren, Ihr Antrag hat für große Heiterkeit bei meinen Kolleginnen und Kollegen gesorgt.
Herr Kollege Sichert, auch Sie dürfen mit der Anrede beginnen: „Herr Präsident!“
Haben wir das jetzt neu eingeführt, ja? Gut.
Das haben wir nicht neu eingeführt, das ist hier die Regel. Wenn Sie das nicht beachten, dann ist das einen Ordnungsruf wert.
Gut. – Mein Präsident! Ihr Antrag hat für große Heiterkeit bei meinen Kollegen und mir gesorgt. Was dieser Antrag bewirkt, kann man nämlich unter folgendem Slogan kurz zusammenfassen: Die Linken wollen auf Kosten der Arbeiterklasse den Bonzen mehr Geld geben.
Sie fordern, dass künftig alle, die in die Arbeitslosenversicherung eingezahlt haben, nach 30 Jahren Beitragsdauer unbegrenzt lange 58 Prozent des Nettoentgeldes bekommen. Das bedeutet: Topverdiener können in Zukunft mit Mitte 50 in Ruhestand gehen und bekommen weiterhin jährlich ein hohes Einkommen, nur mit dem Unterschied, dass sie dafür keine Leistung mehr erbringen müssen.
Die Geringverdiener müssen dann mit erhöhten Beiträgen zur Arbeitslosenversicherung für den süßen Lebensabend der Topverdiener bezahlen. Das ist eine reine Umverteilung von unten nach oben. Das ist nicht Marx, sondern Murks, was Sie hier vorschlagen.
