Wir haben 5 Millionen Ermittlungsverfahren im Jahr in der Bundesrepublik Deutschland laut PKS. Daraus werden 673 000 Gerichtsverfahren – 673 000! –; 13 000 davon landen beim Landgericht. Wenn in nur 3 Prozent der Fälle ein Befangenheitsantrag gestellt wird, handelt es sich um 400 Verfahren – 400 von 673 000 Gerichtsverfahren.
Sie setzen beim Befangenheitsrecht an, in der Hoffnung oder in der Vermutung, wie Sie hier äußern, Verfahren zu verbessern und zu beschleunigen. Von missbräuchlichen Anträgen ist hier noch gar nichts gesagt. Das Befangenheitsrecht betrifft nur 400 Verfahren überhaupt. Wie wollen Sie dort eine generelle Beschleunigung von Verfahren, gar eine Verbesserung der Sicherheit in Deutschland erreichen, meine Damen und Herren? Das ist doch offensichtlich unzutreffend.
Um es kurzzumachen: Sie verkürzen die Rechte von Beschuldigten. Sie erschweren Beweisantragsrechte, und Sie machen die Befangenheitsablehnung von Gerichten zum noch heftigeren Problem, als es das vorher schon war, meine Damen und Herren. Wirkliche Modernisierung könnten Sie ja machen, aber das tun Sie nicht. Da haben Sie Angst vor den, ich sage mal, interessierten Kreisen.
Sie könnten die Videoaufzeichnung von Hauptverhandlungen jetzt schon einführen; das könnten Sie machen. Das passiert übrigens schon in 20 anderen Ländern der Europäischen Union, ohne dass dort die Rechtspflege zusammenbricht. Wozu wollen Sie dann noch eine Expertengruppe einsetzen, die prüft, ob man das machen sollte oder nicht? Was erwarten Sie sich dort für einen Erkenntnisgewinn? Gar keinen. Das ist nichts weiter als das Sich-hinterm-Baum-Verstecken vor den Richtern, die dort Kontrollverlust für die eigene Verfahrensgestaltung wittern. Aber solche Kontrolle ist aus unserer Sicht in der Rechtsmittelinstanz durchaus sinnvoll.
Wenn Sie wirklich Modernisierung wollten, dann könnten Sie eins machen: eine elektronische Akte einführen, zumindest in den sogenannten UJs-Verfahren; das sind Verfahren ohne konkret benannte Beschuldigte. Das sind Anzeigen, die von der Polizei an die Staatsanwaltschaft weitergereicht und einfach eingestellt werden. Davon gibt es pro Jahr 3 321 000 Anzeigen. Da wird jedes Mal eine Akte angelegt, eine Papierakte. 3 321 000 Akten! Aber führen Sie die elektronische Akte ein? Nein, das lassen Sie bleiben. Stattdessen stürzen Sie sich auf nur vermutete 40, vielleicht 50 missbräuchliche Befangenheitsanträge im Rahmen von 673 000 Strafverfahren.
Ich sage Ihnen das ganz deutlich: Echte Modernisierung sieht ganz anders aus!
Für Die Linke hat das Wort der Kollege Niema Movassat.
