Liebe Bürger! Herr Präsident! Meine Damen und Herren! Ich wollte eigentlich mit meinen persönlichen Erlebnissen hier einsteigen. Ich möchte aber doch noch mal einen Satz zu Gregor Gysi sagen, der hier als Vertreter der Nachfolger der SED sitzt und eine wirklich schwache Rede gehalten hat,
der uns, der AfD, vorwirft, wir würden die Errichtung neuer Mauern befördern.
Erstens. Für die Mauertoten sind Sie verantwortlich und nicht wir.
Zweitens. Es macht einen Unterschied, ob man seine Bürger einsperrt oder ob man sagt: Wir wollen kontrollieren, wen wir in das Land hereinlassen.
Der 9. November, meine Damen und Herren, ist für uns ein bewegender Tag. Für uns junge Ossis war er damals wirklich ein prägender Tag.
Zwei Dinge haben uns in diesen Tagen wirklich stark bewegt:
Erstens. Es war die Wiedergewinnung unserer Nation, es war ja die vorweggenommene Wiedervereinigung – das kann man wirklich sagen –: der 9. November, dieser glückliche Tag.
Die SPD hat damals noch in ihren Statuten das Ziel der Wiedervereinigung herausstreichen wollen. Das muss man heute auch noch mal sagen.
Diejenigen, die sich heute hierhinstellen und die große Einheit loben, haben damals das Ziel herausstreichen wollen. Aber wir Ostdeutsche haben uns sehr gefreut, dass wir endlich wieder zusammenkamen in Ost und West und dass wir wieder zusammenwachsen konnten. Wir freuen uns noch heute darüber.
Zweitens. Dieser 9. November war die Wiedergewinnung der Freiheit. Mir klingt immer noch ein älterer Herr von der Bornholmer Brücke im Ohr, der damals gesagt hat: Det is unsere Stunde, det is die Stunde der Freiheit. – Genauso haben wir das im Osten empfunden. Es ging nicht nur um Reisefreiheit. Wir hatten auch keinen Bock mehr auf die ständige Bevormundung durch die SED-Herrscher, keinen Bock mehr auf Staatsbürgerkunde und all den Sozialistenquark.
Aber was ist daraus heute geworden? 30 Jahre nach unserer Friedlichen Revolution erleben wir wieder den Geist der Unfreiheit.
Ja, zum Glück kommt heute niemand in den Knast, wenn er seine Meinung sagt.
Aber die Stigmatisierung, die Diffamierung, das Mobbing muss man heute schon wieder ertragen, und mittlerweile sogar körperliche Angriffe. Das versteht wirklich keiner, der 1989 dabei war.
Wir haben damals gelernt, wie toll es ist, wenn man offen und frei heraus seine Argumente austauschen kann. Heute gewinnt schon wieder der, der die Moralkeule am lautesten schwingen kann. Davon haben wir wirklich die Nase gestrichen voll. Deswegen werden wir nicht zulassen, dass wir wieder in eine solche bleierne Zeit zurückfallen.
Es ist doch so, wir erleben es auch in diesem Hause: Wer die Masseneinwanderung kritisiert, der ist ein Ausländerfeind.
