Warum ist das so? Die USA wollen Unternehmen sanktionieren, die am Bau beteiligt sind. Warum ist das so? Weil die USA einfach in Wildwestmanier versuchen, hier Wirtschaftspolitik zu betreiben, und eben ihr schlechteres Flüssiggas bei uns loswerden wollen. Die EU ist leider so dumm und macht da mit.
Ausfluss dessen ist dann eben, dass sich die EU und die USA geeinigt haben, dass wir mehr Flüssiggas aus den USA beziehen, das teurer ist, das unsicherer ist und das durchaus auch dreckiger sein kann, wenn es sich um verflüssigtes Fracking-Gas handelt. Die Folge dieser Gasrichtlinie mit den Auflagen, die jetzt auf uns zukommen und die vorher gar nicht da gewesen sind, ist, dass die Gasversorgung teurer wird.
Die Folge ist auch, dass unsere Gasversorgung jetzt durchaus eingeschränkt werden kann. Wir sehen das am Beispiel von OPAL, wie die Nutzung der Gasleitungen innerhalb der Europäischen Union für Nord-Stream-Gas behindert worden ist. Damit ist klar, dass eine gesicherte Gasversorgung, so wie wir es kennen, schon nicht mehr zu 100 Prozent gewährleistet werden kann. Das ist nicht in unserem Interesse, auch nicht im Interesse Europas. Deswegen lehnen wir das ab.
Nebenbei bemerkt: Nord-Stream-2-Gas hat auch einen besseren CO
Wenn die Bundesregierung dieses Projekt nun behindert, kann es mit ihrem Postulat, dass CO
Vielen Dank. – Bevor wir in der Debatte fortfahren, möchte ich das Ergebnis der namentlichen Schlussabstimmung über den Entwurf eines Zweiten Gesetzes zur Änderung des Direktzahlungen-Durchführungsgesetzes in den genannten Drucksachen verkünden, das die Schriftführerinnen und Schriftführer ermittelt haben. Es wurden 631 Stimmkarten abgegeben. Mit Ja haben gestimmt 358, mit Nein haben gestimmt 212, Enthaltungen 61. Damit ist der Gesetzentwurf angenommen.
Wir fahren in der Debatte fort. Nächster Redner ist für die Fraktion der SPD der Kollege Timon Gremmels.
