Ich möchte Sie noch mal daran erinnern, dass es die Landwirtinnen und Landwirte sind, die uns tagtäglich mit Essen versorgen. Also räumen Sie endlich der Landwirtschaft nicht nur mündlich, sondern tatsächlich im Parlament den Stellenwert ein, der ihr gebührt!
Die Erhöhung der Umschichtung bedeutet für den durchschnittlichen landwirtschaftlichen Betrieb in meiner Heimat 250 Euro. Das mag wohl nicht viel Geld sein, aber es hat eine gewaltige Wirkung für die Landwirtinnen und Landwirte, weil es im Endeffekt eine Einkommenskürzung ist. Und das nehmen Sie einfach so billigend in Kauf.
Statt immer mehr Auflagen, Bürokratie und Umverteilung brauchen wir endlich Lebensmittelpreise auf einem akzeptablen Niveau. Das hat etwas mit Wertschätzung zu tun. Das sollte auch in Ihrem Interesse sein, aber daran mangelt es aktuell akut.
Mit dem Agrarpaket stärken Sie sicherlich nicht die Wettbewerbsfähigkeit. Ganz im Gegenteil: Sie lähmen die Investitionsfreudigkeit, Sie zerstören ideologiegetrieben und mutwillig den ältesten Beruf der Welt, und Sie verhöhnen die Bauern und Bäuerinnen, die tagtäglich unsere Republik mit Lebensmitteln versorgen.
Ergänzend kommt dann noch dazu, dass Sie Umweltprobleme wie Nitrat beispielsweise auf Kosten der Alterssicherung lösen wollen. Jetzt hört es tatsächlich auf. Das ist eine bodenlose Frechheit, was Sie da machen: Schuldzuweisungen auf Kosten der Landwirtschaft!
Grüner Ökopopulismus, verpflichtende Anteile an Ökolandbau, immer mehr Stilllegungsflächen und generelle Pflanzenschutzverbote nützen gar nichts, meine Damen und Herren. Deshalb appelliere ich an Sie: Geben Sie neuen Technologien eine Chance! Geben Sie der Digitalisierung eine Chance! Und geben Sie bitte den Landwirtinnen und Landwirten die Chance, mitzureden und mitzubestimmen! Nur miteinander können wir den Weg in eine zukunftsfähige und wettbewerbsfähige Landwirtschaft in Deutschland ermöglichen.
Danke schön.
Vielen Dank. – Als Nächste spricht für die Fraktion Die Linke die Kollegin Dr. Kirsten Tackmann.
