Frau Präsidentin! Meine sehr geehrten Damen und Herren! Ich stehe hier, um für die AfD die Alarmglocke in diesem Land zu schlagen.
Was passiert hier? In einer verkürzten, 27-minütigen Debatte wird massiv an den Freiheitsrechten in diesem Land gesägt.
Die Geldwäscherichtlinie, die vom Europäischen Parlament und vom Europäischen Rat vorgegeben wurde, biegt links ab. Europa biegt links ab. Deutschland zahlt, und Deutschland folgt in den Sozialismus.
Was passiert hier? Was wollen Sie? Sie wollen die Vollkontrolle des Bürgers. Sie stellen den ehrlichen deutschen Bürger unter Generalverdacht. Sie haben bereits das Bankgeheimnis abgeschafft, und Sie arbeiten an der Eindämmung des Bargeldes. Das wollen wir als AfD nicht.
Was will diese Richtlinie aus Brüssel? Sie schreibt vor, dass Edelmetallkäufe anonym nur noch bis 2 000 Euro erfolgen dürfen, nachdem die Grenze schon von 15 000 Euro auf 10 000 Euro abgesenkt wurde.
Sie verpflichtet Steuerberater, Lohnsteuerhilfevereine, Makler, Kunsthändler, sonstige Intermediäre zu Verdachtsmeldungen, wenn sie von Geldwäsche ausgehen. Das fördert ein Denunziantentum in diesem Land, was wir nicht gutheißen können.
Die anonyme Bargeldnutzung soll auf 10 000 Euro abgesenkt werden. Es soll ein Bankkontenregister eingeführt werden. Die Überwachung der Zahlungsströme und die Überwachung des Konsumverhaltens sind davon nur noch ein My entfernt. Das ist keine Terrorbekämpfung, das ist Drangsalierung, Bespitzelung und Überwachung unserer Bürger. Meine Damen und Herren, das ist mit uns nicht zu machen.
