Herr Präsident! Meine Damen und Herren! Schlechte Regierungspolitik bekämpft Symptome, anstatt die Ursachen eines Missstandes zu beheben. Ganz schlechte Regierungspolitik ist es, wenn der Missstand durch die Symptombekämpfung sogar noch verschärft wird. Genau das tun Sie mit Ihrer Bekämpfung sogenannter Hassrede, werte Regierungsparteien, Sie schüren erst richtig den Hass und heizen den Zorn an, für den Sie und Ihre Politik verantwortlich sind.
Damit wir uns klar verstehen: Ich spreche nicht von Beleidigungen, Verleumdungen, üblicher Nachrede oder Volksverhetzung,
die nach unserem Strafgesetzbuch schon längst strafbar sind. Ich spreche noch weniger von dem Anschlag in Halle oder dem Mordfall Lübcke, die Sie als „Hassverbrechen“ bezeichnen; abscheuliche Verbrechen, die verfolgt und hart bestraft werden müssen.
In Ihren Initiativen gegen Hassrede und Hasskriminalität geht es aber um etwas ganz anderes. Sie instrumentalisieren und missbrauchen diese Fälle, um ein System der Unterdrückung der freien Rede,
der Zensur und der Angst in diesem Land zu installieren, um politisch Andersdenkende mundtot zu machen.
Interessanterweise spricht man ja immer nur von „rechter Hasskriminalität“ und rüstet zum „Kampf gegen rechts“, wenn es um dieses Thema geht.
Die wenigen schweren Straftaten halbirrer Extremisten greift man begierig auf, um die Gefahr des Rechtsextremismus maßlos aufzubauschen und in beispielloser Weise vor allem gegen unsere Rechtsstaatspartei, die AfD, zu hetzen.
Wenn kriminelle Linksextremisten regelmäßig Autos unbescholtener Bürger abfackeln oder sie in Hamburg und Leipzig ganze Straßenzüge verwüsten und Hunderte Polizisten verletzen, dann spricht man nicht von Hasskriminalität, sondern verharmlosend von „linken Chaoten“ oder „Aktivisten“.
Wenn Zugewanderte aus archaischen Kulturen
