Sehr geehrte Frau Präsidentin! Meine Damen und Herren! Wir debattieren hier über zwei dünne Seiten Antrag der AfD. Die erste Seite beschreibt lapidar die Probleme und Herausforderungen strukturschwacher Regionen. Ich sage Ihnen das als jemand, der auch aus einer strukturschwachen Region, dem Landkreis Helmstedt, kommt. Das, was Sie hier an Banalität auf der ersten Seite Ihres Antrags zusammengetragen haben, ist so etwas von überflüssig.
Ich sage Ihnen noch etwas. Wenn man Verantwortung für eine Region hat, dann schreibt man nicht irgendwelche oberflächlichen Dinge auf, sondern dann kämpft man dafür.
Aus dieser Motivation heraus haben wir es zum Beispiel geschafft, mit dem Strukturstärkungsgesetz 90 Millionen Euro in den Landkreis Helmstedt zu bringen. Das bringt einer Region, die mit dem Strukturwandel beschäftigt ist, mehr als zwei dünne Seiten Antrag.
Ich komme auf das Beispiel Kaiserslautern zurück; Herr Ulrich hat darüber gesprochen. Dazu sagt der Antrag der AfD nichts. Vielleicht sollten Sie sich das einfach einmal zum Vorbild nehmen. Sie wissen, wie der Satz endet: Wenn man keine Ahnung hat, dann …
Meine Damen und Herren der AfD, nehmen Sie sich das als Beispiel.
Auf der zweiten Seite stehen noch ein paar Phrasen. Das ist ein bisschen AfD-Bullshit-Bingo. Ich habe Ihre Textbausteine zu Flüchtlingen, Gleichstellung und Klima gesucht
– Habe ich nicht gefunden.
