Sehr geehrter Herr Präsident! Liebe Kolleginnen und Kollegen! Liebe Frau Bull-Bischoff, liebe Frau Stumpp, ich muss an dieser Stelle etwas vorwegschicken: Wir leben den Föderalismus, und wir dürfen nicht immer versuchen, ihn auszuhebeln, wenn es uns vielleicht gerade passt.
In erster Linie sind die Länder für Bildung zuständig.
Die Länder sind auch dafür verantwortlich, dass die Kommunen entsprechend ausgestattet sind, damit sie ihre Aufgaben auch wahrnehmen können.
Darüber hinaus möchte ich Ihnen folgende Gedanken darlegen: Immer mehr Menschen in Deutschland sind leider für populistische Parolen empfänglich. Das kann man so im Raum stehen lassen; denn es ist natürlich nicht aus der Luft gegriffen. Vielmehr macht das die Shell-Jugendstudie deutlich. Die Erhebung, die seit 1953 durchgeführt wird, zeigt, auf welche Weise junge Menschen mit Herausforderungen umgehen, welche Verhaltensweisen, Einstellungen und Mentalitäten sie herausbilden. Wir haben hierbei eine gesamtgesellschaftliche Verantwortung; das wird ganz deutlich.
Ich zitiere aus den Kernergebnissen der Shell-Jugendstudie aus dem Jahr 2019:
In der Shell-Jugendstudie wurden die Jugendlichen auch zu ihrer Position zu bestimmten populistischen Aussagen befragt.
Wir alle hier merken, dass es wichtig ist, sich damit auseinanderzusetzen,
