Sehr geehrter Herr Präsident! Liebe Kolleginnen und Kollegen! Klimaschutz ist eine, wenn nicht gar die Herausforderung unserer Zeit. Klimaschutz ist zu wichtig, um dabei Zeit und auch Geld zu verschwenden. Umso wichtiger wäre es doch, jetzt mutig voranzuschreiten. Umso wichtiger wäre es doch, jetzt den effizientesten und kostengünstigsten Weg für einen funktionierenden Klimaschutz zu suchen. Umso wichtiger wäre es doch, jetzt zu zeigen, dass sich Klimaschutz und Wachstum nicht ausschließen. Umso wichtiger wäre es doch, jetzt alles dafür zu tun, dass die Menschen in unserem Land Klimaschutz als Chance verstehen und nicht als Bedrohung.
Liebe Kolleginnen und Kollegen von Union und SPD, was präsentieren Sie uns stattdessen heute? Eine ganze Fülle von Einzelmaßnahmen und einen nationalen Emissionshandel mit Festpreis, der, wenn wir ehrlich sind, nichts weiter ist als eine verkappte CO
Hierbei – das ist das Traurigste – nehmen Sie wissentlich einen erheblichen Kollateralschaden in Kauf. Denn weder das Klima noch die Bürger dieses Landes werden davon profitieren, meine sehr verehrten Damen und Herren. Im Gegenteil: Schon jetzt ist absehbar, dass Deutschland die Klimaschutzziele so kaum erreichen wird. Denn ein CO
Klimawochen, das macht mir eher Angst. Erklären Sie doch den Bürgern im Land einmal, was ein Sofortprogramm bedeutet. Was passiert denn, wenn der Verkehrsminister sein Ziel nicht erreicht? Kommt dann das Tempolimit auf Umwegen? Gibt es dann flächendeckende Fahrverbote? Dürfen dann an einigen Tagen nur noch Fahrzeuge mit geraden Zahlen auf den Nummernschildern fahren und an anderen nur welche mit ungeraden? Was soll das sein? Ich glaube, die Antwort darauf sind Sie den Bürgern in unserem Land schuldig.
Meine sehr verehrten Damen und Herren, erlauben Sie mir, ein Bild zu nutzen. Wer Fischbestände konsequent schützen will, führt doch keine Steuer auf Fisch oder, um in Ihrer Logik zu bleiben, einen Festpreis für Fisch ein. Er wird was tun? Er wird Fangquoten festsetzen.
Eine solche Quote, ein Limit, brauchen wir für CO
Wo das CO
– es freut mich, dass ich Sie erheitere; die Fische werden es mir danken –,
