Alles in allem ist es ein weiteres Gesetz, das aufgrund einer absurden, nicht bewiesenen Hypothese erlassen wird, das dazu dient, erstens das Volk noch effektiver auszuplündern und zweitens die Gesellschaft in eine ökosozialistische Diktatur zu transformieren.
Damit, liebe Genossen, verlassen Sie den Boden
der freiheitlich-demokratischen Grundordnung und werden dafür zur Verantwortung gezogen werden. Ich hoffe für Sie: nach Artikel 20 Absatz 2 und nicht nach Artikel 20 Absatz 4 Grundgesetz.
Vielen Dank.
Können Sie bitte den Button mitnehmen? – Danke schön.
Danke, Karsten Hilse. – Nächste Rednerin: Dr. Anja Weisgerber für die CDU/CSU-Fraktion.
