Nein, ich würde das gerne im Zusammenhang vortragen. Danach!
Herzstück des Klimapakets ist das Klimaschutzgesetz. Das ist genau darauf ausgelegt, jedes Jahr zu überprüfen und nachzusteuern. Das ist die Qualität, die wir jetzt haben. Klimaschutz ist jetzt Gesetz, und es wird jedes Jahr überprüft werden, ob wir die Ziele denn auch wirklich einhalten.
Das ist eine wirklich neue Weichenstellung, die wir hier vornehmen.
Meine sehr geehrten Damen und Herren, in diesem Haushalt legen wir eine wirklich gute Grundlage dafür, dass künftig jedes Jahr zum Jahr des Handelns im Klimaschutz wird. Ich danke noch mal den Mitgliedern des Haushaltsausschusses, den Obleuten und natürlich insbesondere den Berichterstatterinnen und Berichterstattern für den Haushalt für die gute Zusammenarbeit. Das waren sehr viele Stunden, aber ich finde, es hat sich wirklich gelohnt. Wir haben etwas Gutes vorangebracht.
Ich bitte um die Zustimmung zu diesem Einzelplan und sage noch mal ganz herzlich Danke schön.
Vielen Dank, Frau Ministerin. – Der nächste Redner ist für die AfD-Fraktion der Kollege Dr. Rainer Kraft.
