Herr Präsident! Guten Morgen, liebe Kolleginnen und Kollegen! Meine sehr verehrten Damen und Herren! Die Klimaziele, die wir uns gesetzt haben, gelten und werden umgesetzt. Natürlich bedarf es dazu der Mitwirkung aller. Das heißt, wir alle haben unseren Beitrag dazu zu leisten. Wenn ich „alle“ sage, meine ich nicht nur die fünf Sektoren, die wir haben – Industrie, Verkehr, Energieerzeugung, Landwirtschaft und Gebäude –, sondern auch, dass wir passgenaue Angebote für die Städte und den ländlichen Raum mit ihren unterschiedlichen Bedingungen machen müssen. Wir denken außerdem an die Menschen, die es nicht so dicke haben, Leute mit kleinem Geldbeutel. Auch denen wird ein Angebot gemacht, sich zu beteiligen; denn wir brauchen eine Breitenwirkung.
Eines hat die heutige Diskussion gezeigt: Es gibt zwei Gruppen – das spiegelt sich auch im Parlament wider –: Die einen sagen: Klimaschutz ist Quatsch, brauchen wir nicht, überhaupt nicht notwendig, und die andere Gruppe sagt: Alles viel zu wenig. Wir müssen sofort etwas tun. – Ich glaube, das, was wir uns mit der Klimaschutzgesetzgebung zum Ziel gesetzt haben, ist der richtige Weg. Den sollten wir weiter beschreiten. Daran werden wir arbeiten.
Meine sehr verehrten Damen und Herren, hierbei lassen wir uns von Prinzipien leiten. Wir wollen Anreize statt Verbote. Wir wollen fördern und maßvoll fordern. Wir geben Freiraum für Technologien, um der Innovation Vorschub zu leisten. Wir wollen, dass die Technologien den örtlichen Gegebenheiten angepasst werden. Das ist ein wesentlicher Punkt, um das Wirtschaftlichkeitsgebot einzuhalten. Wir wollen nicht, dass durch Klimaschutzmaßnahmen das Eigentum der Menschen gefährdet wird und sie dadurch in eine soziale Schieflage geraten.
Die soziale Fairness zwischen allen Beteiligten ist maßgeblich, um eine Breitenwirkung zu erreichen. Wir werden die entstehenden Belastungen abfedern – das gilt insbesondere für Leute mit einem kleinen Geldbeutel – und sehr darauf achten, dass die Wettbewerbsfähigkeit unserer Wirtschaft nicht gefährdet wird, indem den entstehenden Gefahren gegengesteuert wird.
Der Gebäudebereich schlägt beim CO
Neben der steuerlichen Förderung ist auch die Förderung durch das CO
Meine sehr verehrten Damen und Herren, steuerliche Förderung für die, für die es sich lohnt, CO
Liebe Kolleginnen und Kollegen, zur Ehrlichkeit gehört: Ja, Klimaschutz kostet Geld. Klimaschutz wird uns alle belasten. Diese Lasten müssen jedoch vertretbar sein. Und wenn diese vertretbar sind, sieht es auch jeder ein, und jeder wird mitwirken.
Es ist wichtig, beispielsweise zwischen Stadt und Land zu unterscheiden. Durch eine Erhöhung der Pendlerpauschale muss es für die Menschen, die zur Arbeit fahren müssen, eine entsprechende Entlastung geben. Auch beim Wohngeld werden wir sicherlich nachbessern und für die Mieterinnen und Mieter eine weitere Lösung finden. Und wir geben eine weitere Milliarde für eine Verbesserung des ÖPNV-Angebots sowohl in den Städten, aber auch im ländlichen Raum. Darüber hinaus werden wir die Frage von Einzelheizungen, die es vor allem im ländlichen Raum gibt, in Angriff nehmen, indem die Auswechslung von öl- oder gasbetriebenen Einzelheizungen hin zu klimafreundlichen Techniken mit bis zu 60 Prozent gefördert wird.
Meine sehr verehrten Damen und Herren, das ist ein Strauß von Maßnahmen, den wir auf den Weg bringen werden. Davon werden wir uns nicht beirren lassen.
Lassen Sie mich kurz einen Blick nach vorne werfen auf die Frage der Nachhaltigkeit im Gebäudebereich. CO
Ich komme zum Schluss. Durch Transparenz und dadurch, dass wir nicht überfordern, Anreize geben, breit informieren und beraten, werden wir eine Breitenwirkung erzeugen. Dafür steht diese Koalition. Wer nichts machen will, der setzt unsere Schöpfung aufs Spiel, und wer überzieht, setzt den gesamten Prozess aufs Spiel.
Danke schön.
Jetzt erteile ich dem Kollegen Marco Bülow das Wort.
