Guten Morgen allerseits! Gemäß Titel soll dieser Antrag von Union, SPD und Grünen das deutsche Auslandsschulwesen stärken. Das wird diesem wohlfeilen Antrag allerdings nicht gelingen.
Auslandsschulen sind in der Tat sehr wichtig. Sie tragen zum Verständnis unserer kulturellen Werte, unserer Traditionen und unserer Geschichte bei. Deswegen sollten wir sie fördern und sie auch finanziell stärken. Aber davon ist in Ihrem Antrag keine Rede.
Als Lehrer habe ich früher immer meinen Schülern beigebracht, sie sollen den ersten Satz mit Bedacht wählen, weil er einen Text vorprägt. Schauen wir also, was die übergroße Koalition hier niedergelegt hat:
Der Deutsche Bundestag stellt fest: In einer Welt, die aus den Fugen geraten scheint, in der alte Ordnungen sich auflösen und Populismus und Nationalismus auch im Herzen Europas auf dem Vormarsch sind, kommt der Auswärtigen Kultur- und Bildungspolitik … eine wachsende Bedeutung zu, die Hoffnung macht und Wege aufzeigt.
Mal ehrlich, liebe Kollegen: Wollen Sie wirklich, dass der Deutsche Bundestag diesen geistigen Tiefflug feststellt?
Pädagogen würden hier von externer Kausalattribuierung sprechen.
