Frau Präsidentin! Liebe Kolleginnen und Kollegen! Heute Morgen stand die berufliche Bildung im Fokus; jetzt geht es mehr um die akademische. Für uns als Grüne im Bundestag ist entscheidend: Wir wollen Chancen und Wahlfreiheit für alle in der jungen Generation.
Hundertausende haben in diesen Tagen nun ihr Studium aufgenommen, und damit beginnt für sie eine sehr spannende Lebensphase. Da wünschen wir viel Neugierde und auch viel Erfolg auf diesem Weg.
Doch anstatt voll ins Studium und in den Unialltag hineinzustarten, ist es so, dass Tausende Studis auf Wartelisten für Wohnheimplätze stehen und keine bezahlbare Bleibe finden. In manchen Hochschulstädten gibt es Notunterkünfte für Erstis. Was sind das eigentlich für Zustände in einem Land der Dichter und Denker? So geht das nicht.
Deswegen fordern wir eine bundesweite Offensive für studentisches Wohnen. Denn Kopf braucht eben Dach. – Warum ist das so?
Erstens. Wohnen wird für Studierende immer teurer. Für eine 30-Quadratmeter-Bude bezahlt man im Schnitt 403 Euro; in Stuttgart sind es 542 Euro, in München 717 Euro.
Für finanzarme Studis ist das eben nicht zu stemmen. Im BAföG gibt es pauschal maximal 325 Euro fürs Wohnen. Wir wollen deshalb eine regional gestaffelte und dynamisierte Wohnkostenpauschale im BAföG; die ist einfach gerechter.
Es gibt zweitens einen historischen Tiefststand bei Wohnheimplätzen. Nur noch 9,6 Prozent der Studis finden Platz in einem Wohnheim. Das ist aber nun mal die preisgünstigste Wohnform, die es nach dem Elternhaus gibt. Es entlastet die völlig überhitzten Wohnmärkte vor Ort. Es ist auch ein wunderbarer Integrationsort für internationale Studis und deshalb eine sehr gute Wohnform. Der Bedarf ist riesig; die Wartelisten für diese Wohnheimplätze sind lang. Allein in München, Frau Zeulner, sind 12 000 Studis auf dieser Warteliste.
Wir helfen auch gerne in Bayern ein Stück weit über ein Bund-Länder-Programm zum Bau von öffentlich finanzierten Wohnheimplätzen.
– Ja, das regt Sie auf; ich weiß. Aber 12 000 Studis auf den Wartelisten in München, das sollte Ihnen echt zu denken geben.
Übrigens: Mehr als die Hälfte der Plätze in Wohnheimen sind über Bund-Länder-Programme in den 70er- und 80er-Jahren entstanden und ab 1994 über Sanierungsprogramme fit gemacht worden.
