Sie von den Links-Grünen drücken mit aller Macht die planwirtschaftliche Energiewende durch, die zu diesen hohen Strompreisen führt.
Wind- und Sonnenstrom muss durch Kohle-, Gas- und Kernenergiestrom subventioniert werden; denn Wind- und Sonnenstrom ist um ein Vielfaches teurer als Strom aus konventioneller Stromerzeugung.
Und wer will den Anteil dieses teuren Stroms noch erhöhen? Richtig! Sie von den Links-Grünen wollen diesen teuren Anteil noch erhöhen.
An Wind- und Sonnenstrom verdienen Unternehmen und solche, die es sich leisten können. Die, die es sich nicht leisten können, sich eine Windenergieanlage zu bauen oder sich Photovoltaikanlagen aufs Dach zu packen, zahlen nämlich für die anderen mit in Form der EEG-Umlage. Das ist unsozial und zeigt noch mal, wofür Links-Grün steht, nämlich für die Umverteilung von Reich zu Arm. Das ist leider so.
Da hilft auch kein Geschwafel über Bürgerenergie oder sonstige kosmetische, kleinere Veränderungen weiter. So ist diese vorgegaukelte Anteilnahme an denjenigen, die diese Preise also nicht bezahlen können, schier geheuchelt.
Damit aber nicht genug. Sie, meine Damen und Herren von den Links-Grünen, sind auch mit dafür verantwortlich, dass wir preiswerte, zukunftsfähige, saubere und sichere Technologien, zum Beispiel auch die Kernenergie, nicht weiter verfolgen. Sie tragen eben auch eine Mitschuld daran, dass wir energiepolitisch und technologisch unseren Vorsprung an der Weltspitze verlieren.
Außerdem wollen Sie den Kohleausstieg. Der kostet uns 100 bis 150 Milliarden Euro. Diese Kosten kommen noch obendrauf. Also: Zum Strompreis kommen noch die Kosten des Kohleausstiegs. Der kostet uns noch obendrauf.
Das sind keine Erträge, das sind – um das noch mal klarzustellen – Kosten in Höhe von 100 bis 150 Milliarden Euro, die im Raum stehen. Sie wollen auch, dass sich die Produkte in Deutschland generell verteuern, mithilfe der CO
Also erzählen Sie hier bitte nichts von sozialer Politik. Dies glauben wir Ihnen nämlich nicht.
Oder erklären Sie es mir! Erklären Sie mir bitte, wenn Sie mit dafür verantwortlich sind, dass die Strompreise steigen, wie Sie dann die Geringverdiener gerade bei den Strompreisen entlasten wollen. Ja, natürlich, klar: Ich kann die Strompreise hochtreiben und dann noch von Verboten reden. Der Berliner Senat ist ja auch dabei, Verbote zu installieren, vorher aber die wirtschaftlichen Rahmenbedingungen zu schrotten. Aber das ist für uns keine Alternative.
Wir sagen ganz klar: Wir werden wieder eine bezahlbare Stromversorgung einführen.
In Bulgarien zum Beispiel kostet der Strom ein Drittel unseres Preises, also 10 Cent. Und das, was man in Bulgarien kann, das können wir auch hier in Deutschland. Da werden wir wieder hinkommen. Wir werden diese verantwortungslosen Experimente der Energiewende beenden. Wir werden wieder einen vernünftigen Energiemix hier in Deutschland haben: mit Kohle, mit Gas, mit laufzeitverlängerter Kernenergie natürlich und mit einem vertretbaren Maß an erneuerbaren Energien.
Wir werden den deutschen Sonderweg beenden und zu einer ausgewogenen und vernünftigen Energiepolitik zurückkehren, um Strom für alle wieder bezahlbar zu machen.
Vielen Dank.
Johann Saathoff, SPD, ist der nächste Redner.
