Es trifft nämlich nicht nur Superreiche, die Sie hier gerne an den Pranger stellen, es trifft 5 Millionen Menschen und Betriebe in unserem Land,
denen der Fiskus weiter jedes Jahr über 10 Milliarden Euro aus der Tasche ziehen möchte.
Ein Zehntel der Steuerzahler, das heute schon gut 50 Prozent der Steuerlast trägt, soll zukünftig noch stärker zur Kasse gebeten werden. Das spricht jedem Leistungsgedanken Hohn.
Es trifft die Fleißigen und Aufstiegsorientierten, den qualifizierten Arbeitnehmer, den Ingenieur, den Krankenhausarzt, den Handwerksmeister, den risikobereiten Selbstständigen und vor allem die mittelständischen Unternehmen, Personengesellschaften ebenso wie Kapitalgesellschaften und damit auch die Arbeitsplätze.
Ich frage: Wer soll dann noch investieren und neue Arbeitsplätze schaffen? Vor dem Hintergrund deutlich sinkender Wachstumsprognosen und einer nachlassenden Arbeitsmarktdynamik brauchen wir Entlastungssignale an die Wirtschaft. Wir benötigen Wettbewerbsfähigkeit. Wir brauchen Anreize, keine hohen Hürden, wenn wir Wachstum sichern wollen, wenn wir die Arbeitsplätze sichern wollen und wenn wir neue Investitionen und Arbeitsplätze schaffen wollen, meine Damen und Herren. Das ist allemal kostengünstiger und vernünftiger, als zu warten, bis uns eine Krise zu teuren Konjunkturprogrammen zwingt.
Das gilt für die Steuerpolitik insgesamt, über das enge Feld des Soli hinaus.
Herr Bundesfinanzminister, Ihre Argumentation, man könne den Soli nicht völlig abschaffen wegen der unterschiedlichen Verteilung von Vermögen, spricht allen mittelständischen Unternehmern und Betriebsinhabern Hohn.
Das sind die Leute, die in ihren Betrieb investiert haben, die Vermögen mit dem Betrieb geschaffen haben. Aber er ist gemeinwohlpflichtig mit den Arbeitsplätzen.
Das ist soziale Marktwirtschaft. Deswegen darf es nicht stattfinden, dass man die Leute an den Pranger stellt.
Ich denke, im Ziel sollten wir uns alle in diesem Hause einig sein: Der Solidaritätszuschlag kann nicht bis zum Sankt-Nimmerleins-Tag laufen, er muss auslaufen. Über den besten Weg und den Zeitpunkt für dieses Ziel müssen wir reden, müssen wir verhandeln. Das sind wir allen schuldig.
Deshalb begrüße ich es, dass ein Entwurf des Solirückführungsgesetzes zu einem so frühen Zeitpunkt vorliegt. Das schafft ausreichend Zeit, um die vielen Aspekte, die ich angesprochen habe, ausführlich zu beleuchten und nach verfassungsfesten und besseren Lösungen zu suchen. Dafür sollten wir uns im Interesse der Bürgerinnen und Bürger unseres Landes die nötige Zeit nehmen. Es ist fehl am Platze, irgendwelche Leistungsträger immer wieder an den Pranger zu stellen, Ideologie in die Steuerpolitik hineinzubringen.
Es geht darum, für das Gemeinwohl, für Wachstum, für Beschäftigung in unserem Land zu arbeiten. Diese Ziele müssen wir verfolgen, und Erfolg gibt es hier nur mit einer Steuerentlastung.
Herzlichen Dank.
Nächster Redner ist der Kollege Dr. Florian Toncar, FDP.
