Ein zweiter konkreter Punkt zur Stärkung der Zivilgesellschaft. Was wir dringend anpacken müssen, ist das Thema Gemeinnützigkeit. In dieser Woche wurde Campact die Gemeinnützigkeit entzogen.
Nach Attac ist das die zweite große Organisation, die dadurch enorme finanzielle Schwierigkeiten bekommen wird. Das ist ein fatales Zeichen – zu einer Zeit, in der wir weit mehr statt weniger Engagement und politische Bildung brauchen. Konkret schreibt Campact auf einer Internetseite:
Kontroverse politische Debatten sind das Lebenselixier einer lebendigen Demokratie.
Diese Debatten leben davon, dass alle gesellschaftlichen Gruppen ihren Argumenten Gehör verschaffen können.
Insofern brauchen wir dringend eine gesetzliche Änderung, damit Organisationen, die sich für Frieden, für Klimaschutz, für soziale Gerechtigkeit und für die Einhaltung von Menschenrechten starkmachen, ihre Arbeit leisten können. Wir müssen ihnen die Gemeinnützigkeit garantieren.
Noch ein letzter Punkt, weil das schon angesprochen wurde: Natürlich müssen wir auch mehr für die Anerkennung des freiwilligen Engagements machen, zum Beispiel beim Freiwilligendienst. Lassen Sie uns gemeinsam für freie Fahrt im Nahverkehr und in den Zügen der Deutschen Bahn für Freiwilligendienstleistende und ehrenamtlich Engagierte bei der Feuerwehr, beim THW und bei den Rettungsdiensten kämpfen! Das wäre ein Anfang. Das ist sozial gerecht, ökologisch und eine Anerkennung des unschätzbar wertvollen Engagements von Freiwilligen.
Natürlich muss die Bundesregierung einen angemessenen finanziellen Ausgleich an die Deutsche Bahn und an die Verkehrsverbünde zahlen.
Danke schön.
Das Wort hat die Kollegin Kordula Schulz-Asche für die Fraktion Bündnis 90/Die Grünen.
