dass 39 Prozent der Jugendlichen eher weltoffen orientiert sind, während 33 Prozent eher populistisch orientiert sind. 28 Prozent sind nicht eindeutig positioniert.
Das macht zwar deutlich, wo die Sorgen und Probleme liegen, zeigt aber auch, dass sich der überwiegende Teil der Jugendlichen weltoffen orientiert.
Nach wie vor besteht ein starker Zusammenhang zwischen Bildungserfolg und sozialer Herkunft; auch das macht die Studie noch einmal deutlich. Genau dort setzen wir an: Wir wollen die politische und zivilgesellschaftliche Bildung in Elternhäusern, Schulen und im Ehrenamt stärken. Nur so ermöglichen wir es den Kindern und Jugendlichen, kritisches Denken und Hinterfragen von vermeintlichen Fakten zu erlernen. Nur so machen wir sie möglichst immun gegen Verschwörungstheorien. Das sollte unsere Aufgabe sein; darauf sollten wir unser Augenmerk richten.
Soziale Herkunft und Lebensort haben allerdings noch immer einen zu großen Einfluss auf den Bildungserfolg. Das wird auch gar nicht geleugnet, aber es geht darum, die Verantwortung auch dort zu suchen, wo sie liegt. Wir machen mit dem, was wir heute zum Beschluss vorlegen, einmal mehr deutlich, dass es uns als Bund darum geht, den Föderalismus zu leben, aber an einigen Stellen auch Verantwortung zu übernehmen, indem wir sagen: Ja, wir gehen Hand in Hand gemeinsam mit den Ländern.
Das, was wir Ihnen heute zum Beschluss vorlegen, soll sich an der Realität orientieren. Wir haben die Unterstützung für begabte Kinder und Jugendliche auf den Weg gebracht. Jetzt ist es unsere Aufgabe, den Kindern und Jugendlichen zu helfen, die insbesondere in den Schulen ihre Bildung erfahren, in denen wir Nachholbedarf sehen. Leider arbeiten dort an verschiedenen Stellen noch immer Quer- und Seiteneinsteiger, die nicht unbedingt die entsprechende Qualifikation haben. Auch darauf muss ein Augenmerk gelegt werden, aber bitte schön von den Ländern.
Das föderale System mit seiner Initiative „Schule macht stark“ soll Abhilfe schaffen. Der Bund bringt sich über einen Zeitraum von zehn Jahren mit insgesamt 125 Millionen Euro ein, um dieses gemeinsame Aufgabengebiet zu bewältigen. Es ist ein nachhaltiges Programm; denn es ist doch ganz bemerkenswert, wie viel Geld hier über zehn Jahre in die Hand genommen wird, und zwar zugunsten der Bildung und zugunsten der Länder, um dort Unterstützung zu leisten. Das heißt aber auch, dass die Länder das Geld auch im Bewusstsein ihrer Verantwortung verwenden müssen.
Wir schließen an vorhandene Programme an, die in den 16 Bundesländern bereits existieren. Wir wollen helfen, den manchmal hier und da vorhandenen Flickenteppich in der Bildungspolitik damit ein bisschen einheitlicher zu gestalten.
Liebe Frau Völlers von der SPD, herzlichen Dank für unsere tolle Zusammenarbeit. Ich glaube, wir freuen uns alle über den baldigen Start und über die Auswahl der 200 Schulen für die Modellphase. Kein Kind und kein Jugendlicher darf aufgrund seiner oder ihrer Herkunft, des Wohnortes oder sozialer Rahmenbedingungen strukturell benachteiligt werden. Wir handeln und beschließen heute „Schule macht stark“.
Herzlichen Dank.
Vielen Dank, Frau Kollegin Dr. Tiemann. – Letzter Redner zu diesem Tagesordnungspunkt ist der Kollege Oliver Kaczmarek, SPD-Fraktion.
