Herr Präsident! Liebe Kolleginnen und Kollegen! Am Ende einer so lebhaften Debatte und gerade nach René Röspel kann man zusammenfassen: Es ist eine ganz klassische Debatte, liebe Damen und Herren auf der Zuschauertribüne, an den Fernsehapparaten. Die Linke propagiert natürlich den Bildungsnotstand in Deutschland, dabei ist sie selber in Verantwortung. Ihr Minister war Präsident der KMK, und seitdem Sie in Thüringen Verantwortung tragen, sind die Thüringer Schulen bei den Bildungsvergleichen um drei Plätze zurückgefallen.
Die Grünen werfen uns Schönreden vor. Dass Sie die Batteriezellenforschungsfabrik noch einmal ausgraben, finde ich erstaunlich. Mehr Transparenz geht da nicht.
Besuchen Sie den Forschungsausschuss. Dort gab es die Fakten – das waren eben Fakten, die man zur Kenntnis nehmen muss –, aber eben nichts zum Skandalisieren.
Herr Kollege, gestatten Sie eine Zwischenfrage?
Nein, wir führen erst einmal aus, und dann schauen wir weiter.
– So ist das, natürlich.
