Sehr geehrter Herr Präsident! Meine Kolleginnen und Kollegen! Als wir 2016 das Kassengesetz beschlossen haben, war das kein Selbstzweck. Es ist so – das ist heute schon mehrfach angesprochen worden –, dass Bargeldgeschäfte betrugsanfällig sind. Das ist kein Generalverdacht, aber eine Tatsache, die wir immer wieder feststellen müssen. Es gab Hochrechnungen des Bundesrechnungshofs dazu, der von 8 bis 10 Milliarden Euro sprach. Diese Summe haben wir ein bisschen angezweifelt; aber selbst die Hälfte wäre Anlass genug gewesen, zu handeln.
Wir haben damals verschiedene Problembereiche im Ausschuss gesehen und beraten: Einsatz von Manipulationssoftware, nichtdokumentierte Stornierungen, überhaupt die Nichterfassung von Einnahmen, nichtdokumentierte Änderungen mittels elektronischer Programme oder die Führung einer Zweitkasse. Das war Auftrag genug, etwas zu tun. Wir haben in dem Gesetz drei Punkte geregelt:
Zum einen ist da die technische Sicherheitseinrichtung in einem elektronischen Aufzeichnungssystem. Der Kollege Bayaz hat völlig recht: Da müssen wir jetzt ein bisschen Gas geben; denn wir müssen die Kassen haben, damit sie auch zum Einsatz kommen.
Ein zweiter Punkt, der nicht zu unterschätzen ist, ist die Einführung einer sogenannten Kassennachschau, die mittlerweile durch die Finanzverwaltungen schon durchgeführt wird. Die Ergebnisse geben uns recht: Wir haben in diesem Bereich einiges zu tun.
Natürlich haben wir auch die Sanktionierung von Verstößen geregelt.
Wichtig ist mir, zu betonen, dass wir auf Grundlage eines Gesetzentwurfs der damaligen Bundesregierung diskutiert haben. Es gab verschiedene Ansinnen des Bundesrates, aber auch unserer Kollegen aus der SPD-Bundestagsfraktion. Sie hatten überlegt, eine grundsätzliche Registrierkassenpflicht einzuführen.
Ich halte es nach wie vor für einen Riesenerfolg, dass wir das nicht gemacht haben. Man stelle sich vor, beim Oktoberfest würden ständig Belege ausgegeben werden, in jedem Festzelt.
Ich glaube, bei jedem Vereinsfest hätten wir ein Problem gehabt. Von daher ist es klug, dass es die offene Ladenkasse teilweise noch geben kann, meine Damen und Herren.
Das Risiko, eine offene Ladenkasse zu führen, ist – das kann ich Ihnen sagen – immens groß, weil diejenigen, die keine Kasse anmelden, natürlich ganz besonders in den Fokus der Finanzverwaltung rücken und einer näheren Prüfung unterzogen werden.
Wir haben verhindern können, dass es eine Annahme- und Belegmitnahmepflicht gibt, wie wir das aus Italien und Österreich kennen, wo man als Kunde gezwungen wird, den Beleg mitzunehmen.
Ein weiterer Punkt war die Belegausgabepflicht. Der ursprüngliche Gesetzentwurf, von Bundesfinanzminister Wolfgang Schäuble vorgelegt, enthielt die, wie ich finde, kluge Lösung einer Herausgabe auf Verlangen, also keine generelle Belegausgabepflicht. Das war mit dem Bundesrat nicht zu machen. Daran waren übrigens auch manche Länder beteiligt, in denen die FDP an der Regierung beteiligt ist; die wollten das unbedingt nicht. Das gehört auch zur Wahrheit.
Wir haben dann gesagt: Okay, wir stimmen der Belegausgabepflicht zu, wenn es eine Ausnahme gibt, die wir aus der Abgabenordnung schon kennen. Sie müssen wissen: Sie haben als Kaufmann eine sogenannte Einzelaufzeichnungspflicht. Wenn Sie viele unbekannte Kunden haben und Waren vertreiben, haben Sie natürlich ein Riesenproblem, wenn Sie eine Einzelaufzeichnung durchführen müssen. Daher haben wir schon vorher in der Abgabenordnung die Regelung gehabt, dass diese grundsätzlich davon ausgenommen werden. Das ist übrigens alte Rechtsprechung des Bundesfinanzhofs von 1966. Das haben wir uns zu eigen gemacht. Das haben wir in § 146a Absatz 2 Satz 2 Abgabenordnung geregelt. Es ist der Wille des Gesetzgebers gewesen, dass die Ausnahmeregelung in diesen Fällen greift. Das sind übrigens nicht nur die Bäcker, Herr Dürr.
Wir haben da auch andere im Fokus. Ich finde es schade, dass Sie in Ihrem Gesetzentwurf nur auf die Bäcker Bezug nehmen.
Wenn, dann müsste man auch die anderen mitnehmen. Wir jedenfalls haben gesagt, diese Regelung würden wir gerne eins zu eins übernehmen. Wenn man ein Gesetz auslegt – das habe ich damals gelernt –, soll man auch den Willen des Gesetzgebers berücksichtigen. Ich kann nur zitieren aus der Debatte vom 15. Dezember 2016, in der der Kollege Feiler, der inzwischen aus den Reihen der Abgeordneten auf die Regierungsbank gewechselt ist, ausgeführt hat:
Der Bäcker von der Ecke muss also auch in Zukunft nicht für jedes 20-Cent-Brötchen
