Deutschland gibt fürs Soziale pro Kopf mehr aus als die verbliebenen sozialistischen Länder – Nordkorea, Kuba und China – zusammen.
Liebe Kollegen von der Union, Sie sollten sich einmal an Ludwig Erhard erinnern. Erhard hat den schönen Satz gesagt: „Je freier die Wirtschaft, umso sozialer ist sie auch.“
Meine Damen und Herren, in diesem Land geht es viel zu sehr um das Verteilen und zu wenig um das Erwirtschaften. Damit komme ich zu meinem zweiten Punkt. Das ist der Standort Deutschland. Wir müssen den Standort Deutschland wieder in den Fokus unseres Handelns rücken. Der Standort Deutschland fällt zurück. Wir sehen das beim Wachstum. Wir sehen das in der Exportindustrie, und wir sehen das in der Infrastruktur.
Die Politik dieser Regierung muss auf die Stärkung des Standorts Deutschland gerichtet sein. Tatsächlich beschäftigen Sie sich aber mit der Vergangenheit. Allein in der Amtszeit von Angela Merkel sind die Subventionen um 50 Prozent gestiegen. Die Rekordsteuereinnahmen aber sind das Ergebnis von harter Arbeit der Menschen in diesem Land. Diese Menschen zu entlasten, muss herausragendes Ziel sein. Wir haben gestern eigene Vorschläge vorgelegt, wie wir Bürger und Unternehmen in den nächsten fünf Jahren um insgesamt 200 Milliarden Euro entlasten wollen. Das ist unser Vorschlag.
Was uns allen Sorgen bereiten sollte, sind die Auswirkungen der Null- und Niedrigzinspolitik der EZB. Das ist mein dritter Punkt. Es mag für den Finanzminister schön sein, dass er heute 25 Milliarden Euro weniger Zinsen bezahlen muss als sein Vorgänger Oskar Lafontaine vor 20 Jahren. Doch die Schattenseite ist, dass die Sparer in diesem Land enteignet werden. Das sollte uns hier, in diesem Hohen Haus, große Sorgen bereiten.
Deshalb schlagen wir vor, die Vermögensbildung endlich attraktiver zu machen und die Förderung auch für Aktien, Aktienfonds und Mitarbeiterbeteiligung zu öffnen.
