Herr Vizepräsident! Meine Damen und Herren! Die Grünen fordern, die finanziellen Leistungen für Hartz-IV-Empfänger deutlich zu erhöhen und sämtliche Sanktionen abzuschaffen.
Solch sozialistischer Umverteilungswahnsinn war schon immer zum Scheitern verurteilt. Sozialismus ist kein politisches Konzept, sondern eine gesellschaftliche Seuche, die immer in Massenarmut und Elend endet.
Alles für alle funktioniert nämlich immer nur so lange, bis alles alle ist.
Ein Sozialstaat ist eine Vereinbarung auf Gegenseitigkeit, das hat der Kollege Zimmer gerade wunderbar dargelegt. Es gibt jene, die Sozialleistungen empfangen, und andere, die mit ihrer Arbeitsleistung überhaupt erst die Sozialleistungen ermöglichen. Beide Gruppen haben Rechte. Genauso wie die Bedürftigen ein Recht auf existenzsichernde Leistungen haben, haben die Steuerzahler ein Recht darauf, dass die Ausgaben auf das unbedingt notwendige Maß beschränkt werden.
Ein funktionierender Sozialstaat und soziale Gerechtigkeit bedeuten, dass jeder bestrebt ist, nach seinen Möglichkeiten seinen Teil zur Gesellschaft beizutragen. Wer dazu nicht bereit ist, den muss ein wehrhafter Sozialstaat mittels Sanktionen dazu zwingen. Alles andere ist asozial gegenüber den Steuerzahlern, die diesen Sozialstaat finanzieren.
Sie von den Grünen wollen immer nur den Sozialleistungsbeziehern die Rechte stärken und die Pflichten mindern, den Steuerzahlern hingegen bürden Sie damit immer mehr Pflichten und Belastungen auf. Sie sorgen dafür, dass es attraktiver wird, sich im Sozialstaat einzurichten und auf Kosten der Allgemeinheit zu leben.
Damit zerstören Sie die Leistungsbasis der Gesellschaft und die Zukunftsfähigkeit des Sozialstaates.
Ihr Antrag ist ein Schlag ins Gesicht der fleißigen Familien und Alleinerziehenden, die mehrere Jobs ausüben, um ihren Kindern ein gutes Vorbild zu sein, und trotzdem nur knapp über dem Existenzminimum leben. Diese Eltern, die ihren Kindern die deutschen Tugenden von Fleiß, Strebsamkeit und Bescheidenheit vorleben, haben höchsten Respekt verdient.
– Ich finde es etwas respektlos, dass hier ein grüner und ein linker Abgeordneter sich gerade über einen Zeitungsartikel freuen. Ist egal – Grüne und Linke halt.
