Das kann ich mir lebhaft vorstellen. Das Kritische sind aber wohl weniger Medienbeteiligungen als die Herkunft von Geldern und Krediten für Ihr politisches Wirken, meine Damen und Herren.
Dass Sie da keine Lust drauf haben, das kann ich schon durchaus nachvollziehen.
Auch die vorgeschlagene Änderung des Gesetzes gegen den unlauteren Wettbewerb, meine Damen und Herren, ist ein untaugliches Mittel; denn auch hiermit kann sich der Kunde nicht oder nicht richtig über Umfang oder Art und Weise einer Beteiligung bzw. den Einfluss informieren. Das ist sinnlos.
Das gilt erst recht für die vorgeschlagene Änderung im Wettbewerbsrecht – § 30 des Gesetzes gegen Wettbewerbsbeschränkungen –; das ist ein Fehlgriff. Wie soll das eingehalten werden, und wie soll die Weitergabe etwa von Agenturinhalten oder von gemischt erstellten bzw. von redaktionellen Netzwerken erstellten Inhalten überprüft werden? Auch das ist faktisch nicht möglich.
Und: Sie verkennen, dass das Kartell- und Wettbewerbsrecht ein Recht ist, das dem Markt und dem geschäftlichen Betrieb zugeordnet ist und das dafür sorgen soll, dass Wettbewerb in fairen Bahnen verläuft. Es ist keine Regelung zur politischen Regulierung von Medien, meine Damen und Herren.
Wir haben übrigens früher schon einen ganz einfachen Vorschlag eingebracht, mit dem die Probleme in diesem Bereich gelöst wären. Das ist die Impressumspflicht in Druckerzeugnissen oder in elektronischen Medien für Parteibeteiligungen.
Wenn Sie davon sprechen, dass Ihr Gesetzentwurf wichtig für die Demokratie sein soll, dann stellt sich mir die Frage: Warum behandeln Sie eigentlich nicht Dinge, die viel, viel wichtiger sind für das Funktionieren der Demokratie im Medienbereich?
Ich spreche hier von Fake News, meine Damen und Herren.
Das ist ein Problem, das vor wenigen Jahren noch unbedeutend war, sich aber zunehmend zu einem ernsten Problem der Demokratie und des demokratischen Diskurses entwickelt. Es hätte Ihnen durchaus gut angestanden, wenn Sie sich diesem Problem in irgendeiner Weise zugewendet hätten.
Aber ich glaube, genau das war nicht beabsichtigt.
So könnte man argwöhnen, dass dieser Gesetzentwurf ein Ablenkungsmanöver ist, ein Manöver, um von Problemen abzulenken, die Sie genau kennen, die Sie genau verstehen, aber nicht anfassen und nicht benennen wollen.
Fake News werden gezielt zum Erreichen politischer Zwecke eingesetzt. Sie werden verbreitet, um Angst zu erzeugen – da gibt es schöne Beispiele, auch aus den Reihen der AfD –, um Seriosität vorzutäuschen, um Menschen angeblich zu informieren, und in Wirklichkeit werden dort die dreistesten Lügen im Umlauf gebracht.
Ich könnte hier jetzt die einzelnen Beispiele aufzählen,
bei denen die AfD wirklich Fake News verbreitet hat.
– Das können wir machen; aber so viel Redezeit, um das im Einzelnen aufzuzählen, habe ich leider nicht.
