Freiheit rauben, Mangel erzeugen und dann diesen Mangel mit großer Leidenschaft und Unterdrückung bis ins kleinste Detail verwalten.
Flankiert wird diese Intention auch auf EU-Ebene. Bejubelt wird dort die Ankündigung von Massenarmut und Mangelwirtschaft.
Wie sonst könnte es sich erklären lassen, dass Forderungen nach Verteuerungen in allen Lebensbereichen, jedweden Konsums und aller gehandelter Waren ganz größenwahnsinnig als Mondmoment deklariert werden?
Vielleicht ist es nötig, festzuhalten, dass bislang ausschließlich die USA einen Mondmoment gehabt haben. Offensichtlich sind uns die USA nicht nur dabei voraus,
sondern auch im Umgang mit ungenauen Klimavorhersagen und vagen Heilsversprechen. Gerade weil sich Rest-CO
Beenden wir die Farce von Paris,
die Sie mit Ihren falschen CO
die Menschheit könne gezielt das Klima beeinflussen. Das können wir nicht. Das ist Science Fiction.
Herr Dr. Kraft, achten Sie bitte auf die Zeit.
Vielen Dank, Frau Präsidentin.
Das Wort hat der Kollege Carsten Träger für die SPD-Fraktion.
