Aber nur 20 Prozent der 193 Staaten beteiligen sich an deren Versorgung. Eine Lösung dieses Dilemmas wäre im Prinzip so simpel wie naheliegend: Wenn mehr Nationen an mehr Punkten mit Hilfe ansetzten, wären die Lasten insgesamt für alle leichter zu tragen.
Vorschläge wie zum Beispiel neue regionale Unterstützungsplattformen und mehr Resettlement-Plätze sind daher absolut unterstützenswert.
– Was schreien Sie denn so? Komisch, es gibt zwei Themen, bei denen Sie wie wild reinschreien.
Jetzt reicht es aber. Jetzt sind Sie mal ganz still da in der ersten Reihe. Wir werden uns das im Protokoll ansehen. Sie halten sich jetzt zurück. – Jetzt ist Frau Groden-Kranich dran.
Ein erklärtes Ziel des Globalen Pakts für Flüchtlinge ist, die Eigenständigkeit von Flüchtlingen zu fördern. Für mich die sinnvollste Art, dies zu tun, ist, Perspektiven zu bieten, und zwar durch Bildung. Dieses Thema haben wir auch im Unterausschuss für Auswärtige Kultur- und Bildungspolitik immer wieder auf der Agenda; aber bei der so wichtigen Sitzung am 9. Dezember, als Bundesminister Gerd Müller gerade zum Thema Afrika da war, haben Sie ebenfalls mit Abwesenheit geglänzt.
Wir haben gehandelt; daher nimmt Bildung auch im Haushalt 2020 zu Recht einen wichtigen Raum ein: unter anderem 13 Millionen Euro für die Deutsche Akademische Flüchtlingsinitiative Albert Einstein, über 10 Millionen Euro für die Philipp-Schwartz-Initiative der Humboldt-Stiftung,
die Aufstockung um 16 Millionen Euro für das Programm „Education Cannot Wait“ für Kinder und Jugendliche in Konfliktgebieten.
Zum Schluss. Es ist doch bemerkenswert, dass gerade heute vor Weihnachten das Thema Flüchtlinge in mehrfacher Weise von Ihnen ins Plenum gebracht wurde. Ist das nicht ein Fall von unfreiwilliger Ironie? Maria und Josef waren Flüchtlinge.
Jesus wurde als Flüchtlingskind geboren. In Bethlehem im heutigen Westjordanland, in Palästina ist die Flüchtlingsproblematik auch 2 000 Jahre danach leider immer noch genauso aktuell. Das Christentum und die Botschaft des Neuen Testaments beginnen mit und beruhen auf einer Flüchtlingsgeschichte. Ich empfehle das Lesen der heutigen Ausgabe der „FAZ“, die unter der Überschrift „Das Licht der Erkenntnis“ die Fluchtbewegung von Beamten in der AfD zum Thema macht.
Uns allen wünsche ich besinnliche Weihnachten.
Vielen Dank, Ursula Groden-Kranich. – Nächster Redner in der Debatte: Ulrich Lechte für die FDP-Fraktion.
