Guten Morgen! Sehr geehrter Herr Präsident! Liebe Kolleginnen und Kollegen! Unser Wald lehrt uns Denken und Handeln in Generationen. Ein Baum, der heute gepflanzt wird, kann uns 80 Jahre und mehr zum Wohle dienen. Und der Wald ist ein Multitalent: Tieren und Pflanzen bietet er Lebensraum, Nahrung und Schutz. Er liefert uns Holz, Erholung und frische Luft. Der Waldboden nimmt den Regen auf. Er verhindert so, dass Hochwasser entstehen. Im Waldboden wird das Wasser gefiltert und gespeichert. Wälder sind schlichtweg unsere grüne Lunge. Sie speichern CO
Wir brauchen den Wald heute, und wir brauchen ihn morgen. Knapp ein Drittel der Landfläche Deutschlands ist bewaldet. Er gibt mehr als 1 Million Menschen, gerade auf dem Land, Arbeit und Einkommen. Wir brauchen den Wald.
Aber der Wald braucht auch uns. Wir stehen am Ende eines schwierigen Jahres; das wissen wir. Wetterextreme und Klimawandel haben massive Spuren hinterlassen. Die Bäume sind nachhaltig gestresst und anfällig für Schädlinge. Stürme, Trockenheit, Wassermangel, Waldbrände, Befall durch Borkenkäfer oder Eichenprozessionsspinner – 180 000 Hektar Wald sind geschädigt. Das entspricht umgerechnet rund 250 000 Fußballfeldern.
Millionen Festmeter an Schadholz sind angefallen. Dadurch ist der Holzmarkt zusammengebrochen, die Preise sind eingebrochen, es gibt Probleme mit Lagerstätten, die Aufarbeitungskosten sind hoch. Unsere Waldbesitzer durchleben schwierige Zeiten. Ich bin allen, die im und mit dem Wald arbeiten, dankbar für ihren Einsatz. Danke für Ihren Einsatz für uns alle hier in Deutschland!
Mein Dank gilt ganz explizit allen Waldbesitzern; denn 48 Prozent unseres Waldes sind im Privatbesitz. Unsere Waldbesitzer haben viel Geld investiert, und sie haben auch viel Geld verloren. Deshalb finde ich – das will ich hier an dieser Stelle sagen – das Gerede mancher Grünen wirklich unerträglich, die den Waldbesitzern Ausbeutung der Wälder und Holzplantagenbau vorwerfen.
Wer nämlich heute den Waldbesitzern die Unterstützung verweigert, versündigt sich an den Kindern und Kindeskindern. Einfach die Hände in den Schoß zu legen und allein auf Naturverjüngung oder Verurwaldung zu warten, das ist unverantwortlich.
Denn wer dem Wald jetzt nicht aktiv hilft, liebe Kolleginnen und Kollegen, der schiebt den Klimaschutz auf die lange Bank. Und das sind häufig diejenigen, denen es mit dem Klimaschutz nicht schnell genug gehen kann.
Wir als Bundesregierung und die Große Koalition haben umgehend pragmatisch, unideologisch und vorausschauend gehandelt.
Ich will elf Punkte nennen:
Erstens. Wir haben bereits Ende 2018 eine neue Maßnahmengruppe zur Bewältigung von Extremwetterfolgen im Wald im Förderbereich Forsten eingeführt. So konnten schon sehr früh Unterstützungsmittel in den Ländern für Schadensbeseitigung, für Prävention und für Anpassung abgerufen werden.
Zweitens. Wir haben sehr schnell, auch mit den Kollegen anderer Ausschüsse, für steuerliche Erleichterungen gesorgt bei Schadholz und für sehr stark betroffene Forstbetriebe.
Drittens. Wir haben bei der Landwirtschaftlichen Rentenbank Kredite für Waldeigentümer zu günstigen Konditionen in einer neuen Fördersparte gebündelt und erweitert.
Viertens. Für Erleichterungen bei Abtransport und bei Lagerung von Kalamitätenholz haben wir auch gesorgt.
