Wir leben in einer wehrhaften Demokratie, die sich dem Kampf gegen Hasskriminalität stellt, in einer wehrhaften Demokratie, die Antisemitismus keinen Raum lässt und die Rechtsextremismus und Rechtsterrorismus bekämpft. Diese wehrhafte Demokratie stärken wir mit diesem Haushalt. Wir stärken das BKA, wir stärken den Verfassungsschutz, und wir stärken Prävention, indem wir die Bundeszentrale für politische Bildung stärken. Ich finde, das ist ein starkes Signal, das wir mit diesem Haushalt aussenden.
Gleichzeitig ist dieser Haushalt kein Haushalt der großen Kosten, sondern es ist ein ausgeglichener Haushalt mit massiven Investitionen in die Zukunft dieses Landes. Wir investieren als Bund in Kindertagesstätten und in Schulen. Wir machen das bewusst, weil wir finden: Das sind gesamtgesellschaftliche Aufgaben, vor denen sich der Bund nicht wegducken darf. Wir müssen jedem Kind in unserer Gesellschaft die gleichen Startchancen ermöglichen; denn wenn wir das nicht tun, dann ist der Fachkräftemangel von morgen vorprogrammiert. Deshalb sind die Investitionsschwerpunkte, die wir setzen, auch hier richtig und wichtig.
Wir investieren in den Ausbau der Eisenbahninfrastruktur. Wir investieren in die Deutsche Bahn, in das Straßennetz, in den Breitbandausbau. Wir investieren in den Umwelt- und Klimaschutz. Wir investieren in den sozialen Wohnungsbau. Wir investieren in die Städtebauförderung. Wir investieren in die Forschung an Hochschulen und in Forschungseinrichtungen. Ich finde, das sind starke Signale, die in die Zukunft weisen.
Wir vergessen dabei eines nicht, nämlich dass Investitionen am Ende des Tages auch umgesetzt werden müssen, dass es nicht reicht, nur Investitionsmittel zur Verfügung zu stellen, sondern dass man am Ende auch Personal braucht, um das Ganze umzusetzen. Deshalb stärken wir mit diesem Haushalt auch die Verwaltung. Wir schaffen 6 000 neue Stellen im Eisenbahn-Bundesamt, in der Wasser- und Schifffahrtsverwaltung und im Bundesamt für Güterverkehr, damit die Investitionen auch auf die Straße kommen. Auch das ist ein wichtiges Signal dieses Haushalts.
Liebe Kolleginnen und Kollegen, vor uns liegt ein Haushalt, der auf Zusammenhalt setzt. Vor uns liegt ein Haushalt, der zeigt, dass die gesellschaftlichen Herausforderungen erkannt wurden und die gesellschaftlichen Herausforderungen dieses Landes angegangen werden, ein Haushalt, dem wir Sozialdemokraten heute nicht nur gerne zustimmen, sondern auf dessen Umsetzung im nächsten Jahr wir uns auch freuen.
Vielen Dank.
Vielen Dank, Dennis Rohde.
Einen schönen guten Morgen, liebe Kolleginnen und Kollegen! Ich will Ihnen kurz erzählen, dass wir, der Deutscher Bundestag, gerade ein wunderbares Geschenk bekommen haben – ich durfte es annehmen –, und zwar einen herzerwärmenden Baum von der Lebenshilfe Rhön-Grabfeld. Alle Kolleginnen und Kollegen, die sich nach unseren Abstimmungen vielleicht ein bisschen auf die Adventszeit einstimmen möchten, die Besinnlichkeit und Herzenswärme tanken wollen, sind herzlich eingeladen, an diesem Baum über die Würde des Menschen, die Würde aller Menschen nachzudenken.
Nächster Redner: für die FDP-Fraktion Dr. Stefan Ruppert.
