Sehr geehrter Herr Präsident! Liebe Kolleginnen und Kollegen! Liebe FDP, in vielen Themenfeldern sind wir ja durchaus ähnlicher Auffassung; aber bei der inneren Sicherheit muss ich leider wiederholt feststellen, dass wir da auf keinen gemeinsamen Nenner kommen.
Ich frage mich schon, was Sie mit dem vorliegenden Antrag inhaltlich eigentlich bewirken wollen. Wenn wir die Prosa außen vor lassen, stelle ich fest: Ihr Antrag ist in der Sache reichlich dünn. Von den neun Punkten, die Sie vorgelegt haben, sind acht ausschließlich organisatorischer und verfahrenstechnischer Art. Bei dem einzigen Punkt, in dem Sie konkrete inhaltliche Forderungen erheben, nehmen Sie selbst als Antragsteller, als Partei, als FDP überhaupt keine eigene Positionierung vor. Sie sagen uns nicht, was Sie eigentlich wollen.
Ich will es Ihnen gerne erklären. Sie thematisieren beispielsweise die Zuständigkeiten für die Abschiebung ausreisepflichtige Gefährder. Sie lassen uns aber nicht wissen, ob Sie wollen, dass die Zuständigkeit beim Bund liegt oder ob Sie eine andere Lösung wollen.
Sie fordern etwas nebulös Regeln für das Trennungsgebot zwischen Polizei und Nachrichtendiensten. Sie lassen uns aber nicht wissen, ob Sie das aufweichen wollen, ob Sie es abschaffen wollen oder was auch immer.
Dieses Vorgehen zieht sich munter durch Ihren gesamten Antrag.
Meine Damen und Herren, ich sage Ihnen auch: Wer Änderungen in unserer föderalen Sicherheitsarchitektur in Deutschland will, muss auch politisch mal ansatzweise Farbe bekennen, wohin die Reise eigentlich gehen soll. In Hamburg würden wir sagen: Da muss man endlich mal Butter bei die Fische geben.
Solche inhaltlichen Tiefflüge sind wir von Ihrer Fraktion eigentlich nicht gewohnt;
das kennen wir in der Regel von der benachbarten Fraktion.
Dass Sie hierfür jetzt auch noch eine namentliche Abstimmung beantragen, setzt dem Ganzen die Krone auf.
In Ihrem Antrag stehen ja ein paar substanzielle Forderungen, zum Beispiel die Schaffung einer digitalen Infrastruktur. Aber da ist doch schon viel passiert: Sie kennen das Projekt PIAV und andere.
Die Werthebach-Kommission, eingerichtet von Thomas de Maizière, hat viele Vorschläge vorgelegt.
Ich will Ihnen gerne sagen, was Ihr stellvertretender Bundesvorsitzender Wolfgang Kubicki am 5. Januar 2017 dazu gesagt hat:
Das ist kompletter Nonsens. Wir haben doch schon ein FBI, es heißt nur Bundeskriminalamt. Noch mehr Konzentration führt zu noch mehr Fehlern. – Also, bei dieser Vielstimmigkeit innerhalb der FDP frage ich mich erst recht, was Sie denn nun eigentlich in der Sache wollen. Vielleicht fehlt da auch etwas Expertise; vielleicht bräuchte man auch mal wieder einen Innenminister in einem Bundesland.
Das ist nur Spekulation.
– Das stimmt; da sind wir durchaus beieinander.
