Wer aus Gründen devoter Kultursensibilität, politischer Korrektheit oder schlicht ideologischer Feigheit absichtlich ganze Tätergruppen und deren kulturelle und religiöse Hintergründe ausblendet, der befördert eine Kultur der Gewalt gegen Frauen.
Also hören Sie endlich auf mit Ihrer verlogenen Multikulti-Romantik! Gerade diejenigen auf der linken Seite, die sich so gerne als Frauenrechtlerinnen bezeichnen, betreiben eine Politik, die archaische Vorstellungen und die Unterdrückung der Frau millionenfach nach Deutschland holt.
Sie gefährden damit unsere über Jahrhunderte erkämpften Freiheiten.
Kommen Sie bitte zum Schluss.
Wachen Sie endlich auf!
Nächste Rednerin: für die SPD-Fraktion Gülistan Yüksel.
