Sehr geehrte Frau Präsidentin! Liebe Kolleginnen und Kollegen! Am Dienstag habe ich mich in der allgemeinen Finanzdebatte schon ein wenig darüber beschwert, dass nur drei Frauen in der Debatte geredet haben. Jetzt, in der Schlussdebatte, sind es leider wieder nur drei Frauen. Mittendrin war es mal ein bisschen besser, was den Frauenanteil angeht. Ich finde das wirklich schade.
Deshalb nehme ich diesen Anlass gerne auf, um ein wenig für ein Thema zu werben, das uns von der SPD-Fraktion wirklich sehr am Herzen liegt. Wir haben in diesem Bundestag einen viel zu geringen Frauenanteil von nämlich nur 30 Prozent. Wir haben auch im Haushaltsausschuss einen zu geringen Frauenanteil: von 27 Prozent. Das, denken wir, muss sich ändern.
Denn wir haben gerade in dieser Woche eindrucksvoll gemerkt, welch tolle Ergebnisse zustande kommen, wenn Männer und Frauen zusammenarbeiten.
Deshalb unsere Forderung: Wir brauchen endlich ein Paritégesetz im Bundestag.
In Bezug auf den Bundeshaushalt will ich in meiner kurzen Rede die frauenpolitischen Anteile erwähnen, und ich fange gerne, Herr Minister Müller – vorhin war er noch hier –, mit der Entwicklungszusammenarbeit an. Denn hier haben wir in hohem Maße multilaterale Mittel aufgestockt. Ich denke an UN Women, UNFPA, aber auch an die Bildungsallianz. Denn von diesen Mitteln profitieren in allererster Linie Mädchen und Frauen.
Aber auch hier im Land erreichen wir viel, zum Beispiel im Familienministerium.
Liebe Damen und Herren, meine Kollegin Svenja Stadler hat in der Generaldebatte – daran werden Sie sich bestimmt noch erinnern; es war eindrucksvoll – das Thema „Gewalt gegen Frauen“ in den Vordergrund gestellt. Das ist ein trauriges Thema und auch ein unbequemes Thema. Aber ich fand es ganz toll, dass sie dieses Thema wirklich so hochgezogen hat, dass es auch überall angekommen ist.
