Aber viel, viel wichtiger ist, dass wir verstehen, dass der neue Rohstoff die Daten sind. Die Bundesregierung hat jetzt auf der Grundlage der Datenethikkommission Eckpunkte für eine Datenstrategie festgelegt, die wir im Frühjahr verabschieden werden. Ich habe den Eindruck, dass uns die Bedeutung schon klar ist, den großen Unternehmen auch,
dass aber im deutschen Mittelstand die Bedeutung dessen, was durch das Wesen der Daten als neuer Rohstoff entstanden ist, noch nicht ausreichend gesehen wird. Deshalb unterstütze ich das, was Peter Altmaier vorgeschlagen hat, nämlich als Politik – das ist ja schon etwas seltsam – mit daran zu arbeiten, dass wir eine Plattform entwickeln, auf der Daten verarbeitet werden können, und zwar nicht nur in Deutschland, sondern möglichst zusammen mit Frankreich und europaweit. Es muss verstanden werden, dass es nicht nur darum geht, dass ich meine Daten kenne.
Deutschland hat Industrie 4.0 mit als erstes Land nach vorne gebracht. Die Digitalisierung der eigenen Produktion ist der erste Schritt. Der zweite Schritt ist die Vernetzung aller Menschen und vor allen Dingen auch Gegenstände auf der Welt. Dies bietet völlig neue Möglichkeiten, Erkenntnisse zu gewinnen. Das muss im Gesundheitsbereich passieren. Das muss beim Umweltschutz passieren. Das muss aber auch für neue Wirtschaftsmodelle passieren. Je schneller wir das akzeptieren, umso besser ist es. Das bedeutet aber als Erstes einmal, dass ich alles digitalisiert vorhanden habe und dass ich weiß, was ich habe. Wir sind dafür – ich schaue gerade Nadine Schön an –, dass wir das möglichst im Open-Data-Bereich als Open Source machen, damit es durchschaubar ist. Aber damit man daraus neue Produkte machen kann, brauchen wir noch einen Kulturwandel in Deutschland. Man muss verstehen, dass das dringlich ist. Ich habe den Eindruck, dass wir da viel, viel zu langsam sind. Wir als Abgeordnete sollten sozusagen die Botschafter sein, die sagen: Verschlaft diese Zeit nicht, sonst werden Wertschöpfungsmodelle an uns vorbeigehen und wir werden zur verlängerten Werkbank. – Das ist meine ganz große Sorge. Aber, ich glaube, als Bundesregierung sind wir jetzt auf dem richtigen Weg.
Wir müssen führend in KI sein, in der künstlichen Intelligenz, in den Algorithmen, die mit diesen Daten arbeiten. Wir haben glücklicherweise sechs entsprechende Forschungszentren. Sie werden unterstützt. Da müssen Bund und Länder gut zusammenarbeiten. Ich unterstütze sehr die zusätzliche Strategie von Bayern, die mit der Bundesstrategie bestens zusammenpasst. Ich weiß, dass auch in anderen Bundesländern viel passiert. Das ist gut.
Hiervon und vom Klimawandel wird weit mehr als von anderen Dingen abhängen, ob wir in 10 oder 20 Jahren noch ein führender Industriestandort sind oder nicht. Die Weichen dafür werden heute gestellt.
Wirtschaft, soziale Marktwirtschaft, unser Gesellschaftsmodell – das in die neue Zeit zu tragen, verstehen wir als Aufgabe der Bundesregierung. Aber wir sehen, dass die vielen Veränderungen, die dramatischen Veränderungen auf der Welt auch zu großen Friktionen in unserer Gesellschaft führen. So gut wie das Internet ist und so gut wie die digitalen Möglichkeiten sind, so viele Gefahren bergen sie natürlich auch; das war bei jeder neuen Technologie so. Deshalb ist es gut, dass im Augenblick in Berlin das große internationale Internet Governance Forum der UN tagt, das sich mit solchen Fragen beschäftigt.
Wir müssen konstatieren: Obwohl es uns wirtschaftlich sehr gut geht,
