Frau Präsidentin! Liebe Kolleginnen und Kollegen! Meine Damen und Herren! Ich hatte mir schon Sorgen gemacht, Herr Gauland, nach Ihrer Rede: Da gab es diesmal keine Ausflüge in die deutsche Geschichte, keinen Untergang des Abendlandes.
Zum Glück ist auf Frau Weidel Verlass; sie hat sich vorgearbeitet vom Marktradikalismus zum Rechtsradikalismus und ist damit bei ihrem Markenkern angelangt.
Denn vor einem haben Sie beide ja gemeinsam Angst: dass demnächst der Höcke vor der Tür steht.
Kommen wir einmal zum Haushalt.
Ich habe in den letzten beiden Tagen den Reden, den Beiträgen, der Kritik, den Vorwürfen zugehört, die es gibt gegenüber der Großen Koalition, gegenüber diesem Bundeshaushalt, gegenüber den Schwerpunkten des Bundeshaushalts. Wenn ich einmal zusammenfassen darf – ganz subjektiv natürlich –, was eigentlich die Hauptkritikpunkte waren, stellen sich für mich drei Punkte heraus: Erstens. Da sei doch zu viel Klein-Klein bei dieser Koalition, kein großer Wurf, alles zu wenig, alles zu spät. Zweitens. Diese Koalition, diese Bundesregierung investiere zu wenig. Und drittens: Eigentlich habe ja diese Koalition und eigentlich habe ja diese Bundesregierung ihr Pulver schon verschossen und für die zweite Halbzeit nichts mehr vor.
Gehen wir einmal auf den ersten Vorwurf ein, den Vorwurf des Klein-Klein.
Ich weiß gar nicht, was es dagegen einzuwenden gibt, wenn man sich auch mit sogenannten kleinen Dingen befasst, wenn man sich damit befasst, was die Nöte, die Alltagssorgen von 83 Millionen Bürgerinnen und Bürgern in Deutschland sind. Dagegen gibt es gar nichts einzuwenden, meine Damen und Herren.
Wenn Sie sich einmal anschauen, wie diese Große Koalition in den letzten 20, 21 Monaten gearbeitet hat, die Probleme angegangen ist, dann müssen Sie feststellen: Wir haben uns um die kleinen Dinge gekümmert, aber auch um die großen. In diesem Land wurde 25, 30 Jahre über ein Einwanderungsgesetz geredet. Die Große Koalition hat es auf den Weg gebracht, liebe Kolleginnen und Kollegen.
Wir haben seit Jahrzehnten über den Ausstieg aus der Kernkraft geredet, und zwar völlig zu Recht. Jetzt macht diese Koalition beides. Wir gehen aus zwei Großtechnologien heraus – aus Kernkraft und Kohle. Das als Klein-Klein zu bezeichnen, geht wohl etwas an der Realität vorbei, liebe Kolleginnen und Kollegen.
