Liebe Kolleginnen und Kollegen! Ja, PISA erzeugt immer wieder Aufregung, aber wir haben keinen Mangel an Erkenntnis, wir haben einen Mangel an Fähigkeit und Willen, etwas zu verändern.
In Deutschland gibt es mindestens drei Grundprobleme:
Zum ersten Problem. Wir haben zu wenig Geld und zu wenig Personal für Bildung. Die praktische Erfahrung beispielsweise vieler Leute in meinem Wahlkreis ist: Der Bürgermeister aus der Elsteraue kann nur wenige Kitas sanieren, nötig hätten es alle – bitter nötig.
Die Förderschule in Hohenmölsen ist im Originalzustand von vor 1990, und sie teilt dieses Schicksal mit vielen anderen Schulen.
Der Sanierungsbedarf in Kitas und Schulen beläuft sich, je nach Quelle, auf 45 bis 55 Milliarden Euro. Es fehlen Erzieherinnen und Erzieher in den Kitas, wir haben zu wenig Geld für Schulsozialarbeit, obwohl alle wissen: Das ist ein Erfolgsmodell.
Bei der Verteilung der Mittel gibt es obendrein eine soziale Schieflage; denn da, wo es schon viel Geld und Personal gibt, kommt noch mehr obendrauf. Das Geld fließt vornehmlich in Exzellenzinitiativen, aber eben kaum in Alphabetisierung und Grundbildung. Ich gehe jede Wette ein, liebe Kolleginnen und Kollegen: Die Mittel für Schulsanierung – auch die vom Bund einst – fließen sehr viel großzügiger in Schulen der bessergestellten Wohnviertel als in Schulen in Brennpunktvierteln, und das wollen und müssen wir endlich ändern.
Dafür lagen vielfältige Vorschläge – beispielsweise unsererseits – vor.
Problem Nummer zwei. Kinder werden in unserem Schulsystem sozial platziert, das heißt, die Schulform entscheidet letztlich darüber, wie viel Bildung wir unseren Kindern zugänglich machen; die Schulform entscheidet letztlich darüber, was wir Kindern heimlich zutrauen – Stichwort „der heimliche Lehrplan der Schulformen“ –, und die Schulform entscheidet letztlich darüber, was sie mal werden, wie viel Geld und wie viel Einfluss sie bekommen werden – und das nachweislich seit vielen Jahren in Abhängigkeit von der sozialen Herkunft.
Das müssen wir ändern.
