– Pfui, jawohl.
Ihr Nichtverstehen der Kultur führt zum Nichterkennen Ihrer eigentlichen Aufgabe, nämlich des Erhalts und der Verteidigung unserer kulturellen Identität,
die doch die Klammer des Gemeinsinns der deutschen Mehrheitsgesellschaft ist und damit auch die Grundvoraussetzung für Identifikation mit und Integration in unsere Gesellschaft schafft.
Ich sage das nicht, um das Eigene zu überhöhen, und auch nicht, um das Fremde herabzuwürdigen, sondern ganz im Sinne Herders: als gleichwertige Koexistenz der Kulturen in ihren jeweiligen angestammten Kulturräumen.
Das ist es, was Sie hier übergreifend eint: Sie schaffen Deutschland ab und träumen höschenfeucht Ihr One-World-Fantasma.
Ihre Kultur- und Medienpolitik ist die Deutlich- und Sichtbarwerdung eines links-grünen Juste Milieus voller zeitgeistiger, staatsgeldgieriger Opportunisten.
