Herr Präsident! Werte Kolleginnen und Kollegen! Die Linken nehmen jede Möglichkeit wahr, wieder das Lied der Armut in Deutschland zu singen. Anders kann ich es nicht feststellen.
Die Pressemitteilung, die es zu diesem Thema gab, dass sich immer mehr Menschen bei den Tafeln zusätzlich mit Lebensmitteln versorgen, bedeutet noch nicht, dass dies ein Armutsquotient ist. Sie haben richtigerweise die Arbeit der großartigen Ehrenamtlichen bei den Tafeln – es gibt fast 1000 Tafeln in Deutschland – angesprochen. Da danke ich ausdrücklich allen, die sich dieser ehrenamtlichen Arbeit verschrieben haben.
Hier wird Menschen zusätzlich die Möglichkeit eröffnet, Lebensmittel zu erwerben, um damit neben der finanziellen Unterstützung des Staates – entweder durch Grundsicherung oder durch Wohngeld – mehr Freiraum zu haben. Diese ehrenamtliche Tätigkeit ist doch ein großartiges Engagement für den sozialen Zusammenhalt in unserer Gesellschaft; das möchte ich hier würdigen.
Das Zweite ist: Die Linke zeichnet mal wieder ein verzerrtes Bild der Situation.
– Doch, natürlich. Der Kollege Peter Weiß hat völlig recht gehabt, als er darauf hingewiesen hat, dass die Tatsache, dass nur knapp 3 Prozent im Alter auf Grundsicherung angewiesen sind,
ein großartiges Ergebnis unserer Gesellschaftsform bedeutet. Wenn über 97 Prozent grundsätzlich nicht auf solche sozialen Unterstützungsleistungen angewiesen sind,
so beruht das auf vergangener Arbeit, auf vergangenem Erwerb und darüber hinaus darauf, dass sich die Menschen selbst eine Lebensgrundlage geschaffen haben und nicht von staatlichen Leistungen abhängig sind. Es muss ja das Ziel einer Gesellschaft sein, dass letztendlich die eigenen Möglichkeiten der Menschen besonders gefördert werden.
Das tut die Union, auch in dieser ab und zu etwas schwierigen Koalition.
Ich möchte doch einen kleinen Verweis auf die Vergangenheit geben. Wir haben die Regierung Ende 2005/Anfang 2006 angetreten. Arbeitslosigkeit: 10,8 Prozent. Jetzt sind wir bei 5 Prozent.
Das heißt, wir haben die Arbeitslosigkeit kräftig halbiert. Das bedeutet Rentenansprüche in der Zukunft.
Die Arbeitslosen der vergangenen rot-grünen Regierung haben keine Rentenansprüche erworben. Das muss man hier mit sehen.
Wir haben die Zahl der sozialversicherungspflichtigen Beschäftigungsverhältnisse gesteigert. 2006: 26,5 Millionen. Mittlerweile sind es über 33 Millionen sozialversicherungspflichtige Beschäftigte.
Das ist die Grundlage, damit zukünftig keine Altersarmut entsteht. Das ist mit das Entscheidende.
Wir haben die Zahl der Erwerbstätigen kräftig gesteigert: 2006, also am Ende von Rot-Grün, 39,1 Millionen Erwerbstätige in unserem Land, jetzt 44,8 Millionen Erwerbstätige.
Das ist die Grundlage für zukünftige Alterssicherung.
Sie propagieren hier im Prinzip ein bedingungsloses Grundeinkommen.
