Sehr geehrte Frau Präsidentin! Meine lieben Kolleginnen und Kollegen! Sehr geehrte Damen und Herren! Es ist gut, dass wir aufgrund des Antrages der Linken und des Antrages, den wir dazugepackt haben, über das Elterngeld sprechen.
Es ist auch gut, darüber zu sprechen, ob die Höhe nach dieser ganzen Zeit angemessen ist.
Wir werden uns einer solchen Debatte nicht verschließen. Wir haben ja schließlich auch beim Kinderchancengeld gefordert, dass es ein entsprechendes Gremium gibt, das unabhängig auch über die Höhe und die Anpassungsnotwendigkeiten spricht.
Ich würde mir wünschen, dass wir viel mehr und viel intensiver darüber sprechen, was für Reformen darüber hinaus hier dringend notwendig sind. Lieber Kollege Schwartze und lieber Maik, wenn ich die Ausführungen, die ich eben gehört habe, Revue passieren lasse, dann frage ich mich: Ist das Satire? Ist das Kabarett? Was ist das eigentlich?
Sie haben die Punkte angesprochen und gesagt: Ja, die FDP hat recht mit der Frage, ob die Dauer bei einer Frühgeburt angemessen ist, und mit der Frage, wie es in Bezug auf die Berechnung des Elterngeldes aussieht, wenn die Eltern vorher Insolvenzgeld bezogen haben. Über die Zeitkorridore haben wir auch gesprochen. Das haben wir seit ungefähr zwei Jahren gefordert. Seit zwei Jahren vertrösten das Familienministerium und Ihre beiden Fraktionen die Eltern auf eine Lösung.
– Moment mal! Das ist eine so billige Ausrede! Ist das wirklich Ihre Entschuldigung für zwei Jahre Nichtstun gegenüber den Eltern? Das finde ich echt erbärmlich – und ich glaube, die Eltern auch.
Herr Beermann, wenn ich dann höre, dass Sie sagen: „Es hat Vorgespräche gegeben, damit endlich mal ein Detailentwurf kommt“, dann ist das schon erschreckend. Die Familienministerin hatte versprochen: Im Juni liegt hier ein Entwurf vor. – Er liegt nicht vor. Dann hat sie im Ausschuss versprochen: Im Dezember liegt er vor. – Er liegt immer noch nicht vor. In ihrer letzten Reden hat sie von der letzten Sitzungswoche gesprochen. – Also, das finden wir sehr schlimm.
Wir als Serviceopposition sehen das anders.
