und das nicht etwa zum Wohle Deutschlands, sondern zum ideologiedurchtränkten Schaden, zum ideologiegetriebenen Schaden für alle Bürger.
Meine Damen und Herren, wir haben versucht, dieses grob schändliche Gesetzgebungsverfahren zu stoppen. Wir hatten aber leider keine Chance.
Wir versuchen es dennoch hier in Zukunft auch weiter und versprechen den Bürgern: Mit uns gibt es keine Klimahysterie, mit uns gibt es keine Milliardenkosten mit null Effekt.
Deshalb stehe ich hier vorne und darf namens der AfD-Fraktion verkünden, dass wir das gesamte Klimaschutzprogramm 2030 genauso ablehnen wie das gestern verkündete, von Ihnen hinter verschlossenen Türen ausgemauschelte Vermittlungsergebnis.
Vielen Dank.
Herr Abgeordneter Brandner, ich weise mit Nachdruck Ihre Erklärung zurück, dass ein von Verfassung wegen vorgeschriebenes Verfahren, einen Interessenausgleich zwischen dem Deutschen Bundestag und den Bundesländern herbeizuführen, ein Gemauschel sei. Das ist nicht nur unangemessen, sondern in der Sache falsch.
Das als letzter Satz von mir, weil es mich wirklich ärgert: Ich empfehle Ihnen, gelegentlich die Verfassung zu lesen, Herr Brandner, und nicht nur darüber zu reden.
Als nächster Redner hat das Wort der Kollege Carsten Schneider, SPD-Fraktion.
– Herr Abgeordneter Brandner, Sie dürfen sich bitte setzen, und wenn das nicht der Fall ist, bekommen Sie einen Ordnungsruf.
