Frau Präsidentin! Liebe Kolleginnen und Kollegen! Nur ein Gedanke: Apropos Rentenkonzept, Frau Schielke-Ziesing – wo ist denn Ihres?
Wollen Sie wie Herr Meuthen die gesetzliche Rentenversicherung zerschlagen? Oder wollen Sie eine völkische Rente à la Höcke? Das müssten Sie innerparteilich mal klären. Dann können Sie wieder herkommen und über Rentenkonzepte reden.
– Blöken Sie nicht dazwischen, sondern äußern Sie sich sachlich! Klären Sie Ihre innerparteilichen Differenzen! Und dann kommen Sie mit einem Rentenkonzept her.
Aber zurück zum Thema. Eines vorweg: Die knapp 1 000 Tafeln im Lande liefern und realisieren eine wirklich gute Arbeit. Sie sorgen dafür, dass noch brauchbare Lebensmittel nicht auf dem Müll landen, sondern bei Menschen, die sie wirklich gebrauchen können. Dafür sage ich auch an dieser Stelle herzlichen Dank an die vielen Ehrenamtlichen, die das vor Ort machen.
Klar ist: Die Arbeit ist sinnvoll; denn dort gehen Leute hin, die sonst schwer über die Runden kommen; das ist ja unbestritten. Wenn die Zahl der älteren Tafelkunden steigt, ist das ein Hinweis auf ein drängendes Problem. Diese Menschen haben oft eine zu niedrige Rente und scheuen sich ebenso häufig, zum Amt zu gehen. Altersarmut ist in diesem Land ein Thema; das ist überhaupt keine Frage. Sie ist kein Massenphänomen; aber sie nimmt zu.
Die Zahl derjenigen, die Grundsicherung im Alter beziehen, kann da nur ein Anhaltspunkt sein.
Das DIW – die Studie ist ja eben schon erwähnt worden – hat vor ein paar Tagen veröffentlicht, dass 60 Prozent derjenigen, die Anspruch auf Grundsicherung im Alter haben, diesen Anspruch nicht realisieren -
aus Unwissenheit, aus Angst, dass die Kinder finanziell in Anspruch genommen werden, aber auch aus Scham. An diesem Phänomen hat sich leider seit Jahrzehnten nichts verändert.
Ich habe meine Diplomarbeit über dieses Thema geschrieben.
Es ist allerdings ein Armutszeugnis für ein reiches Land wie Deutschland und einen Sozialstaat wie unseren, dass es Menschen gibt, die trotz Sozialleistungen aufgrund steigender Mieten und Lebenshaltungskosten zusätzlich zur Tafel gehen, weil sie sonst nicht über den Monat kommen.
Es gibt viele, die ihren Anspruch beim Staat gar nicht geltend machen, weil sie sich schämen oder weil sie Angst vor der Bürokratie haben.
Wir wollen und wir werden künftig denjenigen den Gang zum Amt ersparen, die jahrzehntelang gearbeitet haben, die Kinder erzogen haben und die Angehörige gepflegt haben. Mit der Grundrente ohne Bedürftigkeitsprüfung lösen wir dieses Versprechen endlich ein.
Wir wollen den Sozialstaat wieder stärker zum Partner der Menschen machen, damit sie ihn nicht als Obrigkeitsstaat verstehen und erleben, wie das noch viel zu oft der Fall ist.
Die SPD hat jüngst auf ihrem Parteitag mit dem Sozialstaatspapier den Grundstein dafür gelegt. Da heißt es:
Leistungen des Sozialstaats sind soziale Rechte, die Bürgerinnen und Bürgern zustehen. Sie sind Inhaberinnen und Inhaber dieser Rechte, keine Bittsteller.
Da heißt es auch:
