Wir finden, die Menschen haben für ihre Lebensleistung eine Anerkennung verdient,
und zwar als Rente und nicht als Fürsorge.
Die FDP will den Gutverdienern 11 Milliarden Euro geben, und wir geben 1,5 Milliarden Euro ganz konkret den Menschen in diesem Land, die es mit ihrer Hände Arbeit nicht geschafft haben, mehr als die Grundsicherung zu haben.
Diese Grundrente ist ein wichtiger Schritt; denn wir als SPD werden auf dem Bundesparteitag nächste Woche über den Sozialstaat als Partner diskutieren. Der Sozialstaat als Partner sagt: Wir erkennen Lebensleistung an, und zwar nicht im Fürsorgesystem, sondern in den sozialen Sicherungssystemen, also dort, wo es hingehört. – Das war der Blick auf das Erreichte.
Das ist ein kluger Haushalt für Zusammenhalt. Er enthält zahlreiche Ideen für morgen. Weil wir in der SPD genau diesen Bogen spannen können, blicke ich optimistisch und zuversichtlich nach vorne; denn wir haben auch in dieser Koalition noch einiges vor. Wir sind ja noch gar nicht fertig.
Wir haben eine Situation in Deutschland, in der es darum geht, die Transformation durch Klimaschutz – und den wollen wir –, durch Digitalisierung und technologischen Wandel zu gestalten. Wir alle wissen, dass da große Dinge auf uns zukommen. Unsere Mission als SPD in dieser Bundesregierung ist, dafür zu sorgen, dass die Menschen, die heute einen Job haben, auch morgen noch einen guten Job in diesem Land haben.
Deshalb werden wir die Arbeit-von-morgen-Gesetze machen, bei denen es darum geht, Kurzarbeitergeld schneller zu gewähren und für die Betriebe besser zu machen. Vor allen Dingen wollen wir einen weiteren Ausbau von Qualifizierung und Weiterbildung in diesem Land. Wir werden aber gemeinsam auch noch befristete Beschäftigung zurückdrängen. Auch darauf haben wir uns in der Koalition verständigt. Wir wollen die Mitbestimmung und die Tarifautonomie stärken, weil wir wissen: Das ist der Garant dafür, dass Menschen gute Löhne und den Respekt für ihrer Hände Arbeit bekommen, den sie verdienen.
Wir werden auf unserem Bundesparteitag auch eine Arbeitsversicherung diskutieren und den Blick nach vorne richten. Ein Recht auf Weiterbildung, mehr Tarifbindung, auch das Recht auf Arbeit statt einem bedingungslosen Grundeinkommen werden wir diskutieren. Wir werden den Gedanken des Sozialstaats als Partner durchdeklinieren. Wir werden mutig die sozialdemokratische Kindergrundsicherung diskutieren. Und wir werden uns über die Einführung einer Vermögensteuer – in der Zukunft, nicht in der Koalition – unterhalten; denn es geht darum, die Schere zwischen Arm und Reich zu schließen.
Wir haben viel geleistet. Wir haben in der Koalition und mit unserem Koalitionspartner noch viel vor. Aber unsere Ideen sind nicht erschöpft; sie richten sich auf die Zukunft.
Vielen Dank.
Voraussichtlich letzter Redner in dieser Debattenrunde ist der Kollege Dr. Matthias Zimmer, CDU/CSU.
