wie auch in anderen Ländern, alsbald um die Ohren fliegen. Dann werden in diesem Bundestag vielleicht auch wieder Debatten auf der Grundlage wissenschaftlicher Erkenntnisse geführt,
und zwar zum Wohle des deutschen Volkes.
Ich schließe mit einem weiteren Zitat von Henryk Broder: Die Klimageschichte ist eine neue, globale Kirche.
Und Sie alle, die Sie hier sitzen, lassen es zu, dass diese Klimasekte diesen Bundestag als Tempel ihrer neuen Religion missbraucht. Irgendwann, so Henryk M. Broder, setzt sich Vernunft durch; manchmal dauert es etwas länger; aber irgendwann setzt sie sich durch.
Trotz aller Meinungsunterschiede wünsche ich allen ein friedliches und gesegnetes Weihnachten.
Für die CDU/CSU-Fraktion spricht der Kollege Andreas Jung.
