Vielen Dank. – Herr Präsident! Liebe Kolleginnen und Kollegen! Das ist das sechste Mal, dass wir in dieser Legislaturperiode über den Einzelplan 14 hier im Plenum diskutieren. Das eine oder andere, was hier an Argumenten ausgetauscht wird, ist und war ja vorhersehbar. Die einen sprechen davon, dass wir die Bundeswehr vernünftig ausrüsten. Die anderen verkehren das und sprechen darüber, wir würden aufrüsten. Dann gibt es die anderen, die sagen, wir müssten mehr Geld ausgeben, wir müssten Quoten erfüllen, und wieder andere sagen: Eigentlich muss das Geld in ganz anderen Bereichen verausgabt werden.
Ich finde aber, es muss uns in dieser Debatte im Kern immer um etwas anderes gehen: Es geht zentral um unsere Verantwortung als Parlament gegenüber unserer Parlamentsarmee. Wir entscheiden über die Einsätze der Soldatinnen und Soldaten, und wir haben als Umkehrschluss sicherzustellen, dass sie die von uns übertragenen Aufgaben auch in Gänze wahrnehmen können. Das ist unsere Verantwortung, das kommt für uns auch in diesem Einzelplan zum Ausdruck.
Wenn ich über die Verantwortung eines Parlaments gegenüber seiner Parlamentsarmee spreche, dann, finde ich, gehört auch noch etwas anderes dazu, nämlich dass wir es gemeinsam als Parlament nicht zulassen, dass Debatten über Einsätze der Bundeswehr innenpolitisch motiviert, initiiert oder geführt werden. Dieser Schutz unserer Soldatinnen und Soldaten muss auch von diesem Parlament ausgehen, liebe Kolleginnen und Kollegen.
Einsätze der Bundeswehr müssen immer außen- und sicherheitspolitisch begründet werden, sie müssen immer die Werte und die Festschreibung unseres Grundgesetzes berücksichtigen, und sie dürfen niemals zur Selbstverständlichkeit verkommen.
Wir als Sozialdemokraten haben bereits in der letzten Debatte hier deutlich gemacht, dass für uns die sicherheits- und einsatzrelevante Infrastruktur der Bundeswehr in staatliche Hand gehört. Ich finde, man muss umso mehr zu dem Ergebnis kommen, wenn man sich die veränderte globale Lage ansieht. Man muss umso mehr zu dem Ergebnis kommen, wenn man sich das Weißbuch der Bundesregierung ansieht. Man muss umso mehr auch zu diesem Ergebnis kommen, wenn man sich die Erkenntnisse des Untersuchungsausschusses ansieht. Deshalb begrüßen wir als Sozialdemokraten ganz ausdrücklich die gemeinsame Entscheidung in der Koalition, die gemeinsame Entscheidung mit CDU/CSU und mit dem Verteidigungsministerium, die Heeresinstandsetzungswerke nicht zu verkaufen. Das ist die richtige Entscheidung. Sie ist konsequent, und, ich glaube, sie ist auch nachhaltig.
Dieser grundsätzliche Gedanke – dass die sicherheitsrelevante Infrastruktur in staatliche Hand gehört – gilt perspektivisch auch beim Gefechtsübungszentrum. Der Haushaltsausschuss des Deutschen Bundestages hat beschlossen, den Auftrag letztmalig extern zu vergeben, und das Verteidigungsministerium aufgefordert, die Voraussetzungen zu schaffen, es zukünftig im Eigenbetrieb zu machen. Liebe Kolleginnen und Kollegen, Staat vor privat statt privat vor Staat.
