versickern Umsätze, die nie in einer Steuererklärung stehen werden.
Man sieht also, dass selbst dort diese Erkenntnis angekommen ist.
Um hinsichtlich der Vereine etwas zu Fritz Güntzler zu sagen: Wenn Schweden, Österreich, Portugal und Belgien es schaffen,
mit Ausnahmen für Vereine ein gutes Modell hinzubekommen, hätten wir das auch hinbekommen können. Wir haben uns das österreichische Modell angeguckt. Das wäre wunderbar eins zu eins gegangen; Ingrid Arndt-Brauer und Andreas Schwarz sind darauf eingegangen. Das hätte wunderbar gepasst.
Übrigens: Fast alle Einzelhändler – Hans, für dich –, Bäcker, Fleischer, Gemüsehändler, Gastwirte, Friseure führen ihre Betriebe ehrlich und korrekt.
Die wenigen Gauner, die die Mehrwertsteuer hinterziehen, die Geldwäsche organisieren, die Leute schwarz und prekär beschäftigen, die über 10 Milliarden Euro Schaden anrichten, sind ein riesiger Wettbewerbsnachteil für all die Ehrlichen, und deshalb muss man etwas tun.
Was uns wundert – das war damals natürlich nicht ganz konfliktfrei –: Wir haben keine Kassenpflicht. Wer sich nicht beteiligen will, wirft die elektronische Kasse in den Keller. Alles wunderbar! INSIKA, die einzige Software, die gut gewesen wäre, ist leider zwischen uns allen, sagen wir mal, ein bisschen untergegangen.
Jetzt, nach drei Jahren, soll auch noch die Belegpflicht abgeschafft werden. Was bleibt denn dann noch?
Die unangekündigte Nachschau! Die läuft aber ins Leere, wenn man nichts hat, wo man nachschauen kann.
