Deswegen verdient er unsere Solidarität. Jeder, der sich da einsetzt, weiß uns an seiner Seite.
Wir lassen sie nicht alleine. Das sind nicht nur Worte. Wir investieren massiv in die Ausstattung mit Fahrzeugen. Wir investieren massiv dahin gehend, dass auch ehrenamtliche Helferinnen und Helfer eine höhere Aufwandsentschädigung bekommen.
Die Kampagnen laufen dahin gehend, dass man sich im Ehrenamt entsprechend einsetzt.
– Herr Buschmann, Sie haben in diesem Land in der schwarz-gelben Koalition Verantwortung getragen und eine Kürzungsorgie nach der anderen gemacht, die das Ehrenamt getroffen haben. Als es darum ging, dieses Land zu regieren, haben Sie sich verweigert, weil Sie gesagt haben: Besser nicht regieren als schlecht regieren! – Jetzt wollen Sie uns Tipps geben, wie man es besser machen kann? Es ist Ihre Verantwortung, dass Sie ihr nicht nachgekommen sind.
Auch wenn konservative und sozialdemokratische Abgeordnete im Gesellschafts- und Menschenbild einiges unterscheidet, insbesondere auch darin, was den starken und solidarischen Staat angeht, so kann man, obwohl man unterschiedlicher Auffassung ist, zu einem Ergebnis kommen: Wir nehmen mehr Geld in die Hand.
Wir machen dieses Land sicherer. Wir sorgen für den gesellschaftlichen Zusammenhalt. Darum ist es wichtig, dass die Sozialdemokratie Verantwortung trägt. Das kann man in diesem Haus niemand anderem überlassen.
Nächster Redner ist der Kollege Hagen Reinhold, FDP.
