Herr Präsident! Liebe Kolleginnen und Kollegen! Frau Ministerin, seit mehreren Jahren führen wir eine ziemlich absurde Debatte bei uns im Land, nämlich die Debatte um das 2-Prozent-Ziel, also 2 Prozent gemessen am Bruttoinlandsprodukt für Verteidigung auszugeben. Die Debatte ist deshalb absurd, weil wir nicht fragen: Wie ist die Problemlage? Welche Aufgaben leiten sich daraus ab, und wie viele Mittel bräuchten wir dafür? Vielmehr wird zuerst festgestellt: So viel soll ausgegeben werden, und dann überlegen wir uns, was wir damit machen wollen. – Diese Debatte dauert an. Sie beginnen eine neue Debatte, die genauso absurd ist, mit dem gleichen Konstruktionsfehler, indem Sie sagen, wir bräuchten mehr Auslandseinsätze. Die brauchen wir nicht, liebe Ministerin.
Ich dachte immer, wir freuen uns hier, wenn Auslandseinsätze beendet werden.
Ich dachte immer, wir freuen uns, wenn Konflikte nicht mit Waffen gelöst werden, wenn wir friedliche Lösungen finden. Aber offensichtlich habe ich mich geirrt. Ich sage Ihnen: Solche Debatten sind verantwortungslos, mindestens den Soldatinnen und Soldaten gegenüber.
Wegen dieser Auslandseinsätze – der Kollege Brandl hat es angesprochen – wird in letzter Zeit wieder verstärkt darüber gesprochen, dass man den Soldatinnen und Soldaten mehr Dank und Anerkennung entgegenbringen sollte.
Sie nehmen daher für ein Mittel Geld in die Hand, nämlich dass die Soldatinnen und Soldaten ab nächstem Jahr kostenlos Bahn fahren können,
allerdings nur in Uniform.
Ich frage mich, wieso das?
