Aber wenn Sie die Lücke sehen: So sieht das Land ja auch aus. Bei der Bahn stehen die Kunden häufig in überfüllten Zügen oder an Bahnhöfen, an denen überhaupt kein Zug mehr kommt. Ich will daran erinnern: Seit 1990 sind 6 400 Kilometer Bahnstrecke eingestellt worden, meine Damen und Herren. Das trifft natürlich zuallererst den ländlichen Raum. Das sind grandiose Fehlentscheidungen gewesen. Dazu kommt, dass die Tickets in den letzten 20 Jahren um 50 Prozent teurer geworden sind. Das sind Fehlentwicklungen. Wenn Sie die jetzt korrigieren wollen, nur zu! Am Ende muss die Bahn unschlagbar werden. Das ist eine Maßnahme sowohl für das Klima als auch für den ländlichen Raum. Das wäre der richtige Weg.
Frau Merkel, was interessant ist: Sie haben hier heute kein Wort zum Thema „Wohnen und Mieten“ gesagt, anders als Christian Lindner; dazu komme ich nachher noch. In Ihrem Haushalt fehlen die notwendigen Investitionen in bezahlbare Wohnungen, und zwar in nennenswerten Größenordnungen. In Wien oder in Basel sind die Mieten sozial bemessen. Und warum? Weil Kommunen Grundstücke kaufen und darauf günstige Wohnungen bauen.
Die Kommunen! Das ist das Richtige. Ein Viertel der Wiener Wohnungen gehören der Stadt. Ein Viertel! Und knapp 15 Prozent gehören gemeinnützigen Bauvereinigungen.
Und bei uns? Bei uns zahlt die Hälfte der Haushalte mehr als 30 Prozent für die Miete. Sie tun viel zu wenig dafür, dass eine Handwerkerin, ein Verkäufer oder eine Krankenpflegerin noch eine Wohnung bezahlen kann. Über 1 Million Menschen haben nach Abzug der Miete weniger Geld zum Leben als mit Hartz IV. Das ist die Realität.
Wohnen ist im Übrigen auch deshalb unbezahlbar geworden, weil die Bodenpreise explodieren, bundesweit seit 1962 um 2 300 Prozent, in München seit 1950 im Übrigen um 39 400 Prozent. Wir brauchen dringend eine neue Bodenpolitik. Politik kann und muss diese Entwicklung stoppen, meine Damen und Herren.
Ich will mal zitieren:
… Recht auf eine menschenwürdige Wohnung. … Die Bodenpreisspekulation ist zu unterbinden, ungerechtfertigte Gewinne aus Bodenverkäufen sind abzuschöpfen.
