Herr Präsident! Liebe Kolleginnen! Liebe Kollegen! Rekordinvestitionen, keine neuen Schulden, Entlastung der Bürgerinnen und Bürger – dies alles prägt diesen Haushalt und zeigt die wirtschaftliche Stärke dieses Landes und unseren Willen, diese Stärke zu erhalten. Zugleich unterstreichen wir mit dem Einzelplan 23, den wir hier beraten, unser Bekenntnis zur gewachsenen internationalen Verantwortung Deutschlands mit einem Haushalt von nahezu 10,9 Milliarden Euro. Das ist ein neuer Rekordwert; darauf sind wir stolz, meine Damen, meine Herren.
Mir sei schon die Bemerkung erlaubt: Nach sieben mageren rot-grünen Jahren, in denen der Haushalt bei 4 Milliarden Euro stagnierte, gab es 14 gute Jahre. Und ich habe Sie, Frau Hajduk, so verstanden: Das soll so weitergehen. – Recht haben Sie! Vielen Dank für diese Bestätigung.
Mit dieser Bereitschaft zur Übernahme von Verantwortung werden wir der Werteorientierung unserer Politik auch im internationalen Bereich gerecht. Wenn über 800 Millionen Menschen bitteren Hunger erleiden, 1,4 Milliarden Menschen in bitterster Armut leben, Hunderten Millionen von Menschen der Zugang zu Bildung, zu Ernährung, zu sauberem Wasser und zur Gesundheitsvorsorge verwehrt ist, dann darf uns dies als reiches Land nicht ruhen lassen. Weil wir wirksam helfen können, müssen wir auch helfen, meine Damen, meine Herren.
Zugleich gilt: Der Kampf gegen bittere Armut, gegen Ausbeutung und Unterdrückung ist auch in unserem eigenen Interesse. Frieden, Wohlstand und soziale Gerechtigkeit werden wir auch für uns auf Dauer nur erhalten können, wenn wir weltweit mehr Gerechtigkeit und Wohlergehen für alle Menschen erreichen.
Wenn Nationalisten weltweit und hier im Hause angesichts des millionenfachen Elends in der Welt der Abschottung das Wort reden oder – wie wir es heute erlebt haben – in billiger Weise Vorurteile gegen Entwicklungszusammenarbeit schüren, missachten sie die bittere Not von Millionen Menschen in aller Welt und leisten zugleich unserem eigenen Land einen Bärendienst.
Niemand kann und will die Welt alleine retten, wie Sie es uns unterstellen.
Aber wir werden Ihnen und Ihresgleichen nie mehr erlauben, die Welt an den Rand des Abgrunds zu führen; auch das gilt.
– Die Antwort auf solch schäbige Töne ist der Rekordhaushalt.
