Sehr geehrte Frau Präsidentin! Werte Kolleginnen und Kollegen! Zu Beginn möchte ich festhalten: Die FDP-Bundestagsfraktion spricht in ihrem Antrag wirklich sehr viele richtige, wichtige und auch durchaus kritische Punkte an
– Komma –, aber sie vermischt auch einige Tatsachen.
Wir stimmen uneingeschränkt zu, dass China ein schwieriger Partner ist. In den letzten Jahrzehnten hat sich das Land zur zweitgrößten Volkswirtschaft der Welt entwickelt. Mit Wachstumsraten, die in die Höhe schießen, Technikgiganten und einer innovativen Industrie hat uns das Land – das muss man zugeben – in vielen Bereichen bereits überholt, in anderen konkurrieren wir mit ihm. Auch ist diese Entwicklung in vielen Feldern mit einem sozioökonomischen Aufschwung verbunden.
In der Entwicklungszusammenarbeit ist China vor allem in Afrika sehr aktiv und verbindet dieses Engagement unverdeckt mit seinen großen wirtschaftspolitischen und strategischen Interessen. Eigentlich kann man bei den Praktiken Chinas nicht mehr von „Entwicklungszusammenarbeit“ sprechen, da nicht die Entwicklung der Partnerländer, sondern die eigenen ökonomischen Vorteile im Vordergrund stehen. Aus diesem Grund hat unser Ausschuss im letzten Jahr eine Studie zu den strategischen Interessen hinter Chinas Entwicklungszusammenarbeit in Afrika beim Technikfolgenbüro des Bundestages in Auftrag gegeben. Wir warten auf das Ergebnis.
Nicht angesprochen im FDP-Antrag wird die schlechte Menschen- und Bürgerrechtslage in der Volksrepublik, die ich nicht unerwähnt lassen möchte. Gerade gestern haben wir im Ausschuss ja über die Arbeit unserer politischen Stiftungen gesprochen. In China ist die Arbeit für die meisten Stiftungen entweder gar nicht oder nur sehr eingeschränkt möglich.
Meine sehr geehrten Kolleginnen und Kollegen, kritisieren muss ich an dem Antrag den verwirrenden Umgang mit dem Wort „Entwicklungszusammenarbeit“ im nationalen und internationalen Kontext. Da will ich auch einiges klarstellen:
Erstens. Zwischen Deutschland und China gibt es seit 2008 keine zwischenstaatliche Entwicklungszusammenarbeit mehr. Die noch laufenden und durch Haushaltsmittel finanzierten Kredite werden wirklich nur noch abgewickelt.
Zweitens. Nach unseren Auskünften sind Ihre Angaben hinsichtlich Zinssubventionen an China durch die KfW nicht richtig.
Aber da können wir ja einen Check machen.
