Herr Frei, jetzt haben Sie das Wort.
Vielen Dank, Frau Präsidentin. – Herr Kurth, ich kann Ihnen diese Frage nur insoweit beantworten: Ich bin kein Vertreter des Innenministeriums und auch kein Vertreter der Regierung. Ich kann Ihnen aber meine Meinung sagen: Ich würde als Bundesinnenministerium ein solches Gespräch nicht führen, weil die Kommunen aus meiner Sicht für vieles Verantwortung tragen sollten, aber mit Sicherheit nicht für die Asyl- und Flüchtlingspolitik.
Das kann nur eine nationale Aufgabe sein. Wir sind darüber hinaus der Auffassung, dass man das Problem nicht nur im nationalen, sondern sogar im europäischen Maßstab lösen muss.
Die Kommunen, die Sie ansprechen, sind nicht bereit, die Konsequenzen zu tragen. Sie wollen nur eine bestimmte Art von Flüchtlingen aufnehmen, am liebsten Familien mit Kindern.
Sie sind nicht bereit, die Kosten dafür zu übernehmen. Das tut die Allgemeinheit, und deshalb ist das auch eine nationale Aufgabe, die national entschieden werden muss.
Ich kann Ihnen nur meine Meinung sagen: Ich würde als Bundesinnenministerium ein solches Gespräch nicht führen.
Jetzt komme ich zum letzten Punkt. Ich möchte noch auf Folgendes hinweisen: Wir haben beispielsweise unsere Rechte aus dem Dublin-Vertrag in der Vergangenheit – insbesondere im vergangenen Jahr – nicht so wahrgenommen, wie wir es hätten tun können. Wir haben im ganzen Jahr 2018 sechs Dublin-Rücküberstellungen nach Griechenland vorgenommen. Die Griechen haben umgekehrt 3 995 Dublin-Überstellungen vorgenommen.
Ich will an der Stelle nur eines sagen: Es gibt sehr viele Beispiele dafür, wo wir Verantwortung übernehmen. Das tun wir auch weiterhin. Aber wir tun es so, dass wir die Folgen im Blick haben. Wir unterstützen die griechischen Behörden, die Aufgaben richtig zu erledigen. Damit tragen wir auch effektiv zum Schutz der Menschen auf den griechischen Inseln bei.
Jetzt will ich Ihnen von den Grünen noch ein Letztes sagen.
Wenn ich Ihren Antrag anschaue: Sie wollen einen nationalen Alleingang bei den Ad-hoc-Aufnahmen. Sie wollen, dass wir die Rechtsberatung auf den griechischen Inseln finanzieren.
Glauben Sie eigentlich, dass es den europäischen Zusammenhalt stärkt, wenn wir hingehen und den anderen Ländern erklären, wie Rechtsstaatlichkeit funktioniert? Wir brauchen mehr europäische Zusammenarbeit in diesem Bereich und nicht weniger. Dafür schaffen wir die Voraussetzungen, nicht Sie mit Ihrem Antrag.
Herzlichen Dank.
Vielen Dank, Thorsten Frei. – Nächster Redner: Armin-Paulus Hampel für die AfD-Fraktion.
