Herr Präsident! Meine verehrten Kolleginnen und Kollegen! Es ist richtig, dass wir heute diese Aktuelle Stunde haben. Es geht darum, über Verantwortung zu sprechen, über das zu sprechen, was in der vergangenen Woche passiert ist. Ich habe dazu als Generalsekretär der CDU
deutliche und klare Worte gefunden. Es geht um die Verantwortung. Es geht auch um die Verantwortung von uns als Union.
Es ist ein Ministerpräsident mit Unterstützung der AfD gewählt worden.
– Danke für die Bestätigung, warum das genau falsch ist. Ich sage Ihnen noch einmal, warum.
Es ist viel geschrieben worden über die AfD, über ihre Beziehungen zur rechtsextremen Szene, über das, was Sie kundtun, zum Beispiel den Volkstod durch Bevölkerungsaustausch. Sie machen die Parlamente in Deutschland verächtlich. Sie fordern in der Erinnerungskultur an die Shoah eine 180-Grad-Wende, also genau das Gegenteil von dem, was wir in unserer Gesellschaft leben.
Meine Damen und Herren, ich könnte jetzt meine komplette Redezeit auf weitere Beispiele verwenden.
Ich glaube, ein Tweet der AfD in der vergangenen Woche, nach der Wahl des Ministerpräsidenten, bringt ihre komplette Haltung auf den Punkt.
So twitterte der Sprecher der Abgeordneten der AfD im Europäischen Parlament nach der Wahl in Thüringen – mit der Erlaubnis des Präsidenten zitiere ich – unter dem Hashtag „Thüringen“: „Die Auswanderung Michel Friedmans rückt näher.“
Genau das ist der Grund, warum in Deutschland kein Ministerpräsident mit den Stimmen solcher Leute gewählt werden darf.
So etwas, meine Damen und Herren, kann man nur mit einem Wort beschreiben: Das ist widerwärtig.
Dann gibt es einige, die fragen: Warum nennt der CDU-Generalsekretär Herrn Höcke einen „Nazi“?
Ganz einfach: Weil er einer ist,
weil er erwiesenermaßen einer ist. Und Sie wissen es. Deswegen werde ich das auch weiterhin tun.
Meine Damen und Herren, werte Kolleginnen und Kollegen, aber all dieser Zorn und diese Wut und die politische Auseinandersetzung innerhalb einer Demokratie, auch mit der AfD, rechtfertigt nicht – auch nicht in der vergangenen Woche – die unglaublichen Beleidigungen und Beschimpfungen von Herrn Kemmerich oder von Kolleginnen und Kollegen der FDP und anderer Parteien; ich schließe meine mit ein. Es gibt keine Rechtfertigung für Gewalt,
egal ob links, egal ob in der politischen Mitte. Ich sage das auch, weil ich gelesen habe, dass die Kinder beschützt werden müssen, weil die Familien beleidigt wurden. Das gilt für alle Parteien.
Und übrigens – das füge ich hinzu –: Wir setzen uns hier auseinander mit Herrn Höcke, mit Herrn Gauland und wie sie alle heißen.
Aber die Familien und die Kinder – auch die von AfD-Abgeordneten – haben damit nichts zu tun.
Kinder sind Kinder, und Kinder haben ein Recht, Kinder zu sein, meine Damen und Herren.
Dann wird jetzt wieder vorgetragen, die CDU müsse ihr Verhältnis zur Linken überdenken, gerade in dieser Situation; es sei doch langsam an der Zeit. Ja, was sollen wir da überdenken? Sollen wir die Mauertoten noch mal nachzählen?
Sollen wir überlegen, ob wir ein anderes Verhältnis zu sozialistischen Diktaturen, die Sie unterstützen, haben wollen? Sollen wir als CDU noch mal überlegen, ob Deutschland in der EU bleiben soll, ob wir noch in der NATO bleiben sollen? Meine Damen und Herren, Teile Ihrer Partei werden vom Verfassungsschutz beobachtet, Teile Ihrer Partei distanzieren sich nicht von Gewalt gegen Menschen.
Was gibt es da zu diskutieren mit uns?
