Sehr geehrter Herr Präsident! Meine sehr verehrten Damen und Herren! Liebe Kolleginnen und Kollegen! Ich glaube, es macht Sinn, sich zu Beginn der Debatte noch mal das Wahlergebnis vom Oktober anzuschauen:
In Thüringen hat damals die Linkspartei 31 Prozent bekommen, die AfD 23 Prozent.
Erstmals in der Geschichte der Bundesrepublik haben damit die politischen Ränder eine Mehrheit der Wählerstimmen erhalten,
anders als beispielsweise in Brandenburg und in Sachsen wenige Wochen zuvor. Es macht schon Sinn, dass auch ich noch einmal darauf hinweise
– wenn Sie von beiden Seiten laut schreien, scheine ich ja nicht so falsch zu liegen –:
In Brandenburg haben wir es mit der Höcke-AfD,
