Nein, ich erlaube keine Zwischenfragen. – Die Ursache für die Migration war, dass die Menschen dort in den Lagern Hunger und Not gelitten haben. Deswegen ist es nicht nur ein Zeichen von Humanität, sondern ist es auch ein Zeichen von Klugheit, dass wir es zu einer solchen Situation wie in den Jahren 2015/16 nicht mehr kommen lassen werden. Das hat nichts damit zu tun, wie Sie das eben gepredigt haben, dass wir Menschen in Deutschland betrügen würden, dass die Flüchtlinge auf Kosten der Deutschen leben würden. Das alles, was Sie erzählen, ist Quatsch.
Meines Erachtens sollte jeder Einzelne von uns auch noch einen humanitären Anspruch haben. Auch das Bundesverfassungsgericht hat davon gesprochen, dass dieser Anspruch ein Menschenrecht ist.
Was Ihren Antrag betrifft, kann ich Ihnen nur sagen: Da müssen Sie schon einmal 10 800 Kommunen fragen. Die Daten liegen nur dort vor. Oder Sie fragen bei den Finanzverwaltungen der Länder bzw. bei den Ländern selbst nach. Ich kann Ihnen nur dringend raten: Die Unterlagen, die mir zur Verfügung stehen – die Unterrichtung der Bundesregierung, der Bericht der Migrationsbeauftragten, der Bericht der Bundesagentur für Arbeit –, reichen mir aus.
Herr Curio, eine letzte Bemerkung: Sie sprechen hier in Ihrer Pressemitteilung davon, wie groß die „Verwertbarkeit“ der Migranten ist.
Verwertbarkeit, welch ein Begriff für Menschen. Wissen Sie, in Vorbereitung dieser Rede war ich wirklich positiv überrascht, wie viele Menschen aus Kriegs- und Krisengebieten mittlerweile in Beschäftigung gekommen sind. Das ist eine sehr, sehr positive Entwicklung. Dass das schwierig wird, wussten wir wohl alle im Herbst 2015. Herr Curio, ich glaube, dass Sie sich wirklich einmal ganz in Ruhe überlegen sollten, welche Auswirkungen Ihre Rede im Netz und letztendlich möglicherweise auch auf der Straße hat.
Herzlichen Dank.
Vielen Dank, Herr Kollege Rehberg. – Nächster Redner ist für die FDP-Fraktion der Kollege Konstantin Kuhle.
