Wie Sie wissen, wurde die UNAMID-Mission inzwischen erheblich reduziert; das wurde hier auch schon gesagt. Es sind insgesamt weniger als 5 000 Blauhelmsoldaten dort. Und wir planen einen Ausstieg aus der Peacekeeping-Mission und den Übergang zu einer Peace-Support-Mission. Ende Januar dieses Jahres hat der sudanesische Premierminister einen Brief an den UNO-Generalsekretär und an den UN-Sicherheitsrat geschickt, in dem er seine Wünsche für eine solche „special political mission“ als Folgemission für UNAMID skizziert. Diese Vorstellungen sind sehr umfangreich und bedeuten auch weiterhin ein starkes Engagement der internationalen Gemeinschaft. Aber ich denke, die sudanesische Bevölkerung hat es nach dem Sturz des Despoten verdient, dass wir sie nicht im Stich lassen, sondern den politischen Wandel im Land weiter unterstützen.
Nur ein langer Atem hat uns so weit gebracht, und deswegen sollten wir auch jetzt nichts überstürzen. Der Übergang von UNAMID zur Folgemission muss sorgfältig ausgearbeitet werden. Als Mitglied des Sicherheitsrats und als Co-Federführer des UNAMID-Dossiers kommt Deutschland dabei eine besondere Verantwortung zu.
Daher hat es mich etwas verwundert, liebe Bundesregierung, dass uns ein Mandatsantrag vorliegt, mit dem die Beteiligung der Bundeswehr nicht wie gewöhnlich um ein Jahr verlängert wird, sondern lediglich um neun Monate. Ich hoffe und bete, dass Sie es schaffen, in neun Monaten alles so weit hinzubekommen, dass wir den Abzug durchführen und dann den Übergang gestalten können. Da bin ich mal gespannt. Ansonsten wäre es einfacher gewesen, um ein Jahr zu verlängern. Und falls es dann möglich wäre, die Soldaten früher zurückzuholen – es sind ja derzeit nur vier Leute –, hätte man das ja machen können. Diesen Kniff habe ich nicht ganz verstanden. Aber die Abschmelzung der Obergrenze für die Zahl der Soldaten war gut.
Zu unserer Position zur EZ spricht gleich der Kollege in der Beek.
Vielen Dank.
Vielen Dank, Ulrich Lechte. – Nächste Rednerin: für die Fraktion Die Linke Christine Buchholz.
