Okay, ich glaube, die Frage ist jetzt ausreichend beantwortet. – Herr Kollege, fahren Sie fort.
Das hätten wir weiter im Ausschuss diskutieren können.
Ich will noch einmal deutlich machen, was meine Vorredner schon gesagt haben: dass – das ist die Innovation – in einer subsidiären Weise genau dort ein Ansprechpartner da ist, der in den großen Ministerien und in den Bundesverwaltungsämtern so nicht gegeben ist: Face to Face, von Mail zu Mail, von Telefon zu Telefon. Und dann gilt es, die guten Gedanken aufzunehmen, die da sind, und in eine Landschaft hineinzubringen, die tatsächlich einen großen Bedarf an Innovationen hat.
Meine Damen und Herren, von der Nachbarschaftshilfe bis zur Kommunalpolitik haben wir insbesondere dort, wo die Wirklichkeit so ist, dass Menschen weggehen, einen Bedarf, dass jemand anwaltlich an der Seite der Ehrenamtlichen steht. Es wäre ein wirkliches Fehlverhalten oder ein Versäumnis, wenn wir diesen Leuten nicht zur Seite stünden.
Lassen Sie uns diese Stiftung auf den Weg bringen. Sie wird sich beweisen müssen. Ich bin dankbar, dass wir die Anhörung durchgeführt haben und nach der Anhörung mit unserem Antrag noch einmal alle die Probleme auszuräumen versucht haben.
Herr Kollege Patzelt, kommen Sie bitte zum Ende.
Frau Werner, zu Ihnen muss man sagen: Lesen Sie doch mal unseren Ergänzungsantrag! Dann werden Sie sehen, dass wir genau die Probleme, die beanstandet wurden in der Anhörung, aufgegriffen haben.
Leider ist meine Zeit zu Ende.
Vielen Dank, Herr Kollege Patzelt. – Die Kollegin Gitta Connemann ist die letzte Rednerin zu diesem Tagesordnungspunkt. Wenn Sie ihr noch die Chance geben, ihre Rede ungestört zu Ende zu führen! – Liebe Frau Kollegin, Sie haben das Wort.
