Die Übertragungsnetzbetreiber prognostizieren für 2021 eine Unterdeckung der Leistung von 5,5 Gigawatt. Es bleibt völlig unklar, wie diese Lücke geschlossen werden kann. Es gibt keine Strategie, kein Konzept. In Spitzenzeiten werden wir auch nichts vom Ausland bekommen können; denn dort sind die Kapazitäten ebenfalls ausgelastet. Gaskraftwerke sind zu teuer, müssen subventioniert werden und kommen frühestens in zehn Jahren. Dem Bürger werden Kosten aufgebürdet: Kosten ohne Ende, meine Damen und Herren.
Der instabile Strom aus Erneuerbaren hat keine gesicherte Leistung, das heißt, es kann nicht davon ausgegangen werden, dass Strom zu einem benötigten Zeitpunkt X zur Verfügung steht: Wind weht nicht immer, nachts ist es dunkel, und Strom kann industriell nicht gespeichert werden. Ausweichtechnologien wie Wasserstoff oder Brennstoffzellentechnik sind nicht wettbewerbsfähig. Brennstoffzellentechnik gibt es seit 180 Jahren, und das will man uns hier als Zukunft servieren; aber wäre das die Zukunft, hätte sich das schon längst durchgesetzt. Hat es aber eben nicht, weil die Wettbewerbsfähigkeit fehlt.
Die Stromversorgung wird unsicherer; die Netzeingriffe werden mehr und länger. Energieintensive Unternehmen können sich nicht mehr zu 100 Prozent auf die Stromversorgung verlassen. Strom wird Mangelware, die deutsche Energiepolitik zur sozialistischen Mangelwirtschaft, meine Damen und Herren.
Und was bei einem flächendeckenden Stromausfall alles passieren kann, das können Sie durchaus im Bericht des Ausschusses für Bildung, Forschung und Technikfolgenabschätzung von 2011 nachlesen: Nach wenigen Tagen kann es die ersten Toten geben.
Das Erneuerbare-Energien-Gesetz – wir erinnern uns – ist ein planwirtschaftliches Gesetz, führt zu Verwerfungen. Industriebetriebe und solche, die exportieren, sind von der EEG-Umlage teilweise befreit. Und so kommt es, dass zum Beispiel der nicht exportorientierte Bäckereihandwerksbetrieb die EEG-Umlage zahlen muss, das exportorientierte Industrieunternehmen mit den gleichen Waren und gleichen Zielkunden aber nicht. Teigwaren der entlasteten Industriebetriebe – um bei diesem Beispiel zu bleiben – können also preiswerter angeboten werden als die des Handwerkbetriebes. Und das, meine Damen und Herren, ist staatlich verordnete Verzerrung des Wettbewerbs.
Noch ein Wort zur Kernenergie. Wir sollten die Hysterie der vergifteten und ideologischen Diskussionen herausnehmen und jenseits der links-grünen Untergangsfantasien neue Konzepte für neue Reaktoren prüfen und entwickeln. Teile der CDU sind ja ebenfalls dafür. Zu beachten ist dabei, dass die schlimmen Beispiele Fukushima und Tschernobyl bei uns so gar nicht passieren können
und auch die Endlagerproblematik auf dem Weg der Lösung ist.
