Herr Präsident! Liebe Kolleginnen und Kollegen! Vor 25 Jahren erschien in den überregionalen Tageszeitungen eine Anzeige der deutschen Energiekonzerne. In dieser Anzeige wurde behauptet, Sonne, Wind und Wasser könnten nie mehr als 4 Prozent am deutschen Strommix leisten, sonst würde die gesamte Energieversorgung zusammenbrechen. Im Februar dieses Jahres hatten die erneuerbaren Energien bereits einen Anteil von 60 Prozent – ein nie dagewesener Rekord. Das kann man gerne mal abfeiern; denn dieser Erfolg der erneuerbaren Energien ist nicht wegen der Politik dieser Bundesregierung zustande gekommen, sondern trotz der Politik der Bundesregierung.
Gestern sind zwei Studien erschienen, die im Auftrag des Bundesumweltministeriums und des Bundeswirtschaftsministeriums zustande gekommen sind. Das Bundeswirtschaftsministerium und das Bundesumweltministerium haben gefragt: Reicht dieses Klimapaket aus, um die Klimaziele der deutschen Bundesregierung bis 2030 zu erreichen? Die Antwort darauf – und zwar in den Studien, die diese beiden in Auftrag gegeben haben – war ein ganz klares Nein.
Das bedeutet doch: Diese Bundesregierung ist jetzt aufgefordert, dieses Klimapaket in allen Sektoren deutlich nachzuschärfen.
Die Bundesregierung sollte alles tun, um die erneuerbaren Energien entschieden auszubauen;
denn gerade wenn wir Klimaschutz betreiben und den Kohleausstieg erreichen wollen, brauchen wir einen entschiedenen Ausbau der erneuerbaren Energien.
Doch die Energiewende in Deutschland befindet sich in einer Krise. In den letzten drei Jahren haben wir 40 000 Arbeitsplätze im Bereich der Windkraft verloren. Bereits 2012 haben wir 70 000 Arbeitsplätze im Bereich der Solarenergie verloren.
Grund dafür ist eine verfehlte und zu mutlose Energiepolitik dieser deutschen Bundesregierung, die, wenn es so weitergeht, weitere Arbeitsplätze und die Wertschöpfung in ganzen Regionen gefährdet,
und das können wir nicht hinnehmen.
Neben der Wind- ist die Sonnenenergie eine zentrale Säule dieser Energiewende. Immer mehr Menschen packen sich Solaranlagen auf ihre Dächer. Sie speisen erneuerbaren Strom ins Stromnetz ein und bekommen dafür Geld ausgezahlt. Das ist die sogenannte Einspeisevergütung. Vor allem Betreiber von Kleinanlagen, also Menschen, die auf den Dächern ihrer Häuser solche Solaranlagen installieren, bekommen diese Einspeisevergütung.
