Sehr geehrter Herr Präsident! Sehr geehrte Damen und Herren! Ich muss gestehen: Als wir die Aktuelle Stunde hier angemeldet haben, hätte ich mir nicht vorstellen können, dass ich so viel Phrasendrescherei und belangloses Geschwätz zum Thema Zukunft hier heute hören würde.
Hier droht ein Abbau von mehr als 400 000 Arbeitsplätzen, und einige gewerkschaftsnahe Kollegen stellen sich hin und sagen: Ja, das ist halt so. – Es ist unfassbar. Das letzte Mal, als wir das hier diskutiert haben, haben Sie von der Regierungskoalition sich noch hierhingestellt und betont, dass durch Ihre Politik der Umstellung auf E-Mobilität keine Arbeitsplatzverluste entstehen werden. Jetzt haben wir eine Studie von Ihren Experten, und die sagt genau das Gegenteil. Sie sagt genau das, was die AfD-Fraktion von Anfang an gesagt hat: Das Ende des Verbrennungsmotors hat gravierende Konsequenzen für die Arbeitsplätze in der deutschen Automobilindustrie. – Das sagt diese Studie, das sagen wir, und Sie begreifen es nicht.
Was hier auf die deutsche Autobranche zukommt, sind eben nicht die Auswirkungen des technischen Fortschritts, wie das manche hier suggerieren. Einige Politiker hier verbreiten ja sogar das Märchen, die deutsche Automobilindustrie wünsche sich die Umstellung auf Elektromobilität. Das ist entweder eine dreiste Lüge oder Ausdruck erschreckender Unkenntnis.
Die Umstellung auf Elektromobilität in der Automobilbranche folgt den planwirtschaftlichen Vorgaben der Politik. Es ist zukünftig in Europa praktisch unmöglich, Automobile zu verkaufen ohne signifikante Anteile an Elektromobilität.
Für die Hersteller bedeutet das eine Zwickmühle. Einerseits sind die Verbrauchsvorgaben der EU, die Sie zu verantworten haben, zu vermeiden. Andererseits sind Elektrofahrzeuge aufgrund der fehlenden Nachfrage überall in Europa praktisch nur schwer verkäuflich; in vielen Fällen sind sie gar nicht verkäuflich. Das ist der Grund, warum die Automobilbranche immer wieder den Wunsch nach staatlicher Förderung und Subvention von Elektromobilität an Sie richtet.
Sie treiben die Unternehmen in diesem Land in ein marktwirtschaftlich nicht funktionierendes Geschäftsmodell.
