Sehr geehrter Herr Präsident! Meine sehr geehrten Damen und Herren! Herr Komning, Sie haben gleich am Anfang Ihres Redebeitrags zum Besten gegeben, worum es Ihnen eigentlich geht: Es geht Ihnen um Angst, es geht Ihnen um Skandalisierung,
es geht darum, Sorgen zu streuen, indem Sie schreiben: Autoland abgebrannt. – Das war ja der Titel, unter dem Sie diese Aktuelle Stunde eigentlich beantragt haben.
Das zeigt ja, auf welchem geistigen Niveau Sie sich hier bewegen.
Was Sie als AfD tun, ist, Nationalismus nach vorne zu stellen.
Ich bin sicher: Das ist das Letzte, was eine globale Industrie braucht. Was Sie tun, ist, alle Förderungen im Bereich Ladeinfrastruktur streichen zu wollen. Das ist mit Sicherheit das Letzte, was der Autoindustrie in Deutschland hilft. Das, was Sie tun, ist, zu glauben: Wenn alles so bleibt, wie es ist – man möchte eigentlich sagen: wenn alles so ist, wie es mal war –, dann wird schon alles gut. – Das ist Ihre Logik.
Ich muss Ihnen leider sagen: Nein, wenn alles so bleibt, wie es ist oder war, dann wird es noch viel schlimmer, Herr Komning.
Denn das Thema ist viel zu wichtig,
um es mit Ihrer rückwärtsgewandten Logik anzupacken.
