Sehr geehrter Herr Präsident! Meine sehr geehrten Damen und Herren! Die FDP hat ja derzeit gewisse Probleme bei der korrekten Verortung, was bzw. wo die gesellschaftliche Mitte ist. Das passiert ihr auch bei der gesellschaftlichen Verteilung von Einkommen und Vermögen. Da verortet sie auch, wenn man es auf einer X-Achse sieht, die Mitte leider ganz rechts, nämlich bei den Superreichen. Auch hier liegt die FDP falsch.
Sie benennen ein Problem, niedriges Medianvermögen, und haben eine relativ einfache Lösung für alle Probleme, nämlich eine Verbesserung der Aktienkultur. Sie wollen dafür alle vermeintlichen Hemmnisse abbauen und haben ein Sammelsurium an Vorschlägen vorgebracht. Übrigens wollen Sie auch die Altersvorsorge mit dazunehmen und privatisieren. Das ist natürlich Quatsch.
Sie vergessen aber, eines zu erwähnen: eine weiter zunehmende Einkommens- und auch eine weiterhin sehr hohe Vermögensungleichheit in Deutschland. Wen Sie auch nicht erwähnen, sind die reichsten 10 Prozent der Bevölkerung, die die Hälfte des Gesamtvermögens besitzen, und die 40 Prozent der Bevölkerung, die praktisch kein Nettovermögen haben.
Diesen Menschen raten Sie, jetzt mal Aktien zu kaufen.
Das ist frei nach Marie-Antoinette: Wenn sie kein Geld haben, sollen sie Aktien kaufen. – Das ist Quatsch an der Stelle.
Wie sieht denn die Politik für die tatsächliche Mitte der Gesellschaft aus? Wie sieht sozialdemokratische Politik aus? Wir machen eine Mindestausbildungsvergütung für Auszubildende. Dieses Geld landet bei denen in der Tasche.
Wir wollen die Tarifbindung erhöhen, damit ordentliche Löhne gezahlt werden. Den Mindestlohn wollen wir erhöhen.
Eine Stärkung der gesetzlichen solidarischen Rentenversicherung hilft den Menschen
und mehr Steuergerechtigkeit mit einem Spitzensteuersatz, der höher greift, aber Bezieher mittlerer und unterer Einkommen stärker entlastet. Das ist Politik für die Mitte der Gesellschaft.
Diese guten Löhne sind dann auch die Basis für Vermögensbildung. Dann können wir auch über Aktienkultur sprechen.
Da bin ich gar nicht weit weg.
Herr Kollege, einen ganz kleinen Moment. – Ich bitte die Fotografen auf der Tribüne, davon Abstand zu nehmen, die Bänke der Abgeordneten zu fotografieren. Ansonsten muss ich Sie entfernen lassen.
Herr Kollege, Sie haben weiter das Wort.
