Sehr geehrter Herr Präsident! Werte Kolleginnen und Kollegen! Sehr geehrte Damen und Herren auf der Tribüne und vor den Bildschirmen! Lieber Klaus Ernst, ich habe genau zugehört: Sie wollen die Kommunen entschulden. Ich bitte Sie darum: Geben Sie das auch Ihren Kollegen im Bundesland Thüringen zur Kenntnis; denn dort wurden die Kommunen seit dem Beginn der Arbeit der linken Landesregierung finanziell immer weiter nach unten getrieben, und der Gürtel musste immer enger geschnallt werden. Also noch mal die Bitte: Sagen Sie das bitte dem Kollegen Ramelow. Ich freue mich, als Bürgermeister mehr Geld zu bekommen. Danke schön!
Meine Damen und Herren, erst am Mittwoch in dieser Woche präsentierte uns der Vorsitzende der Bundesagentur für Arbeit im Ausschuss einen soliden Haushalt für 2020. Obwohl wir mit mehreren Beitragssenkungen viele Arbeitnehmer und Arbeitgeber entlastet haben, steht die BA trotzdem finanziell ordentlich da, und die Rücklagen bieten weiterhin ausreichend Sicherheiten – was sie auch müssen.
Leider ist der Opposition eine solide Haushaltsführung, glaube ich, nicht wichtig. Entweder haben Sie das Rechnen verlernt, oder es ist Ihnen wirklich unwichtig. Denn Sie wollen diese Sicherheiten wegkatapultieren. Die Plünderung der Rücklagen der BA und der öffentlichen Kassen ist das, was ich in den Anträgen der Opposition sehe, und das können wir natürlich als Regierungsparteien nicht mitmachen. Sie fordern unter anderem ein Investitionsprogramm.
Sie fordern öffentliche Kredite. Sie fordern den erheblichen Ausbau des Kurzarbeitergeldes. Sie fordern eine Erhöhung des Arbeitslosengeldes I, und Sie fordern eine Verlängerung der Bezugsdauer. Fordern, fordern, fordern, meine Damen und Herren.
Sie verstecken hinter der Fassade der Digitalisierung und des Klimaschutzes große populistische Forderungen, bieten aber leider kein ausgereiftes Gesamtkonzept, und das ist schade. Vor allem über die Finanzierung Ihrer Vorschläge lese ich in Ihren Anträgen überhaupt nichts.
Sie fordern hier grenzenlos Leistungen, aber interessieren sich scheinbar nicht für Lösungen. Das ist für mich unseriöse Politik.
– Danke schön.
