Der nächste Schritt dürfte dann sein, dass das Kooperationsverbot mit der Linken aufgehoben wird, wie es Herr Günther fordert. Ich fürchte, Herr Günther setzt sich eher durch als Herr Ziemiak;
denn – so seine Logik – die Hufeisentheorie sei falsch, man könne die AfD nicht mit der Linken vergleichen.
Stimmt, an einem Ende des Hufeisens steht eine demokratische Volkspartei,
am anderen Ende stehen die Erben der Mauermörder,
die noch immer Enteignung und Sozialismus fordern.
Sollte die CDU, anders als Herr Ziemiak jetzt sagt, diesen Weg gehen und beispielsweise Bodo Ramelow ins Amt verhelfen,
„dann wüsste wirklich niemand mehr, wofür die Christdemokraten stehen“, wie es der Kommentator der „Welt“ formuliert hat.
Meine Damen und Herren, uns kann das nur recht sein. Wir wären dann die einzige Oppositionspartei,
und die Union würde die SPD auf dem Weg in die Bedeutungslosigkeit begleiten.
Gut, dass Konrad Adenauer und Helmut Kohl das nicht mehr erleben müssen.
Schade nur, liebe Kollegen von der CDU, dass dann eine bürgerliche Mehrheit auf lange Zeit keine Machtoption mehr sein dürfte.
Danke schön.
Nächster Redner in der Debatte ist für die Fraktion der SPD der Kollege Carsten Schneider.
