Aber während die Bundesregierung dabei versagt, die Mieten wirkungsvoll zu deckeln, hat jetzt Berlin mit Rot-Rot-Grün und mit einer linken Bausenatorin
endlich das erste wirkungsvolle Gesetz zu einem Mietendeckel in einem Bundesland vorgelegt. Diesem guten Beispiel sollten weitere Bundesländer folgen.
Ausgerechnet diejenigen, die hier seit Jahren jeden wirkungsvollen Mieterschutz verhindern, ziehen jetzt vor das Bundesverfassungsgericht, um den Berliner Mietendeckel zu verhindern, nämlich CDU, FDP und AfD, also das gleiche unheilvolle Bündnis,
das sich kürzlich erst in Thüringen blamiert hat.
Sie bitten also das Bundesverfassungsgericht um die alleinige Zuständigkeit für ein Thema, bei dem Sie doch jahrelang überhaupt nicht gehandelt haben. Ich finde das wirklich unanständig.
Millionen Mieterinnen und Mieter erhoffen sich von diesem Mietendeckel endlich die Atempause, die sie verdient haben. Sie wollen sie verhindern und sind auch noch stolz darauf, posten Fotos im Internet, die zeigen, wie Sie die Klage unterschreiben. Ich finde, Sie sollten sich wirklich schämen.
Ein letztes Wort zur AfD: Sie haben hier Wahlkampf gemacht und die etablierten Parteien beschimpft. Kaum sind Sie in den Bundestag eingezogen, streichen Sie eine fette Spende von einem Berliner Baulöwen ein,
und als kleines Dankeschön reichen Sie dann eine Klage gegen den Mietendeckel ein. Das ist doch wirklich Bestechung. Das ist gekaufte Politik.
Das werden wir als Demokratinnen und Demokraten niemals akzeptieren.
Nächster Redner ist der Kollege Christian Kühn, Bündnis 90/Die Grünen.
