Nein, danke.
Das muss ich nicht haben. Bei dieser Fraktion kann man wirklich nur noch sagen: grausam.
Meine Damen und Herren, es gibt in Deutschland eine große Bereitschaft bei Bundesländern, Gemeinden und Städten. 138 haben ihre Aufnahmebereitschaft bereits kundgetan. Nehmen wir zum Beispiel Berlin: Die Sozialsenatorin hat angekündigt, sie könnte sofort 2 000 Plätze zur Verfügung stellen. Das ist doch ausgezeichnet.
Wer macht ihnen einen Strich durch die Rechnung? Darum sollte sich mal die FDP kümmern. Es ist Herr Seehofer. Er könnte ohne Weiteres – das steht übrigens in unseren Anträgen drin – den Kommunen die Genehmigung erteilen, dies durchführen.
Natürlich muss dies auch entsprechend gefördert werden.
Frau Kollegin, kommen Sie zum Schluss, bitte.
Die Kommunen müssen unterstützt werden.
Die Möglichkeit einer europäischen, solidarischen Lösung ist nur dann gegeben, wenn wir endlich den Anfang machen und nicht nur auf alle möglichen anderen EU-Staaten starren, die nichts tun wollen.
Vielen Dank. – Nächster Redner ist der Kollege Detlef Seif, CDU/CSU-Fraktion.
