Sehr geehrte Frau Präsidentin! Meine Damen und Herren! Man kann fast sagen: Endlich wieder Cum/Ex! Ich habe es schon fast ein bisschen vermisst. Ich war in der letzten Legislaturperiode Mitglied des Untersuchungsausschusses, in dem wir uns anderthalb Jahre mit dieser Frage beschäftigt haben. Man hat schon ein bisschen Sehnsucht gehabt und gehofft, dass das Thema hier wieder auf die Tagesordnung kommt.
Ich habe den Antrag der Grünen, der schon ein bisschen älter ist, und den der Linken aufmerksam gelesen. Bis jetzt habe ich aber noch nicht so ganz verstanden, was eigentlich der Anlass dafür ist, warum wir heute wieder darüber sprechen müssen.
Wir können aber gerne die Zeit nutzen und noch einmal darstellen, was in diesem Untersuchungsausschuss herausgekommen ist. Es gibt einen über 1 000-seitigen Bericht; den kann man gerne lesen. Wir haben in den eineinhalb Jahren viele Zeugen vernommen und dabei auch Dinge erfahren, die man gar nicht geahnt hat; das gebe ich zu. Wir haben in dem Ausschuss aber festgestellt, dass die Finanzbehörden sachgerecht und pflichtgemäß gehandelt haben.
Hier wird immer wieder erzählt, wie viele Milliarden es sein sollen. Wir haben hier zig Sachverständige angehört, und keiner konnte uns darlegen, wie hoch der Schaden tatsächlich ist,
insbesondere – Frau Paus, das wissen Sie auch – weil zahlreiche Kapitalertragsteuern gar nicht ausgezahlt worden sind, weil es gute Mitarbeiter beim Bundeszentralamt für Steuern gegeben hat und gibt, die das verhindert haben. Von daher sollten wir denen sehr dankbar sein.
Wir haben in dem Bericht festgestellt, dass diese Cum/Ex-Geschäfte rechtswidrig waren. Wir haben aber auch darauf hingewiesen, dass das bis heute gar nicht höchstrichterlich entschieden ist. Wir sind aber zu der Auffassung gelangt, dass es keine Gesetzeslücke, sondern schlicht Steuerbetrug war,
wie das Landgericht Bonn jetzt wohl auch entscheiden wird; denn es kann nicht sein, dass eine Steuer, die einmal gezahlt wird, zweimal erstattet wird. Von daher haben wir da für Klarheit gesorgt.
Die Grünen sagen jetzt: Wir müssen den Cum/Ex-Steuerskandal beenden. – Wir haben dem Cum/Ex-Handel bereits am 1. Januar 2012 durch das OGAW-IV-Umsetzungsgesetz den Garaus gemacht. Es gibt seitdem kein Cum/Ex mehr, und es ist gut, dass wir das damals mit dem Gesetz so geregelt haben.
In diesem Zusammenhang wird immer gleich auch Cum/Cum angesprochen. Die Gemeinsamkeit besteht eigentlich nur in dem Wort „Cum“; denn Cum/Ex und Cum/Cum sind zwei völlig verschiedene Dinge. Bei Cum/Ex ist, wie gesagt, eine Steuer einmal gezahlt und zweimal erstattet worden. Bei Cum/Cum ist eine Steuer einmal gezahlt und dann erstattet worden. Es ist also ein Steuerarbitrage-Geschäft gemacht worden, und die Frage ist, ob man das will. Aber auch dem haben wir mit dem Investmentsteuerreformgesetz im Jahre 2016 einen Riegel vorgeschoben,
indem wir mit § 36a Absatz 2 des Einkommensteuergesetzes eine 45-Tages-Frist eingeführt haben,
