Frau Präsidentin, ich verspreche: Da ist auch etwas für Sie dabei.
Gut.
Frau Präsidentin! Liebe Kolleginnen und Kollegen! Wir beraten heute ein Gesetz abschließend, das zwei Bereiche betrifft, die unterschiedlicher nicht sein könnten. Zum einen geht es um die Regelung für den Finanzmarkt, zum anderen betrifft dieses Gesetz die Landwirtschaft in unserem Land. So unterschiedlich diese beiden Bereiche auch sein mögen, eine Sorge verbindet die beiden: Es geht um den Schutz der Steuerzahlerinnen und Steuerzahler. Es kann nicht sein, dass Gewinne privat eingestrichen, aber Verluste der Allgemeinheit auferlegt werden.
Dem wollen wir auch durch diese Vorschriften vorbeugen.
Im Bereich des Finanzmarktes treffen wir Regelungen zu sogenannten zentralen Gegenparteien. Zentrale Gegenparteien sind wichtige Akteure im internationalen Finanzmarkt. Bei bestimmten Handelsaktivitäten treten sie als Käufer und Verkäufer auf. Sie stellen eine verlässliche Abwicklung von Handelsgeschäften sicher. Sie wirken als Stabilisatoren. Sie sorgen in einem Marktsegment für Transparenz, welches in der Finanzkrise 2008 intransparent war; auch deshalb war die Finanzkrise 2008 so möglich.
Wesentliche Teile des Derivatehandels wurden bilateral und an der staatlichen Aufsicht vorbei abgewickelt. Staatliche Aufsichtsstellen waren in der Krise blind. Es war nicht möglich, rechtzeitig angemessene Maßnahmen zu ergreifen. Deshalb, Kolleginnen und Kollegen, haben die G-20-Staaten für die Marktteilnehmer die Pflicht eingeführt, bestimmte außerbörsliche Derivategeschäfte über zentrale Gegenparteien abzuwickeln. Das schafft Transparenz und dämpft das Bewertungsrisiko. Damit wird für Finanzstabilität gesorgt.
Jetzt gilt es aber, diese Stabilisatoren selbst widerstandsfähiger zu machen.
