Dennoch ist es ein Problem, wenn jene, die hart arbeiten, auf keinen grünen Zweig kommen. Die Linke will den Grundfreibetrag anheben und Einkommen bis 7 100 Euro brutto im Monat entlasten. Der Spitzensteuersatz muss später greifen, aber wieder so hoch sein wie unter Helmut Kohl.
Die FDP will keine Erhöhung des Grundfreibetrags, ab dem man überhaupt erst Steuern zahlt.
Sie wollen den Bereich im Steuertarif, in dem man mit bis zu 24 Prozent besteuert wird, leicht abflachen. Auf Deutsch: keine Entlastung der geringsten Einkommen und eine kleine Entlastung mittlerer Einkommen. Die größte Entlastung von über 3 000 Euro – der Kollege Binding hatte danach gefragt, und ich übernehme die Antwort – soll bei der FDP bei einem zu versteuernden Einkommen von 90 000 Euro greifen, also etwa 102 000 Euro brutto bei einem alleinstehenden Beschäftigten.
Inklusive der vollständigen Abschaffung des Soli nimmt die Steuerentlastung von der FDP bei den Reichsten aber ständig zu. So entlasten Sie zu versteuernde Einkommen von 5 Millionen Euro im Jahr um 126 000 Euro. Das ist unanständig.
Ihr Antrag kostet inklusive Abschaffung des Soli 30 Milliarden Euro im Jahr. 30 Milliarden Euro: Das sind 1 Million Euro für jede Schule in Deutschland.
Das ist so teuer wie der Cum/Ex- und Cum/Cum-Skandal jedes Jahr und 60-mal so teuer wie der Mautskandal von Andi Scheuer.
Wenn man mehr investieren und wie die FDP auch die Steuern für Konzerne senken will, gibt es dafür nur eine Lösung: Man muss Renten und Sozialausgaben kürzen. Das macht Die Linke niemals mit.
Ich muss mich beeilen, weil Herr Kubicki hinter mir sitzt. – Die FDP will Bundestagsabgeordnete entlasten, Die Linke Bäcker, Krankenschwestern und Polizisten. Das ist der Unterschied. Wer die Mitte entlasten will, muss die Reichsten in die Pflicht nehmen. Die FDP darf anrufen, wenn sie mitmachen will.
Herr Kollege De Masi, Sie müssen sich nicht beeilen, weil ich hinter Ihnen sitze, sondern weil die Zeit weiterläuft. Das ist das Entscheidende. – Nächster Redner für die Fraktion Bündnis 90/Die Grünen ist der Kollege Dr. Wolfgang Strengmann-Kuhn.
