Herr Präsident! Meine sehr geehrten Damen und Herren! Ohne Zweifel stehen der Automobilstandort Deutschland und die damit verbundenen Hunderttausende Arbeitsplätze vor großen Herausforderungen. Wir lesen es jeden Tag in der Zeitung. Heute äußert sich beispielsweise der Chef von Volkswagen, wie sich sein Unternehmen diesen Herausforderungen stellen will. Wir wollen das politikseitig begleiten. Ich freue mich vor allen Dingen darüber, dass die deutsche Automobilindustrie sich dieser Herausforderungen bewusst ist. Es bedarf mit absoluter Sicherheit nicht dieser Aktuellen Stunde, die die AfD verlangt hat.
Meine Damen und Herren, wenn ich hier den Kollegen Ulrich höre, der sagt: „Die AfD ist das größte Problem der Automobilindustrie“, dann kann ich Ihnen nur entgegenrufen: Sie sind ein nicht minder großes Problem.
Wenn ich mich an die Äußerungen Ihrer Fraktionskollegin Leidig erinnere, die sich hier immer dann in einem an sich nicht zu übertreffenden Zynismus freut, wenn es der deutschen Automobilindustrie und damit auch den Beschäftigten an den Kragen geht, muss ich sagen: Das sollten Sie sich mal hinter den Spiegel stecken.
Meine Damen und Herren, eines ist auch ziemlich klar: Alternative Antriebe, Elektromobilität, synthetische Kraftstoffe – das sind die Themen der Zukunft. Hinzu kommt autonomes Fahren. Dort wird investiert, im Übrigen nicht nur vom Bund, dem ich dafür ganz herzlich danke, sondern auch von den Ländern. In meiner Heimatregion Braunschweig, in Wolfsburg, ist jüngst ein Testfeld für autonomes Fahren eröffnet worden. Das findet internationale Beachtung.
Richtigerweise ist gesagt worden, dass sich das Mobilitätsbedürfnis und das Mobilitätsverhalten verändern. Im Übrigen verändert sich auch die Produktion von Fahrzeugen ziemlich dramatisch. Es ist ein abenteuerlicher Irrglaube, zu meinen, dass wir beispielsweise im Jahr 2030 uns hier noch über eine Automobilindustrie unterhalten werden, wenn wir uns, wie Sie das tun, vorstellen, dass die Fahrzeuge und die Produkte dann aussehen, wie sie vor 20 Jahren ausgesehen haben. Dann ist hier nämlich in diesem Punkt Stille.
– Herr Spaniel, zu Ihnen kommen wir später noch.
Meine Damen und Herren, wir müssen mal eines sehen – in Ihrer engen Begrenztheit sind Sie überhaupt nicht auf die Idee gekommen, das anzusprechen –: Drei von vier Fahrzeugen der deutschen Automobilindustrie werden exportiert.
Und Sie haben die abenteuerliche Vorstellung, dass wir alleine mit nationaler Regulierung hier einen großen Einfluss ausüben können.
Ehrlich gesagt: Denken Sie mal 150 Kilometer weiter. Es fällt Ihnen schwer, wir sehen das immer wieder; aber das Weltgeschehen ist dafür der maßgebliche Faktor.
Meine Damen und Herren, wir haben nun mal mit dem Problem zu kämpfen, dass die weltweite Automobilproduktion und der weltweite Automobilabsatz im Jahr 2019 um 5 Prozent, mithin um über 4 Millionen Einheiten, zurückgegangen sind.
– In den USA noch viel stärker; Sie sind da leider nicht à jour.
