Einen letzten Aspekt möchte ich besonders hervorheben. Es geht um die Frage, ob die derzeitige Situation an der türkisch-griechischen Grenze rechtswidrig ist. Machen Sie sich doch mal Gedanken über diejenigen, die sich derzeit an der türkisch-griechischen Grenze befinden. Das sind zu 100 Prozent Menschen, die bereits in der Türkei sicher aufgenommen waren.
Das sind Menschen, insbesondere aus Afghanistan, den Maghreb-Staaten usw., bei denen die Schutzquote in der Europäischen Union unter 30 Prozent liegt.
Wir sind nicht mehr bereit, das Asylsystem als Missbrauchsmöglichkeit zu erlauben für Menschen, die zu uns kommen wollen.
Wir sind dafür, dass diejenigen, die den Schutz verdienen, ihn auch erhalten,
aber bitte keinen Missbrauch.
Danke schön.
Vielen Dank, Herr Kollege Seif. – Nächste Rednerin ist für die SPD-Fraktion die Kollegin Dr. Eva Högl.
