Herr Präsident! Meine sehr verehrten Damen und Herren! Ja, die Verlängerung der Mietpreisbremse ist längst überfällig. Deswegen haben wir sie als Linke hier auch mehrfach beantragt.
Aber eine Verlängerung der Mietpreisbremse muss natürlich mit einer grundlegenden Nachbesserung der Mietpreisbremse verbunden sein. In ihrer jetzigen Form wirkt sie ja offenbar nicht.
Allein hier in Berlin haben sich die Preise bei neuen Mietverträgen in den letzten zehn Jahren mehr als verdoppelt. Daran haben auch fünf Jahre Mietpreisbremse nichts geändert, und in vielen anderen deutschen Städten sieht es nicht besser aus. Also die Einschätzung, dass sich die Mietenexplosion jetzt dank der Mietpreisbremse verlangsamt, können wir als Linke nicht teilen.
Wenn es so wäre, wäre das weniger auf die Mietpreisbremse zurückzuführen als darauf, dass sich einfach niemand mehr findet, der diese Mondpreise überhaupt noch bezahlen kann. In den Speckgürteln der Metropolen geht es mit der Mietenexplosion jetzt erst richtig los. Es gibt also leider keinen Grund zur Entwarnung.
Deswegen fordern wir hier als Linke im Übrigen schon seit zehn Jahren: Wenn die Mietpreisbremse wirklich wirken soll, dann muss sie wirklich bremsen und darf nicht noch die Möglichkeit, die Mietpreise um 10 Prozent über der ortsüblichen Vergleichsmiete zu erhöhen, gesetzlich vorsehen. Sie muss flächendeckend gelten, anstatt es jedem Land zu überlassen, mit eigenen Rechtsverordnungen das Ganze noch mal rechtssicher auszugestalten. Außerdem muss sie auch ohne Ausnahmen gelten.
Denn was passiert? Viele Vermieter flüchten sich in teure Modernisierungen und in die Vermietung möblierter Wohnungen, weil Modernisierungen und möblierte Wohnungen aus der Mietpreisbremse ausgenommen sind. Das muss sich endlich ändern.
Schließlich, meine Damen und Herren: Ein Gesetz kann eben nur wirken, wenn Verstöße auch wirklich bestraft werden. Aber wer die Mietpreisbremse umgeht, bleibt straffrei – und das kann einfach nicht sein.
Die Koalition rühmt sich heute mit der Einführung der Rückzahlungspflicht. Zu viel verlangte Miete soll nun also von Mietbeginn an zurückgezahlt werden. Das finden wir richtig; das fordern auch wir Linke seit vielen Jahren. Doch leider gilt in dem Entwurf, der jetzt zur Abstimmung steht, die Rückzahlungspflicht nur für neue Mietverträge. Das war ursprünglich anders vorgesehen. Das heißt aber in der Praxis: Wer in den letzten fünf Jahren von seinem Vermieter geprellt wurde, bekommt sein Geld eben nicht von Mietbeginn an zurück. Die Vermieter bleiben also straffrei und dürfen die zu viel geforderte Miete auch noch behalten. Das ist keine Reform; das ist doch Augenwischerei.
Nein, meine Damen und Herren, eine wirkliche Reform der Mietpreisbremse ist das nicht. Der Gesetzentwurf kommt zu spät und greift zu kurz. Mit halbherzigen Reförmchen bekommen wir den Mietenwahnsinn nicht in den Griff.
Auch dieses Mal war es die Union, die den Gesetzentwurf verwässert und sinnvolle Vorschläge aus dem Justizministerium zum Nachteil der Mieterinnen und Mieter beschnitten hat. Auch hier erweist sich die Union eben nicht als Verbündete der Mieterinnen und Mieter, sondern als Gegnerin der Mieterinnen und Mieter.
Sie machen einfach Politik für diejenigen, die vom Mietenwahnsinn profitieren. Das ist die Wahrheit;
denn was für die einen der Mietenwahnsinn ist, ist der Gewinn für die anderen.
