Bisher war es in der Straßenverkehrs-Ordnung so geregelt, dass man in der Regel hintereinander fährt. Wir kennen aber die Ausnahmen bei Rennradfahrern, dass man ab gewissen Größenordnungen zu zweit nebeneinander fahren muss. Alles hatte seinen Sinn;
aber wir probieren neue Dinge aus.
Wir möchten die Sicht im Kreuzungs- und Einmündungsbereich verbessern. Deswegen werden die Parkverbotszonen etwas besser geregelt. Man darf also im Kreuzungsbereich auf der Fläche von mindestens fünf Metern vom Beginn der Eckausrundung von Bordsteinkanten nicht mehr parken.
Für Lastenfahrräder werden wir ein Piktogramm einführen. Das ist ganz wichtig. Wir werden ein Verkehrszeichen „Radschnellweg“ einführen. Wir werden ein Verbot des Überholens von Radfahrern einführen. Das haben wir uns in den Niederlanden als Verkehrsausschuss angeguckt: Es gibt dort Zonen, in denen große Schilder stehen mit der Aufschrift: „Autofahrer, ihr seid hier Gast“.
Dort gibt es auch wenige Autofahrer, ganz klar. Die Autofahrer bekommen den Hinweis: Ihr dürft hinter den Fahrradfahrern fahren, aber ihr dürft sie nicht überholen. – Die Möglichkeit, dies durch ein entsprechendes Schild einzuführen, werden wir den Kommunen einräumen. Deswegen war es eine erfolgreiche Reise in die Niederlande.
Wir möchten eine Öffnung der Einbahnstraßen für den Radverkehr auch im Gegenverkehr erleichtern. Wir möchten die Haifischzahnmarkierung einführen, wie sie in anderen Ländern schon mehrfach gut erprobt ist. Wir möchten die Fortführung der Radfahrstreifen vor Grundstückszufahrten, damit nicht bei jeder Grundstückszufahrt der Radfahrweg plötzlich aufhört. Auch hier sind Erleichterungen möglich.
Wir möchten auch eine Erhöhung der Geldbußen bei Parkverstößen mit Bezug zum Radverkehr. Das gilt für das Parken in zweiter Reihe, das gilt für unzulässiges Parken auf Geh- und Radwegen sowie auf Schutzstreifen. Alles das möchten wir anpassen, damit es den Radfahrern besser geht.
Wir möchten die Vision Zero als Leitgedanken in die Straßenverkehrs-Ordnung einführen. Das ist uns ganz wichtig. Ich mache darauf aufmerksam: Wir möchten in den Städten einen besseren Verkehrsfluss, mehr Sicherheit, mehr Freude beim Fahrradfahren. Das ist nicht nur für die Menschen gut, sondern auch für die Umwelt.
Das Wort hat der Abgeordnete Wolfgang Wiehle für die AfD-Fraktion.
