– Doch, es ist ein Fortschreiben. Genau die gleichen Standards, die seit zehn Jahren gelten, sollen jetzt weiter gelten, und das kann nicht das Ziel eines neuen Gesetzes sein.
Wenn wir im Jahr 2050 einen klimaneutralen Gebäudebestand haben wollen, dann müssen Sie jetzt mit einem vernünftigen Gesetz genau diese Maßnahmen umsetzen. Es ist wichtig, dass das, was Bauwirtschaft, Gebäudetechnik, Erneuerbare-Energien-Branche zur Verfügung stellen, um energiesparende, erneuerbar beheizte Gebäude zu errichten, endlich auch genutzt wird. Die Branchen brauchen die Verlässlichkeit aus der Politik, um als Unternehmen auch planen und richtig investieren zu können. Geben Sie ihnen also endlich die Leitplanken, die nötig sind.
Noch mal zur Erinnerung: Die Gesetze und Verordnungen, die die Regierung jetzt in diesem Gebäudeenergiegesetz zusammenführen will, sind bis zu zehn Jahre alt. Wir haben gerade von Carsten Müller gehört, da sei noch Luft nach oben. Die Union scheint es offenbar noch für möglich zu halten, diese Effizienzstandards weiter anzuheben. Von der SPD höre ich gerade großes Mauern. Das stört mich.
Inzwischen gab es das Pariser Klimaschutzabkommen, das die Bundesregierung und auch dieses Parlament angenommen haben. Diesen Beschluss muss die Regierung jetzt auch endlich in die Tat umsetzen. Ihr habt uns letztes Jahr weismachen wollen, dass ein Klimaschutzgesetz CO
Vielen Dank.
Vielen Dank, Frau Kollegin. – Der nächste Redner: der Kollege Dr. Andreas Lenz, CDU/CSU-Fraktion.
