lassen Sie konsequenterweise gleichzeitig auch noch die Solarbranche hängen. Diese Dialektik versteht nur, wer auch in 15 Jahren ohne Ende Kohlestrom produzieren will. Kommen Sie endlich mal im 21. Jahrhundert an, Herr Koeppen!
Angeblich sind sich doch alle einig, oder? Das Bundeskabinett hat die Abschaffung des Deckels schon im Oktober beschlossen. Der Bundesrat hat die Abschaffung des Deckels beschlossen. Es fehlt einzig und allein noch ein Beschluss in diesem Parlament. Und die Menschen sind es echt leid, dass einige wenige Energiewendesaboteure aus der Unionsfraktion den weiteren Ausbau der Solarenergie blockieren.
Ihr Klimapaket vom September basierte auf Ihrer Behauptung, dass der Ausbau der erneuerbaren Energien bis 2030 vorangeht. Das alles fällt nun wie ein Kartenhaus zusammen.
Die Menschen lassen sich nichts mehr vormachen. Die Behauptung in Ihren Sonntagsreden, Sie seien für die erneuerbaren Energien, glaubt doch kein Mensch mehr. Also, übernehmen Sie endlich Verantwortung!
Ziehen wir dieses Gesetz jetzt schnell durch das Verfahren – was angeblich alle wollen –, bringen es nächste Woche wieder hier zum Beschluss.
Setzen wir um, was der Bundesrat will, was die Länderkammer will. Das wäre nicht nur das einzig energie- und klimapolitisch Verantwortbare; es wäre auch endlich mal ein Hauch moderner und solider Wirtschaftspolitik.
Vielen Dank.
Vielen Dank, Frau Kollegin. – Nächster Redner ist für die CDU/CSU-Fraktion der Kollege Dr. Andreas Lenz.
