Vielen Dank, Herr Präsident. – Liebe Kolleginnen und Kollegen! Die meisten werden sich erinnern: Vor einem Jahr haben wir hier im Hause die Feierstunde „100 Jahre Frauenwahlrecht“ begangen. Ich möchte daran erinnern, dass beide Festrednerinnen, Rita Süssmuth und Christine Bergmann, sehr viel fraktionsübergreifenden Applaus bekommen haben, und zwar für ihre Kritik daran, dass wir hier zu wenig Frauen haben, und für die Aufforderung, etwas daran zu ändern.
Ich befürchte, ehrlich gesagt, dass der Beifall weniger dem Inhalt als der Höflichkeit geschuldet war, sonst würden auf unserem Gruppenantrag nicht nur Linke und Grüne stehen, oder es gäbe andere Initiativen und konkrete Vorschläge, um Parität in das Wahlrecht einzuschreiben.
In unserer interfraktionellen Gruppe für mehr Frauen in die Parlamente waren wir uns in mindestens drei Punkten einig. Ich glaube, wir sind es immer noch.
Erstens. 30 Prozent Frauen im Bundestag sind viel zu wenig.
Zweitens. Dass in keinem Parlament dieses Landes Frauen und Männer zur Hälfte sitzen, geht gar nicht.
Drittens. Dass die Zahl sogar sinkt, muss dringend umgekehrt werden.
In der Linken ist das übrigens selbstverständlicher Konsens für alle. Deshalb quotieren wir unsere Listen und diskutieren engagiert verschiedene Wege, um Parität in den Parlamenten zu erreichen. Wir haben auch einen eigenen Gesetzentwurf entwickelt. Aber uns ist klar, dass Änderungen im Wahlrecht, die dazu führen, dass mehr Frauen in die Parlamente kommen, nur erreicht werden können, wenn es ein gemeinsames Vorgehen aus der Mitte des Bundestages gibt.
Liebe Kolleginnen und Kollegen, die heute diskutierte Initiative fordert doch nicht einmal viel. Im Endeffekt will sie den Beifall aus der Feierstunde festschreiben und uns verpflichten, konkrete Schritte gemeinsam zu erarbeiten. Es ist ein Minimalkonsens. Wer selbst das nicht zulassen will, hat anscheinend mächtig Muffensausen.
Ein paar Worte zur SPD. Ich habe gehört, dass ihr sagt: Es ist zu spät für die Kommission; es muss jetzt die anstehende Wahlrechtsreform genutzt werden. – Okay, hier wäre ich sogar dabei, wie wahrscheinlich alle anderen auch. Aber ihr müsst mir das erklären. Die Kommission kommt seit dem Sommer nicht zustande, weil sie in der Union nicht durchsetzbar war. Woher nehmt ihr die Hoffnung, dass ihr mit der Regierungsfraktion tatsächlich Änderungen im Wahlrecht erreicht? Das ist, liebe Kolleginnen und Kollegen, eine Beerdigung erster Klasse der anstehenden Wahlrechtsreform und der Kommission. Das verstehe ich wirklich nicht.
Gestatten Sie eine Zwischenfrage der Kollegin Mast?
