Fraglos wird die Situation auch durch die gesetzlichen Regelungen aus der Zeit der Wiedervereinigung komplizierter. Denn es ist auch unklar, ob das enteignete Privateigentum der Hohenzollern heute überhaupt noch zurückgefordert werden kann; denn der Deutsche Bundestag hat 1994 per Gesetz die Wertentscheidung getroffen, dass enteignetes Vermögen nicht zurückgefordert werden kann, wenn dem nationalsozialistischen System erheblich Vorschub geleistet worden ist.
Was aber unter der Formulierung „erheblich Vorschub leisten“ zu verstehen ist – damit ist es eben ein wirklich unbestimmter Rechtsbegriff –, ist ebenso schwierig rechtlich zu definieren wie tatsächlich festzustellen. Aus der öffentlichen Debatte wissen wir – das ist hier eben auch schon angesprochen worden –, dass renommierte Historiker hinsichtlich dieser Frage durchaus zu entgegengesetzten Ergebnissen kommen. Um hierüber nicht jahrelang vor Gericht zu verhandeln, lohnt es, zunächst einmal zu versuchen, auf dem Verhandlungswege zu einer Einigung zu kommen. Davon kann unter Umständen auch die Allgemeinheit profitieren.
Denn der Weg der Linken, gerichtlich Zugesprochenes durch Vergesellschaftung gegebenenfalls wieder zu enteignen, ist jedenfalls kein schlüssiger Vorschlag; denn da beißt sich die Katze doch in den Schwanz. Enteignungen sind in der Bundesrepublik nach dem Grundgesetz natürlich zu entschädigen.
Als rheinischer Katholik und mithin „Beutepreuße“ stehe ich sicherlich nicht im Verdacht, Parteigänger der Preußen zu sein.
Es geht mir vielmehr um den republikanischen Geist, das allgemeine Gesetz als Maßstab des politischen Handelns zu sehen, und nicht die möglicherweise willkürliche Einzelfallentscheidung aus überhöhter Emotion.
Vielen Dank.
Vielen Dank, Herr Heveling. – Nächster Redner: für die AfD-Fraktion Dr. Marc Jongen.
