Sie sind ja so gut zu mir. Vielen Dank, dass ich die Frage stellen darf. – Beim Stichwort „Gäubahn“ greife ich natürlich gerne ein. Es geht um drei Ausbauabschnitte, Herr Kollege.
Für den einen Ausbauabschnitt, Horb–Neckarhausen, besteht Baurecht seit zwei Jahren. Der Finanzierungsvertrag ist unterschrieben; das Geld ist da. Die Deutsche Bahn könnte die Bagger anrollen lassen. Was wollen Sie da mit einem Beschleunigungsgesetz?
Bei den zwei anderen Abschnitten geht es um die ungeklärte Frage des Einsatzes von Neigetechnikzügen. Nur dann, wenn Neigetechnikzüge gesichert zum Einsatz kommen, macht der Ausbau an diesen Stellen Sinn. Wie wollen Sie die Frage der Neigetechnikzüge, bitte schön, über ein Gesetz klären?
Also: Der Ausbau aller drei Ausbauabschnitte kann durch das Gesetz nicht beschleunigt werden.
Herr Kollege Gastel, wenn Sie schon einen südbadischen Verkehrspolitiker auf die Gäubahn ansprechen, sollten Sie sich im Detail noch besser auskennen. Was Sie ansprechen, ist der Abschnitt zwischen Horb und Neckarhausen. Der ist genau 6 Kilometer lang. Der ist tatsächlich planfestgestellt und könnte gebaut werden. Aber für den übrigen Streckenverlauf der Gäubahn gibt es keine fertige Planung und keinen Planungsbeschluss.
Deshalb wäre die Gäubahn genau richtig für dieses Gesetz gewesen: um es zu beschleunigen. Alles andere ist ehrlicherweise ein Skandal für die Verkehrspolitik in Baden-Württemberg.
Meine sehr geehrten Damen und Herren, wir schaffen die Voraussetzungen für klimafreundliche Mobilität. So haben wir zum Beispiel die Mittel für die Verkehrsinfrastruktur erhöht; bereits in diesem Jahr verdoppeln sich die Mittel des Gemeindeverkehrsfinanzierungsgesetzes von 332 Millionen Euro auf 665 Millionen Euro. Ab 2021 steht sogar 1 Milliarde Euro zusätzlich zur Verfügung. Ich frage Sie ernsthaft: Wann hat es das in der Verkehrspolitik in Deutschland jemals gegeben? Das ist doch positiv, und das könnten Sie heute eigentlich auch loben.
Wir schaffen mehr Stellen bei den zuständigen Planungsbehörden. So bekommen das Eisenbahn-Bundesamt und die Wasser- und Schifffahrtsverwaltung rund 200 neue Stellen. Und wir vereinfachen die Planungs- und Genehmigungsverfahren, ohne dabei – auch das ist übrigens eine Mär aus manchem grünen Verkehrsministerium dieses Landes – auf die Öffentlichkeitsbeteiligung zu verzichten. Es ist wichtig, auch die Anwohner frühzeitig mit einzubinden.
Mehr Geld und mehr Personal führen zu schnelleren Verfahren. Denn es ist doch eines klar: Am Ende ist entscheidend, was bei den Menschen ankommt. Es kann nicht sein, dass wir in Deutschland mittlerweile Verfahren haben, die über Generationen hinweg dauern.
Ganz viele Menschen setzen sich dafür ein, dass sich das ändert; aber am Ende müssen wir an kleinen Schräubchen drehen, damit es eben endlich schneller geht. Helfen Sie mit! Wir haben die Gesetze dafür vorgelegt und arbeiten weiter daran.
Vielen Dank. – Nächster Redner ist für die Fraktion der AfD der Kollege Leif-Erik Holm.
