Herr Präsident! Liebe Kolleginnen und Kollegen! Nach dem interessanten, eher die Vergangenheit betreffenden Scharmützel sollten wir uns, glaube ich, wieder den aktuellen Fragen zuwenden. Da muss man sich einfach vor Augen führen, dass wir uns hier ein Jahr lang haben anhören müssen: Das Ergebnis der Kohlekommission wird eins zu eins umgesetzt. – Es gab keine energiepolitische Debatte, in der der Minister und Vertreter der Koalitionsfraktionen das nicht immer wieder mantrahaft gesagt haben.
Wir als Grüne haben gesagt: Gut, das ist nicht unser Kompromiss gewesen – wir waren auch gar nicht für diese Kommission; wir waren als Fraktion auch gar nicht darin vertreten –, aber wir tragen das mit – wir haben das hier sogar eingebracht –, weil wir es als richtig und notwendig erachtet haben, dass 28 Vertreter gesellschaftlicher Gruppen den Kohleausstieg einleiten.
Meine Damen und Herren, ich kann Ihnen das an dieser Stelle jetzt nicht ersparen: Das, was da im Kabinett beschlossen worden ist, ist bei Weitem nicht die Eins-zu-eins-Umsetzung. Das kann niemand abstreiten; das ist objektiv so. Vor allen Dingen bezogen auf den Klimaschutz, um den es hier geht, erfolgt keine Eins-zu-eins-Umsetzung.
Herr Vassiliadis bekommt fast 5 Milliarden Euro für die Beschäftigten. Ich gönne ihnen das; das ist alles richtig und gut. Die Länder bekommen 40 Milliarden Euro an Strukturhilfe. Das ist notwendig und richtig. Die vier betroffenen Länder haben am Abend bei der Kanzlerin noch ein Fraunhofer-Institut als Zuckerli obendrauf bekommen. Auch das ist gut; dagegen habe ich nichts. RWE und LEAG bekommen aber fast 4 Milliarden Euro an Entschädigung. Im Fall der LEAG weiß man gar nicht wofür, weil die Kraftwerke so stillgelegt werden, wie es das Unternehmen selber einmal geplant hat. Das sind Geschenke, die unverantwortlich sind.
Wenn man das macht, dann muss man einen Kompromiss – das war ein Kompromiss der 28 – auch insgesamt umsetzen; denn pacta sunt servanda. Da bin ich knochenkonservativ. Es kann nicht sein, dass die Umweltseite, die Klimaseite an dieser Stelle ein Stück weit hintenüberkippt. Ich finde es völlig richtig, wenn die Vertreter der Klimaschutzorganisationen in der Kohlekommission sagen: Das ist die Aufkündigung des Kompromisses. – Denn das ist eben nicht die Eins-zu-eins-Umsetzung.
Ich werde Ihnen das auch deutlich machen: Die Abschaltungen der Kraftwerke schieben Sie um Jahre nach hinten.
Das führt gegenüber dem Kommissionsvorschlag zu zusätzlichen Emissionen von 180 Millionen Tonnen – 180 Millionen Tonnen! Das ist kein Klimaschutz. Das ist das Gegenteil von Klimaschutz.
Eines – das ist eben schon angesprochen worden – muss man sich vor Augen führen: Die Kommission hat empfohlen, das Kraftwerk Datteln nicht in Betrieb zu nehmen. Sie hat nicht Datteln genannt; aber es gibt nur einen Fall, auf den es überhaupt zutrifft, dass ein Kraftwerk gebaut, aber nicht in Betrieb genommen worden ist. Was passiert? Die Bundesregierung verständigt sich darauf, dieses Kraftwerk in Betrieb zu nehmen.
Wie irre ist das denn?
