Schönen Dank. – Herr Präsident! Liebe Kolleginnen und Kollegen! Sehr verehrte Damen und Herren! Ich möchte mich zunächst Herrn Müller anschließen und der Bundesregierung danken. Ich hätte nicht gedacht, dass man in der kurzen Zeit ein solches Programm operativ abwickeln kann. Also, das muss ich ehrlich sagen: Was da, auch mit unserer Unterstützung, in vier oder sechs Wochen passiert ist! – Aber wir wissen, auf wen viele Ideen zurückgehen. Das ist eine Wahnsinnsleistung, finde ich; das muss man erwähnen, und das wurde auch schon mehrfach erwähnt. Das ist auch verdient.
Weil es immer viel um Geld geht – es geht auch um viel Geld –, will ich Olaf Scholz besonders erwähnen, weil er immer irgendwie Ja sagen muss. Falls in ein paar Jahren irgendwas schiefgeht, dann weiß ich, wem man dafür die Schuld geben wird. Ich sage jetzt nicht, wem. Aber es ist völlig klar: So wird das Spiel laufen. – Vielen Dank für das, was da geleistet wurde.
Ich will ein Wort zu Otto Fricke sagen, weil er etwas Gutes behauptet hat. Er hat ausgeführt: Mal angenommen, einem Unternehmen geht es schlecht, und es würde die 1 Milliarde Euro, die ihm helfen würde, nicht bekommen – es hat nämlich ein Tochterunternehmen in Panama –, wodurch wir 50 000 Arbeitsplätze verlieren.
Jetzt gibt es noch eine andere Lösung. Wir sagen: Wer eine passive Gesellschaft als Tochter in Panama hat, kriegt die 1 Milliarde Euro nicht.
Dann können wir sagen: Die 50 000 Arbeitsplätze sind weg. Oder wir sagen: Die stille Gesellschaft in Panama wird geschlossen. Wird die stille Gesellschaft geschlossen, werden die 50 000 Arbeitsplätze durch die 1 Milliarde Euro erhalten.
Das ist gutes Management. Darauf würde ich mich gerne beziehen.
Ich will Klaus-Peter Willsch eine Frage stellen: Weißt du, was in einer Mottenkiste ist?
Der Staat macht sehr viel; das will ich gar nicht alles wiederholen. Cansel Kiziltepe hat schon gesagt: Der Staat hat bewiesen, dass er hilft.
Herr Kollege Binding, der Kollege Fricke würde gerne eine Zwischenfrage stellen.
Das Risiko gehe ich ein.
Herr Kollege Binding, das Risiko können Sie ruhig eingehen. Es ist auch nett, dass Sie hier versuchen, die Zuhörer ein bisschen zu, wie man es im Rheinland so schön sagt, verkasematuckeln.
Ich habe bewusst nicht das Beispiel Panama gebracht. Ich glaube, bei Panama sind wir uns beide ziemlich einig darin, dass wir hier ein Land auf der Länderliste haben – das gilt genauso für die Cayman Islands und andere –, bei dem es einfach ganz klar sein muss, dass es in einem solchen Fall keine Staatshilfe gäbe. Ich habe aber bewusst das Beispiel Niederlande gebracht. Ich würde deswegen gerne wissen – das müssen wir nämlich klarmachen –: Was machen Sie denn in dem Fall, den die Linken im Zusammenhang mit den 46 000 Arbeitnehmern von Airbus angeführt haben? Sie sagen: Ja, es stimmt. – Die Holding ist – übrigens aus steuerlichen Gründen, wie wir beide wissen – in den Niederlanden. Ist es denn nach Ihrer Meinung so, dass Airbus, wenn das Unternehmen mit der Bitte um Hilfe käme, keine Hilfen aus dem Wirtschaftsstabilisierungsfonds bekommen dürfte, oder doch?
Die KfW würde vertraglich zu verabreden haben, dass die Gelder, die dort als Kredite, verzinst und rückzahlbar, zur Verfügung gestellt werden, dem Unternehmensstandort Deutschland helfen. Diesen Vertrag muss man dann entsprechend gestalten.
Man muss dann schauen, ob in dieser Liste mit den 40 Steueroasen auch die Niederlande aufgeführt sind. Das sollte man im Einzelfall prüfen.
Gibt es da einen Kanal, der letztendlich nur dazu dient, dass unser Zuschuss oder unser günstiger Kredit, für den letztendlich der Staat haftet,
dann in den Niederlanden landet, um ihn von dort über Irland nach Panama weiterzuleiten, dann muss der Vertrag – das wäre meine Meinung – so gestaltet sein, dass die Antwort ist: Ja, die Niederlande bekommen das Geld bei einer klugen Vertragsgestaltung.
So, weiter geht es.
Wir wollen, dass Unternehmen dann, wenn sie Kredite oder Hilfen vom Staat bekommen, auch einen finanziellen Anteil für die Gemeinschaft leisten. Wir wissen seit Jahren, dass wir mit BEPS, Country-by-Country Reporting, mit dem Steuerumgehungsbekämpfungsgesetz, dem Lizenzschrankengesetz, dem Schwarzarbeitsbekämpfungsgesetz, dem Gesetz gegen Kassenbetrug immer dagegen vorgehen müssen, damit das System halbwegs fair funktioniert. Ist es nicht schlimm, dass wir permanent solche Gesetze machen müssen? Könnten die Unternehmen sich nicht so verhalten, dass diese Gesetze überflüssig wären? Das wäre ein Anspruch. Diesen hätte ich an einen halbwegs ethisch-moralisch korrekten Manager.
– Ja, ja.
