Frau Präsidentin! Werte Kolleginnen und Kollegen! Besucher auf den Tribünen! Kameraden am Hindukusch! Was wir hier von der Kollegin von der SPD gerade wieder gehört haben, sind hehre Wünsche.
Ich würde mir wünschen, dass das, was Sie hier geäußert haben, weiterhin Bestand hat; aber das wird nicht passieren.
Die Taliban werden wieder an die Macht kommen. Wir hatten 2001 die sogenannte Petersberg-Konferenz, wo man darüber verhandelt hat, wie es in Afghanistan aussehen soll nach der Herrschaft der Taliban. Im Moment ist es aber so, dass man mit den Taliban verhandeln muss. Man verhandelt mit den Taliban. Die Taliban setzen ihre Forderungen durch. Es geht momentan um die Freilassung von 1 500 Kriegsverbrechern und Terroristen in Afghanistan. Die Taliban fordern die Freilassung von 5 000. Die werden auch noch kommen.
Die sogenannten Menschen-/Frauenrechte, die Sie hier eben angesprochen haben,
werden keinen Bestand haben. Denn die Taliban werden dieses Land wieder kontrollieren.
Wenn man sich ehrlich macht, hat doch die Salamitaktik, nach der wir diesen Einsatz immer wieder verlängert haben – in der Hoffnung, dass sich irgendetwas bewegt –, letztendlich nur gezeigt: Ohne die Vereinigten Staaten, ohne Trump, sind wir nicht durchhaltefähig, sind wir nicht überlebensfähig in diesem Land. – Das heißt, wir haben 20 Jahre investiert. Wir haben als Deutsche einen hohen Blutzoll gezahlt. Wir haben viel Geld in dieses Land gesteckt und müssen jetzt letztendlich doch erkennen: Die Amerikaner werden abziehen – das ist so sicher wie das Amen in der Kirche –, und dann werden wir auch abziehen, und dann wird nichts davon übrig bleiben. Herr Otte hat im Ausschuss gesagt: Wir müssen ja unsere erreichten Ziele und andere Sachen und unsere Erfolge erhalten. – Man kann dort nichts erhalten, Herr Otte.
Die Taliban werden faktisch die Macht wieder übernehmen, und uns wird nichts anderes übrig bleiben, als zu erkennen, dass dieser Einsatz schon gescheitert war, als deutsche Soldaten Afghanistan das erste Mal betreten haben.
Was auch falsch ist: Peter Struck, der ehemalige Verteidigungsminister, hatte gesagt: Deutschland wird am Hindukusch verteidigt. – Das war damals falsch, und es ist auch heute falsch.
Man hat die deutsche Bevölkerung getäuscht, als man ihr gesagt hat: Deutschland wird am Hindukusch verteidigt.
Wo stehen wir heute? Wir stehen heute da, dass wir abziehen müssen. Es gibt noch nicht einmal eine Exit-Strategie. Die Exit-Strategie, die die Bundesregierung hat, die die Verteidigungsministerin hat, ist „Zusammen rein, zusammen raus“; das ist alles. Auf gut Deutsch: Wenn die Amerikaner mit ihren Fähigkeiten gehen und wir diese Fähigkeiten nicht abbilden können, dann gehen wir auch. – Das ist die ganze Wahrheit. Aber das ist schon seit 20 Jahren die Wahrheit. Warum wird denn das nicht gesagt? Warum haben wir es denn wirklich nie ausgeplant?
