Wir wollen auch, dass die Investitionen in Deutschland den deutschen Unternehmensstandort stärken; das ist doch völlig klar. Das sind deutsche Steuergelder. Insofern ist das eine kluge Sache. Aber Vorsicht: Nicht auf dem Rücken anderer! Wir müssen schon schauen, dass die Gemeinschaft den Einzelnen hilft. Und wenn die Krise vorbei ist, helfen wieder die Einzelnen der Gemeinschaft. So einfach ist das. Was wir hier verteilen, ist ja nicht unser Geld, sondern das Geld aller.
Wir wollen nicht – das habe ich schon gesagt –, dass dann diese Gelder über geschickte Gestaltungen über Steueroasen letztendlich ganz woanders landen. Es geht eben nicht, dass man hier einen Zuschuss bekommt und gleichzeitig Dividenden ausschüttet und Aktien zurückkauft; dazu ist schon viel gesagt worden.
Das Gute an dem Antrag der Linken ist, dass er sozusagen zwei Ausgänge hat. Der eine Ausgang ist, dass die Regierung, dass wir, dass die KfW dieses Anliegen unterstützt. Wer jetzt ein bisschen genauer nachschaut, der findet dazu in den Merkblättern der KfW – die Merkblätter muss ich ja lesen, wenn ich diesen Antrag beurteilen will –: Gewinn- und Dividendenausschüttungen sind verboten.
– Ja, manchmal hilft die Wiederholung. Ich meine, über die Mottenkiste haben wir schon geredet.
Diese KfW-Coronahilfen sind eben so gestaltet, dass das verboten ist, und zwar für alle. Deshalb steht das in dem entsprechenden Papier, das ich zeichnen muss, wenn ich den Kredit bekommen will. Aktienankäufe sind genauso verboten. Also, das ist eigentlich schon geregelt.
Wir haben aber natürlich auch das Ziel, dass Konsortialfinanzierungen in einer ähnlichen Weise organisiert und unterstützt werden, dass auch Konsortien, also Zusammenschlüsse großer Unternehmen – die meisten mittelständischen und großen Unternehmen sind groß –, liquide bleiben. Da ist die Sache jetzt ein bisschen schwieriger, weil dazu nichts im Merkblatt steht, sondern das wird einzelvertraglich verabredet; das habe ich schon gerade als Antwort auf die Frage von Otto Fricke gesagt.
Mit dieser einzelvertraglichen Regelung bin ich nicht glücklich. Ich finde, wir müssten versuchen, zu erwirken, dass diese einzelvertraglichen Regelungen dort rausgelöst werden und sozusagen auch in die Form eines Merkblatts kommen, damit das für alle gilt.
– Ja, du schüttelst den Kopf. – Ich meine, es ist klug, alles für alle gleich zu machen. Denn dann gelten die Regeln für alle, dann ist es also durchgängig.
