Herr Präsident! Liebe Kolleginnen und Kollegen! Die Covid-19-Pandemie war, die Covid-19-Pandemie ist eine unbekannte Herausforderung, die unser Land nahezu unvorbereitet getroffen hat. Deshalb haben wir hier in diesem Parlament in großer Einmütigkeit einschneidende Maßnahmen gemeinsam beschlossen. Wir haben unser Land heruntergefahren. Wir haben Grundrechte, Grundfreiheiten eingeschränkt wie zu keinem Zeitpunkt zuvor in der Geschichte unseres Landes. Das haben wir Freie Demokraten mitgetragen. Ja, teilweise haben wir sogar dazu ermuntert, kontrolliert das gesellschaftliche und wirtschaftliche Leben herunterzufahren.
Nun sind einige Wochen ins Land gegangen. Nun wissen wir mehr. Nun ist das Land weiter. Der Gesundheitsschutz ist unzweifelhaft eine Aufgabe für die staatliche Verantwortungsgemeinschaft. Es gibt eben Dinge, die gehen über die Möglichkeit der individuellen Verantwortungsübernahme hinaus, Herr Gauland.
Aber die Zweifel an der Verhältnismäßigkeit des Zustandes insgesamt und die Zweifel an der Geeignetheit einzelner Maßnahmen sind ebenfalls gewachsen. Und weil die Zweifel gewachsen sind, Frau Bundeskanzlerin, endet heute auch die große Einmütigkeit in der Frage des Krisenmanagements.
Sie haben vielfach, Frau Merkel, von Vorsicht gesprochen und auch heute hier den Eindruck erweckt, wer Ihren Gedanken von Vorsicht nicht teilt, müsse sich Fahrlässigkeit oder Leichtfertigkeit vorwerfen lassen. So auch am Montag in Ihrer öffentlichen Stellungnahme. Das sind aber nur scheinbar Alternativen: Vorsicht und Leichtsinn. Freiheit und Gesundheit dürfen wir nicht und müssen wir auch nicht gegeneinander ausspielen. Das Land ist weiter.
Hier ist von allen Rednern heute – und nicht nur heute – unterstrichen worden, wie verantwortungsbewusst und solidarisch die Menschen sind – Gott sei Dank. Versorgungsengpässe werden bekämpft. Die öffentlichen Gesundheitsämter und auch das Gesundheitswesen insgesamt haben ihre Kapazitäten erhöht. Also: Das Land ist weiter, und deshalb, Frau Bundeskanzlerin, muss jetzt darüber gesprochen werden, wie wir Gesundheit und Freiheit besser vereinbaren als in den vergangenen Wochen. Es ist jetzt möglich.
– Ich komme dazu.
