dass in den Mitgliedstaaten, so auch in der Bundesrepublik Deutschland, auf allen denkbaren Medienkanälen nur noch einseitige regierungs- und EU-genehme Nachrichten bzw. Informationen verbreitet werden.
Sie sollten nicht immer Ihr eigenes Fernsehen schauen; denn das, was Sie schreiben, ist schlicht und ergreifend Quatsch.
Der EU-Aktionsplan sieht eine sehr breit aufgestellte Gruppe von Akteuren vor: natürlich die entsprechenden EU-Organe und die Mitgliedstaaten, aber in enger Abstimmung mit Wissenschaftlern und anderen. Und auch große Onlineplattformen wie Facebook, Google, Twitter sind dabei.
– Sie sollten zuhören. Das hat auch etwas mit Meinungspluralismus zu tun, das hat auch etwas mit dem Hören anderer Meinungen zu tun – genau das, was Sie in Ihrem Antrag fordern, was Sie aber nicht leben.
Letztendlich sind wir alle gefordert, die Meinungsfreiheit zu schützen, als Bürgerinnen und Bürger genauso wie als Politikerinnen und Politiker. Wir alle – auch Sie! – sollten dafür sorgen, dass gezielte Desinformation weder in den sozialen noch in sonstigen Medien eine Chance hat. Sobald wir diesen Zustand erreicht haben, können wir gerne wieder darüber diskutieren, ob wir einen EU-Aktionsplan immer noch brauchen.
Vielen Dank.
Vielen Dank, Frau Kollegin.
