Aber es gibt auch ein Problem: Der Kohleausstieg kommt zu langsam, 2038 wird eben nicht ausreichen, wenn wir das Pariser Klimaabkommen erfüllen wollen. Wir sagen als Linke: Wir brauchen 2030; das ist der Stand der Wissenschaft. Und Deutschland hat da eben eine historische Verantwortung: Deutschland steht in der Geschichte als Verursacher von CO
und wir müssen die industriepolitische Zukunftsfähigkeit unseres Landes erhalten. Und das geht zusammen, das lässt sich nicht trennen. Deshalb ist es verheerend, dass die Bundesregierung Kohleausstieg und Strukturwandel in zwei unterschiedliche Gesetze gepackt hat. Kohleausstieg und Strukturwandel in den Regionen gehören zusammen.
Es ist ja so: Die Ergebnisse der sogenannten Kohlekommission der Bundesregierung sind uns in der ganzen Zeit, die seitdem vergangen ist, immer so verkauft worden: Das sei der große Konsens, wir müssten jetzt dafür sorgen, dass die Ergebnisse der Kohlekommission auch wirklich eins zu eins umgesetzt werden. Diese Reden kann man nachlesen.
In den Reden, die wir heute hier gehört haben, ist keine Rede mehr davon, dass das eins zu eins umgesetzt werden soll, da hieß es dann: „annähernd“ oder „guter Impuls“ oder was auch immer. Das Problem ist: Die Bundesregierung hält sich nicht mal an die Vorgaben – die zu lasch waren – aus der Kohlekommission. Die Hälfte der Abschaltungen von Kohlekraftwerken, gerade Braunkohlekraftwerken, wird erst nach 2035 erfolgen. Das Problem dabei: Es werden mehr Emissionen in die Luft geblasen, es wird mehr CO
Deswegen sagen wir ganz klar: Wir müssen jetzt die 20 dreckigsten Braunkohlekraftwerke dichtmachen und nicht zuerst die Steinkohlekraftwerke. Und wir brauchen den Kohleausstieg 2030. Wir müssen die Strukturen in den Regionen fördern. Wir müssen gute Arbeit fördern.
Was wir nicht brauchen, ist, den Kohlekonzernen jetzt noch Milliarden hinterherzuwerfen, sie für vergangene Gewinne zu entschädigen. Das ist der falsche Weg, den Sie mit diesem Gesetz gehen.
Vielen Dank.
Das Wort hat der Kollege Oliver Krischer für die Fraktion Bündnis 90/Die Grünen.
