Liebe Kolleginnen und Kollegen, ich will hier noch mal die Position der SPD-Bundestagsfraktion deutlich machen: Wir sind bereit, zu unterstützen, doch wir akzeptieren keine Selbstbedienung von denjenigen, die sowieso schon genug haben.
Konkret heißt das: Erstens. Man kann nicht auf der einen Seite die Hand für Steuergelder aufhalten und gleichzeitig Milliardengewinne ausschütten.
Wir machen hier Politik, um Arbeitsplätze zu schützen. Wir machen keine Politik, um Dividenden für Aktionäre zu sichern.
Zweitens. Wer Staatshilfen erhält, darf sich nicht die Gehälter mit Boni versilbern. Gerade die Spitzenverdiener sollten auf die Gehaltseiscreme verzichten, damit alle Mitarbeiterinnen und Mitarbeiter nach der Krise noch einen Arbeitsplatz haben.
Drittens. Staatsgeld darf nicht dafür missbraucht werden, die Aktienkurse künstlich hoch zu halten. Aktienrückkäufe müssen der Vergangenheit angehören, damit endlich wieder Geld in produktive Investitionen fließt.
Und zu guter Letzt. Wer seine Gewinne kleinrechnet, darf seine Hilfsbedürftigkeit jetzt nicht großrechnen. Gewinne in Steueroasen zu verstecken, ist ein höchst unsolidarischer Akt. Wer das Gemeinwesen so behandelt, kann auch keine Solidarität von der Gemeinschaft erwarten.
Das ist unsere tiefste Überzeugung, und deswegen werden wir als SPD das auch im Fokus haben.
Bei allen Maßnahmen stellen wir sicher: Die Mittel werden hierzulande verwendet und landen nicht auf einer Karibikinsel.
Liebe Kolleginnen und Kollegen, ein Blick – das hilft immer – auf die bestehenden Hilfsmaßnahmen zeigt, dass wir schon längst damit begonnen haben. Wer beispielsweise KfW-Kredite erhält, darf währenddessen keine Gewinn- und Dividendenausschüttungen vornehmen. Auch versteckte Auszahlungen über die Gehälter von Geschäftsführern haben wir mit klaren Obergrenzen verhindert.
Das alles ist also bereits Regierungshandeln; das haben wir gestern im Finanzausschuss ausgiebig erörtert. Ich sage Ihnen: Trotzdem sind wir weit weg vom Staatssozialismus.
Liebe Kolleginnen und Kollegen, bei den Maßnahmen, deren Details noch geklärt werden müssen, wird diese sozialdemokratische Handschrift klar erkennbar sein; das sage ich hier ganz deutlich.
Ich will zum Schluss noch einen weiteren Punkt betonen: Wir wollen die Hilfen schnell und unbürokratisch bereitstellen, und das tun wir auch bereits. Das bedeutet aber nicht, dass wir damit unseren moralischen Kompass verlieren. Ganz im Gegenteil: Wir müssen es vereinen und zusammenbringen. Deshalb freue ich mich auch über den Beschluss unserer Fraktion, der die notwendigen Leitplanken hierfür setzt.
Solidarität ist unser Leitbild als Sozialdemokratie, als SPD. Die SPD steht für eine Politik mit Gewissen. Dafür kämpfen wir schon seit jeher und werden das auch in Zukunft tun.
Vielen Dank.
Vielen Dank, Frau Kollegin. – Für die Fraktion der FDP hat das Wort der Kollege Otto Fricke, der noch ein bisschen Abstand halten muss, aber schon an das Pult heranschleicht. – Bitte schön.
