Sehr geehrter Herr Präsident! Liebe Kolleginnen und Kollegen! Ja, es verwundert nicht, dass es heute so ein bisschen die Stunde der ehemaligen Bürgermeisterinnen und Bürgermeister, der Landrätinnen und Landräte ist; denn es geht hier natürlich um die Frage, wie Kommunen sich in Zukunft aufstellen müssen. Jedenfalls schicken die demokratischen Parteien hier im Hause ihre Bürgermeister auch in diese Debatte. Als ehemaliger Bürgermeister – zehn Jahre lang – der schönsten Gemeinde in Deutschland, der Gemeinde Krummhörn, kann ich feststellen: Öffentliche Daseinsvorsorge gehört in öffentliche Hand.
Zwei Anträge liegen hier zur ersten Beratung vor. Ein Antrag stammt von der FDP; den würde ich in meinen Worten so übersetzen
- „fantastisch“? da kann ich Ihnen leider nicht recht geben –: Möge der Bessere gewinnen.
Dieses Motto des Antrags hinkt allein schon deswegen, weil öffentliche bzw. kommunale Unternehmen in der Regel andere Absichten verfolgen als private.
Während auf der privaten Seite die Gewinnerzielungsabsicht über allem steht, ja, auch stehen muss – das will ich ihnen gar nicht vorwerfen –,
steht auf der kommunalen Seite die Dienstleistung am Menschen im Vordergrund, also der Dienst an und für die Menschen in der Kommune. Dabei gilt: Auch kommunale Unternehmen wollen mindestens keine Verluste machen. Das steht außer Frage. Aber für uns als kommunal verwurzelte Sozialdemokraten ist klar, dass öffentliche Daseinsvorsorge definitiv in öffentliche Hand gehört.
Das hat nicht nur damit zu tun, dass ohne die Absicht, so schnell wie möglich viel Geld zu verdienen, die Dienstleistung für die Menschen vor Ort bezahlbarer bleibt, sondern das hat vor allem auch damit zu tun, dass die verantwortlichen Personen in den kommunalen Unternehmen für die Bürgerinnen und Bürger direkt ansprechbar sind, also dass sie in besonderer öffentlicher Verantwortung den Kunden gegenüberstehen, im Zweifel auch mal wiedergewählt werden wollen und sich deswegen so verhalten, wie die Bürgerinnen und Bürger das eigentlich gerne sehen würden.
Das Verhältnis zwischen Unternehmer und Kunde ist eben ein völlig anderes als das Verhältnis zwischen Kommune und Bürger. Das muss man hier klar auseinanderhalten.
Oder, wie man in Ostfriesland sagt: Blood is dicker als Bottermelk.
