Die Linkspartei ist mitnichten die demokratische Musterpartei, schon gar nicht die verfolgte Unschuld, als die sie nun seit Wochen durch die Lande tingelt. Hinter ihrer Biedermeier-Maske lurt noch immer die alte rotgesichtige SED hervor, die mit Putin und Maduro kuschelt und in Phantasien schwelgt, wie man Reiche erschießt oder zu gemeinnützigen Arbeiten heranzieht.
Liebe Kolleginnen und Kollegen, wie können wir denn da noch Zweifel haben, dass Die Linke zumindest in Teilen auf dem besten Weg dazu ist, unsere freiheitlich-demokratische Ordnung zu verlassen? Hier sind keine Witze, sondern hier ist eher eine Beobachtung durch den Verfassungsschutz angebracht.
Warum haben Sie, Herr Riexinger, nicht die Chance ergriffen, sich heute hier zu stellen und sich selbst zu entschuldigen? Waren Sie dazu nicht Manns genug?
Herr Kollege Riexinger, ziehen Sie endlich Konsequenzen aus dieser Geschichte, und treten Sie als Parteivorsitzender zurück!
Und, Herr Riexinger, geben Sie auch gleich Ihr Bundestagsmandat ab! Sie haben für unser Engagement hier im Hohen Haus nur Hohn und Spott übrig. Sie haben kürzlich öffentlich hinterfragt, ob Sie sich die Arbeitserfahrung als Bundestagsabgeordneter nicht hätten ersparen sollen. Ich sage Ihnen: Hätten Sie in diesem Parlament mal ordentlich gearbeitet, dann würden Sie nicht einen solchen Unsinn verzapfen.
Wer so redet und auch so handelt wie Die Linke, der darf niemals wieder Regierungsverantwortung in Deutschland bekommen.
Die Kolleginnen und Kollegen von den Grünen und der SPD frage ich daher: Wo bleibt eigentlich Ihre Empörung und Ihr Aufschrei angesichts solcher Äußerungen und Eskapaden?
Sie, Herr Kollege Lindh, haben Dinge relativiert, die einfach nicht zu relativieren sind. Ich habe eher den Eindruck, Sie verzichten auf zu viel Kritik, aus Rücksicht auf eine zukünftige grün-rot-rote Koalition. Wenn Sie sich hier nicht endlich abgrenzen, sind Sie offensichtlich bereit, in die rote Kolonne einzutreten,
eine rote Kolonne, die dann Deutschland unter dem Motto „Verbieten, enteignen und erschießen“ in die Zukunft führen will.
Meine Damen und Herren, die CSU war, ist und wird immer das Bollwerk gegen den Sozialismus sein.
Wir wollen unsere freiheitlich-demokratische Ordnung in Deutschland bewahren und nicht gegen eine sozialistische Knechtschaft eintauschen. Wir werden unsere freiheitliche Demokratie gegen jeden Feind, ob von links oder von rechts, mit Haut und Haaren verteidigen.
Herzlichen Dank.
Vielen Dank, Herr Kollege. – Als nächster Redner hat das Wort der Kollege Stephan Brandner, AfD-Fraktion.
