– Das war ein Wechsel, den ich nicht mitbekommen habe.
Es geht mit mir jetzt auch nicht weiter. Ich bitte Sie, zum Ende zu kommen.
Ich dachte, ich kriege einen Bonus dadurch. – Nur 5 Prozent der Einwohner Malis bewerten die UN-Operation positiv. Wir müssen an dieser Stelle durch zivile Begleitmaßnahmen die MINUSMA-Operation zu mehr Erfolg führen.
Vielen Dank für Ihre Aufmerksamkeit.
Vielen Dank, Herr Dr. Brecht. – Letzter Redner in dieser Aussprache ist der Kollege Dr. Reinhard Brandl, CDU/CSU-Fraktion.
– Ich kann das leider nicht mit einem Ordnungsruf belegen; aber Sie können sich mit Claudia Roth ja gerne privat verabreden.
Herr Kollege, Sie haben das Wort.
