Schaffen Sie einen unbürokratischen Härtefallfonds, um Studierenden in besonderen finanziellen Notlagen auch mit direkten Zuschüssen direkt unter die Arme greifen zu können. Die Mittel sind vorhanden: 900 Millionen Euro BAföG-Mittel wurden allein im letzten Jahr nicht verausgabt.
Schaffen Sie mit der Arbeitsagentur und den Studierendenwerken vor Ort eine schnelle Vermittlung in neue Nebentätigkeiten zur Unterstützung der Landwirte, der Supermärkte, der Gesundheitsbehörden.
Sorgen Sie dafür, dass neue BAföG-Ansprüche schneller berechnet werden. Vereinfachen Sie die Verfahren, indem Sie wie ja schon bei der Grundsicherung auf die aufwendige Vermögensprüfung verzichten.
Stellen Sie klar, dass das aktuelle Sommersemester nicht auf die BAföG-Höchstförderdauer angerechnet wird.
Und öffnen Sie sich endlich für eine strukturelle Reform zu einem elternunabhängigen BAföG, wie wir Freie Demokraten es längst vorgeschlagen haben.
Also, handeln Sie, Frau Ministerin!
