Was die PCR für die Biologie ist, ist die Attributionsforschung für den Klimaschutz. Es gibt Wissenschaftlerinnen und Wissenschaftler, die genau analysieren können, welche Wetterveränderungen mit welcher Wahrscheinlichkeit auf den menschengemachten Klimawandel zurückzuführen sind, auf die menschengemachten Emissionen. Dies kann man nicht ignorieren.
Die Prognosen, die diese Menschen machen, bestätigen, dass wir in Zukunft verstärkt hier in unseren Klimalagen Extremwetterereignisse bekommen werden. Das hat der grüne Antrag vollkommen richtig beschrieben. Dahinter steht die Wissenschaft zu 100 Prozent. Ich habe dies in meinen Reden hier in Vergangenheit auch schon häufiger deutlich gemacht.
Liebe Kolleginnen und Kollegen, der Antrag der Grünen bietet dafür die richtigen Anregungen. Wir müssen uns das aber im Ausschuss mal anschauen. Es ist ja wirklich ein Gemischtwarenladen, und es gibt auch unterschiedliche Zuständigkeiten, die hier nicht deutlich gemacht werden.
Wir als SPD wollen ganz klar den sozialökologischen Umbau. Wir wollen einen sozialen grünen Deal. So muss dieser auch ansetzen: bei den armen Menschen. Wir dürfen nicht nur an die Reichenquartiere denken, sondern wir müssen auch gerade in den armen Wohngegenden einen stadtökologischen Umbau betreiben, und Wohnen muss dabei bezahlbar bleiben.
Aus Sicht der SPD geht es auch nicht darum, unsere Industrie abzuschaffen, sondern wir müssen sie klimafreundlich umbauen. Ich freue mich, dass wir an dieser Stelle die Gewerkschaften und die Unternehmen an unserer Seite wissen.
Ich möchte es so zusammenfassen: Früher gab es in Europa eine Union für Kohle und Stahl; jetzt muss es eine Union für erneuerbare Energien und Wasserstoff geben. Das schützt unseren Planeten und unsere Gesundheit, und wir können damit sichere Arbeitsplätze und Wertschöpfung schaffen. Ich lade Sie alle ein, dabei mitzuwirken.
Danke schön.
Ich schließe die Aussprache.
