Verehrtes Präsidium! Meine Damen! Meine Herren! Geschlossene Grenzen in Zeiten der Pandemie haben uns gezeigt, wie wichtig das geeinte Europa ist, ein grenzenloses Miteinander von Menschen, der freie Austausch von Dienstleistungen und Waren, von Meinungen, von Kultur. Stattdessen mussten wir bewachte Zäune, fehlende Dienstleister im Baubereich, in der Pflege, in der Landwirtschaft, stockende Lieferketten erleben.
Die historische Wende der Europäischen Union ist doch, dass auf Jahrhunderte von Kriegen Jahrzehnte folgten, in denen sozialer und wirtschaftlicher Austausch stattgefunden hat, Frieden und Wohlstand geschaffen wurden.
Der Rückfall in Nationalismus, der Rückfall in ein betoniertes Regime, in hohe Grenzen würde allen schaden. Das würde auch unser Land ruinieren. Wir müssen verhindern, dass nationalistische Kräfte Europa beschädigen, so wie es Herr Springer und seine Fraktion wollen. Wir wollen, dass Europa stark ist. Sie wollen Europa runterreden.
Wichtig ist auch, dass die Europäische Union die soziale Frage thematisiert.
Die soziale Frage ist beispielsweise mit dem Arbeitnehmer-Entsendegesetz aufgearbeitet worden. Wir wollen keinen Dumpingimport von Billigarbeitern. Wir wollen faire Löhne und faire Wettbewerbsvoraussetzungen.
Dadurch erreichen wir letztendlich auch, dass die Akzeptanz Europas gestärkt wird.
Mit der Änderung des Entsendegesetzes, die wir heute beraten und verabschieden werden, werden die Tarifverträge gestärkt – jene nach dem Entsendegesetz, aber auch die Tarifverträge, die bundesweit allgemeinverbindlich sind. Wir verhindern, dass Entgelte – wie bisher möglich – durch Kosten der Unterkunft, für Werkzeug oder Fahrten nachträglich gedrückt werden können, und arbeiten damit auf ein wesentliches Ziel hin, das die Europäische Union in ihrem Grundlagenvertrag formuliert hat, nämlich „die stetige Besserung der Lebens- und Beschäftigungsbedingungen“ für alle Menschen in der Europäischen Union.
Wir wissen: Dazu bedarf es Regeln. Wir kennen auch die Problematik mancher Unterkünfte. Aus meinem Heimatkreis wurde mir ein Brief geschrieben, aus dem hervorging, dass Leiharbeiter aus Rumänien in gemieteten Unterkünften untergebracht wurden, 22 Personen in einer Unterkunft. Für die Schlafstätten mussten sie 340 Euro bezahlen. Die haben dann in Nettetal am Niederrhein gewohnt und in den Niederlanden gearbeitet. – Das darf es nicht mehr geben.
Deshalb ist die Entsenderichtlinie so entscheidend; mit ihr können wir solche Probleme abstellen.
