Frau Präsidentin! Meine Damen und Herren! Von allen Gesetzen, die im Zuge der Coronakrise in den einzelnen Staaten verabschiedet wurden, ist das ungarische Notstandsgesetz mit Abstand das repressivste. Es ist unbefristet, das Parlament ist entmachtet, und nur die Regierung, nur Orban selbst, kann dieses Gesetz wieder aufheben. Ich denke, wir müssen diesen Weg, diesen Missbrauch der Pandemie sehr deutlich verurteilen.
Es ist schon angesprochen worden: In den letzten Tagen sind in Ungarn diverse Menschen verhaftet worden. Sie haben zu Hause Besuch von der Polizei bekommen, weil sie angeblich gegen ein sogenanntes Fake-News-Gesetz, ein Fehlinformationsgesetz, verstoßen haben, indem sie auf Facebook irgendeine kritische Bemerkung gemacht haben, zum Beispiel der Kollege in der Stadt Gyula, der geschrieben hat, dass es ein Problem ist, dass sehr viele pflegebedürftige Menschen aus den Krankenhäusern entlassen worden sind, damit dort möglicherweise Menschen, die sich mit Corona infiziert haben, aufgenommen werden können. Dieser Umgang ist eindeutig inakzeptabel. Das will ich noch mal ganz klar sagen.
Und natürlich muss darauf reagiert werden.
Ich will aber sehr deutlich sagen: Es ist die Partei Orbans, die gemeinsam mit der CDU/CSU-Gruppe in der EVP-Fraktion des Europäischen Parlaments sitzt.
Und es waren die CDU/CSU und die EVP, die verhindert haben, dass im Europarat ein Monitoringverfahren gegen Ungarn eingeleitet wird. Das ist wirklich ein bisschen eine Doppelmoral. Es ist ein politisches Problem. Man muss sich von der Fidesz-Partei trennen und nicht nur darauf warten, dass es neue Sanktionsinstrumente gibt.
Aber eins will ich auch sagen: Für die AfD, die hier sitzt und sich gegenwärtig in Deutschland als Grundrechtepartei aufspielt, ist ja Orban das Vorbild.
Das ist wirklich eine unerträgliche Doppelmoral.
