Meine Damen und Herren, wir müssen künftige Altersarmut verhindern, und heutige Altersarmut bekämpfen. Die meisten der 38 OECD-Staaten haben das verstanden. Nur in Australien, Finnland, den USA und Deutschland gibt es keine Mindestrente für ältere Menschen, und das darf nicht so bleiben.
Am vergangenen Montag gab es eine Sachverständigenanhörung zur sogenannten Grundrente der Bundesregierung. Ergebnis: Mehr als die Hälfte der drei Millionen Armen jenseits der 65 Jahre werden von der sogenannten Grundrente der Bundesregierung keinen Cent sehen. Und dafür sind Sie verantwortlich, werte Kollegen Linnemann, von Stetten und andere vom Wirtschaftsflügel der CDU/CSU.
Gegen Altersarmut wird die sogenannte Grundrente wegen Ihrer Verschlechterung des Gesetzentwurfs nicht wirklich helfen, und das ist schlecht.
Wir brauchen aber gute Ideen. Und da lohnt ein Blick nach Österreich. Dort heißt die Mindestrente Ausgleichszulage. Alleinstehende Rentnerinnen und Rentner ab 15 Beitragsjahren erhalten dort die Ausgleichszulage, bis sie monatlich auf eine Rente von 917,35 Euro kommen. Und diese Ausgleichszulage wird 14-mal im Jahr gezahlt. Das heißt, in Österreich hat man also monatlich mindestens eine Rente von 1 070,24 Euro, und das ist gut so.
Übrigens: Wer keine 15 Versicherungsjahre schafft, erhält die 917,35 Euro 12‑mal im Jahr als bedarfsorientierte Mindestsicherung. Und das sind immer noch gut 100 Euro mehr als die durchschnittliche Grundsicherung im Alter in Deutschland. – Ja, es ist nicht alles gut, was aus Österreich zu uns kommt;
aber in der Rentenpolitik können wir viel von den Österreichern lernen.
