dann wünsche ich mir auch Feiern zum Erhalt der Staatsangehörigkeit, also Einbürgerungsfeiern. Aber diese Einbürgerungsfeiern sind dann nichts mehr wert, wenn zum Beispiel der Eingebürgerte afrikanischer Herkunft in den Bus steigt und Gegenstand von Racial Profiling wird oder wenn sich die Eingebürgerte arabischer Herkunft abends auf dem Sommerfest rechtfertigen muss, ob sie denn wirklich auf dem Boden des Grundgesetzes steht, und aufgefordert wird, dass sie sich klar vom IS distanziert.
Herr Kollege, kommen Sie bitte zum Schluss.
Und es scheitert auch, wenn der Eingebürgerte immer noch als Deutscher mit Migrationshintergrund gilt, und es scheitert erst recht, wenn die Angehörigen des Eingebürgerten erleben müssen, wie sie in einer Shishabar von einem Verfechter dieses Reinheitswahns des Deutschtums eiskalt abgeknallt werden.
Herr Kollege, kommen Sie jetzt bitte zum Schluss!
Auch das gehört in diese Debatte, und das müssen wir gewährleisten, sonst belügen wir uns selbst.
Vielen Dank.
Damit schließe ich die Aussprache.
