Auch die Sektorkopplung muss verbessert und endlich zugelassen werden, die Hemmnisse für die Herstellung von Wasserstoff aus Überschussstrom, etwa aus Wind und Photovoltaik, müssen dringend beseitigt werden. Dass dafür EEG-Umlage anfällt, versteht niemand. Wir brauchen dringend einen ökologischen Ordnungsrahmen der sozialen Marktwirtschaft. Die Diskriminierung des Wasserstoffs muss beendet werden, meine Damen und Herren. Und ja, wir plädieren für die Ausweitung des europäischen Emissionshandelssystems auf die Sektoren Verkehr und Wärme, und wir plädieren dafür, dass dieser marktwirtschaftliche Ordnungsrahmen auch ausgedehnt wird, zum Beispiel auf Länder wie Nordafrika oder andere Länder der Welt. Denn es ist völlig egal, wo klimaneutraler Wasserstoff hergestellt wird, Hauptsache, das Klima wird geschützt, und Hauptsache, der Wasserstoff wird zu wirtschaftlich wettbewerbsfähigen Preisen hergestellt.
Das war jetzt ein gutes Schlusswort, Herr Kollege.
Dann können Klimaschutz und Arbeitsplätze verbunden werden.
Vielen Dank.
Ich mache darauf aufmerksam, dass ich jetzt angesichts der fortgeschrittenen Zeit auf die strikte Einhaltung der Redezeit achten werde.
Nächster Redner ist Mark Helfrich für die Fraktion der CDU/CSU.
