Meine Damen und Herren, es geht hier um Spitzenpolitik und um die Frage, welche Prozesse und Wirkungen Sie auslösen. George Floyd und diese schreckliche Tat haben es nicht verdient – nicht verdient! –, dass wir das hier instrumentalisieren und eine Scheindebatte führen, für die es in der deutschen Polizei überhaupt keine Rechtfertigung gibt.
Sie befeuern Ihre politische Agenda durch den vermeintlichen Mord an einem Menschen. Und jetzt meine Damen und Herren, halten Sie sich einmal fest:
Menschen wie George Floyd würden die deutsche Polizei wählen, wenn sie wählen könnten, wer sie festnehmen soll.
Sie würden die deutsche Polizei wählen, weil sie wissen: Wenn eine deutsche Polizei handelt, dann gilt Demokratie, dann gilt Rechtsstaatlichkeit und dann gelten alle Vorschriften. – Das würden sich die Menschen weltweit wünschen.
Deswegen geht es in einer Aktuellen Stunde heute darum, nicht Trittbrett zu fahren auf diesen furchtbaren Vorgängen in den USA.
– Frau Dr. Mihalic, wenn sie sich irgendwann einmal einen Innenministerposten in diesem Land zutrauen – „sie“ kleingeschrieben, es können auch andere sein –,
dann würden auch Sie erkennen, dass die Probleme von Fehlerkultur, von individueller Fehlerbekämpfung, Verantwortung und unnachgiebigem Handeln, auch im öffentlichen Dienst, jeden Tag von 17 Landes- und Bundesinnenministern gelöst werden. Das ist tagtägliches Geschäft. Die deutsche Polizei ist deshalb so gut, weil deutsche Innenminister für Qualität in dieser Polizei sorgen – völlig unvergleichbar mit den USA und übrigens auch vielen anderen Ländern.
Deswegen glaube ich, Sie haben auch noch die Chance verpasst, Ihrem Justizsenator in Berlin von dieser Stelle einen sanften Hinweis zu geben, dass er in eine Sackgasse fährt und schon ziemlich weit hinten an der Wand angekommen ist. Das könnten sich Bundesgrüne durchaus einmal erlauben. Auch diese Chance haben Sie verpasst,
weil Sie der Versuchung nicht widerstehen konnten, Ihr politisches Agenda-Setting zu machen. Machen Sie sich doch bitte nicht gemein mit Menschen, die mehr Zuneigung zur Antifa haben als zur deutschen Polizei. Und das finde ich schon ziemlich furchtbar.
Meine Damen und Herren, der „taz“-Artikel ist nur ein sehr abscheulicher und unrühmlicher Zwischengipfel, den Sie mit dem Verhalten auslösen, welches Sie hier an den Tag legen.
