Vielen Dank. – Herr Präsident! Liebe Kolleginnen und Kollegen! Ich kann gleich an die Ausführungen meiner Vorrednerin anknüpfen. Ich möchte eine Sache ganz am Anfang klarstellen: Doch, Frau Teuteberg, alle Antifaschisten sind selbstredend und ganz automatisch Demokraten,
weil sie sich gegen Faschismus wenden und weil sie für Demokratie und Freiheit kämpfen.
Ich möchte auf den zur Debatte stehenden Antrag zu sprechen kommen. In der Überschrift Ihres Antrags heißt es ja: „… Verbot der Antifa prüfen“. Ich habe das mal für Sie gemacht und komme zu dem Schluss, dass es sich bei Ihrem Antrag um eine Themaverfehlung handelt.
Ich möchte Ihnen kurz erklären, wie ich zu diesem Schluss komme: In der Überschrift steht zwar „Antifa“, aber in dem Antrag geht es um Linksextremismus. Sie hätten in der Schule in Geschichte besser aufpassen sollen; denn Antifaschismus hat nichts mit Linksextremismus zu tun,
und im Übrigen auch seine Symbole nicht.
Herr Kollege Grötsch, erlauben Sie eine Zwischenfrage der Kollegin Teuteberg?
Ja. – Bitte, Frau Teuteberg.
Herr Grötsch, Sie haben gerade gesagt, dass auch jeder Antifaschist Demokrat sei. Ich finde, das ist eine sehr ernste Frage, wenn es uns mit diesem Kampf für die Demokratie ernst ist. Würden Sie das auch über zum Beispiel Stalin sagen, der mindestens bis 1939 und dann wieder ab 1941 erklärter Antifaschist war, aber bestimmt nicht Demokrat?
