Frau Präsidentin! Meine sehr verehrten Damen und Herren! Die FDP schlägt vor, sogenannte virtuelle Gerichtsverhandlungen im Zivilrecht zu ermöglichen. Wer den Antrag liest, der fühlt sich ein wenig erinnert an den Wahlslogan der FDP: Digital first. Bedenken second.
Oder anders ausgedrückt: Digitales fordern und dann erst nachdenken.
Es wäre vielleicht besser, wenn Sie erst mal nachdenken, bevor Sie einen Antrag stellen; denn das, was hier in Ihrem Antrag verarbeitet ist, hält weder rechtsstaatlichen Standards stand, noch ist es irgendwie praktisch tauglich.
Ich will Ihnen kurz sagen, weshalb.
Nach § 128a ZPO kann nach Ermessen des Gerichts eine Zeugeneinvernahme oder auch eine Anhörung per Bild- oder Videoübertragung stattfinden. Was Sie aber fordern, ist ein völliger Paradigmenwechsel. Sie wollen nämlich, dass, wenn dies eine Partei bereits beantragt, dann automatisch diese Sitzung als Videoübertragung stattfinden muss, und das ist, ehrlich gesagt, mit Artikel 103 Absatz 1 Grundgesetz nicht vereinbar,
weil nämlich nach der Rechtswegegarantie des Grundgesetzes jeder den Anspruch auf rechtliches Gehör vor Gericht hat. Das heißt, die Verhandlung muss am Gericht stattfinden. Wir können es nicht in einen virtuellen Raum verlagern, meine Damen und Herren.
Zudem haben Sie ein Folgeproblem gar nicht bedacht. Es gibt vor den Amtsgerichten keinen Anwaltszwang, sodass es jedem Bürger unbenommen ist, auch selbst vor Gericht zu erscheinen und seine Rechte wahrzunehmen.
Damit werden Sie, wenn Sie auf Antrag einer Partei ein Videoverfahren zulassen, letztlich die Menschen benachteiligen und juristisch ein Stück weit ins Abseits drängen, die das typischerweise gar nicht können und wollen: Ältere, Rentner, Menschen, die Schwierigkeiten damit haben. Aber der Zugang zum Gericht ist für jeden da,
