Danke, Herr Präsident. – König Salomo: Sein Name steht für weise Entscheidungen, die allen Interessen gerecht werden – wie unsere heutige Gutscheinlösung. Denn damit helfen wir am Ende Veranstaltern, Künstlern und den Kunden.
Seit Beginn der Coronakrise wurden alle Veranstaltungen abgesagt. Bis Ende August summiert sich das im Bereich der Kultur auf 120 000 Veranstaltungen. Darunter leiden die Besucher. Aber ins Mark getroffen sind die Veranstalter und die Künstler – existenziell.
Darauf hat unsere Kulturstaatsministerin Monika Grütters reagiert. Liebe Monika Grütters, du kämpfst wie eine Löwin für unsere Künstler, für die Kultur – von Soforthilfen über Honorarausfallgelder bis hin zu Orchesterprogrammen. Gemeinsam mit unseren Rechts- und Kulturpolitikern hast du diese Lösung mit auf den Weg gebracht.
Danach dürfen Kulturveranstalter ihren Kunden einen Gutschein ausstellen. Wer das Geld braucht, bekommt es zurück. Alle anderen dürfen sich weiter auf die Veranstaltung freuen; die Eintrittskarte dafür haben sie ja bereits in der Tasche.
Frau Kollegin, gestatten Sie eine Zwischenfrage der Kollegin Barrientos?
Ja, gerne.
Ganz vielen Dank, dass ich eine Zwischenfrage stellen darf. – Sie haben gerade gesagt, diese Gutscheinregelung würde sowohl Veranstaltern als auch Künstlerinnen und Künstlern oder wem auch immer, sogar den Verbrauchern helfen. Das ist Unsinn. Es hilft weder den Veranstalterinnen und Veranstaltern – es hilft einigen, aber nicht allen –, und es hilft schon gar nicht den Verbraucherinnen und Verbrauchern. Ich möchte mal ein Fallbeispiel aufmachen.
