Herr Präsident! Sehr geehrte Damen und Herren! Meine Fraktion unterstützt selbstverständlich den Wiederaufbau in Europa; denn wenn Italien und Spanien Fieber haben, kann auch Deutschland nicht gesund werden.
Es ist offensichtlich, auch hier in Deutschland: Es ist eben teurer, in der Krise zu kürzen; denn wenn Unternehmen sterben, wenn Jobs vernichtet werden, dann brechen uns auch die Steuereinnahmen von morgen weg.
Weil jetzt bei diesem Aufbaufonds auch über die Verknüpfung mit dem Europäischen Semester gesprochen wird: Was nicht geht, ist, in der Coronakrise mit feuchten Augen für die Krankenschwestern und Ärzte in Italien, Spanien oder Deutschland zu klatschen und dann zu sagen: Geld gibt es nur, wenn man den Leuten ins Portemonnaie greift und wieder die Löhne und Renten kürzt. – Das müssen wir verhindern! Das wäre Gift für Europa.
Wir haben ja auch in Deutschland wieder die Debatte: Die Union will die Grundrente aussetzen, diskutiert über die Senkung von Mindestlöhnen und will den Soli auch für DAX-Manager und Bundestagsabgeordnete abschaffen. Es dürfen nicht wieder die Leute die Rechnung bezahlen, die den Laden am Laufen halten. 63-mal hat die EU-Kommission seit 2011 EU-Mitgliedstaaten aufgetragen, ihre Gesundheitsausgaben zu kürzen. Jeder Mensch in diesem Land versteht doch: Was die Krise jetzt teurer macht, ist, dass wir die Wirtschaft nicht mehr anfahren können, weil unser Gesundheitssystem sonst zusammenbrechen würde. Dieser Unsinn in Europa muss ein Ende haben!
Natürlich muss man auch Auflagen machen, wenn man Geld gibt. Aber warum denn nicht mal, anstatt der Krankenschwester ins Portemonnaie zu greifen, die Multimillionäre und Milliardäre in Europa zur Kasse bitten,
warum nicht die Steueroasen austrocken?
