Vielen Dank, Herr Präsident. – Liebe Kolleginnen und Kollegen! Der Antrag der AfD ist der traurige Versuch, das Verbrechen der Deutschen mit dem Unrecht an Deutschen zu vergleichen, aufzurechnen und damit zu relativieren,
Und genau das wollen und dürfen wir nicht.
Das trägt nicht zur Versöhnung bei.
– Ich glaube, wir machen weiter; die Emotionen gehen hoch.
Bundeskanzlerin Angela Merkel hat im Dezember folgenden Satz in Auschwitz gesagt – ich zitiere –:
Ich empfinde tiefe Scham angesichts der barbarischen Verbrechen, die hier von Deutschen verübt wurden – Verbrechen, die die Grenzen alles Fassbaren überschreiten. Vor Entsetzen über das, was Frauen, Männern und Kindern an diesem Ort angetan wurde, muss man eigentlich verstummen.
Dem ist eigentlich nichts hinzuzufügen – aber ich mache natürlich weiter.
Der Holocaust hat insgesamt 6 Millionen Juden das Leben gekostet. Sie wurden von Deutschen ermordet. Weltweit sind 60 Millionen Menschen dem Zweiten Weltkrieg zum Opfer gefallen. Dieser Krieg war ein Angriffs- und Vernichtungskrieg,
ein vom nationalsozialistischen Deutschland verschuldetes Verbrechen. Die Anerkennung dieser Schuld muss immer im Mittelpunkt unserer Erinnerungskultur stehen. Nur so können wir nämlich das „Nie wieder!“ an die nächste Generation weitergeben.
Richard von Weizsäcker nutzte im Mai 1985 eine klare Sprache, eine befreiende Sprache für das, was 40 Jahre zuvor geschehen war. Auch ich zitiere ihn:
Der 8. Mai war ein Tag der Befreiung. Er hat uns alle befreit von dem menschenverachtenden System der nationalsozialistischen Gewaltherrschaft.
Dieser Gedanke von Richard von Weizsäcker wird von der AfD in seiner Intention verdreht und nicht verstanden, und das ist beschämend.
Ich erinnere an eine Rede von Björn Höcke 2017 in Dresden. Er sagte damals:
Und diese dämliche Bewältigungspolitik, die lähmt uns heute noch ... Wir brauchen nichts anderes als eine erinnerungspolitische Wende um 180 Grad.
