Das zweite Problem ist: Auch mit der Grundrente, wie Sie sie vorschlagen, bleiben viele leider mit einem Bein in der Sozialhilfe stecken;
denn durch Ihre Abschläge werden viele Personen trotzdem in der Grundsicherung bleiben und diesen Freibetrag in Anspruch nehmen müssen. Auch hier ist die Alternative die grüne Garantierente, eine Versicherungsleistung, die aus dem Bereich der Versicherung kommt und die Grundsicherung hinter sich lässt und überwindet, und das muss das Ziel sein, um die Rentenversicherung zu stärken.
Dann können wir jetzt kurz zu dem wüsten Verwaltungsaufwand kommen. Ich will das nicht zu sehr vertiefen, aber einfach einmal das Thema Kapitaleinkünfte ansprechen.
Das war ja dem Wirtschaftsflügel der Union so unglaublich wichtig. Das hätten Sie aber einfach lösen können, meine Damen und Herren von der Union, indem Sie die Abgeltungsteuer abgeschafft hätten,
die ja Leute mit einem Spitzeneinkommen belohnt, weil sie weniger zahlen als durch die Einkommensteuer. Wenn die Kapitaleinkünfte nach Abschaffung der Abgeltungsteuer wieder in der Einkommensteuererklärung auftauchen würden, wäre ja alles kein Problem. Aber da wollten Sie natürlich nicht ran.
Stattdessen haben Sie ein kompliziertes Prüfungsverfahren eingeführt, was den Verwaltungsaufwand erhöht,
