Frau Präsidentin! Meine sehr verehrten Damen und Herren! Ja, da stimme ich Konstantin von Notz zu: Dieses Urteil ist wirklich ein Meilenstein. Es ist auch eine juristische Herausforderung, es ist eine technologische Herausforderung, darauf komme ich noch, und – das genießt unsere Fraktion ganz besonders – es ist eine einzigartige Bestärkung unseres politischen Kurses, was die Kraft eines Auslandsnachrichtendienstes anbelangt. Ich bin schlicht begeistert davon,
dass den Richtern die Balance gelungen ist, zu erklären: Jawohl, dieses Land braucht eine strategische Fernmeldeaufklärung im Ausland; jawohl, die ist auch anlasslos, da darf auch gespeichert werden, da dürfen Verkehrsdaten gespeichert werden.
Wären die Linken oder die FDP vor Ort in Karlsruhe zahlenmäßig stärker vertreten gewesen, hätten sie gelitten. Wenn Sie die 138 Seiten lesen, werden Sie an vielen Stellen feststellen, wie das Bundesverfassungsgericht von der Leistungsfähigkeit unseres Auslandsnachrichtendienstes überzeugt ist.
Ich zitiere: Es gibt ein „überragendes öffentliches Interesse“ an dieser Arbeit. Deswegen investiert diese Fraktion mit der SPD zusammen seit Jahren in die materielle, in die personelle Ausstattung dieser Dienste, in gesetzgeberische Reformen und jetzt in eine bessere Rechtskontrolle.
Meine Damen und Herren, ich bin wahrscheinlich der einzige parlamentarische Überlebende der Reform von 2016;
ich habe daran eng mitgearbeitet. Leider sind Frau Högl, Herr Lischka usw. nicht mehr da. Den damaligen Fraktionsvize spreche ich jetzt mal nicht an. Meine Damen und Herren, alles hat seine Zeit. Damals sagten die Sachverständigen zu unserer Reform von § 16 BND-Gesetz: epochal, international einzigartig. – Ich weiß, es gab auch Kritik. Ich selber habe massiven Druck empfunden, wie weit wir mit der parlamentarischen Kontrolle beim neuen BND-Gesetz gehen, auch im Hinblick auf die Mitarbeiter des BND.
Ich erinnere mich noch sehr gut. Damals hieß es: Die legen den BND an die Kette. Nein, das haben wir nicht getan. Wir haben 2016 eine starke Reform gemacht – alles hat seine Zeit –; jetzt machen wir eine zweite. Damals waren Dinge noch nicht gangbar, die, glaube ich, heute gangbar sind – ein deutlicher Beleg dafür, wie das Bundesverfassungsgericht auch zu unserer Lösung steht. Wir haben bis 31. Dezember 2021 Zeit. Das ist ein sehr deutliches Signal. Außerdem: Die politische Berichterstattung des BND an die Bundesregierung hat in diesem Urteil einen dicken grünen Haken bekommen.
– Ja, ja. –
