Verehrte Frau Präsidentin! Liebe Kolleginnen und Kollegen! Meine Damen und Herren! Lieber Herr Kollege Brandenburg, ich will erst mal den Antrag der FDP besonders loben
und begründe das damit, dass er einen Konsens der, glaube ich, meisten hier im Haus klar formuliert:
Fraglos ist, dass die medizinische Sicherheit der gewonnenen Blutspenden und die Sicherheit der potenziellen Empfängerinnen und Empfänger höchste Priorität hat.
Der ebenfalls hier zur Debatte stehende Antrag der Fraktion Bündnis 90/Die Grünen ist in gleicher Weise zu loben,
weil auch in diesem Antrag steht:
Die Sicherheit der Empfänger*innen von Blutspenden muss oberste Priorität haben.
Wie kommt das, dass ein so klarer Konsens da ist? Das hat natürlich damit zu tun, dass wir in den 80er-Jahren die Blut-Aids-Katastrophe erlebt haben, die dazu geführt hat, dass sich damals mehr als 1 500 Bluter durch Blutprodukte, die mit HIV infiziert waren, ihrerseits angesteckt haben. Das ist nicht der einzige Arzneimittelskandal, den es gegeben hat; sondern man muss dazusagen, dass auch das Thema Hepatitis-C-Infektionen im gleichen Zusammenhang steht. Und man muss, weil wir ja in Gesamtdeutschland leben, auch die Anti‑D-Prophylaxe aus den Zeiten der DDR bei Frauen mit bestimmten Blutgruppenkonstellationen erwähnen, bei denen damals 7 500 Infektionen ausgelöst worden sind.
Deswegen muss uns allen gemeinsam klar sein: Wenn wir den Satz formulieren, dass die Sicherheit der Empfängerinnen und Empfänger von Blutspenden „oberste Priorität“ haben muss,
dann muss diese Kategorie des Patientenschutzes natürlich auch Konsequenzen haben.
Ich erlaube mir, aus der Drucksache 12/6700 – das ist „Erste Beschlussempfehlung und Zwischenbericht“ des 3. Parlamentarischen Untersuchungsausschusses der 12. Wahlperiode – zu zitieren. Dort heißt es auf der Seite 17:
