Nein, danke.
Denn nach dem Holocaust und 75 Jahre nach dem fast vollständigen Auslöschen des jüdischen Lebens in Deutschland ist es gut, dass wir wieder das Vertrauen der jüdischen Gemeinschaft haben, der Jüdinnen und Juden.
Momentan sind es, glaube ich, ungefähr 300 jüdische Soldatinnen und Soldaten, die in der Bundeswehr dienen. Und eigentlich müssen wir Danke sagen; wir müssen Danke sagen, dass das Vertrauen wieder da ist und dass auch die jüdische Gemeinschaft den Schritt gegangen ist, diesen Staatsvertrag mit uns zu unterzeichnen, gerade in Anbetracht unserer Geschichte.
Diese jüdischen Soldatinnen und Soldaten – wie alle anderen auch – dienen Deutschland. Sie beschützen Deutschland, sie riskieren ihr Leben für Deutschland, und deshalb haben sie auch ein Anrecht auf Militärseelsorge, genauso wie alle anderen Soldatinnen und Soldaten. Für die evangelischen und katholischen Soldaten ist es geregelt. Es gibt für Konfessionslose eine Anlaufstelle, und es gibt auch für Soldatinnen und Soldaten anderen Glaubens eine Anlaufstelle in Koblenz, in der sie Unterstützung und Rat finden. Ich glaube, dass wir es aber eben auch für Musliminnen und Muslime – auch wenn ich selber weiß, wie schwierig das ist, weil es dort nicht den zentralen Ansprechpartner/die zentrale Ansprechpartnerin gibt – werden regeln müssen.
Ich glaube im Übrigen nicht, dass irgendeine jüdische Soldatin oder ein jüdischer Soldat damit ein Problem haben wird.
Ich finde es richtig, dass alle das Anrecht auf Militärseelsorge haben; das ist auch gesetzlich verbrieft. Im § 36 des Soldatengesetzes heißt es:
Der Soldat
– es muss jetzt natürlich heißen „Die Soldatin“; vielleicht sollten wir das mal ändern –
