Frau Präsidentin! Liebe Kolleginnen und Kollegen! Es ist in der Tat etwas Besonderes, dass das Bundesverfassungsgericht in seiner Entscheidung in der vergangenen Woche festgestellt hat, dass die Grundrechte auch für Ausländer im Ausland gelten, wenn deutsche Staatsorgane tätig werden. Aber ich möchte an dieser Stelle auch sagen: Diejenigen, die jetzt glauben und triumphieren, dass die Ausland-Ausland-Fernmeldeaufklärung damit zur Strecke gebracht wurde, die sollten dieses Urteil richtig lesen.
Dann kommen sie nämlich auf den Trichter, dass eine Kernaussage dieses Urteils ist, dass die strategische Fernmeldeaufklärung grundsätzlich verfassungskonform ist
und dass der Gesetzgeber letztlich auch ohne Eingriffsschwelle diese erlauben kann, dass das möglich ist
und dass er das auch vorbehaltlos tun kann.
Das ist ein Fakt, mit dem wir uns auseinanderzusetzen haben. Das werden wir berücksichtigen, wenn es darum geht, auf dieses Urteil zu reagieren.
Ja, es stimmt: Das Bundesverfassungsgericht hat uns aufgegeben, den Bereich der Eingriffsverfahren, der Löschungsverfahren, der Kontrollverfahren, auch der Übermittlungsverfahren
