Herr Präsident! Liebe Kolleginnen und Kollegen! Liebe Frau Bundeskanzlerin! Ich bin Thüringerin, ich bin Deutsche und vor allem stolze Europäerin. Wie gar nicht so wenige in Europa bin ich in einer Diktatur geboren. Freiheit, Rechtsstaat, Gerechtigkeit – ich weiß, wie es sich ohne anfühlt. Deswegen: Europa ist und bleibt die beste Idee, die Europa je hatte.
Doch Deutschland und Europa befinden sich in einer doppelten Krise: in der Coronakrise und in der Klimakrise. Diese Krisen meistern wir nur, wenn wir beide gemeinsam bekämpfen, meine Damen und Herren. So vergleichsweise gut, wie wir in Deutschland durch die Coronakrise gekommen sind, wären wir doch prädestiniert dafür, beim Klimaschutz jetzt wirklich eine führende Rolle zu übernehmen.
Dazu haben Sie viele Sätze gesagt. Auch schon in Ihrer Rede anlässlich des Petersberger Klimadialogs haben Sie gesagt, dass Deutschland nicht am Klimaschutz sparen dürfe, sondern Investitionen in zukunftsfähige Technologien benötige. Aber nur Sätze zu sagen, das reicht eben nicht, sondern es braucht jetzt wirklich Taten.
In Brüssel haben Sie den nationalen Klimaplan ein halbes Jahr zu spät eingereicht: too little und too late.
Schauen wir uns das nationale Konjunkturprogramm an. Sie steigen mit 9 Milliarden Euro bei der Lufthansa ein mit flauschigen Absichtserklärungen zum Klimaschutz. Airbus hat das Ziel ausgegeben, bis zum Jahr 2030 emissionsfreies Fliegen zu ermöglichen. Wo ist denn Ihre Initiative, die europäischen Airlines gemeinsam auf Linie zu bringen, die Lufthansa voran?
Wo ist der Plan für den Bereich Schiene? 130 Milliarden Euro und kaum etwas für die Verkehrswende.
Über Ihr Konjunkturprogramm, Frau Merkel, Herr Scholz, haben Sie gesagt: Das ist ein Paket, das schickt man in die Welt, und dann hofft man, dass der Mensch sich freut. – Wir haben zu Recht gesagt: An diesem Paket ist nicht alles falsch; da ist viel Richtiges drin. Aber das sind eben kurzfristige Investitionen. Wir glauben, es braucht einen Pakt, eine echte Verabredung mit den Unternehmen in Deutschland, mit den Unternehmen in Europa, mit den Bürgerinnen und Bürgern dieses Kontinents und dieses Landes. Es braucht einen echten Pakt, der besagt: Wir verabreden uns – für langfristige Investitionen, für zukunftsfähige Investitionen, für echte Nachhaltigkeit. Wir brauchen diese Planungssicherheit, wenn wir die große Transformation, wenn wir die große Umstellung schaffen wollen, wenn wir es schaffen wollen, aus dieser Krise herauszukommen und nicht Altes zu restaurieren, sondern Neues zu schaffen, ökologisch und gerecht, resilient für die Zukunft, meine Damen und Herren.
Deswegen lautet meine große Bitte: Machen Sie diese Ratspräsidentschaft zur Klimapräsidentschaft.
Das ist das Ziel, das wir brauchen. Das heißt ganz praktisch: Unterstützen Sie ein europäisches Klimaschutzgesetz, das 65 Prozent Emissionsminderungen bis 2030 verankert und jährliche CO
die Pestizide und Überdüngung drastisch reduziert und die sich ernsthaft um das Tierwohl kümmert.
