Damit verfehlt das Gesetz – ebenso wie alle Vorgänger – seinen Zweck, es muss daher aus diesen Gründen verworfen werden.
In der Begründung zum Gesetz wird unter „Alternativen“ behauptet, dass es dazu keine Alternative gebe – wie auch die allseits beliebte Kanzlerin immer wieder von „alternativlos“ spricht. Hier im Parlament sieht man, dass es eine Alternative gibt.
In diesem Fall wäre die Alternative die vollständige Abschaffung dieses und vergleichbarer Gesetze wegen erwiesener Nutz- und Wirkungslosigkeit bei gleichzeitig exorbitanten Kosten.
Die Deutschen wurden vom Staat noch nie so rücksichtslos ausgeplündert wie heute: Im Jahr 2018 kassierte er etwa 770 Milliarden Euro Steuern. Die Steuereinnahmen des Staates haben sich seit Anfang der 90er-Jahre nahezu verdoppelt, obwohl die Bevölkerung kaum zugenommen hat – abgesehen natürlich von den Millionen durch den deutschen Steuerzahler alimentierten Wirtschaftsmigranten.
Was aber zugenommen hat, ist der ins Maßlose gesteigerte Wahn der neosozialistischen Regierung, die Welt retten zu müssen und das Geld der Deutschen mit vollen Händen an jeden zu verteilen, der nur laut genug schreit. – Sie schreien auch laut; super! – Ein Beleg dafür, dass wir auf dem Weg in eine sozialistische Diktatur sind,
ist das staatstragende Prinzip, gegen die Interessen der Bürger zu handeln. Nicht nur, dass diese Regierung uns Bürger in nie dagewesenem Maße ausplündert, sie will uns auch das Auto wegnehmen, uns vorschreiben, wie wir wohnen und leben sollen, selbst beim Essen werden wir gegängelt.
Die Umweltministerin nennt diesen Gesinnungsterror „sinnvolle Lebenslenkungswirkung“. Sinnvoll wäre es, wenn die unfähigste Umweltministerin seit Eiskugel-Jürgen ihren Ministerposten zur Verfügung stellen würde.
Natürlich soll die CO
– Ganz genau. Dabei ist völlig offen, wer benachteiligt wird und wer profitieren soll.
In unserem dazu gestellten Antrag fordern wir auch vor dem Hintergrund des durch die Regierung verordneten fast kompletten Herunterfahrens der Wirtschaft, wirkungslose bzw. überflüssige Ausgaben einzusparen.
