Ja, genau. Dass Sie das richtig finden, das glaube ich Ihnen sogar.
Was heißt das eigentlich? Heißt das, dass nach dem Bundesgleichstellungsgesetz Frauen und Männer grundsätzlich gleich sind, aber Frauen etwas gleicher sind?
Oder heißt das, dass jemand, der zufällig das Pech hatte, als Mann auf die Welt zu kommen, in diesem Moment schon jegliches Recht, als Gleichstellungsbeauftragter gewählt zu werden, verwirkt hat, weil er möglicherweise so etwas wie ein Macho-Gen in sich trägt?
Man muss sich das Ganze mal umgekehrt vorstellen. Man stelle sich mal eine Organisation vor, die sich die Gleichstellung der Geschlechter auf die Fahnen geschrieben hat und explizit alle Frauen ausschließt. Ich glaube, das Geschrei linker Frauenrechtsorganisationen würde diese Bundesrepublik bis ins Mark erschüttern, meine Damen und Herren.
Man würde wahrscheinlich den Verfassungsschutz auf den Plan rufen wegen klar erkennbarer gruppenbezogener Menschenfeindlichkeit, und das in diesem Falle wahrscheinlich sogar mit Recht.
Erklärt wird das Ganze dann immer mit den angeblichen strukturellen Benachteiligungen, unter denen Frauen zu leiden haben
und die man natürlich ausgleichen muss.
