Das passt allerdings sehr gut zu Ihrer Doppelzüngigkeit angesichts der Finanzierung; Hubertus Heil hat ja das Notwendige dazu gesagt.
Meine Damen und Herren, ich glaube, dass wir bei diesem Gesetzgebungsverfahren aufpassen müssen – es gibt bessere Modelle –, dass wir nicht etwas hinkriegen, was in der nächsten Legislaturperiode verbesserungsfähig ist. Ansonsten, wenn Sie Hoffnungen und Erwartungen wecken, die dann nicht in Erfüllung gehen, wird die gesetzliche Rentenversicherung beschädigt. Wir dürfen gerade in diesen Zeiten der Unsicherheit, die auch noch lange anhalten werden, keine Enttäuschung produzieren.
Darum hoffe ich, dass wir mit sehr großer Ernsthaftigkeit an dieses Verfahren herangehen und dass wir in der öffentlichen Debatte vor allen Dingen eines nicht vergessen: Die Grundrente ist eine Teilleistung, eine Mindestleistung. Ein insgesamt funktionierendes Altersversicherungssystem braucht aber drei Dinge, einen Dreiklang: Sie braucht ein angemessenes Rentenniveau – denn sie muss als Einkommensversicherung auch für die Mittelschicht funktionieren –, sie braucht die bereits angesprochene Mindestsicherung, und sie braucht ein breites Fundament, das heißt, wir brauchen endlich die Bürgerversicherung in der Rentenversicherung.
Dieser Dreiklang wird Vertrauen und Stabilität stärken. Das Gesetzgebungsverfahren, das uns bevorsteht, ist ein Baustein dafür, und wir werden es konstruktiv begleiten.
Vielen Dank.
Für die SPD-Fraktion hat nun die Kollegin Katja Mast das Wort.
