Sehr geehrter Herr Präsident! Sehr verehrte Kollegen! Verehrte Bürger! Zur ersten Lesung hörten wir noch vom Kollegen Brinkhaus aus der CDU/CSU-Fraktion, dass es keine zweite und dritte Lesung dieses Gesetzentwurfs geben wird, wenn die Grundrente nicht solide gegenfinanziert wird. Nun, diese Aussage hielt nicht besonders lange, und das, obwohl sich an dem Gesetzentwurf nicht das Geringste geändert hat. Mit anderen Worten: Die CDU/CSU-Fraktion lässt sich wieder einmal von der SPD vorführen und verrät wieder einmal ihre Prinzipien – oder vielleicht sollte man sagen: ehemaligen Prinzipien.
Herzlichen Glückwunsch im Übrigen an die CDU zum 75. Geburtstag! Man sollte meinen, in so einem Alter hat man genügend Erfahrung gesammelt, um sich gegen einen hyperaktiven Koalitionspartner durchzusetzen. Aber dem ist wohl nicht so.
Wir haben ja an dieser Stelle schon häufig über die Grundrente debattiert. Ich könnte nun wieder die Gründe anführen, warum wir die Grundrente für grundlegend falsch halten, warum wir dieses Konzept für zu teuer und vor allem für ungerecht halten, warum wir es für verheerend halten, das Äquivalenzprinzip – dass es also für eine bestimmte Leistung eine bestimmte Gegenleistung gibt – so dermaßen aufzuweichen, warum es falsch ist, die Rentenversicherung mit bürokratischen Aufgaben zu überlasten, um auf die denkbar komplizierteste und teuerste Art und Weise Geld zu verteilen, von dem am Ende doch so wenig Menschen profitieren.
Das alles möchte ich mir heute einmal sparen; denn alles, was zu diesem Thema gesagt werden konnte, wurde bereits gesagt: von den zahlreichen Sachverständigen in der öffentlichen Anhörung, von der Rentenversicherung und sogar von den eigenen Abgeordneten der Großen Koalition – wie wir heute wissen: vergeblich.
Stattdessen möchte ich heute lieber etwas zur Berechnung dieser Grundrente sagen. Mit Erlaubnis des Präsidenten möchte ich aus dem neuen § 76g SGB VI zitieren, bei dem es um die Berechnung der Grundrente geht:
Der Zuschlag an Entgeltpunkten wird ermittelt aus dem Durchschnittswert an Entgeltpunkten aus allen Kalendermonaten mit Grundrentenbewertungszeiten und umfasst zunächst diesen Durchschnittswert. Übersteigt das Zweifache dieses Durchschnittswertes den jeweils maßgeblichen Höchstwert an Entgeltpunkten nach den Sätzen 3 bis 5, wird der Zuschlag aus dem Differenzbetrag zwischen dem jeweiligen Höchstwert und dem Durchschnittswert nach Satz 1 ermittelt. Der Höchstwert beträgt 0,0334 Entgeltpunkte, wenn 33 Jahre mit Grundrentenzeiten vorliegen. Liegen mehr als 33, aber weniger als 35 Jahre mit Grundrentenzeiten vor, wird der Höchstwert nach Satz 3 je zusätzlichen Kalendermonat mit Grundrentenzeiten um 0,001389 Entgeltpunkte erhöht; das Ergebnis ist auf vier Dezimalstellen zu runden. Liegen mindestens 35 Jahre mit Grundrentenzeiten vor, beträgt der Höchstwert 0,0667 Entgeltpunkte. Zur Berechnung der Höhe des Zuschlags an Entgeltpunkten wird der nach den Sätzen 1 bis 5 ermittelte Entgeltpunktewert mit dem Faktor 0,875 und anschließend mit der Anzahl der Kalendermonate mit Grundrentenbewertungszeiten, höchstens jedoch mit 420 Kalendermonaten, vervielfältigt.
