Soziale Sicherheit und solide Staatsfinanzen sind eben keine Gegensätze, im Gegenteil. Sie fordern zu Recht von den Bürgern, eine Maske zu tragen. Wir fordern von Ihnen nur: Legen Sie Ihre ideologischen Scheuklappen ab!
Meine Damen und Herren, Kinder und Familien, insbesondere Alleinerziehende, waren und sind teils noch immer Verlierer dieser Krise. Daher – ich teile das – darf es nicht zu einem ähnlichen Lockdown und zu flächendeckenden Kita- und Schulschließungen kommen. Das muss regional entschieden werden; das ist richtig. Aber ich will auch darauf hinweisen, dass in der Pandemie die Kinderarmut in unserem Land weiter gestiegen ist. Damit können wir uns allesamt nicht abfinden. Jedes Kind muss gleiche Chancen haben.
Ich will in diesem Zusammenhang aus Ihrem Koalitionsvertrag zitieren. Da steht drin:
Wir werden Kinderrechte im Grundgesetz ausdrücklich verankern. Kinder sind Grundrechtsträger, ihre Rechte haben für uns Verfassungsrang.
Das haben Sie in Ihrem Koalitionsvertrag aufgeschrieben. Sie machen gar nichts in diese Richtung. Es kommt nicht in das Grundgesetz. Union und SPD haben hier offensichtlich die Bevölkerung selbst mit dem Koalitionsvertrag verklappst. Versprochen und gebrochen, das ist die Realität.
Dass eine solche Verankerung notwendig ist, haben wir in besonderer Weise in der Coronakrise gesehen. Frau Bundeskanzlerin, Sie haben sofort einen Autogipfel nach wenigen Tagen ausgerichtet. Aber ein Schulgipfel ist erst Monate später angesetzt worden. Das sagt alles über die Prioritätensetzung dieser Bundesregierung, meine Damen und Herren.
Dann sagen Sie immer: Die Länder sind zuständig. – Ich frage mich überhaupt, wieso wir eine Bundesbildungsministerin auf der Bundesebene haben.
Das ist wirklich eine zulässige Frage. Heute habe ich von Ihnen gehört, es solle Laptops wegen der Digitalisierung geben. Das hat auch Olaf Scholz gestern gesagt. „Donnerwetter!“, kann ich da nur sagen. Das ist doch schon 2016 von der Kultusministerkonferenz beschlossen worden. Was ist denn bis heute passiert?
Wissen Sie, was wir im Bildungssystem vor allen Dingen brauchen, liebe Frau Merkel: gut bezahlte Lehrerinnen und Lehrer. Wir haben aktuell einen dramatischen Lehrermangel. Das ist unser Hauptproblem: mehr Lehrerinnen und Lehrer, kleinere Klassen. Das ist entscheidend, wenn alle Kinder mitkommen sollen, meine Damen und Herren.
Ich mache Ihnen einen konkreten Vorschlag. Kippen Sie das 2-Prozent-Ziel der NATO! Wir haben einen Bildungsnotstand.
Aber kein Land bedroht die Bundesrepublik, meine Damen und Herren. Wenn wir jährlich 10 Milliarden Euro einsparen, dann könnten wir das Ziel erreichen, dass es keine Klasse in Deutschland mit mehr als 15 Schülerinnen und Schülern gibt. Das wäre einmal eine wirkungsvolle Maßnahme.
Wir würden kein Geld verbrennen, kein Steuergeld für Trump und das NATO-Ziel, sondern wir würden damit eines der besten und gerechtesten Schulsysteme der Welt aufbauen. Das wäre einmal eine Maßnahme, sozialpolitisch, bildungspolitisch und übrigens auch integrationspolitisch.
Schlechte Schulen und Kinderarmut sind eine toxische Mischung, die wir endlich auflösen müssen. Ein reiches Land mit der stärksten Wirtschaft Europas darf doch keine schlechten Schulen haben. Doch was passiert bei Ihnen? Sie geben Milliarden für die Rüstung aus. Der Verteidigungsetat ist unter dieser Regierung um 21 Prozent gestiegen.
Warum erhöhen Sie mitten in der Krise jetzt auch noch die Rüstungsausgaben deutlich? Warum geben Sie mehr Geld für Rüstung aus als für Gesundheit und Bildung zusammen? Das ist inakzeptabel, meine Damen und Herren.
Meine Damen und Herren, jede zweite Rente liegt in Deutschland unter 1 000 Euro. Davon haben 2,4 Millionen Rentnerinnen und Rentner über 40 Jahre eingezahlt. Und Ihre Grundrente ändert daran nichts. In den Niederlanden gibt es wirklich eine Grundrente, die ihren Namen verdient. Keine Rentnerin und kein Rentner erhält dort unter 1 255 Euro, und das ist bei uns ganz anders. Deutschland hat die stärkste Wirtschaft; aber bei Schulen und bei Renten sind wir Abstiegskandidaten in Europa. Wenn ein Durchschnittsverdiener in Wien und ein Durchschnittsverdiener in Würzburg in Rente gehen, dann gibt es in Wien 800 Euro Rente mehr als in Würzburg. Wie wollen Sie das wirklich erklären?
Deshalb: Nutzen Sie die Krise für eine grundlegende Reform. Wir machen einen Vorschlag: Lassen Sie zunächst mal alle Abgeordneten des nächsten Bundestages in die gesetzliche Rente einzahlen; das wäre doch ein wichtiges Symbol. Wir brauchen eine Rentenkasse, in die alle einzahlen. Wir werden hier noch vor Weihnachten einen entsprechenden Antrag vorlegen, und dem sollten Sie dann zustimmen. Das wäre zumindest ein wichtiger Schritt.
Eine zweite Großbaustelle des Sozialstaates ist die Pflege. Pflege wird immer mehr zur Armutsfalle. Es kann doch nicht sein, dass ein Pflegeplatz in Deutschland 2 000 Euro oder teilweise noch deutlich mehr kostet. Das ist kein Eigenanteil mehr; das ist Enteignung, meine Damen und Herren.
Und was tun Sie dagegen? Jeder dritte Pflegeheimbewohner muss inzwischen Sozialhilfe beantragen. „Wozu gibt es denn eigentlich eine Pflegeversicherung?“, fragen da viele Betroffene. Ich meine, Sie haben hoffentlich nach der Pandemie im Gesundheitswesen dazugelernt, dass Kommerzialisierung wirklich der falsche Weg ist und dass wir hier auch wirklich die Eigentumsfrage stellen müssen.
Aber wo ist denn aktuell die bessere Bezahlung in der Kranken- und Altenpflege? Wann senken Sie denn mal die Eigenanteile? Die Pflegeversicherung hat 10 Milliarden Euro mehr in diesem Jahr als 2017, und trotzdem fließt weniger Geld in die Altenheime. Ihr Sparprogramm müssen die Bewohner durch explodierende Kosten und das Pflegepersonal über magere Löhne bezahlen. Ein Sozialstaat ohne ein gutes Renten- und Pflegesystem ist wie eine Schule ohne Lehrer, meine Damen und Herren.
Hier müssen Sie handeln und dürfen sich hier auch nicht hinter der Pandemie verstecken, meine Damen und Herren. Handlungsbedarf ist angesagt – für die Menschen, die dort arbeiten, die Sie in den letzten Wochen und Monaten vielfach beklatscht haben.
Sie geben Hunderte Milliarden aus und schaffen es aber nicht, dieses Land – mit diesem Haushalt erst recht nicht – krisenfest zu machen. Mit einem Teil des Geldes – nur mit einem Teil des Geldes! – könnten wir den Sozialstaat, das Gesundheitssystem und die Schulen fitmachen für die nächsten Jahre. Stattdessen wird durch Ihre Politik Steuergeld auf eine Art ausgegeben, dass das Land nach der Krise noch tiefer gespalten sein wird, und das, meine Damen und Herren, ist ein Riesenproblem.
Deshalb: Dieser Haushalt, der kann nicht Krise, dieser Haushalt kann überhaupt nicht soziale Sicherheit, dieser Haushalt kann nicht Zukunft, und deswegen sollte er grundsätzlich verändert werden.
Herzlichen Dank.
Nächster Redner ist der Fraktionsvorsitzende von Bündnis 90/Die Grünen, Dr. Anton Hofreiter.
