Frau Präsidentin! Meine Damen und Herren! Unser Schulsystem entspricht in Normalzeiten oft dem eines Schwellenlandes – wenn man die Analphabetenquote betrachtet. In Zeiten von Corona entspricht es dem frühen Mittelalter,
insbesondere deswegen, weil Deutschland bei digitaler Bildung himmelweit zurückliegt.
Was die Grünen heute vorlegen, habe ich in weiten Teilen mit Fieberthermometer im Coronakrankenbett schon in meinem Antrag im März geschrieben sowie im Thesenpapier „Lehren aus der Corona-Krise“. So viel Übereinstimmung heute, liebe Grüne, das rührt mein Herz.
Laut Schulbarometer haben nur 36 Prozent der Lehrkräfte ihre Schüler über Onlineplattformen erreicht. In der Schweiz und in Österreich – da gibt es noch mehr Verschwörungstheoretiker, die einen auf Orwell machen – haben dagegen fast doppelt so viele Lehrkräfte ihre Schüler erreicht: 60 bzw. 65 Prozent. Dass Deutschland bei diesem Thema in der Krise versagt, darunter leiden insbesondere die finanziell Schwachen und die ohnehin schon Bildungsferneren.
Angela Merkel hat 2008 die „Bildungsrepublik Deutschland“ ausgerufen. Heute haben wir keine Bildungsrepublik Deutschland, sondern in Teilen eine Bildungsarmutsrepublik, und das ist beschämend.
Genauso beschämend war der schwarz-rote Auftritt heute Nachmittag beim DigitalPakt Schule, der war so desaströs, dass sich heute kaum noch einer hierher traut, um eine zweite Rede zu halten.
Union und SPD spielen ein billiges Schwarzer-Peter-Spiel, sie schieben alles auf die Länder und tragen keine Sorge für ein einigermaßen solides nächstes Schuljahr. Meine Damen und Herren, Schulpflicht hat zwei Seiten: Kinder müssen zur Schule gehen, und der Staat hat die verdammte Pflicht, ihnen Unterricht zu bieten,
und zwar analog wie digital, Präsenzunterricht wie Distanzunterricht. Die Koalitionsfraktionen, die Bildungsministerin, sie üben sich im Beamtenmikado und haben dabei leider auch noch eine richtige Glückssträhne.
Bund und Länder haben immer noch keine Positivliste seriöser Onlineanbieter erstellt. Das wäre der einzig krisenfeste Weg für stabilen Unterricht nach den Sommerferien. Corona schüttelt unsere Schulen durch, und Union und SPD benehmen sich wie Schönwetterkapitäne.
Was wir jetzt brauchen:
