Frau Präsidentin! Meine Damen und Herren! In Griechenland zündeten Migranten ihre Zelte und Aufnahmelager an, Kirchen wurden verwüstet. Ziel der Brandstifter war: dauerhafte Aufnahme in Europa, am liebsten in Deutschland.
Linke und Grüne unterstützen dieses Ziel heute hier im Bundestag. Alle sollen kommen: Dann könnt ihr bleiben! – Auch die Bundesregierung will Tausende aufnehmen; das ist das Signal. Das ist ein katastrophales Signal. Alle sollen kommen. Also, zündet eure Lager an, dann könnt ihr bleiben, dürft sogar weiter bis nach Deutschland. – Die Schleusermafia reibt sich die Hände; denn Deutschlands Regierung belebt ihr Geschäft. Sie alle hier unterstützen die internationalen Schlepper, Erpresser und Betrüger. Das muss mal klar gesagt werden.
Griechenlands Regierung protestierte dagegen im Sommer 2019.
Das Beispiel Ungarn steht ja allen noch vor Augen: Zunächst campierten nur wenige Tausend am Bahnhof von Budapest. Für sie öffnete Merkel die Grenzen. Die Bilder lösten einen gigantischen Sog aus – bis in den letzten Winkel von Orient und Afrika. Millionen Menschen setzten sich plötzlich in Bewegung. In endlosen Menschenschlangen durchbrachen sie alle Grenzen.
Ist Ihnen das keine Lehre? Haben Sie nichts aus der Geschichte gelernt?
Sie machen aus Deutschland ein Siedlungsgebiet für jeden, der kommen will; eine Art offenes Buffet, an dem sich jeder bedienen kann. Das werden wir nicht zulassen.
Wir werden Deutschland und seine Kultur erhalten als den einzigen Flecken Erde – hören Sie zu! –, an dem wir Deutsche uns wirklich zu Hause fühlen können.
Entgegen Ihrer Behauptung ist Ihre Politik auch alles andere als humanitär. Sie ist zynisch, weil sie falsche Signale setzt. Unzählige Menschen in aller Welt werden entwurzelt. Sie verkaufen ihr Land, ihr Vieh, geben Tausende Dollar an die nordafrikanische Schleppermafia und lassen sich dann auf löchrigen Booten nach Europa schiffen.
Ihnen allen hier geht es doch gar nicht um die Menschen. Ihnen geht es um die Bilder, letztlich um populistische Selbstdarstellung; das ist der Fall, meine Damen und Herren.
Berlins Innensenator von der SPD, Grünenchefin Göring-Eckardt,
