Sehr geehrter Kollege, wenn Sie erlauben – da waren ja ein paar Unterstellungen drin –, würde ich Ihnen gerne antworten.
Das Erste ist die Frage: Wie hält man es mit Werkverträgen? Werkverträge sind tatsächlich im Wirtschaftsleben etwas total Normales; sie wird es auch in vielen Bereichen weiter geben. Ich mache Ihnen mal ein Beispiel: Wenn Sie eine Firma hätten und sich einen Handwerker bestellen, der eine Sicherheitsanlage einbaut – das ist ein ganz normaler Werkvertrag. Das wird es immer geben. Im Rahmen der Vertragsfreiheit ist das vollkommen in Ordnung.
Hier haben wir es mit dem Missbrauch von Werkverträgen in hohem Maße zu tun, mit Sub-Sub-Subunternehmern. Deshalb sage ich Ihnen – danke, dass ich die Gelegenheit habe, Ihnen das zu sagen –: Ich werde mit Werkverträgen und mit Leiharbeit in der Schlachtbranche Schluss machen. Wir werden das verbieten in diesem Bereich, weil wir das erlebt haben.
Zu Ihrer zweiten Frage zu den Kontrollen. Wir haben in den letzten Wochen und Monaten unter Führung des Bundesfinanzministers Olaf Scholz, der für den Zoll zuständig ist, die Fleischbetriebe in Deutschland kontrolliert. Über 130 Razzien hat es gegeben.
Ich habe vorhin gesagt: Es sind verschiedene Behörden zuständig: für den Arbeitsschutz die Länder, der Zoll für die Schwarzarbeitskontrolle. Es sind erhebliche Verstöße ans Licht gekommen. Wir haben den Zoll personell aufgestockt. Und deshalb ist die Erfahrung, die wir in dieser Branche haben: Es nützen die schärfsten Regeln nichts, wenn man nicht auch kontrolliert. Das werden wir tun. Darauf können Sie sich verlassen.
Der Kollege Ernst bekommt das Wort zu einer Frage oder Bemerkung. Allerdings werde ich weitere Fragen und Bemerkungen im Rahmen der Rede des Ministers nicht zulassen.
Schade eigentlich, Frau Präsidentin.
Ich ahnte das schon.
