– „Brauner“ Humor. Ich finde, das ist einfach die Verneinung von Wahrheiten; das muss man hier in diesem Haus, glaube ich, auch mal öffentlich machen. Das, was diese Kolleginnen und Kollegen hier machen, ist einfach die Verneinung der Wahrheit.
Ich hoffe inständig, dass wir von diesem Änderungsgesetz und von diesen Regelungen nie Gebrauch machen müssen.
– Ich würde meine Rede gerne fortsetzen.
Sie können gleich gerne weiterpöbeln, aber ich würde gerne meine Rede halten, und Sie können sich dem demokratischen Diskurs im Ausschuss gerne stellen.
Das ist ein Notmechanismus. Er hat enge Voraussetzungen, einen begrenzten Anwendungsbereich und eine demokratische Absicherung durch den Wahlprüfungsausschuss, damit er eben nicht zweckentfremdet werden kann.
Die erste Lesung ist zugleich immer auch ein erster Aufruf des Themas, und weitere Themen liegen weiterhin auf dem Tisch. Ich spreche nur mal an, dass vereinsrechtliche Regelungen und Anpassungen insbesondere für Parteien weiterhin notwendig sind, insbesondere im Hinblick auf die Digitalisierung. Ich sehe, dass auch die Selbstvergrößerung des Deutschen Bundestages nach der jüngsten Einigung im Koalitionsausschuss als ein weiteres Thema für diesen Regelungskomplex auf dem Verhandlungstisch liegt,
und ich sehe auch, dass wir Lücken im Parteienrecht – und das wird die AfD-Fraktion sicherlich besonders interessieren – zu schließen haben und schließen wollen, insbesondere was den Missbrauch von Wahlwerbung, Unterstützung durch Dritte und Finanzierung durch Dritte betrifft. Bei diesem Thema würde ich mir von der AfD den gleichen Eifer wünschen, den Sie heute gezeigt haben, und dass Sie in Sachen Transparenz im Parteienrecht eng an unserer Seite in diesem Haus streiten.
Ich finde, wir haben über Parteigrenzen hinweg sehr gute überparteiliche Gespräche zu diesem Thema angestoßen. Dass sich eine bestimmte Partei nicht sachdienlich an diesem Diskurs beteiligen will, weil sie Wahrheiten verneint, nehme ich hier zur Kenntnis.
Herr Kollege.
Ansonsten bitte ich um konstruktive Diskussionen im Ausschuss. Ich freue mich bereits jetzt auf die zweite und die dritte Lesung und bedanke mich beim Präsidenten, dass er mir 25 Sekunden zusätzlich gewährt hat.
Vielen Dank für die Aufmerksamkeit.
Jetzt waren es 30 Sekunden, aber das ist völlig egal. – Vielen Dank, dass Sie zum Ende gekommen sind, Herr Kollege Özdemir.
Als nächster Redner erhält von mir der hellwache Kollege Konstantin Kuhle, FDP-Fraktion, das Wort.
