Herr Präsident! Meine lieben Kolleginnen und Kollegen! Ich weiß nicht, womit ich gestraft bin. Fast in jeder Debatte muss ich nach dem Herrn Frohnmaier reden. Herr Frohnmaier, das Thema ist wirklich einfach zu ernst und zu groß, als dass ich mich jetzt hier mit Ihrem kleinen nationalistischen Dünnpfiff abgebe, sorry.
Ich werde zum Thema kommen: Wir haben eine Woche hier angesetzt, in der wir über die 17 Ziele für nachhaltige Entwicklung reden. Ich sage ganz bewusst nicht: eine „Nachhaltigkeitswoche“, in der es um Klima und Umwelt geht, sondern es gibt 17 Ziele der Vereinten Nationen, die alle zusammengehören und alle wichtig sind. Die ersten beiden besagen nicht umsonst, Hunger und Armut bis 2030 zu überwinden. Das sind die ersten beiden Ziele.
Dazu – Herr Kollege Klein hat es angesprochen – war am Mittwoch der Direktor des Welternährungsprogramms der Vereinten Nationen David Beasley im Ausschuss. Er hat uns ganz eindringlich und drastisch geschildert, wie sich diese Zahlen entwickelt haben und wie weit wir sind, um diese Ziele zu erreichen. Ich sage: Bereits vor der Coronapandemie sah das nicht gut aus. Ich erinnere noch mal: 2015 hat die Weltgemeinschaft gesagt, innerhalb von 15 Jahren will sie Hunger und Armut überwinden. Wir haben es geschafft, von 2000 bis 2015 den Anteil der Hungernden an der Weltbevölkerung zu halbieren. Aber fast 800 Millionen Menschen sind sozusagen übrig geblieben, und das sind nicht wenig. Wir hatten schon 2018 leider wieder einen leichten Anstieg auf über 821 Millionen Menschen, die hungern. Durch die Coronapandemie kann die Zahl jetzt auf über 1 Milliarde ansteigen.
Das muss uns hier in diesem Hohen Haus ein Warnsignal sein. Von dieser Woche, von dieser Debatte muss ein Mahnruf ausgehen. Wir müssen zeigen, wie die Entwicklung bei den beiden wichtigsten bzw. ersten Zielen verläuft. Aus menschlicher Sicht sind es die wichtigsten Ziele; denn wenn du verhungerst, nutzt dir alles andere auch nichts. Auch Digitalisierung und Bildung nutzen dir nichts, wenn du verhungerst.
Natürlich ist es wichtig, dass wir auch noch mal mit finanziellen Mitteln viel helfen. Ich bin auch stolz und froh, dass es uns gelungen ist – die Kollegen des Hauses und der Entwicklungsminister haben sich eingesetzt, aber auch unser Finanzminister Olaf Scholz –, dass wir in dieser Legislaturperiode im Entwicklungshaushalt so hohe Aufwüchse pro Jahr bei den Mitteln für Entwicklungszusammenarbeit hatten wie noch nie. Ich bin seit 2002 dabei. Seither gab es noch nie jedes Jahr mindestens 1 Milliarde Euro, dieses Jahr mit den Coronasondermitteln sogar über 2 Milliarden Euro. Insgesamt 3,55 Milliarden Euro zusätzlich in 2020 und 2021 für die EZ, humanitäre Hilfe, als Sondercoronaprogramm.
Aber: Geld alleine wird Menschen auch nicht aus Hunger und Armut führen können. Es ist wichtig, jetzt zu helfen – klar. Wenn ein Haus brennt, kann man nicht sagen: Jetzt warte ich erst einmal, bis ich eine schicke Feuerwehr habe. – Ich muss mit den Mitteln löschen, die ich zur Verfügung habe. Deswegen ist es auch wichtig, über soziale Sicherungssysteme und alle Hilfsmaßnahmen hungernden Menschen direkt zu helfen.
Natürlich geht es langfristig darum, Menschen zu empowern, wie man so schön sagt, in die Lage zu versetzen, dass sie selbstbestimmt von ihrer eigenen Hände Arbeit würdig leben können. Dazu gehört auch fairer Handel. Dazu gehört menschenwürdige Arbeit. Hier brauchen wir faire Handelsverträge. Wir brauchen auch Unternehmen, die überall auf der Welt Menschenrechte umsetzen, meine sehr verehrten Damen und Herren.
Ich bin sehr stolz und froh, dass es in der Bevölkerung eine große Zustimmung gibt. In meinem Wahlkreis gibt es viele, die in Eine-Welt-Läden arbeiten, die sich ehrenamtlich für eine bessere Welt engagieren. Wir haben bereits mit Gelnhausen, Erlensee, Rodenbach drei Kommunen, die sich engagieren. Jetzt kommt die größte Stadt Hanau dazu. Die wird im November Fair-Trade-Town. Herzlichen Glückwunsch dazu.
– Ja, da kann man einmal klatschen. Danke.
