Sehr geehrte Frau Präsidentin! Meine Damen und Herren! Das, was uns hier von den Linken vorgelegt wurde, das sogenannte Soforthilfeprogramm, macht den Eindruck, als habe die Antifa aus Leipzig an Sie, Frau Lay, einen Wunschzettel übergeben,
den Ihre Mitarbeiter ein wenig aufgearbeitet haben und den Sie dann ins Parlament eingebracht haben. Mehr ist das nicht.
Sie fordern in Ihrem Antrag allen Ernstes ein Moratorium für Mieterhöhungen, ein Verbot von Zwangsräumungen und eine Senkung der Nettokaltmiete um 30 Prozent.
Warum eigentlich nur um 30 Prozent? Warum nicht um 50 oder 80 Prozent?
– Ja, oder 100 Prozent.
Dann sollen Sammelunterkünfte aufgelöst werden, und sogenannten Geflüchteten soll angemessener Wohnraum dezentral zur Verfügung gestellt werden.
