Auch der Beschluss der EZB vom 3. und 4. Juni ist abrufbar, in dem dargelegt wird, wie die Prüfung stattgefunden hat. Uns wurden auch die jüngsten Unterlagen zur Verfügung gestellt, aus denen hervorgeht, dass das PSPP systematisch in Bezug auf die Verhältnismäßigkeit geprüft wurde. Die einzelnen Maßnahmen, wie dargelegt wurde, wurden dem Bundestag zur Verfügung gestellt, und wir haben sie in unsere Debatten einfließen lassen.
Der nun gewählte Weg, wie wir ihn hier beschreiten, schafft darüber hinaus mehr Transparenz und somit noch mehr Vertrauen. Erkennbar wurden die Vor- und Nachteile immer abgewogen. Umfang und Anteile am Gesamtvolumen der verschiedenen Ankäufe im Hinblick auf die mögliche monetäre Staatsfinanzierung wurden ausreichend beachtet. Es ist daher nur folgerichtig, dass wir heute feststellen, dass der Beschluss des EZB-Rates und unser eigenes langjähriges Handeln genügen, um die Anforderungen des Urteils des Bundesverfassungsgerichts zu erfüllen.
Die Bundesrepublik Deutschland ist fest in der Europäischen Union verankert. Die europäische Integration ist Aufgabe unseres Grundgesetzes. Sie hat den Frieden in Europa gesichert, die staatliche Einheit ermöglicht und zu Wohlstand und sozialem Fortschritt beigetragen.
Das ist eine klare Haltung, wie wir in Deutschland zu Europa stehen. Dieser Haltung schließen sich in unserer Resolution dreieinhalb Fraktionen an. Darauf können wir stolz sein.
Bei der FDP scheint es eine gewisse Spaltung zu geben.
Da gibt es die Proeuropäer wie Michael Link, Konstantin Kuhle, und da gibt es die anderen, die eher die national orientierten Interessen nach vorne treiben, wie mein Fußballkollege Frank Schäffler – das ist ganz klar; mit dem habe ich mich noch einmal darüber unterhalten. Wissen Sie, woran man die Spaltung bei Ihnen merkt? Wenn einer von dem zweiten Block redet, klatscht immer die AfD. Da braucht man sich gar nicht viel Mühe zu geben, das merkt man daran. Das sollte Ihnen in diesem Punkt zu denken geben.
Vielleicht ist es Ihnen möglich, dass man die proeuropäische Seite – Sie haben viele gute Proeuropäer in Ihren Reihen – stärker einbringt.
Über die Forderung der Linken und der Grünen nach einer rechtlich verankerten Berichtspflicht kann man natürlich nachdenken.
– Ja, man kann auch laut dazwischenschreien; das geht immer. Kopfnoten wären gar nicht so schlecht bei Ihnen. – Ich persönlich kann mich auch der Forderung von Fabio De Masi und der Linken anschließen, dass man über eine Erweiterung und Veränderung des Auftrags der EZB reden kann. Auch dem kann ich mich anschließen.
Wir werden das diskutieren müssen.
