Vielen Dank. – Frau Präsidentin! Liebe Kolleginnen und Kollegen! Frau Kollegin Baerbock, Sie haben sich mit Ihrem Antrag schlicht und ergreifend verrannt.
Erstens ist es ja so, dass ich so einen speziellen Antrag noch nie gesehen habe: ein einziger Satz,
einfach so ohne Begründung. Es gibt keine Erklärung: Geht es um Außenpolitik, geht es um Wirtschaftspolitik, geht es um Menschenrechte? Jetzt weiß ich ja, worum es Ihnen geht;
aber vorher wusste ich es jedenfalls nicht.
Der Satz lautet, man fordere dazu auf, „dass sich die Bundesregierung umgehend von der Pipeline Nord Stream 2 distanziert und die Fertigstellung über geeignete Maßnahmen verhindert“.
Ist das jetzt nur Ignoranz, oder ist das Faulheit?
