Sehr geehrte Frau Präsidentin! Sehr verehrte Damen und Herren! Herr Minister! Die Arbeitswelt befindet sich in einem tiefgreifenden Wandel, hervorgerufen durch die Digitalisierung und die Klimakatastrophe. Durch die Coronapandemie sind ganze Branchen in Schwierigkeiten geraten. Die Leidtragenden sind überwiegend die Beschäftigten, die durch Arbeitsplatzverlust und Einkommenseinbußen Zukunftsängste für sich und ihre Familien haben.
Zur Wahrheit gehört aber auch, dass viele Probleme schon lange existieren und erst durch Corona – wie sagt man immer so schön hier in diesem Haus? – wie durch ein Brennglas sichtbar geworden sind. Den Pflegenotstand gibt es nicht erst seit März dieses Jahres, aber seit Corona arbeiten die Pflegekräfte auch noch unter einem erhöhten Infektionsrisiko, wie die Zahlen des Robert-Koch-Instituts beweisen, und nach wie vor mit zu wenig Personal und mit zu langen Arbeitszeiten.
Die Erzieherinnen, Müllmänner und Beschäftigten im öffentlichen Dienst, die immer schon sehr wichtig für diese Gesellschaft waren, wurden es unter Coronabedingungen erst recht. Wer hat denn im Lockdown die Kinder betreut, den Müll weggebracht, die Anträge auf Hartz IV und Kurzarbeit bearbeitet usw.? Und denen sagt man nun in der aktuellen Tarifrunde, dass eine Lohnsteigerung um 4,8 Prozent unangemessen sei! Anderes Beispiel: die Beschäftigten in der Deutschen Post AG. Die Deutsche Post AG hat im ersten Halbjahr 2020 eine Gewinnsteigerung von 48 Prozent erzielt. Das muss man sich einmal auf der Zunge zergehen lassen: 48 Prozent!
Die Beschäftigten aber will man mit einer Lohnerhöhung von 1,5 Prozent abspeisen.
Es gäbe noch etliche Beispiele mehr. Diese Kolleginnen und Kollegen haben den Laden am Laufen gehalten, sie haben sich dem Risiko einer Infektion ausgesetzt, und hier im Haus hat man ihnen stehend applaudiert. Jetzt aber predigt man Verzicht. Wo bleibt denn die Initiative, über eine Vermögensabgabe die Superreichen zur Finanzierung der Krise heranzuziehen?
Offensichtlich verwechseln einige die Dienstleistungsgesellschaft mit einer Dienstbotengesellschaft.
