Frau Präsidentin! Liebe Kolleginnen und Kollegen! Am kommenden Samstag feiern wir 30 Jahre Wiedervereinigung. Der Fall der Berliner Mauer ging dem voraus, aber es war nicht nur der Fall der Berliner Mauer. Es war der Fall des Eisernen Vorhangs. So feiern wir eben nicht nur die Wiedervereinigung Deutschlands, sondern auch die Wiedervereinigung Europas. Es war jemand anderes, der einst sagte: Die ersten Steine der Berliner Mauer, lieber Kollege Sarrazin, wurden von Polen herausgebrochen. – Ich glaube deswegen: In diesen Tagen sollten wir uns insbesondere des Muts vieler in Europa erinnern, die hier vorangegangen sind; denn ohne sie wäre all das nicht möglich gewesen.
Ich möchte an diesem heutigen Tag im Rahmen einer Haushaltsdebatte nur einmal daran erinnern – wir reden ja oft über Zahlen oder über das, was vielleicht hätte noch besser gemacht werden können, was sicherlich alles richtig ist –: Wenn wir auch mal den Blick zurück wagen und schauen, wie die Länder, wie ganze Landstriche damals aussahen, dann sehen wir dabei eben auch, welche Erfolgsgeschichte die europäische Integration ist, ohne die die deutsche Wiedervereinigung so nicht hätte stattfinden können.
Wir haben seit der Wiedervereinigung nun zum vierten Mal die Ratspräsidentschaft inne. In der Tat: Viele dicke Brocken lagen vor uns, liegen nach wie vor vor uns. Vieles konnte auch schon angepackt und gelöst werden – auch hier nicht durch Deutschland allein. Die Basis für den Erfolg der Verhandlungen zum mehrjährigen Finanzrahmen und natürlich auch zum Wiederaufbaufonds, dem Recovery Fund, wie er auch genannt wird, wurde vor allem durch einen deutsch-französischen Kompromiss gelegt. Einmal mehr: Ohne Deutschland und Frankreich im Zusammenwirken wird dieser Motor, den wir in Europa brauchen, nicht funktionieren bzw. sich das Ganze nicht bewähren.
Ich finde, heute ist ein erfreulicher Tag – Michael Roth hat darauf bereits hingewiesen –, was das Thema der Rechtsstaatlichkeit und den Rechtsstaatsmechanismus angeht:
Wir konnten in Brüssel mit einer Mehrheitsentscheidung nun dem deutschen Vorschlag zum Erfolg verhelfen,
der einigen Ländern nicht weit genug geht.
– Kollege Graf Lambsdorff, da haben Sie durchaus recht. – Ich denke da an Belgien, die Niederlande, Dänemark, Schweden, aber auch
Finnland, denen dieser Vorschlag nicht weit genug geht. Aber ich glaube, es ist im ersten Aufschlag ein Kompromiss; denn zum ersten Mal haben wir nun tatsächlich veritabel festgelegt,
dass die Rechtsstaatlichkeit ein Prinzip in Europa ist,
das gelebt werden muss.
