Sehr geehrte Frau Präsidentin! Werte Kolleginnen und Kollegen! Deutschland ist bislang gut durch die Krise gekommen. Deutschland ist auch deshalb gut durch die Krise gekommen, weil wir eine nachhaltige und sehr vernünftige Haushalts- und Finanzpolitik machen. Warum ist diese Haushalts- und Finanzpolitik klug?
Weil wir investieren. Der Bund investiert, nimmt Geld in die Hand. Der Bund hilft den Unternehmen mit Sofort-, mit Überbrückungshilfen. Wir haben jetzt auch ein Konjunkturpaket verabschiedet, um die Folgen der Pandemie, des Lockdowns abzumildern und Arbeitsplätze zu sichern. Wir nehmen Geld in die Hand, um aus der Krise durchzustarten, und gleichzeitig sagen wir auch ganz klar: Im kommenden Jahr muss die Schuldenbremse wieder eingehalten und die Neuverschuldung zurückgefahren werden. Denn das ist auch eine Frage der Generationengerechtigkeit und der Nachhaltigkeit, meine Damen und Herren.
Wir haben in der letzten Sitzungswoche eine Nachhaltigkeitswoche auf die Tagesordnung gesetzt. Wir reden nicht nur, wir handeln auch. Ich bin stolz, dass wir Umwelt- und Klimapolitiker Einfluss auf dieses Konjunkturprogramm genommen haben in dem Sinne, dass wir jetzt in die Zukunft investieren. Corona hat uns gelehrt, dass wir präventiv handeln müssen, dass wir nachhaltig aus dieser Krise durchstarten müssen, dass wir uns gleich für die nächste Herausforderung, den Klimawandel, der im Moment schon intensiv greift, wappnen müssen, dass wir dem begegnen müssen. Wir investieren mit diesem Konjunkturpaket 40 Milliarden Euro in den Umwelt- und Klimaschutz, in Umwelt- und Klimainnovation, zum Beispiel in die Innovationsprämie, in Flottenaustauschprogramme, in das CO
Zur Wahrheit gehört auch, dass wir mit diesem Haushalt die Mittel für den Klimaschutz verdreifachen. Deswegen sage ich ganz klar an die Adresse der Opposition: Hören Sie doch einmal auf mit dem Märchen, dass wir nicht in Klimaschutz investieren! Das stimmt einfach nicht.
Als Nächstes: Hören Sie auf mit dem Märchen, dass die Regierung, dass der Bundestag nichts für Klimaschutz macht! Wir haben ein Klimapaket auf den Tisch gelegt – wir haben dieses Klimapaket verabschiedet,
sind jetzt in der Umsetzung –, das seinesgleichen sucht, mit einem Klimaschutzprogramm mit 60 Maßnahmen, mit dem Klimaschutzgesetz, mit Monitoring, mit Zielen in den Sektoren, und wir geben CO
Und jetzt sage ich auch an die Adresse der Opposition: Eine solche Kraftanstrengung haben auch die Grünen unter Rot-Grün nicht hinbekommen. Das gehört zur Wahrheit dazu. Die Grünen haben damals die Chance verpasst, ein solches Paket zu verabschieden.
– Ja, das gehört zur Wahrheit dazu. Man merkt an Ihrer Rede, dass Ihnen die Argumente bezüglich der Kritik an diesem Paket ausgehen.
Es ist ein gutes Paket. Warum ist das Paket gut?
