Deswegen hat es keinen Sinn, mit dem Finger auf andere zu zeigen. Das kann einen ganz schnell wieder einholen.
Es ist für mich wichtig, dass wir in Mecklenburg-Vorpommern – auch wenn der intensive Austausch zwischen den Ländern weitergehen muss – erstens einen festen Zaun gebaut haben, der dreimal pro Woche kontrolliert wird, der im Übrigen 1,50 Meter hoch, 30 Zentimeter tief eingegraben und mit einem Unterwühlschutz versehen ist. Wenn wir das überall gemacht hätten, dann hätten wir das Problem in der Form nicht.
Das sage ich sehr klar und deutlich.
Zweitens haben wir eine enge Kooperation zwischen den Veterinärbehörden, und wir haben die Testkapazitäten komplett hochgefahren. Ich glaube, sehr geehrte Frau Bundesministerin, auch die Telefonschaltkonferenz gestern Abend war zielführend in der Richtung, wie wir die Zusammenarbeit intensivieren können, und zwar über Landesgrenzen und Nationen hinaus. Wir erhalten aber zurzeit überhaupt keine Informationen mehr aus Polen über die Situation dort. Ich bedaure das sehr.
Im Übrigen haben wir auch intensive seuchenprophylaktische Übungen gemacht, auch länderübergreifend mit Brandenburg, aber auch nationenübergreifend mit Polen. Ich war der Erste, der die sogenannte Pürzelprämie in Deutschland auf den Weg gebracht hat, mit der wir großen Erfolg haben. Allein in unserem Bundesland sind im Durchschnitt der letzten Jahre etwa zwischen 130 000 und 168 000 Stück Schwarzwild gefallen. Im letzten Jahr waren es 196 000 Stück. Es hilft also.
Meine dringende Bitte ist da: Der Bund möge sich daran – auch an den Kosten – beteiligen, damit wir die Jägerschaft weiter motivieren, uns bei dieser Bekämpfungsmaßnahme zu helfen. Wenn wir sie demotivieren und mit dem Finger auf sie zeigen, kommen wir keinen Millimeter weiter. Im Übrigen sind auch die Landwirte aktiv mit einzubinden.
Dass wir jetzt ein Ernteverbot aussprechen, ist aus meiner Sicht nicht nur richtig, sondern auch zielführend. Wir müssen in diesen Gebieten Ruhe bekommen, und wir müssen diesen Krisenherd so schnell wie möglich ausgeräumt bekommen. Ich nehme aktuell zur Kenntnis, dass angeblich weitere Fälle aufgetreten sind, und zwar in Stadtnähe. Ich hoffe, wir alle wissen, was das bedeuten würde. Auch das nehme ich zur Kenntnis.
Es ist unbedingt wichtig, dass wir weitere Barrieren schaffen. Ich weise an dieser Stelle darauf hin, dass wir an der Autobahn A11 die Wildschutzzäune komplett neu hergerichtet haben; sie wurden im letzten Jahr fertiggestellt. Ich sage auch ausdrücklich den Landwirten Unterstützung zu. Hier bitte ich um weitere Unterstützung, um die Früherkennung weiter hochzufahren. Wir müssen bei den Nutztierbeständen einen genauen Überblick haben. Von den 250 Betrieben in Mecklenburg-Vorpommern beteiligen sich 70 Betriebe an der Früherkennung.
Ich glaube, wir müssen uns auch auf weitere Entschädigungsregelungen einstellen, und zwar nicht nur in der Landschaftswirtschaft. Wir müssen zu einer Verwertungskette kommen, was die Sauen – die Wildbestände, aber auch die Haustierbestände – angeht.
