Sehr verehrter Herr Präsident! Meine Kolleginnen und Kollegen! Manches von dem, was der Kollege Ullrich angesprochen hat, könnte ich jetzt mit vollster Inbrunst wiederholen,
weil verfassungsrechtliche Fragen als solche richtig beantwortet wurden.
Wir beraten heute in zweiter und dritter Lesung, werte Kolleginnen und Kollegen, den Entwurf eines Gesetzes, eingebracht durch Bündnis 90/Die Grünen, das vorsieht, Auslandseinsätze jeglicher Art durch das Bundesverfassungsgericht auf ihre verfassungsgemäße Legalität zu überprüfen.
Ich sage es Ihnen vorweg: Dieser Gesetzentwurf ist abzulehnen; denn er gefährdet zum einen die Sicherheit der Soldatinnen und Soldaten
und zum anderen die Sicherheit unserer Einsätze, ohne dass hierfür eine verfassungsrechtliche Notwendigkeit besteht.
Erlauben Sie mir an dieser Stelle, dies auch zu begründen.
