Herr Kollege Hohmann, ich weiß ja nicht, wann Ihre Begegnung mit dem Erzengel Michael sein wird,
aber ich glaube, so, wie Sie hier reden, wird sie nicht gut ausgehen.
Wenn – führen wir uns den Beginn der Debatte vor Augen – Herr Hilse hier davon redet, dass man Deutschland wieder groß oder großartig machen möchte, dann hat das natürlich damit zu tun, dass Sie für sich erkannt haben, dass Sie dieses Land erst mal schlechtreden müssen,
und das machen Sie permanent, in jeder Debatte. Dabei ist es in Wirklichkeit so, dass wir in einem großartigen Land leben.
Aber das heißt eben nicht, dass es nicht auch Punkte gibt, die es besser zu machen gilt. Wir sind nicht in diesem Parlament, um nur zu sagen: Deutschland ist großartig, und wir sind stolz darauf.
Wir haben jetzt eine Debatte zum Etat Umwelt, zum Thema Umwelt. Das ist mit Sicherheit ein Thema, das den Deutschen sehr, sehr wichtig ist.
Deswegen wird diese Debatte auch so geführt, deswegen bemühen wir uns darum, unsere Art und Weise, unseren Erfolg der letzten Jahrzehnte, den wir erreicht haben, in Einklang damit zu bringen, dass diese Umwelt, dass diese Natur, die wir so schätzen und lieben, auch erhalten bleibt für die nächsten Generationen.
Natürlich ist es so, dass Sie an der Großartigkeit dieses Landes keinen Beitrag hatten – weil Sie, zum Glück, nicht da waren, als das aufgebaut wurde. Wahrscheinlich wären Sie glücklich gewesen, wenn Pläne – die es ja gegeben hat –, aus Deutschland nach dem Krieg einen Kartoffelacker zu machen,
umgesetzt worden wären. Das wäre das Land gewesen, das Sie sich gewünscht hätten, da hätten Sie zwischen dem Kartoffelkraut Ihre dumpfen Gedanken ausbringen können,
da hätten Sie vielleicht auch eine Ernte einfahren können.
Aber Sie werden es niemals erreichen, dass die Deutschen nicht stolz auf ihr Land sind. Das können sie auch zu Recht sein. Wir stehen kurz vor einem Feiertag, der Deutschland die Wiedervereinigung beschert hat – zu der Sie auch nichts beigetragen haben.
Ich bin auch froh, dass Sie nichts beitragen; denn jeder Beitrag von Ihnen ist ein schlechter Beitrag.
Da ist sicherlich Einigkeit in diesem Parlament. Ansonsten ist es vollkommen richtig, dass wir uns darüber streiten, wie wir dieses Land weiter nach vorne bringen, und da gibt es verschiedene Ansätze.
Ja, Frau Lemke, Sie haben recht: Manchmal ist gestern der beste Augenblick gewesen. Das können wir nicht nachholen. Heute ist der Augenblick, wo wir es schaffen müssen.
Es ist wichtig, zu sehen: Die Bemühungen gehen in die richtige Richtung. Können wir noch mehr machen? – Mein Wunsch ist – genauso wie es Frau Dött ausgeführt hat –, dass wir energischer an dieses Thema herangehen, dass wir zum Beispiel das Thema der Kreislaufwirtschaft aufgreifen und sagen: Wir sind in Europa ein Land, das ziemlich weit vorne ist. Aber wir können die Bremse weiter lösen. Wir müssen klare Vorgaben machen und dürfen uns nicht im Klein-Klein verstricken, sondern müssen eine Perspektive eröffnen.
Da hier über die Zukunftstechnologie Wasserstoff diskutiert und darauf hingewiesen wurde, dass es eine Haushaltssperre gibt: Das ist ein übliches Haushaltsinstrument. Wir haben hier ein großes, milliardenschweres Gesamtpaket hingestellt und haben dann natürlich gesagt: Es geht darum, genau zu schauen, welche Maßnahme man zu welchem Zeitpunkt macht. – Das ist ein vollkommen normaler Vorgang. Wir wollen doch das Parlament nicht entmachten. Haushaltssperren werden wir sicherlich noch einige ausbringen. Da mag die Regierung sagen: Das ist aber nicht nett. – Das sind wir auch nicht. Wir wollen als Parlament steuern können, und das ist eines der Instrumente, mit denen wir steuern können, damit wir, bevor Geld ausgegeben wird, noch einmal entscheiden können, wie es dann im Kleinen ausgegeben wird. Die Perspektive, die wir uns mit diesem Programm eröffnen, ist groß.
Was wir auch gesehen haben: Durch die starken Einschränkungen wegen Corona – das wurde bereits erwähnt – sind die CO
