Aber ja: Wir müssen darüber reden, wo zu welchem Zweck der Staat tatsächlich als Eigentümer agiert. Das Beispiel Lufthansa ist kein gutes Beispiel dafür.
Das Motto der Bundesregierung lautet ja hier: Der Steuerzahler soll blechen, der Staat soll retten, die öffentliche Hand aber nichts zu sagen haben. – Kein privater Geldgeber – auch Sie, Herr Houben, nicht – wäre so dämlich und würde so etwas mitmachen.
Deshalb muss auch bei staatlichen Beteiligungen gelten: Wer bezahlt, bestimmt, meine Damen und Herren.
Auf all diese Fragen bietet der Antrag der FDP keine Antworten. Sie unterstützen ja de facto auch Herrn Altmaier in seinen zentralen Ansätzen, wie er das Beteiligungsmanagement organisiert. Ich finde das nicht verantwortungsvoll.
Ich komme zum Schluss. Für uns als Linke bleibt es dabei: keine staatlichen Rettungsprogramme, keine Beteiligungen ohne Beschäftigungsgarantien. Wir brauchen eine verbindliche Verpflichtung, Tarifverträge und Mitbestimmung zu respektieren, und natürlich müssen auch staatliche Beteiligungen genutzt werden, um sie auf das Ziel des Klimaschutzes auszurichten. Das ist verantwortungsvolle Politik, meine Damen und Herren.
Vielen Dank für Ihre Aufmerksamkeit.
Katharina Dröge, Bündnis 90/Die Grünen, hat als nächste Rednerin das Wort.
