Frau Präsidentin! Meine sehr verehrten Kolleginnen und Kollegen! Durch mehrere Brände ist das Flüchtlingscamp Moria auf der Insel Lesbos zerstört. Gott sei Dank gab es keine Verletzten und Toten, gleichwohl haben wir eine bittere humanitäre Notlage.
Ich möchte zu Beginn die humanitäre Leistung der Bundesrepublik Deutschland und auch unserer Bevölkerung kurz in Zahlen darstellen. Wir haben seit 2015 1,73 Millionen Flüchtlinge aufgenommen. Wir nehmen zurzeit werktäglich 300 bis 400 Flüchtlinge auf – jeden Werktag. Wir nähern uns wieder den Höchstzahlen der Vergangenheit.
Ich habe vor dem Brand auf Lesbos entschieden, dass wir 243 behandlungsbedürftige Kinder sowie 53 Jugendliche mit ihren Familienangehörigen aufnehmen.
Das sind insgesamt etwa 1 000 Personen, bei denen schon vor dem Brand entschieden wurde, dass sie in der Bundesrepublik Deutschland Hilfe erfahren.
Angesichts von 1,37 Millionen Flüchtlingen insgesamt in fünf Jahren und jetzt werktäglich 300 bis 400 Personen sowie der 1 000 Personen, die wir aus dem Bereich der behandlungsbedürftigen Kinder und Jugendlichen aufgenommen haben, ist mir sehr daran gelegen, unserer Bevölkerung zu danken für die Humanität, die bei uns vorherrscht.
Ich sage: Das machen wir nicht notgedrungen; das machen wir gern.
