Fakt ist, dass wir klare Regeln brauchen, was künstliche Intelligenz darf und was sie nicht darf. Natürlich müssen wir auch dafür sorgen, dass die Regeln durchgesetzt werden; denn KI kann nur dann erfolgreich sein, wenn die Menschen auch das notwendige Vertrauen in die Technologie haben.
Aber es braucht halt noch was zum Erfolg: Unternehmen, die die Technologie weiterentwickeln und sie nutzen. Ich glaube, man kann feststellen: In diesem Bereich können wir noch besser werden; da müssen wir auch noch besser werden. Ein Hindernis dabei ist sicherlich ein unsicherer Rechtsrahmen; denn der hält die Unternehmen davon ab, zu investieren. Deswegen müssen wir dringend einen Regulierungsrahmen schaffen bzw. den vorhandenen anpassen. Angesichts der unglaublich rasant voranschreitenden Entwicklung ist es notwendig, dass wir Raum schaffen, und zwar Raum für weitere technologische Entwicklungen, Raum, in dem der Rechtsrahmen praxisnah ausgestaltet wird.
Auch in der Forschung nimmt die KI schon einen großen Stellenwert ein. Europa ist mit Blick auf KI in einer Spitzenposition. Aber anders als einige hier sich das vielleicht wünschen, darf die KI-Forschung kein innereuropäischer Wettkampf sein; KI aus Europa muss sich vielmehr global behaupten können. Das erreichen wir sicherlich nur, wenn wir unsere Kompetenzen bündeln und unsere Anstrengungen zusammenführen, weil wir dann gut und breit aufgestellt sind, sodass wir auch international wettbewerbsfähig sein können.
Deswegen müssen wir mit aller Kraft daran arbeiten, noch mehr europäische KI-Entwicklungen auf den Markt zu bringen. Im Moment bleibt, wie ich finde, noch zu vieles hinter verschlossenen Türen und ist oft nur einer kleinen Gruppe von Forschern zugänglich.
Die EU-Kommission hat mit ihrem Weißbuch Potenziale und Chancen von künstlicher Intelligenz für die Wirtschaft und die Gesellschaft erkannt. Liebe Kolleginnen und Kollegen, die Kommission ist mit dem Weißbuch einen großen Schritt in Richtung Zukunft gegangen. Aber diese Zukunft der KI müssen wir jetzt mit Leben füllen, damit wir künftig auch über die Uhr unser autonom fahrendes Auto „K.I.T.T.“ rufen können, das dann angefahren kommt. Daran sollten wir gemeinsam arbeiten.
Vielen Dank.
Voraussichtlich letzter Redner in dieser Debatte ist der Kollege Dr. Joe Weingarten, SPD.
