Herr Präsident! Liebe Kolleginnen und Kollegen! Sehr geehrte Damen und Herren! „Der Klimawandel ist für unsere Welt eine Schicksalsfrage“, so die Bundeskanzlerin 2017 auf der UN-Klimaschutzkonferenz in Bonn. Eine Schicksalsfrage, die sich nicht nur an die Vereinten Nationen richtet, nicht nur an Europa, an die Mitgliedstaaten in Europa. Sie richtet sich an jeden Einzelnen von uns. Wir als CDU/CSU-Fraktion erkennen die Relevanz und die Brisanz des Klimawandels an. Wir engagieren uns gegen die erwarteten Folgen des Klimawandels und gegen die Erderwärmung. Und das tun wir nach bestem Wissen und Gewissen im Rahmen unserer Möglichkeiten, nicht aus der Überheblichkeit heraus, dass wir alleine die Welt retten könnten, wohl aber aus der Einsicht – bei aller Bescheidenheit –, dass es eben auch auf uns ankommt: jetzt und hier und ganz konkret.
Als Beitrag zur Erreichung der Klimaschutzziele haben wir ein umfassendes, detailliertes Klimaschutzprogramm 2030, in dem es auch darum geht, Beiträge zu einer Verkehrswende, zu einer Reduzierung der CO
Die Bundesregierung wird die Kraftfahrzeugsteuer stärker an den CO
Mit dem heute zu entscheidenden Gesetzesvorschlag wird ein Versprechen eingelöst, meine Damen und Herren, ein Zeichen der verlässlichen und kalkulierbaren Politik der Großen Koalition.
Auf die wesentlichen Punkte dieses Gesetzentwurfs haben wir schon in der ersten Lesung Bezug nehmen können. Es geht darum, dass die Steuersätze für CO
Meine Damen und Herren, wir haben über diesen Gesetzentwurf in der öffentlichen Anhörung, aber auch in den Fraktionssitzungen und den Sitzungen mit dem Koalitionspartner sehr intensiv diskutiert. Auf einige Punkte möchte ich kurz eingehen. Der erste Punkt betraf die Frage, ob die Anreizwirkung der Staffelung eigentlich hinreichend sei. Die Fraktion der Grünen, Herr Schmidt, schlägt vor, auf ein Bonus-Malus-System umzusteigen, um die Anreizwirkung noch einmal zu verstärken. Das ist gerade angesichts des vorgeschlagenen vereinfachten Systems ein etwas komplexeres Verfahren, das vielleicht infrage zu stellen ist. Wir haben, Herr Schrodi, von Mietwagenunternehmen und Unternehmen mit größeren Fuhrparks Rückmeldungen, dass man dort bereits umdisponiert, hin zu emissionsärmeren Fahrzeugen. Man erkennt also sehr wohl: Es gibt eine Anreizwirkung. Wir glauben, dass der Gesetzesvorschlag dem hinreichend Rechnung trägt.
Wir haben über den Verzicht auf die Hubraumkomponente diskutiert. Auch dazu hatten einige Gutachter Hinweise. Tatsächlich muss man davon ausgehen, dass etwas über die Hälfte des Steueraufkommens auf die CO
Wir haben des Weiteren über die Emissionswerte bei den Plug-in-Hybriden diskutiert und sind uns einig, dass da stabilere Daten zu beschaffen sind, damit auch die Emissionswerte, die ja Grundlage für die Steuer sind, verlässlich sind. Da sind wir uns auch mit den Grünen einig.
Die Fraktion der Linken weist darauf hin, dass man vielleicht bei den E-Fahrzeugen doch stärker differenzieren müsse, weil es da auch schwerere und größere gebe, zumindest perspektivisch. Auch das ist sicherlich diskussionswürdig, aber nicht im Rahmen dieser Gesetzesänderung angebracht.
Zuletzt haben wir sehr grundsätzlich – das ist der letzte und entscheidende Punkt, den ich hier ansprechen möchte – über die Frage diskutiert, ob die Kfz-Steuer überhaupt sinnvoll ist, wenn es darum geht, Anreize gegen CO
Allerdings müssen wir die damit verbundenen Konsequenzen sehr sorgfältig prüfen. Wir möchten, dass die Akzeptanz dieser Maßnahmen nicht verloren geht. Über die Verteilungseffekte, die daraus resultieren, wollen wir intensiv diskutieren. Ich lade dazu auch die Vertreter der anderen Fraktionen, insbesondere auch den Koalitionspartner, ein, das im Weiteren zu verfolgen.
Ich komme zum Schluss, meine Damen und Herren. Es ist ein guter Gesetzentwurf. Er ist wohlüberlegt, gut abgewogen und vernünftig. Er bedeutet ein klares Signal, aber er ist auch ein Zwischenschritt auf dem Weg zu noch mehr Anreizen im Sinne einer reduzierten Emission von CO
Ich lade Sie, liebe Kolleginnen und Kollegen, ein, sich weiter an der Diskussion zu beteiligen und dem hier vorliegenden Gesetzentwurf aber uneingeschränkt zuzustimmen. Ich bitte um Verständnis, dass wir dem Entschließungsantrag der Grünen nicht folgen können.
Vielen Dank für Ihre Aufmerksamkeit.
Herzlichen Dank, Herr Kollege Tebroke. – Nächste Rednerin ist die Kollegin Franziska Gminder, AfD-Fraktion.
