Die Finanzaufsicht erließ ein Leerverkaufsverbot und zeigte die Journalisten an, die die wahren Zeitungsartikel geschrieben hatten. Die Staatsanwaltschaft München stellte das Geldwäscheverfahren schnell wieder ein, und die Abschlussprüfer von Ernst & Young setzten brav die Unterschrift unter den Abschluss 2018. Bei Wirecard haben die Kontrolleure nicht nur versagt; es ist noch schlimmer. Die Botschaft an die Anleger war doch: Bei Wirecard ist alles in Ordnung. – Die Anleger wurden in die Irre geführt dadurch, dass die Kontrolleure Wirecard sogar noch als Opfer dargestellt haben. Das ist das, was diesen Fall ganz besonders gravierend macht.
Insofern lautet die Frage nicht: Kann man einen Untersuchungsausschuss einsetzen? Man muss einen Untersuchungsausschuss einsetzen. Dieser ist so zwingend wie kaum ein zweiter.
Das, was die Behörden gemacht haben, geschah ja nicht allein auf der Fachebene in kleinen Behörden, sondern unter engster Einbindung von maßgeblichen Stellen der Bundesregierung. Der Bundesfinanzminister war seit Anfang 2019 regelmäßig über den Fall Wirecard informiert. Er ist in der Mitverantwortung für das, was gemacht wurde, und in der Mitverantwortung für das, was nicht gemacht wurde, liebe Kolleginnen und Kollegen.
Auch aus der Staatsregierung im Freistaat Bayern ist es erstaunlich still in diesem Fall.
Ich meine, diese Stille hat auch Gründe: Man hofft, dass man über den Sturm hinwegkommt. Aber wir werden herausarbeiten, dass natürlich auch in Bayern Hinweisen nicht so nachgegangen worden ist, wie es zwingend erforderlich gewesen wäre.
Hinzu kommen Regierungskontakte von Wirecard bis hin dazu, dass die Bundeskanzlerin persönlich auf direkte Bitte von Karl-Theodor zu Guttenberg in offizieller Funktion in China sich noch für Wirecard eingesetzt hat, als man im Unternehmen längst eine Hausdurchsuchung hätte durchführen müssen. Wo sind wir denn, dass eine Regierung in so einer Lage noch für das Unternehmen wirbt, statt durch die Aufseher eine Durchsuchung durchzuführen? Das wäre doch die richtige Reaktion gewesen.
Der Verdacht, der da im Raum steht, ist, dass man sich blenden ließ, dass man meinte, einen digitalen Champion zu haben, auf den Deutschland weltweit stolz sein kann, und dass man meinte, ihn auch in Schutz nehmen zu müssen vor vermeintlichen Attacken von außen. Wir wollen in diesem Untersuchungsausschuss wissen, ob das auch ein Grund dafür war, dass weggeschaut wurde und dass das Instrumentarium nicht genutzt wurde, das man gehabt hätte. Eine falsche Solidarität von Regierung und Behörden mit diesem angeblichen Vorzeigeunternehmen? Ich glaube, dass wir dem noch sehr genau nachgehen müssen.
Dieser Untersuchungsausschuss wird ein Untersuchungsausschuss für die, die jeden Tag mit ehrlicher Arbeit ihr Geld verdienen, für die, die daran zweifeln, dass der Rechtsstaat sie auch vor schwerster Kriminalität effektiv schützen kann, und vor allem auch für die, die nicht damit zufrieden sind, dass nach einem solchen Skandal jeder Kontrolleur – der Finanzminister, Ernst & Young und die anderen Beteiligten – immer nur sagen, was sie nicht tun konnten, wo ihre Grenzen waren, anstatt dass sich einmal einer hinstellt und sagt: Ich war verantwortlich, und ich trage diese Verantwortung auch. – Dafür werden wir mit diesem Untersuchungsausschuss sorgen. Er ist zwingend nötig, und ich werbe um breite Zustimmung.
Herzlichen Dank.
Das Wort hat der Kollege Matthias Hauer für die CDU/CSU-Fraktion.
