Deswegen kann es für uns nicht der richtige Weg sein, Cannabis zu legalisieren.
Herr Kollege, es gibt noch einen Wunsch nach einer Zwischenfrage von der Kollegin Dr. Kirsten Kappert-Gonther.
Nein, danke. Wir hatten, glaube ich, schon genügend Austausch.
Jetzt diskutieren wir hier in dieser Debatte auch darüber, ob es vielleicht in Ordnung sei, Cannabis zu konsumieren und sich danach ins Auto zu setzen. Seit Jahren sinkt auch dank der Initiativen gerade aus der Unionsfraktion die Zahl der Verkehrstoten. 3 000 Verkehrstote gab es im Jahr 2019. Das sind immer noch 3 000 Verkehrstote zu viel. Wir wollen diese Zahl weiter reduzieren und unser Ziel, die Vision Zero, erreichen. Aber das werden wir doch nicht mit Ihren Anträgen schaffen, in denen Sie sagen, wenn man Bier trinken und danach Auto fahren dürfe, dann solle man auch einen Joint rauchen können. Diese Logik erschließt sich mir nicht. Wir müssen doch stattdessen eher darüber diskutieren, ob wir nicht auch im Straßenverkehr zu einer Nulltoleranzstrategie übergehen, damit wir die Zahl der Verkehrstoten weiter reduzieren.
Meine Damen und Herren, dann möchte ich für einen Weg werben, den Daniela Ludwig als Drogenbeauftragte in den vergangenen Monaten aufgezeigt hat, nämlich dass es viel besser ist, über Prävention den Menschen zu zeigen, welche Folgen der Cannabiskonsum hat, und dafür gerade die Bereiche Social Media und Internet zu verwenden; denn dort sind gerade die Jüngeren viel häufiger unterwegs. Deswegen kann ich die Kampagnen, die in den vergangenen Wochen von Daniela Ludwig gestartet wurden, mit Nachdruck unterstützen.
Ich fasse zusammen. Wir werden Ihre Anträge ablehnen. Wir werden nicht den Weg der Legalisierung gehen; denn er bedeutet unsägliches Leid, er bedeutet, dass es zu Abhängigkeiten kommt, dass es Therapien geben muss, dass viele Menschen darunter leiden. Wir werden stattdessen den Weg der Prävention einschlagen. Das ist der deutlich bessere.
Herzlichen Dank für die Aufmerksamkeit.
Vielen Dank, Herr Kollege Ploß. – Damit schließe ich die Aussprache zu diesem Tagesordnungspunkt.
