– Nein, das haben Sie nicht.
Je früher, häufiger und intensiver Cannabis konsumiert wird, desto größer ist die Gefahr einer Depression, Psychose und Schädigung der Gedächtnisleistung.
Mitunter ist Cannabis auch ein Einstieg in eine Drogenkarriere.
Meine sehr geehrten Damen und Herren, wir hatten zu diesem Thema vor zwei Jahren eine Anhörung, in der die Bundesärztekammer vertreten war. Sie warnt uns ausdrücklich, der medizinische Sachverstand in Deutschland warnt uns ausdrücklich, diese Anträge von Linken, Grünen und FDP anzunehmen, weil der Drogenkonsum verharmlost wird. Die Bundesärztekammer sagt uns, die Zahl der Konsumenten würde steigen. Wenn wir diese Anträge annähmen, gäbe es mehr medizinischen Behandlungsbedarf.
– Weil die Grünen sagen, man möge über den Tellerrand schauen: Die Bundesärztekammer hat das gemacht. Sie hat nach Colorado geschaut. Dort hat sich nach der Legalisierung innerhalb von zwei Jahren die Zahl der behandlungsbedürftigen Fälle fast verdoppelt. Die Zahl der Behandlungsfälle im Krankenhaus hat sich fast verdoppelt. Die Drogenpolitik, die Sie vorhaben, würde dazu führen, dass wesentlich mehr Menschen erkranken.
Deswegen meine Bitte: Hören Sie auf den medizinischen Sachverstand, und hören Sie nicht auf die Drogendealer!
Jetzt haben wir die Argumente gehört: Alle kiffen doch; überall wird gekifft; an jeder Ecke gibt es was. – Das mag für die Parteijugend der Linken und der Grünen der Regelfall sein. Aber ich kann einmal sagen: Für die Mehrzahl der jungen Leute in diesem Land ist es das nicht. Neun von zehn Kindern und Jugendlichen im Alter von 12 bis 17 Jahren haben mit Cannabis nichts am Hut, wissen, dass man von Drogen die Hände lässt. Die große Zahl der jungen Menschen ist also vernünftig; ich bin dankbar dafür, dass sie klüger sind als manche hier im Haus.
Zum zweiten Argument. Sie sagen: Obwohl Cannabis seit Jahren verboten ist, gibt es weiterhin Drogenkonsumenten; also müsse man es legalisieren. – Ja, obwohl Cannabis seit Jahren verboten ist, gibt es weiterhin Konsumenten. Aber, Entschuldigung: Seit Menschengedenken ist Mord verboten – seit Kain und Abel gibt es ihn trotzdem.
Und in den Städten ist es verboten, schneller als fünfzig zu fahren – trotzdem passiert das jeden Tag in zig Fällen.
Es kam noch nie jemand von Ihnen auf die Idee – obwohl es im Verkehrsbereich um wesentlich mehr Fälle geht –, zu sagen: Lasst die Leute doch einfach fahren, wir entfernen die ganzen Verkehrsschilder, dadurch werden es weniger Raser. Niemand käme auf die Idee! Im Fall von Cannabis tun Sie so, als ob das besser wäre.
Wenn man ein Verbotsschild wegnimmt, verhalten sich natürlich mehr Leute so. Wenn man leichter an Drogen herankommt, dann wird logischerweise mehr konsumiert; das liegt in der Natur der Sache. Natürlich – das sagt uns auch die Bundesärztekammer – würde eine Legalisierung dazu führen, dass der Konsum von Jugendlichen steigt; denn ein Verbot ist auch ein Stoppzeichen für junge Leute, dass sie wissen: Das macht man nicht, das schädigt die Gesundheit.
Herr Kollege, gestatten Sie eine Zwischenfrage?
Ja, bitte schön.
