Hätten Sie Thermen erneuert, Umwälzpumpen erneuert! Sie hätten jedes Jahr 600 000 neugebaute Heizungen zu 5 000 Euro verschenken können. Das wäre billiger geworden; das wären 3 Milliarden Euro. In 18 Jahren alle Heizungen in Deutschland zu tauschen, kostete 54 Milliarden Euro insgesamt. Das wären gerade einmal 10,8 Prozent der 500 Milliarden Euro gewesen. Das wäre effektiv. Ihre Aufgabe ist nicht, Geld auszugeben, Ihre Aufgabe ist, Geld sinnvoll auszugeben.
Aber vielleicht stört Sie das alles so herzlich wenig, weil Sie in einem Jahr zurück in Ihr Eigentum fahren. Eigentum: Da war doch was? Grunderwerbsteuerfreibetrag, habe ich mal gehört, Eigentümer anfachen. Da sitzt die Koalition, die Sie anstreben. Die wollen Einfamilienhäuser verbieten, und den Grunderwerbsteuerfreibetrag kriegen Sie nicht gebacken. Eine unheilige Koalition, die sich da für dieses Land androht.
Kommen wir zum CO
Ich sage Ihnen: Sie können noch 2 Billionen Euro in den nächsten Jahren ausgeben. Bei der CO
Herr Seehofer, zum Abschluss: Sie haben noch ein Jahr vor sich, und Sie wissen: In diesem Kabinett wird kein CSU-Minister entlassen. Das haben Sie ja festgestellt. Man kann nicht nur Unsinn machen, man kann auch mutig sein.
Und deshalb sage ich für meine Kinder und für Ihr Enkelkind – es ist doch auf dem Weg –: Finden Sie Ihre Tugenden wieder – Sparsamkeit, Redlichkeit und gesunden Menschenverstand!
Ich danke Ihnen.
Jetzt erhält das Wort der Kollege Dr. Jens Zimmermann, SPD.
