Erstens: die veränderte Natur von Konflikten, die zunehmend geprägt sind von innerstaatlichen Auseinandersetzungen und nichtstaatlichen Akteuren. Dadurch sind die Anforderungen an die VN-Friedensmissionen erheblich gestiegen: von militärischen hin zu immer mehr polizeilichen und zivilen Aufgaben.
Zweitens sind in einer vernetzten Welt fast alle Staaten auf funktionierende internationale Institutionen und einen internationalen Ordnungsrahmen angewiesen. Es ist problematisch, wenn einige wenige Großmächte die Illusion hegen, souverän sei, wer sich nicht an Regeln halten müsse oder zum Regelwerk beitrage. Dass es gerade einige Mitglieder des VN-Sicherheitsrats sind, die die VN immer stärker umgehen und unterlaufen, ist wenig hilfreich.
Wenn die P 5 sich nicht mehr als Hüter einer gemeinsamen Ordnung verstehen, stehen – drittens – auch Effektivität und Legitimität des VN-Systems insgesamt infrage. Mit Blick auf die US-Wahlen in der kommenden Woche hoffen wir, dass die USA sich künftig wieder konstruktiv in die Arbeit der VN einbringen. Wir brauchen einen starken Westen in handlungsfähigen Vereinten Nationen.
Für uns ist klar: Die Bewahrung und Weiterentwicklung einer regelbasierten Ordnung ist das überragende strategische Interesse unseres Landes. Ein möglicher Weg zur Stärkung dieser Ordnung könnte durchaus auch in der stärkeren Einbindung und Forderung von regionalen Organisationen wie der Afrikanischen Union oder der OSZE liegen, um Friedenssicherung und den Aufbau regionaler Sicherheitsstrukturen zu bewerkstelligen – nicht als Ersatz für die VN, sondern als Ergänzung von Fähigkeiten und zur Stärkung regionaler Verantwortlichkeiten.
Auch wir Europäer tragen große Verantwortung, und wir müssen weltweit künftig in deutlich höherem Maße willens und in der Lage sein, Verantwortung zu übernehmen und unsererseits insbesondere in unserer Nachbarschaft zu Frieden und Stabilität beizutragen. Dabei können sich die Vereinten Nationen und die Bundesregierung auch weiterhin auf die Unterstützung der CDU/CSU-Fraktion verlassen.
Vielen Dank.
Vielen Dank, Herr Kollege Dr. Nick.
Bevor ich dem nächsten Redner das Wort erteile, erteile ich dem Kollegen Dr. Roy Kühne aus der CDU/CSU-Fraktion einen Ordnungsruf. Er hat den Plenarsaal ohne Maske verlassen und den Plenarsaal ohne Maske wieder betreten. Wir haben vielfältig darauf hingewiesen, dass wir am Anfang mit Mahnungen auskommen; aber es muss dann offensichtlich auch härtere Maßnahmen geben. Ich weise hier auch ausdrücklich darauf hin, dass im Wiederholungsfall weitere Ordnungsmaßnahmen folgen können.
Nächster Redner ist der Kollege Ulrich Lechte, FDP-Fraktion.
