Herr Präsident! Meine sehr geehrten Damen und Herren! Die Geburtstagstermine meiner Familie, mein Hochzeitstag und der 3. Oktober, das sind die Termine in jedem Jahr, wo es sich lohnt, eine ordentliche Party zu organisieren.
Und das sollten eigentlich alle machen, anstatt im Prinzip jeden Tag nur Probleme zu wälzen.
Meine Damen und Herren, ich habe 30 Jahre, also genau die Hälfte meines Lebens, in der DDR verbracht und konnte dann zum Glück die andere Hälfte meines Lebens – und ich hoffe, es kommen noch ein paar Jahre dazu – im vereinten Deutschland verbringen.
Meine Damen und Herren, es klingt ja immer mal so an: Das war ja alles nicht so schlimm damals. – Ich habe das in verschiedenen Reden heute auch gehört. Das mag zwar sein – wenn ich zurückblicke und an die Zeit denke, die ich mit meiner Familie und mit meinen Freunden am Biertisch, beim Skatspielen oder sonst was verbracht habe, ist das auch richtig –, aber das ist eben nur die halbe Wahrheit oder weniger als die halbe Wahrheit.
Wenn ich an meine Schulzeit denke, wenn ich an meine Studienzeit denke oder an die Zeit, die ich auf der Arbeit verbracht habe: Da sah die Welt anders aus: ein permanenter politischer und gesellschaftlicher Druck, Diskriminierung, Benachteiligung und ständige Bespitzelung Andersdenkender, zu denen ich damals auch gehörte, eine permanente Mangelwirtschaft, eine unerträgliche Luftverschmutzung – gerade in der Heizperiode –, die Elbe in Dresden ein stinkender Strom durch die Landschaft, der Kampf um eine brauchbare Wohnung – wer sich daran vielleicht noch erinnert! –, keine Reisefreiheit. Aber es gab eine Straßenbahnfahrt für 20 Pfennige. Das wurde uns schon in der Schule gelehrt: Das ist der Unterschied zwischen der glorreichen Zukunft des Sozialismus und dem faulenden Kapitalismus: dass man in der DDR für 20 Pfennige Straßenbahn fahren durfte. Nur, das Problem war: Die Straßenbahn kam nicht immer,
weil immer wieder mal ein Ersatzteil fehlte, das nicht beschafft werden konnte, oder der Straßenbahnfahrer vielleicht 14 Tage vorher gerade in den Westen ausgereist war.
So viel zur Realität, meine Damen und Herren, und das sollte man auch nie vergessen! Gerade deswegen, wenn man das alles zusammenrechnet, ist der 3. Oktober für mich ein Tag des Feierns.
Das Problemewälzen können wir vorher machen und spätestens am 4. wieder beginnen.
Meine Damen und Herren, es gibt heutzutage zu solchen Festtagen eine Flut von Büchern und Filmen und Diskussionen. Der öffentlich-rechtliche Rundfunk ist voll davon. Alle wollen nun herausfinden: Was ist denn der Unterschied zwischen den Ostdeutschen und den Westdeutschen? Und natürlich: Der Ossi, das seltsame Wesen, was ist denn das für einer?
Meine Damen und Herren, ich sage Ihnen eines: Das geht mir am meisten auf die Nerven bei der ganzen Diskussion.
Weil: Warum kümmert sich denn niemand darum, was der Unterschied ist zwischen dem Bayern und dem Holsteiner oder dem Rheinländer und dem Pfälzer oder – um es noch ein bisschen kleiner zu schneiden – zwischen dem Kölner und dem Düsseldorfer?
