Ich habe es eben gerade gesagt – Sie haben sich ja schon gemeldet, da hatten Sie noch gar nicht bis zum Ende zugehört –: Natürlich geht es hier um ein Symbol. Das weiß ich doch auch. Dieser Antrag löst nicht das millionenfache Problem der Altersarmut. Das weiß ich sehr wohl. Aber jetzt zu sagen: „Na ja, das wollen wir nicht“? Nein, es ist das ausdrückliche Angebot: Tun Sie mit, dass wir diesen Schritt gehen! Wir haben hier im Deutschen Bundestag leider aktuell keine Mehrheiten, die es möglich machen, dass auch Beamtinnen und Beamte einzahlen, dass Selbstständige und auch Abgeordnete aller Ebenen einzahlen. Die haben wir leider nicht. Aber dass Sie, wenn es darum geht, diesen Schritt zu vollziehen und Vertrauen zurückzugewinnen, mit der Populismuskeule kommen,
zeigt, dass Sie offensichtlich ein bisschen traurig sind, dass Sie diesen Antrag nicht gestellt haben. Aber dafür kann ich nun leider nichts.
Ich will es wiederholen: Ja, natürlich, der Antrag löst nicht die Grundprobleme. Das ist doch unbestritten; das habe ich auch nicht behauptet. Ich habe gesagt und wiederhole das noch mal für Sie: ein Antrag mit Symbolwirkung. Aber es geht um das Signal an die Bürgerinnen und Bürger, das Signal an die Gesellschaft, dass wir alle uns darüber Gedanken machen. Es muss am Ende nicht unser Antrag umgesetzt werden. Bringen Sie Ihre ganze Kompetenz ein. Wir sind bereit, dort mitzumachen.
Aber eine Rentenkasse für alle, dieses Ziel haben wir als Linke, und das seit Langem.
Dafür sind wir schon im letzten Bundestagswahlkampf eingetreten. Tun Sie ruhig daran mit; das würde uns zumindest freuen. Wir müssen aufhören und Schluss machen mit dem Extrasystem für Abgeordnete. Das ist unser Ziel.
Das ist eine vertrauensbildende Maßnahme.
