Herr Präsident! Meine Damen und Herren! Es ist Halbzeit. Die Halbzeit der deutschen EU-Ratspräsidentschaft ist keine Pause und kein Zeitfenster, um Kräfte zu sammeln, um etwas zu trinken oder um letzte Anweisungen der Trainerin zu erhalten. Die Halbzeit ist eine Zeit für eine Zwischenbilanz. Wir checken, ob wir auf dem richtigen Weg sind. So viele Begegnungen hatten wir uns vorgenommen, so viel Austausch, so viel lebendiges Europa.
Die Pandemie hat den persönlichen Begegnungen oft einen Strich durch die Rechnung gemacht. Und doch empfinde ich den Auftrag, unser Europa in dieser Ratspräsidentschaft gut fortzuentwickeln, als persönlichen Auftrag für jede Demokratin und jeden Demokraten hier im Haus.
Ich habe nicht wie Axel Schäfer, Franziska Brantner oder Alexander Graf Lambsdorff praktische Erfahrungen im Europaparlament. Ich kann hier einfach nur biografisch auf Europa schauen. Ich bin Jahrgang 1960. Ich hatte uralte Eltern. Mein Vater war Jahrgang 1916, meine Mutter Jahrgang 1919; ein Haufen Kinder, keine Pille. Mein Vater ist im Ersten Weltkrieg geboren, er war im Zweiten Weltkrieg Soldat. Meine Mutter war Krankenschwester in deutschen Lazaretten in Frankreich. Mein Großvater war im Ersten Weltkrieg. Die Generationen davor haben sich hier jahrhundertelang wegen allem Möglichen die Köpfe eingeschlagen.
Ich bin mit dem Friedensversprechen Europas großgeworden. Es war aber nicht so, dass man jeden Tag beim Mittagessen das Friedensversprechen Europas angesprochen hat. Da hieß es eher: Iss deinen Teller leer. – Wir wären froh gewesen, wir hätten etwas gehabt.
Nun ist es so, dass dieses Friedensversprechen alleine nicht mehr trägt. Wir müssen diesem Friedensversprechen noch etwas hinzufügen. Dieses Friedensversprechen trägt nicht mehr bei den Griechen in Südeuropa, die wir alleine lassen mit den großen Problemen.
Wir müssen dem Friedensversprechen ein soziales Versprechen, ein Klimazielversprechen, ein Menschenrechtsversprechen und ein Rechtsstaatsversprechen hinzufügen.
