Herr Präsident! Liebe Kolleginnen und Kollegen! Wir debattieren heute in dieser Debatte aus Anlass der Erhöhung der Hartz-IV-Gesetze zum 1. Januar 2021. Ich sage als Freier Demokrat und für meine Fraktion: Wir stellen die Berechnungsmethode ausdrücklich nicht infrage. Was wir allerdings an dieser Regierung kritisieren, ist, dass die zentrale Frage, um die es eigentlich in jeder Hartz-IV-Diskussion und bei jedem Gesetzesvorhaben zu Hartz IV gehen müsste, nämlich wie wir Menschen in Arbeit bekommen, bei dieser Regierung nie im Mittelpunkt der Diskussion steht. Das ist falsch und nicht der richtige Weg.
Liebe Kolleginnen und Kollegen, die zweite Frage, die in dieser Regierung keine Rolle spielt, ist die Frage, wie wir es den Menschen, die arbeiten, deren Einkommen aber nicht zum Leben reicht und ihren Bedarf nicht deckt, ermöglichen, sich am Arbeitsmarkt zu qualifizieren und aufzusteigen, um Schritt für Schritt von dem Einkommen, das sie verdienen, selbstständig leben zu können. Auch diese zweite Frage spielt in dieser Regierung leider keine Rolle.
Die dritte Frage, die in dieser Regierung keine Rolle spielt, ist, wie wir die Vererbung von Armut und Langzeitarbeitslosigkeit verhindern. Das geschieht, indem wir präventiv angreifen und die Kinder so stärken, dass der Einstieg in Ausbildung und Arbeit gelingt und dass sie diesen Weg für sich und ihre Zukunft erfolgreich gehen können.
Liebe Kolleginnen und Kollegen, das sind die drei Herausforderungen, die eigentlich im Zentrum jeder Hartz-IV-Debatte stehen müssten, die bei dieser Regierung leider keine Rolle spielen.
Wir haben als Freie Demokraten einen Antrag vorgelegt, mit dem wir zeigen, wie man 300 000 Menschen in Arbeit bringen könnte. Dieses Modell, das wir vorgelegt haben und das 300 000 Menschen in Arbeit bringen könnte – das sagen nicht nur wir, das ist vom ifo-Institut nachgerechnet worden –, wirkt. Dieses Modell liegt schon seit einem Jahr vor.
Herr Kollege, erlauben Sie eine Zwischenfrage des Kollegen Rosemann, SPD-Fraktion?
