Herr Präsident! Meine lieben Kolleginnen und Kollegen! Liebes Publikum an den digitalen Endgeräten und herzlich willkommen Sie da oben, der als Einziger noch zuschaut!
– Oh, Entschuldigung, es sind vier. Gegen das Licht ist das nicht so gut zu erkennen. Insofern begrüße ich Sie natürlich alle einzeln!
Zur Sache. Während mein Kollege Tobias Zech die anderen beiden Teile dieses Gesetzentwurfs behandelt hat, werde ich mich jetzt dem Thema Sozialwahlen widmen. Erfreulicherweise haben wir ein derartiges Maß an Übereinstimmung, dass man sich fragt, warum wir eigentlich so lange für die Modernisierung gebraucht haben. Ich bin erst in dieser Legislaturperiode in den Deutschen Bundestag gekommen und jetzt Berichterstatter für dieses Thema. Es wurde mir als extrem strittig dargestellt; das hörte sich heute Gott sei Dank nicht so an. Ich bin sicher, wir werden eine gute Ausschussberatung haben.
Der wichtigste Teil der Modernisierung der Sozialwahlen liegt schon hinter uns, weil wir bei den Krankenkassen Onlinewahlen zugelassen haben. Auch da gibt es Erfreuliches zu berichten: Das Gesetz ist fertig, die Rechtsverordnung liegt vor, die Satzungsänderungen sind vollzogen, die Zertifizierung durch das BSI ist da. Jetzt können die Krankenkassen an die Ausschreibungen gehen. Das ist eine gute Nachricht. Warum eigentlich?
Erstens. Bei den Sozialwahlen bei den Krankenkassen gibt es 22 Millionen Wahlberechtigte. Das ist eine große Menge. Wir als Gesellschaft lernen endlich, inwiefern Onlinewahlen sicher sind, wie wir die Menschen authentifizieren und – das ist ganz besonders wichtig – wie wir die Geheimhaltung der Wahl aufrechterhalten, damit kein Hacker feststellen kann, wie jemand gewählt hat, und wie manipulationssicher die Wahl ist. Diese Erfahrungen brauchen wir dringend. Ich hätte mir eigentlich gewünscht, dass wir das schon für die letzten Sozialwahlen erreichen; aber nun erreichen wir das wenigstens für die nächsten Wahlen. Gerade in der gegenwärtigen Coronapandemie wäre ich froh, wir hätten ein erprobtes System, das wir jetzt auf andere Dinge ausweiten können. Jetzt lernen wir es. Man kann das Erlernte dann auch für andere Dinge anwenden. Wenn wir dann 2023 wissen, wie es geht, dann brauchen wir es hoffentlich nie wieder für irgendeine Pandemie.
Es gibt noch ein paar weitere Themen, die andere schon angesprochen haben. Was ist der Union wichtig? Wir wollen, dass Frauen besser repräsentiert sind; das haben wir mehrfach beschlossen.
Aber zuerst zu Ihnen, Frau Schielke-Ziesing. Ich verstehe Ihren Angriff gar nicht. Während es in Thüringen und Brandenburg verpflichtende Frauenquoten gibt, steht jetzt im Gesetzentwurf – wohlweislich resultierend aus den Rechtsproblemen – eine verschärfte Sollvorschrift. Dass diese nun nach dem Urteil rechtlich nicht möglich sein soll, erscheint mir in Ihrer Argumentation ziemlich absurd.
Wir tragen das jedenfalls selbstverständlich mit.
