Wir führen – und das haben wir entgegen den Planungen erreicht; das war mir sehr wichtig – auch die Bundesprogramme „Sprach-Kitas“ und „Kita-Einstieg“ weiter. Das sind über 200 Millionen Euro im Jahr. Jede achte Kita in Deutschland ist eine Sprachkita. Wenn Sie noch in keiner waren – ich bin mir aber sicher, Sie alle kennen sie aus Ihren Wahlkreisen –,
dann wissen Sie, wie wichtig dieses Programm ist, wie wichtig diese tolle Sprachbildung in den deutschen Sprachkitas ist und wie großartig dieses Geld eingesetzt wird.
Mit diesen Maßnahmen sorgen wir für mehr Plätze und auch für mehr Qualität in der Kinderbetreuung. Wir unterstützen Eltern, die Familie und Beruf vereinbaren wollen, und wir unterstützen vor allen Dingen Kinder, damit sie gleiche und gerechte Chancen im Leben bekommen. Das ist die zentrale Zukunftsfrage in unserem Land. Das ist systemrelevant.
Zum Zweiten – ein weiterer wichtiger Schwerpunkt – unterstützen wir das Engagement und die Demokratieförderung. Ich freue mich sehr, dass es gelungen ist, das Bundesprogramm „Demokratie leben!“ nicht nur im kommenden Haushaltsjahr aufzustocken, nämlich von 115 auf über 150 Millionen Euro, sondern wir haben auch für die kommenden Jahre eine Erhöhung auf bis zu 200 Millionen Euro ab dem Jahr 2023 vorgesehen. Das ist fast eine Verdopplung der bisherigen Mittel, und das ist ein wichtiges Signal
für all diejenigen in unserem Land, die sich gegen jede Art von Extremismus und für die Demokratieförderung einsetzen.
Warum das wichtig ist, haben wir gerade kürzlich auf den Stufen dieses Parlamentsgebäudes gesehen: weil es Menschen gibt, die sich aus unserem gesellschaftlichen und demokratischen Konsens ausklinken, die sich in Verschwörungsfantasien verlieren und unsere demokratische Ordnung infrage stellen. Das darf uns nicht kaltlassen. Deshalb müssen wir darauf antworten und das Thema Prävention starkmachen, genauso wie die politische Bildung.
Dafür brauchen wir nicht immer nur neue Programme. Es geht auch darum, auf starke Kontinuität zu setzen, zum Beispiel beim Kinder- und Jugendplan des Bundes. Damit fördern wir auch im nächsten Jahr über 850 bundeszentrale Organisationen und Einrichtungen – Jugendverbände, Sportvereine und Musikschulen, die Nummer gegen Kummer oder den neuen Bundesjugendchor, den wir gegründet haben –, damit gute Kinder- und Jugendarbeit in Deutschland auf einer verlässlichen Grundlage steht. Deshalb ist es gut, dass wir hier weiter in dieser Größenordnung investieren.
Mir ist wichtig, dass wir diejenigen unterstützen und stärken, die nicht nur meckern, dass jemand anderes etwas tun sollte, sondern auch aktiv etwas dafür tun, die Dinge zum Besseren zu verändern. Wir haben ein Programm, das Chancenpatenschaften übernimmt und Menschen stärkt, die Hilfe brauchen. „Menschen stärken Menschen“ heißt dieses Programm. Wir sichern auch dafür eine Perspektive, genauso wie für die vielen Freiwilligen, die in den Freiwilligendiensten jedes Jahr Zeit und Kraft aufbringen, um sich für die Gemeinschaft zu engagieren. Wir stärken die wichtige Arbeit der Wohlfahrtsverbände mit 39 Millionen Euro pro Jahr, und das mit einer Perspektive für die kommenden zwei Jahre, damit die Wohlfahrtsverbände, auch bei ihrer wichtigen Arbeit für die Digitalisierung, Planungssicherheit haben.
Meine Damen und Herren, wir haben über 540 Mehrgenerationenhäuser in Deutschland – auch die kennen Sie alle aus Ihren Wahlkreisen –, die die verschiedensten Menschen – Jung und Alt, Menschen mit Migrationshintergrund und Menschen ohne Migrationshintergrund – zusammenbringen und für Gemeinschaft sorgen. Auch diese Mehrgenerationenhäuser, die Leuchttürme für ein gutes gesellschaftliches Miteinander sind, werden wir stärken und die Mittel dafür mit unserem neuen Programm mit einer Perspektive von einem Förderzeitraum von acht Jahren verstetigen. Das ist ein wichtiges Signal für Deutschland.
All diese Projekte bewirken, dass Menschen zusammenkommen, dass sie ihren Platz in der Gesellschaft finden, dass sie gesehen und angenommen werden und dass wir jeder Form von Extremismus entgegentreten, um den sozialen Frieden in unserem Land zu erhalten. Deshalb ist es wichtig, dass wir auch künftig genau dort die Schwerpunkte setzen. Unser Haushalt sorgt dafür, dass wir ein stabiles Land schaffen, in dem Jung und Alt gut versorgt sind, in dem Vereinbarkeit von Familie und Beruf für Frauen und Männer gelingt, in dem Engagement gefördert wird und in dem Bund, Länder und die Zivilgesellschaft gemeinsam Probleme lösen. Das ist der Weg; den wollen wir zusammen gehen.
Ich danke Ihnen herzlich für Ihre Unterstützung.
Das Wort hat der Abgeordnete Volker Münz für die AfD-Fraktion.
