Herr Präsident! Verehrte Kolleginnen und Kollegen! Vor gut zwei Jahren hat uns der Bundesrechnungshof auf eine Reihe von Vergaberechtsverstößen im BMVg hingewiesen. Wir sind ihnen nachgegangen, zuerst im Verteidigungsausschuss und anschließend im Untersuchungsausschuss, und konnten sie im Wesentlichen bestätigen.
Im BMVg sind während dieser ganzen Phase eine ganze Reihe von Maßnahmen ergriffen worden, um solche Entwicklungen in Zukunft zu verhindern. Als Erstes – weil es noch nicht genannt worden ist – wurden alle Abrufe aus den umstrittenen Verträgen beendet. Im nachgeordneten Bereich wurde das Vieraugenprinzip eingeführt. Im Ministerium wurde ein neues Referat zur Verbesserung der Fachaufsicht aufgestellt. Es gibt eine neue zentrale Dienstvorschrift zur besseren Abgrenzung von Beratungs- und Unterstützungsleistungen.
Es wurde eine Reihe von bestehenden Vorschriften angepasst, und auch die IT-Systeme für die Abrechnung von Leistungen wurden verbessert. Nach menschlichem Ermessen und auch nach Aussage des Bundesrechnungshofs sind diese Maßnahmen angemessen, um solche Entwicklungen zukünftig zu verhindern.
Der Ausschuss hat aber auch etwas anderes ergeben: Jedem der Beteiligten – wir haben sie ja im Ausschuss als Zeugen rauf und runter gehört – kann man unterstellen, dass er aus seiner Sicht das Beste, manchmal auch das Schnellste und oft halt das Bequemste für die Bundeswehr wollte.
Es gibt keine Hinweise darauf, dass einer einen persönlichen Vorteil davon hatte. Den Vorteil hatten zum Teil externe Berater; aber die Mitarbeiter der Bundeswehr haben nach bestem Wissen und Gewissen und für die Truppe gehandelt.
Meine Damen und Herren, dabei wurden Fehler gemacht, und es wurden Leute beauftragt, die man kennt. Das war falsch.
Jetzt gibt es neue Regeln und mehr Kontrolle, und es stellt sich die Frage: Ist das jetzt eigentlich alles richtig? – Jetzt kann man natürlich über jede einzelne Maßnahme, die ich gerade vorher aufgezeigt habe, sagen: Ja, die ist richtig; sie hilft, Fehler und Risiken zu vermeiden. – Aber wir müssen auch das Gesamtsystem betrachten, und das Gesamtsystem entwickelt sich aus meiner Sicht in eine falsche Richtung. Wir kriegen das ganz oft von der Opposition und auch aus dem Haus vorgehalten.
Ich darf zitieren – ich habe mir das extra herausgesucht –, was das Kommando Heer kürzlich zum Beschaffungswesen aufgeschrieben hat:
Die derzeitige Beschaffungspraxis ist darauf ausgerichtet, Risiken möglichst auszuschließen, und strebt maximale (rechtliche) Sicherheit und Regelkonformität an. …
