Sehr geehrter Herr Präsident! Liebe Kolleginnen! Liebe Kollegen! Sehr geehrter Kollege Klinge, wir haben uns ja heute Nachmittag am Rande der Ausschusssitzung schon kurz austauschen können. Ich habe Ihren Antrag genau durchgelesen. Da steht vieles im Rubrum drin, was wir durchaus unterschreiben können. Die dramatische Situation des Gastgewerbes und der Hoteliers, wie Sie sie beschreiben, sehen wir alle fraktionsübergreifend ähnlich.
– Langsam, langsam; schreien Sie nicht zwischendurch rein! Stellen Sie mir eine Frage, dann habe ich mehr Zeit!
Sie titulieren Ihren Antrag mit „Pandemieplan“. Das setzt voraus, dass wir hier bezüglich der Pandemie und des Covid-19-Virus etwas planen können. Bei der Ausbreitung dieses Virus gibt es aber leider nun einmal Unwägbarkeiten und nur begrenzt Einflussnahmemöglichkeiten der Regierung.
Das heißt im Endeffekt: Wie sich das Virus in der Bevölkerung verbreitet, haben wir doch im Sommer und im Herbst an dem Ansteigen der Infektionszahlen gemerkt. Das Verhalten der Menschen ist entscheidend: Wo trifft man sich? Wie feiert man zusammen? Wo gibt es Pandemietreiber? Ich habe bei mir im Wahlkreis vor drei Tagen ein Seniorenheim mit 107 Menschen besucht. 87 davon sind positiv getestet. Dieses Virus ist nicht zu unterschätzen.
Wir hoffen, dass die Menschen – – Herr Präsident, können Sie bitte für ein bisschen Ruhe bei der FDP sorgen?
Herr Kollege Lehrieder, solange Sie das stört, bitte ich um ein bisschen Ruhe.
Ja, mich stört es – nicht zu knapp.
