Zweitens. Aus den Finanzreserven der Kassen, die 0,4 Monatsausgaben überschreiten, werden wir einmalig 8 Milliarden Euro in den Gesundheitsfonds überführen.
Drittens. Die Verpflichtung der Kassen zum stufenweisen Abbau überschüssiger Finanzreserven wird auf Kassen mit Finanzreserven von mehr als 0,8 Monatsausgaben ausgedehnt werden.
Meine Damen und Herren, mit diesem Gesetz werden wir die Versorgung in einem Bereich verbessern, der elementar ist, nämlich in der Geburtshilfe und der Hebammenversorgung. Warum ist das für uns ein Kernanliegen? Das ist für uns ein Kernanliegen, weil werdende Mütter unsere Unterstützung brauchen. Das ist für uns ein Kernanliegen, weil wir eine bessere Betreuung der Schwangeren während der Geburt haben wollen. Und das ist für uns ein Kernanliegen, weil wir die Arbeitsbedingungen der Hebammen in der Geburtshilfe nachhaltig verbessern wollen.
Was sehen wir konkret vor? Ein Förderprogramm für drei Jahre.
Erstens. Pro 500 Geburten im Jahr in einer Klinik erhalten diese Kliniken jeweils eine halbe zusätzliche Hebammenstelle extra finanziert. Das führt zu 600 zusätzlichen Vollzeitstellen für Hebammen; das ist eine ganze Menge.
Zweitens. Wir sehen vor, zusätzliches Assistenzpersonal zu finanzieren. Weshalb? Weil uns die Hebammen aus der Praxis heraus immer wieder berichten, dass sie hohe Arbeitsbelastungen haben, teilweise und stellenweise auch Überlastungssituationen. Dies hängt mit fachfremden Tätigkeiten zusammen. Deswegen finanzieren wir Assistenzpersonal. Das führt zu 700 zusätzlichen Stellen, die extra finanziert werden. Das entlastet die Hebammen. Das führt dazu, dass sich Hebammen stärker als bisher auf ihre eigentlichen Kernaufgaben konzentrieren können. Es unterstützt die Hebammen. Es unterstützt die werdenden Mütter. Das Programm kostet rund 200 Millionen Euro. Aber ich sage: Jeder Euro in diesen Bereich investiert ist sinnvoll investiert.
Ich freue mich auf die Beratungen.
Vielen Dank, Herr Staatssekretär. – Es macht sich bereit für die Fraktion der AfD der Kollege Uwe Witt. Herr Kollege, wenn Sie noch einen Moment warten.
So. Jetzt haben Sie das Wort.
