Es wäre also grob fahrlässig, auf diese Vorsichtsmaßnahme zur Eindämmung des Infektionsgeschehens zu verzichten.
Das heißt, so selten wie möglich, aber so häufig wie nötig müssen Masken getragen werden.
Jeder kennt das aus seinem Bundesland: Da gibt es für die Kinder gute Lösungen, regionale Lösungen, Lösungen mit speziellem Blick auf das Infektionsgeschehen.
– Nein, das ist kein Wildwuchs. Wenn es aber in einem Bundesland A einen ganz anderen Infektionsverlauf als im Bundesland B gibt, dann muss man auch differenzierte Lösungen finden.
Herr Kollege, kommen Sie zum Schluss, bitte.
Ich komme zum Schluss, Herr Präsident.
Ja.
