Außerdem muss ich Ihnen sagen: Ich bin da ganz entspannt. Wir sind jetzt im Gesetzgebungsverfahren. Wir werden dieses Gesetz noch entscheidend verbessern. Wir haben in der nächsten Sitzungswoche die Anhörung im Ausschuss. Wir bringen uns auch im Kreis der Klimapolitiker sehr konstruktiv in diese Diskussion ein. Sie können sicher sein, dass wir am Ende auch ein gutes EEG haben werden.
Gut, danke schön. – Dann geht es weiter in Ihrer Rede.
Wir brauchen alle Staaten der Welt. Mit dem Pariser Klimaabkommen ist auch die Trennung zwischen den Industrienationen und den Entwicklungs- und Schwellenländern aufgehoben worden. Wir werden unsere Klimaziele nicht erreichen, wenn die Entwicklungs- und Schwellenländer ihre Wirtschaft nicht von Anfang an klimafreundlich aufbauen. Wir brauchen die Klimaabkommen auch deswegen, damit diese Staaten mitgenommen werden und damit wir, wenn wir in diesen Staaten investieren, dies auf unsere Klimaziele angerechnet bekommen.
Denn bei einem haben Sie recht: Allein in Deutschland können wir dem Klimawandel nicht begegnen. Wir brauchen alle Staaten der Welt. Deswegen brauchen wir auch internationale Abkommen.
Vielen Dank.
Vielen Dank, Dr. Anja Weisgerber. – Nächster Redner: für die FDP-Fraktion Dr. Lukas Köhler.
