Sehr geehrter Herr Präsident! Liebe Kolleginnen und Kollegen! Meine sehr geehrten Damen und Herren von den Grünen, ich habe es beim letzten Mal an dieser Stelle schon gesagt: Wer vergessen machen will, dass er in diesem Land in Regierungen sitzt und damit Verantwortung trägt, handelt populistisch und unseriös.
Diese Pressemitteilung hier hat der grüne Verkehrsminister von Hessen vor zwei Wochen herausgegeben – Überschrift: „Bundesstraßenprojekte können beginnen“. Darin feiert sich der Minister dafür, dass sich das Projektvolumen im Straßenbereich mehr als verdoppelt hat.
Das Land Baden-Württemberg hat 2016 unter einer grünen Regierung über 100 Straßenbauvorhaben für den Bundesverkehrswegeplan 2030 angemeldet, darunter zahlreiche Autobahnen. Haben Sie eigentlich mal mit Ihren grünen Ministerpräsidenten und Verkehrsministern darüber gesprochen, wie sie es fänden, wenn der Bund seine Planungen für den Straßenbau in diesen Ländern auf Eis legen würde? Oder darf Herr Kretschmann Ihre ideologischen Phrasen auf Bundesebene nicht mehr kommentieren, weil sonst deutlich werden würde, wie sehr bei Ihnen Anspruch und Wirklichkeit auseinanderfallen?
Im Grunde bin ich Ihnen sehr dankbar für Ihre Forderung, da sie bloßstellt, was von Ihren ganzen Papieren zu Strukturwandel, Transformation und Mobilitätswende zu halten ist. Natürlich brauchen wir einen Umbau unseres Verkehrssystems hin zu mehr Nachhaltigkeit. Wir wollen ein Verkehrssystem, das Mobilität umweltgerecht ermöglicht
und insbesondere in den Städten auch mit weniger Autoverkehr funktioniert.
Aber Ihnen geht es in Wahrheit nicht um die Mobilität der Menschen, nicht um den Umbau des Verkehrssystems.
Sie sind gegen das Autofahren an sich. Das ist die DNA Ihrer Partei!
