und ohne den vereinbarten Kompromiss zum Baugebot auf den Weg gebracht. Das geht nicht, das muss korrigiert werden.
Ich bin sehr gespannt, Herr Minister, auf Ihr Angebot, das Sie eben angekündigt haben.
Herr Kollege, Ihre Redezeit ist zu Ende.
Ich habe noch viele andere Punkte, die ich nicht mehr ansprechen kann. – Wir wollen, Herr Minister, keinen Bauminister haben, der sozusagen ohne Baugesetzbuch seine Amtszeit beendet. Deswegen sind wir auf Ihr Angebot sehr gespannt und hoffen, dass es eine einvernehmliche Lösung noch geben kann. Dafür müssen Sie sich aber anstrengen.
Danke schön.
Konstantin Kuhle, FDP, hat jetzt das Wort.
