Herr Präsident! Meine sehr verehrten Damen und Herren! „Gemeinsam. Europa wieder stark machen“ – Kollegin Staffler hat das Motto genannt – ist ein Ziel der deutschen Ratspräsidentschaft, für das es sich wirklich lohnt, Politik zu machen. Und obwohl wir uns alle fragen, ob dies die sinnvollste Aktuelle Stunde ist und ob es nicht andere Themen gäbe, die man behandeln kann, sind wir nun hier und können uns mit diesem Thema auseinandersetzen; denn die deutsche Ratspräsidentschaft ist – das zeigt ihre Halbzeitbilanz – sehr erfolgreich.
An dieser Stelle möchte ich auch einen Dank an diejenigen aussprechen, die das trotz Corona bewerkstelligen müssen. Das sind zunächst selbstverständlich die Vertreterinnen und Vertreter unserer Bundesregierung mit ihren Mitarbeiterinnen und Mitarbeitern, an der obersten Stelle Kanzlerin Merkel und Vizekanzler Olaf Scholz. Die haben mit den Fachministerinnen und Fachministern tatsächlich bereits sehr viel erreicht; ich werde gleich darauf eingehen. Ich möchte natürlich auch dem Präsidenten, in Vertretung Herrn Friedrich, danken, dass wir unser parlamentarisches Programm trotz der organisatorischen Schwierigkeiten, die wir durch Covid-19 haben, unter erschwerten Bedingungen durchführen können, dass wir Konferenzen durchführen und unsere Beiträge leisten können. Auch hierfür einen ganz herzlichen Dank an all diejenigen, die dies bewerkstelligen!
Es ist vieles erreicht worden. Wir haben als Startschuss einen Vorschlag für den mehrjährigen Finanzrahmen erreicht. Das war vorher über mehrere Jahre nicht möglich. Es ist nicht ungewöhnlich, dass das immer kurz vor Toresschluss kommt. Der Vorschlag liegt nun beim Europäischen Parlament. Die Schwierigkeiten sind genannt worden, aber der Vorschlag ist da.
Jetzt kann man natürlich sagen: Bei dem einen gibt es zu wenig, bei dem anderen zu viel. – Das ist ganz normal. Man kann auch ursprüngliche Vorschläge oder das, was im letzten Finanzrahmen enthalten war, als Bezugspunkt nehmen; je nachdem gibt es eine Steigerung oder keine Steigerung. Das sind die typischen politischen Bewertungen, die legitim sind und mit denen wir uns auseinandersetzen. Jeder hat seine Schwerpunkte, wo er sagen würde: Da will ich mehr. – Das wird im Europäischen Parlament nun sehr stark verhandelt. Dort spielt das Thema Rechtsstaatlichkeit selbstverständlich eine exponierte Rolle.
Ich bin nicht so pessimistisch bei dem Vorschlag, der auf dem Tisch liegt. Mehr geht immer – ganz klar –; ich habe auch gar nichts dagegen. Aber der Fuß ist in der Tür, und zwar sehr stark. Die müssen wir offen halten und die Möglichkeiten nutzen, liebe Kolleginnen und Kollegen.
Beim Thema Brexit haben wir das Trauerspiel auf der britischen Seite, das wir die ganze Zeit haben; das muss man sagen. Herrn Barnier und der Europäischen Union ist es gelungen, Geschlossenheit zu wahren; das ist unwahrscheinlich wichtig, auch in der jetzigen schwierigen Phase. Auch das ist ein Signal während der deutschen Ratspräsidentschaft: dass die Europäische Union geschlossen auftritt, wenn es darum geht, die Werte der Europäischen Union, die Freizügigkeit in der Europäischen Union, den Binnenmarkt in der Europäischen Union zu schützen und damit, liebe Kolleginnen und Kollegen, auch Frieden und Wohlstand in unserem Land zu sichern. Das ist eine Grundvoraussetzung.
Dazu leisten die Europäischen Union und die deutsche Ratspräsidentschaft einen großen Beitrag.
