Sehr geehrter Herr Präsident! Liebe Kolleginnen und Kollegen! Heute ist ein guter Tag. Wir verabschieden heute das Gesetz zur Digitalisierung von Verwaltungsverfahren bei der Gewährung von Familienleistungen. Ja, man kann kritisieren, dass das schon längst hätte geschehen müssen. Und ja, ich bin ehrlich: Das hatten wir uns schon für die letzte Wahlperiode vorgenommen. Aber es ist wichtig, dass man ein gutes Gesetz nun auch so zu Ende bringt, dass es ankommt. Das freut mich, und darauf können wir alle miteinander auch mal stolz und dankbar sein.
Denn man muss nicht nur kritisieren; man muss am Ende des Tages ja auch machen. Ich freue mich ganz besonders, dass wir mit diesem Gesetz gerade junge Familien entlasten und stärken und dass wir nach dem Starke-Familien-Gesetz hier nun einen weiteren Gesetzentwurf vorlegen, damit junge Familien sehen: Der Staat ist an deiner Seite. Der Staat unterstützt dich beim Kinderkriegen, bei der Kindererziehung, bei der Betreuung und nimmt dir diese administrativen Aufgaben so gut wie möglich ab. Vielen Dank dafür!
Ich will auch die Kritik, die hier erwähnt wurde, ansprechen. Denn wenn wir uns fragen: „Warum sind 525 Verwaltungsdienstleistungen immer noch nicht digitalisiert?“,
dann müssen wir dazusagen: Das ist nicht deshalb so, weil wir von der Unionsfraktion es nicht wollen, sondern das betrifft strukturelle Fragen, Dinge, die in unserem Land problematisch funktionieren. Da ist natürlich der Verwaltungsföderalismus mit dem Bund, mit den Ländern, mit den Gemeinden. Da haben wir unterschiedliche Software. Da haben wir unterschiedliche Zuständigkeiten in den Ländern. Überlegen wir doch einfach mal, wer überall fürs Elterngeld zuständig ist, wer Kindergeld auszahlt, wie das auf den Jugendämtern funktioniert. Alleine an 435 Jugendämtern in Deutschland haben wir unterschiedlichste Systeme für den Unterhaltsvorschuss usw. usf.; ich könnte da zahlreiche Beispiele nennen.
Deswegen ist es richtig und gut, dass wir die Identifizierung der Bürgerinnen und Bürger einheitlich festlegen, dass wir ein funktionierendes System nehmen – E-Government funktioniert im Steuerverfahren besonders gut; das muss ich ganz klar sagen –, die Steuer-ID für die Identifizierung der Bürgerinnen und Bürger im Onlineverfahren, und dies auch zur Grundlage für weitere Verwaltungsdienstleistungen machen. Das ist ein richtiger und guter Schritt zu mehr E-Government in unserem Land, liebe Kolleginnen und Kollegen.
Deswegen verstehe ich die Opposition nicht, die auf der einen Seite sagt: „Ja, wir fordern mehr E-Government; wir fordern mehr Vereinheitlichung, mehr standardisierte Verfahren“,
aber auf der anderen Seite sagt: „Nein, gemeinsame Register, das geht doch alles gar nicht; das ist Teufelszeug“, und dann kommt man hier auf das Urteil von 1983 zu sprechen. Damals gab es für die meisten Bürgerinnen und Bürger in diesem Land noch gar kein Internet. Deswegen sollte man da vorsichtig sein.
Ich appelliere an Sie: Arbeiten Sie hier mit uns zusammen. Lassen Sie uns Lösungen finden, wie wir die Bürgerinnen und Bürger in gemeinsamen Registern, in gemeinsamen Datenbanken der verschiedenen Behörden erfassen können, aber auch – und da bin ich bei Ihnen von der Grünenfraktion –, wie wir den Bürger stets und ständig über Verwaltungsdienstleistungen, über Abfragen informieren.
Wenn ich mir was bei Amazon bestelle,
