Sehr geehrter Herr Präsident! Liebe Kolleginnen und Kollegen! Ich finde es ja sehr schön, wenn bei der Vorbereitung auf eine Rede so ein bisschen eine ähnliche Stimmung aufkommt wie bei der Vorbereitung auf einen SPD-Parteitag. Mir ging das zumindest am Anfang der Beschäftigung mit dem Antrag der Linken ein wenig so. Insofern: Danke für einige Aspekte des Antrags!
Ich halte insbesondere die Idee einer interfraktionellen Arbeitsgruppe zum Austausch über die Altersversorgung von Abgeordneten für eine sehr diskutable Idee.
Die SPD hat auf Parteitagen schon ziemlich oft eine Erwerbstätigenversicherung beschlossen. Wenn man eine Erwerbstätigenversicherung will – die SPD will das; der Koalitionspartner eher nicht –, dann ist es aus meiner Sicht sehr logisch, dass man in einem ersten Schritt tatsächlich über die Abgeordneten spricht. Das wäre recht einfach. Man hat es zumindest nicht mit Lobbygruppen von außen zu tun; es ist auch eine sehr kleine Gruppe, und wir könnten eine Vorbildfunktion ausüben.
Bei manchen Reden habe ich hier ein bisschen den Eindruck gewonnen, dass man davon ausgeht, dass wir nicht Vorbilder sind, sondern dass wir etwas Besseres sind. Das würde ich mit einem ganz klaren Nein beantworten. Wir sind gewählt, aber wir sind nicht erwählt.
Ich finde aber, wenn man sich mit der Altersversorgung von Abgeordneten beschäftigt und deren Einbeziehung in die Rentenversicherung fordert, dann sollte man sich auch mit den Problemen befassen.
– Sorry, da ist totale Stille.
