Frau Kollegin, Sie müssen jetzt wirklich zum Schluss kommen.
– im Sommer einen Präsidiumsbeschluss gefasst haben für eine Eins-zu-eins-Betreuung. Das sage ich auch in Richtung der Grünen; die sind noch nicht ganz so weit wie wir.
Wir wollen eine Eins-zu-eins-Betreuung, durchgehend, im Kreißsaal. Wir wollen natürlich auch die Hebammenvergütung verbessern; das haben wir als einen ganz wichtigen Punkt auch noch ins Auge gefasst. Darüber müssen wir im Ausschuss noch reden, liebe Kolleginnen und Kollegen; –
Frau Kollegin, jetzt sind Sie eine Minute drüber.
– wir haben noch Zeit dafür.
Auch bei der Personalbemessung der Pflege achten wir, Herr Kessler, natürlich – –
Frau Kollegin, ich musste Ihnen jetzt bedauerlicherweise das Wort entziehen, weil eine Minute und zehn Sekunden drüber – mit der Ankündigung, Sie wollten sich an die Redezeit halten –, das ist schon eine beachtliche Leistung.
Man hat Sie auch mit Maske verstanden; allerdings erkennt man Sie ohne Maske deutlich besser. Trotzdem muss ich jetzt einschreiten.
– Das hat mit Kleinlichkeit nichts zu tun. Ich mache aus meinem Herzen keine Mördergrube: Hier kann nach meiner Auffassung jeder so lange reden, wie er möchte. Allerdings begrenzen die Fraktionen die Redezeit, und daran sollten wir uns dann halten; wenden Sie sich an Ihren Geschäftsführer!
Letzter Redner zu dem Tagesordnungspunkt ist der Kollege Erich Irlstorfer, CDU/CSU-Fraktion.
