Leider haben Sie zu viel über Regelungen zur Arbeitszeit geredet. Leider wollen Sie dieses wichtige Schutzrecht schleifen. Das, sage ich Ihnen, wird es mit uns nicht geben. Nutzen Sie doch die Möglichkeiten von Tarifverträgen, die es bei uns in Deutschland gibt.
Herzlichen Dank.
Das war deutlich drüber. – Danke schön, Herr Rosemann.
– Ja, das ist deutlich drüber. Ich ziehe nichts ab, weil ich gut aufgelegt bin.
– Um Gottes willen: Nein, nein, das ist rückwirkend. Rückwirkend gilt das nur. Wir kommen jetzt nämlich ganz gut durch.
Nächste Rednerin: für die Fraktion Die Linke Jessica Tatti.
