– ja, da brauchen Sie nicht zu lachen –, gegenüber Rechtsradikalen und Menschen, die in diesem Lande als Identitäre umherspringen,
im Mittelpunkt zu stehen. Denn Radikalismus und Fanatismus – egal ob von rechts, von links, vom Islam oder anderen Gruppierungen – dürfen in einem Staat nicht hingenommen werden.
Um dem entgegenzuwirken, liebe Kolleginnen und Kollegen, wird uns in einem Rechtsstaat nichts anderes übrig bleiben – das haben wir konsequent durchzusetzen, und das machen die Bundesregierung und die Koalitionsmehrheit in diesem Parlament konsequent –, als Repression und Vorbeugung mit Ausstiegshilfen und Programmen zu kombinieren und zu unterlegen.
Menschen aus der Gesellschaft herausnehmen, das können wir mit ganz einfachen Lösungen, indem wir sagen: Wir schieben Gefährder, die nicht deutsche Staatsangehörige sind, ab. – Aber was machen wir mit den 30 000 Rechtsradikalen, die wir bei uns haben? Die können wir nicht abschieben. Dafür haben wir keinen Raum zum Abschieben. Da müssen wir etwas tun. Deshalb ist ein Dreiklang notwendig: zum Ersten die Repression, zum Zweiten die Vorbeugung und zum Dritten das Anbieten konsequenter Ausstiegshilfen, die es ermöglichen, die Menschen wieder in die Gesellschaft zurückzuführen.
Dies geht nur, liebe Kolleginnen und Kollegen, wenn wir da nicht mit Fanatismus, sondern mit Ruhe, mit Bedacht und mit Klugheit herangehen, unseren Gerichten die entsprechenden Instrumente geben, unserer Polizei und unseren Diensten die Instrumente zur Zusammenarbeit geben und wenn wir nicht vergessen: Hinter allem und für alles, was wir tun, stehen die Menschen in unserem Land und in unserem Nachbarland, egal welche Religion sie haben.
Ich bedanke mich recht herzlich für die Aufmerksamkeit und wünsche ein schönes Wochenende.
Vielen Dank, Karl-Heinz Brunner. – Wieder als letzter Redner in dieser Debatte und in dieser Woche: Michael Kuffer für die CDU/CSU-Fraktion.
