Die Linken haben auch einen Antrag eingereicht, den wir erstmalig diskutieren. Sie möchten Cannabis und Alkohol gleichstellen, jedenfalls was den Führerscheininhaber und die Führerscheininhaberin betrifft. Ein Entzug der Fahrerlaubnis soll hier nicht allein aufgrund des festgestellten Konsums oder des widerrechtlichen Besitzes illegaler Drogen, und zwar nicht nur von Cannabis, sondern aller illegalen Drogen, erfolgen, sondern nur, wenn eine Abhängigkeitserkrankung diagnostiziert wurde, wenn durch den Drogenkonsum eine konkrete Gefährdung des Straßenverkehrs verursacht wurde oder wenn wiederholt Zuwiderhandlungen im Straßenverkehr nach dem Straßenverkehrsgesetz begangen wurden. In der Fahrerlaubnis-Verordnung soll ergänzt werden, dass durch einen ein- oder mehrmaligen betäubungsmittelrechtlichen Verstoß durch den Konsum von Cannabis kein Eignungszweifel begründet wird. Bei jemandem, der im Straßenverkehr ein Kraftfahrzeug führt, soll hinsichtlich des Konsums von Cannabis erst eine Wirkung angenommen werden, wenn ein Toleranzgrenzwert von 10 Nanogramm THC pro Milliliter im Blutserum vorliegt. Auch für diese Vorschläge gibt es keine wissenschaftliche Grundlage.
Einen solchen Schritt werden wir massiv bei der Verkehrssicherheit spüren; denn es wird zu mehr Unfällen kommen.
Schon nach derzeitiger Rechtslage führt der widerrechtliche Besitz von Betäubungsmitteln im Sinne des Betäubungsmittelgesetzes nicht unmittelbar zur Entziehung der Fahrerlaubnis, wie hier behauptet wird, sondern nur zur Anordnung eines ärztlichen Gutachtens zur Abklärung des Konsumverhaltens.
Wenn Sie beim Autofahren alkoholisiert sind, dann haben Sie sehr wohl die Chance, den Führerschein sofort zu verlieren, und Sie möchten das angleichen. Bei anderen Drogen reicht vielleicht auch einmaliger Konsum für eine Entziehung der Fahrerlaubnis aus.
Ich möchte noch auf die Empfehlung des Deutschen Verkehrsgerichtstages, wo ich auch schon einige Male dabei war, von 2018 eingehen. Ein wesentlicher Punkt, der 2018 in einer Arbeitsgruppe festgestellt wurde, ist, dass die Fahrtauglichkeit erst ab einem THC-Wert von 3 Nanogramm pro Milliliter eingeschränkt ist; 1 Nanogramm, 3 Nanogramm. Wir haben jetzt also vier Werte: 1, 3, 5 und 10. Deswegen ist es gut, dass die Grenzwertkommission beim Bundesministerium für Verkehr zu diesem Thema im Dezember tagen wird. Die Grenzwertkommission beschäftigt sich mit der Einführung von Gefahrengrenzwerten im Straßenverkehr. Deren Empfehlung ist für die Union Handlungsmaßstab. Daran werden wir uns orientieren.
Den Gesetzentwurf der Grünen werden wir ablehnen. Den Antrag der Fraktion Die Linke, der hier erstmalig diskutiert wird, würden wir im Verkehrsausschuss gern detailliert beraten.
Herzlichen Dank.
