Sehr geehrte Frau Präsidentin! Sehr geehrter Herr Bundesminister Spahn! Liebe Kolleginnen und Kollegen! Meine Damen und Herren! Unser duales Krankenversicherungssystem haben wir in diesem Hause immer wieder diskutiert. Gefühlt haben wir dieses Thema ähnlich intensiv wie das aktuelle Thema der Coronapandemie diskutiert, ohne dass es dadurch besser würde.
– Das kann ich an Sie zurückgeben, Herr Kessler.
Ein Antrag fordert, wie wir jetzt gelernt haben, als Zwischenschritt – so haben Sie uns das erklärt –, die Beitragsbemessungsgrenze der gesetzlichen Kranken- und Pflegeversicherung abzuschaffen, allerdings ohne die in jedem Fall hilfreich sein könnenden neuen Argumente. Frau Maag hat darauf nachdrücklich hingewiesen.
Ihr Antrag ist vielmehr zum wiederholten Male aufgrund verfassungsrechtlicher Bedenken abzulehnen.
– Hören Sie doch mal zu! Das wäre hilfreich. Vielleicht lernen Sie noch etwas.
Bei der Beitragsbemessung in unserem solidarisch ausgerichteten System darf die Solidarität in der Versicherungsgemeinschaft nicht überdehnt werden. Um dem Grundsatz der Verhältnismäßigkeit zu entsprechen, muss in solchen Systemen das Äquivalenzprinzip der Versicherung bleiben.
Das heißt – jetzt passen Sie auf! –, dass Leistungen, für die Beiträge entrichtet werden, auch dem Interesse der Versicherten entsprechen müssen. Anderenfalls kommen die Beiträge einer Steuer gleich. Das wollen wir nicht.
In einem zweiten Antrag fordern Sie, die private Krankenversicherung ab einem bestimmten Stichtag auf medizinisch nicht notwendige Zusatzversicherungen zu begrenzen. Alle privat Krankenversicherten sollen per Gesetz zu gesetzlich Versicherten werden. Diese faktische Abschaffung der PKV begegnet ebenfalls grundsätzlichen verfassungsrechtlichen Bedenken. Dies würde einen nicht zu rechtfertigenden Eingriff in die Berufsfreiheit der Versicherer darstellen. Warum wollen Sie unser zuverlässiges System gefährden? Das deutsche Gesundheitssystem hat im internationalen Vergleich eine hohe Versorgungsdichte und ermöglicht allen Patientinnen und Patienten einen einfachen Zugang zu medizinischen Leistungen. Bei Einführung einer Bürgerversicherung sehe ich, sehen wir als Union eher eine Verschlechterung der Situation. Wir befürchten, dass ohne die Dualität der Systeme die Gefahr besteht, dass der Leistungskatalog nicht mehr dem medizinischen Fortschritt angepasst und mittelfristig auf eine minimale Grundversorgung reduziert wird. Meine Damen und Herren, nicht mit uns!
