Herr Dürr, gerade mit Ihrer Argumentation sorgen Sie mit dafür, dass sich die Länder an der Stelle hinter dem Bund verstecken.
Wir haben eine verteilte Verantwortung – Stichwort: Föderalismus –, wir haben Steuern, wovon mittlerweile nur noch 40 Prozent beim Bund landen, und die Finanzsituation der Länder und Kommunen vor Corona sah so aus, dass massiv Überschüsse da waren. Der DigitalPakt Schule war ursprünglich nur dafür da, dass die digitale Infrastruktur zu den Schulen hinkommen und in den Schulen ausgebaut werden kann. Das war der Ansatz vom DigitalPakt Schule – nicht mehr und nicht weniger.
Ich bin schon noch dafür, Herr Kollege Dürr, dass die Länder, die bis 2019 und ab 2021 wirklich eine deutlich bessere Finanzsituation als der Bund gehabt haben bzw. haben werden, an dieser Stelle ihrer Verantwortung nachkommen.
Das kann wirklich nicht anders sein.
Das Thema der Woche war: Der Bund ist für alles zuständig.
Hier beklagen Sie, das sei alles zu bürokratisch und zu kompliziert.
Wir haben jetzt einen Bundesrechnungshofbericht zum Thema „Hochschulpakt I und II“ bekommen.
