Frau Präsidentin! Liebe Kolleginnen und Kollegen! Herr Dr. Krings, ich bin ja ganz enttäuscht, aber positiv enttäuscht. Inhaltlich habe ich gar keine großen Bedenken. Nur: Sie haben das Ganze so entromantisiert und verkaufen das so schlecht.
Und jetzt muss ich versuchen, den stillen Zauber dieses Bundesmeldegesetzes, der gar kein so stiller ist, hier deutlich zu machen, und ich bemühe mich, das auch zu tun.
Denn es handelt sich, glaube ich, um ein durchaus sehr nutzerfreundliches Gesetzesvorhaben, auf das man am Ende wird stolz sein können. Das versuche ich jetzt auch deutlich zu machen.
Zugleich danke ich erst einmal auch Ihnen, Herr Dr. Espendiller, dass Sie in dem Zusammenhang nicht von Flüchtlingen gesprochen haben; das ist schon mal positiv.
Dass Sie da Big Brother wittern, verstört mich leicht; aber ich kommentiere das jetzt nicht weiter.
Wir halten uns ja oft mit diesen großen hitzigen Themen auf. Ich kann aber selber aus meiner Erfahrung – das werden viele aus ihren Wahlkreisen bestätigen können – sagen: Es gibt vor Ort in den Kommunen oft kaum emotionalere Themen als die Fragen des Funktionierens oder Nichtfunktionierens eines Einwohnermeldeamtes: Wartezeiten, Schwierigkeiten, Bürokratisierung und vieles andere. Insofern ist das, was wir heute im Sinne von Dienstleistung für Bürgerinnen und Bürger auf den Weg bringen, etwas zutiefst Menschenfreundliches und auch sehr nützlich für Kommunen. Wir können also mit weniger Frings’scher Bescheidenheit und mit mehr Lindh’scher Unbescheidenheit mutig und offen darüber reden.
Worum geht es letztlich? Es geht darum, dass wir den Auftrag des Onlinezugangsgesetzes, Ende 2022 gültig, in die Realität umsetzen können. Auch wenn sich bei der Union gerade, nach anfänglicher Begeisterung, wieder Nebengespräche entwickeln, werde ich mich nicht bremsen in meiner Begeisterung für dieses Vorhaben.
Denn es muss 2022 möglich sein, dass Bürgerinnen und Bürger elektronisch, direkt und ohne großen Aufwand ihre Daten abrufen können und dass sie auf das Melderegister zugreifen und es für ihre Zwecke nutzen können. Das ist ein immenser Fortschritt. Nach Einführung des Bundesmeldegesetzes 2015 hat sich gezeigt, dass wir von dieser Realität noch weit weg sind.
