Meine Damen und Herren, wie bequem war das denn, immer mal wieder zu sagen: „Beschlüsse, die wir hier oder im Bundesrat gefasst haben, sichern wir noch durch einen Beschluss der MPK ab“? Wie oft haben wir das jetzt in Krisenzeiten gehört? Ich habe kein Problem damit, wenn sie zusammenkommen. Ich vertraue vielen, ich wertschätze sie auch. Aber es ersetzt keine Debatte an den Orten, wo sie hingehört, und auch keine Entscheidung dort, wo sie hingehört.
Wir müssen über die Fragen hinsichtlich des Infektionsschutzgesetzes reden. Dieses Infektionsschutzgesetz ist ganz offenkundig gar nicht für diese Krisenpandemiezeit ausgelegt, ihr so gar nicht gewachsen. Wir brauchen da Veränderungen. Wir müssen in Bezug auf § 5, auf § 28 und auch in Bezug auf § 32 über die Verknüpfung zwischen Bund und Ländern diskutieren. Wir brauchen hier eine Neufassung. Wir brauchen eine stärkere Akzentuierung des Parlamentarischen, und sie müssen wir durch die Rechtsgrundlagen auch anders verankern, meine Damen und Herren.
Wenn es um so tiefgehende Grundrechtseingriffe geht, über die wir diskutieren und die vielen notwendig erscheinen und die notwendig sind, dann brauchen wir die Veränderung der Rechtsgrundlagen. Wir brauchen den Zustimmungsvorbehalt des Parlamentes. Wir brauchen eine stärkere Verankerung der Unterrichtungspflicht. Wir brauchen klarere Festlegungen über Entscheidungen und Kontrolle des Parlamentes.
Wir müssen auch sagen: Alles das, was eine Ministerpräsidentenkonferenz leisten kann, ist kein Ersatz für das, was wir eben in einem Rechtsstaat in einem neu gefassten Infektionsschutzgesetz als Rechtsgrundlage zusammenfassen.
Auch hier bin ich dankbar für die Initiative, dafür, dass wir das Thema bringen. Ich bin auch dankbar für die Ankündigung der SPD, dass da Bewegung entsteht; sie fordern wir schon seit März. Selbstverständlich werden wir als Fraktion hierzu auf parlamentarischem Wege etwas einbringen und es in der nächsten Woche vorlegen.
Vielen Dank.
Für die CDU/CSU-Fraktion hat nun Dr. Georg Kippels das Wort.
