sondern bleiben Sie hier mal bei den richtigen Fragen, bei dem Knackpunkt der Lüge. Das wird ja auch in Ihrer Partei intern intensiv diskutiert.
Herr Minister Scheuer, Sie konnten nicht beweisen, dass Sie das Parlament und den Untersuchungsausschuss nicht belogen haben.
Daher fordere ich Sie nunmehr auch persönlich auf, vom Amt des Bundesverkehrsministers sofort zurückzutreten.
Frau Bundeskanzlerin Merkel und auch Herr Söder müssen umgehend dem Bundespräsidenten Ihre Entlassung vorschlagen.
Zum Abschluss noch einige persönliche Worte an Herrn Söder. Lieber Herr Ministerpräsident, Sie zeigen jeden Tag kraftvoll, dass Sie respektiert und ernst genommen werden wollen. Wer aber nach Höherem strebt, muss auch die Kraft haben, unangenehme Entscheidungen wie die Entlassung von Andreas Scheuer durchzuführen.
Sonst würden Sie ja zeigen, Herr Ministerpräsident, dass Sie der Vorsitzende einer unseriösen Partei sind, die Probleme nicht löst, sondern aussitzt.
Beweisen Sie mir und auch der deutschen Bevölkerung das Gegenteil.
Ich danke Ihnen für die Aufmerksamkeit.
Für die Fraktion Die Linke hat das Wort der Kollege Jörg Cezanne.
