Und wir stehen gegen diese Aufrüstung. Wir wollen nicht, dass diese Gelder, insbesondere in einer Pandemie, in diesen Militärbereich fließen. Wir sagen: Es ist Zeit abzurüsten, statt aufzurüsten, so wie es die Friedensbewegung bei ihrem Aktionstag jetzt formuliert hat.
Es ist richtig, hier die Militärausgaben deutlich zu reduzieren.
Liebe Kolleginnen und Kollegen, es ist schon interessant, wer sich da jetzt alles zusammenfindet.
Jetzt ist es so, dass sich offensichtlich die Grünen ganz offiziell quasi an der ganz großen Koalition der Aufrüstung beteiligen.
Es soll mehr Geld in Rüstung, es soll mehr Geld in die Bundeswehr und in europäische Militärstrukturen gesteckt werden.
Das bedauern wir ausdrücklich. Aber es ist nicht ganz untypisch. Wir sagen: Genau diese Aufrüstung soll es nicht weiter geben.
Und wir bedauern ausdrücklich, wenn die Grünen dagegen nicht mehr weiter opponieren. Wir sagen: Das ist dringend notwendig.
Ein Wort zu der Debatte um die Kampfdrohnen, weil immer so getan wird, es würde hier ausschließlich um eine Bewaffnung und den Schutz der Soldaten gehen. Es geht darum: Es sind Kampfdrohnen, und es sollen damit Gegnerinnen und Gegner ausgeschaltet werden – auch ein Grund, warum wir diese Kampfdrohnen klipp und klar ablehnen.
Und wenn das jetzt nicht entschieden wird, ist das gut. Wir begrüßen das ausdrücklich. Es ist nicht so, dass es Kritik daran geben sollte, dass das Ganze quasi nicht entschieden wird.
Wir lehnen diesen Aufrüstungshaushalt ab.
Ich bedanke mich.
