ich erwähne die politischen Geschehnisse in Thüringen, den Merkel-Putsch;
ich erwähne namentlich die Ereignisse in Sachsen-Anhalt rund um die Zwangsbeiträge des Staatsfunks.
Merkels und der Blockparteien bislang nahezu unumschränkte Macht, meine Damen und Herren, erodiert und bröselt, überall, immer schneller; und das ist auch gut so.
Das merken Sie natürlich. Sie merken, dass Sie bald nur noch Geschichte sein werden, und deshalb fahren Sie die letzten Geschütze gegen die Opposition auf.
Ich sehe Ihnen allen schon an – ich gucke ja in Ihre Gesichter –: Wenn Merkel mal weg ist, dann werden Sie alle sagen: Wir konnten nichts dafür; wir haben doch nur gemacht, was sie verlangte. – Sie sind dann die Ersten, die wegrennen und versuchen, sich zu entschuldigen.
Mit Duckmäusern, mit Wendehälsen und mit vorauseilendem Gehorsam haben wir in Deutschland schon verdammt schlechte Erfahrungen gesammelt. Sie werden es nachmachen.
Sie fahren Ihre letzten Geschütze auf: 1 100 Millionen Euro im Kampf gegen die Opposition, verbrämt im Krampf gegen rechts. Wir wissen schon jetzt, wohin viele Millionen fließen werden: in die Amadeu-Antonio-Stiftung, in die Bundesstiftung Magnus Hirschfeld und andere dubiose, problemlos verzichtbare Einrichtungen. Da pumpen Sie Ihr Geld rein.
Steuergeldverschwendung auch für „rassismussensible Sprache“ in Gesetzestexten, sogar Flüchtlingsintegration wird aus dem Justizhaushalt finanziert.
