Herr Präsident! Meine Damen und Herren! Ich bin etwas eilig hier nach vorne gegangen, weil wir jetzt ein Thema besprechen, das das Wirtschaftsministerium betrifft, und weder der Minister noch irgendjemand anderes aus dem Ministerium, zum Beispiel ein Staatssekretär, zur Verfügung steht.
Ich frage Sie, Herr Präsident: Wie machen wir da weiter? Werden wir als Parlament inzwischen noch nicht mal so wahrgenommen, dass einer der Parlamentarischen Staatssekretäre sich bemüht, um 21 Uhr hier ins Plenum zu kommen?
Ich frage mich: Wie sollen wir damit umgehen? Sollen wir jetzt alle unsere Reden zu Protokoll geben?
Herr Kollege Houben, ich bin ja nicht derjenige, der beim Spiel „Sie fragen, ich antworte“ mitspielen muss.
Es wäre so schön gewesen.
Aber es gibt parlamentarische Möglichkeiten, die Ihr Parlamentarischer Geschäftsführer auch kennt; jedenfalls andere Parlamentarische Geschäftsführer kennen sie.
Herr Staatsminister Hoppenstedt erklärt, man versuche, jemanden zu erreichen; es könne auch nicht so lange dauern. Ich weiß jetzt nicht, ob das die Intervention der Bundesregierung war, uns zu bitten, zu warten, oder so.
