Vielen Dank. – Frau Präsidentin! Liebe Kolleginnen und Kollegen! Meine sehr geehrten Damen und Herren! Gestern hat uns das Bundesverteidigungsministerium zumindest den offenen Teil des halbjährlichen „Berichts zur materiellen Einsatzbereitschaft der Hauptwaffensysteme der Bundeswehr“ übersandt. Was sich hinter dem komplizierten Begriff „materielle Einsatzbereitschaft“ verbirgt, ist schlichtweg die Antwort auf die Frage, wie viele Hubschrauber fliegen, wie viele U-Boote tauchen, wie viele Schiffe fahren und wie viele Panzer am Ende des Tages funktionieren.
Sie, Frau Ministerin, haben ja zu Beginn dieses Jahres auf der Bundeswehrtagung in Ihrer Grundsatzrede die Steigerung der materiellen Einsatzbereitschaft zu einem der Kernanliegen Ihrer Amtsführung gemacht. Heute Morgen war in einem Interview mit dem Generalinspekteur der Bundeswehr zu lesen, die durchschnittliche materielle Einsatzbereitschaft liege bei 74 Prozent, und diese Steigerung bedeute eine Verbesserung der Situation in der Bundeswehr.
Lassen Sie mich, Frau Präsidentin, einen Tweet des Generalinspekteurs vom 24. September dieses Jahres zitieren, in dem er einen Teil seiner Ansprache an den Lehrgang „Generalstabs- und Admiralstabsdienst“ unserer Führungsakademie der Bundeswehr zur Verabschiedung wiedergibt. Der Herr Generalinspekteur sagt darin – ich zitiere –:
Schreiben Sie nicht, dass Dinge „beherrschbar“ sind, „auf der Zeitachse lösbar“ oder „alternativlos“. Schreiben Sie auf, was ist – mit Schönfärberei helfen Sie niemandem weiter. Seien Sie wahrhaftig, mit klarer Diktion und Sprache!
Recht hat der Herr Generalinspekteur!
Schauen Sie jetzt in den offenen Teil des Berichts! Ich will Ihnen nur drei Sätze vorhalten, und Sie können sich alle fragen, ob diese Maßstäbe erfüllt sind.
Erstes Zitat:
Ziel bleibt es, konsequent den eingeschlagenen Weg auch in 2021 weiter zu gehen und die Fülle der Maßnahmen für jeden Angehörigen der Bundeswehr greifbar zu machen.
Oder – Zitat –:
Mit einer weiteren Wirkungsentfaltung des Vertrages wird im Laufe des Jahres 2021 gerechnet.
