Herr Präsident! Liebe Kolleginnen und Kollegen! Ist Dieter Nuhr ein Rassist? Ich überlasse es Ihnen, zu überlegen und zu entscheiden. Aber dieser aktuelle Fall sagt sehr viel darüber aus, wie wir in diesem Land mit Rassismus umgehen.
Ähnlich viel sagt darüber das Sprechen und Schreiben der AfD zu den Begriffen „Rassismus“, „Rasse“ und „Kultur“ aus. Aber noch viel mehr offenbart darüber das tagtägliche Erleben von Opfern von Rassismus, von schwarzen Menschen, von Musliminnen und Muslimen, von Roma, die tagtäglich buchstäblich Rassismus erfahren und das eben nicht abschütteln können.
Die AfD plädiert, um ihren Antrag zusammenzufassen, gegen das Konzept „Rassismus ohne Rassen“, das auf einen Begriff von Stuart Hall und Balibar Bezug nimmt, und auch gegen den „Kulturrassismus“. Letztlich plädieren Sie für einen Rassismus mit Rassen. Sie plädieren letztlich für Rassenlehre, und das muss klar so benannt werden. Dafür braucht es nicht siebenseitige Elogen. Sie hätten das in einem Satz machen können; Sie haben es eben vorgeführt.
Herr Kollege Lindh, erlauben Sie eine Zwischenfrage von Herrn Jongen aus der AfD-Fraktion?
Ich erlaube gerne eine Zwischenfrage von Herrn Jongen, weil die Beantwortung immer ein sehr lehrreiches Erlebnis für ihn ist.
Vielen Dank, Herr Lindh, dass Sie die Zwischenfrage zulassen. – Ich glaube, es wird vor allen Dingen ein lehrreiches Erlebnis für die Zuschauer unserer Debatte sein.
Sie haben gerade behauptet, wir würden hier für einen „Rassismus mit Rassen“ plädieren. Sie haben uns quasi unterstellt, Rassisten zu sein. Aus meiner Rede werden Sie das nicht ableiten können;
aber das steht Ihnen natürlich sozusagen frei. Solche Unterstellungen sind wir ja gewohnt.
Ich möchte jetzt aber auf Ihren Rassismusbegriff zu sprechen kommen und Sie fragen: Ist Ihnen bekannt, dass es in den USA – ich zitiere hier aus einer englischen Wikipedia-Seite, die darüber berichtet – „five racial categories“ gibt, nämlich „White American, Black or African American, Native American, Alaska Native, Asian American, Native Hawaiian, and Other Pacific Islander“? Das ist also offizielle US-Politik. Was man daraus ableiten kann: Die USA sehen hier sozusagen naturgegebene Unterschiede zwischen den Menschengruppen. Sie nennen sie „Rassen“, wir können sie anders nennen.
Darum geht es nicht; es geht nicht um die Benennung. Es geht darum, die naturgegebenen Unterschiede zwischen den Menschen anzuerkennen und dann den Anspruch zurückzuweisen, dass eine Gruppe sich über die andere erhebt und sozusagen einen Unterdrückungsanspruch aus diesen Unterschieden ableitet. Das wäre ein vernünftiger Begriff von Rassismus.
Stimmen Sie dem zu, oder teilen Sie sozusagen die konstruktivistische, tendenziell linksradikale Meinung,
dass es so was wie naturgegebene Unterschiede gar nicht gibt, dass das alles nur unsere gesellschaftliche Konstruktion sei?
Ich bin erst mal aus dem Grund dankbar für die Frage, dass ich jetzt das Thema noch breiter aufgreifen kann,
obwohl Sie gerade selbst den Beweis geführt haben, dass Sie rassistischem Denken anhängen, wie Sie es gerade deutlich gemacht haben. Gleichwohl nutze ich die Gelegenheit zu einer Einführung, ohne Hoffnung auf Verständnis und Empathie bei Ihnen.
Jawohl, jeder mit einigermaßen Verstand sollte heutzutage, im Jahre 2020, begriffen haben, dass Rassen ein soziales Konstrukt darstellen. Man nennt das den „Prozess der Rassifizierung“. Nicht Rassen konstituieren Rassismus, sondern Rassismus konstituiert Rassen, was Sie ja in Ihrem Antrag und Ihren Ausführungen gerade bestmöglich demonstriert haben,
was Sie mit Ihren Ausführungen, mit Ihrer Stimmungsmache, mit Ihrem siebenseitigen Sichabarbeiten am IKG, an dem Begriff „gruppenbezogene Menschenfeindlichkeit“, am Begriff „Rassismus ohne Rassen“ beweisen. Sie haben es ja noch weiter bewiesen: Sie haben eben fünf Kategorien aufgeführt, mit denen Sie genau zeigen wollten, dass es angeblich doch biologisch motivierte Rassen gebe.
Noch etwas. Ich höre Ihnen immer gut zu. Das ist Ihr Problem; denn Sie hören mir nicht genau zu, aber Sie sollten das. Sie zitierten am Anfang sinngemäß Sarrazin, „Deutschland schafft sich ab“, und haben das bewusst gesetzt.
Auch das ist letztlich ein biologistisch-rassistisches Modell, in dessen Tradition Sie sich stellen.
Sie haben im Übrigen – erlauben Sie mir diese Zwischenbemerkung – so lange Ausführungen gemacht, dass es für Ihre Fans schwierig sein wird, das zu schneiden. Aber das ist nur eine Randbemerkung, und das war wahrscheinlich auch in der Sprachform etwas abgehoben.
Nichtsdestotrotz haben Sie selbst eben in Ihren Ausführungen, in Ihrer Rede noch einen weiteren Beleg geliefert, indem Sie – das machen Sie übrigens regelmäßig – darauf hinwiesen, dass der französisch-jüdische Philosoph Finkielkraut das und das sage. Wozu erwähnen Sie da „jüdisch“? Sie weisen in Ihren ganzen Ausführungen auch extra darauf hin, dass Jüdinnen und Juden durch Migrantinnen und Migranten besonders gefährdet würden.
Das ist ein zutiefst rassistischer Ansatz, weil Sie auf diese billige Weise den Antisemitismus zu instrumentalisieren versuchen
und Jüdinnen und Juden gegen Menschen, die aus anderen Gründen rassistisch verfolgt werden, in Stellung zu bringen versuchen.
Herr Kollege.
