Aber ihr solltet auch beachten: Jeder Kollege, der in rabiater und brachialer Weise gegen friedliche Demonstranten vorgeht, um sie einzuschüchtern, zerstört das Bild, das ihr, diejenigen, die verhältnismäßig agieren, zeigt.
Auch ich wurde am Mittwoch Opfer von völlig unverhältnismäßigem Handeln.
Wegen einer vermeintlichen Ordnungswidrigkeit ging ich mit zwei Beamten in Richtung ihrer Fahrzeuge zur Personalienfeststellung.
Natürlich hatte ich mich von Anfang an als Bundestagsabgeordneter ausgewiesen. Als ich dann den Kollegen offensichtlich nicht schnell genug war, wurde ich erst geschubst, gegen eine Scheibe gedrückt und fand mich plötzlich auf dem Pflaster wieder, mit dem Gesicht im Asphalt, kniende Polizisten auf mir. Mehrmals hatte ich den Beamten zugerufen, dass ich kooperiere, dass ich meine Personalien angebe. Ich habe sogar die ganze Zeit meinen Personalausweis hochgehalten.
Sie hätten ihn einfach nur nehmen müssen. Das interessierte sie nicht mehr.
Ich weiß, dass die meisten von Ihnen das auch nicht interessiert. Anders wäre es, wenn zum Beispiel Herr Bartsch oder Herr Hofreiter betroffen wären oder wenn irgendjemand von Ihnen bei irgendeiner Gelegenheit in dieser Situation gewesen wäre.
Dann wäre das Geschrei groß.
Herr Kollege Hilse, Ihre Redezeit ist abgelaufen.
Okay. – Sie hätten dann – –
