Viele Verkehrsträger sind gebeutelt durch die Coronakrise, und ich möchte daran erinnern, dass wir hier vor drei Wochen über den Luftverkehr debattiert haben. Da haben mir die Kolleginnen und Kollegen der Koalition versichert, der Antrag der FDP sei absolut überflüssig, weil die wichtigen strukturellen Hilfen für die Flughäfen, Kollege Simon, Kollege Klare, sozusagen minütlich um die Ecke kämen. Jetzt sind wir drei Wochen weiter und warten leider immer noch darauf, und ich befürchte, dass wir auch im neuen Jahr noch darauf warten werden. Sehr geehrter Herr Minister, hier ist aus unserer Sicht ganz dringender Handlungsbedarf.
Der Kollege Meyer hat die Verschuldung der Bahn angesprochen. In der Coronakrise kommt aber noch was Weiteres hinzu, und da werden die Defizite in den Strukturen der Bahn ganz deutlich: Sie ist zu groß, zu schwerfällig, hat zu viele Hierarchieebenen und ist zu verschachtelt durch ihre Auslandsgesellschaften. Wir müssen also – und das ist vielleicht ein Nutzen, den wir aus dieser Krise ziehen – die Strukturen und die Strategie der Deutschen Bahn noch mal überdenken und ändern.
Natürlich werden weiter Milliarden in die Bahn gepumpt, und das führt natürlich auch zu einer Wettbewerbsverzerrung.
Ich will ganz zum Schluss noch mal auf einen anderen wichtigen Verkehrsträger hinweisen, der in dieser Debatte noch gar keine Rolle gespielt hat.
Es ist übrigens ein sehr ökologischer Verkehrsträger, nämlich das Binnenschiff.
Hier wurden die Mittel gekürzt, und dabei ist es wirklich notwendig, gerade ins Kanalnetz in Westdeutschland – am Rhein, an der Elbe – weiter zu investieren, damit dieser Verkehrsträger, der wirklich von hohem Nutzen ist, weiter gefördert wird.
Zusammenfassend. Die FDP steht dafür, dass Geld dort ausgegeben wird, wo es tatsächlich gebraucht wird, und nicht für aufgeblähte Verwaltungen und sinnlose Strategien. Wir wollen, dass das Geld in diesem Land dort eingesetzt wird, wo es für die Verkehrsinfrastruktur tatsächlich benötigt wird.
Ich danke ganz herzlich für Ihre Aufmerksamkeit, wünsche ein gesegnetes Weihnachtsfest. Und bleiben Sie gesund!
Ich hoffe ja, wir alle sehen uns nächste Woche noch einmal.
Es hat das Wort Jörg Cezanne von der Fraktion Die Linke.
