Lieber Herr Röspel, Sie haben eben einen Antrag der FDP angesprochen. Ist Ihnen bewusst, dass im Haushalt im Sondervermögen Ganztagsbetreuung 750 Millionen Euro liegen, denen auch wir zugestimmt haben? Ist Ihnen bewusst, dass in diesem Jahr kein Euro abgeflossen ist? Ist Ihnen bewusst, dass erst jetzt die Gesetzgebung stattfindet, dass im nächsten Jahr, bis die Vereinbarungen geschlossen sind, kaum ein Euro abfließen wird? Halten Sie es nicht auch für sinnvoll, in einer Krise jetzt erst mal mit Blick auf Haushaltswahrheit und mit Blick auf Sparsamkeit das zu nutzen, was an Rücklagen da ist, und wenn der Bedarf wieder da ist, dann wieder Geld zu beantragen, statt es in Sondervermögen zu parken? 750 Millionen Euro liegen dort – von der FDP unterstützt, Herr Röspel!
Wenn Sie das so im Streichungsantrag begründet hätten, dann könnten wir ja noch darüber sprechen.
Aber lesen Sie die Begründung dieses Streichungsantrags zu den 500 Millionen Euro. Dort steht ausdrücklich, dass Sie nicht die Notwendigkeit sehen, dass sich der Bund in diesem Bereich beteiligt, und dass das Ländersache ist.
Diese Argumentation heißt: Sie wollen die 500 Millionen Euro, egal ob sie abfließen oder nicht, zur Verfügung stellen. Das heißt, offenbar ist Ihnen nicht bewusst, was Sie als Begründung geschrieben haben. Sie hätten Ihren Antrag anders begründen müssen.
Aber da steht klar drin: Diese 500 Millionen Euro sind nicht in der Zuständigkeit des Bundes, das müssen die Länder machen, und zu häufig gibt es eine Vermischung zwischen den föderalen Zuständigkeiten. – Deswegen kann ich das nur so verstehen – und jeder andere sicherlich auch –, dass Sie diese 500 Millionen Euro nicht zur Verfügung stellen wollen.
Gut. Dann kriege ich heute Mittag einen Antrag von der FDP auf den Tisch gelegt, wo es um den Gentechnikfonds geht. Da steht drin, man solle sich konsequent auf die Systeme der Marktwirtschaft, des Unternehmertums und der Forschungsfreiheit konzentrieren. Das finde ich dann allerdings schon spannend.
Wenn man sich die weiteren Anträge der FDP im Ausschuss – jedenfalls im Bildungs- und Forschungsausschuss – im Hinblick auf Forschungsfreiheit anguckt, dann stellt man fest, dass Kürzungsvorschläge ausgerechnet in den Bereichen gemacht werden, wo es Forschungsfreiheit gibt, nämlich DFG, Fraunhofer und andere Bereiche. Das sind all die Bereiche, wo es nicht darum geht, eine bestimmte Forschungsrichtung zu stützen, sondern wo es allein um exzellente Forschungsanträge aus allen Themenbereichen geht, also darum, Forschungsfreiheit par excellence umzusetzen. Da schlagen Sie Kürzungen vor.
Zum Stichwort – das fand ich spannend bei Ihrem Antrag – „Gentechnikfonds“ sagen Sie, wir müssen konsequent Marktwirtschaft und Unternehmertum stützen. Die Forderung dieses Antrags heißt: Unternehmertum ist wichtig; aber Staat, gib mal bitte 150 Millionen Euro Staatsknete für diesen Fonds. – Das, finde ich, hat alles nichts mit Marktwirtschaft und Unternehmertum zu tun. Da sind Sie als FDP eben nicht auf der richtigen Spur.
Noch schlimmer betreibt es die AfD. Ich habe in dieser Debatte niemanden gehört, der in irgendeiner Form die Wissenschaftsfreiheit oder Forschungsfreiheit einschränken oder bestimmte Themen verbieten will – mit Ausnahme der Partei der AfD. Sobald Sie Gender- oder Klimaforschung hören, geht bei Ihnen offenbar die Hasslampe an,
und Sie sagen: Das muss sofort verboten werden. – Das ist alles andere als Forschungsfreiheit. Sie sind es, die genau diese Themen immer wieder behandeln unter dem Stichwort „Das wollen wir nicht“, „Das darf nicht sein“ und „Das ist ideologisch“. Das ist tatsächlich ein Angriff auf die Forschungsfreiheit.
Ich bin sehr froh, dass diese Forschung auch dazu beiträgt, dass Jungen und Mädchen selbstbewusster sind. Ich bin sehr froh, dass meine Tochter Randi eine starke, selbstbewusste Frau wird. Und ich bin sehr froh, dass ihre Brüder Tobias und Daniel auch noch gut finden, dass sie eine starke, selbstbewusste Frau wird.
Noch schlimmer ist: Wenn es nach der AfD gegangen wäre, hätten wir im zweiten Jahr 500 Millionen Euro weniger für BAföG zur Verfügung. Das würde bedeuten, dass gerade in dieser Situation rund 200 000 Schüler und Studierende aus Arbeiterfamilien es noch schwieriger hätten, sich ein Studium oder den Besuch eines Gymnasiums zu leisten. Das, meine Damen und Herren von der AfD, ist genau das, was wir nicht wollen. Wir als SPD setzen eine andere Politik dagegen. Wir haben nämlich 200 Millionen Euro zusätzlich für eine Nothilfe für Studierende zur Verfügung gestellt.
– Sie können mir keine Lüge vorwerfen. Das haben Sie beantragt!
– Ach, hören Sie auf. Eine Lüge ist übrigens ein schwerer Vorwurf.
Kollege Röspel.
