Vielen Dank. – Frau Präsidentin! Liebe Kolleginnen und Kollegen! Frau von Storch, Ihr letzter Satz war eine üble Drohung; so hat es sich zumindest angehört. Trotzdem wollen wir beim Thema bleiben.
Wir stimmen hier heute über einen gemeinsamen Antrag zum Einfluss türkischstämmiger Rechtsextremisten in Deutschland ab, besser bekannt – wir haben es eben schon gehört – als die Grauen Wölfe. Ich freue mich auch darüber, liebe Kolleginnen und Kollegen von den Grünen und von der FDP, dass Sie unseren Antrag mit unterstützen. Ich sage an die Adresse der Kolleginnen und Kollegen von den Linken: Wäre es nach uns gegangen, würden Sie auch mit auf diesem Antrag stehen.
Denn uns Demokraten eint alle der Kampf gegen Rechtsextremismus,
egal aus welcher Ecke unserer Welt er kommt.
Deshalb wollen wir, dass der Bundesinnenminister prüft, ob die Ülkücü-Bewegung derart gegen das Prinzip der Völkerverständigung verstößt, derart unser friedliches Zusammenleben stört, derart antidemokratisch ist, dass ihr Einhalt geboten werden sollte. Darum geht es in diesem Antrag, um nicht mehr und nicht weniger.
Allen Rechtsextremisten, egal woher sie kommen, ist eine völkische, nationalistische und rassistische Ideologie gemeinsam. Darin unterscheiden sich die türkischstämmigen Rechtsextremisten nicht von den deutschstämmigen Rechtsextremisten. Sie haben mit deutschen Rechtsextremisten außerdem gemeinsam, dass sie gern den Scheinwerfer von sich wegdrehen und Sündenböcke finden und bekämpfen. Das dürfte rechts außen, auch hier, bekannt sein.
Eine weitere Gemeinsamkeit ist die rege Agitation in sozialen Netzwerken. Auch türkische Rechtsextremisten sind im Netz aktiv und üben eine gewisse Anziehungskraft speziell auf junge türkischstämmige Menschen aus. Sie haben ein klares Freund-Feind-Schema und bieten vermeintlich einfache Antworten in einer zunehmend komplizierten Welt. Auch das kommt vielen von uns bekannt vor, liebe Kolleginnen und Kollegen. Das machen deutsche Rechtsextremisten nämlich genauso: Sie mobilisieren, organisieren und verbreiten Fake News bzw. verfassungsfeindliche Inhalte. – Ich bin sehr erleichtert, dass auch Twitter inzwischen seiner Verantwortung gerecht wird und Fake News als solche markiert. Wir werden mit unserem Gesetz zur Bekämpfung von Hass und Hetze im Netz – das sei an dieser Stelle gesagt – strafrechtlich gegen diese Hetzer vorgehen.
Herr Kollege, erlauben Sie eine Zwischenfrage oder ‑bemerkung von Kollege Dehm?
