Liebe Kolleginnen und Kollegen, was sind die Projekte, die jetzt für die Koalition anstehen?
Ich bin Frau Völlers dankbar, dass sie es schon gesagt hat. Wir haben im Koalitionsausschuss am 25. August beschlossen, dass wir Bildungskompetenzzentren für die digitale Bildung aufbauen. Eine bundesweite Bildungsplattform wurde angesprochen. 90 Millionen Euro stellt der Haushaltsgesetzgeber hier dem BMBF zur Verfügung. Ich denke, das ist eine tolle Ansage.
Im Vergleich zur SPD und auch im Vergleich zum BMBF hat die Union hier schon ganz konkrete Vorschläge erarbeitet. Diese Vorschläge haben wir am Dienstag beschlossen und am Mittwoch in den Medien entsprechend vorgestellt. Ich kann Ihnen das Papier „Digitale Bildungsoffensive Schulen“ der CDU/CSU-Bundestagsfraktion sehr empfehlen. Darin ist ein ganz genaues Konzept enthalten, wie diese Plattformen, wie die Bundesbildungskompetenzzentren aussehen sollen. Ich glaube, hieran kann sich das BMBF ein Beispiel nehmen, aber selbstverständlich auch der Koalitionspartner.
– Wir schicken das auch dem Herrn Holter, genau. Das ist ein sehr, sehr guter Vorschlag.
Lassen Sie uns gemeinsam mal in dieses Papier reinschauen. Es geht ja nicht nur um die Bildungskompetenzzentren und die entsprechende Bildungsplattform. Vielmehr werden noch mal ganz konkrete Vorschläge aufgezeigt, wie wir die Mittel bei dem DigitalPakt schneller abfließen lassen können. Und dann möchte ich noch mal betonen: Es liegt nicht am Bund, sondern es liegt an den Ländern. Wir machen ganz konkrete Vorschläge, was die Länder unternehmen können.
Ich möchte gerne noch auf ein Thema aus dem Digitalbereich eingehen, nämlich den Datenschutz. Da höre ich immer: Das kann man nicht machen. – Daher haben wir keine digitale Bildung in den Schulen. Wir sprechen uns hier für eine einheitliche Unbedenklichkeitsprüfung bei der datenschutzrechtlichen Beurteilung aus. Das können die Kultusminister in ihrem Bundesland mit ihren jeweiligen Datenschutzbeauftragten klären. Das auf die Schulen runterzubrechen und dort abzuladen, ist ein großer Fehler.
Meine Redezeit geht zu Ende. Schauen Sie einfach mal in das Positionspapier rein; das sind elf ganz konkrete Vorschläge. Sie können das auf unserer Homepage einsehen und runterladen.
Ich danke herzlich für Ihre Aufmerksamkeit.
Zu einer Kurzintervention hat die Kollegin Birke Bull-Bischoff das Wort.
