Jetzt den Klimawandel zum Anlass zu nehmen, den Markt zu diskreditieren, halte ich für falsch. Der Markt ist die Lösung, und Technologie und Innovation sind die Lösung im Kampf gegen den Klimawandel und nicht das Hindernis, liebe Kolleginnen und Kollegen.
Wenn wir das alles zusammen machen, dann haben wir im Übrigen auch die Grundlage dafür gelegt, dass wir einen vernünftigen Sozialstaat finanzieren können. Denn das wird auch hin und wieder einfach mal vergessen: Das Geld, das ausgegeben wird, muss auch finanziert werden können. Aber um es den Leuten zu sagen, die uns als Große Koalition sagen: „Ihr habt zu viel für den Sozialstaat gemacht“:
Das Wichtigste ist der Zusammenhalt der Gesellschaft, und dieser Zusammenhalt der Gesellschaft wird durch diesen Sozialstaat auch entsprechend gesichert. Vor diesem Hintergrund brauchen wir da an der Stelle nichts zurücknehmen.
Um noch mal zum Anfang meiner Rede zu kommen: Zusammenhalt der Gesellschaft, das ist eigentlich das Stichwort, an dem sich die Coronamaßnahmen messen müssen. Zusammenhalt der Gesellschaft bedeutet eben nicht nur, den Starken und Jungen alles zu ermöglichen, jegliche Freiheiten zu geben, sondern Zusammenhalt der Gesellschaft bemisst sich daran, inwieweit wir in der Lage sind, die Alten, Verletzlichen und Schwachen zu schützen.
Danke schön.
Das Wort geht an Herrn Klaus Ernst von der Linksfraktion zu einer Kurzintervention.
