Sehr geehrter Herr Präsident! Liebe Kolleginnen und Kollegen! Meine sehr verehrten Damen und Herren! Die deutsche Automobilindustrie steht für 4 Prozent unseres Bruttoinlandsproduktes, sie steht – wenn man alle Wertschöpfungsbereiche zusammennimmt – für über 1 Million Arbeitsplätze. An ihr hängen Existenzen, Menschen mit gut bezahlten Jobs. Wir sind in Sorge um diese Jobs. Wir erfahren ja auch bei den Beratungen im Wirtschaftsausschuss, dass die IG Metall befürchtet – auch durch den erzwungenen Ausstieg aus dem Verbrennungsmotor –, dass 450 000 Arbeitsplätze, die am Verbrennungsmotor hängen, gefährdet sind.
Meine sehr verehrten Damen und Herren, wenn allein durch die Elektromobilität – laut Aussagen des Fraunhofer-Instituts – netto mindestens 100 000 Arbeitsplätze wegfallen, dann kann die Politik dies nicht einfach akzeptieren, dann müssen wir an dieser Stelle diskutieren, wie wir die Automobilindustrie und vor allen Dingen die Beschäftigten am Standort Deutschland sichern können.
Mit „Industrie“ meinen wir nicht nur die Autokonzerne, sondern vor allen Dingen die mittelständischen Zuliefererbetriebe, die Tier-1-, Tier-2- und Tier-3-Zulieferer, und natürlich auch den Maschinenbau, der zu 40 Prozent am Automobil hängt.
Drei Krisen prägen zurzeit die Automobilindustrie. Klar, da ist Corona und die Schließung von Autohäusern und Werkstätten. Da ist die Unsicherheit, Stichwort „Kurzarbeit“, die viele Menschen dazu bringt, eben kein neues Auto kaufen zu wollen.
Aber es gibt weitere Krisen: die Handelskriege zwischen den USA und China und zwischen den USA und Europa. Wer die deutsche Automobilindustrie analysiert, stellt fest: Wir haben die Arbeitsplätze erhalten, weil wir Premiumfahrzeuge in Deutschland herstellen und exportieren. Wer Arbeitsplätze in der Automobilindustrie erhalten will, der muss sich für Freihandel einsetzen,
für multilaterale Freihandelsabkommen, aber auch für bilaterale Freihandelsabkommen. Deshalb, sehr geehrter Herr Minister Altmaier, meine Damen und Herren, müssen wir jetzt die Freihandelsabkommen CETA und Mercosur ratifizieren.
Wir brauchen eine Freihandelsoffensive, meine Damen und Herren.
