– Frau Staatssekretärin, ich begrüße Sie hier. Frau Winkelmeier-Becker, immerhin sind Sie gekommen. Besser spät als nie!
Dass Gründungen wichtig sind, haben wir auch aktuell zur Kenntnis nehmen können. Wir denken an die Covid-19-Impfstoffe. Interessanterweise wurde das betreffende Unternehmen von einem Ehepaar mit türkischen Wurzeln gegründet. Gerade Ausländer oder Menschen mit einem Migrationshintergrund sind besonders erfolgreich bei der Gründung von Unternehmen, und wir sollten sie besonders unterstützen.
Wir haben in unserem Land ein enormes Potenzial. Wir leben davon, was die Menschen in Deutschland zwischen den Ohren haben, und nicht davon, was wir vielleicht unter unseren Füßen gerne hätten, nämlich Gold oder Öl. Wir brauchen also Anstrengungen, wir brauchen Engagement. An dieser Stelle möchte ich sagen: Wir sollten die Menschen mehr ermutigen.
Gerade die Jugend muss ermutigt werden, den Weg zu gehen in Eigenverantwortung, in unternehmerische Tätigkeiten. Dazu trägt unser Antrag bei. Wir freuen uns auf die Debatte darüber. Und wir würden uns freuen, wenn Sie am Ende Ideen, die wir hier vorgetragen haben, dann auch aufnehmen würden.
Vielen Dank.
Vielen Dank, Herr Kollege Houben.
Herr Kollege Thomae, da nun das Ministerium vertreten ist, vermute ich mal – auch wenn die Restaurants geschlossen sind und wir sonst nicht wissen, was wir tun sollen –, dass sich Ihr Antrag, den Minister herbeizuzitieren, damit erledigt hat.
