Nur haben wir andere Vorstellungen, wie wir zu einem 12-Euro-Mindestlohn kommen. Wir sagen: Die Festlegung des Mindestlohns ist Sache der Mindestlohnkommission und nicht des Bundestages.
Die Aufgabe der Kommission muss es daher sein, die Höhe so festzulegen, dass man nach einem Arbeitsleben zum Mindestlohn nicht in die Grundsicherung fällt. Man muss nicht nur vom Lohn leben können, man muss danach auch von der Rente leben können.
Liebe Linke, als Letztes fordern Sie die Erhöhung der Tarifbindung und die Erleichterung der Allgemeinverbindlichkeitserklärung. Wir sehen bei der Pflege gerade, wie schwer es ist, eine Allgemeinverbindlichkeitserklärung hinzubekommen. Es hätte mich schon gefreut, wenn Sie im Antrag geschrieben hätten, wie Sie das konkret erreichen wollen.
Aber ich fürchte, da bin ich wieder mal zu anspruchsvoll.
Vielen Dank.
Vielen Dank, Dr. Matthias Bartke. – Nächster Redner: für die FDP-Fraktion Johannes Vogel.
