Sehr geehrte Frau Präsidentin! Meine Damen und Herren Kollegen! Liebe Kollegen von den Linken, ich kann mir vorstellen: Sozialist zu sein in diesen Zeiten, ist wirklich schwierig, wenn einem die CDU und die SPD diese ganze Arbeit abnehmen.
Dieser Showantrag offenbart ja Ihre ganze Verzweiflung. Dabei müssten Sie angesichts des dritten Ermächtigungsgesetzes von heute Morgen
doch eigentlich jubeln: Wieder ein Stück Demokratie abgeschafft!
Fünf Tage Lockdown haben an Ihrer Infektionsfront, liebe Bundesregierung, nicht auch nur den Hauch eines Effekts gehabt. Die täglichen Wasserstandsmeldungen zu den sogenannten Infizierten sollen Angst und Schrecken verbreiten, um den Menschen erfolgreich eine pandemische Lage vorzugaukeln.
Schauen wir uns doch mal die Zahlen des Grauens, heruntergerechnet auf eine Stadt mit 100 000 Einwohnern, zum Beispiel meine Landeshauptstadt Schwerin, an: Da sind, statistisch gesehen, seit März – seit März! – 750 Menschen auf Corona positiv getestet worden. Bei der gegenwärtig äußerst kritischen Lage kommen momentan täglich 19 Menschen hinzu. Ach ja, krank werden die alle gar nicht. Nur 28 von diesen 100 000 Menschen brauchten seit März eine intensivmedizinische Behandlung.
Gerade einmal 13 sind gestorben, von 100 000,
