Was soll nun das StaRUG bewirken? Es soll einen Rahmen liefern für den Versuch, die Insolvenz eines Unternehmens erst gar nicht eintreten zu lassen, indem es bereits in deren Vorfeld eine Restrukturierung der Verbindlichkeiten des Unternehmens ermöglicht. Die Zielrichtung ist also sicherlich eine sinnvolle. Dabei ist Restrukturierung in aller Regel eine Umschreibung dafür, dass die Gläubiger auf einen Teil ihrer Forderungen verzichten. Wo dem alle Betroffenen nach Abwägung ihrer Interessen zustimmen, ist das kein Problem. Das ist aber nicht immer der Fall, und deshalb soll auch die nur mehrheitliche Annahme eines entsprechenden Plans durch die Gläubiger möglich sein.
Es wird also in die Rechte eines einzelnen Gläubigers, im Zweifel auch gegen dessen Willen, eingegriffen. Das mag in bestimmten Fällen zu rechtfertigen sein. Es erfordert aber zumindest, dass der einzelne Betroffene seine Rechte in diesem Verfahren auch sinnvoll wahrnehmen kann.
Schaut man sich beispielsweise die Annahmefrist in § 21 des StaRUG-Entwurfes an, die im Mindestmaß nur 14 Tage betragen soll, kann man daran durchaus Zweifel haben. In diesem wie in weiteren Punkten wird die Anhörung hoffentlich noch weitere Erkenntnisse bringen.
Zur Insolvenzordnung. Der vorliegende Gesetzentwurf soll zwar nicht, wie nach Äußerungen aus der CDU/CSU-Fraktion zu besorgen war, den Insolvenzgrund der Überschuldung ganz abschaffen, aber doch ihn ein weiteres Mal aufweichen. Das lehnen wir ab. Die Vermeidung einer Unternehmensinsolvenz ist – wo möglich – sicher wünschenswert. Nicht sinnvoll ist es dagegen, diese nur möglichst lange hinauszuschieben. Durch eine weitere Schwächung des Insolvenzgrundes der Überschuldung wird sich die Zahl der Zombieunternehmen – die am Ende, wenn die Insolvenz dann schließlich doch eintritt, nur umso größere Schäden anrichten – nur noch erhöhen. Hier sollten wir also nicht die bisherige Fehlentwicklung fortsetzen, sondern stattdessen gegensteuern.
Vielen Dank und bis nächste Woche.
Danke schön. – Letzter Redner in der Debatte: Alexander Hoffmann für die CDU/CSU-Fraktion.
