– Sie brauchen jetzt nicht zu lachen. Wenn Sie das wochenlang, monatelang torpedieren und danach mit Krokodilstränen dastehen, weil das nicht funktioniert, dann ist das einfach nur unehrlich.
Gut. – Herr Sorge, weiter mit der Rede.
Vielen Dank, Frau Präsidentin. – Ich sage Ihnen auch ganz offen: Wir sollten da nicht stehen bleiben. Wir müssen bei solchen Datennutzungsmöglichkeiten doch den Nutzer entscheiden lassen. Wir müssen ihm, gerade wenn es um freiwillige Möglichkeiten geht, überhaupt die Option eröffnen, solche Daten zur Verfügung zu stellen. Und da geht es ja nicht nur um den Bereich der Corona-Warn-App. Wir reden im Gesundheitsbereich mittlerweile über KI, über Künstliche-Intelligenz-Anwendungen, über Assistenzsysteme, die ja nur mit Daten funktionieren. Insofern geht es in der Debatte viel, viel stärker als bisher darum, nicht abstrakt Risiken aufzuzeigen, sondern ganz konkret klarzumachen: Wo sind die individuellen Mehrwerte für den einzelnen Patienten, für jeden einzelnen Nutzer? Welche Vorteile hat das?
Noch mal: Daten retten Leben. Ich glaube, in einer Krise wie Corona ist es ganz besonders wichtig, dass wir Daten nutzen, um Leben retten zu können. Diese Option wollen wir mit den Dingen, die wir auf den Weg gebracht haben, ermöglichen. In diesem Sinne freue ich mich auf die Beratungen im Ausschuss, freue mich auch, dass Sie lernfähig sind, und freue mich auf gute Ergebnisse.
Vielen Dank.
Vielen Dank, Tino Sorge. – Die letzte Rednerin in dieser Debatte und an diesem Abend ist Elvan Korkmaz-Emre für die Fraktion der Sozialdemokraten.
