Sehr geehrter Herr Präsident! Liebe Kolleginnen und Kollegen! Sie haben soeben erlebt, wie ein politisch Ertrinkender verzweifelt nach Halt sucht.
Sie saufen politisch ab, weil Sie keine Themen haben, keine Ideen und keine Antworten auf die Herausforderungen der Zeit. Deswegen müssen Sie sich mit der Geschäftsordnung beschäftigen.
Gestalten können Sie nicht. Sie können nur dagegen sein, und das ist größtenteils mit Verleumdungen und Unwahrheiten verbunden.
Sie wissen das, und deswegen sind Sie gerade so betroffen.
Im Übrigen wird Ihre Rechnung nicht aufgehen. Die Menschen im Lande sind nicht so dumm, Ihnen auf den Leim zu gehen.
Beschäftigen Sie sich damit! Versuchen Sie mal, programmatisch zu arbeiten! Ich weiß, das ist ungewohnt für Sie; aber es lohnt sich.
Wir schließen heute ein vollkommen geordnetes Gesetzgebungsverfahren ab, an dem das Parlament massiv beteiligt war.
