Wir müssen auch strukturelle Fragen in dieser Pandemie ansprechen; denn eine geringe Tarifbindung ist die größte Lohnbremse. Ich hoffe, da sind wir uns zumindest zwischen vielen Fraktionen einig. Wir müssen die Tarifbindung stärken. Natürlich sind dafür in erster Linie Arbeitgeber und Gewerkschaften gefragt; aber auch der Staat kann einen Unterschied machen, indem er öffentliche Aufträge und Vergabeverfahren an eine Tarifbindung koppelt.
Liebe Kolleginnen und Kollegen, auch die Wirtschaftshilfen tragen dazu bei, die soziale und wirtschaftliche Lage der Menschen zu stabilisieren und Ungleichheit entgegenzuwirken. Wir stützen die Firmen, die besonders unter den aktuell notwendigen Schließungen leiden, und damit stützen wir die Arbeitsplätze für viele Menschen und helfen den Familien.
Ich will noch das Sozialdienstleister-Einsatzgesetz erwähnen; denn damit werden die sozialen Einrichtungen unterstützt. Auch das ist wichtig in der Krise, auch das ist ein Ausbau unseres Sozialstaates. Damit wird die soziale Infrastruktur gesichert, die wir nicht nur in der Krise, sondern auch danach dringend brauchen, um die Menschen zu unterstützen.
Da geht es ganz praktisch um Arbeitsförderungs- und Bildungsmaßnahmen. Da geht es um Sprachkurse, um die Frühförderung und um die Eingliederungshilfe für Menschen mit Behinderung. Da geht es um Rehamaßnahmen. Alles das ist wichtig, damit Menschen gute und gleiche Chancen haben. All das stärken wir, gerade in diesen schwierigen Zeiten.
Wir wollen aber nicht nur die Folgen der Krise abfedern, meine Damen und Herren, sondern wir wollen auch schnell wieder aus der Krise herausfinden. Aus diesem Grund haben sich CDU/CSU und SPD auf ein Konjunkturpaket geeinigt, das es in dieser Dimension noch nie gegeben hat. Wir stärken damit Investitionen und Kaufkraft und sichern so Arbeitsplätze. Wir helfen Familien. Wir investieren in Bildung und Forschung, und wir sichern mit dem Konjunkturprogramm Ausbildungsplätze und stärken Kommunen. Unser Land wird damit sozialer, digitaler und ökologischer. Auch das ist eine Frage der sozialen Gerechtigkeit.
Damit investieren wir in die Zukunft. Das macht natürlich ökonomisch Sinn, aber es ist vor allem auch sozial gerecht.
Und ja, meine Damen und Herren, das kostet sehr viel Geld, viele Milliarden, und der eine oder andere in diesem Haus kritisiert das. Aber es ist gut und richtig investiertes Geld, damit wir uns gemeinsam den wirtschaftlichen und sozialen Folgen der Coronapandemie entgegenstellen können. Dabei wirkt unser Sozialstaat. Wir haben ihn ausgebaut, damit Menschen in Notlagen noch besser, zielgenauer und nachhaltiger unterstützt werden können.
Das zeigt: Diese Bundesregierung handelt in dieser schwierigen Zeit. Wir kämpfen um jeden Arbeitsplatz, um die soziale Sicherheit und um gute Chancen für alle Menschen. Auf den Sozialstaat ist Verlass.
Vielen Dank.
Vielen Dank, Kerstin Griese. – Nächster Redner: für die FDP-Fraktion Pascal Kober.
