Herr Präsident! Meine Damen und Herren! Herr Lindner, die Zahl 50 und auch die Zahl 35 stehen im § 28a Infektionsschutzgesetz, hier im Deutschen Bundestag beschlossen, und sind insofern nicht willkürlich. – Das zu Ihrer Behauptung, der Deutsche Bundestag wäre hier nicht beteiligt, meine Damen und Herren.
Wenn wir uns die Entwicklung der letzten Wochen und Monate angucken, dann muss man sagen: Der Lockdown wirkt. Wir kommen von Inzidenzen, von Neuinfektionszahlen von knapp 200, wir sind jetzt unter 65; das heißt, die Maßnahmen haben gewirkt.
Und wir liegen übrigens auch im europäischen Vergleich mit unseren Neuinfektionen sehr, sehr gut, besser als viele, viele andere Länder, besser als viele Nachbarländer. Wir liegen auch insgesamt noch sehr gut bei der Anzahl der Infizierten auf 100 000 Einwohner und auch, ja, bei der Anzahl der Toten auf 100 000 Einwohner. Was schlecht ist – das gehört zur Wahrheit leider auch dazu –, ist die Anzahl der Toten bei den Hochbetagten. Das ist eine Sache, wo wir uns als Gesellschaft fragen müssen, ob wir dort alles richtig gemacht haben, liebe Kolleginnen und Kollegen.
– Meine Damen und Herren, das war jetzt sehr interessant. Jetzt sagt Herr Lindner: Da muss die CDU sich fragen.
Also, ich finde es schon sehr, sehr interessant, wie Sie mit dieser Krise umgehen, wie Sie versuchen, parteipolitisch Kapital zu schlagen,
wie Sie versuchen, Wahlkampf in der schwersten Krise zu machen, die diese Republik hat.
Es ist erbärmlich, Herr Lindner. Und die Wählerinnen und Wähler zeigen es Ihnen auch bei den Umfragen, dass das nicht verfängt, was Sie hier veranstalten, liebe Kolleginnen und Kollegen.
Wir sind beim Impfen zu langsam, aber mittlerweile ins Rollen gekommen, und wir sind beim Thema Wirtschaftshilfen – das muss man an dieser Stelle auch sagen – viel, viel umfangreicher unterwegs als die meisten anderen Länder. Und ja, Herr Mützenich, dazu gehört auch das Kurzarbeitergeld. Dazu gehört ein vereinfachter Zugang bei Hartz IV. Es ist ein Gesamtpaket, was wir im Bereich Wirtschaft auf den Weg gebracht haben, und es ist gut, dass die Überbrückungshilfe III jetzt auch ausgezahlt wird, liebe Kolleginnen und Kollegen.
Und für all diejenigen, die jetzt sagen: Ja, aber in anderen Ländern ist es besser. – Ja, andere Länder haben andere Umstände. Australien ist eine Insel, und wir können uns gerne mal die Repressionsmaßnahmen in China daraufhin angucken, ob wir die hier haben wollen. Und im Übrigen ist es so, dass andere Länder auch nicht so viele Hochbetagte haben wie wir. Aber eins ist auch richtig: Alle Länder, die besser durch die Pandemie gekommen sind als wir, hatten zuerst einen radikalen Lockdown und haben zuerst die Zahlen nach unten geknüppelt, nach unten geprügelt.
Deswegen ist es auch richtig, was wir hier machen, dass wir sagen: Bevor wir in differenzierte Maßnahmen einsteigen, müssen wir erst die Zahlen nach unten kriegen.
Und das ist genau die Politik, die auch nach den Beschlüssen gestern in der Ministerpräsidentenkonferenz entsprechend weitergeführt wird. Diese Politik ist richtig, liebe Kolleginnen und Kollegen.
Deswegen ist es auch voll zu unterstützen, dass die Lockdown-Maßnahmen weitergeführt werden.
Sorgen bereitet mir allerdings, auch wenn es in unserem Grundgesetz so vorgesehen ist, dass die Länder individuell darüber entscheiden, die Schulen und die Kitas wieder zu öffnen. Ich habe da meine Zweifel, ob das in dieser Phase richtig ist.
Denn betrachten wir mal, von welchen Zahlen wir kommen. Die Bundeskanzlerin hat es gesagt: Wir kommen von Inzidenzen unter 10, unter 5, und da müssen wir auch wieder hin, um entsprechend die Öffnungen hinzukriegen.
Natürlich ist es sehr, sehr hart für die Schülerinnen und Schüler, für die Eltern, für die Familien, und wir erkennen auch an, dass es hart ist. Es ist eine Zumutung. Aber es ist auch eine Zumutung, dass mehr als 60 000 Menschen in diesem Land gestorben sind, liebe Kolleginnen und Kollegen,
und auch das muss man immer wieder im Hinterkopf behalten, wenn man über Freiheitsrechte redet. Und ich bleibe dabei, Herr Lindner, was ich hier vor einigen Wochen gesagt habe: Freiheit ist auch immer die Freiheit der Schwachen und nicht nur die Freiheit der Starken.
Aber wenn wir mal nach vorne schauen, dann reicht es ja jetzt nicht, dass Ministerpräsidenten, dass das Bundeskabinett, dass wir hier uns klar darüber sind, wie es weitergeht, sondern es gibt eine Menge Dinge, die noch zu tun sind. Ich möchte Ihnen fünf Dinge nennen, an die wir jetzt ranmüssen.
Das erste ist das Thema Schulen. Ja, es ist die Länderkompetenz. Aber trotzdem erwarte ich – gerade vor dem Hintergrund, dass jetzt wieder Öffnungen auf den Weg gebracht werden – Teststrategien, Lüftungsstrategien, Logistikstrategien, sodass die Schulbusse nicht mehr so voll sind. Beim Thema Schulen erwarte ich, dass es eine Lernstandserhebung dazu gibt,
was verpasst worden ist, dass es Konzepte dafür gibt, wie dieser Stoff über den Sommer hinweg durch Nachhilfe, durch Sommerakademien aufgeholt werden kann, dass es Konzepte dafür gibt, wie insbesondere die Kinder gefördert werden, die in benachteiligten Familien aufwachsen, wo nicht geholfen werden kann, liebe Kolleginnen und Kollegen. Das gehört nämlich auch dazu. Ich glaube, wir haben im Bereich Schule sehr, sehr viel zu tun.
Der zweite Bereich: Gesundheitsämter. Das Rückgrat unserer Pandemiebekämpfung sind die Gesundheitsämter. Ja, wir haben einen Pakt für das öffentliche Gesundheitswesen. Ja, wir haben mehr Geld bereitgestellt. Aber dieses Geld muss jetzt auch entsprechend umgesetzt werden. Die Softwarefrage muss schnell gelöst werden.
Wir müssen die Prozesse analysieren, und wir brauchen eine Monitoringstelle, wo die Qualität der Gesundheitsämter auch tatsächlich kontrolliert wird; sonst können sie nicht das Rückgrat der Bekämpfung der Pandemie sein. Und ja, dazu gehört auch eine adäquate Bezahlung der Mitarbeiterinnen und Mitarbeiter in den Gesundheitsämtern.
Dritter großer Bereich: Altenheime. Wir haben jetzt viele Erfolge beim Impfen der hochbetagten Menschen erzielt, die in den Altenheimen wohnen. Wir brauchen aber eine weiterführende Strategie. Was ist mit den Menschen, die jetzt neu aufgenommen werden, die noch nicht geimpft sind? Wo gibt es da das Konzept, mit dem flächendeckend sichergestellt wird, dass derjenige, der neu in einem Altenheim aufgenommen wird, auch geimpft wird?
Wie führen wir die Teststrategien weiter? Es reicht ja nicht, jetzt zu sagen: Alle sind geimpft, und alles ist gut.
