Liebe Kolleginnen und Kollegen, ich habe diese Woche so manchen Fake gehört. Aber die größten Böcke hat Frau Baerbock geschossen.
Erste Bemerkung zur Behauptung von der Kollegin Baerbock, hier würden 500 Millionen Euro für Regionalflughäfen ausgegeben: Die Wahrheit ist eine andere. Erstens. 300 Millionen Euro für die Deutsche Flugsicherung sind notwendig; denn wir sind Eigentümer. Zweitens. 170 Millionen Euro für drei Flughäfen sind notwendig, weil wir beteiligt sind: Berlin, München, Köln/Bonn. Richtig ist: 20 Millionen Euro haben wir eingestellt, um möglichst, wenn Brüssel Ja sagt, den kleinen Regionalflughäfen beim Thema Flugsicherung zu helfen; das ist die Wahrheit. So viel zu diesen 500 Millionen Euro.
– Wisst ihr: Entweder schreibt ihr ihr das besser auf, oder sie guckt mal in den Bundeshaushalt rein.
Diese Rede von der Kollegin Baerbock hat von großer Unkenntnis gezeugt.
Und Gnade uns Gott, wenn entweder Frau Baerbock oder Herr Habeck Bundeskanzler werden; der eine weiß nicht, was eine Entfernungspauschale ist, und die andere hat noch nicht einmal in den Bundeshaushalt reingeguckt, liebe Kolleginnen und Kollegen.
Zweite Bemerkung. Kollegin Baerbock behauptet, aktuell wachse das Straßennetz um mehrere Tausend Kilometer, während bei der Schiene sage und schreibe drei neue Kilometer dazugekommen seien. Es gibt da eine ganz andere Wahrheit, liebe Kolleginnen und Kollegen: Unter Rot-Grün im Jahr 2004 wurden 3 Milliarden Euro für Neubau und 1 Milliarde Euro für Erhaltung ausgegeben. Heute werden 3,3 Milliarden Euro für Neubau und 4,5 Milliarden Euro für Erhaltung ausgegeben.
Wenn Sie mal alle Mittel für die Schiene zusammenrechnen, dann sehen Sie, dass für die Schiene fast dreimal so viel ausgegeben wird wie im Bereich der Straße. Deswegen auch hier, Frau Baerbock: Einen Blick in den Bundeshaushalt zu werfen, schützt vor Unkenntnis und vor falschen Aussagen hier im Deutschen Bundestag.
Herr Kollege Spaniel, scheinbar verstehen Sie überhaupt keinen Spaß. Es ist hier in der Schlussrunde so üblich, weil die Haushälter eine besondere Truppe sind, dass mal das Reeperbahn Festival Thema ist, mal der Glühwein.
Es gab ja schon eine ganze Menge Aussagen zum Thema Herdenschutzesel. Ich finde es gut – Ingo Gädechens war mit dabei –, das in den Einzelplan 16 einzustellen; ich glaube, die Idee kam vom Kollegen Freese, wenn ich das richtig erinnere. Aber ich habe mich gefragt: Welchen Herdenschutzesel brauchen wir denn ab dem 26. September des kommenden Jahres, nach der Bundestagswahl?
– Ja, aber Frau Kollegin Roth, das ist ein spannendes Thema. – Denn ich glaube, die Schafe – im übertragenen Sinne – sind die Steuerzahlerinnen und Steuerzahler, die Bürger dieses Landes. Die Frage ist: Wer muss an der Stelle vor wem geschützt werden? Wenn ich die Pläne höre, die die einzelnen Parteien haben – Abschaffung der Schuldenbremse, Vermögensabgabe usw. usf. –, dann kann ich nur dringend raten: Wir brauchen einen kräftigen, robusten Herdenschutzesel, damit man den Bundeshaushalt vor mancher Wölfin und vor manchem Wolf schützt.
Herzlichen Dank.
Ich gebe das Wort zu einer Kurzintervention an Anja Hajduk von der Fraktion Bündnis 90/Die Grünen.
