Herr Präsident! Verehrte Kollegen, die zuhören wollen! Werte Zuhörer an den Geräten und zu Hause!
Der Süßwarenhersteller Haribo schließt sein einziges Werk in Ostdeutschland, weil es angeblich nicht mehr wirtschaftlich ist und über keine moderne Produktionsstruktur verfügt. Damit verlieren die rund 150 Mitarbeiter zum Jahresende überraschend ihre Arbeit – mit herben Folgen für die Familie. Die in der Selbstbeschreibung hochgelobte Wirtschaftskompetenz der sächsischen Regierung konnte den Standort bei Zwickau offensichtlich nicht retten, was bei einem Wirtschaftsminister mit SPD-Parteibuch auch nicht verwunderlich ist.
Sehr geehrte Damen und Herren, was da gerade in Sachsen passiert, ist Ausdruck der Krise durch die wirtschaftliche Inkompetenz der Regierung in Fragen wie zum Beispiel der Automobilwirtschaft, der Energieindustrie und letztendlich der wirren Lockdown-Politik. Über den jahrzehntelangen Fleiß und den hohen Aufbauwillen der mitteldeutschen Beschäftigten wird fern der betroffenen Region mit einem Federstrich im Westen entschieden. Zum Hohn werden den auf die Straße gesetzten ostdeutschen Beschäftigten meist Arbeitsplätze in den alten Bundesländern angeboten. Diese millionenfache Abwanderung qualifizierter Arbeitnehmer von Ost nach West seit der Wende und dem Treuhanddebakel ist der Todesstoß für die Wirtschaft in den neuen Bundesländern. Das Gegenteil wäre vonseiten der Politik notwendig, nämlich eine Steigerung der Attraktivität des Standortes Ostdeutschland, zum Beispiel durch die Einrichtung einer Sonderwirtschaftszone, wie ich das als Vertreter mitteldeutscher Interessen in unserer Fraktion fordere.
Meine Damen und Herren Kollegen, Haribo ist überall. Für meinen Wahlkreis in Nordthüringen bedeutet die zerstörerische Politik in Ostdeutschland mit der Schließung der Firma Eaton in Nordhausen den Verlust von 250 Industriearbeitsplätzen. Mühlhausen verliert durch die Schließung der Firma Continental 160 Arbeitsplätze für qualifizierte Arbeitnehmer. Bei der Firma Erko in Beuren fallen weitere 230 Arbeitnehmerstellen weg. Wir haben in Eichsfeld, einer wichtigen Region in meinem Wahlkreis, bereits heute mehr als 30 Prozent mehr Arbeitslose als im Vergleichszeitraum im Vorjahr. Ich sage Ihnen: Haribo ist überall.
Viele Mütter und Väter werden in der nahenden Weihnachtszeit arbeitslos. Viele Kinder stehen also nicht freudestrahlend vor einem reichgedeckten Gabentisch. Sie spüren schon leise die vielen Einschränkungen und reduzierten Entwicklungsmöglichkeiten, die ihnen ein über die Generationsgrenzen hinweg verschuldetes Land in der Zukunft bereithält. Das ganze Szenario erinnert an ein Land, das von innen her einfriert infolge sozialer Kälte und politischem Starrsinn der Regierenden.
Schuld an dieser fatalen Entwicklung ist vorrangig eine wirre Politik wider die ökonomische Vernunft und – das wiegt umso schwerer – eine Regierungspolitik ohne soziales Gewissen oder den Blick für das Ganze.
Ansonsten nichts Neues.
