Sehr geehrte Präsidentin! Liebe Kolleginnen und Kollegen! In Ihrem Antrag überrascht die AfD mit bahnbrechenden Erkenntnissen, nämlich dass man im Internet widersprüchliche Aussagen zu 5 G findet. Donnerwetter! Ich kann Ihnen ein Geheimnis verraten: Das ist bei anderen Themen auch so.
Die AfD fordert im Antrag eine Studie zum Zusammenhang zwischen gesundheitlichen Schäden und Mobilfunk, insbesondere 5 G, sowie einfach verständliche Erklärungen. Das haben schon viele vor ihr gefordert, auch meine Fraktion, die Linksfraktion. Und selbst die Bundesregierung ist darauf schon gekommen.
Beim Bundesamt für Strahlenschutz findet man elf laufende Forschungsvorhaben zum Mobilfunk. Mehr als die Hälfte davon ist bereits zum Zusammenhang zwischen Gesundheit und Mobilfunk, einige sogar explizit zu 5 G. Aber Recherche ist nicht so das Ding der AfD. Die interessiert sich nicht für Fakten, die möchte anschlussfähig bleiben an Angstbotschaften.
Bisher allerdings konnte es der AfD gar nicht schnell genug gehen mit dem 5-G-Ausbau. Ich zitiere mal Ihren Kollegen Matthias Büttner – hier an dieser Stelle hat er das gesagt –:
Lassen Sie uns bei der 5G-Technologie nicht die alten Fehler wiederholen. Lassen Sie uns stark beginnen, lassen Sie uns zur Abwechslung den Technologiesprung aber einmal vollständig vollziehen, sodass das Potenzial des neuen Standards vollumfänglich ausgeschöpft werden kann …
– Das klang jetzt wirklich nicht ängstlich.
