Jetzt besteht die Notwendigkeit, dass wir für die Menschen mit diesem öffentlich-rechtlichen Vertrag Rechtssicherheit und Planungssicherheit zwischen den Parteien schaffen.
Zu den Aufgaben, die bis spätestens 2038 bewältigt werden müssen, gehören unter anderem der Rückbau der Tagebaue, die entsprechenden Rekultivierungsmaßnahmen, vor allen Dingen aber der Ersatz der Arbeitsplätze für die Menschen, die jetzt in diesem Prozess aus ihrem angestammten Arbeitsverhältnis ausscheiden. Für diese Menschen müssen wir Perspektiven schaffen.
Die Zeit der Diskussionen, die berechtigterweise und auch intensiv geführt worden sind, ist hier und heute vorbei. Jetzt muss die Tinte unter diesen Vertrag gesetzt werden und trocknen, damit die Planungs- und Umsetzungsarbeiten für die richtigen und wichtigen Schritte des Braunkohleausstiegs in Ruhe durchgeführt werden können.
Wir sind im Revier von diesem Prozess überzeugt. Wir alle werden konstruktiv und technisch orientiert an diesem Prozess mitarbeiten. Aber wir sind auch davon überzeugt, dass dieser Erfolg nur gemeinsam und mit einem konkreten Plan gelingen wird.
Herzlichen Dank und Glück auf!
Herr Kollege Kippels, nachdem Sie zwei Kollegen, nämlich die Kollegen Gösta Beutin und Krischer, angesprochen, aber keine Zwischenfrage zugelassen haben, gestatte ich jetzt beiden eine Kurzintervention. Es beginnt der Kollege Gösta Beutin.
