Der Bund alleine zahlt die Soforthilfe, den Wirtschaftsstabilisierungsfonds, die Überbrückungshilfe I, die Überbrückungshilfe II, die Novemberhilfe, die Dezemberhilfe.
Ich könnte diese Reihe fortsetzen. Der Bundesrechnungshof hat aktuell die Finanzhilfen des Bundes an die Länder und Kommunen – in den letzten Jahren und für die Zukunft geplante –, insbesondere mit den Investitionen in die Kohleregionen, noch einmal aufgelistet. Demnach geben wir weitere 44 Milliarden Euro an Länder und Kommunen. Irgendwo müssen wir auch auf unsere finanzielle Leistungsfähigkeit achten. Bei aller Wertschätzung der Arbeit in den Ländern und Kommunen – dort wird hervorragende Arbeit geleistet –: Wir müssen über eine faire Verteilung der finanziellen Lasten reden; denn nach dem Grundgesetz erfüllen Bund und Länder gemeinsam die Verpflichtung zur Wahrung der Haushaltsdisziplin.
Das gilt nicht nur in der Coronapandemie, sondern natürlich grundsätzlich auch darüber hinaus.
Schließen möchte ich mit einem Vergleich, mit einer interessanten Haushaltsstelle aus dem Umweltministerium.
– Wir alle kennen mehrere Haushaltsstellen. – So wie der Herdenschutzesel die Schafe vor den Wölfen beschützen soll, so schützt die schwarze Null den Haushalt vor weiteren Schulden. – Da wollen wir wieder hin.
Vielen Dank fürs freundliche Zuhören. Ich bitte um Zustimmung.
Das Wort hat die Abgeordnete Dr. Gesine Lötzsch von der Fraktion Die Linke.
