Frau Bundeskanzlerin, Sie haben auf Vorschläge aus diesem Haus – von uns, von den Grünen, von der FDP – wenig gehört und im Sommer und im Herbst das Land nicht auf den Coronawinter entsprechend vorbereitet. Ich will nur ein Beispiel nennen: Im Herbst ist hier über ein Schutzkonzept für Heime gesprochen worden; auch viele Experten haben das eingefordert. Und täglich sterben weiter viele Menschen in Alten- und Pflegeheimen, weil sie nicht geschützt werden und der Impfstoff fehlt. In Hessen zum Beispiel kamen im Januar 73 Prozent derjenigen, die an Corona verstorben sind, aus Alten- und Pflegeheimen. Und Sie sagen, da ist nichts schiefgelaufen? Das Sterben in den Heimen ist vielleicht das dunkelste Kapitel der letzten Jahrzehnte. Dazu gab es übrigens nie einen Gipfel. Nicht dass wir als Opposition das alles besser gemacht hätten, darum geht es überhaupt nicht; aber diese Papstattitüde der Unfehlbarkeit ist in dieser Situation unangebracht, meine Damen und Herren.
Deshalb: In einer historischen Ausnahmesituation, wo das Vertrauen der Bürgerinnen und Bürger, über das wir alle sprechen, das höchste Gut ist, sollten Fehler zugegeben werden und nicht selbstgerecht vom Tisch gewischt werden. In den letzten Monaten ist vieles schiefgelaufen. Vom Pandemieweltmeister im Frühjahr sind wir abgestiegen in den Impfkeller Europas. Wir haben seit Wochen leere Impfzentren, Millionen verzweifelte Bürger, die stundenlang in Warteschleifen stecken. Und Sie sagen, es ist nichts schiefgelaufen? Beim Impfen stehen wir hinter Rumänien, hinter Griechenland, hinter der Slowakei. Wir sind selbst in der EU weit abgeschlagen.
Frau Bundeskanzlerin, Deutschland hatte im vergangenen Jahr von Juli bis Dezember die Ratspräsidentschaft in der EU. Natürlich ist es richtig, dass europäisch bestellt wurde; das bestreitet doch von uns hier niemand. Aber überaus fraglich ist in der Tat, warum Sie eine frühere Ministerin damit beauftragt haben, die schon einmal an Verträgen gescheitert ist.
Frau von der Leyen nach dem Beraterskandal im Verteidigungsministerium den Ausweg nach Europa zu ermöglichen, war augenscheinlich ein Fehler, Frau Merkel.
Aber zurück zu Ihrem Krisenmanagement. In Deutschland wachsen die Unzufriedenheit, Verzweiflung und auch Wut. Das hat sich auch nach gestern nicht geändert, und das wissen Sie. Herr Brinkhaus hat die Länder, wo es nicht funktioniert, genannt. Aber in den USA, in Großbritannien, in Israel, in vielen anderen Ländern wird im Rekordtempo geimpft, und in Deutschland erleben die Menschen aktuell eben ein Impfdebakel. Das ist die Wahrheit.
Sie müssen drei Fragen den Bürgerinnen und Bürgern beantworten.
Erstens. Warum bestellte die EU unter deutscher Ratspräsidentschaft den Impfstoff, den Deutschland mit viel Steuergeldern gefördert hat, vier Monate später als Großbritannien und die USA?
Zweitens. Warum bestellte die EU unter deutscher Ratspräsidentschaft weniger Impfdosen von BioNTech und Moderna, als möglich war? Und warum hat es Deutschland zugelassen, dass beim Preis gefeilscht worden ist? 520 Millionen Impfdosen weniger wurden zunächst bestellt. Andere Staaten haben nicht geknausert, als es um das Leben ihrer Bürgerinnen und Bürger ging.
Drittens. Warum haben sich die EU unter deutscher Ratspräsidentschaft und die Bundesregierung selbst im Jahr 2020 nicht um die Ausweitung der Produktionskapazitäten gekümmert? Der Impfgipfel vergangene Woche war faktisch ein Placebo. Sie haben die Impfstoffentwicklung zu Recht gefördert, aber die Produktion bis heute verschlafen. Großbritannien und die USA agieren vergleichsweise komplett anders.
Nun sagen Sie immer: Das ist der Flaschenhals am Anfang. – Aber das ist nicht der Fall. In den USA werden 1,5 Millionen Menschen täglich geimpft, und es werden täglich noch mehr, die geimpft werden. Die Amerikaner haben eben sehr früh in der Operation Warp Speed 18 Milliarden Dollar in Forschung, Produktion und Impfstoffe investiert. Die EU hat darin nur 3 Milliarden Euro investiert. Was für ein Missverhältnis! Europa hat deutlich mehr Einwohner. Es ist kein Zufall, dass in drei amerikanischen Bundesstaaten inzwischen mehr geimpft worden ist als in ganz Europa. Sie sagen, Herr Brinkhaus, völlig zu Recht: Impfstrategie! – Aber sorgen Sie einmal dafür, dass bei den Hausärzten jetzt die Voraussetzungen geschaffen werden, dass die impfberechtigt sind, damit die zügig agieren können. 20 Millionen impfen die jedes Jahr gegen Grippe. Das muss man aber jetzt vorbereiten, damit das möglich wird.
Meine Damen und Herren, ich will eine Bemerkung machen: Die Pandemie ist weltweit, ja. Was ist eigentlich mit dem globalen Süden? Wann soll der impfen? Wir haben eine Sondersituation. Deswegen: Heben Sie die Patente auf! Es muss global produziert und geimpft werden.
Patentschutz ist eine Impfbremse und ein Mutationstreiber. Corona kann in veränderter Form zurückkommen, das erleben wir gerade.
