ziele womöglich auf Eingriffe in die Eigentumsrechte der Herstellerfirmen. „Ein solcher Eindruck wäre für unseren Forschungsstandort fatal“, sagte sie.
Meine Damen und Herren, das ist eine abenteuerliche Argumentation, die ich nur in aller Form zurückweisen kann. Ich bin auch froh, dass der Fraktionsvorsitzende der CDU/CSU dies zumindest öffentlich korrigiert und gesagt hat,
er sei auch klar für eine Ausweitung – wie im Übrigen auch der bayerische Ministerpräsident, der sonst ja mit sehr vielen Vorschlägen auffällt, aber auch mit diesem gekommen ist.
Zweiter Punkt. Die Begleitung der Pandemie wird uns noch viel Zeit kosten. Ich will hier auch klar sagen: Ich finde die zwei Entscheidungen, die das Kabinett heute getroffen hat,
nämlich Sequenzierung und Einreiseverordnung – jemand, der aus Staaten, die als hohes Risikogebiet klassifiziert sind, einreist, muss einen negativen Test vorlegen –, absolut richtig. Ich frage mich nur: Die Mutation in Großbritannien ist seit dem 18./19. Dezember bekannt, die in Südafrika ähnlich lange. Die Reisenden – es soll ja Leute geben mit so viel Geld, die im hiesigen Winter dort ihren Sommerurlaub machen – sind bereits wieder da. Warum hat das so lange gedauert? Ich halte das für fahrlässig angesichts dessen, dass wir das ganze Land in weiten Teilen zurückgefahren und alle mit Einschränkungen zu leben haben.
Außerdem: Auch die Sequenzierung – –
