Frau Präsidentin! Liebe Kolleginnen und Kollegen! Die FDP hat ihren Antrag damit begründet, dass es um Fairness und Solidität in der gesetzlichen Rentenversicherung ginge.
Das sehen wir auch so. Nur, wir sind völlig anderer Meinung als Sie, wie man dahin kommt und welche Konsequenzen man da zieht.
Worum geht es bei Ihrem Vorschlag konkret? Die Renten folgen den Löhnen. Durch die sogenannte Rentengarantie kommt es bei sinkenden Löhnen in der Krise nicht zu Rentenkürzungen. Das soll durch geringere Rentensteigerungen in der Zeit danach aufgefangen werden. Das ist Kern des Nachholfaktors. Es bedeutet aber, dass Sie Rentnerinnen und Rentner für die Krise mehrfach zahlen lassen wollen.
Denn durch die nächstes Jahr anstehende Nullrunde und auch als Steuerzahler zahlen sie ohnehin schon.
Und Sie setzen noch einen drauf und wollen die künftigen Rentenerhöhungen kürzen. Das machen wir nicht mit.
Sie verbrämen das in Ihrem Antrag mit dem Deckmantel vermeintlicher Generationengerechtigkeit.
