Sehr geehrter Herr Kollege Whittaker, ich möchte Sie fragen, ob Sie zur Kenntnis nehmen wollen, dass wir in dem Antrag „Garantiesicherung“ zu dem Thema Bedarfsgemeinschaften ausformuliert haben, dass wir insbesondere die Bedarfsgemeinschaften bei unverheirateten Paaren als Problem sehen. Sie profitieren nämlich nicht von steuerlichen Vorteilen, wie zum Beispiel vom Ehegattensplitting. Da ist das Beispiel von meinem Kollegen Sven Lehmann sehr lebensnah gewesen: eine unverheiratete Krankenschwester in Partnerschaft mit einem Künstler, in der das Gehalt dieser Frau noch mit dem Hartz-IV-Anspruch des nicht mehr arbeiten dürfenden Künstlers verrechnet wird.
Wir haben in diesem Antrag bewusst gesagt: Wenn wir perspektivisch die Individualisierung auch auf Ehen beziehen wollen, dann ist das ganz grundsätzlich nur denkbar mit einer größeren Reform, die dann auch das Ehegattensplitting mit betreffen würde. Dass Sie zum Thema Ehe sich ein bisschen anders positionieren, ist das eine. Aber ich bitte Sie, zur Kenntnis zu nehmen, dass wir mit der Garantiesicherung insbesondere bei den wirklich sehr ungerechten Regelungen ansetzen, die unverheiratete Paare betreffen. Ich möchte Sie fragen, ob Sie bereit sind, das zur Kenntnis zu nehmen, und ob Sie glauben, dass das einen Unterschied macht.
Frau Kollegin, ich bin bereit, zur Kenntnis zu nehmen, dass wir offensichtlich zwei völlig unterschiedliche Ansichten dessen haben, was wir als die kleinste Einheit in diesem Land verstehen. Sie möchten eine Individualisierung bei Leistungen des Sozialstaates; wir glauben an die Kraft der Verantwortungsgemeinschaft in der Familie, egal ob mit oder ohne Trauschein.
Deshalb wollen wir diese Verantwortungsgemeinschaft nicht zerstören – im Gegensatz zu Ihnen, die Sie jede Leistung individualisieren wollen. Wir glauben, dass das nicht der richtige Weg ist.
Außerdem haben Sie in Ihrem Antrag nicht explizit dargestellt, dass dies für Ehepartner nicht gelten soll; also insofern sind Sie da nicht sauber.
Sie sind in Ihrem Antrag auch weiterhin nicht sauber, wenn Sie zum Beispiel – ich finde es etwas seltsam, dass es drinsteht – auf einen zu erhöhenden Mindestlohn verweisen. Sie fordern 12 Euro die Stunde. Das finde ich deshalb sehr interessant, weil es Ihre Fraktion war, die, als wir hier über den Mindestlohn gesprochen und diskutiert haben, darauf bestanden hat, dass es eine Kommission geben soll, die jenseits der politischen Einflusssphäre, jenseits dieses Parlaments steht und mit den Tarifpartnern zusammen entscheidet, wie der Mindestlohn ausgestaltet werden soll.
Heute machen Sie eine Kehrtwende und verlangen 12 Euro die Stunde, ohne es zu begründen. Ich vermute, Sie wollen damit Armut aufgrund von Armutslöhnen bekämpfen. Aber wenn Sie das wirklich wollen, dann müssten Sie eigentlich so konsequent sein wie die Linken und sagen: Dann machen wir es an 60 Prozent des durchschnittlichen Lohnes in Deutschland fest. Nur: Dann bräuchten wir keine Mindestlohnkommission mehr, und genau das lehnen wir als Unionsfraktion ebenfalls ab.
Zu guter Letzt. Mit Ihrer Politik vergessen Sie schlicht und ergreifend die gesellschaftliche Mitte in diesem Land. Sie schreiben in Ihrem Antrag sehr deutlich, dass Sie in Zukunft die SGB-II-Leistungssätze am Konsumverhalten der Mitte der Gesellschaft orientieren wollen. Das heißt übersetzt nichts anderes, als dass knapp die Hälfte, nämlich die untere Hälfte, die, die unter dem Durchschnitt liegt, in Zukunft diese SGB-II-Leistungen, Ihre Garantiesicherung, beziehen soll. Wir wollen nicht, dass die Hälfte in diesem Sozialstaat Leistungsbezieher ist, sondern wir wollen, dass die Menschen in Arbeit sind und ihr eigenes Geld verdienen können.
Ich war ebenfalls entsetzt, als ich gelesen habe – das haben Sie schön mit den Worten verbrämt: wir wollen Bürokratie abbauen und Vereinfachungen haben –: Na ja, in Zukunft soll der Antragsteller einfach angeben, er hat kein Vermögen und er hat dies nicht und er hat das nicht, und wir prüfen das nicht weiter.
Ich meine, so kann man natürlich auch Bürokratie abbauen, indem man einfach zwei Augen zudrückt. Aber ich bin mal gespannt, wenn wir das bei den Finanzämtern machen und nicht nachprüfen würden, ob das, was in den Steuererklärungen drinsteht, auch wirklich stimmt: Dann kämen wir nicht mehr sehr weit mit unserem Staat.
Ich frage mich ernsthaft, wen Sie da eigentlich schützen wollen. Wissen Sie, Sie verschließen ein bisschen die Augen vor der Realität. Es gibt Sozialleistungsmissbrauch.
Es gibt kriminelle Banden, die auch SGB-II-Betrug machen. Ich finde, mit Ihrem Antrag schützen Sie niemanden: weder die Steuerzahler, die arbeiten und einzahlen, noch die Leistungsbezieher, die SGB II brauchen, wenig Geld zur Verfügung haben und dann noch wegen dieser kriminellen Banden schlechtgemacht werden.
Deshalb können wir diesem Antrag nicht zustimmen.
