Herr Präsident! Liebe Kolleginnen und Kollegen! Verehrte Damen und Herren! Ich bin nicht übermäßig glücklich mit der Art, wie die Debatte verläuft. Eigentlich haben wir gedacht, wir machen hier eine gemeinsame Bestandsaufnahme und nutzen diese Bestandsaufnahme, um möglichst übereinstimmend und einvernehmlich an die Bürgerinnen und Bürger zu adressieren, wie es weitergeht und vor allem auch, dass es Gründe für Zuversicht gibt.
Ohne jetzt auf jeden Einzelnen, der vorgetragen hat, einzugehen: Mein Eindruck ist ein bisschen, jeder dreht das Rad weiter, das er auch in den vergangenen Monaten gedreht hat: Ja, natürlich muss ein Pandemierat eingerichtet werden. Ja, natürlich muss gesagt werden: Lasst das doch alles laufen und hebt den Lockdown auf. Natürlich muss gesagt werden: Wir brauchen mehr Verstaatlichung, weniger Patente, wir brauchen im Grunde mehr Sozialismus in der pharmazeutischen Industrie.
Aber helfen alle diese Botschaften uns in der aktuellen Situation tatsächlich weiter?
Dabei gibt es doch Gründe zur Zuversicht. Reinhard Sager aus Schleswig-Holstein, der Landrat des Kreises Ostholstein und der Präsident des Deutschen Landkreistages, hat Anfang Januar ein bemerkenswertes Interview in der „Frankfurter Allgemeinen Zeitung“ gegeben. Ich zitiere ihn:
Wir schwanken in der Diskussion von einem Extrem ins andere. Vor wenigen Wochen hatten wir noch eine Diskussion darüber, ob es zulässig ist, so schnell einen Impfstoff überhaupt zu genehmigen. Da war auch noch die Rede davon, dass frühestens erst im kommenden März mit dem Beginn der Impfkampagne zu rechnen sei. Das hielt man schon für flott. Jetzt streiten wir darüber, warum es nicht so viel früher mehr Impfstoffe gegeben hat. Das befremdet mich offen gesagt.
So Reinhard Sager. – Ja, mich befremdet das auch. So Rudolf Henke.
