Herr Präsident! Liebe Kolleginnen und Kollegen! Ich freue mich, dass wir heute zu einer so prominenten Zeit am Donnerstag über ein ganz wichtiges Vorhaben der Bundesregierung sprechen können: die Datenstrategie der Bundesregierung.
Ich bin in den letzten Wochen auch öfter gefragt worden: Es steht ja gar nicht im Koalitionsvertrag. Jetzt kommt die Datenstrategie der Bundesregierung. Hat das jetzt etwas mit Corona zu tun? – Ich würde mal sagen: nicht unmittelbar, weil wir tatsächlich auch schon vor Corona mit der Datenstrategie begonnen haben. Aber was sich natürlich auch im letzten Jahr ganz deutlich gezeigt hat, war, dass sich eben datengetriebene Geschäftsmodelle, digitale Geschäftsmodelle in dieser Pandemie wesentlich resilienter gezeigt haben, als es bei anderen Geschäftsmodellen der Fall war.
Warum ist die Strategie so wichtig? Ich fange mal mit dem wichtigsten Thema zuerst an: Daten retten Leben. Mein Lieblingsbeispiel, das wir auch in der Datenstrategie hinterlegt haben und das wir gestern schon im Kabinett haben umsetzen können – Sie sehen, das geht auch Schlag auf Schlag, was die Maßnahmen betrifft –, ist das Beispiel Krebsregister. Wir haben jetzt erstmals auch dank der Datenstrategie ein bundesweites Krebsregister, das alle wertvollen Daten der Länder nochmals zusammenführt. So kann die Forschung erstmals sehen, wo welche Krebsart besonders häufig vorkommt, was besonders gut hilft. Krebs ist immer noch die Todesursache Nummer zwei. Mit dem zentralen Krebsregister leisten wir einen ganz wichtigen Beitrag, damit diese Krankheit nicht jedes Jahr unzählige Familien leiden und trauern lässt.
Aber es geht nicht nur um die Wissenschaft – die Wissenschaft ist natürlich ein ganz wichtiger Bereich in unserer Datenstrategie –; vielmehr entscheidet sich an der Frage, ob und wie wir unsere Daten nutzen, in einer digitalisierten Gesellschaft nicht weniger als alles. Innovation, Wirtschaftswachstum, Fortschritt in Gesundheit, Fortschritt in Mobilität, eine moderne Bildung, ein effektiver Klimaschutz – das alles ist natürlich mit Daten wesentlich einfacher.
Natürlich ist das Thema Daten nicht neu. Wir neigen nur vielleicht an der einen oder anderen Stelle immer sehr stark dazu, die Gefahren zu betonen, weniger die Chancen, weniger die Innovation, die dahintersteckt, zu sehen. Deswegen haben wir mit der Datenstrategie auch diesen innovativen Ansatz gewählt, dass wir das Potenzial heben wollen, das vor allem in der Datennutzung liegt. Dieses Potenzial müssen wir heben. Auch bei Daten gilt: Size matters. Laut BDI beträgt das Wertschöpfungspotenzial der Datenökonomie bis 2025 alleine für Deutschland bis zu 425 Milliarden Euro. Betrachtet man in diesem Punkt ganz Europa und nicht nur Deutschland, so wird das Wertschöpfungspotenzial für die nächsten zehn Jahre auf bis zu 1,25 Billionen Euro geschätzt.
Daran sieht man, was wir im letzten Jahr auch digitalpolitisch in der Pandemie beobachtet haben. Deswegen haben wir auch die Datenstrategie noch ein paar Monaten nach hinten verschoben, weil wir noch die Erkenntnisse aus dem letzten Jahr mit hineinnehmen wollten.
Erstens sind, wie gesagt, diese datengetriebenen Geschäftsmodelle resilienter.
