Liebe Kolleginnen und Kollegen, mehr Ausgabenkritik ist angesagt.
Und wenn uns der Bundesrechnungshof mahnt, der Bund müsse sich stärker auf die eigenen Aufgaben konzentrieren, dann ist das richtig. Der Bund kann nicht weiter Ausfallbürge für Versäumnisse der Länder sein, zum Beispiel bei der Kommunalfinanzierung. Mit Spannung erwarte ich das Urteil des Verfassungsgerichtshofes am 16. Dezember zu den Fehlentwicklungen in Rheinland-Pfalz.
Der Bund muss sich gerade in dieser Frage keine Vorwürfe machen. Im Bundeshaushalt 2021 stehen rund 65 Milliarden Euro mit direktem oder indirektem kommunalen Bezug zur Verfügung, 5,5 Milliarden Euro mehr als im Haushaltsjahr 2020 und über 22 Milliarden Euro mehr als 2019. Mit dem Coronakommunalpaket im Sommer haben wir gezeigt: Wir stehen auch in Krisenzeiten an der Seite der Kommunen. Kostenübernahmen bei der Grundsicherung im Alter oder den Kosten der Unterkunft entlasten Kommunalhaushalte strukturell, langfristig und nachhaltig.
Meine Damen und Herren, das Haushaltsjahr 2021 wird leider nicht besser für die Kommunen. Durch den Teil-Lockdown sind weitere Steuerausfälle zu erwarten. Aber ich will es wiederholen: Die Länder müssen hier ihre finanzielle Verantwortung wahrnehmen. Der Anspruch auf eine auskömmliche kommunale Mindestausstattung in Artikel 28 Absatz 2 Grundgesetz ist keine Prosa, sondern Rechtsanspruch.
Liebe Eltern, liebe Großeltern, liebe Tanten und Onkel, liebe Enkelkinder, Nichten und Neffen, erlauben Sie mir zum Abschluss dieser Haushaltswoche noch einen persönlichen Impuls. Unsere Politik muss vom christlichen Menschenbild geleitet sein. Daher sind solide Staatsfinanzen gelebte Generationengerechtigkeit. Lassen Sie uns doch dieses Weihnachtsfest, das ganz anders sein wird als alle anderen zuvor, einmal als Chance begreifen. Lassen Sie uns aus der Not eine Tugend machen. Lassen Sie uns im kleinsten Kreis, so wie damals in Bethlehem an der Krippe, feiern – nur der kleinste Kreis, das Herz der Familie. Weihnachten ist eigentlich kein Fest von Glanz und Gloria. Es ist ein besinnliches Fest. Erinnern wir uns daran!
Vielen Dank.
Vielen Dank. – Das Wort geht an Herrn Otto Fricke von der FDP-Fraktion.
