Herr Präsident! Meine sehr geehrten Damen und Herren! Wer heute hier die Debatten verfolgt, der muss wirklich zu dem Schluss kommen, dass der Wahlkampf eröffnet ist. Die einen fordern „Steuern runter!“, die anderen gleich „Steuern rauf!“;
aber die Zuschauer fragen sich, ob das der Ernst ist.
Der Otto Normalverbraucher will gerade Antworten auf folgende Fragen: Wie bekommen wir die Todeszahlen runter? Welche Möglichkeiten gibt es kurzfristig, die Krankenhauskapazitäten zu erhöhen? Wie senken wir dauerhaft die Zahl der Neuinfektionen? – Was machen die FDP und die Linken in der vorherigen Debatte? Sie bedienen mit diesem aufgewärmten Menü die Forderungen ihrer Wählerklientel.
Liebe Kollegen über alle Parteigrenzen hinweg, brauchen wir jetzt nicht einen nationalen Kraftakt? In meinem Heimatwahlkreis, in Wittenberg, regiert ein linker Landrat, in meinem Heimatland die Kenia-Koalition aus Schwarzen, Roten und Grünen. Allen ist eines klar: dass wir jetzt über Parteigrenzen hinweg darum kämpfen müssen, den Menschen das Leben zu retten.
Liebe Freie Demokraten, glauben Sie ernsthaft, es interessiert irgendeinen vor Ort aktuell, was in Ihrem Antrag steht,
wie etwa Aktienverluste besser steuerlich abzusetzen sind?
