Frau Präsidentin! Meine sehr geehrten Damen und Herren! Frau Kollegin Storch, Sie sind ja von Hause aus eigentlich Rechtsanwältin; so sollte man hier eine gewisse juristische Vorbildung erwarten. Aber das, was Sie uns hier dargeboten haben, das war ja wirklich Science-Fiction, das war Dystopie – und das bei einem wirklich ernsten und auch rechtlich außerordentlich schwierigen Thema.
Wir haben ja gesehen, was am Nachmittag des 6. Januar in den USA passiert ist – das war in der Tat etwas Ungeheuerliches –: Anhänger von US-Präsident Donald Trump sind auf das Kapitol marschiert,
haben sich dort gewaltsam Zugang verschafft zum Sitz des Kongresses, der Herzkammer der amerikanischen Legislative,
wo zu dieser Stunde der gerade gewählte Präsident Joe Biden bestätigt werden sollte. Am Ende dieses Tages hatten fünf Menschen ihr Leben verloren, viele waren verletzt. Den größten Schaden hat vermutlich die US-amerikanische Demokratie genommen. Was hat das jetzt mit unserem Thema zu tun,
was hat das mit Meinungsfreiheit im Netz zu tun? Ja, das will ich Ihnen sagen: Trump hat den klaren Wahlsieg von Joe Biden nicht anerkannt.
Trump hat auf Twitter 90 Millionen Follower, eine enorme Reichweite gehabt, und er hat in den Tagen zuvor – wie in der gesamten Präsidentschaft – falsche Fakten dargelegt: Er hat gesagt, die Wahl wurde ihm gestohlen. Er hat in seiner ganzen Präsidentschaft gelogen und damit den Boden für den Sturm auf das Kapitol bereitet. Und Twitter hat dann reagiert, es hat am Ende den Account des Präsidenten gesperrt, und auch Facebook, Instagram, andere soziale Kanäle haben in einer ähnlichen Art und Weise reagiert.
Nun kann man sagen: Richtig so, gut, dass Trump endlich abgeschaltet wurde.
Vier von fünf Deutschen denken auch so.
Ich will aus meiner persönlichen Meinung gar keinen Hehl machen: Auch ich finde, es ist gut, dass er abgeschaltet worden ist.
Aber wie sieht das denn als Gesetzgeber aus? Können wir uns das wirklich so einfach machen? Was wäre denn gewesen, wenn nicht Trump abgeschaltet worden wäre, sondern
vielleicht Obama – oder auch Merkel? Und das zeigt, glaube ich, dass wir über den Tag hinaus denken müssen, wir müssen fragen: Wer entscheidet eigentlich, was in meinungsträchtigen Netzwerken gesagt werden darf,
wer entscheidet, wer sich an der weltweiten Kommunikation beteiligen darf?
