Herr Präsident! Werte Kolleginnen und Kollegen! Zuerst einmal will ich mich ausdrücklich dafür bedanken, dass vonseiten der SPD die Entscheidung über die Bewaffnung von Drohnen geschoben wurde. So kommt es diese Legislaturperiode nicht mehr zu einer Beschaffung der Bewaffnung für die Drohne Heron TP. Das begrüßen wir als Linke ausdrücklich.
Bedanken möchte ich mich bei den Akteuren aus der Zivilgesellschaft, der Friedensbewegung, der Wissenschaft, bei der SPD, den Grünen und den Linken, die dieses möglich gemacht haben.
Wir werden später hören, dass diese Debatte über die Bewaffnung von Drohnen ausführlich geführt worden sei. Na ja, wir wissen aber auch: Das Verteidigungsministerium hat eine im Wesentlichen gelenkte Debatte geführt. Eine ausführliche, breite gesellschaftliche Debatte sieht völlig anders aus.
Dazu gehören auch viele andere Akteure, zum Beispiel aus dem Bereich der Gewerkschaften und der Religionsgemeinschaften. Das zur Ehrenrettung von Norbert Walter-Borjans und Rolf Mützenich.
Immer wieder wird von den Befürwortern der Bewaffnung vorgebracht, Drohnen würden nur und ausschließlich zum Schutz der Soldatinnen und Soldaten sowie von Lagern und Konvois eingesetzt. Jeder, der sich mit Drohnen auskennt, weiß: Das ist, freundlich formuliert, nur ein Teil der Wahrheit. Für Kampfdrohnen gibt es breite Einsatzszenarien. Schauen Sie zum Beispiel in das Thesenpapier „Rüstung digitalisierter Landstreitkräfte“ vom Kommando Heer. Da sind solche Szenarien konkret beschrieben. Da ist von UAV-Wirkmitteln gegen Gegner die Rede. Ich zitiere mal einen Soldaten. Er sagt: Unehrlich ist es, diese militärischen Einsatzszenarien hinter dem Begriff „Schutz“ zu verstecken. „Schutz“ heißt beim Militär eben auch, dass wir anderen Menschen das Leben nehmen werden. Das gehört dazu.
Er sagt weiter: Wir müssen aufhören, nur vom Schutz für Soldatinnen und Soldaten zu reden. Im besten Falle schießen sie nie, die Drohnen. Wenn wir sie aber nutzen, dann meist mit dem Ziel, Menschen zu töten.
