Frau Präsidentin! Meine sehr geehrten Damen und Herren! Ich frage mich bei den Rednerinnen und Rednern der CDU/CSU und der SPD, warum sie in Pandemiezeiten hier überhaupt noch erscheinen. Also, wenn Sie finden, dass die Bundesregierung das mit den Ministerpräsidenten gut macht, dann können Sie einfach zu Hause bleiben.
Das kann doch nicht allen Ernstes Ihr Ansatz sein, liebe Kolleginnen und Kollegen.
Ich stelle heute fest: Die FDP hat zum zweiten Mal in dieser Wahlperiode einen brauchbaren Gesetzentwurf vorgelegt; den werden wir sehr wohlwollend begleiten.
Ich finde, darüber zu sprechen, ist sehr richtig und notwendig. Worum geht es? Alle kennen die berühmten Merkel-und-Ministerpräsidenten-Runden, wenn das ganze Land gebannt vor dem Bildschirm darauf wartet, was denn jetzt Neues verkündet wird. Das Grundproblem dabei ist doch Folgendes: Erstens ist diese Runde nirgendwo in der Verfassung überhaupt vorgesehen – daran muss man kurz erinnern –,
zweitens tagt diese Runde ausschließlich nichtöffentlich,
und drittens – das will ich dazusagen – wird sie von einem Gremium aus Beratern und Wissenschaftlern vorbereitet, dessen Zusammensetzung völlig intransparent ist und bei dem man sich fragt, ob das eigentlich nicht ein wenig einseitig ist. All das könnten wir mit dem Gesetzentwurf der FDP ändern, liebe Kolleginnen und Kollegen.
Ich will eines wirklich ganz deutlich sagen, das ist eine demokratische Grundsatzfrage: Wenn Grundrechte eingeschränkt werden, dann darf das niemals – das lehrt doch auch die Geschichte – durch Verordnungen und durch die Regierung geschehen.
Das muss hier diskutiert und hier entschieden oder abgelehnt werden. Das ist doch eine Grundsatzfrage. Ich verstehe nicht, wie man sich dem entziehen kann.
Und die Idee der Grundrechte ist doch gerade, dass Grundrechte natürlich auch und besonders in Krisenzeiten gelten und geschützt werden müssen. Deswegen kann man damit nicht so lax umgehen, wie das im letzten Jahr der Fall war, liebe Kolleginnen und Kollegen.
Versammlungsfreiheit, Bewegungsfreiheit, Religionsfreiheit: Diese so wertvollen Rechte können nicht einfach per Verordnung aufgehoben werden.
