Vielen Dank, Frau Präsidentin. – Meine sehr geehrten Damen und Herren! Wir haben zu Anfang dieser Woche die Frage gestellt: Wer soll die Pandemierechnung bezahlen? – CDU/CSU und SPD drücken sich vor der Antwort und wollen es erst nach der Wahl sagen. Das lassen wir ihnen nicht durchgehen, meine Damen und Herren!
Die Union will ja nach der Wahl die Schuldenbremse wieder anziehen. Wir wollen – in der Tat – eine Vermögensabgabe für Milliardäre, so wie es unser Grundgesetz vorsieht. Das ist der Unterschied, meine Damen und Herren!
Aber auch die Kolleginnen und Kollegen der SPD wollen eigentlich die Vermögenden stärker besteuern. Ich bitte Sie: Reden Sie nicht nur im Wahlkampf darüber, machen Sie auch ernst, liebe SPD!
Es gab ja zu Beginn der Pandemie bei vielen die Illusion, die Gesellschaft würde jetzt näher zusammenkommen. Der Befund ist: Das Gegenteil ist passiert. Die Politik der Bundesregierung hat weiter zur Spaltung beigetragen. Hilfen wurden ungerecht verteilt. Milliardäre wurden gerettet, und fast 1 Million Niedriglöhner haben ihre Arbeit verloren und fallen durch die sozialen Netze. So kann das nicht weitergehen!
Wir haben drei Fragen gestellt: Ist der Haushalt sozial, ist er friedlich, ist er klimafreundlich?
Alle drei Fragen mussten wir mit Nein beantworten.
Er ist nicht sozial, weil er zu wenig gegen die soziale Spaltung unserer Gesellschaft tut. Er ist nicht friedlich, weil er mit über 53 Milliarden Euro – nach NATO-Kriterien berechnet – zur Aufrüstung der Bundeswehr beiträgt. Und er ist nicht klimafreundlich, weil Menschen mit dem größten CO
Ich will aber bei der Bewertung des Haushalts Union und SPD nicht über einen Kamm scheren. Hubertus Heil ist ehrlich bemüht, etwas für Rentnerinnen und Rentner, Arbeitslose und Niedriglöhner zu tun.
Doch schauen wir uns den Befund an. Der Armutsbericht des Paritätischen Wohlfahrtsverbandes sagt: 13 Millionen Arme. – Das können wir nicht hinnehmen. Das entspricht nicht unserem Menschenbild.
Ich sage Ihnen: Das Grundproblem liegt doch nicht in den einzelnen Haushaltszahlen, sondern es liegt im gesamten Politikansatz. Schauen wir uns nur die Bereiche Wohnen, Gesundheit, Bildung, Verkehr und Rente an. In allen diesen Bereichen wurde das Profitprinzip der Neoliberalen eingeführt. Der Markt sollte den Wohnungsbau, das Gesundheits-, Bildungs-, Verkehrs- und Rentensystem auf Vordermann bringen. Doch das Ergebnis ist: Diese Politik ist gescheitert.
Es fehlen nämlich preiswerte Wohnungen, es fehlt Pflegepersonal in den Krankenhäusern,
es fehlen Fachkräfte an allen Ecken und Enden, die Autobahnprivatisierung ist ein Desaster, und die kapitalgedeckte Riester-Rente ist gescheitert. So kann das nicht weitergehen!
Ihre Formel „Was sich nicht rechnet, wird eingespart“ hat fatale Folgen. Vorratswirtschaft war angeblich falsch. Die Neoliberalen wollten alles just in time, also genau auf die Sekunde machen. Das solle Kosten sparen. Welch fataler Irrtum! Das müssen wir jetzt alle gemeinsam ausbaden.
Der Gesundheitsminister hat Masken und Schutzausrüstungen zu Wucherpreisen aufkaufen müssen. Doch er scheitert natürlich, wenn es ums Pflegepersonal geht. Menschen kann man nicht just in time, also über Nacht, wie bei Amazon bestellen. Und das ist auch gut so, meine Damen und Herren!
Ich sage Ihnen: Wer eine Gesellschaft wie ein Onlinekaufhaus organisieren will, muss scheitern. Ein Krankenhaus kann nicht wie eine Schraubenfabrik auf Profit getrimmt werden. Im Krankenhaus sollen der Patient und die Patientin und natürlich auch die Menschen, die dort arbeiten, im Mittelpunkt stehen und nicht die Fallpauschale und nicht der Profit. Das ist der falsche Weg, meine Damen und Herren!
Ich sage Ihnen auch: Wenn wir die Krankenhäuser nicht von den Pandemielasten befreien, werden wir nach der Pandemie noch weniger öffentliche Krankenhäuser haben als vor der Pandemie. Das müssen wir verhindern!
Selbst die Bundeswehr sollte ja zu einem Unternehmen umgebaut werden. Frau von der Leyen und ihre Unternehmensberaterin sind bei dem Versuch grandios gescheitert.
Die Ausgaben für die Bundeswehr steigen seit Jahren in einem atemberaubenden Tempo. Aber die Bundeswehr wirkt wie ein Durchlauferhitzer: Das Geld wird an Airbus und Rheinmetall durchgereicht. Die liefern dann zu überhöhten Preisen alles Mögliche, was angeblich oder wirklich nicht funktioniert, und die Rendite von Airbus und Rheinmetall stimmt. Dieses Geld können wir besser für soziale Zwecke verwenden, meine Damen und Herren!
Viel wurde natürlich auch über die innere Sicherheit gesprochen und über das Geld, das dafür zur Verfügung gestellt werden muss. Auch hier muss man grundsätzlich herangehen; denn das Grundproblem der inneren Sicherheit ist nicht mit Polizei und Geheimdiensten zu lösen. Wirklich extrem ist das zerstörerische Profitstreben. Das muss beendet werden, meine Damen und Herren!
Wer also wirklich etwas gegen Extremismus tun will, der muss
