Sehr geehrter Herr Präsident! Liebe Kolleginnen und Kollegen! Nach eigener Aussage will die AfD mit ihrem heutigen Antrag Steuergelder der deutschen Bürger schützen, um sich ein paar Zeilen weiter gegen den europäischen Rechtsstaatsmechanismus auszusprechen.
Also: Sie wollen die Möglichkeit der EU, Gelder dann zu kürzen, wenn die Rechtsstaatlichkeit verletzt wird, abschaffen. Also Sie sind dafür, dass deutsche Steuergelder an die korrupten Kumpel von Viktor Orban fließen. Sie sind einverstanden und wollen, dass deutsche Steuergelder dazu beitragen, dass in Polen freie Medien weiter unter Druck gesetzt werden.
Genauso geht es weiter in Ihrem Antrag: Sie behaupten, Deutschland hafte für andere Länder – Lüge.
Sie behaupten, jedes Mitgliedsland würde für den Wiederaufbaufonds haften – Lüge. Der EU-Haushalt haftet.
Sie behaupten, Gelder aus dem Wiederaufbaufonds würden ohne inhaltliche Konzeption an die Mitgliedsländer gehen, man würde erst die Gelder rausgeben und sich dann überlegen, wofür – Lüge. Wenn Sie es noch nicht mitbekommen haben: 37 Prozent dieser Gelder müssen in den Klimaschutz gehen, 20 Prozent in die Digitalisierung. Vielleicht ist es Ihnen ja noch nicht aufgefallen.
Sie behaupten hier, das Wachstum in der Euro-Zone läge bei unter 1 Prozent
– Lüge. Es beträgt konstant mehr als 1 Prozent.
Und das ist Ihre Masche: eine Lüge nach der anderen. Und diese Masche, eine Lüge nach der anderen, führt am Ende zur Erstürmung des Kapitals.
Und ich kann Ihnen sagen, dass wir das werden zu verhindern wissen.
– Erstürmung des Kapitols.
