Frau Präsidentin! Liebe Kolleginnen und Kollegen! Thema dieser Debatte ist mal wieder Gentechnik, ein ebenso wichtiges wie kontrovers diskutiertes Thema; denn es geht um mehr oder weniger gezielte Veränderungen des Erbguts von Lebewesen. Wobei ich mich als Tierärztin schon manchmal wundere, wie locker-flockig manche darüber reden – wir haben es ja auch eben gehört –; denn am Erbgut sollte man nun wirklich nicht einfach so herumschrauben, als ob es eine Maschine wäre.
Und dass dabei immer nur Gutes herauskommt, ist auch einer der Gentechmythen, die so absichtsvoll verbreitet werden; denn das Genom ist und funktioniert weit komplexer als manche Gentechnikdebatte, und es sind höchstens die Grundlagen seiner Funktionalität bekannt. Deshalb sind halt Folgen einer technischen Veränderung oft nicht so ohne Weiteres direkt vorhersehbar oder deren Ergebnis absehbar.
Es stellen sich auch ethische Fragen; denn es geht um den Eingriff in den Bauplan des Lebens, andere sagen: in die Schöpfung. Damit wird eben – gewollt oder ungewollt – auch die Tür zu einem genetisch optimierten Menschen aufgemacht. Das, finde ich, ist ein Albtraum.
Umso mehr müssen Potenziale und Gefahren dieser Risikotechnologie sehr genau abgewogen werden. Aber die Gentechlobby verharmlost absichtsvoll diese Risiken.
Es wird zum Beispiel so getan, als gäbe es keinen Unterschied zwischen den eher kontrollierbaren Risiken der Gentechnik in geschlossenen Systemen, zum Beispiel bei der Impfstoffentwicklung im Labor, und den unkontrollierbaren Risiken bei gentechnisch veränderten und vermehrungsfähigen Organismen in Land- und Forstwirtschaft oder der Fischerei. Dabei ist unkontrollierte Ausbreitung keine Theorie. Gerade jetzt wurde wieder ein gentechnisch veränderter Leinsamen, Triffid genannt, in Baden-Württemberg nachgewiesen. Vermutlich war schon das Saatgut verunreinigt. Er war zuletzt 2009 aufgetaucht und sorgte damals für Rückrufaktionen in 28 Ländern, wie der Informationsdienst Gentechnik berichtet. Auch solche Albträume müssen verhindert werden.
Gerade die Agrogentechnik ist ganz klar eine Hochrisikotechnologie, die reguliert und kontrolliert gehört, zumal sich viele Heilsversprechen der Agrogentechniklobby gar nicht erfüllt haben.
Es ging wohl mehr um Profitversprechen für Gentechkonzerne,
