Aber an diesem Beispiel ist zu erkennen, welchen Stellenwert heimische Unternehmen und heimische Beschäftigte bei Ihnen haben.
Bundesregierung und Europäische Union unter Kommissionspräsidentin von der Leyen zerstören in Ost und West aktiv die deutsche Automobilindustrie und damit, so Hans-Werner Sinn – den kennen Sie alle hier –, das Rückgrat der deutschen Wirtschaft.
Daimler lässt Motoren zukünftig in China bauen, und BMW stellt die Fertigung seiner Verbrennungsmotoren in Deutschland ein; sie werden künftig in Großbritannien gebaut. Auch die Zulieferindustrie hat bereits Zehntausende Menschen entlassen müssen und erwartet eine riesige Pleitewelle, im Westen und im Osten. Im thüringischen Nordhausen etwa verlieren zum Jahresende weitere 250 Menschen ihren Arbeitsplatz. Dort stellt der Autozulieferer Eaton seine Produktion ein und verlagert seine Fertigung nach Polen. Ihr sogenannter Aufbau Ost ist zu einem gigantischen Abbau Ost geworden.
Und nun gefährdet ein in virtueller Hinterzimmerkungelrunde unter Vorsitz von Merkel beschlossener Lockdown laut Handelsverband auch noch bis zu 250 000 Stellen im innerstädtischen Einzelhandel. Rund die Hälfte aller Gastrobetriebe ist von Insolvenz bedroht. Die Zahl der verdeckt überschuldeten Unternehmen könnte bis März auf bis zu 800 000 ansteigen.
Auch die Lufthansa wird wegen Ihres Lockdowns rund 40 000 Menschen entlassen. Diese Katastrophe für die Arbeitnehmer haben Sie dann auch noch vom Steuerzahler mitfinanzieren lassen. Erst im Mai war die Fluglinie durch ein staatliches Hilfspaket von 9 Milliarden Euro gerettet und damit teilverstaatlicht worden. Hinzu kommt, dass schon heute infolge von Digitalisierung und Automatisierung in ganz Deutschland fast 8 Millionen sozialversicherungspflichtige Arbeitsplätze bedroht sind. Auch dazu gibt es von Ihnen kein Wort und schon gar keine vernünftige Politik.
Meine Damen und Herren, die Kernkompetenz dieser Regierung scheint nur noch darin zu bestehen, die deutschen Arbeitnehmer mittels Infektionsschutzgesetz zu entrechten und durch EU-Freizügigkeit, Coronakahlschlag und Zerstörung der Autoindustrie arbeitslos zu machen. Diese Bundesregierung löst keine Probleme; sie ist mit Abstand das größte Risiko für deutsche Beschäftigte und für den Wirtschaftsstandort Deutschland.
Vielen Dank.
Die nächste Rednerin ist die Kollegin Daniela Kolbe, SPD-Fraktion.
