zu versuchen, die vom BVerfG vorgegebenen Differenzierungen nachzuzeichnen oder wörtlich zu paraphrasieren, und übernimmt damit die in diesen angelegten Unzulänglichkeiten und Ungereimtheiten, ohne ein eigenes Ordnungssystem zu entwickeln.
Meine Damen und Herren, dieses Urteil ist doch nicht vom Himmel gefallen. Bereits nach der Entscheidung des Gerichts im Januar 2012 zu den Bestandsdaten war doch klar, wohin die Reise geht. Nicht umsonst haben nicht nur wir von der AfD, sondern auch die FDP und sogar die Grünen bei der Entfristung des Terrorismusbekämpfungsgesetzes im letzten Jahr eine unabhängige Evaluierung und eine völlige Neuausrichtung der Sicherheitsstruktur in Deutschland verlangt – leider vergebens, obwohl die Zeit da war.
Trotz dieser Kritikpunkte werden Sie mit Ihrer Mehrheit wieder einmal ein offensichtlich verfassungswidriges Gesetz durchboxen. Auf diese Weise verspielen Sie einmal mehr das Vertrauen des deutschen Volkes in dieses Parlament als Gesetzgebungsorgan.
Aber dieser Verstoß ist ja leider kein Einzelfall, wie wir wissen. Alle Parteien außer der AfD haben im März 2020 zu Anfang der Coronakrise ihre grundgesetzlich vorgeschriebene Pflicht als gesetzgebendes Organ an der Garderobe des Dienstboteneinganges des Kanzleramtes abgegeben und damit das souveräne deutsche Volk zum Untertan degradiert. Sie haben die Macht dieses Parlamentes an ein verfassungsrechtlich nicht legitimiertes Kaffeekränzchen aus Kanzlerin und Ministerpräsidenten abgegeben.
– Das ist Thema. – Deshalb einmal die Frage an den Verfassungsschutz: Wer verstößt in diesem Land eigentlich gegen die freiheitlich-demokratische Grundordnung?
Doch wohl die, die vorsätzlich verfassungswidrige Gesetze erlassen, doch wohl die, die mit berechtigter Angst um ihre Posten und Mandate auf das Volk schauen und deshalb auch mit diesem Gesetz jetzt den gläsernen Bürger wollen
