Das ist an dieser Stelle keine Wissenschaftskommunikation, Frau Karliczek, obwohl sie ein Ziel ist. Jetzt sehen Sie, wie toll Ziele und Messkriterien sind. Jetzt haben Sie was gesehen, jetzt können Sie es ändern – perfekt! Und genau deswegen braucht es hier Ziele und Messkriterien.
Jeder weiß, dass in Deutschland die Innovation nicht an klugen Köpfen und im Übrigen auch nicht an der Forschungsfinanzierung scheitert. Es scheitert am Transfer. An dieser Stelle ist die Strategie leider etwas schwammig. Ein bisschen Lektüre für Herrn Kleinwächter, wenn der Puls wieder unten ist:
Lesen Sie unseren Antrag „Von der Biologie zur Innovation – Von der Innovation zum Produkt“. Da geht es eben um die Ausfinanzierung entlang der Prozesskette, damit eben auch marktwirtschaftliche Prinzipien gewahrt bleiben.
Weil es mir meinen Zeitplan leider ziemlich zerhauen hat, komme ich nur noch zum letzten Teil. Frau Karliczek hat es zum Glück dieses Mal angesprochen: Wenn eins in der Strategie fehlt, dann ist es leider der Mut. – Sie hören nicht auf Ihre eigenen Berater. Dass Sie teilweise acatech und die Leopoldina ignoriert haben, daran kann man sich vielleicht, auch wenn es wehtut, gewöhnen. Aber Ihr eigener Bioökonomierat hat Sie kritisiert. In diese Strategie muss ein klares Bekenntnis zur Gentechnik als ein potenzieller Lösungsweg für die Probleme der Zukunft. Das sind Sie leider schuldig geblieben. Das spielt den Fortschrittspessimisten wie Herrn Ebner in die Hände, auf dessen Rede ich mich natürlich freue.
Vielen Dank.
Vielen Dank, Herr Kollege Brandenburg. – Nächste Rednerin ist die Kollegin Dr. Petra Sitte, Fraktion Die Linke.
