Darüber hinaus geht es um weitere komplexe Fragestellungen, zum Beispiel um den Unterschied zwischen privaten und staatlichen Accounts. Was ist denn, wenn ein Account ein offizieller Account einer Regierung, eines Präsidenten ist? Was ist denn – darüber sollten wir einmal nachdenken –, wenn Meinungsplattformen wie Twitter, Facebook oder andere essenzielle Strukturen der Meinungsfreiheit, der Meinungsbildung im demokratischen Gefüge sind? Gibt es überhaupt Ausweichoptionen? Also zusammengefasst: Es ist eben kompliziert.
Und immer, wenn es kompliziert wird, neigen viele dazu, einfache Lösungen herbeizuholen. Das ist dann übrigens auch die Stunde der Populisten, die es sich sehr einfach machen. Aber es ist auch für andere Teilnehmer nicht einfach. Ich finde, dass es sich die Bundesregierung einfach gemacht hat; ich finde auch, dass es sich die Plattformen zu einfach machen, und – man muss auch selbstkritisch sagen – wir User machen es uns eben manchmal auch zu einfach.
Die Bundesregierung macht es sich zu einfach, wenn sie mit dem NetzDG beispielsweise die Durchsetzung von Strafrecht im Netz im Ergebnis zunehmend auf Private verlagert, wenn strafrechtliche Vorermittlungen – verfassungsrechtlich höchst bedenklich – in Abteilungen privater Unternehmen stattfinden sollen. Viel gefährlicher ist übrigens, dass dieses System von autokratischen Regimen, von minderdemokratischen Regimen als Vorbild und Entschuldigung für ihr eigenes System genommen wird, wobei wir wieder beim Thema Russland wären.
Auch die Plattformen machen es sich zu einfach. Sie berufen sich auf Community Standards. Ich habe Fälle erlebt – gerade gestern wieder in einem Gespräch –, dass Dinge nach Community Standard behandelt werden und nicht nach den tatsächlichen rechtlichen Bedingungen in den Ländern. Die Plattformen haben da viel nachgelegt, aber da ist noch viel Luft nach oben. Wenn die Plattformen die User nicht als Kunden haben – wir sind als User ja Teil des Produkts –, dann geht das eben, von der Sichtweise her, an der Rechtslage vorbei. Und das ist kompliziert.
Und auch wir haben es selbst in der Hand. Wir machen es uns selbst manchmal zu einfach, wenn wir die Verantwortung für das eigene Handeln zu sehr in staatliche Hände legen. Ich will jetzt nicht anfangen mit der Netiquette. Es gibt eigentlich seit 30 Jahren Grundregeln im Internet, wie man sich zu verhalten hat. Aber wenn wir uns auch außerhalb des Internets unglaublich verhalten – übrigens auch in diesem Haus machen das manche Fraktionen – und verbal auf eine schlechte Art und Weise um uns schlagen, darf man sich nicht wundern, wenn sich das nachher im Netz widerspiegelt. Deswegen sind einfache Lösungen am Ende nicht geeignet.
Ich hoffe, dass wir die Debatte rund um Deplatforming und den Trump Ban für eine Gesamtreflexion nutzen, dass wir für Nutzerinnen und Nutzer, für Plattformen und für den Rechtsstaat gute Lösungen finden und dass wir am Ende nicht vergessen: Es geht um das freie Internet.
Herzlichen Dank.
Das Wort hat der Kollege Dr. Jens Zimmermann für die SPD-Fraktion.
