Sehr geehrte Frau Präsidentin! Liebe Kolleginnen und Kollegen! Meine sehr verehrten Damen und Herren! Es gab einen allseits bekannten Werbespruch eines großen Kaufhauses, der, insbesondere beim Schlussverkauf, besagte: Das Beste zum Schluss. – Ob man den vorliegenden Antrag der FDP zum Thema Digitalisierung zum Ende unserer Sitzung damit bewerben kann, das will ich an ein paar Beispielen überprüfen. Ich kann Ihnen auch sagen: Sie müssen sich nicht fürchten.
Gleich der Punkt 1 dieses Antrages zeigt eine gewisse Realitätsferne. So soll innerhalb der nächsten dreieinhalb Wochen – die Festtage natürlich mit eingeschlossen – eine bundesweite Whitelist von sämtlichen schulischen Plattformanbietern in Abstimmung mit allen Bundesländern vom Bund erstellt werden. Diese soll auch noch den datenschutzrechtlichen Anforderungen für eine öffentliche Nutzung genügen.
Ganz abgesehen davon, dass eine Durchführung dieser Forderung zeitlich gar nicht möglich ist, gibt es doch erhebliche Unwägbarkeiten hinsichtlich der vergaberechtlichen Fragen, die es zu klären gilt.
Es besteht nämlich das Risiko, dass Bund und Länder massiv angreifbar sein könnten, wenn bei der Erstellung der Whitelist zum Beispiel ein Anbieter entweder vergessen worden ist oder möglicherweise nicht berücksichtigt wurde.
Ist er zu Unrecht von der Liste verschwunden, könnte das in der Tat millionenschwere Schadensersatzforderungen zur Folge haben. Einen Untersuchungsausschuss würden Sie mit Sicherheit sofort fordern, wenn das alles nicht klappt.
Die FDP fordert weiter mit willkürlich gegriffenen Terminsetzungen, die Mittelabflüsse zur Beschaffung von technischem Equipment zu beschleunigen.
Abgesehen davon, dass mich das eher an planwirtschaftliche Vorgaben erinnert, blendet die FDP mehr oder weniger gekonnt aus, dass auch hier Vergabeverfahren eingehalten werden müssen.
– Doch, doch, das hat schon etwas damit zu tun.
