Sehr geehrter Herr Präsident! Liebe Kolleginnen und Kollegen! Mit unserem Antrag wollen wir das Impfmanagement in Deutschland digitalisieren und damit verbessern. Ich weiß, was Sie jetzt sagen werden: Impfen ist Sache der Länder. – Das ist richtig. Das wollen wir auch gar nicht ändern.
Denn zum Beispiel in meinem Heimatbundesland Schleswig-Holstein läuft es mit dem liberalen Gesundheitsminister Heiner Garg sehr gut.
In anderen Bundesländern ist das leider nicht so. Es geht hier, meine Damen und Herren, auch gar nicht um Zuständigkeiten, sondern es geht um einen schnellen Weg aus dieser Pandemie, und das wollen wir doch hier alle.
Die Bevölkerung ist es leid, dass immer dann, wenn es nicht rund läuft oder etwas schiefläuft, die anderen zuständig und schuld sind. Aber das ist ja in dieser Regierung nichts Neues. Erst vollmundig Schnelltests zum 1. März versprechen, und wenn es dann nicht klappt, dann sind halt die Länder zuständig für die Bestellung. So läuft es nicht, meine Damen und Herren.
Wir müssen schleunigst dafür sorgen, dass wir uns nicht sehenden Auges von einem Impfstoffmangel zu einem Impfstau bewegen. Es ist doch beschämend, dass in dem Land, wo der erste zugelassene Impfstoff entwickelt wurde, bis Ende Juni erst die Hälfte der Bürgerinnen und Bürger ein Impfangebot erhalten, und das ist noch optimistisch, meine Damen und Herren.
Ich frage mich, wann die Bundesregierung endlich aufwacht. Wir sind uns doch alle einig: Impfen, Schnelltests sind der entscheidende Weg raus aus der Pandemie. Es muss geimpft werden und vor allen Dingen schnell und rund um die Uhr. In Israel kann man bei Ikea und in Bars geimpft werden. Das liegt natürlich auch daran, dass Israel bei der Impfstoffbestellung klüger war als Deutschland und Europa. Als wir noch verhandelt haben, hat Israel schon gehandelt. Außerdem – das ist der entscheidende Punkt – sind Länder wie Israel bei der Digitalisierung des Gesundheitswesens Deutschland meilenweit voraus.
Und wir? Wir schlagen uns mit geplatzten Impfterminen, die auf Zetteln und in Excel-Tabellen verwaltet werden, mit übriggebliebenen Impfdosen, mit unprofessionellem Impfterminmanagement, mit ungenutzten Impfdosen und mit unterbrochenen Lieferketten herum. Das muss ein Ende haben!
