Frau Präsidentin! Liebe Kolleginnen und Kollegen! Man kann ja mit Sicherheit trefflich über die einzelnen getroffenen Maßnahmen diskutieren, und das tun wir hier im Parlament. Wir ringen um die beste Lösung für unser Land – gerade in dieser Situation – mit den unterschiedlichsten Sichtweisen. Das ist Wesen der Demokratie: Rede und Gegenrede und dann vor allem das Finden eines guten Kompromisses. Das Wesen der Demokratie ist aber auch ein respektvoller und vor allem ein sachlicher Umgang miteinander. Diesen sachliche Umgang lassen Sie in Ihren drei Anträgen vermissen. Sie haben diese drei Anträge gestellt, um Unruhe zu stiften und um Desinformationen zu verbreiten. Nichts anderes bezwecken Sie mit diesen drei Anträgen.
Gerade in einer solch schwierigen Lage für alle Beteiligten brauchen wir genau das Gegenteil: Sorgfalt, Konzentration, Sachlichkeit und vor allem auch Zuversicht. Ihre drei heutigen Anträge zeigen, dass Sie diese Attribute – Sorgfalt, Konzentration, Sachlichkeit – überhaupt nicht können; von Zuversicht will ich gar nicht reden. Ihr Mantra ist: Masse statt Klasse. – Sie fordern ja immer Bürokratieabbau und Entbürokratisierung. Wenn Sie einen anständigen Antrag stellen würden, anstatt drei schlampige, die die Bundestagsverwaltung behandeln muss,
und wir die Debatte hier nicht führen müssten, wäre das das Beste, was Sie heute zur Entbürokratisierung beitragen könnten.
Also, konzentrieren Sie sich doch auf die Sache!
Zum ersten Antrag „Aufbruch für Deutschland – Raus aus der … Krise“: Sie wollen wichtige Weichen stellen; aber was Sie mit Ihrem Antrag liefern, ist eine unendlich lange, ermüdende Liste von Behauptungen, verbunden mit der Bitte, nicht genau hinzuschauen und dann eventuell zuzustimmen. Ich greife mal nur einen Punkt raus: systemische Mehrkosten für die Energiewende zwischen – so geschätzt – 500 Milliarden und 3 Billionen Euro.
Übrigens: Im zweiten Antrag zur Umsatzsteuer sind es 2,3 Billionen Euro. Welcher Satz stimmt jetzt eigentlich in Ihren Anträgen? Oder machen Sie Haushaltspolitik nach dem Prinzip des grünen Daumens?
