Da behauptete der Virologe Professor Drosten eben mal, dass Kinder Virenschleudern seien.
Aber Gott sei Dank gibt es noch seriöse, unabhängige Wissenschaftler, die dann diese Sache auch korrigiert haben.
Dann wurde hysteriebedingt behauptet, dass es im letzten Jahr eine Übersterblichkeit gegeben hätte; das Gegenteil ist der Fall. Auch die WHO hat gesagt, es gab sie nicht. Oder es wurde behauptet, dass wir schwerwiegende Engpässe bei der Belegung von Intensivbetten hätten und dass wir auf eine Katastrophe zusteuern würden. Auch das ist ja nicht passiert. Die Behauptung war falsch. Auch wenn die individuellen Schicksale hier schwer wiegen: Die große gesamtgesellschaftliche Katastrophe ist ausgeblieben.
Herr Kollege, kommen Sie zum Schluss, bitte.
Nun muss die Bundesregierung endlich zugeben, dass sie falschgelegen hat.
Sie muss den Lockdown endlich aufheben. Das tut jetzt not: die vollständige Öffnung aller Lebensbereiche, aller wirtschaftlichen Bereiche und die Wiederherstellung unserer Freiheit – nicht mehr und nicht weniger, meine Damen und Herren.
Als nächster Rednerin erteile ich das Wort der Kollegin Gabriele Katzmarek, SPD-Fraktion.
