nicht nur, aber da war auch Kluges dabei. Deswegen will ich an dieser Stelle einfach sagen: Sie sollten nie unterstellen, auch an dieser Stelle nicht, dass die Regierungsfraktionen oder auch die Bundesregierung nicht bereit wären, aus Situationen und Entwicklungen zu lernen und die notwendigen Schlüsse zu ziehen. Das tun wir. Das haben wir in den vergangenen Gesetzgebungsprozessen bewiesen, als es beispielsweise um das Dritte Bevölkerungsschutzgesetz ging. Das werden wir auch in diesem Verfahren wieder beweisen. Ich sage Ihnen ausdrücklich zu: Wir sind daran interessiert, auch mit den Oppositionsfraktionen gemeinsam zu erörtern, wie wir es schaffen können, für diese Maßnahmen eine möglichst breite Mehrheit hier im Parlament zu haben. Das ist unser Ziel.
Herr Kollege Frei, die Kollegin Lötzsch würde gerne eine Zwischenfrage stellen.
Bitte schön.
Vielen Dank, Herr Kollege Frei, dass Sie die Frage zulassen. – Der Minister ergreift ja nicht das Wort, also muss ich mich an Sie wenden, aber das mache ich natürlich auch sehr gerne.
Sie haben gerade gesagt, dass Sie aus den Fehlern lernen wollen und Verbesserungen anstreben. Nun habe ich eine ganz konkrete Frage: Wie schätzen Sie es ein – darüber wird auch heute wieder in der „Tagesschau“ berichtet –, dass die Reihenfolge bei der Impfpriorisierung häufig verletzt wurde mit der kleinen Ausrede: Da sind ja Impfdosen übrig geblieben. – Aber man weiß von vielen Fällen, in denen sich schon vor Beginn der Impfungen Landräte, Bürgermeister usw. haben impfen lassen, wo dann einfach gesagt wurde: Na ja, da ist was übrig geblieben, lasst uns mal schnell impfen.
Wir haben am Mittwoch im Ausschuss mit dem Minister darüber gesprochen, und der hat gesagt: Da hat man keine rechtliche Handhabe, um das, ich sage mal, zu bestrafen, oder wie auch immer. – Ist das aus Ihrer Sicht ein Feld, auf dem man zu Veränderungen kommen müsste? Wenn ja, welche Veränderungen würden Sie vorschlagen? Wenn nein, warum nicht?
Frau Kollegin Lötzsch, das ist ein ganz wesentlicher Punkt, warum wir darauf achten müssen, dass wir hier im Parlament die wesentlichen Fragen, die grundrechtsrelevant sind, selbst entscheiden und darüber hinaus der Bundesregierung bzw. in diesem Fall dem Bundesminister durch Verordnungsermächtigung die Möglichkeit geben, spezifisch auf die Herausforderungen zu reagieren. Wir tun das im Übrigen auch mit dem Gesetzentwurf, der heute eingebracht wird. Damit schaffen wir die Voraussetzungen, dass auf dieser Grundlage ausbuchstabiert werden kann, wie die Impfziele und die Impfpriorisierungen ganz konkret umgesetzt werden.
Den Fall, den Sie beschreiben, finde ich bedauerlich; das muss ich ganz ehrlich sagen. Ich finde das nicht nur bedauerlich, sondern das ist dort, wo es einen Missbrauch gibt, auch in höchstem Maße unsolidarisch und natürlich maximal unklug. Das kann man nicht anders formulieren. Das gilt insbesondere dann, wenn diejenigen, die an Regeln mitarbeiten, sie selber zu ihren eigenen Gunsten brechen. Das ist absolut indiskutabel.
Ich glaube, dass wir neben diesen Grundsätzen auch Flexibilität brauchen, um sicherzustellen, dass nicht am Ende eines Tages Impfdosen ungenutzt in der Ecke stehen bleiben. Deshalb kommt es darauf an, dass man durchaus auch definiert, wie man in solchen Fällen vorgeht. Ich denke da beispielsweise an Polizistinnen und Polizisten, die im Streifendienst sind, die jederzeit erreichbar sind, die im Feuer stehen und unmittelbar konfrontiert sind mit Situationen, in denen sie Kontakten nicht ausweichen können.
Dort müssen wir mehr tun, schneller impfen. Das ist eine Möglichkeit, damit umzugehen.
Ich will mich im Weiteren auf die grundsätzlichen juristischen Bemerkungen konzentrieren, weil wir nachher noch sehr gute Redner haben, die die übrigen Aspekte dieses Gesetzentwurfs beleuchten können.
Ich kann beispielsweise nicht verstehen, warum man hier bemängelt, dass die Evaluierungsvorschrift, die wir ins Gesetz reinnehmen, nicht stark genug und dass sie zu langwierig sei. Warum denn eigentlich? Tun Sie doch nicht so, als ob die Bundesregierung, die Bundestagsfraktionen – die Regierungs- wie die Oppositionsfraktionen – nicht permanent auch wissenschaftlichen Rat einholten, und zwar nicht nur von Virologen und Epidemiologen, sondern natürlich interdisziplinär.
Was kann falsch daran sein, dass wir neben der jederzeitigen Kontrolle und Überarbeitung dessen, was wir tun, auch längerfristig, also in den nächsten zwölf Monaten, externen wissenschaftlichen Rat einholen? Dazu muss sich die Bundesregierung verhalten, und dazu muss sich auch dieses Parlament verhalten. Das ist doch ganz selbstverständlich.
Frau Kollegin Rottmann vom Bündnis 90/Die Grünen würde auch gerne eine Zwischenfrage stellen.
Sehr gerne, Herr Präsident.
Vielen Dank, dass Sie die Zwischenfrage zulassen. – Sie sagen: Es ist doch gut, dass wir evaluieren. – Ich habe eine einzige Frage. Wir haben die ganze Zeit darüber geredet, dass die Inzidenzwerte dazu dienen, die Nachverfolgbarkeit von Kontakten in den Gesundheitsämtern zu ermöglichen. Der Wert, ab dem die Nachverfolgbarkeit nicht mehr funktioniert, ändert sich aber ständig. Warum brauchen wir jetzt eine Studie? Warum können wir nicht nach einem Jahr erklären: „Wie sind die Kapazitäten in den deutschen Gesundheitsämtern? Wie viele Kontakte können die ab welcher Inzidenz nachverfolgen?“, und darauf einen Stufenplan aufsetzen? Warum ist das nach einem Jahr nicht möglich? Das ist niemandem zu erklären.
Frau Kollegin Dr. Rottmann, zunächst einmal ist es so, dass wir in den vergangenen Monaten vieles dafür unternommen haben, dass die Kompetenzen und Möglichkeiten im staatlichen Gesundheitswesen verbessert werden und dass eine Nachverfolgung unter besseren Umständen gewährleistet werden kann.
Zum zweiten Punkt: Wo liegt die Schwierigkeit? Die Schwierigkeit liegt auch darin, dass wir es nicht nur mit einem Virus zu tun haben, sondern zunehmend auch mit Mutationen, die über eine höhere Infektiosität verfügen, die wir am Ende nicht einschätzen können. Da stehen wir vor der großen Gefahr, dass diese Mutanten auch in Deutschland – so wie wir es in anderen Ländern schon erlebt haben – die Oberhand gewinnen können.
Zur dritten Frage, die Sie gestellt haben, Frau Dr. Rottmann: Warum kann man nicht auf diesen Inzidenzen aufbauend einen Stufen- oder Perspektivplan entwickeln? Dazu muss man sagen, dass wir das im Grunde genommen im § 28a des Infektionsschutzgesetzes bereits getan haben.
Wir haben darin als Parlament klar definiert, ab welchen Inzidenzen und möglicherweise anhand welcher zusätzlicher Indikationen welche Maßnahmen durch die Bundesregierung und die Landesregierungen möglich sind. Das haben wir gemacht.
Ich will nicht ausschließen, Frau Dr. Rottmann, dass wir im parlamentarischen Verfahren auch dazu kommen, das noch etwas näher auszubuchstabieren. Sie haben mit Ihrem Anliegen ja recht, dass wir für die Menschen Perspektiven und eine Nachvollziehbarkeit brauchen. Das ist richtig und notwendig,
und deswegen können wir uns über solche Fragen auch im parlamentarischen Verfahren unterhalten.
– Frau Kollegin Haßelmann, natürlich tun wir das alles jetzt. Wir spielen doch nicht auf Zeit. Ganz im Gegenteil: Wir sind daran interessiert, dass die Dinge gut gelöst werden. Und da sind wir – ich habe es schon gesagt – auch an Zusammenarbeit interessiert.
Ich will noch kurz zwei Aspekte erwähnen. Der eine ist: Wir nehmen die doppelten und dreifachen Netze aus dem Gesetz raus. Wir haben Vorschriften im Infektionsschutzgesetz, die ausschließlich auf die Covid-19-Pandemie anzuwenden sind. Insofern brauchen wir zusätzliche Fristen wie beispielsweise im § 5 nicht, weil wir alles auf die Grundlage der Feststellung einer epidemischen Lage nationaler Tragweite stützen. Das haben wir am 25. März gemacht, und das haben wir am 18. November gemacht.
Wir sagen jetzt, dass diese Regelungen auslaufen, wenn der Bundestag nicht innerhalb von drei Monaten die Fortgeltung der epidemischen Lage beschließt. Das heißt: maximal drei Monate. Das kann natürlich auch kürzer sein, und es ist auch überhaupt kein Problem. Sie haben ja vollkommen recht. Wir haben in der letzten Sitzungswoche zehn Debatten zu Covid-19 gehabt,
