Bis jetzt kann ich Ihrem Gesetzentwurf nur attestieren: Neben dem fehlenden Handlungsbedarf ist jetzt noch ein gröberer handwerklicher Fehler hinzugekommen. Wagt man trotzdem noch einen Blick auf den Inhalt bzw. Ihre Analyse, dann wird der katastrophale Eindruck von Ihrem Machwerk leider völlig abgerundet. Sie behaupten, dass unser Bargeld aufgrund der Niedrigzinspolitik der Europäischen Zentralbank entweder abgeschafft oder zumindest benachteiligt werden würde; ich habe es extra noch mal im Protokoll der 124. Bundestagssitzung nachgelesen. Damals hat das Kollege Peterka, der gerade eben auch gesprochen hat, zum Besten gegeben.
Wenn Sie wirklich glauben, dass man durch eine Änderung des Artikels 14 Grundgesetz eine Geldwertstabilität hervorrufen würde, dann zeigen Sie damit, dass Sie nicht nur mit der Juristerei, sondern auch mit der Volkswirtschaftslehre auf Kriegsfuß stehen.
Niedrige Zinsen haben Sie übrigens auch in den USA, Japan und der Schweiz. Oder wollen Sie sagen, das läge auch an der EZB?
Zusammengefasst ist dieser Gesetzentwurf vollumfänglich abzulehnen. Hören Sie auf, die Menschen in unserem Land zu verunsichern in der Hoffnung, damit Stimmen zu fangen.
Verantwortungsvolle Politik geht anders.
Herzlichen Dank.
Danke. – Das Wort geht an Frank Schäffler von der FDP-Fraktion.
