Herr Präsident! Sehr geehrte Damen und Herren! Es ist ein sehr wichtiges Thema, das die FDP hier in die Debatte einbringt. Da ist zu sagen: Die individuelle Freiheit, Wohneigentum anzuschaffen, ist subjektiv und in einer freien Gesellschaft überhaupt nicht zu hinterfragen. Die psychologische und tatsächliche Sicherheit im Alter durch Wohneigentum ist nicht zu unterschätzen. Das ist ein wichtiger Baustein innerhalb unserer Gesellschaft, meine Damen und Herren.
Es wurde schon angedeutet: Beim Wohneigentum sind wir fast das Schlusslicht in Europa; hinter uns kommt nur noch die Schweiz. Bei uns wohnen 51,1 Prozent der Menschen im Eigenheim, im Vergleich dazu haben in Rumänien 95,8 Prozent Wohneigentum. Da müssen Sie mal in die Statistik gucken. So ist das. Wir sind also fast Schlusslicht in Europa. Da kann ich auch noch erwähnen, dass hier Sachsen das Schlusslicht unter den Flächenländern in Deutschland ist.
Meine Damen und Herren, Wohneigentum ist ja auch ein Spiegelbild der Ideologie in der Gesellschaft. Die berühmte Neiddebatte wird hier von einigen gerade auch beim Thema Wohneigentum aufgemacht. Was das ideologische Verhindern der Bildung von Wohneigentum angeht, sitzen hier zahlreiche Zeitzeugen einer bestimmten Partei. Sie haben miterlebt, was so alles passiert ist und wie der Wohnungsmarkt aussah, als es kein Wohneigentum gab, meine Damen und Herren.
Die DDR hat es uns vorgemacht. Wir hatten damals Bleileitungen, kaputte Abwasserrohre, kaputte Fenster und mit 6 Ampere abgesicherte Aluminiumleitungen. Das war ganz toll. Wer das miterlebt hat, der weiß, was passiert, wenn der Staat in diesem Bereich allein tätig wird.
Meine Damen und Herren, die Grünen kommen jetzt auch zu Wort. Herr Habeck wird zitiert: „Verbote sind die Bedingung für Freiheit“.
Ganz toll! Ich bin dankbar für die Formulierung. Damit wissen wir endlich mal wirklich genau, wo diese Leute stehen. Ich hoffe, dass einige Wähler wirklich mal überlegen, was das für eine Partei ist.
Herr Hofreiter möchte ja nun, dass gar keine Einfamilienhäuser mehr gebaut werden. Er will in die Höhe bauen, weil wir ja so wenig Platz haben. Ja, warum haben wir denn so wenig Platz? Weil einige hier in diesem Haus Deutschland zum Einwanderungsland erklärt haben.
So ein Blödsinn! Ein Einwanderungsland hat Fläche, meine Damen und Herren,
und die haben wir gerade nicht. Das haben Sie damit bestätigt. Australien, die USA, Kanada usw., das sind Einwanderungsländer. Aber so weit können Sie ja nicht denken.
Es geht aber noch weiter; denn es wird durch diese Darstellung ergänzt: „Vermieter“ ist gleich „reich“, „Mieter“ ist gleich „arm“. – Ich sagte es schon: Das ist die sogenannte Neiddebatte.
