dass Sie wegen dieser Formalie, die wir in die Einleitung reingeschrieben haben,
eine effektive Maßnahme zur Rettung der Arbeitsplätze in diesem Land ablehnen.
Ist das Ihr Ernst? Das müssen Sie den Arbeitnehmern mal erklären.
Ich fahre mit meiner Rede gerne weiter fort.
Der zentrale Punkt hier ist die Anrechenbarkeit von synthetischen Kraftstoffen. Das ist etwas Vernünftiges, was in Ihrem Antrag steht; es steht auch erstmalig drin. Aber ich möchte noch mal betonen: Machen Sie bitte ehrliche Politik. Lassen Sie uns gemeinsam für den Erhalt des Verbrennungsmotors kämpfen, und lassen Sie Ihre Lobbypolitikansätze weg. Dann werden wir uns ernsthaft mit Ihrem Antrag beschäftigen; das machen wir zwar sowieso, aber dann denken wir auch darüber nach, ob wir dem zustimmen können und ob wir hier gemeinsam im Parlament eine Initiative einbringen können.
Vielen Dank.
Das Wort geht an Ulli Nissen von der SPD-Fraktion.
