Also manche graben ja hier echt einen Tunnel, um das Niveau immer noch ein Stück weiter zu senken.
Sehr geehrte Frau Präsidentin! Werte Kolleginnen und Kollegen! Wer im Glashaus sitzt, der sollte nicht mit Steinen werfen. Haben die Antragstellenden eigentlich nicht aufgepasst, als ihre Eltern versucht haben, ihnen das beizubringen?
Sie wollen also Indymedia verbieten. Was nervt Sie denn eigentlich so an dieser Seite?
Dass da in Teilen tatsächlich sehr kritikwürdige Inhalte veröffentlicht werden, weswegen die ursprüngliche Seite ja auch abgeschaltet wurde?
Oder ärgert Sie vielmehr, dass da jemand ist, der Ihnen auf die Finger schaut,
der zu Ihnen und Ihresgleichen recherchiert,
der Netzwerke aufdeckt, die Sie nur zu gerne verbergen wollen?
Kollegin Rüthrich.
