Wenn man es denn wirklich ernst meint, dann sollte man insgesamt eine Diskussion führen. Ich glaube, diese Diskussion sollte eine Bürger/-innenversammlung führen; denn wenn man seine eigenen Regeln macht, dann ist man immer befangen. Wenn wir also eine Bürger/-innenversammlung brauchen, dann zu diesem Thema – eine Versammlung, die Vorgaben macht. Ich glaube, dann haben wir eine Chance, hier wirklich etwas umzusetzen, über Parteigrenzen und über Fraktionsgrenzen hinweg.
Das ist das nächste Problem. Wenn es nicht wieder nur um Parteitaktik gehen würde, dann würden Sie heute diesem Antrag zustimmen oder den anderen Anträgen, die von den Grünen und von anderen Fraktionen gekommen sind. Es geht aber wieder nur um Parteitaktik, um möglichst über den Wahlkampf zu kommen. Und das ist eben keine Glaubwürdigkeit.
Stimmen Sie den anderen Anträgen zu! Stimmen Sie auch den Petitionen zu! Es gibt mittlerweile fünf oder sechs Petitionen genau zu diesem Thema, die schon über 50 000 Unterschriften haben. Dann beschäftigen Sie sich mal mit diesen Petitionen und mit diesen Gruppen!
Warum haben Sie nicht den Parteikodex unterschrieben, den ich mit dem Kollegen Schick vor sieben Jahren ausgearbeitet habe? Wenn Sie glaubwürdig sein wollen, dann machen Sie bei den Initiativen mit und reden hier nicht so schön, sondern handeln endlich!
Vielen Dank.
Das Wort hat der Kollege Dirk Wiese für die SPD-Fraktion.
