Vor einigen Wochen durfte ich hier im Deutschen Bundestag auch über die besondere Situation von anerkannten Minderheiten sprechen, und mir liegt es sehr am Herzen, mich für diese einzusetzen. Ihre Bedürfnisse finden nämlich in direkten Abstimmungen kein Gehör
bzw. lassen sich nur sehr schwer in Kompromissen wiederfinden.
Die Deutschen hatten noch nie so viele Mitwirkungsmöglichkeiten wie jetzt. Auf kommunaler, auf Landesebene, ja, bei jedem Bauprojekt ist Bürgerbeteiligung erwünscht und wird auch sehr rege genutzt. Wir, die FDP-Bundestagsfraktion, wollen an dieser Stelle der Schwarzmalerei der AfD widersprechen: Wir finden die Organisation des Staates nicht perfekt, aber doch sehr gut, und trotzdem heißt das nicht, dass wir uns ausruhen sollten.
Was sind denn die Vorschläge der FDP? Erstens. Für Menschen, die jenseits der Teilnahme an Wahlen Verantwortung übernehmen wollen, muss es einen leichteren Zugang zu Bürger- und Volksentscheiden auf kommunaler und respektive Landesebene geben.
Das sind nicht nur hohle Phrasen. Das hat beispielsweise die FDP hier in Berlin gezeigt. Sie hat den Volksentscheid zum Erhalt des Flughafens Tegel unterstützt und auch ein positives Votum erhalten.
An diesem Beispiel lässt sich aber auch erkennen, warum Volksentscheide auf Bundesebene eben nicht praktikabel sind. In einer Stadt wie Berlin herrscht die Wohnungsverhinderungsmietendeckelpolitik, während in anderen Regionen Deutschlands die Landflucht droht.
Das bedeutet, dass ein bundesweiter Volksentscheid gar nicht die unterschiedlichen Lebensverhältnisse darstellen kann.
Zweitens möchte ich für die Möglichkeit des Petitionsverfahrens werben. Die FDP-Fraktion hat öfters angeregt, das Verfahren weiter zu digitalisieren und darüber hinaus die Möglichkeit des Bürgerplenarverfahrens zu schaffen. Es besteht ja für jede Petition, bei der über 100 000 Unterschriften gesammelt werden, die Möglichkeit, an Ort und Stelle im Plenum beraten zu werden.
Wir haben in Deutschland keinen Mangel an Partizipationsmöglichkeiten. Aber nein, Ihnen geht es doch nur um die Botschaft, die Sie schon so lange geplant haben: Die „Altparteien“ – welch furchtbarer rechter Sprech – verhindern, dass das Volk gehört wird. – Das wird genau die Botschaft Ihres kleinen YouTube-Filmchens für den heutigen Tag.
Frau Kollegin.
Auf die wehrhafte Demokratie, die dieses wunderschöne Land vor Leuten wie Ihnen schützt!
Herzlichen Dank!
Mahmut Özdemir, SPD, ist der nächste Redner.
