Herr Präsident! Meine Damen und Herren! Die politische Hygiene in Deutschland ist unter die Räder gekommen. Sie ist zum einen unter die Räder gekommen, was die Korruptionsfälle in den Altparteien angeht: nahezu täglich neue Fälle nimmersatter Altparteienkarrieren, zu denen Dutzende Fälle in der Vergangenheit hinzukommen. Die politische Hygiene ist aber auch unter die Räder gekommen, wo es um unsere Meinungsfreiheit geht, eines unserer zentralen Grundrechte. Und dieses zweiten Problems nehmen wir uns von der AfD mit unserem Gesetzentwurf an.
Zitat: „Ich garantiere die Freiheit der Rede, aber nicht die Freiheit nach der Rede.“ Diese Aussage wird dem afrikanischen Despoten Idi Amin zugeschrieben. Die Aussage – Zitat –: „Sie können in Deutschland eigentlich alles sagen. Man muss dann manchmal halt mit Konsequenzen rechnen“, stammt von einer zunehmend erfolglosen Sportmoderatorin des zwangsfinanzierten deutschen Rundfunks. Beide Aussagen oder Drohungen weisen Bezüge zum Zustand der Meinungsfreiheit in Deutschland auf. Dieser Zustand der Meinungsfreiheit in Deutschland ist schlecht. Er ist verdammt schlecht.
Unser Grundgesetz formuliert in Artikel 5 Absatz 1 – Zitat –:
Jeder hat das Recht, seine Meinung in Wort, Schrift und Bild frei zu äußern und zu verbreiten … Eine Zensur findet nicht statt.
Wie kann es also trotzdem sein, dass in den sozialen Medien gelöscht, zensiert und blockiert wird, dass die Schwarte kracht, dass sogar Reden von Abgeordneten des Deutschen Bundestages gelöscht und gesperrt werden und dass dem Löschmassaker von Facebook, Twitter, Instagram und Co weltweit pro Jahr über 100 Millionen Meinungen, in Deutschland etwa 20 Millionen, zum Opfer fallen, wobei das Wachstum in letzter Zeit exponentiell verlief?
Wie sind also diese Löschorgien mit der klaren Verfassungslage, die ich ja gerade mit Artikel 5 des Grundgesetzes zitiert habe, in Einklang zu bringen? Ganz einfach: Unser Grundgesetz bindet nur den Staat und nicht etwa Facebook und Co. Und weil unser Staat das weiß, hat er die Zensur ausgelagert, sozusagen privatisiert. Facebook und Co machen da, jedenfalls unterstützt durch milliardenschwere und steuergeldfinanzierte Regenbogenprogramme der bunten Zivilgesellschaft, der Amadeu-Antonio-Stiftung und anderer dubioser Akteure, gerne mit.
„Hass“ und „Hetze“ sind die Zensurwerkzeuge von heute und von gestern.
