Sehr geehrter Herr Präsident! Liebe Kolleginnen und Kollegen! Meine sehr verehrten Damen und Herren! Wir reden heute über Abgeordnetenbestechung und Abgeordnetenbestechlichkeit, ja, über Korruption. Ich will Ihnen ernsthaft sagen, dass ich zutiefst beschämt bin – zutiefst beschämt, dass Anlässe für eine solche Debatte sich in meiner eigenen Fraktion finden, nämlich bei ehemaligen Mitgliedern der CDU/CSU-Bundestagsfraktion.
Dazu möchte ich mir eine Vorbemerkung erlauben. Ich glaube, dass es wichtig ist, wie wir eine solche Debatte führen; denn das, was mich an diesen Fällen so wütend macht, ist – das wird Ihnen genauso gehen –, dass diese Fälle die Demokratie beschädigen. Am Ende wird es so laufen, dass sie vor allem der parlamentarischen Demokratie einen solchen Schaden zufügen, dass diese in eine echte Krise geraten kann. Deshalb ist es auch wichtig, wie wir über solche Fragestellungen diskutieren.
Herr Kollege, gestatten Sie eine Zwischenfrage des Kollegen Straetmanns?
Nein, wir sind spät dran. Herr Kollege, ich komme eh gleich noch zu Ihnen.
Es ist wichtig, wie wir darüber diskutieren. Am Ende des Tages sage ich Ihnen ganz ehrlich: Wenn wir es so machen, wie es heute die AfD oder Die Linke gemacht hat, dann müssen wir uns nicht wundern, wenn irgendwann im Land die Menschen eben nicht mehr unterscheiden und sagen: „Das war doch Partei XY“, sondern es dann heißen wird: Typisch Politiker.
Am Ende gilt dann auch eine Wahrheit, nämlich dass hier im Haus nur zwei Gruppierungen davon profitieren, wenn die Menschen der parlamentarischen Demokratie den Rücken kehren. Das sind nämlich die zwei extremen Randgruppierungen.
Ich will es noch mal sagen: Ich bin zutiefst beschämt,
auch als Mitglied der CSU und als CSU-Politiker, weil eben diese Debatte geführt wird über Fälle in meiner eigenen Gruppierung. Aber ich bin auch froh – der Kollege Jung hat es vorhin schön skizziert –, dass binnen 24 Stunden das Signal von beiden Parteispitzen kam, dass für solche Leute in unseren Reihen kein Platz ist.
Und auch das bitte ich in einer solchen Debatte nicht zu vernachlässigen.
Kollegin Bayram, irgendwie sind Sie vielleicht nicht auf der Höhe der Zeit, aber sowohl CDU als auch CSU haben schon umfassende Pakete vorgelegt, was wir machen werden, um diesen Vertrauensverlust in der Bevölkerung auszugleichen,
um Transparenz herzustellen und um Vertrauen zurückzugewinnen. Wir werden gerade als CSU ein Paket schnüren, das richtungsweisend sein wird
– hören Sie zu! – und das neue Maßstäbe setzt, und zwar für alle politischen Gruppierungen.
