Subsidiarität, Dezentralität, Entscheidungsfähigkeit in kleinen Einheiten vor Ort sind in komplexen, modernen Zeiten wichtiger denn je. Die Hattie-Studie aus dem Jahr 2009 hat genau das noch einmal gezeigt: Entscheidend für den Unterschied im Lernergebnis ist der Lehrer, seine Einstellung, wie er auf die Schüler zugeht und wie er seinen Beruf versteht.
Deswegen braucht der Lehrer Freiheit. Er braucht eines als Allerletztes: dass wir hier glauben, in Berlin ohne Komma und Punkt alles übernehmen zu wollen, weil wir anscheinend für alles zuständig wären. Subsidiarität und Dezentralität sauber neu durchdeklinieren – das ist das, was wir tun müssen.
Das gilt im Übrigen auch in Coronazeiten. Ich habe eine Tochter von acht und eine Tochter von zwölf Jahren, und ich kriege das mit so wie viele Eltern zu Hause. Da gibt es Lehrer, die sind herausragend trotz widriger Umstände. Und wieso sind sie das? Weil sie die richtige Einstellung haben. Weil sie trotz dieser widrigen Umstände einen genialen, bravourösen Fernunterricht machen. Ich weiß, dass die Umstände schwierig sind, dass das nicht zufriedenstellend ist. Aber es ist möglich, wenn man Lehrerinnen und Lehrer motiviert und unterstützt. Das ist die Schlüsselfrage.
Liebe Kolleginnen und liebe Kollegen, das heißt aber nicht, dass unsere Position wäre, dass der Bund nicht zuständig sei und keine Aufgaben hätte; ganz im Gegenteil.
Wir müssen uns sehr genau überlegen, was wir tun und wie wir es tun. Diese naive Sicht einiger linker Gruppierungen – im Übrigen gehört die FDP seit dieser Legislaturperiode inzwischen dazu –,
dass immer dann, wenn etwas nicht klappt, der Bund sofort in die Bresche springen muss, das ist der falsche Ansatz. Das ist Unsinn, weil es letztendlich das gesamte System durcheinanderbringt und das Problem nicht löst, sondern mehr Probleme schafft.
Die Aufgaben des Bundes nehmen zu. Aber es braucht klare Verantwortlichkeiten. Und wenn jeder für alles zuständig ist, ist zuletzt keiner verantwortlich und zuständig, sehr geehrte Damen und Herren.
– Ich sage nur: Das gehört auch zur Bildungspolitik dazu. Hier wird ständig ausschließlich über Schulpolitik diskutiert. Es geht um den Nationalen Bildungsbericht. Da geht es um weit mehr als um die Kerntätigkeiten von Schule.
Wir haben in den vergangenen Jahren mit großen Paketen Verantwortung übernommen: Wir geben für den Hochschulpakt bis 2023 20 Milliarden Euro an Bundesmitteln. Wir geben in den nächsten Jahren für die Hochschulen mit dem Zukunftsvertrag „Studium und Lehre stärken“ 2 Milliarden Euro jährlich. Wir haben für Innovation und Modernisierung in der beruflichen Bildung in den letzten drei Jahren während dieser Legislaturperiode so viel zusätzliches Geld gegeben wie Jahrzehnte nicht, liebe Kolleginnen und liebe Kollegen. Wir geben jetzt die 6,5 Milliarden Euro für den DigitalPakt Schule.
Und vielleicht eine Anmerkung: Ich war einer von denen, der vor fünf Jahren hier mit Ministerin Wanka gesagt hat: Wir stellen die 5 Milliarden Euro ins Schaufenster.
Von den Kolleginnen und Kollegen hier ist so etwas nicht gekommen. Von den Ländern, in denen Sie Verantwortung haben, gab es keinen Antrag im Bundesrat. Es war unsere Initiative. Aber wir erwarten schon, dass Sie bei der Umsetzung Ihre Arbeit machen.
Zum Geld. Was haben wir als Bund gemacht? Und dann schauen wir, ob das die ganze Nation hinkriegt. Wir haben vonseiten des Bundes seit 2005 die Bildungsausgaben von 4,4 auf 11 Milliarden Euro erhöht. Das ist eine Steigerung um 150 Prozent. Das Land Brandenburg hat im selbigen Zeitraum die Gelder um 72 Prozent erhöht – um nur ein Beispiel zu nennen. Also, reden Sie nicht über uns, sondern reden Sie dort, wo Sie Zugang haben, mit denen, die da Verantwortung tragen!
Wenn alle das machten, was wir, seit wir an der Regierung sind, machen, dann wären das gute Zeiten in diesem Lande. Deswegen abschließend: Ja, der kooperative Föderalismus muss weiterentwickelt werden.
Natürlich macht es keinen Sinn, dass jedes Bundesland eine eigene Schul-Cloud hat. Deswegen haben wir auch in den letzten zwei Legislaturperioden die Verfassung geändert, 2014 den Artikel 91b – seither können wir uns an der Grundfinanzierung der Hochschulen beteiligen – und 2019 den Artikel 104c hinzugefügt. Seither können wir die Schulen bei Digitalisierung, Betreuungsangeboten und Weiterem mehr unterstützen.
Wir werden auch in der nächsten Legislaturperiode die Zuständigkeiten weiterentwickeln. Ralph Brinkhaus hat recht, wenn er sagt: Corona hat uns gezeigt, dass die Zusammenarbeit auf den staatlichen Ebenen grundlegend verbessert werden muss. – Genau das werden wir tun, nicht aktionistisch, beliebig und nach dem Motto „Jeder ist für alles zuständig“, sondern indem wir genau überlegen, was unsere Aufgabe auf Bundesebene sein soll, was wir weiterentwickeln müssen. Dann werden wir genau diese Reform des Staatswesens machen – nicht aktionistisch, sondern klug und vernünftig.
Danke schön.
Vielen Dank, Albert Rupprecht. – Nächste Rednerin: für die AfD-Fraktion Nicole Höchst.
