Sehr geehrte Frau Präsidentin! Liebe Kolleginnen und Kollegen! Es bleibt mir nur übrig, zu sagen: „Schlimmer geht nimmer“, nachdem ich das gehört habe, was von der FDP gerade –
– Entschuldigung! –,
von der AfD gerade vorgetragen wurde.
Ich finde, in der Krise ist kein Platz für Polemik und ist auch kein Platz für Panikmache aus der rechten Ecke.
Denn damit, meine sehr geehrten Damen und Herren, werden diejenigen verhöhnt, die leiden, die ihre Verwandten verloren haben und die jetzt noch immer unter den Folgen leiden. Sie müssen denen Respekt zollen. Das fehlt mir von der AfD hier in diesem Haus vollkommen.
Ich möchte Sie jetzt aber einmal wieder etwas mehr in die Realität zurückholen. Diese ganzen Gespinste, die Sie gerade aufgebaut haben, entbehren jeder Realität.
Vergleichen wir einmal Deutschland mit Europa: Wie stehen wir denn da? Bei den Inzidenzen im unteren Bereich, auch wenn wir die 100 überschritten haben.
Schauen Sie einmal in die Liste.
