Herr Präsident! Meine Damen und Herren! In den letzten Jahrzehnten hat sich das Leitbild der karriereorientierten berufstätigen Frau in der Gesellschaft offensichtlich durchgesetzt. Es liegt deshalb in der Natur der Sache, dass dem Arbeitsmarkt langsam eine wachsende Zahl von hochqualifizierten Mitarbeiterinnen zur Verfügung steht. Und selbstverständlich soll und wird sich das künftig auch in der Besetzung von Aufsichtsräten und Vorständen widerspiegeln. Dagegen ist auch überhaupt gar nichts einzuwenden.
Einzuwenden ist etwas gegen den Weg dorthin, der von Ihnen immer wieder propagiert wird; denn dies ist ein Weg staatlichen Dirigismus, mit dem Sie Ihre Vorstellungen um jeden Preis erzwingen wollen:
Frauenquoten für Aufsichtsräte, Frauenquoten für Vorstände und Frauenquoten selbstverständlich am Ende auch für die Parlamente. Mit Letzterem sind Sie nunmehr bereits dreimal vor den Verfassungsgerichten gescheitert. Die Verfassungsgerichte Thüringen, Brandenburg und auch das Bundesverfassungsgericht haben einer Vorauswahl aufgrund des Geschlechtes eine klare Absage erteilt.
Und was für Parlamente gilt, kann durchaus auch auf andere Bereiche übertragen werden. Aufsichtsräte sind verpflichtet, zum Wohle des Unternehmens Vorstände ausschließlich nach ihrer Qualifikation auszuwählen.
Das Geschlecht hat dabei überhaupt keine Rolle zu spielen, und das tut es auch nicht.
Dieter Rickert, der von der „Frankfurter Allgemeinen“ als Altmeister der Headhunter beschrieben wird, schildert die Situation wie folgt – ich zitiere mit Erlaubnis des Präsidenten –:
Seit 40 Jahren stelle ich als Personalberater bei jeder Suche die Standardfrage: „Darf es auch eine Frau sein?“ Die Antwort lautet stets: „Finden Sie eine! Wir nehmen die Person mit der besten Qualifikation. Geschlecht egal.“
Er sagt weiter:
