Frau Präsidentin! Liebe Kolleginnen und Kollegen! Meine Damen und Herren! Ich habe mein Redemanuskript jetzt auch mal beiseitegelegt, Herr Rehberg. Das ist nämlich hier und heute schon ein unglaublicher Vorgang.
Das will ich hier deutlich sagen.
Ich beginne meine Rede erst einmal damit, dass ich Frau Brantner ausdrücklich dafür danke, dass sie eine sehr sachliche Einordnung des hier praktizierten Verfahrens vorgenommen hat und dass sie deutlich darauf hingewiesen hat, worin nämlich die Probleme liegen.
Dann will ich das auch noch mal sehr deutlich sagen: Ich bin Michael Roth, einem Staatsminister in dieser Bundesregierung, ausdrücklich dankbar dafür, dass er diese klaren Worte gewählt hat,
weil es nämlich darum geht, dass wir in der Europäischen Union einen Weg in die Zukunft wählen. Und da fehlt mir bei FDP und CDU/CSU jetzt mittlerweile auch jegliches Verständnis im Hinblick darauf, wo sie stehen.
Lieber Herr Rehberg, das ist keine Gewissensfrage Ihrer Fraktion, ob Sie dem heute zustimmen oder nicht, sondern es ist eine grundsätzliche Frage der Solidarität und der Zukunft der Europäischen Union.
