Der wirkliche Weg zu einem Erfolg besteht darin, die internationalen Akteure koordiniert zusammenzuführen und arbeiten zu lassen. Lassen Sie mich ganz kurz nur einige wenige der Akteure aufzählen, die heute schon mehrfach genannt worden sind: WHO, GFATM, GAVI, ACT-A, Covax. Jüngst wurde Covax allein durch die Bundesrepublik Deutschland um 1,5 Milliarden aufgestockt, und die USA haben Mittel angekündigt. – Das sind die Methoden, mit denen wir uns diesen Herausforderungen widmen müssen.
Das Entscheidende ist aber auch, dass die Rahmenbedingungen neben der reinen Beschaffung, dem Erwerb und der Verteilung des Impfstoffs gewährleistet sind. In der Anhörung gestern Nachmittag zum Thema der Patentrechte ist uns geschildert worden, dass es unter anderem eine wesentliche Voraussetzung ist, dass vor Ort Impfzentren oder Impfmöglichkeiten, aber vor allen Dingen auch die notwendigen Spritzen vorhanden sind. 5 Milliarden spezieller Spritzen fehlen zurzeit noch. Auch da ist UNICEF federführend und vorausschauend unterwegs und hat gestern die ersten Lieferungen vom Zentrallager in Dubai zu den Malediven auf den Weg gebracht; 30 weitere Länder werden kurzfristig mit Spritzen versorgt.
Aus gegebenem Anlass – lieber Herr Dr. Kessler, Sie reizen mich immer wieder mit diesem Thema – muss ich noch mal was zum Thema der Impfstoffe sagen.
Gestern haben wir in der ausführlichen Anhörung substanziiert vernommen, dass die Produktion des BioNTech/Pfizer-Impfstoffs eben nicht ein normaler chemischer Vorgang ist, sondern ein hochkomplexer Prozess: 160 Substanzen – größtenteils ebenfalls patentgeschützt, teilweise in der Lieferkette knapp –, 450 Schritte der Qualitätssicherung – 70 Prozent des Produktionsprozesses bestehen aus Qualitätskontrolle –, Fit and Finish, Verpackung, Logistik und entsprechende Belehrungen in der Verarbeitung sind wesentliche Bestandteile des Produktions- und Vertriebsprozesses. Und das kann eben nicht jedermann; das können nur Spezialisten. Also suggerieren Sie doch bitte nicht der ganzen Welt, es reiche, wenn man auf dem Schreibtisch zwei Reagenzgläser, eine Zentrifuge und einen Bunsenbrenner stehen hat und die Patenturkunde an der Wand hängt.
Auf diese Art und Weise kann man keine Premiumprodukte herstellen.
Herr Kollege, erlauben Sie eine Zwischenfrage aus der Fraktion der Linken von dem von Ihnen angesprochenen Kollegen?
Ja, bitte schön.
