Frau Präsidentin! Verehrte Kolleginnen! Verehrte Kollegen! Wir reden heute über Transparenz von politischen Entscheidungen,
so jedenfalls ist der Antrag überschrieben.
– So ist die Aktuelle Stunde bzw. der Antrag zur Einführung einer Aktuellen Stunde überschrieben; um ganz korrekt zu sein.
Frau Kollegin Haßelmann, Sie haben über eine Reihe von Kollegen, über eine Reihe von Vorfällen gesprochen, und das sehr zugespitzt. Das ist aber vollkommen in Ordnung. Das gehört zum politischen Geschäft.
Ich will dennoch ein paar Dinge differenziert darstellen. Es gibt Fälle, bei denen Ermittlungsverfahren durch die Staatsanwaltschaften eingeleitet wurden, und es gibt Fälle, die nicht – jedenfalls noch nicht; wie auch immer – strafrechtlich verfolgt werden. Ich sage – unabhängig davon, ob die Vorgänge strafrechtlich relevant sind oder nicht –: Mein Verständnis und das Verständnis meiner Fraktion ist, dass wir als Abgeordnete diesem Land dienen und dass wir nicht den Eindruck erwecken dürfen, in Notsituationen durch Geschäfte mit Masken zu verdienen oder gar unanständig zu verdienen.
Meine Damen, meine Herren, es gibt Ermittlungsverfahren. Die Vorwürfe, die erhoben worden sind, wiegen schwer. Wir erwarten, dass unverzüglich und vollumfänglich aufgeklärt wird. Daran arbeitet die Justiz; aber wir sehen auch die betroffenen Kollegen in der Pflicht, aufzuklären und für Transparenz zu sorgen.
Aber ich sage auch eines: Der Rechtsstaat macht an der Tür dieses Hauses nicht halt. Deshalb gilt in diesem Verfahren auch für Politiker die Unschuldsvermutung. Deshalb dürfen wir hier keine Vorverurteilungen vornehmen. Deshalb bitte ich darum, dass wir die Debatte sachlich führen; denn das Thema ist in der Tat sensibel, und der Schaden, der da angerichtet wird, auch durch das Verhalten Einzelner, ist enorm. Vorverurteilungen feuern Ressentiments gegenüber den politischen Institutionen aber nur an, und das hilft uns allen nicht.
Lassen Sie mich auch etwas zu dem Thema Transparenz sagen. Es ist wichtig – in der Tat –, dass die Gesellschaft Vertrauen in Institutionen und in uns als Politiker hat, und das gibt es nicht ohne das notwendige Maß an Transparenz. Ich glaube, das ist auch gar nicht strittig. Es geht gar nicht um das Ob, sondern es geht um das Wie, und es geht um die Grenzen der Transparenz. Transparenz ist wichtig, aber sie ist kein Selbstzweck. Deshalb geht es uns darum, Interessenkonflikte, denen ein Abgeordneter vielleicht ausgesetzt ist, offenzulegen und erkennbar zu machen.
Was wir aber nicht wollen – ich sage das jetzt unabhängig von diesen Fällen; aber es gilt dafür genauso –: Wir wollen nicht den gläsernen Abgeordneten, den komplett gläsernen Abgeordneten.
Wir wollen auch kein generelles Verbot von Nebentätigkeiten.
