Sie sprachen eben davon, dass es ein Kompliment ist, dass jemand die deutsche Staatsbürgerschaft haben will. Können Sie sich auch vorstellen, dass die deutsche Staatsbürgerschaft haben zu wollen kein Kompliment an die deutsche Bevölkerung ist, sondern, im Gegenzug, eine Migration, eine dauerhafte Einwanderung in unsere Sozialsysteme darstellt?
Wem wollen Sie unsere Staatsbürgerschaft verleihen? Ich habe jüngst, heute Morgen noch, gelesen: Ein Syrer mit 4 Frauen und 23 Kindern kostet den deutschen Steuerzahler schon jetzt im Jahr 400 000 Euro Alimentierung, ohne je einen einzigen Cent eingezahlt zu haben. Wollen Sie solchen Menschen unsere Staatsbürgerschaft hinterherwerfen? Kommen Sie in der Realität an! Setzen Sie Ihre schwarz-grüne Brille einfach mal ab, Herr Amthor!
Herr Keuter, ich danke Ihnen für den Hinweis, dass Sie nicht nur Ihre Unkenntnis im Staatsangehörigkeitsrecht, sondern auch die im Sozialrecht unterstrichen haben;
das wird nämlich in dieser Frage sehr deutlich. Und nicht nur das: Auch Zuhörschwäche scheinen Sie zu haben. Ich habe nämlich darauf hingewiesen, dass wir mit der Reform des Staatsangehörigkeitsrechts eine Einbürgerung von Menschen in Mehrehe explizit ausgeschlossen haben.
Ich weiß nicht, was Sie für Zerrbilder haben. Niemand will solche Einbürgerungen. Das, was wir machen, ist konkrete Politik. Was Sie machen, ist oberflächliches Geschwätz, und das merken die Menschen.
Meine Damen und Herren, ich will Ihnen noch mal deutlich sagen: Bevor die AfD hier Vorschläge macht, wie man nun mit einbürgerungswilligen Ausländern umgeht, sollten Sie selbst hinterfragen, ob Sie die Voraussetzungen erfüllen. Da finde ich besonders spannend: Sie verlangen von allen Ausländern, die eingebürgert werden wollen, ein Bekenntnis zur freiheitlich-demokratischen Grundordnung. Total richtig! Das ist auch Praxis. Ich kann nur sagen: So ein Bekenntnis zur freiheitlich-demokratischen Grundordnung würde ich mir von manchen in Ihren Fraktionen befindlichen staatlich geprüften Rechtsextremisten wünschen.
Das ist doch die Realität. Was Sie hier aufführen, ist scheinheilig.
