Was fällt Ihnen nach einem Jahr an Verbesserungen ein? Der Bundestag soll nun die epidemische Lage im Dreimonatsrhythmus beschließen. Tut er es nicht, gelten auch alle Verordnungen, die seit Anfang 2020 in Kraft getreten sind, nicht mehr, also auch Krankenhausfinanzierung, Arbeitsschutz usw. Das ist doch lediglich eine Scheinbeteiligung des Parlaments;
Regieren per Verordnung bleibt weiter möglich. Das ist mit uns nicht zu machen, und deshalb lehnen wir das ab.
Was bezüglich der Akzeptanz der Bevölkerung ein genauso großes Problem ist wie die fehlende Transparenz, ist die fehlende Strategie. Im Vorfeld und auch im Nachgang dieser Ministerpräsidentenkonferenz wird – so würde man es zumindest in Bayern sagen – regelmäßig eine andere Sau durchs Dorf getrieben. Jeder und jede hat andere Ideen und andere Vorschläge. Der eine erzählt, dass der Osterurlaub nicht möglich ist, der Nächste erzählt was von bedeutenden Schritten der Öffnung, die es demnächst geben wird. Die Inzidenzwerte, die gestern diskutiert wurden, die für die Öffnungen maßgeblich sind, schwankten im Stundentakt zwischen 35, 50 und 100. Es ist nicht mehr nachvollziehbar.
Die bisherigen Öffnungsschritte muten zumindest seltsam an. Während aktuell noch ganze Schulklassen in Homeschooling sind, haben Friseure seit 1. März wieder geöffnet. Ich habe nicht grundsätzlich etwas dagegen. Aber warum ausgerechnet Friseure,
und warum ausgerechnet zum 1. März? Und warum sind eigentlich bayerische Baumärkte weniger infektiös als andere? Ich sage Ihnen: Das ist alles nicht logisch. Das ist Willkür und keine Strategie.
Wir sind uns einig: Alle Freiheitseinschränkungen müssen so schnell wie möglich aufgehoben werden. Aber für Öffnungsszenarien sind Kontaktnachverfolgung, ein breiter Zugang zu Impfstoffen und Schnelltests nötig. Und bei all diesen Punkten hat die Bundesregierung bislang versagt.
Die Corona-Warn-App hat gefloppt, und die Gesundheitsämter sind über einen viel zu langen Zeitraum runtergespart worden, sodass die Kontaktverfolgung erschwert wurde. Ausreichender Impfstoff steht nach wie vor nicht zur Verfügung, auch weil sich die Bundesregierung standhaft weigert, die Lizenzen freizugeben.
Und auf die angekündigten Schnelltests und Selbsttests warten wir noch, während unsere österreichischen Nachbarn damit schon lange arbeiten.
Ja, natürlich ist die Lage dynamisch. Aber ein Jahr nach der Pandemie können die Menschen in diesem Land doch erwarten, dass Sie Ordnung in dieses Chaos bringen.
Und dazu gehören ein im Parlament – und ich betone: im Parlament – beschlossener Stufenplan, der regelt, welche Einschränkungen und welche Bedingungen gelten, und eine hier beschlossene Impf- und Teststrategie. Das alles fehlt in Ihrem Gesetzentwurf. Nach zwölf Monaten hätte ich wirklich mehr erwartet.
Ich erwarte von dieser Bundesregierung auch, dass sie die Weichen für die Zukunft anders stellt. Wir brauchen Investitionen ins Bildungssystem. Das, was in dieser Pandemie mit Kindern und Jugendlichen passiert ist, darf nie wieder passieren.
Und der Gesundheits- und Pflegebereich muss endlich der Marktlogik entzogen werden. Es ist doch völlig irre, dass im letzten Jahr 20 Krankenhäuser geschlossen worden sind.
Abschließend bitte ich Sie, unserem Entschließungsantrag für eine Lohnersatzleistung für die pflegenden Angehörigen zuzustimmen; denn es sind Menschen, die sehr häufig vergessen werden, und sie brauchen unbedingt ein soziales Sicherungsprogramm.
Vielen Dank.
Nächste Rednerin ist die Kollegin Maria Klein-Schmeink, Bündnis 90/Die Grünen.
