Wir werden einen Antrag einbringen, der die Rechte des Haushaltsausschusses des Deutschen Bundestages noch mal manifestiert;
sie sind aus meiner Sicht schon ausreichend durch Bundesverfassungsgerichtsurteile und durch die Rechtsetzung des Deutschen Bundestages gegeben.
Liebe Kolleginnen und Kollegen, ich kann zum Schluss nur die Hoffnung zum Ausdruck bringen, dass das Geld sinnvoll verwendet wird. Und wir als Deutsche werden am meisten davon profitieren, auch wenn wir – ja, das ist richtig – gut viermal mehr einzahlen, als wir letztendlich zurückbekommen. Aber diese Nettozahlerdebatte zum Mehrjährigen Finanzrahmen: Wer hat denn in den letzten Jahrzehnten am meisten von Europa profitiert? Wer hat denn in den letzten Jahrzehnten am meisten vom Euro profitiert?
Das sind doch wir Deutsche! Ein großer Teil unseres Wohlstandes basiert auf dem Europas
und nach dem Fall der Mauer auf dem größer gewordenen Europa und auf dem Euro.
Herzlichen Dank.
Jetzt erteile ich das Wort dem Kollegen Otto Fricke, FDP.
