Sehr geehrte Frau Präsidentin! Liebe Kolleginnen, liebe Kollegen! In der Pandemie müssen Grenzkontrollen, Eingriffe in die Freizügigkeit durch den Infektionsschutz begründet, epidemiologisch sinnvoll und vor allem gut koordiniert sein. „Ja, was auch sonst“, könnte man sich da fragen.
Aber genau deswegen ist die Begründung der Bundesregierung für das, was sich aktuell an den Grenzen zu Österreich und Tschechien abspielt, ja auch so interessant; denn die Lage in diesen beiden Ländern ist nicht wesentlich anders als zum Beispiel in Frankreich an den Grenzen zu Rheinland-Pfalz und dem Saarland.
Und doch gibt es zu Frankreich keine Grenzkontrollen, was die Bundeskanzlerin gestern beim EU-Gipfel auch ausdrücklich ausgeschlossen hat, zu Österreich und Tschechien aber schon.
Den Grund dafür hat sie auch gleich genannt: Denn anders als Rheinland-Pfalz und Saarland, hätten Bayern und Sachsen ausdrücklich um Grenzkontrollen gebeten.
Meine Damen und Herren, ich finde das unerhört! Pandemiebekämpfung ist doch kein Wünsch-dir-was einzelner Staatskanzleien,
sondern muss sich daran orientieren, was im Sinne des Infektionsschutzes, Herr Wendt, wichtig ist und was auch nach Abwägung der Rechtsgüter möglich ist. Also entweder ist es angesichts der Situation in diesen Ländern sinnvoll, oder es ist nicht sinnvoll. Aber dann darf man auch nicht mit zweierlei Maß messen.
Man kann doch mit der europäischen Freizügigkeit nicht umgehen, wie es einem gerade passt. Da ist es auch kein Wunder, dass die Europäische Kommission die Bundesregierung dafür kritisiert hat. Dabei hätte die Bundesregierung nach rund einem Jahr Pandemie und dem ständigen Ringen um die richtigen Konzepte da viel weiter sein können. Genau das ist das Problem. Seit rund einem Jahr liegt das Bundesinnenministerium im Tiefschlaf und verfällt in Aktionismus, wenn es daraus irgendwann einmal aufwacht.
