Wir brauchen jetzt konkrete Initiativen. Entgeltliche Lobbyarbeit muss endlich gestoppt werden, und wir brauchen viele weitere Punkte zur Verschärfung der Parteienfinanzierung. Dazu haben wir heute einen Antrag vorgelegt.
Kollegin Haßelmann, es tut mir leid. Sie müssen zum Schluss kommen.
Wissen Sie, dass wir heute darüber abstimmen? Wir haben einen Antrag hier vorliegen, über den wir sofort abstimmen können, der sämtliche Forderungen zu Transparenz und Veröffentlichungspflichten enthält.
Die können bitte bis zur Abstimmung noch nachgelesen werden, aber nicht mehr vorgetragen werden.
Darüber können wir heute abstimmen.
Das Wort hat Dr. Volker Ullrich für die CDU/CSU-Fraktion.
