Damit komme ich zu den zwei anderen Punkten, die eigentlich gut dazu passen. Jetzt haben Sie einen Kinderbonus beschlossen, haben sich dafür auch gefeiert. Ich finde, das ist ein sehr halbherziger Schritt. Eltern sind unter Dauerbelastung, und Sie reagieren darauf mit einer Einmalzahlung. Nein, ich finde nicht, dass das reicht. Übrigens, eine Gruppe trifft es besonders stark, das sind nämlich die ALG-II-Empfängerinnen und -Empfänger.
Die brauchen keine Einmalleistung, sondern sie brauchen eine dauerhafte Unterstützung während des Shutdowns.
Da bin ich komplett bei allen Sozialverbänden in diesem Land. Beschließen Sie einen Zuschlag für die Familien in Hartz IV! Für sie fällt die Infrastruktur weg. Es gibt kein Mittagessen in der Kita, es gibt nicht mehr die Ganztagseinrichtungen, nicht mehr den Hort. Sie sind auf sich selbst gestellt. Und nein, sie können kein Geld sparen; denn einen Urlaub hätten sie sich vorher schon nicht leisten können, und den werden sie jetzt auch nicht einsparen können. Sie brauchen unsere Solidarität und Unterstützung. Da sollten wir Farbe bekennen, liebe Kolleginnen und Kollegen.
Leider kann ich nichts mehr zu dem Bereich Schule sagen, obwohl ich das wollte. Aber der Präsident hat hier natürlich das Sagen. Nur noch so viel: Wir sollten nicht Pingpong spielen zwischen Bund und Ländern, sondern uns der Sache annehmen. Ich finde es, ehrlich gesagt, wirklich beleidigend, wie hier immer die Schuldzuweisungen hin- und hergeschoben werden. Wir sind es unseren Kindern und Eltern schuldig, hier nicht nur Schuldzuweisungen zu präsentieren.
Vielen Dank, Frau Kollegin. – Auch damit haben Sie es geschafft, 30 Sekunden zu überziehen; auch in Ordnung.
– Alles gut.
Nächste Rednerin ist die Kollegin Bettina Margarethe Wiesmann, CDU/CSU-Fraktion.
