Frau Präsidentin! Verehrte Kolleginnen und Kollegen! Für die heutige Debatte mit den heutigen Anträgen ist die politische Aufstellung klar. Die AfD würde sagen: viel zu viel in die Schiene, aber ohne Konzept. Die FDP würde mehr liberalisieren und fordert mehr Wettbewerb. Dies ist ihr altbekanntes Konzept.
Die Linke würde am liebsten rückverstaatlichen, und der Bund solle den ÖPNV am besten auch noch machen.
Das ist ein Konzept aus einem anderen Jahrtausend. Den Grünen reicht das alles nicht. Aber wenn es konkret wird, dann wird es unkonkret bei den Grünen.
Wenn nämlich die Großprojekte ins Zentrum rücken, beispielsweise der Brenner-Nordzulauf oder die Fehmarnbeltquerung, dann ist man schnell dagegen. Das ist ein Konzept von Philosophen.
Ich stelle fest: Diese Koalition macht eine gute und moderne Bahn- und Schienenpolitik.
Wir handeln nach dem Motto „kein Weiter-so, sondern ein Richtig-so – modernisieren, investieren, digitalisieren, harmonisieren, priorisieren“.
