Vielen Dank, dass Sie die Zwischenfrage zulassen. – Sie haben hier gerade von 500 Milliarden Euro gesprochen, die Sie ausgeben wollen. Wie wollen Sie denn das finanzieren?
Super, vielen Dank, Herr Kollege, dass Sie die Frage stellen. Es wäre super, wenn die Uhr solange nicht weiterlaufen würde. – Vielen Dank.
Wir haben gerade gesagt, dass wir für ein solches Infrastrukturinvestitionsprogramm einen vernünftigen Vorschlag gemacht haben, die Schuldenbremse im Grundgesetz zu erweitern.
Das heißt ganz explizit nicht, sie abzuschaffen, sondern sie um eine Infrastrukturinvestitionsergänzung zu erweitern. Das heißt: Nettoinvestitionen, die der Staat tätigt, um die Infrastruktur der Zukunft zu bauen, können über Kredite finanziert werden. Das ist haushaltspolitisch vernünftig. Das fordern nicht nur wir. Beispielsweise hat uns diese Woche auch Herr Hüther vom Institut der deutschen Wirtschaft auf Twitter dazu gratuliert und gesagt: Das, was die Grünen vorschlagen, muss man wirtschaftspolitisch machen.
Was Sie machen, ist eine falsch verstandene Haushaltspolitik. Sie sagen, Sie wollen einen Schuldenbremsenturbo, Sie stellen die schwarze Null als Symbol einer Haushaltspolitik über die wirtschaftspolitische Vernunft. Denn wie entsteht denn Wirtschaftswachstum? Wenn man eine Infrastruktur hat, die funktioniert; wenn auch im ländlichen Raum das Breitbandinternet da ist und nicht die Unternehmer sagen: Wir würden ja gerne digitale Geschäftsmodelle anbieten, aber das Internet kommt bei uns leider nicht an. – Wenn der Netzausbau beschleunigt wäre, dann hätten wir hier irgendwann auch eine funktionierende Energiewende. Dann könnten wir irgendwann auch sagen: Wir schaffen die Wasserstoffinfrastruktur, die die Industrie so dringend braucht, die Chemieindustrie, die Stahlindustrie.
Für all das braucht man staatliche Infrastrukturinvestitionen.
Auf der einen Seite sagen Sie immer nur, 3 Prozent des Bruttoinlandsproduktes wollen Sie allein durch Steuersenkungen dem Bundeshaushalt entziehen.
Ich gehe davon aus, die Frage ist jetzt beantwortet.
Auf der anderen Seite sagen Sie an keiner Stelle, wo das Geld herkommt. Das ist nicht nur haushaltspolitisch unsolide, das ist auch wirtschaftspolitisch kein Konzept für die Zukunft.
– Genau, noch eine Frage, dann käme ich noch zur Handelspolitik. Vielleicht schaffe ich das noch ganz kurz.
Sie haben gesagt: Handelspolitik ist wichtig.
Das sagen wir auch. Dann reden Sie über die Partnerschaft mit den USA, aber das Einzige, was Sie dazu sagen, ist: Sie wollen das Alte wie bisher. Wenn Sie sich aber anschauen, was Joe Biden macht, dann hätten Sie das Wort „Klimaschutz“ in Ihrem Antrag erwähnen müssen. Aktuell wäre mit den USA ein transatlantisches Abkommen realistisch, das Klimaschutz in den Mittelpunkt stellt, das eine Antwort auf die Frage gibt, wie die Industrie zukunftsfähig ist. Das ginge zum Beispiel, indem man durch Grenzausgleichsmechanismen funktionierende Klimazölle schafft, um die Wettbewerbsfähigkeit einer klimaneutralen Industrie zu garantieren. Das ist etwas, was mit Joe Biden möglich ist. Mit Sicherheit gilt das nicht für die Ideen, –
Liebe Kollegin, kommen Sie zum Ende.
– die Sie vorschlagen. Deswegen sind Ihre Konzepte Konzepte der Vergangenheit.
Vielen Dank, Kollegin Dröge. – Das Wort geht an Bernhard Loos von der CDU/CSU-Fraktion.
