Ja, natürlich.
Sehr geehrte Frau Kollegin Hajduk, vielen Dank, dass Sie die Zwischenfrage zulassen. – Ich möchte Sie zu den von Ihnen getroffenen Aussagen befragen. Für Wirtschaftshilfen standen im Haushalt 2021 39,5 Milliarden Euro bereit. Bis jetzt sind circa 15 Milliarden Euro abgeflossen.
Die Große Koalition möchte jetzt 25,5 Milliarden Euro zusätzlich obendrauf setzen, damit es 65 Milliarden Euro werden – bei 15 Milliarden Euro Mittelabfluss. Für die Pandemiebekämpfung stehen 35 Milliarden Euro bereit. Bisher gebunden: je nach Rechnung; letztens im Haushaltsausschuss hieß es: 17 Milliarden Euro.
Ich glaube, beides zeigt sehr deutlich, dass noch Milliarden in diesem Haushalt stecken, die nicht gebunden und auch nicht verausgabt sind und die zur Pandemiebekämpfung und für Wirtschaftshilfen zur Verfügung stehen.
Unser Vorschlag war, dass wir die Steuerschätzung im Mai abwarten, um den Haushalt auch bei den Einnahmen nachjustieren zu können; denn auch da werden große Veränderungen eintreten. Deshalb möchte ich Sie fragen, ob es wirklich solide Haushaltspolitik ist, jetzt im April hopplahopp einen Nachtragshaushalt zu beschließen, wenn im Mai – in nicht mal einem halben Monat – die Steuerschätzung kommt? Dann könnte auf solider Basis, wie es sich für den Deutschen Bundestag gehört, ein Nachtragshaushalt beschlossen werden. Das ist das Anliegen der Freien Demokraten. Ich finde, jeder solide Haushälter, Frau Kollegin Hajduk, sollte sich dieser Sache anschließen. Deshalb möchte ich Sie fragen, ob Sie da eine andere Auffassung haben.
Danke schön, Herr Klein. – Frau Hajduk.
Sehr geehrter Herr Kollege Klein, ich gehe erst mal davon aus, dass Sie die Verschiebung der Gesamtkreditaufnahme, die ich gekennzeichnet habe, anerkennen. Ich will aber sagen: Sie haben mit Ihrer Frage im Grunde ein Argument dafür geliefert, warum wir in diesem Jahr für die Wirtschaftshilfen mehr Geld brauchen. Ich habe nämlich wie Sie die kritische Meinung, dass es nicht in Ordnung war, dass die Wirtschaftshilfen im letzten Jahr schlecht umgesetzt wurden. Das Verfahren war zu kompliziert. Das hat viele Unternehmerinnen und Unternehmer in die Krise gestürzt. Dass das Geld jetzt fließt, wie Eckhardt Rehberg gesagt hat, ist schön; aber nach unserer Einschätzung hätte das schneller gehen müssen. Das heißt dann aber auch, dass wir dieses Jahr größere Summen brauchen.
Außerdem haben wir den Lockdown verlängern müssen. Sie wissen auch: Als wir den Haushalt beschlossen haben, hatten wir die Hoffnung, dass nach dem ersten Quartal vielleicht Besserung eintritt. Wir laufen nun in ein zweites Quartal ein, das schwierig ist. Meine Fraktion erkennt an, dass wir Vorsorge treffen müssen für Hilfen für Unternehmerinnen und Unternehmer und Hilfen für mehr Kurzarbeitergeld. Wir brauchen auch einen Aufschlag für Hartz‑IV-Bezieher. Wir verstehen es überhaupt nicht, dass die Bundesregierung das nicht macht. Das kritisieren wir.
Wir glauben, dass es richtig ist, mit diesem Nachtragshaushalt Vorsorge zu treffen. Am Ende ist das nur eine Ausgabeermächtigung. Mit Blick auf das Wahljahr, wo wir noch viel Parteienwettbewerb haben werden, ist das eine wichtige Sicherheit und Garantie und Botschaft an die Bürgerinnen und Bürger.
Deswegen muss ich dabei bleiben: Sie sorgen nicht für eine sichere Finanzierung fürs Impfen, fürs Testen, für Krankenhäuser und anderes.
Deswegen ist Ihre Ablehnung dieses Nachtragshaushalts zu kritisieren.
Vielen Dank. – Danke schön, Herr Klein.
Ich fahre in meiner Rede fort. – Ich und wir haben auch Kritik an diesem Haushalt, und deswegen – das wurde gefragt – werden wir uns enthalten.
Ich habe es gesagt: Wir finden, dass die Hilfen nicht ausreichen,
