Sehr geehrter Herr Präsident! Liebe Kolleginnen und Kollegen! Es ist doch erstaunlich, dass ausgerechnet die AfD neuerlich so viel Wert auf unsere Verfassung und die darin verbürgten Werte legt.
In öffentlichen Äußerungen wurde die sogenannte Bundesnotbremse von der AfD mit einem Anschlag auf die föderale Ordnung und auf die demokratischen Grundprinzipien unserer Republik verglichen. Da, wo es opportun erscheint und vermeintlich Stimmen und Stimmung bringt, erklären sich die Kolleginnen und Kollegen der AfD zu Verfassungshütern. Das ist nicht nur entlarvend, meine Damen und Herren, sondern auch lächerlich.
Denn selbstverständlich gelten unser Grundgesetz und die Grundrechte auch und gerade in Krisenzeiten wie der Coronapandemie.
Natürlich ist es so, dass das Vierte Bevölkerungsschutzgesetz teilweise die Grundrechte Einzelner wie die allgemeine Handlungsfreiheit, die Bewegungsfreiheit und auch die Berufsausübungsfreiheit berührt. Doch wie man bereits im juristischen Grundstudium lernt, gelten Grundrechte eben nicht völlig grenzen- und schrankenlos.
Sie können insbesondere dort eingeschränkt werden, wo die Rechte anderer betroffen werden. Und betroffen ist durch die Pandemie vor allem das ebenfalls verfassungsrechtlich verbürgte Recht auf Leben und körperliche Unversehrtheit. Das brauchen wir doch bei über 80 000 Coronatoten allein in Deutschland nicht wirklich zu diskutieren.
Was wir diskutieren müssen – und das haben wir vor Verabschiedung des Vierten Bevölkerungsschutzgesetzes intensiv getan –, ist, wie in einem solchen Kollisionsfall die betroffenen Grundrechtsgüter angemessen ins Verhältnis zu setzen sind. Bis zum Einsetzen der Notbremse durch das infragestehende Gesetz ist die Zahl der Infizierten über Wochen exponentiell angestiegen. Die Intensivstationen sind in bedenklicher Geschwindigkeit immer weiter vollgelaufen. Auch jetzt noch haben wir jeden Tag viel zu viele Tote zu beklagen. Ich weiß nicht, auf welchem Ohr Sie taub sind, wenn Sie die Hilferufe aus der Intensivmedizin von den Ärztinnen und Ärzten und den Pflegekräften nicht vernommen haben.
Vor diesem Hintergrund muss abgewogen werden, und wir haben uns diese Abwägung nicht leicht gemacht. Aus meiner Sicht ist es zumutbar, dass man sich in Landkreisen mit einer Inzidenz von über 100 zwischen 22 Uhr und 5 Uhr des Folgetages in seinen Aktivitäten einschränkt, zumal Sport und Bewegung ja sogar bis 24 Uhr noch möglich sind und es darüber hinaus auch Ausnahmen gibt. Es ist zumutbar, weil wir damit Menschenleben retten.
Das Gesetz wird zu Recht als Notbremse bezeichnet, schließlich befinden wir uns auch in einer Notsituation. Es handelt sich gerade nicht um eine Spaß- oder Freiheitsbremse, wie Sie unterstellen.
Und natürlich sind die Inzidenzzahlen nicht, wie Sie meinen, willkürlich gewählt. Es ist einfach ein Faktum – das sich in der Vergangenheit deutlich gezeigt hat –, dass ab einem Infektionsgeschehen jenseits einer 100er-Inzidenz eine effektive Kontaktnachverfolgung Infizierter nicht mehr möglich ist.
Das führt dann zu einer unkontrollierten Ausbreitung von Infektionen.
