Sehr geehrte Frau Präsidentin! Sehr geehrte Frau Ministerin! Liebe Kolleginnen und Kollegen! Mit der Änderung des Agrarmarktstrukturgesetzes setzen wir die EU-Richtlinie über unlautere Handelspraktiken in den Geschäftsbeziehungen zwischen Unternehmen in der Agrar- und Lebensmittelversorgungskette, kurz: UTP, um.
Die UTP-Richtlinie will Erzeuger und Lieferanten vor unlauteren Handelspraktiken schützen. Dafür führt sie konkrete Praktiken in zwei verschiedenen Listen auf. Der Unterschied zwischen schwarzer und grauer Liste: Bei den Praktiken der grauen Liste geht man davon aus, dass sie ihre Unlauterkeit verlieren können, wenn beide Parteien sie einvernehmlich vereinbaren.
Man blendet bei dieser Annahme geflissentlich aus, dass die Vertragsverhandlungen in diesem Bereich selten auf Augenhöhe stattfinden, was dazu führt, dass Lieferanten aus Angst um ihre Existenz letztlich Verträgen zustimmen, die für sie nachteilige Bedingungen enthalten. Lieferanten berichten uns zudem, dass es eben gerade die Praktiken der grauen Liste sind, die ihnen das Leben schwermachen. Ich möchte daher unterstreichen, was ich bereits bei der ersten Lesung im Januar gesagt habe: Unlauter ist und bleibt unlauter.
Liebe Kolleginnen und Kollegen, ich bin froh, dass wir uns mit unserem Koalitionspartner darauf verständigen konnten, im Vergleich zur EU-Richtlinie zumindest einige Praktiken der grauen Liste in die schwarze zu überführen und somit gänzlich zu verbieten. So dürfen Handelsunternehmen Lieferanten nicht mehr an den Lagerkosten beteiligen oder nicht verkaufte Ware zurückschicken, ohne dafür zu bezahlen. Wir als SPD – das ist kein Geheimnis – hätten gerne alle grauen Praktiken geschwärzt,
und wir wollten eine offene Liste bzw. eine Generalklausel, um klarzustellen, dass jegliches unlautere Geschäftsgebaren in der Lieferkette unzulässig ist.
Das hätte die Position der Erzeuger und Lieferanten ganz wesentlich verbessert. Eine Generalklausel war mit der Union nicht umzusetzen; das möchte ich hier nicht verschweigen.
Angesichts dieses Wermutstropfens ist es aber umso wichtiger, dass das Gesetz nach zwei Jahren evaluiert wird. Dafür und für die konkrete Formulierung des Evaluierungsparagrafen hat sich meine Fraktion vehement eingesetzt. Darin heißt es:
Neben der Überprüfung der Einhaltung bestehender Verbote kann der Deutsche Bundestag im Zuge der Evaluierung gegebenenfalls auch die Liste verbotener Handelspraktiken um neue, bisher nicht erfasste unlautere Handelspraktiken erweitern. In die Evaluierung fließen auch
– und das ist mir ganz wichtig –
