Sehr geehrter Herr Präsident! Sehr geehrter Herr Minister Seehofer! Werte Kolleginnen und Kollegen! Meine Damen und Herren! Frühere Baugesetzbuchnovellen haben sich dadurch ausgezeichnet, dass man dem besonderen Charakter dieses Gesetzes Rechnung getragen hat. In der Regel gingen dem, was man dann ins Baugesetzbuch geschrieben hat, aufwendige Planspiele und Simulationen voraus: zig Berichterstatterrunden, viele öffentliche Debatten und Anhörungen und eben kein politisches Klein-Klein, weil die Baunutzungsverordnung, das Baurecht, sich eben nicht für das parteipolitische Spiel eignet.
In aufwendigen Verfahren wurden also die Baugesetzbuchnovellen vorbereitet. Wenn man sich nun das Verfahren der letzten vier Jahre anschaut, dann muss man einfach sagen: Dieses Verfahren war ein Trauerspiel. Das war nicht nur Corona geschuldet; vielmehr hat der Dauerstreit der Großen Koalition untereinander, der Streit zwischen CDU und Horst Seehofer, zwischen SPD und Union das Verfahren zur Novelle des Baugesetzbuches gelähmt. Dieses Verfahren war dem Baugesetzbuch unwürdig.
Weder von der Form her noch vom Inhalt her ist diese Novelle auf der Höhe der Zeit. Zum Inhalt will ich das an zwei Punkten deutlich machen.
Erstens. Unser Hauptkritikpunkt ist die Wiederinkraftsetzung des § 13b – Bauen im Außenbereich – und zwar, Sören Bartol, ohne Umweltverträglichkeitsprüfung, ohne Bürgerbeteiligung, ohne Ausgleichsflächen; das finden wir ungeheuerlich. Deswegen beantragen wir die Aufhebung. Ich sage es noch mal: Ohne Umweltverträglichkeitsprüfung, ohne Bürgerbeteiligung und ohne Ausgleichsflächen ist es nun möglich, die Flächennutzungspläne zu umgehen.
Das bedeutet noch mal eins obendrauf auf den Flächenverbrauch – da bleibt mir echt die Spucke weg –, und das in einer Zeit, in der die SPD die Umweltministerin stellt.
Gehen Sie mal auf die Seite der SPD-Umweltministerin. Da steht – Stichwort „Nachhaltigkeitsstrategie“ –: Das Ziel ist die Reduktion des Flächenverbrauchs auf unter 30 Hektar pro Tag bis zum Jahr 2030. – Das erreichen wir so nicht.
Das ist ein weiteres gebrochenes umweltpolitisches Versprechen der SPD. Das muss man sich klarmachen.
Jeden Tag wird eine Fläche von 73 Fußballfeldern versiegelt. Das ist zu viel.
