Vor wenigen Wochen haben genau Sie so argumentiert, wie das der Herr Ernst jetzt macht. Nur: Falsch bleibt falsch. Falsch bleibt falsch!
Wir möchten gerne in das Infektionsschutzgesetz einen § 28b einfügen. Im Absatz 1 stehen zehn Maßnahmen drin. Das hat nicht die Bundesregierung entwickelt;
das haben die Bundestagsfraktionen der Union und der SPD vorgeschlagen, und sie stellen das hier heute und am kommenden Mittwoch zur Abstimmung. Das entscheidet das Parlament. Im Absatz 6 steht eine Verordnungsermächtigung drin, und zwar mit dem Zustimmungsvorbehalt von Bundesrat und Bundestag. Was ist denn daran ein Freibrief für die Bundesregierung?
Wenn Sie ins Gesetz schauen, dann sehen Sie, dass das, was Sie hier sagen, nichts, aber auch rein gar nichts mit der Wahrheit zu tun hat.
Meine sehr verehrten Damen und Herren, liebe Kolleginnen und Kollegen, das, was wir hier vorlegen, ist ein Mix unterschiedlicher Maßnahmen, weil wir ganz genau wissen, dass nicht eine einzige Maßnahme die Wirkung erzielen wird, sondern nur die Summe dieser Maßnahmen. Wenn Sie jetzt hingehen und einzelne Maßnahmen herausgreifen, diskreditieren und mit Gutachten kommen, die Ihnen gerade in den Kram passen –
das hat auch die FDP gemacht, das hat der Herr Lindner gemacht –, dann ist das einfach nicht in Ordnung, sondern dann sollten Sie das gesamte Bild zitieren.
Wir haben sehr gute Gutachten beispielsweise aus Kanada. Da hat man die Provinzen Quebec und Ontario untersucht. In Quebec gibt es eine Ausgangsbeschränkung. Da hat man festgestellt, dass im Vergleich zur Provinz Ontario die Bewegungen um 31 Prozent zurückgegangen sind. Das führt dazu, dass die Reproduktionsquote um 13 Prozent zurückgeht. Und wenn die Reproduktionsquote zurückgeht, führt das wiederum dazu – nicht durch die Ausgangsbeschränkungen alleine, aber durch die Ausgangsbeschränkungen in einem Bündel von Maßnahmen –, dass wir damit erreichen, dass das Gesundheitssystem entlastet wird und insbesondere die Intensivstationen.
