Liebe Kolleginnen und Kollegen von der CDU, da möchte ich Ihnen eins sagen: Na, prost Mahlzeit! Sie handeln nach dem Motto „Wer seine Heimat liebt, versiegelt sie“. Da machen wir Grüne nicht mit. Deswegen gibt es heute dazu eine namentliche Abstimmung.
Zweitens zum Umwandlungsschutz. Es ist ja alles richtig, was Sie zum Umwandlungsschutz gesagt haben; den brauchen wir dringend. Und es ist gut, wenn die Kommunen hier mehr Rechte erhalten. Aber warum ermächtigen Sie die Länder, darüber zu entscheiden, ob eine Kommune den Umwandlungsschutz anwenden kann oder nicht? Das macht doch gar keinen Sinn. Damit bringen Sie ganz klar zum Ausdruck: Sie hegen ein Misstrauen gegenüber den Kommunen, und deswegen ermächtigen Sie die Länder. Wir Grüne wollen, dass die Kommunen selber, also ohne Landesverordnung, entscheiden können, dass Umwandlung gebremst wird.
Sie schmeißen den Konflikt, den Sie haben, den Ländern vor die Türe.
Die Regelung zur Umwandlung wird zu einem Flickenteppich in Deutschland führen. Wir halten das grundsätzlich für falsch.
Wir lehnen die vorliegende Novelle ab, weil sie nicht das hält, was sie verspricht. Sie ist systematisch falsch. Und ich sage noch eins: Nicht nur der Umwandlungsschutz ist an diese Verordnung geknüpft, die Vorkaufsrechte auch, die Baugebote auch.
Herr Kollege, Sie müssen zum Schluss kommen.
Aber der § 13b nicht. Das ist der Hohn dieser Gesetzesnovelle, und deswegen können wir nicht zustimmen.
Danke schön.
