Ich weiß; ich zitiere zu Ende.
– Ihre Redezeit ist abgelaufen.
Wenn Sie es mir erlauben, möchte ich das gerne noch zu Ende führen.
Nein. Ich kann es nicht erlauben. Ich habe es den anderen Kollegen auch nicht erlaubt. – Vielen Dank. Kommen Sie zum Ende.
Dann bedanke ich mich für Ihre Aufmerksamkeit und empfehle Ihnen den Artikel. Ich kann es nicht mehr zitieren. Aber Sie sollten es nachlesen, wie er endet. Er erinnert uns nämlich daran, dass wir eine gemeinsame Pflicht haben, auf die vernünftigen Kräfte dort zu setzen.
Jetzt hätten Sie noch zitieren können. Vielen Dank. – Es ist ein bisschen missbräuchlich.
Letzter Redner in dieser Aktuellen Stunde ist der Kollege Christian Schmidt.
