Frau Präsidentin! Meine Damen und Herren! Im September wird gewählt, und zwar nicht nur hier bei uns in Deutschland, sondern auch in Russland. Die Duma-Wahlen stehen vor der Tür, und die Nervosität im Kreml steigt mit jedem Tag. Die Opposition wird drangsaliert, NGOs diskriminiert, Nawalny inhaftiert. Man könnte glatt glauben, im Kreml denkt man, demokratische Kräfte stünden kurz vor einem großen Wahlsieg. Die Umfragen legen das nahe. Vor einem Jahr noch stand Jedinaja Rossija, die Partei des Kreml, bei 45 Prozent. Heute sind es noch 27 Prozent.
Gleichzeitig steigt die Zustimmung zu rechten und linken Kräften, zur Partei von Schirinowski, zu den Kommunisten. Die Opposition hat kaum Bewegungsfreiheit. Anhänger liberaler Parteien werden an der Wahl gehindert, ihre Registrierung wird unterbunden. Der demokratische Wettbewerb findet praktisch nicht statt. Trotzdem sehen wir eine Repression im Inneren, die ihresgleichen sucht. Warum? Weil der Lebensstandard sinkt, die Korruption unverändert ist, aber das Renteneintrittsalter steigt. Und, meine Damen und Herren, im Kreml hat man die Proteste vom Bolotnaja-Platz noch nicht vergessen, als eine Wahl schiefgegangen ist.
Jede legitime Opposition in Russland wird zur Agentin einer Farbrevolution gestempelt, zur Vollstreckerin des Willens der CIA, zu einer Feindin des russischen Volkes. Meine Damen und Herren, das ist falsch. Die Russinnen und Russen haben Demokratie verdient. Es ist ein großes Volk, das sich demokratisch auch selbst regieren kann, und dabei sollten wir es unterstützen.
Aber zur Verteidigung gegen diese imaginären Feinde im Inneren kommt eben dann auch noch die Verteidigung gegen imaginäre Feinde von außen. In diesem Zusammenhang müssen wir den Aufmarsch der russischen Streitkräfte an der ukrainischen Grenze zwischen Woronesch und Rostow sehen. Circa 120 000 Soldaten, gepanzerte Verbände, Infanterie, Artillerie, sogar Landungsboote aus dem Kaspischen Meer wurden verlegt, Lazarette gleich mit. Die Straße von Kertsch wurde gesperrt, das Asowsche Meer gleich mit. Die Häfen der Ukraine sind nicht länger zugänglich.
Angeblich beruht all das auf feindlichen Aktivitäten der NATO. Meine Damen und Herren, nein, es gibt dort keine feindlichen Aktivitäten der NATO. Punkt! Das sind Fake News, das ist Desinformation. Das ist das, was wir, lieber Herr Gauland, von Ihnen als Tatsache hören. Es sind keine Tatsachen. Es sind Falschbehauptungen. Schluss. Ende der Durchsage. Das ist russische Desinformation.
Das Ziel ist doch ein ganz anderes: Russland will die souveräne Ukraine einschüchtern. Es will bekräftigen, dass im nahen Ausland die Staaten nur eine eingeschränkte Souveränität haben. Wir können nicht ausschließen – wir können es bis heute trotz der Ankündigung von Verteidigungsminister Schojgu nicht ausschließen –, dass es unter Umständen sogar die Vorbereitung einer militärischen Invasion ist. Die Fähigkeiten jedenfalls sind da.
Nun hat gestern Präsident Putin in seiner Poslanije, der Rede zur Lage der Nation, rote Linien gezogen. Ich will mit Genehmigung der Präsidentin mal zitieren, was er hier gesagt hat:
Organisatoren jedweder Provokationen, die die Kerninteressen unserer
– also der russischen –
