In dieser Woche beginnt die Auslieferung von Impfdosen über die EU; 650 000 Dosen gehen an die Westbalkanstaaten. Das ist gut, kann aber nur ein Anfang sein.
Ich hoffe sehr, dass wir nun auch den nächsten Schritt tun und die Logik des großzügigen Spenders verlassen, der nur abgibt, was er selbst übrig hat.
Impfstoff allen zugänglich zu machen, ist kein karitativer Akt, sondern Teil der globalen Verantwortung. Es ist im Interesse aller Staaten, also auch in unserem eigenen wohlverstandenen Interesse, die Pandemie weltweit unter Kontrolle zu bringen.
Darum brauchen wir zusätzlich und schnell eben auch die Ausweitung der weltweiten Produktionskapazitäten. In der öffentlichen Anhörung wollten einige Sachverständige den Eindruck erwecken, dass das bestehende System doch bis hierhin ganz gut funktioniert habe und dass die bisherigen Bemühungen, freiwillig Know-how zu teilen und die Produktion auszuweiten, ausreichten. Das ist aber mitnichten der Fall. Ich halte eine solche Aussage angesichts selbst der optimistischsten Verteilprognosen von Covax für mindestens problematisch.
Klar ist: Auch Technologietransfer braucht seine Zeit, und auch Lockerungen im Patentrecht – wenn es denn gelingen soll – werden erst mittelfristig Wirkung zeigen.
Was mir deshalb im Antrag der Linken fehlt, ist ein Konzept, das über die Patentfrage hinausgeht und tatsächlich zu besserer Versorgung und zur Bewältigung der akuten Pandemie führt.
Wir brauchen jetzt eine globale Impfstrategie. Wir brauchen einen Ausbau der Lieferketten und eine Ausweitung der Produktion.
Darum kommt viel darauf an, ab sofort die vorhandenen Impfstoffkontingente gerecht unter allen zu teilen und die Pharmaunternehmen dafür zu gewinnen, die ärmsten Länder dieser Welt zu versorgen. Die großen Industrienationen haben die Unternehmen massiv mit Forschungsmitteln und auch beim Aufbau der Produktionsstandorte, vor allem hier in der EU, unterstützt. Manche Staaten haben ihnen sogar mit öffentlichen Geldern das unternehmerische Risiko abgefedert. Dann sollten die Pharmaunternehmen im Gegenzug auch einen fairen Beitrag zur Bewältigung dieser globalen Gesundheitskrise leisten.
Als SPD setzen wir uns dafür ein, jetzt das historische Fenster zu nutzen, das sich bei den Impfpatenten geöffnet hat.
Denn wenn wir es nicht schaffen, dem Virus gemeinschaftlich entgegenzutreten, dann hätte das Virus schon gesiegt. In diesem Sinne weiß ich fast alle hier vertretenen Fraktionen einig, dass wir unser Engagement für die globale Covid-19-Bekämpfung weiter ausbauen müssen.
Vielen Dank.
Vielen Dank, Heike Baehrens. – Nächster Redner: für die FDP-Fraktion Dr. Andrew Ullmann.
