zu kraftvoller Politik, die von Experten gemacht und die im Parlament verabschiedet wird, meine Damen und Herren.
Hätten Sie es von Anfang an so gemacht, wie es die AfD gefordert hat,
wenn das Grundlage Ihres Handelns gewesen wäre, stünde Deutschland wesentlich besser da, genauso wie Deutschland wesentlich besser dastehen würde, wenn die AfD endlich in Regierungsverantwortung käme.
Vielen Dank.
Liebe Kolleginnen und Kollegen, ich erinnere daran, dass um 11.05 Uhr die Urnen für die Wahlen, die wir am Beginn der Tagesordnung eröffnet haben, geschlossen werden. Wer noch wählen will, muss es innerhalb der nächsten zwei Minuten tun.
Jetzt hat das Wort der Kollege Sebastian Hartmann, SPD.
