Das nicht „Mittäter“ zu nennen, ist eine Bagatellisierung, Verharmlosung
und Verächtlichmachung der Demokratie einerseits und eine Verharmlosung des Nationalsozialismus andererseits. Das verstehen Sie unter Meinungsfreiheit. Herzlichen Glückwunsch!
Aber wir haben uns wahrscheinlich geirrt. Wir haben einfach ein unterschiedliches Verständnis von Meinungsfreiheit. Man muss das umdefinieren. Meinungsfreiheit im AfD-Deutsch heißt dechiffriert „Hassfreiheit“, also Freiheit zum Hass; denn das ist es, worum es Ihnen geht.
Sie gehen ja mit Kalkül vor. Das ist ja letztlich auch Täterschutz, damit Sie Ihren Hass und den Ihrer Unterstützer auch ohne Sanktionen weiter praktizieren können. Das verstehen Sie darunter. Und Sie haben auch einen interessanten Habitus dabei. Ich würde das vergleichen mit einem Waffenhändler, der sich als Lebensschützer darstellt.
Sie sind Waffenhändler, die sich als Lebensschützer darstellen. Das muss man auch erst mal schaffen. Das hat entweder mit einem Mangel von Herz und Hirn zu tun – ich erinnere an mein Zitat eben – oder mit wirklich großem Humor. Sie können sich die Antwort aussuchen.
Was Sie also machen, ist, hier das Thema Meinungsfreiheit vor das Tribunal zu stellen. Bei diesem Scheintribunal gibt es vermeintliche Opfer; das sind Sie. Sie sind keine Opfer, übrigens auch nicht Herr Liefers. Er war in jeder Talkshow, sein Vertrag wurde verlängert. Wahrlich ist er kein Opfer der Meinungsfreiheit; das soll er ja auch nicht sein.
Aber er erleidet kein Martyrium. Dann gibt es Täter in diesem Tribunal, tatsächliche Täter – das sind Sie und Ihre unterstützenden Bataillone –,
und es gibt tatsächliche Opfer. Darauf möchte ich jetzt auch mal zu sprechen kommen.
Was ist denn mit der Meinungsfreiheit vieler, vieler Frauen, die durch die frauenfeindliche Hetze Ihrer Anhänger im Netz bloßgestellt und attackiert werden?
Was ist mit deren Meinungsfreiheit?
