Kommen Sie mir jetzt nicht mit dem Strompreis! Das ist doch völliger Humbug, was Sie hier erzählen. Warum ist denn der Strompreis für Atomstrom immer so preiswert gewesen? Weil wir die Mehrkosten – anders als beim EEG – nicht über die Stromrechnung ausgewiesen haben, sondern über Steuermilliarden. Das müssen Sie doch mit einrechnen, meine sehr verehrten Damen und Herren!
Es gibt Studien, die deutlich gemacht haben: Wenn man die Folgekosten von Atom und Kohle in den Strompreis eingerechnet hätte,
dann hätte der Preis für Atomstrom ein Vielfaches über dem heutigen Strompreis gelegen, dann lägen wir bei 10 Cent zusätzlich pro Kilowattstunde. Das ist doch die Wahrheit; das muss man auch der AfD deutlich sagen.
Herr Müller, Sie haben den größten Applaus heute von mir bekommen; Ihre Fraktion war ja sehr zurückhaltend.
Ich fand, Sie haben alles richtig gesagt. Und, ja, ich fand es auch bedenklich, aber wir sind in der Sache sehr nahe beieinander. Mein Wunsch wäre dann aber, dass Sie einmal zu Ihren Kollegen ins Europäische Parlament gehen; denn dort ist es ja nicht so, dass da die CDU und die CSU gegen Atomkraft sind. Ich habe hier einmal das Ergebnis einer Abstimmung aus dem letzten Jahr mitgebracht. Da ging es um „Atomkraft und Klimaziele“. Welche deutschen Europaabgeordneten haben dafürgestimmt? 20 CDU/CSU-Abgeordnete haben für die Atomkraft gestimmt.
Also auch im Europäischen Parlament müssen Sie noch Überzeugungsarbeit leisten; denn Atomkraft kann keine Zukunft haben.
Wie die AfD darauf kommt, dass das eine Zukunftstechnologie ist, kann ich mir nur so erklären: Sie hatten ja im letzten Jahr einen Bundesparteitag am letzten Standort einer „modernen“ Atomkraftvision, in Kalkar. Wissen Sie, was aus dem Schnellen Brüter von Kalkar geworden ist? Ein Vergnügungspark – und eine Tagungsstätte für die AfD, meine sehr verehrten Damen und Herren. So sehen Ihre Zukunftskonzepte aus. Dafür darf es aus unserer Sicht kein Geld, keine Steuermittel geben!
Ich bin 1986 politisch sozialisiert worden. Zehn Jahre war ich alt, als die Reaktorkatastrophe von Tschernobyl passierte. Als Kind musste ich dreimal am Tag duschen, durfte nicht draußen spielen. – Erinnert ein bisschen an die Pandemie von heute. – Und was noch viel schlimmer war: Wir mussten Milchprodukte aus Trockenmilch trinken. Wenn ich als Kind die Tagesschau geguckt habe, hatte ich Angst um die Zukunft, weil ich nicht wusste, was passiert. – Das war meine politische Sozialisation.
Deswegen ist es ein Freudentag, wenn wir am 31. Dezember nächsten Jahres komplett aus der Atomkraft aussteigen werden. Und sie wird nicht wiederkommen, meine sehr verehrten Damen und Herren; das verspreche ich Ihnen, so wahr ich hier stehe.
Danke Ihnen.
Vielen Dank, Timon Gremmels. – Nächster Redner: für die FDP-Fraktion Dr. Martin Neumann.
