Sehr geehrter Herr Präsident! Liebe Kolleginnen! Liebe Kollegen! Ich auf jeden Fall bin ein sehr großer Fan der umlagefinanzierten Rentenversicherung;
denn sie hat sich bewährt. Wir sehen doch, wie es denen ergangen ist, die in den Kapitalmarkt investiert haben, ob bei Lebensversicherungen oder Bausparverträgen; es waren hohe Summen. Das war vielleicht vor 20 Jahren alles ganz gut. Aber wie ist es denn heute?
Deswegen ist Ihr Antrag, der von den Grünen, ja in Ordnung, und er gefällt mir auch; er geht in die richtige Richtung. Aber eines sage ich euch, lieber Markus Kurth. Auf Seite 3, letzter Absatz, werft ihr uns vor: In den letzten sieben Jahren ist nichts mehr passiert. – Wie könnt ihr so was behaupten? Der Peter Weiß, der Ralf Kapschack und viele Redner haben erläutert, was passiert ist. Bei 9,5 Millionen Menschen haben wir die Anrechnung der Erziehungszeiten verbessert, Stichwort „Mütterrente“. Wir haben dafür gesorgt, dass Menschen nach 45 Versicherungsjahren früher in Rente gehen können. Das haben viele wahrgenommen. Da sind Blumensträuße verteilt worden, weil sie dankbar waren. Die Andrea Nahles hat auch einen bekommen.
Wir haben das Rentenniveau stabilisiert, wir haben die Beiträge in der gesetzlichen Rentenversicherung stabilisiert, und wir haben auch die Erwerbsminderungsrenten mehrfach angepasst und verbessert. Auch haben wir die Grundrente eingeführt. Ja, man kann das alles noch besser machen. Aber das war eine ganze Menge.
Liebe Kolleginnen und Kollegen, die Alterssicherung in Deutschland – das ist heute öfter gesagt worden – ist trotz mancher Diskussionen, Unkenrufen, Verunglimpfungen, Unwahrheiten – was wird nicht alles erzählt! – gut aufgestellt. Das müssen wir doch einfach noch mal zur Kenntnis nehmen.
Unsere Aufgabe ist es jetzt, das zu sichern, zu halten und noch zu verbessern.
