Herr Kollege Trittin, kommen Sie zum Schluss, bitte.
Wenn wir sagen, wir nehmen Menschenrechte und die Bekämpfung der globalen Armut ernst, dann müssen wir Regeln haben und mit einem vernünftigen und mit Zähnen ausgestatteten Lieferkettengesetz verhindern, dass unter Ausbeutung und Zwangsarbeit hergestellte Produkte aus China oder von irgendwo anders aus der Welt hier auf den Markt kommen.
Herr Kollege, bitte.
Das heißt, sich dem Systemkonflikt zu stellen.
Vielen Dank, Herr Kollege Trittin. – Da der Kollege Michael Brand, CDU/CSU-Fraktion, seine Rede zu Protokoll gegeben hat,
ist der letzte Redner der Kollege Dr. Volker Ullrich, CDU/CSU-Fraktion.
