Herr Präsident! Meine Damen und Herren! Ich habe es mir eigentlich zur Angewohnheit gemacht, dass, bevor ich mich aufrege, ich mich erst mal gründlich informiere. Das habe ich in dem Fall jetzt auch gemacht.
Aber zunächst einmal vielleicht zwei Worte zu dem Redebeitrag meines Kollegen Pascal Kober. Ich glaube, es ist nicht hilfreich, den Menschen, die jetzt von der Kündigung bedroht sind, das Argument vorzuhalten, das hänge ja alles mit viel Bürokratisierung zusammen – das tut es an der Stelle nicht –, und in Estland sei das alles besser – nach dem Motto: Dann geht doch nach Estland!
Das war kein guter Beitrag für diese Menschen, lieber Pascal Kober.
Herr Kollege Zimmer, erlauben Sie eine Zwischenfrage des Kollegen Kober?
Nein, in Aktuellen Stunden gibt es keine Zwischenfragen, Herr Präsident.
Entschuldigung! – Gott, dass mir das passiert; unglaublich.
Es ist jetzt ein Traum für mich in Erfüllung gegangen, dass ich den Präsidenten mal korrigieren durfte. Vielen Dank!
Und dann ein zweiter Gedanke, lieber Pascal Kober, zum Vertrauen in die Betriebsräte. Also, die Betriebsräte zu erwähnen, ist ja völlig in Ordnung, aber die werden natürlich erst dann tätig, wenn die Birne bereits gegessen ist. Ich habe da sehr viel mehr Vertrauen in die Kraft der Gewerkschaften,
und ich will auch sagen, warum.
