Zu Ihrem Wissenschaftsantrag, liebe Grünen. Gendersprache ist Idiotensprache.
Das zeigt Ihr Antrag ziemlich zielgerichtet. Ihre Fraktion will Wissenschaft und Forschung klimaneutral machen. Vorbei also die Zeiten, als Wissenschaft und Forschung nach Artikel 5 Absatz 3 des Grundgesetzes frei waren. Nun stehen sie unter Klimavorbehalt.
Wissenschaft und Forschung haben unsere Gesellschaft zu dem gemacht, was sie ist. Durch die Anwendung von Logik und des wissenschaftlich nachweislichen Experimentes wurde die Welt erfasst. Sie wurde erklärt, und sie wurde zur besten aller Gesellschaften geformt, nämlich der freiheitlichsten, die wir jemals hatten.
Aber auch damit ist es offensichtlich vorbei; denn Freiheit steht jetzt unter Klimavorbehalt. Der vorliegende Antrag hat nicht die Absicht, irgendwelche Reduzierungen von Emissionen von gefährlichen Gasen zu erreichen. Nein, es geht um die Herrschaft an den Hochschulen und um das, was dort gelehrt wird. Dabei schreckt die grüne Fraktion nicht vor der typisch grünen Heuchelei zurück. Sie nehmen ein großartiges wissenschaftliches Experiment, nämlich die Polarforschung, und heften sich das ans Revers.
Aber wie hat denn das Alfred-Wegener-Institut die MOSAiC-Expedition hinbekommen? Ich werde es Ihnen sagen:
mit mehreren Zehntausend Tonnen maritimem Dieselöl – das ist eine Technik, die Sie verbieten wollen –: Dieselöl, um das Schiff ins Nordpolarmeer zu fahren; Dieselöl, um die Generatoren zu betreiben, die monatelang das Schiff, die Besatzung und die Expeditionsteilnehmer mit Wärme, Strom und Licht versorgt haben; Dieselöl, das die Versorgungsschiffe, die die Expedition versorgt haben, versorgt hat. Und wären diese Dieselschiffe ausgefallen, dann wären nukleare Eisbrecher eingesprungen, eine Technik, die Sie verbieten wollen.
