Herr Präsident! Liebe Kolleginnen! Liebe Kollegen! Herr Seitz, schnell und schlampig! Allein der Antrag als solcher ist ja eine Zumutung. Weder hat das Bundeskanzleramt – Zitat – „zum wiederholten Male die Verlängerung der ‚Lockdown-Maßnahmen‘ ... beschlossen“ – das hat das Bundeskanzleramt übrigens noch nie –, noch hat Herr Professor Schrappe mit den Kollegen ein Thesenpapier entwickelt. Sie beziehen sich vermutlich – das wird aus dem Antrag nicht klar – auf die sieben Thesenpapiere unter dem Titel „Die Pandemie durch SARS-CoV-2/CoViD-19“. Papiere eins bis sechs behandeln Aspekte wie Epidemiologie, Prävention und Gesellschaftspolitik und sind hier übrigens bekannt. Papier sieben verhält sich im Wesentlichen zum Thema Impfen.
Die Herren Professoren Schmidt-Chanasit und Stöhr gehören nicht zu den Autoren dieser Thesenpapiere. Bei den Herrn Professor Schrappe zugeschriebenen Zitaten machen Sie sich noch nicht mal die Mühe, diese zu belegen.
Aber es geht Ihnen ja auch nicht um den konstruktiven Diskurs. Nein, offensichtlich soll dieser Antrag der Coronaresolution Ihres Parteitags am Wochenende ein restbürgerliches Tarnmäntelchen umhängen. Ihr Thüringer Landes- und Fraktionschef Björn Höcke sprach im Zusammenhang mit Corona von einer – Zitat – „herbeigetesteten Pandemie“ und einem – wiederum Zitat – „Testwahnsinn“. Weiteres Zitat: „Die Testung und die Anzahl der Testung führt überhaupt dazu, dass wir eine Pandemie haben.“ – Zitat Ende. Sie lehnen den PCR-Test zum Nachweis der Infektion ab und fordern in Ihrer Resolution – Zitat –, „zu seit Jahrzehnten bewährten Diagnosemethoden zurückzukehren“. Sie schwafeln dort über angebliche Meldungen zu alarmierend hohen Nebenwirkungen und – Zitat – „auffällig vielen Corona-Ausbrüchen und erhöhten Sterberaten nach Impfungen in Heimen“. Mit Verlaub: Blödsinn.
Ja, es gibt Nebenwirkungen, leichte wie auch in geringerem Umfang schwerere. Aber dank unserer funktionierenden Impfüberwachung werden diese auch sofort erkannt, bewertet und vor allem die richtigen Konsequenzen daraus gezogen. Also: Aufklärung, Hinweise, Impfempfehlungen, die angepasst werden. Deshalb kann ich hier sagen, dass bei den bislang zugelassenen Impfstoffen der Nutzen der Impfung die Gefahren einer Nebenwirkung deutlich und weitaus überwiegt.
Wenn in einer Alteneinrichtung in Osnabrück nach der zweiten Impfung 14 Senioren mit der britischen Variante angesteckt wurden und die Senioren entweder asymptomatisch sind, das heißt keinerlei Beschwerden haben, oder leichte Krankheitsverläufe haben, dann beweist es eines, nämlich dass die Impfung offensichtlich wirkt.
Wenn wir das jetzt alles zusammenrechnen: Mit dieser Vorgeschichte fordern nun ausgerechnet Sie den Deutschen Bundestag auf, eine unabhängige Expertenkommission einzurichten. Wozu sie eingerichtet werden soll, wird jetzt nicht ganz klar, weil in Ihrem Antrag an dieser Stelle das Verb fehlt;
aber das ist ja nun auch wurscht.
