und solange man sich nicht eingesteht, dass diese Schieflage andauert, bis man die Grenzen effektiv schützt, so lange wird es keine Lösung für die Probleme am Wohnungsmarkt geben.
Die Probleme des Wohnungsmarktes, die die Linken, Grünen und die SPD beklagen, haben sie selbst durch ihre Politik mitverursacht. Der Mietendeckel ist dabei nur ein Zwischenschritt. Canan Bayram von den Grünen hat es offen ausgesprochen: „Wenn wir jetzt die Mieten deckeln, wird später das Enteignen leichter",
was ja wahrscheinlich dann auch stimmt, Frau Nissen.
Sehr geehrte Damen und Herren, die Umgestaltung unserer Gesellschaft ist für viele noch nicht beendet. Einige Ergebnisse können aber schon heute hier in Berlin besichtigt werden. Vor diesem Hintergrund kann man nur hoffen, dass sich beim Wähler die politische Vernunft durchsetzt und er den sozialistischen Allmachtsfantasien eine deutliche Absage erteilt, egal ob sie rot oder grün gefärbt sind.
Vielen Dank.
Der nächste Redner für die Fraktion der SPD ist der Abgeordnete Klaus Mindrup.
