ein Gründungssemester einführen oder das Tanzverbot an „stillen Feiertagen“ abschaffen, Grenzen offenhalten, Schuldenbremse, Rentenreform und Klimaschutz: Das alles ist möglich, und das ist auch gar nicht schlecht, aber es ist kein stimmiges Programm zur Bewältigung der Coronakrise im Hinblick auf Kinder und Jugendliche.
Schließlich noch ein besonderer Punkt – Sie haben ihn vorhin auch erwähnt –: ein elternunabhängiges Baukasten-BAföG, für dessen Einsatz die wirtschaftliche Situation der Eltern keine Rolle spielen soll. Wo bleibt denn hier die Eigenverantwortung der kleinsten sozialen Gemeinschaft, der Familie, wo das Subsidiaritätsprinzip? Man staunt.
Der Antrag der Grünen „Jugend in der Krise“ ist ein ähnlicher Bauchladen mit bunten Themen rund um die Jugend. Digitale Endgeräte für bedürftige Jugendliche: Die gibt es inzwischen. SGB-VIII-Reform: nächste Woche im Plenum. Wahlalter 16 wegen Corona: an den Haaren herbeigezogen.
Ich bin unbedingt für systematische Beteiligung von Jugendlichen und auch Kindern an sie betreffenden Entscheidungen; das wissen Sie von mir, dafür setze ich mich ein und meine Fraktion auch. Das allgemeine Wahlrecht stellt aber eine Verantwortung dar, in die man hineinwachsen dürfen muss, und das gilt auch nach Corona.
Zu den Anträgen der Linken. Der Ruf nach immer mehr Geld – Sie haben auch vieles Richtige gesagt, Herr Kollege Müller – ist enttäuschend fantasielos. Allein für den wichtigen Bereich Jugendbildungsstätten sind bereits 200 Millionen Euro mobilisiert. Wir reden über weitere Programme; Kollege Rix hat es angesprochen. Die SGB-VIII-Reform steht vor dem Abschluss und wird auch nicht kostenlos umgesetzt werden können. Es ist schade, dass nicht mehr von Ihnen kommt.
Zurück zum Wesentlichen. So wichtig Auffang- und Reparaturmaßnahmen sind, viel wichtiger ist die Prävention. Viele Fehlentwicklungen können wir bremsen oder stoppen, indem wir alle verfügbaren Mittel auch wirklich zum Einsatz bringen und besonders die Systeme Schule, Kita, Jugendeinrichtungen zu sicheren Orten auch in der Pandemie machen.
Gerade wenn jetzt über einen nochmals härteren Brücken-Lockdown gesprochen wird und er vielleicht notwendig wird, dann muss er mit einer geballten Testoffensive für offene Schulen, Kitas, Jugendeinrichtungen verbunden werden.
Denn deren Schutz als überschaubare Einrichtungen mit festen Gruppen ist organisatorisch relativ einfach und vergleichsweise billig. Engmaschige, am besten tagtägliche Selbsttests in Schulen und Kitas kombiniert mit dem wöchentlichen kostenlosen und ohnehin zugesagten Bürgertest, auf den ja auch Kinder und Jugendliche einen Anspruch haben, mit klarem Meldeprozess bieten nicht nur Schutz, sondern endlich auch echten Aufschluss zum Infektionsgeschehen in Schulen und Kitas. Deshalb dürfen sie eben nicht zu Hause gemacht werden.
Diese Testoffensive würde unseren 7,5 Millionen Familien mit minderjährigen Kindern – das sind rund 25 Millionen Menschen in unserem Land – in der härtesten Phase der Pandemie einen Großteil Normalität zurückgeben. Davon profitieren würden auch Eltern und ihre Arbeitgeber, weil damit forderndes Homeschooling, die Kinder bei Laune zu halten, sie zu trösten oder Beratung für sie zu suchen, entfiele. Dies wäre ein Weg, noch einmal Akzeptanz für härtere Einschränkungen in anderen Bereichen zu finden.
Ein Letztes. In Hessen ist die beaufsichtigte Anwendung von Selbsttests an über 20 Pilotschulen vor Ostern erfolgreich erprobt worden. Sie sollte jetzt auf alle Jahrgänge ausgeweitet werden. Es ist mir unverständlich – liebe Kollegin Stumpp, entschuldigen Sie –, warum die Grünen in Wiesbaden nicht mitziehen und stattdessen die testgesicherte Rückkehr der Klassen 7 bis 11 an die Schulen auf ihr Betreiben hin abgesagt wurde, noch weit unterhalb der Schwelle von Inzidenz 200.
Ich sage: Lassen Sie es uns anders machen. Lassen Sie uns loslegen. Lassen Sie uns Kindern und Jugendlichen in der Pandemie ein Maximum an Normalität zurückgeben. Viele im Raum tragen dafür Verantwortung auf vielen Ebenen in diesem Land. Gestern wollten wir alle zusammen die Kinderrechte voranbringen.
Kollegin Wiesmann, Sie können weitersprechen, tun das aber auf Kosten Ihrer Kolleginnen.
