Alle Expertinnen und Experten unserer Anhörung waren sich einig – es ist gesagt worden –: Unser Entwurf zeigt einen verfassungsrechtlich gangbaren Weg. – Über diese positiven und konstruktiven Einschätzungen haben wir uns gefreut. Wir wollen die Abhängigkeit der Kirchen vom Staat beenden und die staatlichen Haushalte langfristig entlasten. Dabei legen wir das Äquivalenzprinzip an; denn alles andere ist – und das hat die Anhörung auch glasklar gezeigt – nicht verfassungskonform. Und dass die AfD es nicht hinbekommt, selbst in so schlichten Fragen auf dem Boden des Grundgesetzes zu bleiben, spricht für sich, meine Damen und Herren.
Schließlich wird unser Gesetzentwurf auch der gesellschaftlichen und politischen Bedeutung der Religionsgemeinschaften gerecht. Die Kirchen, kirchlichen Krankenhäuser, Schulen, Kindergärten, Bahnhofsmissionen, Sozialeinrichtungen und vieles mehr sind wichtiger Teil der sozialen Infrastruktur unseres Landes, gerade in der Fläche, meine Damen und Herren. Und deswegen will ich für diesen Einsatz, die Arbeit, die gelebte Nächstenliebe an dieser Stelle allen Mitarbeiterinnen und Mitarbeitern der Kirchen und den Kirchen selbst ganz herzlichen Dank sagen, meine Damen und Herren.
Der Gesetzgeber sollte die Dinge regeln, wenn er es unbefangen und selbstbestimmt tun kann. Mit den Kirchen und den Ländern standen und stehen wir im Dialog. Jetzt ist ein guter Zeitpunkt, die Ablösung endlich in Angriff zu nehmen.
Bedanken möchte ich mich bei den Kolleginnen und Kollegen von FDP und Linken – ich finde es gut, dass wir das so gut zusammen hinbekommen haben –, insbesondere beim Kollegen Stefan Ruppert, beim Kollegen Benjamin Strasser und bei der Kollegin Buchholz. Ganz herzlichen Dank für die vertrauensvolle Kooperation!
Der GroKo kann ich nur sagen: Danke für die netten Worte, gerade auch von der CDU Mecklenburg-Vorpommern.
Aber mit warmen Worten, lieber Philipp Amthor, wird man einem Verfassungsauftrag nicht gerecht.
Wenn Sie heute nicht zustimmen oder sich enthalten sollten, frage ich Sie: Wo ist Ihr Entwurf, meine Damen und Herren? – Ich frage für einen Freund, der Artikel 140 GG ernst nimmt.
Herzlichen Dank.
Vielen Dank, Dr. Konstantin von Notz. – Nächster Redner: für die CDU/CSU-Fraktion Marc Henrichmann.
