Herr Kollege, erlauben Sie eine Zwischenfrage des Kollegen Professor Andrew Ullmann?
Ich würde gern erst mal weitersprechen.
Er spricht ohnehin nach mir.
Von früh bis abends haben Sie Ihre Bedenken aus einem juristischen Elfenbeinturm vorgetragen. Erst vor einem Monat haben Sie uns damit traktiert, als es um die Impfreihenfolge ging, die Sie unbedingt per Gesetz festlegen wollten, das ginge gar nicht per Verordnung. Jetzt sehen wir nach derzeitigem Stand: Es war richtig, es so zu machen. Die Lösung funktioniert, und die Lösung ist auch rechtssicher.
Deswegen: Lassen Sie uns in unserem Land anpacken! Lassen Sie uns handeln! Liebe Oberbedenkenträger der FDP, orientieren Sie sich einfach mal neu und machen Sie es so, wie Sie es jetzt mit Ihrem Antrag gemacht haben: Machen Sie mal konstruktive Vorschläge!
Das bringt uns besser und weiter voran
als Ihr ständiges Herumnörgeln und Ihre ständig vorgebrachten Bedenken.
