Ja, sie darf.
Herr Ullmann, Danke schön, dass ich fragen darf. – Ich habe Ihnen zugehört. Sie haben sehr breit über den Impfpass – tatsächlich – und die Chancen eines digitalen Impfpasses gesprochen. Aber Ihr gesamter Antrag bezieht sich in sämtlichen Forderungspunkten auf den digitalen Impfnachweis. Schauen Sie sich das einmal sehr genau an und dann sehen Sie, dass genau das verloren gegangen ist.
Wenn wir uns jetzt schon darüber unterhalten: „Wie kommen wir im Gesundheitswesen mit der Digitalisierung voran?“, dann kann ich nur an die Wahlperiode mit FDP-Gesundheitsministern erinnern. Ich kann mich auch noch sehr lebhaft an die Wahlkämpfe erinnern, weil Daniel Bahr in meinem Wahlkreis war.
Dazu kann ich Ihnen nur sagen: Es ist hoch und heilig versprochen worden, dass diese elektronische Patientenakte nicht kommt, und in genau dieser Wahlperiode, in der die FDP maßgeblich beteiligt war, ist in Sachen Digitalisierung nichts passiert.
Das ist die entscheidende Wahlperiode gewesen, in der der Anschluss in der Digitalisierung verpasst worden ist. Das muss man an dieser Stelle deutlich sagen. Wenn Sie sich hier in Sachen Digitalisierung so aufplustern, sollten Sie sich doch daran erinnern.
Deshalb will ich Sie als Fachmann, gerade auch für Infektionskrankheiten, fragen: Wie können wir diesen Immunitätsausweis sachgerecht immer wieder so auf den aktuellen Stand bringen, dass wir damit auch die Gefahren, die mit der Infektionslage verbunden sind, berücksichtigen?
Herzlichen Dank für diese Frage. – Das zeigt wieder einmal – Frau Klein-Schmeink, nichts für ungut –, dass grüne Politik immer rückwärtsgewandt ist und darauf schaut, was in der Vergangenheit passiert ist.
Ich denke, wir Freie Demokraten haben klar gezeigt, dass wir vorwärts gewandt sind und Zukunftsweisendes für die Menschen in unserem Land erreichen wollen. Die Menschen in diesem Land haben auch explizit verdient, dass wir uns hier weiterentwickeln. Es wäre schön, wenn auch die Grünen bei dieser Weiterentwicklung mitmachen würden und nicht immer kritisieren, was damals vor 10, vor 20 oder vor 30 Jahren passiert ist. Es gibt auch bei der grünen Politik genug Beispiele für Dinge, die schiefgelaufen sind und wo heute andere Positionierungen eingenommen werden. Ich denke, diese Art der Diskussion ist wirklich nicht zielführend. Viel wichtiger ist, dass wir in der Politik vorwärtsgewandt sind und immer nach vorne schauen, wie es weitergeht.
Natürlich müssen wir sehen, wie wir diese Gefahren meistern können. Da kann die Digitalisierung natürlich viel helfen. Sie wird natürlich nicht bei allem helfen, das ist für uns auch sehr klar. Aber von der SPD und auch von der Union wird immer nur diskutiert und nichts gemacht. Sie diskutieren darüber: Wir haben ja bald eine ePA, vielleicht ab 1. Januar 2022. – Oder die EU diskutiert darüber, was sie mit einem Impfnachweis macht. Aber das sind immer nur Versprechungen. Wie häufig sind wir gerade in dieser Pandemie von Lockdown zu Lockdown vertröstet worden? Ich denke, diese Art der Politik brauchen wir nicht. Ich kann Ihnen nur empfehlen, nach vorne zu schauen und zukunftsgewandt auch hier auf moderne und gute innovative Medizin zu setzen.
So, ich komme zum Schluss meiner Rede.
In dieser Pandemie ist es wichtig, meine Damen und Herren, dass Geschwindigkeit und Gründlichkeit keine Gegensätze sind, sondern machbar. Wir sollten nicht reden, wir sollten machen. Es wird Zeit, dass die Bundesregierung aus der Regionalbahn aussteigt, umsteigt auf die Schnellstrecke der ICE; denn wir können uns das Vertrödeln der Zeit nicht mehr leisten.
Kommen Sie zum Schluss, bitte.
Die Digitalisierung im Gesundheitswesen muss Fahrt aufnehmen. Deklarieren Sie bitte nicht in diesem Jahr, dass die PDF-Datei der ePA ein Erfolg ist. Wir müssen endlich unseren Turbo anschmeißen.
Herr Kollege, bitte.
Die Menschen unseres Landes haben es verdient. Ich freue mich auf die weitere Debatte.
Herzlichen Dank.
Vielen Dank, Herr Kollege Ullmann. – Nächste Rednerin ist die Kollegin Heike Baehrens, SPD-Fraktion.
