Habe die Ehre, Herr Präsident! Liebe Kolleginnen und Kollegen! Gott zum Gruße, liebe Gäste im Hohen Hause und zu Hause am Fernseher! Zunächst einmal Dank an die Landwirte, die gestern gegen dieses verfehlte Insektenschutzgesetz und für ihre Existenz demonstriert haben. Haltet durch, liebe Bauern. Denkt dran: Bald sind Wahlen.
Ich möchte mich zuerst auf die von Ihnen beabsichtigte Ausweitung des gesetzlichen Biotopschutzes konzentrieren. Sie wollen mit Ihrem Gesetz die landwirtschaftliche Nutzung von extensiv bis mittelintensiv bewirtschaftetem Grünland und von Streuobstwiesen gesetzlich stark einschränken.
Dabei waren es die Bauern, die über die Jahrhunderte diese Elemente unserer schönen Kulturlandschaft geschaffen, erhalten und gepflegt haben.
Diesen unverhältnismäßigen Eingriff in die Eigentumsrechte der Bauern lehnen wir ab und sagen deutlich in Richtung der schwarz-roten Koalition: Finger weg vom Eigentum der deutschen Bauern! Staatliche Eigentumseingriffe sind hier völlig fehl am Platz.
Verstehen Sie mich nicht falsch. Die Alternative für Deutschland räumt dem Artenschutz einen sehr, sehr großen Stellenwert ein, aber Artenschutz ist nur gemeinsam mit der Landwirtschaft möglich und nicht gegen sie,
wie es die schwarz-rote Koalition macht. Wir setzen deshalb bewusst auf Anreize anstatt auf Verbote.
Ja, sehr geehrte Damen und Herren, es gibt einige wenige wissenschaftliche Studien, die Indizien für einen allgemeinen Insektenrückgang aufzeigen.
Kein Aufruhr. Das Wort hat der Kollege Protschka.
Das Datenmaterial ist jedoch sehr dünn und nicht ohne Widersprüche. So hat das Deutsche Zentrum für integrative Biodiversitätsforschung beispielsweise erst kürzlich in einer Studie festgestellt, dass der Bestand bei Landinsekten zwar tendenziell rückläufig sei, beim Bestand an Süßwasserinsekten dafür Zuwächse zu verzeichnen sind.
Herr Kollege Protschka, der Kollege von der FDP möchte eine Zwischenfrage stellen.
Ja.
