Sehr geehrter Herr Präsident! Liebe Kolleginnen und Kollegen! Seit zehn Tagen ist Israel unter Beschuss. Die Raketen der Hamas aus dem Gazastreifen zielen auf Jüdinnen und Juden, und sie treffen die ganze israelische Bevölkerung.
Die Bilder und Berichte von den Luftangriffen auf Israel und im Gazastreifen erschrecken uns, auch mich ganz persönlich; denn ich denke oft an Freundinnen und Freunde, an Bekannte, die dort leben, an ihre Ängste, an die Nächte, die sie mit ihren Kindern im Treppenhaus oder in Bunkern verbringen müssen. Deshalb sage ich auch hier noch mal ganz klar: Der Terror der Hamas ist aufs Schärfste zu verteilen! Er muss sofort beendet werden!
Der Terror der Hamas ist durch nichts – durch nichts! – zu rechtfertigen oder zu relativieren.
Die Hamas nutzt Zivilisten, um Waffen zu schützen. Viele Militäreinrichtungen und Abschussrampen der Hamas sind mitten in dichtbesiedelten Wohngebieten, und die Menschen, die Zivilbevölkerung, werden als lebendige Schutzschilde missbraucht. Israel nutzt Waffen, um Zivilisten zu schützen. Mit dem Iron Dome kann Israel viele Raketen aus dem Gazastreifen abwehren – angesichts der Masse aber nicht alle. Israel schützt seine Zivilbevölkerung. Das ist das Recht des Staates Israel auf Selbstverteidigung.
Für mich ist ganz klar: Deutschland unterstützt das Existenzrecht Israels ohne Bedingungen; das ist es, was Staatsraison meint.
Ich danke Vizekanzler Olaf Scholz und Außenminister Heiko Maas und allen, die das so klar gesagt haben.
Liebe Kolleginnen und Kollegen, der Antisemitismus und Israelhass, der sich in Deutschland auf unseren Straßen zeigt, sind erschreckend. Hier muss mit allen rechtsstaatlichen Mitteln durchgegriffen werden. Es kann und darf nicht sein, dass Polizisten nicht eingreifen, wenn länger als eine Stunde offener Judenhass zur Schau getragen wird, so wie das vor einer Synagoge in Gelsenkirchen in Nordrhein-Westfalen passiert ist; das darf nicht sein.
Gleichzeitig müssen wir viel stärker vorbeugend gegen Antisemitismus vorgehen. Wir wissen, dass Antisemitismus in einem kleinen Teil der Bevölkerung tief verankert ist. Ein Beispiel sind die vielen rechtsextremen Verschwörungstheorien, die im Zuge der Coronapandemie in den sozialen Medien und auf Querdenkertreffen verbreitet werden.
Das ist mir wichtig, zu sagen, weil manche sich nur dann für Antisemitismus interessieren, wenn er einen Migrationshintergrund hat und man damit den eigenen Rassismus verschleiern kann.
Dieser jahrhundertealte Antisemitismus in seiner tödlichsten Form trifft jetzt auf tradierten Israelhass in Teilen unserer Zuwanderungsgesellschaft,
