Herr Präsident! Liebe Kolleginnen und Kollegen! Ich spare mir, hier das Papier von Rechtsaußen zu kommentieren. Ich finde, es ist Zeitverschwendung und nicht die Aufgabe des Deutschen Bundestages, Sektenmanifeste zu kommentieren, die Verschwörungsmythen verbreiten. Das brauchen wir hier wirklich nicht.
Ich möchte stattdessen zu den realen Problemen, insbesondere denen der deutschen Wirtschaft kommen.
Damit bin ich bei Peter Altmaier.
Peter Altmaier erzählt seit über zwei Jahren: Ja, wir wollen die Industrie dekarbonisieren. Wir wollen CO
Ich würde gerne mal wissen, was der Wirtschaftsminister dazu sagt, dass all das, was er seit zwei Jahren in Bezug auf die Klimaschutzziele erzählt, nicht stattfindet, dass die reale Entwicklung in unserem Land, in den Stahlwerken und den industriellen Kernen eine andere ist. Das ist Ihre Verantwortung, das ist Ihr Problem. Ich freue mich, Herr Peter Altmaier, wenn wir gleich etwas dazu hören.
Dann möchte ich zum zweiten Punkt kommen.
Gestatten Sie eine Zwischenfrage des Abgeordneten Peter Altmaier?
Aber gerne.
