Herr Präsident! Meine sehr verehrten Kolleginnen und Kollegen! Weil der Kollege Gauland hier erneut den Eindruck erweckt hat, es sei dem afghanischen Volk sozusagen innewohnend, Frauen und Mädchen zu unterdrücken und zu missbrauchen, möchte ich dem einmal entgegentreten: Das ist ungeheuerlich, Herr Kollege Gauland!
Und jeder Einsatz von Soldatinnen und Soldaten, der Frauen und Mädchen ein menschenwürdiges Leben in Afghanistan ermöglicht hat, war richtig, war notwendig,
und dahinter stehen wir politisch, meine lieben Kolleginnen und Kollegen.
Schauen Sie sich mal das mutige Beispiel der Bürgermeisterin Zarifa Ghafari an, die jetzt in Deutschland angekommen ist und die dem widerstanden hat. Es gibt dort diese mutigen Frauen,
und hinter denen haben wir gestanden und sollten wir weiterhin stehen.
Wir sollten uns nicht einreden lassen, dass Unterdrückung solcher imponierenden Persönlichkeiten irgendwie Afghanistan-immanent ist. Das ist falsch.
Diese Debatte ist keine Alltagsdebatte, sondern ist eine außerordentlich schwierige Debatte, auch für dieses Parlament, das die Bundeswehr regelmäßig in schwierigste Einsätze schickt. Die Lage in Kabul ist aber so gefährlich für die Frauen und Männer, die für uns dort jetzt im Auswärtigen Dienst und als Angehörige der Bundeswehr Dienst leisten, dass wir ihnen unsere Anerkennung zollen sollten. Was sie dort leisten, ist großartig. Die Soldaten haben geschworen, tapfer zu sein. Das sind sie. Unter größten Gefahren, unter kaum vorstellbaren Schwierigkeiten, unter ungeheurem Stress und schwersten seelischen Belastungen retten sie Tausende Menschen – Menschen, deren Verzweiflung kaum Grenzen kennt, Frauen, Kinder, Männer, die befürchten müssen, Opfer der Rache der Taliban zu werden. Um sie zu retten, steht die Bundeswehr Seite an Seite mit Soldatinnen und Soldaten der USA, Großbritanniens, Italiens und vieler anderer Verbündeter für eine Brücke der Hoffnung. Dafür sind wir ihnen unendlich dankbar. Wir stehen als Parlament und Nation in der Schuld dieser Frauen und Männer, meine lieben Kolleginnen und Kollegen.
Ich danke der militärischen Führung, aber auch der Inhaberin der Befehls- und Kommandogewalt, Verteidigungsministerin Annegret Kramp-Karrenbauer. Sie hat in bester Auftragstaktik General Arlt und allen militärischen Führern vor Ort Handlungsfreiheit zugesichert
und gesagt, dass sie dafür politisch hier in Berlin einsteht. Die Frau Wehrbeauftragte hat das gewürdigt. Ich will mich dem anschließen. Ich glaube, das ganze Haus, auch die FDP-Fraktion, sollte an dieser Stelle der Verteidigungsministerin den Rücken stärken
und ihr Respekt und Anerkennung für ihren Dienst zollen.
Dass es so weit kommen musste, ist Folge dramatischer militärischer Entwicklungen. Diese Koalition hatte unter schwierigen Diskussionen das Mandat bis zum Januar des nächsten Jahres verlängert, weil wir in der Tat die Sorge hatten, dass es schnell zu einem Kollaps kommen könnte, auch wenn keiner erwartet hat, dass es so rasch und rapide geht, wie es jetzt gegangen ist. Aber wir wollten an der Seite der Afghaninnen und Afghanen stehen und müssen an dieser Stelle feststellen, dass wir ein Opfer auch der Handlungsunfähigkeit Europas geworden sind.
Wir sind – die Bundeskanzlerin hat das unterstrichen – an dieser Stelle schlicht und ergreifend nach wie vor auf die Vereinigten Staaten von Amerika allein angewiesen.
Für mich sind dreierlei Dinge wichtig:
