damals respektvoll nannte – anzufertigen, damit wir es stolz den Eltern und Großeltern zeigen konnten.
Wie wurden diese 28 Kinder gruppiert? In drei Reihen. Es gab eine erste Reihe, in der saßen die Kinder, eine zweite Reihe, da standen sie, und eine dritte Reihe, da wurden sie
auf kippelige Stühle gestellt. Diejenigen aus der Roon- und aus der Moltkestraße und diejenigen mit dem akademischen und dem unternehmerischen Hintergrund saßen in der ersten Reihe, die
Facharbeiter- und Handwerkerkinder standen in der zweiten Reihe, und diejenigen aus den Barackensiedlungen, die kippelten in der dritten Reihe. Das war damals die Umsetzung einer Erwartung,
dass die einen auf das Gymnasium, die anderen auf die Realschule und die dritten auf die Haupt- oder auf die Sonderschule gehen sollten.
Das hat mich beschäftigt, und es sollte uns immer noch beschäftigten. Es hat schon ganz viel stattgefunden, damit dies heute nicht mehr so ist. In der nächsten Debatte heute
werden Sie einen Schwerpunkt setzen und dafür sorgen können, damit die Chancengleichheit, das gemeinsame Lernen und Leben von Kindern in ihrem Respekt gegenüber ihren eigenen Chancen und
Entwicklungsmöglichkeiten, einen zusätzlichen Baustein bekommt. Dafür werben wir. Dafür kämpfen wir. Das müssen wir jetzt gut machen. Und wenn ich sage: „Das müssen wir jetzt gut machen“, dann
muss ich ehrlich bleiben: Sie müssen noch ganz vieles gut machen. Dafür wünsche ich Ihnen alles Glück in diesem wunderbaren Parlament, dem Weinberg der Demokratie.
Danke schön.
