Es ist wirklich unfassbar, dass diese mörderische Waffenexportpolitik, die allein die Profite der Rüstungskonzerne im Blick hat, von Union, SPD, FDP und AfD einfach mitgetragen wird.
Und was die Grünen angeht, ist es wie beim römischen Gott Janus mit seinen zwei Gesichtern. Man fragt sich: Was gilt denn nun eigentlich? Hier beantragen Sie, Rüstungsexporte zu begrenzen, und zugleich trommelt Ihr Parteivorsitzender Robert Habeck mit Stahlhelm an der Front für Waffenlieferungen an die Ukraine, die sich im Krieg befindet.
Wenn man sich die grüne Regierungszeit anschaut, dann weiß man, welches Gesicht sich am Ende durchsetzt.
Mit den Leopard-2-Panzern, deren Export Sie unter dem Jubel von Herrn Fischer und Herrn Bütikofer auch noch ohne Einsatzbedingungen 2005 an die Türkei und Erdogan genehmigt haben, wurden 2018 die Kurden in Afrin niedergewalzt.
Das ist die Realität der Rüstungsexportpolitik der Grünen. Ich finde, wer glaubwürdig sein will, der muss dafür sorgen, dass er nicht janusköpfig agiert.
Die Linke tritt für ein gesetzliches Verbot von Waffenexporten ein. Die Mehrheit der Bevölkerung in Deutschland – zwei Drittel laut Umfragen – will den Stopp aller Rüstungsexporte. Die Linke findet: Es ist Zeit für eine Politik für die Mehrheit. Deshalb fordern wir einen generellen Stopp der Waffenexporte.
Vielen Dank.
Vielen Dank. – Der nächste Redner ist für die Fraktion der CDU/CSU der Abgeordnete Klaus-Peter Willsch.
