Sehr verehrte Damen und Herren, mit unserer Politik unterstützen wir den ländlichen Raum dabei, seine eigenen Initiativen und Ideen zu verwirklichen. Der Bund ist dabei immer ein
starker und verlässlicher Partner für den ländlichen Raum.
Noch ein paar Sätze zur aktuellen CO2-Debatte. Mobilität ist die Grundlage für unseren Wohlstand. Jeder muss sich Mobilität leisten können, auch in Zukunft. Wenn es um die
Verteilung der Kosten des Klimaschutzes geht, dürfen wir die Menschen im ländlichen Raum nicht vergessen und auch nicht benachteiligen. Es kommt darauf an, die Kosten fair zu verteilen.
Liebe Kolleginnen und Kollegen, gestatten Sie mir noch ein paar abschließende Worte. Ich bedanke mich recht herzlich für die gute Zusammenarbeit, für die vielen konstruktiven
Debatten und vor allem für all die guten Ideen, die wir gemeinsam für die Bürgerinnen und Bürger unseres Landes in den letzten Jahren eingebracht haben. Wir haben als Regierung in dieser
Wahlperiode viel erreicht. Deutschland steht trotz Coronapandemie gut da. Ich möchte recht herzlich Danke schön sagen an das Bundesverkehrsministerium, Herrn Minister Andreas Scheuer und die
beiden Parlamentarischen Staatssekretäre Ferlemann und Bilger. Ich wünsche Ihnen, nachdem es meine letzte Rede ist, alles Gute für die Zukunft, nur gute Beschlüsse für unser Land und vor allem
für den ländlichen Raum. Mir war es eine große Ehre, diesem Hohen Haus zwölf Jahre anzugehören.
Alles Gute und vielen Dank.
Vielen Dank, Herr Kollege Holmeier. – Sie haben sogar von der Regierungsbank Bekundungen bekommen. Das ist eigentlich unzulässig; aber angesichts der Tatsache, dass das Ihre
letzte Rede war, lasse ich das mal durchgehen. – Herr Minister Scheuer, normalerweise sind Bekundungen dieser Art von der Regierungsbank nicht zulässig.
Nächste Rednerin ist die Kollegin Ulli Nissen, SPD-Fraktion.
