Marginalisierte Gruppen twittern auch nicht so oft unter #IchBinHanna“. Aber wenn, dann berichten sie vor allem von den zusätzlichen Hürden, die sie überwinden müssen oder was sie letztlich sogar in den Abbruch treibt; denn auch in der Wissenschaft gibt es Frauenfeindlichkeit, Queerfeindlichkeit und alle Formen gruppenbezogener Menschenfeindlichkeit. Auch damit finden wir Grüne im Bundestag uns nicht ab und wollen mehr Diversity in der Wissenschaft wagen; denn alle haben das Recht auf gleiche Chancen
und die gibt es nur mit Respekt und besten Arbeitsbedingungen für alle.
Excellence und Diversity gehören zusammen in Deutschland und international.
Politik beginnt mit dem Betrachten der Wirklichkeit und braucht Mut zur Veränderung.
Diesen Geist würden wir uns ab September auch endlich wieder im BMBF wünschen. Wir wollen, dass mit Freiheit und Sicherheit besser geforscht werden kann, damit wir weniger Hannas und mehr Innovationen ernten.
Das Wort hat Dr. Astrid Mannes für die CDU/CSU-Fraktion.
