Frau Präsidentin! Liebe Kolleginnen und Kollegen! Von den Amigos über die Kohl-Spenden, Ehrenworte und – ich zitiere – „jüdischen Vermächtnisse“ der hessischen CDU bis hin zu
den aktuellen Aktienoptionen von Augustus Intelligence, Geld aus Aserbaidschan und den empörenden Maskendeals: Die Liste der Korruptionsskandale von CDU und CSU ist sehr lang, meine Damen und
Herren. Allein dieses Jahr, wenige Wochen ist es her – ich sage es nur mal: wenige Wochen –: strafrechtliche Ermittlungen gegen mindestens fünf namhafte Unionspolitiker, Vermögensarreste in
Millionenhöhe, Durchsuchungen von Büros hier im Deutschen Bundestag. Was sich Vertreter Ihrer Fraktion mit Maskengeschäften geleistet haben, sind keine Ausrutscher; es ist und bleibt ein
Skandal, meine Damen und Herren.
Aber es ist richtig, Herr Kollege Schnieder: Man kann nicht nur von einigen wenigen auf Ihre große Fraktion schließen, und es verbieten sich Generalverdächtigungen und pauschale
Verurteilungen gegen andere. Das ist immer richtig. Von einigen wenigen auf viele zu schließen, ist in einem Rechtsstaat immer falsch.
Aber zur Wahrheit, meine Damen und Herren, gehört auch: Diese Strukturen, die Lücken bei der Transparenz und Strafbarkeit sind im Schutz Ihrer ganzen Fraktion gewachsen. Sie alle
von CDU und CSU haben hier im Deutschen Bundestag Jahre und Jahrzehnte die Intransparenz, die Schutzlücken, die Einfallstore für Korruption mit allen parlamentarischen Mitteln verhindert, und
das geht voll auf Ihr Konto, meine Damen und Herren.
All das trotz der Skandale, gegen die Stimmen aus der Fachwelt und Zivilgesellschaft, trotz unzähliger Anträge hier im Deutschen Bundestag von meiner Fraktion, aber auch den
anderen Fraktionen.
