Deshalb bin ich froh, dass wir uns heute die Zeit nehmen und dieses Thema beraten. Es ist schon einiges passiert. Sie, Herr Gehrke, und auch Herr Riebsamen haben es angesprochen:
Wir haben zwei Krankenhausprogramme bzw. Hygieneprogramme, abgestimmt mit den Ländern, auf den Weg gebracht. Aber dieses Problem lässt sich leider nicht von heute auf morgen lösen.
Ich sage Ihnen auch: Angst, Herr Gehrke, ist da ein schlechter Ratgeber. Sie haben von 30 000 Menschen gesprochen, die pro Jahr an Krankenhausinfektionen sterben. Die Zahl wird
ja von vielen Praktikerinnen und Praktikern hinterfragt. Man geht eher von einem Drittel dieser Zahl aus. Und ich sage auch: So ein ernstes Thema eignet sich nicht für Übertreibungen.
Liebe Kolleginnen und Kollegen, auch ohne Übertreibung lässt sich festhalten – – Könnten wir vielleicht das Redepult noch ein bisschen herunterfahren, Herr Präsident? Das ist ein
bisschen hoch.
Wo drücke ich? Ach, hier; alles klar
