Sehr geehrte Frau Präsidentin! Werte Kolleginnen und Kollegen! Meine sehr verehrten Damen und Herren! Frauen kommen überallhin. – Das gilt in der Theorie, aber nicht in der
Praxis, und zwar, besonders wenn es um Führungspositionen geht, und das, obwohl Frauen im Schnitt bessere Abschlüsse machen als Männer. An der Qualifikation liegt es also nicht.
Deshalb liegt es an anderen Dingen: an Strukturen und Netzwerken. Das nennt man gläserne Decke – sieht man nicht, gibt es aber. Viele sagen: Frauen bekommen Kinder, und es
mangelt an der Vereinbarkeit von Familie und Beruf. Manche sagen sogar: Die Frauen sind selbst schuld. – Das ist alles einfach nur Quatsch. Hauptverantwortlich sind die Strukturen, und genau
deshalb ändern wir heute die Strukturen per Gesetz.
Zu lange hat die Wirtschaft gesagt: Das ändern wir selbst. Es ist nichts passiert; denn sonst wären mehr als 12 Prozent Frauen in Vorständen der DAX-Unternehmen.
Das ist auch deshalb fatal, weil Unternehmen mit Frauen in Vorständen wirtschaftlich erfolgreicher sind. Also muss politisch gesteuert werden, und deshalb führen wir heute die
erste Mindestquotenregelung für die Vorstände in der Wirtschaft ein. Das ist ein historischer Erfolg, den wir künftig ausbauen können.
Und wieso historisch? – Erstens weil wir Jahrzehnte dafür gekämpft haben. Mit „wir“ meine ich nicht nur Frauen und Männer, sondern auch die vielen Verbündeten in Politik,
Wirtschaft und Gesellschaft und natürlich auch meine Partei, die SPD.
Zweitens weil von einer Quote in der Wirtschaft nichts im Koalitionsvertrag steht. Im Wahlprogramm von CDU/CSU stand lediglich, dass sie konkret im öffentlichen Dienst etwas
ändern wollen, kein Wort von der Wirtschaft und den Vorständen. Und weil ich ebenso wie Caren Marks und Sönke Rix bei den Koalitionsverhandlungen dabei war, weiß ich: Es gab in den
Koalitionsverhandlungen null Spielraum.
