Bei aller Unterschiedlichkeit, die wir in der Bewertung hatten, wurde aber eines meiner Meinung nach sehr deutlich: Gleichwertige Lebensverhältnisse sind als Ziel richtig. Die
Umsetzung wird noch weitere Legislaturperioden brauchen, und einzelne Ansätze werden der komplexen Zielstellung wahrscheinlich schwer gerecht.
Die Zwischenbilanz hat aber auch gezeigt, wo nachgeschärft werden muss und wo es Umsetzungsdefizite gibt. Beispielsweise will ich hier den Dezentralisierungsansatz nennen. Da
heißt es im Plan für Deutschland, dass zum Beispiel Behördenansiedlungen vorrangig in kleinen und mittleren Städten erfolgen sollen. Schaut man sich nun die Zwischenbilanz an, so wird man
nicht ganz zufrieden sein, denke ich; denn die Ansiedlungen erfolgten tatsächlich überwiegend im Bereich von Großstädten und eben nicht in den zuvor genannten kleinen und mittleren Städten.
Hier brauchen wir – das ist klar – vor allem in der Umsetzung mehr Konsequenz, aber nicht nur vonseiten des Bundes, sondern auch der Länder, die aufgrund der Föderalistik zum Schluss für die
Städte zuständig sind.
Gleichwertige Lebensverhältnisse tangieren viele Bereiche, egal ob es, wie gerade beim Vorredner, um die Mobilität geht oder um die Infrastruktur, um die Wohnbedingungen oder um
die Kultur. Die Aufzählung könnte man sicherlich noch weiter fortführen. Unser Blick geht sehr oft auf die Großstädte mit ihren, ja, ebenfalls sicher drängenden Problemen. Aber – das muss man,
denke ich, immer wieder deutlich betonen –: Die weit überwiegende Fläche unseres Landes liegt nun einmal im ländlichen Raum, und auch die überwiegende Anzahl der Menschen wohnt im ländlichen
Raum.
Wenn ich das sage, geht es mir keineswegs darum, Konflikte zwischen Stadt und Land weiter zu postulieren, sondern im Gegenteil: Ich bin der Meinung, dass der ländliche Raum
helfen kann, Probleme der Ballungsräume zu lösen. Ich denke hier an das Wohnungsmarktproblem, oder ich denke an Infrastrukturüberlastungen, die wir dort haben. Genau deshalb, weil diese
