– Aber Sie können eine Evaluation nicht vornehmen, wenn an Hochschulen im Moment gar nichts stattfindet. Wir haben aufgrund der Pandemie die Höchstbefristungsdauer im Wissenschaftszeitvertragsgesetz verlängert. Das können Sie doch aber in so eine Evaluation nicht einfließen lassen. Sie brauchen doch einen Zeitraum, in dem sie das auch beurteilen können. Die Evaluation hat am 1. Januar 2020 begonnen. Wir erhalten zum Ende des Jahres erste Ergebnisse, und dann liegt im Frühjahr das Ergebnis vor.
Eines kann ich Ihnen hier und heute übrigens schon versprechen: Wir haben 2016 eine klare Erwartungshaltung mit dem Gesetz verbunden. Wenn unsere Erwartungen nicht erfüllt werden, dann kommt das Thema zügig wieder auf die Tagesordnung dieses Hohen Hauses.
Meine lieben Kolleginnen und Kollegen, Wissenschaftlerinnen und Wissenschaftler in unserem Land leisten jeden Tag hervorragende Arbeit. Sie tragen zu Wohlstand und Fortschritt entscheidend bei. Sie entwickeln Impfstoffe, sie helfen, dem Klimawandel entgegenzutreten. Dafür verdienen sie Respekt und Dank und Unterstützung.
Sie verdienen aber auch eines: Aufrichtigkeit. Das, was hier nun von verschiedenen Seiten gefordert wird, sind leere Versprechungen. Bevor Sie auf der linken Seite des Hauses hier das Blaue vom Himmel versprechen – Dauerstellen für alle –,
sprechen Sie mit der Wissenschaft, mit den Hochschulen, mit den außeruniversitären Forschungseinrichtungen. Genau die werden Ihnen sagen: Wir brauchen Befristungsregeln. Wir können nicht allen Promovierten eine dauerhafte Perspektive bei uns eröffnen, wenn wir die Dynamik und den Erfolg unseres Wissenschaftssystems erhalten wollen.
Und sprechen Sie mit Ihren Parteifreunden in den Landesregierungen. Fragen Sie dort: Warum schafft Ihr nicht mehr Dauerstellen?
