Was wir nicht brauchen, ist ein Arbeiten bis zum Umfallen. Und deswegen ist die Debatte über die Rente mit 68 auch grundfalsch.
Ich persönlich kenne Maurer, Maler, Gas-Wasser-Installateure, Trocken- und Gerüstbauer, die stehen mit 50 mit Schmerzen auf, arbeiten hart und gehen mit Schmerzen ins Bett. Die sind froh, wenn sie mit 60 Jahren noch arbeitsfähig sind. Eine Rente mit 68 bedeutet für diese Gruppe faktisch eine Rentenkürzung, und ja, das ist asozial.
Die Forderung nach einer längeren Lebensarbeitszeit ist im Übrigen keine Forderung aus dem Elfenbeinturm der Wissenschaft, sondern auch eine Forderung aus der Mitte der CDU. Ich erinnere nur an den Aufruf von Christoph Ploß, dem Vorsitzenden der CDU in der Hansestadt Hamburg. Was wissen wir über ihn? Abitur, Zivildienst, Bachelor, Master, Pressereferent, Bundestag. Von Berufs wegen hat der Mann noch nie einen Ziegel in der Hand gehalten, will aber denjenigen, die jeden Tag tausend Ziegel bewegen und die zwei Tonnen Ausgleichsmasse in den vierten Stock tragen, sagen, dass sie länger arbeiten sollen. Da, meine Damen und Herren, verwundert es überhaupt nicht, wenn die Leute da draußen sagen, dass sie keine Lust mehr haben auf diese Politik. Sie müssen sich hier nicht wundern, wenn die Politikverdrossenheit steigt und der Vertrauensverlust in der Gesellschaft zunimmt.
Herr Ploß geht übrigens – wie wir alle hier im Deutschen Bundestag – nach vier Jahren im Bundestag, wenn er denn geht, mit einem Pensionsanspruch von 1 000 Euro; das ist mehr als der Rentner im Durchschnitt in Deutschland bekommt.
Meine Damen und Herren, wir fordern eine Abschaffung der Politikerpension und eine Einbeziehung der Politiker in die gesetzliche Rentenversicherung. Und wir fordern noch etwas anderes, nämlich dass die Prioritäten richtig gesetzt werden. Die Bundesregierung überweist Milliardenbeträge an Kindergeld ins europäische Ausland. 23 Milliarden Euro an Flüchtlingskosten zahlen wir im Jahr. 44 Milliarden Euro werden wir dieses Jahr nach Brüssel überweisen. Von dort wird es in Länder verteilt, wo das Rentenniveau höher ist, die Lebensarbeitszeit und das Renteneintrittsalter aber niedriger sind. Hören Sie auf, den Leuten in diesem Land zu erzählen, es sei kein Geld für die Rente da.
Denken Sie bitte an Ihre Redezeit.
