Eine Quellensteuer auf die in Deutschland erwirtschafteten Umsätze von Digitalkonzernen, die ihre hierzulande erzielten Gewinne im Ausland erfassen, wird eingeführt …
Meine sehr verehrten Damen und Herren, eine Quellensteuer auf hier erwirtschaftete Umsätze ist wahrscheinlich keine Ertragsteuer. Diese Frage taucht immer auf, wenn über das Thema Digitalsteuer diskutiert wird; denn man weiß nicht – auch die OECD nicht –, ob das eigentlich eine Umsatzsteuer oder eine Gewinnsteuer wird. Wenn es eine Umsatzsteuer wird, dann ist es in der Tat so, dass nur der Verbraucher sie trägt. Das heißt, die Ertragskraft des Unternehmens würde gar nicht getroffen.
Bei der Gewinnsteuer ist es so: Wenn beispielsweise Daimler Benz, dessen Sitz in Deutschland ist, in China Autos verkauft, dann werden die Gewinne, die aus diesen Umsätzen generiert werden, gottlob in Deutschland besteuert. Das gilt für VW do Brasil, für BASF und für viele andere. Es ist hochgefährlich, bloß weil die Amis tüchtige Digitalkonzerne haben, an dieser Schraube zu drehen und so zu tun, als sei der Ort des Unternehmenssitzes nicht der maßgebliche Ort für die Frage der Gewinnbesteuerung – natürlich in einer Konzernstruktur, die die Gewinne letztlich an den Ort des Konzernsitzes schleust.
Wir haben das im Finanzausschuss über Monate immer wieder diskutiert. Ich erinnere mich an einen früheren Ministerialdirektor – er ist dann in den Ruhestand gegangen –, der immer warnend gesagt hat: Hört auf, das Steuersubstrat umzudefinieren; dann wird Deutschland der Riesenverlierer sein. – Wir sind nun einmal Exportweltmeister. Wenn der Exportweltmeister zulässt, dass das Steuersubstrat nicht mehr am Ort der Unternehmenssitze hergestellt wird, sondern da, wo die Umsätze getätigt werden, dann wird das vor allem mit Blick auf China sehr interessant, weil die Chinesen dann Steuern auf die verkauften Autos deutscher Unternehmen erheben.
Insofern, lieber Herr De Masi, spielen Sie wirklich weit unter Ihrem Niveau. Das kann überhaupt nicht funktionieren, was in Ihren Anträgen steht. Deshalb ist die Frage, was Sie sich dabei gedacht haben, dieses – das muss man schon so sagen – wirklich armselige und dünne Papier hier vorzulegen.
Noch abschließend: In der Tat ist es erstaunlich, dass Amazon zwar weltweit eine Umsatzexplosion hatte, nicht aber in Deutschland. Ich habe mir extra noch einmal die Zahlen angeschaut. Selbst wenn sie dort herankämen, kämen Sie nicht zu einer größeren Beute, die Sie so gerne machen würden.
Herzlichen Dank.
Vielen Dank. – Das Wort geht an Bernhard Daldrup von SPD-Fraktion.
