und schaffen damit wichtige Voraussetzungen für eine erfolgreiche Ganztagsbetreuung. Es gilt nun – das ist nur eine kleine Mahnung, das wurde heute auch schon mehrfach
angesprochen –, den letzten Kraftakt zu meistern und diese historische Chance, die wir heute und in den nächsten Wochen miteinander haben, ebendiesen Ganztagsanspruch in einer Grundschule zu
verankern, nicht leichtfertig aufs Spiel zu setzen.
Meine Damen und Herren, der Bundestag verabschiedet viele, viele Gesetze. Einige geraten leider allzu schnell in Vergessenheit. An diesem Gesetz mitgearbeitet zu haben, war für
mich eine sehr große Ehre: für die zukünftigen Melanies, für die zukünftigen Carlos’, für alle Kinder und Familien in diesem Land. All das wird bleiben.
Herzlichen Dank.
Für die CDU/CSU-Fraktion hat nun der Kollege Maik Beermann das Wort.
