Frau Präsidentin! Meine verehrten Damen und Herren! Wir kommen heute zusammen, um über drei große Herausforderungen zu sprechen, die uns miteinander bewegt haben: die Coronapandemie – dazu müssen wir heute Beschlüsse fassen –, das furchtbare Geschehen in Afghanistan, über das wir eben so lange gesprochen haben, und natürlich auch und erneut und richtigerweise die Frage, wie wir mit der schlimmen Katastrophe umgehen und was wir tun im Hinblick auf die Hochwasserschäden, die weite Teile unseres Landes betroffen haben.
Die Bilder von den Zerstörungen – viele Bürgerinnen und Bürger haben sie gesehen – in Rheinland-Pfalz, in Nordrhein-Westfalen, in Bayern und auch zu einem kleinen Teil in Sachsen sind schlimm. Noch schlimmer sind die Zerstörungen, wenn man sie real vor Ort sieht. Schlimm ist, was wir an menschlichem Leid erfahren mussten. Viele sind gestorben. Und das Leid der Angehörigen, die ihre Liebsten verloren haben – das muss gesagt werden –, können wir nicht lindern, und wir können auch nicht trösten.
Für uns ist aber wichtig, dass wir jetzt und an dieser Stelle tun, was wir tun können, nämlich Solidarität zeigen, dafür sorgen, dass denjenigen geholfen wird, denen jetzt geholfen werden kann, denjenigen, deren Häuser zerstört worden sind, den Gemeinden, den Landkreisen, den Ländern, die große Zerstörungen an der Infrastruktur zu beklagen haben und beheben müssen. Wir müssen alles dafür tun und die entsprechenden finanziellen Mittel einsetzen, damit wieder aufgebaut werden kann, was zerstört worden ist. Genau das beraten wir heute.
Mit der Soforthilfe, die der Bund mit den Ländern vereinbart hat, ist schnell gehandelt worden. Jetzt geht es um den Wiederaufbau all dessen, was zerstört worden ist. 30 Milliarden Euro werden dafür zur Verfügung gestellt: vermutlich 2 Milliarden Euro für die Infrastruktur des Bundes, 28 Milliarden Euro für all die anderen Zerstörungen, über die ich eben gesprochen habe. Ich finde, es ist ein ganz beeindruckendes Zeichen der Solidarität, das wir hier gemeinsam als gesamter Staat setzen, weil wir sagen: Das ist nicht alleine eine Angelegenheit all jener, die jetzt mit dieser Herausforderung zu kämpfen haben. Das ist eine Angelegenheit des ganzen Landes, und wir stehen an dieser Stelle zusammen.
Es ist auch bewegend, zu sehen, wie viel Solidarität von vielen gezeigt worden ist, die unmittelbar vor Ort geholfen haben, von der Feuerwehr, vom Technischen Hilfswerk, der Bundeswehr, die einen großen Einsatz gezeigt hat, aber selbstverständlich auch von vielen Bürgerinnen und Bürgern, die einfach vor Ort waren und versucht haben, irgendwie zu helfen. Dass wir dieses große und starke Zeichen der Solidarität sehen, ist auch eine ermutigende Botschaft für die Zukunft unseres Landes; denn es ist eben doch anders, als manchmal gesagt wird: Wir sind zur Solidarität, wir sind zum Gemeinsinn und wir sind zum Miteinander fähig und willens. Das zeigen die Bürgerinnen und Bürger unseres Landes bei der Bekämpfung dieser Katastrophe.
Wenn wir diese Katastrophe jetzt aufarbeiten, wenn wir dafür Sorge tragen, dass wir all das tun, was notwendig ist, damit Zerstörtes wieder instand gesetzt werden kann, dann müssen wir natürlich auch darüber diskutieren, was das für uns ansonsten bedeutet. Denn eins ist ganz klar: Diese Katastrophe, dieses Unwetter, dieses Starkwetterereignis, dieses Hochwasser – das ist auch eine Folge des menschengemachten Klimawandels,
und es kann an dieser Stelle nicht zur Tagesordnung übergegangen werden. Wir müssen den menschengemachten Klimawandel bekämpfen.
Das ist eine globale Herausforderung, und deshalb werden wir weltweit zusammenarbeiten müssen.
