Damoklesschwert der Troika im Nacken haben und die Angst, in ihrem Land abgewählt zu werden, weil sie versuchen, ihren Staatshaushalt, ihre Wirtschaft zu retten. Deshalb verabschieden wir uns
von der Troika und regeln ab sofort den Zugang über ein Memorandum of Understanding. Das ist der richtige Schritt. Wir brauchen diese vorsorgliche Kreditlinie; aber sie muss auch
funktionieren, liebe Kolleginnen und Kollegen.
Wir machen den ESM am Ende zur Letztsicherung für den europäischen Bankenrettungsschirm. Das klingt auch technisch, bedeutet aber, dass in einer Haftungskaskade erst mal die
Gläubiger für die Bank einstehen müssen und der ESM quasi der Letztsicherungsmechanismus ist, man also nicht mehr Wetten darauf abschließen kann, dass eine Bank „too big to fail“ ist. Das
sorgt für Stabilität im Euro-Raum. Das ist auch eine wichtige Entscheidung, die getroffen wurde, liebe Kolleginnen und Kollegen.
Wir haben in dieser Legislaturperiode einen neuen Aufbruch für Europa initiiert, so wie der Koalitionsvertrag überschrieben war, in Zeiten, die wir bei Unterschrift des
Koalitionsvertrages nicht vorhersehen konnten. Europa ist in dieser Krise solidarisch zusammengewachsen. Auch das bringt der heutige Beschluss zum Ausdruck. Oder um es mit Friedrich Schillers
„An die Freude“ zu sagen: „Deine Zauber binden wieder, was der Mode Schwert geteilt.“
Ich danke für Ihre Aufmerksamkeit.
Nächster Redner ist der Kollege Albrecht Glaser, AfD.
