Wir müssen unsere Bundeswehr stärken, damit sie sich auf ihren Auftrag konzentrieren kann. Dieser Auftrag – Ministerin Kramp-Karrenbauer und General Zorn haben ihn in dieser Woche mit ihrem Eckpunktepapier bereits deutlich umrissen – wird die Bundeswehr in Zukunft noch mehr fordern. Deshalb muss sie ihre Kräfte auf das Wesentliche konzentrieren, anstatt sich mit extremistischen Soldaten in den eigenen Reihen zu beschäftigen.
Und weil die künftigen Aufgaben fordernd sind, wird die Bundeswehr die Reserve stärken, die in vielfacher Weise die aktive Truppe entlastet. Deshalb müssen wir auch bei den Reservisten genau hinschauen
und den gleichen Maßstab wie bei aktiven Soldaten anlegen. Denn auch bei den Reservisten soll die Sicherheitsüberprüfung herausfinden, ob ein Bürger den hohen Sicherheitsanforderungen, die der Bund an gewisse Aufgaben stellt, gerecht wird. Wir wollen wissen, wen wir mit sensiblen Aufgaben betrauen. Denn es gibt eben Fälle, in denen Menschen Gedanken entwickeln, die nicht mit unserer demokratischen Grundordnung vereinbar sind – das haben Ausnahmen der jüngeren Vergangenheit leider gezeigt –, und denen möchte ich definitiv keine sicherheitsempfindlichen Aufgaben übertragen.
Meine Damen und Herren, ich bitte Sie um Zustimmung zum vorliegenden Gesetzentwurf, weil ich davon überzeugt bin, dass wir damit das Sicherheitsfundament der Bundeswehr stärken. Die Bundeswehr baut darauf, dass ihre Soldaten und Reservisten gemäß der Gelöbnisformel und den Paragrafen des Soldatengesetzes treu dienen und für die freiheitliche demokratische Grundordnung eintreten.
Die Bundeswehr lebt davon, dass Soldaten und Reservisten mit voller Leidenschaft ihren Dienst verrichten. Das machen sie, wenn sie wissen, dass unter ihnen keine schwarzen Schafe sind, die den guten Ruf der Bundeswehr beschmutzen. Es geht darum, eine tragfähige Grundlage zu schaffen, damit Soldaten in Verwendungen mit besonders hohen Sicherheitsanforderungen eingesetzt werden können. Es geht darum, Reservisten einzusetzen, die viele Monate oder gar Jahre keine Wehrübung mehr abgeleistet haben und demnach in das erforderliche Sicherheitsnetz der Bundeswehr integriert werden müssen. Deshalb bitte ich Sie um Unterstützung für den vorliegenden Entwurf. Damit unterstützen Sie die Bundeswehr, ihre Soldaten und ihre Reservisten.
Danke.
Der nächste Redner für die Fraktion der AfD ist der Abgeordnete Berengar Elsner von Gronow.
