Immunsystem geschwächt ist, Patienten, die besonders anfällig sind für aggressive Krankenhauskeime.
Ärzte und Pflegekräfte, meine sehr verehrten Damen und Herren, tun alles, was in ihrer Macht steht. Aber trotzdem – das muss man sagen – infizieren sich mehrere 100 000 Patienten
jedes Jahr mit Krankenhauskeimen; leider kommt es auch zu schweren Verläufen.
Ich habe kürzlich ein Gespräch mit einer Rechtsanwältin geführt, die lange Jahre als Krankenschwester gearbeitet hat und sich mit Medizinrecht beschäftigt: Frau Buder aus
Marburg. Sie vertritt viele Betroffene in Hessen, die Opfer von Krankenhauskeimen geworden sind. Es ist leider so – wir sind die Fälle anonymisiert durchgegangen –: Lungenentzündungen,
Wundinfektionen sind keine Seltenheit, bei manchen Mandanten gab es auch langfristige Schäden bis hin zu chronischen Herzschäden oder zerfressenen Nasen. Sie alle kennen wohl die Beispiele.
Leider sterben immer noch viele Menschen infolge einer Infektion mit Krankenhauskeimen oder an Blutvergiftung; auch das muss man festhalten.
Noch mehr und bessere Hygienemaßnahmen müssen wir deswegen auf den Weg bringen; das ist unsere politische Aufgabe. Ich als Gesundheitspolitiker, der lange im Gesundheitsausschuss
tätig ist, sage ganz klar: Jeder Mensch, der infolge einer Infektion mit Krankenhauskeimen oder an Sepsis stirbt, ist einer zu viel. Das kann man, glaube ich, wirklich sagen.
