Länder und Kommunen ächzen unter der Lockdown-Krise, die ihnen diese Regierung eingebrockt hat. Länder und Kommunen ächzen immer mehr unter den Aufgaben, die ihnen der Bund
aufbürdet. Wenn dieses Gesetz so verabschiedet wird, dann werden Familien vermutlich durch Grundsteuer- und Grunderwerbsteuererhöhungen den neuen Rechtsanspruch kräftig mitbezahlen. Dann gibt
es halt für Paul und Sophie einen Ganztagsplatz, aber für Mama und Papa vielleicht eine kleinere Wohnung oder eben kein Häuschen im Grünen.
Ein Kinderfreizeitbonus vor der Wahl. Das ist schön; das ist gut für die Kinder. Aber natürlich kann man da auch an Wahlgeschenke denken oder an Helikoptergeld, das zur
Ankurbelung der Wirtschaft dienen soll.
Wir werden trotzdem dem Kitafinanzhilfenänderungsgesetz zustimmen und uns beim Ganztagsförderungsgesetz aus besagten Gründen enthalten. Die Bundesregierung lindert hier einen
Teil der Folgen ihrer missratenen Lockdown-Politik, aber sie schafft immerhin Verbesserungen. Das muss man anerkennen.
Vielen Dank.
Das Wort hat der Kollege Marcus Weinberg für die CDU/CSU-Fraktion.
