Im Ausschuss für Bildung und Forschung haben wir in dieser Wahlperiode oft über den Transfer von Forschungsergebnissen in zukunftsweisende und marktfähige Produkte gesprochen;
doch so richtig weitergekommen sind wir nicht. Das liegt hauptsächlich an einer zentralen Fehlvorstellung, die auch allen heute vorliegenden FDP-Anträgen innewohnt. Und zwar meine ich damit
den Irrglauben an eine Art wissenschaftliche Planwirtschaft, den hier alle Parteien außer der AfD pflegen.
Schauen wir uns mal an, welche Rohrkrepierer die Altparteien so vorschlagen und angeschoben haben: Da gab es von der Bundesregierung die vielgepriesene Agentur für
Sprunginnovationen. Diese Agentur soll entscheiden, welche Forschungsprojekte gefördert und zu marktfähigen Produkten gepusht werden sollen. Da sitzt also ein Gremium von zehn Leuten, das
munter das Geld unserer Steuerzahler zum Fenster rauswirft, und zwar 100 Millionen Euro, jedes Jahr. Sie fragen nach Erfolgen? Die gab es bisher nicht. Man kann diese Agentur also mit Fug und
Recht als wahre Geldverbrennungsmaschine bezeichnen.
