Das Gleiche gilt für die Studien, die Sie gerade genannt haben. Sorry, aber das ist einfach Unsinn. Wir sehen jeden Tag in diesem Land, wir sehen jeden Tag auf der Welt, dass Impfungen schützen.
Sie werfen immer zwei Dinge durcheinander. Ich hatte in diesen Tagen eine Diskussion daheim im Wahlkreis. Dort sagte Ihr Kandidat: Impfen nützt nichts. – Es geht einmal um die Frage, ob man geimpft ist oder nicht geimpft ist und wie man miteinander umgeht. Darüber kann man, auch mit vielen Emotionen, diskutieren. Zum anderen geht es um die Frage, wie man über Impfungen insgesamt und ihre Wirkungen redet. Wer sagt, dass eine der wirksamsten und sichersten Impfungen, auch was die Impfreaktionen und Nebenwirkungen angeht, die es in der Menschheitsgeschichte jemals gegeben hat – made in Germany übrigens –,
nichts nützt und nicht wirkt, der führt die Leute einfach nicht nur an der Nase herum, sondern betreibt auch ein ganz gefährliches Spiel in dieser Pandemie. Das ist das Problem.
Sie wollen immer Patrioten sein, aber Sie machen jeden Tag das Gegenteil, indem Sie die Leute mit dem, was Sie hier erzählen, verunsichern. Dazu vermengen Sie auch immer legitime Themen. Man muss, finde ich, über die Frage, wie das Verhältnis von „geimpft“ zu „ungeimpft“ aussieht, diskutieren. Das ist ein emotionales Thema in jeder Familie. Die Frage ist immer nur, wie: faktenbasiert, indem man versucht, vernünftig auf die Dinge einzugehen, oder indem man am Ende jedem kleinen Ding hinterherhechelt, das man bei Social Media irgendwie posten kann. Das ist eben der Unterschied. Wir versuchen, das auf vernünftiger Basis zu machen.
Ich möchte auf unser Ziel zurückkommen – das ist auch für die Kolleginnen und Kollegen der FDP wichtig; es wäre schön, wenn Herr Kubicki da wäre, nach allem, was er jeden Tag öffentlich sagt –:
Unser Ziel ist seit Beginn dieser Pandemie das gleiche, und zwar eine Überlastung unseres Gesundheitssystems zu vermeiden. Dank der Impfungen liegt die Sieben-Tage-Inzidenz bei der besonders gefährdeten Bevölkerungsgruppe der über 60-Jährigen gegenwärtig bei 13, also deutlich niedriger, und nur sehr wenige Geimpfte erkranken noch so stark, dass sie ins Krankenhaus müssen. Mehr als 90 Prozent der wegen Corona auf den Intensivstationen behandelten Patienten sind nicht geimpft. Die Impfung wirkt, die Impfung schützt. Allein diese Zahlen zeigen es.
