Ich glaube aber, die Frage der Fürsorge geht weit über die Tauglichkeitsuntersuchung hinaus und endet nicht beim medizinischen Gutachten. Sie ist weiter gefasst. Ansonsten könnte man ja auch das allgemeine Renteneintrittsalter in Deutschland auf 90 Jahre anheben, soweit der Beschäftigte kein gesundheitliches Negativattest vorlegen kann.
Folgt man der Strategie der Reserve aus dem Jahr 2019 – die müssten Sie ja kennen –, so liegt der Bedarf vor allem bei jüngeren Reservisten. Es gibt ein beträchtliches Potenzial an ausscheidenden Bundeswehrangehörigen, die noch über Jahre hinweg als Reservisten dienen können. Diese Feststellung ergibt sich aus einer ganz einfachen Betrachtung: Der größte Anteil an ausscheidenden Soldatinnen und Soldaten besteht aus freiwillig Wehrdienstleistenden und Soldaten auf Zeit. Diese sind aufgrund ihres Alters in der Lage, über lange Jahre hinweg Reservedienst leisten zu können.
Aber auch die Berufssoldaten, die im Alter zwischen 55 und 62 Jahren aus dem aktiven Dienst ausscheiden, können noch drei bis zehn Jahre in der Reserve mitwirken. Da ihre Zahl nun wiederum im Vergleich zu den freiwillig Wehrdienstleistenden und Soldaten auf Zeit deutlich geringer ist, entspricht der Status quo bei der Altersbegrenzung dem Grundmodell einer sogenannten Grundbeorderung von sechs Jahren nach dem jeweiligen Dienstzeitende. Zudem habe ich den Eindruck gewonnen, dass Jüngere ganz gerne die Dienstposten von Älteren übernehmen würden.
Schließlich sollte man sich noch mal genau überlegen, ob man die Büchse der Pandora öffnet. Ein Entfall der Altersgrenze für Reservisten würde zu einer erneuten Diskussion über die allgemeine Altersgrenze in der Bundeswehr führen. Sie liegt für Berufssoldaten nach § 45 des Soldatengesetzes bis auf Ausnahmen bei 62 Jahren. Würden wir also bei der Reserve die Altersgrenze verschieben, provozierten wir damit die Frage nach einer mit der demografischen Entwicklung korrespondierenden Anpassung des regulären Ruhestandes in den Streitkräften.
Aktive Bundeswehrangehörige und Reservisten unterliegen in ihrem Dienst oftmals derselben körperlichen Belastung, sodass man beide Gruppen durchaus vergleichen kann. Warum sollten also Berufssoldaten mit 63 Jahren den physischen Anforderungen des Dienstes nicht mehr gewachsen sein, während Reservisten mit 73 Jahren auch in einem hoffentlich nie eintretenden Bündnisfall ihre Frau oder ihren Mann zu stehen haben?
Sehr verehrte Kolleginnen und Kollegen aus der FDP, grundsätzlich stehen wir einer erneuten Erörterung der Abschaffung der Altersgrenze für die Reserve offen gegenüber. Dafür müsste zunächst aber nachgewiesen werden – das hat Kollege Jens Lehmann schon betont –, ob es im Bereich der Flankierung der Landes- und Bündnisverteidigung oder für die zivil-militärische Zusammenarbeit wirklich einen zusätzlichen Personalbedarf von Älteren in der Reserve gibt. Auf der Grundlage von validen Daten, auf die Sie in Ihrem Antrag großzügig verzichten –
es gibt gar keinen Begründungsteil –, könnte man Ihr Anliegen erneut aufgreifen. Die SPD-Bundestagsfraktion lehnt den FDP-Antrag in der vorliegenden Form ab.
Vielen Dank.
Vielen Dank, Herr Kollege Dr. Brecht. – Nächster Redner ist der Kollege Tobias Pflüger, Fraktion Die Linke.
