Herr Präsident! Liebe Kolleginnen und Kollegen! Die absolute Armut in der Welt sinkt seit 30 Jahren kontinuierlich, Gott sei Dank. Hunderte Millionen Menschen sind in Lohn und
Brot gekommen; ihre Lebensbedingungen haben sich dramatisch verbessert. Diesen Fortschritt verdanken wir nicht wohlgemeinten Gesetzen hier, sondern Handel und Investitionen in der Welt. Dazu
haben gerade deutsche Unternehmen erheblich beigetragen. Das sollten Sie anerkennen, liebe Kolleginnen und Kollegen von der Koalition.
Herr Heil, Sie haben ja vollkommen recht: Es gibt zu viele, viel zu viele Verletzungen fundamentaler Rechte, zu viel Kinderarbeit in viel zu vielen Ländern und Regionen dieser
Welt. Deshalb ist und bleibt es an erster Stelle die Aufgabe der Bundesregierung, sich mit allen Mitteln für die Stärkung der Menschenrechte einzusetzen. Aber bitte machen Sie sich keinen
schlanken Fuß, indem Sie die menschenrechtliche Verantwortung auf die Unternehmen abwälzen! Welche Botschaft wird eigentlich in den Präsidentenpalästen des Globalen Südens ankommen? Dass Sie
die Wirtschaft in Haftung nehmen, weil Ihre Menschenrechtspolitik ein stumpfes Schwert geblieben ist? Ihr Gesetz liefert doch geradezu den Vorwand dafür, dass sich Zustände nicht da bessern,
wo Staaten ihrer Erstverantwortung nicht gerecht werden. Das kritisieren wir.
