Frau Präsidentin! Meine Damen und Herren! Liest man FDP-Anträge – nicht nur diesen Antrag –, spürt man die Angst, der Untergang des Abendlandes stünde bevor, wenn wir in
Deutschland Tarifverträge, Arbeitsrecht und Unternehmensteuern stärken. Zur Beruhigung: Der Untergang bleibt aus; er ist auch ausgeblieben. Bereits seit 70 Jahren sind diese gelebte Realität
in diesem Land oder, um es mit den Worten der FDP zu sagen: Leistung muss sich lohnen.
Zugleich staunt man, wie selbstverständlich Sie in diesem Antrag zugleich fordern, der Staat möge Unternehmen Liegenschaften bereitstellen, er möge für bessere Bildung sorgen, er
möge attraktive Wohnungen und Wohnumgebung bereitstellen, er möge Breitbandleitungen verlegen.
Ja, alles richtig. Das sind wichtige Ziele; da muss sich die öffentliche Hand engagieren. Immerhin: Ihr gelobter Markt hat in diesen Bereichen versagt.
Wenn Wirtschaft, wenn Gesellschaft, wenn Menschen – ja, auch die Wirtschaft – Nutznießer sein sollen, muss sich die öffentliche Hand rühren. Das haben wir als Linke schon seit
vielen Jahren in diesem Hause vertreten.
Aber was wir nicht brauchen, sind Sonderwirtschaftszonen in Deutschland. Wir brauchen auch keine sogenannten Maquiladoras. Das sind diese Fabriken entlang der mexikanischen
Grenzlinie zur USA. Dort werden zu Niedrigstlöhnen Einzelteile für multinationale Konzerne zusammengesetzt.
