Wenn wir über Mädchen- und Frauenrechte reden, dann reicht es doch nicht, zu sagen: Die müssen wir irgendwie stärken.
Wenn wir die Berichte hören, dass Taliban jetzt wieder durch das Land ziehen, wenn wir hören, dass sie erst von den Familien in den Dörfern bekocht werden und dann 10- bis 70-Jährige vergewaltigen, dann können wir doch nicht sagen: Wir warten auf die nächste Bundesregierung, das nächste Parlament, und gucken dann mal, wie wir aufklären. – Nein, unsere Verantwortung ist, das hier gemeinsam in diesem Moment zu beschließen.
Das bedeutet auch, hier in diesem Moment alles zu tun, was wir tun können. Das bedeutet, jetzt einen Afghanistan-Gipfel einzuberufen, an dem alle NATO-Staaten und die Anrainerstaaten beteiligt sind,
damit wir über die Unterstützung im Land reden können, damit wir über die Unterstützungsmission der Vereinten Nationen vor Ort reden können. Es bedeutet auch, in Zukunft eine aktive Außenpolitik zu betreiben und sich nicht immer wegzuducken.
Ich wundere mich wirklich sehr – bei allem Respekt –, Frau Bundeskanzlerin, dass Sie hier nach 16 Jahren Amtszeit – 16 Jahre von 20 Jahren! – am Ende sagen: Ich habe ganz viele Fragen. – Auch diese Fragen wurden in diesem Deutschen Bundestag 16 Jahre lang immer wieder diskutiert:
Warum gibt es keinen politischen Prozess? Was passiert, wenn immer nur Aufstandsbekämpfung betrieben wird? Was passiert, wenn eine US-Regierung sich vor allen Dingen auf Terrorismusbekämpfung konzentriert und die Zivilgesellschaft nicht unterstützt wird? Was passiert, wenn die Korruption nicht bekämpft wird? – Wir haben immer wieder gefordert: Wir müssen das evaluieren.
Das haben Sie von der Unionsfraktion immer wieder abgelehnt. Das ist eines der Probleme, weswegen wir heute so dastehen.
Frau Kollegin Baerbock, einen Moment. Sie haben jetzt die gesamte Redezeit Ihrer Fraktion schon weit überschritten, und deswegen bitte ich Sie, zum Ende zu kommen.
Außenpolitik ist immer eine Abwägung zwischen Dilemmas; aber Außenpolitik bedeutet auch, in schwierigen Momenten zu handeln und nicht den Kopf in den Sand zu stecken. Das sind wir nicht nur den Menschenrechten, sondern auch der Sicherheit in unserem Land schuldig.
Herzlichen Dank.
Nächste Rednerin ist die Kollegin Gabriela Heinrich, SPD.
