Ich will aber zur Sache zurückkommen und das Versagen der Aufsichtsbehörden ansprechen. Die Finanzaufsicht – und das ist ein einmaliger Vorgang – hat ein Leerverkaufsverbot für ein einzelnes Unternehmen erlassen. Nun ist es so, dass ich als Linker wahrscheinlich unverdächtig bin, der Finanzaufsicht das Recht abzusprechen, auch Leerverkäufe, also Wetten auf fallende Kurse, zu regulieren. Aber für ein einzelnes Unternehmen aufgrund einer Erpressungsstory, wonach angeblich die Nachrichtenagentur Bloomberg Wirecard erpressen wolle mit kritischer Berichterstattung, mit einem britischen Drogendealer als Kronzeugen? Das ging von der Staatsanwaltschaft in München dann an die BaFin, und die hat das einfach umgesetzt. Das lag eben auch auf dem Tisch des Finanzministeriums.
Genauso ist es richtig, dass es bei der Staatsanwaltschaft grobe Versäumnisse gab. Sie hat Herrn Marsalek rausspazieren lassen, drei Tage, nachdem sie wusste, dass die 1,9 Milliarden Euro weg sind. Aber es ist ein multiples Behörden- und Aufsichtsversagen gewesen. Die Finanzaufsicht hatte genauso wie die Anti-Geldwäsche-Behörde FIU – deren Arbeit haben wir hier seit 2017 bemängelt – eine idiotensichere Handreichung der Commerzbank aus dem Jahre 2019, die in das Herz dieses Skandals zielte. Sie hat diese Ausarbeitung, diese Geldwäscheverdachtsmeldung, anderthalb Jahre nicht an die Strafverfolgung weitergeleitet, nämlich so lange, bis Wirecard insolvent war.
Als wir danach gefragt haben, wurde uns gesagt, das sei damals alles gar nicht erkennbar gewesen. Wir kennen die Unterlagen mittlerweile, und dort stand klipp und klar drin, dass Wirecard extrem auffällige Transaktionen macht, dass es Bezüge zum deutschen Rechtsgebiet gibt, dass man da also eingreifen kann, dass es Zahlungsabwicklung für Onlineglücksspiele gibt, was übrigens bis vor Kurzem in Deutschland außerhalb Schleswig-Holsteins illegal war.
Es gibt leider auch einige andere Dinge, die bei mir immer wieder Kopfschütteln veranlassen. Einer der Fluchthelfer von Herrn Marsalek, ein ehemaliger österreichischer Agent, stand seit 2018 unter Beobachtung deutscher Sicherheitsbehörden wegen Verdachts auf Auslandsspionage, zwei ehemalige deutsche Geheimdienstkoordinatoren waren im Austausch mit Wirecard bzw. Herrn Marsalek, und die deutschen Sicherheitsbehörden haben angeblich noch nie etwas davon gehört. Das glaube ich nach wie vor nicht.
Wir haben große Aufgaben vor uns. Wir müssen die Wirtschaftsprüfung in Deutschland endlich so gestalten, dass wir die Macht der Big Four, der großen vier Prüfungsunternehmen, brechen.
Wir müssen Prüfung und Beratung trennen. Und wir brauchen eben auch die Einbindung mittelständischer Prüfungsunternehmen.
