Vielen Dank. – Frau Präsidentin! Sehr geehrte Damen und Herren! Ja, der Wahlkampf verlagert sich hier in den Deutschen Bundestag. Heute erleben wir das in Form dieses
unsinnigen Antrags der Grünen „Mobilität in ländlichen Räumen verbessern“.
Für die Verbesserung der Mobilität in den ländlichen Räumen sind wir alle. Aber wir haben völlig unterschiedliche Rezepte. Nachdem die Grünen kein Mittel unversucht lassen, dem
Kraftverkehr in den Innenstädten den Garaus zu machen, soll jetzt den Menschen auf dem Land das Auto endgültig madig gemacht und final genommen werden.
– Moment! Moment! – Die Grünen schreiben in ihrem Antrag, die Unzufriedenheit der Menschen über die eigene Abhängigkeit vom motorisierten Individualverkehr sei groß. Also: Die in
ländlichen Regionen lebenden Menschen, die ich kenne, sind sehr glücklich, ein eigenes Auto zu besitzen.
Die Grünen schreiben weiter: Die Notwendigkeit, in der Regel zwei oder mehr Fahrzeuge pro Familie vorhalten zu müssen, sei eine erhebliche finanzielle Belastung. Ja, das ist ja
wohl der absolute Hohn! Die Politik der Grünen ist die Ursache für die finanzielle Belastung der Menschen in den ländlichen Regionen, die Auto fahren.
Es ist doch Ihre Spitzenkandidatin, die permanent Spritpreiserhöhungen fordert, wenn sie nicht gerade ihren Lebenslauf korrigiert.
Die AfD hat einen Sofortvorschlag: die Steuer für Taxis auch auf dem Land zu reduzieren. Das würde den Menschen übrigens helfen und tatsächlich die Kosten reduzieren.
– Ja, haben wir nicht gemacht. Sie haben ja nicht zugestimmt.
