Meine sehr geehrten Damen und Herren! Sehr geehrte Frau Präsidentin! Es ist schon sehr spannend, wie diese Ampelkoalition zueinanderfindet. Man kann ein kleines bisschen Geschichtsvergessenheit beobachten, bei der FDP, wenn sie sagt: Ach, ihr von der Union wart ja 16 Jahre lang in der Regierung. – Wenn wir schauen, dann sehen wir: Ein paar Jahre war die FDP auch mit dabei.
– Es ist schon ein bisschen her; aber Impulse kamen da in dem Bereich auch nicht.
Die SPD sollte vielleicht auch nicht ganz vergessen, dass ein gehöriger Teil dieser 16 Jahre in die Verantwortlichkeit der SPD fällt. Ich glaube, dass das zur Ehrlichkeit und zur Fairness von Politik dazugehört.
Meine sehr geehrten Damen und Herren, ich möchte noch ein kleines bisschen auf die Vorredner eingehen. Wenn Herr Kühn sagt: „Wir werden das besser machen“, – –
– Ich habe aber keine Antworten gefunden. – Wenn Sie sagen, Herr Föst: „Das eint uns“, dann muss ich feststellen, dass ich keinen einzigen gemeinsamen Vorschlag dieser Ampel gefunden habe.
Und wenn man in Ihr Sondierungspapier schaut, dann findet man darin auch sehr wenig zu diesem Bereich. Ich habe es mir ganz genau durchgelesen. Es steht nicht sehr viel zu dem Bereich drin. Ich bin mal gespannt, welche Antworten Sie auf diese wichtige Herausforderung für die Menschen in unserem Land geben.
Es wird sich vor allem zeigen, Herr Kühn, ob die Ideologie oder die Menschen im Vordergrund der Politik der Ampelkoalition stehen werden.
Ganz kurz: Hohe Energiepreise belasten zum einen die Menschen, die Bürgerinnen und Bürger; darüber haben wir gerade gesprochen. Unser bayerischer Ministerpräsident hat einige Vorschläge gemacht – Kai Whittaker hat sie aufgegriffen –, wie man vor allem schnell helfen kann. Das ist vor dem Winter ganz wichtig.
Herr Föst, ich habe in Ihrer Rede gehört, die Nebenkostenabrechnung komme erst im Februar. Es gibt auch Menschen, die selber eine Wohnung haben und vielleicht auch nicht so viel Geld, um es zu bezahlen.
Irgendwie komisch, was die FDP mittlerweile in ihren Reden von sich gibt!
Schnell geht es, wenn man die Mehrwertsteuer senkt, schnell geht es, wenn man die EEG-Umlage abschafft, und schnell geht es, wenn man die Stromsteuer auf ein europäisches Mindestmaß senkt. Ich glaube, hier sind die Vorschläge der Union relativ gut.
– Herr Kühn, die Nummer mit den 16 Jahren können Sie sich sparen.
Machen Sie Vorschläge; dann können wir uns darüber unterhalten. Heute habe ich keinen einzigen konkreten Vorschlag von den Grünen gehört.
Ich bin gespannt darauf, wenn wir vor Weihnachten noch mal ganz konkret über dieses Thema reden.
– Welche denn? Keine konkreten,
