die all die Maßnahmen, deren Wegfall Sie jetzt so lautstark beklagen –
die flächendeckende Schließung von Betrieben, von Schulen, von Hotels –, längst hätten anordnen können,
es aber nicht getan haben. Und selbst, wenn Sie es jetzt erst täten, hätte die Rechtsverordnung immer noch Gültigkeit bis zum 15. Dezember.
Kommen Sie bitte zum Schluss.
Gerne. – Werden Sie also Ihrer Verantwortung als ehemalige Regierungsfraktion gerecht, und hören Sie auf mit dem politisch kleinkarierten Klein-Klein!
Denn wir bringen ein ausgewogenes Gesetz zur Abstimmung, um gemeinsam Corona zu überwinden, und Corona kennt keine Ländergrenzen und keine Parteigrenzen.
Ich bitte um Zustimmung.
Entschuldigung, Sie sind zu schnell heute, Herr Stracke. – Als nächster Redner hat nun das Wort für die CDU/CSU-Fraktion Stephan Stracke.
