Sehr geehrte Frau Präsidentin! Sehr geehrte Damen und Herren! Liebe Kolleginnen und Kollegen! Wir behandeln heute Anträge der AfD-Fraktion. Vieles ändert sich ja in diesem Bundestag in dieser Legislatur. Eines ändert sich aber nicht: Wir lehnen Ihre Anträge ab. Die Anträge sind weder besonders neu noch besonders originell; aber das sind wir letztlich gewohnt. Es handelt sich um eine Ansammlung von Irrtümern, aber auch Fehl- und Falschinformationen. Herr Hilse, ich höre ja genau zu, was Sie sagen. Sie haben vorhin gesagt: Ihnen – also dem Rest des Parlaments – geht es um die Welt, auch wenn Deutschland auf der Strecke bleibt. -
Ich habe einige Minuten über diesen Satz von Ihnen nachgedacht, und Sie sollten vielleicht auch noch mal darüber nachdenken.
Was aber wichtig ist, ist die Frage der Energieversorgung der Zukunft. Das Thema Atomstrom wird unterschiedlich gesehen, unterschiedlich diskutiert, auch auf europäischer und globaler Ebene; das muss man ganz nüchtern konstatieren. Zum einen wollen die deutschen Kraftwerksbetreiber diese Technologie im Moment nicht, und zum anderen ist auch klar: Atomstrom ist eben nicht die günstigste Form der Energieerzeugung. Übrigens gibt es kein Versicherungsunternehmen auf der Welt, das Atomkraftwerke versichert.
Marktwirtschaft sieht also anders aus, sehr geehrte Damen und Herren.
Unter der unionsgeführten Bundesregierung ging der Ausbau der Erneuerbaren massiv voran.
Wir stehen bei annähernd 50 Prozent Erneuerbare im Strombereich. Wir haben das Klimaschutzziel 2020 – 40 Prozent weniger CO2-Ausstoß im Vergleich zu 1990 – als Deutschland erreicht.
