Ich halte es für zentral, dass wir endlich dazu kommen, Ausschusssitzungen öffentlich zu machen. Ich finde, wir müssen das parlamentarische Fragerecht dringend stärken und ausbauen. Ich finde, wir müssen darüber diskutieren, wie wir die Möglichkeit von Großverdienern, durch Parteispenden Einfluss hier auf den Laden zu nehmen, endlich begrenzen können. Das ist eine zentrale Frage für die Glaubwürdigkeit der Politik.
Ich glaube darüber hinaus – das ist jetzt bitter für die FDP –, dass wir endlich Großspenden von Unternehmen verbieten müssen. Denn Politik darf nicht käuflich sein. Da müssen Sie anders an Geld rankommen.
So geht es auf jeden Fall nicht.
Ich will noch einen letzten Punkt ansprechen, über den wir hier wirklich nachdenken müssen. Wenn Sie sich mal die Wahlbeteiligung angucken, kann man erkennen: Es ist eine soziale Frage. Wenn ich mir den Wahlkreis Starnberg angucke, sehe ich, dass wir dort eine Wahlbeteiligung von 80 Prozent haben. Bei mir in Sachsen-Anhalt, im Wahlkreis Anhalt, sind es gerade mal 65 Prozent.
Das heißt also, diejenigen, die das höchste Pro-Kopf-Einkommen haben, nehmen überproportional ihre demokratischen Rechte wahr, und damit haben wir ein Ungleichgewicht in der parlamentarischen Demokratie. Wir müssen darüber nachdenken, wie wir auch für Leute, diese zum Teil 35 Prozent, die nicht mehr an Wahlen teilnehmen, die sich abgemeldet haben, die Parlamente und das Parlamentsgeschehen so attraktiv machen können, dass sie sich angesprochen fühlen.
Last, but not least: Ich glaube, dass wir bei der Kontrolle und der Begrenzung des Lobbyismus jetzt wirklich weiterkommen können, liebe Freunde von der SPD; denn die Halbtagslobbyisten der CDU/CSU sitzen ja – das ist das einzig Erfreuliche für meine Partei, kann man so sagen – jetzt in der Opposition.
Sie sind jetzt kein Hinderungsgrund mehr. Deswegen glaube ich, dass wir für die Vorschläge der FDP, der Grünen und der SPD – die Linke ist immer für große Reformen zu haben –, die ich in der nächsten Woche einbringen werde und die zum Teil wortgleich von den Grünen und der FDP kommen, hier eine übergroße Mehrheit haben werden, und darüber freuen wir uns.
Alles Gute für die weitere Debatte!
