Sehr geehrte Frau Präsidentin! Sehr geehrte Damen und Herren! Glasgow ist ein Blabla; es kommt nichts dabei heraus.
Aber es ist nicht deswegen ein Blabla, weil sich die Staaten und Akteure nicht einigen können, sondern weil die Ziele einfach falsch sind und weil diese falschen Ziele einfach nicht erreicht werden können. Das Klima lässt sich nicht in eine bestimmte Richtung beeinflussen, zumindest nicht mit dem derzeitigen Stand der Technik.
Aber was wir tun können, das ist natürlich, die Widerstandskraft zu verbessern, beispielsweise indem wir Geld dafür ausgeben, dass in der Landwirtschaft andere Pflanzen angebaut werden und all diese Dinge. Im Übrigen sterben die Menschen eher durch Kälte und nicht durch Temperaturerhöhung.
An dieser Stelle sei noch einmal ganz kurz erwähnt, dass Inselstaaten nicht untergehen werden, auch wenn einzelne Inseln oder die Strände im Vorfeld vielleicht untergehen, aber nicht, wie es immer propagiert wird, ganze Inselstaaten; an dieser Stelle bitte ich noch einmal zu überlegen, wie viel Propaganda dort drinsteckt.
Aber: Wir haben es in der Tat mit einer Klimakatastrophe zu tun, nämlich mit einer Klimakatastrophe der Meinungsfreiheit, meine Damen und Herren.
In der Gesellschaft, in den Medien kommen nur Klimahysteriker zu Wort; das Diskussionsklima ist vergiftet. – Wenn ich Sie schon wieder höre, wie Sie hier reinrufen, dann ist das das beste Beispiel, dass man sich nicht vernünftig über die Dinge äußern kann,
sondern einige gleich in einen Schreimodus verfallen.
Das bringt uns nicht weiter, meine Damen und Herren. Wenn Frau Thunberg sagt: „Wir müssen in Panik verfallen“, oder wenn ein Herr Obama sagt, wir müssten weiterhin wütend sein, dann ist das genau der Mechanismus, die Leute aufzustacheln, in Panik zu verfallen. So bekommt man keinen vernünftigen Diskurs, meine Damen und Herren.
Und wenn immer wieder von irgendwelcher Schuld, historischer Schuld von Deutschland gesprochen wird, dann ist auch das wieder nur ein Mechanismus, die Menschen für seine eigenen Ziele zu missbrauchen, meine Damen und Herren.
Was sind denn diese Ziele? Frau Merkel hat es doch gesagt: Es geht um eine umfassende Transformation unseres Lebens, Arbeitens und Wirtschaftens. Herr Schwab vom Weltwirtschaftsforum sagt, dass wir vielleicht bald kein Eigentum mehr haben werden. Das Bundesinnenministerium schreibt, dass Demokratie durch Digitalisierung ersetzt werden kann. Meine Damen und Herren, Marx, Mao und Lenin hätten das nicht besser ausdrücken können.
Aber wir lehnen es ab, den Menschen die Freiheit zu rauben, die Demokratie weiter zu untergraben und den Wohlstand zu vernichten.
Wir werden die westliche, die freiheitliche Art, unser Leben zu gestalten, nicht der Planwirtschaft und auch nicht der Funktionärsgesellschaft opfern, meine Damen und Herren.
