dass Sie pauschal Gastronomieschließungen wollen, dass Sie pauschal Schulschließungen wollen, warum wird das dann nicht von den Ministerpräsidenten in den Bundesländern gemacht, in denen die Lage heute am verheerendsten ist, nämlich in Sachsen und in Bayern?
Lieber Herr Kollege Buschmann, ich kenne Sie ja schon seit Langem, wir schätzen uns auch gegenseitig, und Sie sind auch ein sehr guter Jurist. Deswegen wundert es mich schon ein bisschen, dass Sie ganz offensichtlich Ihren eigenen Gesetzentwurf nicht richtig gelesen haben.
In § 28a Absatz 8 steht nämlich genau das drin, was ich hier referiert habe: Wenn wir keine epidemische Notlage hier im Bundestag feststellen, dann haben die Länder zukünftig die Möglichkeit, in den Parlamenten bestimmte Maßnahmen zu beschließen.
Ausgenommen, und zwar ausdrücklich ausgenommen, ist genau das, was ich gesagt habe.
Es ist ausgeschlossen, dass Restaurants geschlossen werden, es ist ausgeschlossen, dass Veranstaltungen abgesagt werden.
– Dann lesen Sie doch bitte schön Ihren Gesetzentwurf. Genau so ist es.
